"service_request_id","requested_datetime","updated_datetime","closed_date","status_description","source","service_name","description","agency_responsible","address","city","state","zip","lat","long","geocoded_column"
"165427","2018-08-08T09:33:10.000","2019-07-31T13:17:56.000","2019-07-31T13:17:56.000","closed","Other","Biking & Walking","There is a lot of weeds and bushes blocking the sight lines on the north side of the Clear Creek Trail as you are trying to cross Victor Pike tothe next segment of the trail. These tall weeds or bushes extend for 50 feet or more to the southwest along the road. My wife was nearly hit, right in front of me as we crossed the road. Between the bushes and thick trees it is difficult for bikers, walkers and cars to see eachother.","Parks and Recreation",,"Bloomington","IN",,,,
"170277","2019-09-09T15:56:14.000","2019-09-12T07:30:09.000","2019-09-12T07:30:08.000","closed","Web Form","Biking & Walking","There is a bike rack down in front of Yoga Mala at 116 S. College. Multiple people have called the city and it is still not fixed after weeks. We need that bike rack, hopefully it can be fixed asap","Street Department","200-298 S College Ave, Bloomington, Indiana, 47404","Bloomington","IN",,"39.16524124","-86.53505707","POINT (-86.53505707 39.16524124)"
"165441","2018-08-09T13:40:11.000","2019-09-27T16:38:36.000","2019-09-27T16:38:36.000","closed","Other","Biking & Walking","My friends and l rode the Clear Creek Trail, and finished at Tapp Rd, turned left to Weimer Rd where our map said we would find a signed bike route.  I saw a narrow street.  A driver at the corner said there was no bike route on Weimer.  Did l miss some marker?","Planning and Transportation",,"Bloomington","IN",,"39.16992569","-86.53680420","POINT (-86.5368042 39.16992569)"
"165470","2018-08-13T07:56:00.000","2018-08-14T08:39:45.000","2018-08-14T08:39:45.000","closed","Other","Biking & Walking","The pedestrian crosswalk signals at S. Walnut Street and E. Miller Drive do not work. It is impossible to cross at this point without these functioning.","Street Department",,"Bloomington","IN",,,,
"165474","2018-08-13T09:28:46.000","2018-08-14T08:40:56.000","2018-08-14T08:40:56.000","closed","Other","Biking & Walking","Walk sign only partially functional
Location: SW Corner of College Ave and 6th (social cantina)

The walk sign facing across 6th (towards jewelry store) isn't displaying the walk icon with the white bulbs.  The orange bulbs do work and show the stop hand and the countdown when it's time.","Street Department",,"Bloomington","IN",,,,
"165545","2018-08-17T09:57:33.000","2018-10-31T19:47:08.000","2018-10-31T19:47:07.000","closed","Other","Biking & Walking","The West side multi-use path on Rogers Street between Patterson and Rockport, and most notably the section between the Hillside intersection and Cherokee Drive needs cleaned/serviced. It is covered in road debris and gravel/glass and is beginning to be unsafe for biking. I busted a tube and tire on my commute from Cherokee Drive yesterday morning riding over debris. 
Thanks for your help!","Public Works Department",,"Bloomington","IN",,,,
"165553","2018-08-18T15:31:12.000","2018-08-20T09:16:54.000","2018-08-20T09:16:54.000","closed","Other","Biking & Walking","My bike was stolen from my apartment this morning. Bike lock cut. I have the lock in my apartment. 8/18/18. Regency Court Apartments. 500 E Melrose Avenue, Bloomington, IN.","Police Department",,"Bloomington","IN",,,,
"165747","2018-08-30T11:54:30.000","2018-09-05T07:37:15.000","2018-09-05T07:37:14.000","closed","Other","Biking & Walking","Hi,

Please clean the bike lane from College Ave
and the bypass heading south. Also, 446 shoulders from 3rd St
all the way south to Highway 50 could use some
clean up. And Fairfax rd shoulders need some work as well.

Thank you,

Joan Ellis","Street Department",,"Bloomington","IN",,,,
"165820","2018-09-05T17:26:59.000","2019-07-10T11:33:17.000","2019-07-10T11:33:17.000","closed","Other","Biking & Walking","The problem exists at the intersection of E. Arden Dr. and S. High St.  There is a 4 way stop there.  People driving on High St. regularly run this stop sign, even when there is a car on Arden Dr. that has the right of way.  There have been many close calls there.  This is also an intersection where families and children cross High St. on their way to Southeast Park.  Something needs to be done to discourage cars from running the stop sign on High St. before someone gets hurt.","Planning and Transportation","1916 E Arden DR","Bloomington","IN","47401","39.14743042","-86.50830841","POINT (-86.50830841 39.14743042)"
"165833","2018-09-06T17:30:25.000","2019-09-27T17:03:41.000","2019-09-27T17:03:41.000","closed","Other","Biking & Walking","Is there a reason there is NO sidewalk on Indiana Avenue on either side of the street from 15th St. going north to the IU Credit Union property? It is dangerous to walk that stretch of street without a sidewalk available.","Planning and Transportation",,"Bloomington","IN",,,,
"165838","2018-09-07T12:06:46.000","2018-09-07T15:00:44.000","2018-09-07T15:00:44.000","closed","Other","Biking & Walking","There are barricades protecting the bike lane just north of 11th on college, presumably to stop drivers from using it as a right turn lane during construction?? Nice thought but the crane significantly overhangs the barricade. Nvm that the bus stop is hindered.","Planning and Transportation",,"Bloomington","IN",,"39.17350006","-86.53490448","POINT (-86.53490448 39.17350006)"
"165922","2018-09-13T23:09:27.000","2020-10-09T12:15:04.000","2018-10-01T13:03:18.000","closed","Other","Biking & Walking","Please add a flashing light and signage at the crosswalk where the B-Line crosses Rogers to alert drivers to be prepared to stop for pedestrians. It's especially important because the sidewalk on the east side of Rogers is closed, so people entering or exiting the B-Line there need to cross from or to the west side of Rogers. (I.e., we can't walk on the east side and cross Rogers at the stop sign at 11th St.)","Engineering","501 A N Rogers ST","Bloomington","IN","47404","39.17098999","-86.53862762","POINT (-86.53862762 39.17098999)"
"166047","2018-09-26T21:16:34.000","2021-03-08T11:15:49.000","2021-03-08T11:15:49.000","closed","Other","Biking & Walking","East Fourth Street on the east side of Jefferson is blocked by tree limbs. The limbs hang down across Fourth (which at that point is just a pedestrian path) and extend down almost to the surface of the path.","Engineering","200 S Jefferson ST","Bloomington","IN","47408","39.16559982","-86.50717163","POINT (-86.50717163 39.16559982)"
"166066","2018-09-30T12:44:19.000","2018-10-01T08:31:12.000",,"open","Other","Biking & Walking","Good afternoon,

I am unsure if this is the best forum to voice this concern, but hopefully it can be redirected if it is incorrect. I am deeply concerned with the motorized scooters that have appeared around town. I love walking the B-line trail and have always found cyclists to be courteous and respectful of the pedestrians like myself. The motorized scooters have made it stressful and dangerous for cyclists and pedestrians alike. Just as I am not allowed to walk into motorized traffic, I believe any motorized vehicle should be banned from the B-line and public sidewalks. The speed at which they go makes them untennable and unsafe. Futhermore, they do not promote health or fitness as they do not require any effort of engage. My godsons are just now learning to ride their bikes. How can they safely do so with these fast-moving vehicles wisping by them on the few areas they can safely ride? I hope that, like Indiana University, the City of Bloomington swiftly bans these hazardous and irksome motorized vehicles as soon as possible. It will be tragic if the B-line becomes just another noisy road for motorized vehicles. Especially so soon after the bikeshare project was implemented.

With best regards,
Nile Arena","Parks and Recreation",,"Bloomington","IN",,,,
"166111","2018-10-03T21:17:38.000","2018-10-29T12:17:58.000","2018-10-29T12:17:58.000","closed","Other","Biking & Walking","The intersection at tenth and the bypass has a very dangerous intersection for pedestrians and cyclist. On the north east corner the sidewalk does not have an accessible ramp up the curb unless pedestrians walk into oncoming traffic that often does not slow or yield to the pedestrian right of way. I have had many close calls at this intersection and now there is not a sign when crossing to the east. Please correct this before someone is kill or badly injured.","Engineering",,"Bloomington","IN",,,,
"166246","2018-10-17T16:57:25.000","2018-10-29T12:31:16.000","2018-10-29T12:31:16.000","closed","Other","Biking & Walking","NE corner of 17th&dunn.  My kids are into riddle humor so maybe you'll enjoy this one:
Q. What kind of licensed engineer puts a shared path to the right of a dedicated right turn lane where drivers don't even stop for a red light?
A. The kind that ignores the MUTCD.
Hahahahaha that's even funnier than the time my 4yo gave a long set up forthe punchline ""buttcrack"".

But in all seriousness, the SE corner doesn't have a sidewalk connection for east/west peds and there are no painted crosswalks either. The MUTCD, bro, bible or nah?","Engineering",,"Bloomington","IN",,"39.17916107","-86.52805328","POINT (-86.52805328 39.17916107)"
"166250","2018-10-18T06:39:25.000","2018-12-31T12:15:20.000","2018-12-31T12:15:20.000","closed","Other","Biking & Walking","Could you please install a painted crosswalk at 3rd and E Grant? 3rd is very high traffic and as cars come around the corner heading west, it makes for a dangerous crossing for pedestrians who are given no right-of-way.","Engineering",,"Bloomington","IN",,,,
"166264","2018-10-19T15:11:47.000","2018-10-22T09:51:09.000","2018-10-22T09:51:09.000","closed","Other","Biking & Walking","Hello. I reported 165371.  I noticed there were thin paint lines now, almost like precursors to new crosswalk paint?  Will new thicker lines be painted soon?  Thank you!","Street Department",,"Bloomington","IN",,,,
"166442","2018-11-07T16:24:37.000","2018-12-04T07:41:39.000","2018-12-04T07:41:39.000","closed","Other","Biking & Walking","When the car light is green for 10th Street and the pedestrian signal to cross tenth street is a solid hand, the talking box on the beg button says the walk sign is on.

I stood there a few signals and the box starts saying the walk sign is on when the green light is on for both directions.

It's about 4:22, and I took a video if you'd like to see.

This the corner of 10th and Fee.","Street Department",,"Bloomington","IN",,"39.17160416","-86.51902771","POINT (-86.51902771 39.17160416)"
"166443","2018-11-07T16:28:06.000","2018-11-20T10:12:21.000","2018-11-20T10:12:21.000","closed","Other","Biking & Walking","I just submitted the thing about the talking box at 10th and Fee. I told you I have a video, but I didn't give you my contact info. I entered in into the app and it should be connected to this report.","Street Department",,"Bloomington","IN",,"39.17161560","-86.51903534","POINT (-86.51903534 39.1716156)"
"166671","2018-11-29T16:04:17.000","2018-12-03T11:20:35.000","2018-12-03T11:20:35.000","closed","Web Form","Biking & Walking","The bike rack on 6th Street in front of King Dough could use some love. The racks are either missing bolts or they are loose. Could you fix this? Thanks!","Street Department","100-198 W 6th St, Bloomington, Indiana, 47404","Bloomington","IN",,"39.16756439","-86.53402710","POINT (-86.5340271 39.16756439)"
"167027","2019-01-09T13:24:24.000","2020-10-09T12:11:47.000","2019-09-27T17:19:55.000","closed","Web Form","Biking & Walking","Can we please get a barrier like cones to partition the bike lane on third?  This would help bikers feel safer and actually use the lanes and cars from blocking other cars and buses and creating problems by CONSTANTLY parking in a no parking area by slowing down and pulling over.  I get annoyed as a driver but would be even more mad if trying to bike or driving a bus.","Planning and Transportation","400 W 7th ST","Bloomington","IN","47404","39.16880035","-86.53742218","POINT (-86.53742218 39.16880035)"
"167084","2019-01-15T21:46:27.000","2019-01-16T08:28:04.000","2019-01-16T08:28:03.000","closed","Web Form","Biking & Walking","Multiple vehicles parked in bike lane every day","Parking Services","N College Ave, Bloomington, Indiana, 47404","Bloomington","IN",,"39.17514420","-86.53479004","POINT (-86.53479004 39.1751442)"
"167099","2019-01-16T15:41:13.000","2019-01-16T16:09:53.000",,"open","Web Form","Biking & Walking","We just received an email at IU saying that we should be using the sidewalk on 10th st from the bypass to range rd in our kubota and other atv's. This seems completely wrong, and at odds with encouraging biking and walking in an already troubled area. Please advise if there is an official policy on this.","Police Department","2711-2925 E 10th St, Bloomington, Indiana, 47408","Bloomington","IN",,"39.17159271","-86.49897003","POINT (-86.49897003 39.17159271)"
"167152","2019-01-22T11:34:03.000","2020-10-09T12:11:18.000","2019-01-23T09:09:47.000","closed","Web Form","Biking & Walking","My son is a bicycle commuter to North HS. We were thrilled last week that the bypass bike lanes were cleared. However, this morning the path was completely covered. He was disappointed and late for school, of course. We'll use an alternate route tomorrow, but wanted to alert the city to the fact that it appears INDOT tossed the snow onto the path.","Street Department","4509 E Blackstone CT","Bloomington","IN","47408","39.16920853","-86.47318268","POINT (-86.47318268 39.16920853)"
"167200","2019-01-24T16:35:24.000","2019-02-05T07:53:44.000","2019-02-05T07:53:44.000","closed","Other","Biking & Walking","Cars parked in bike lane on west side of college just south of the railroad bridge (approx 12th st). Also, deep snow in same bike lane at intersection w 14th st","Parking Services",,"Bloomington","IN",,"39.17506027","-86.53486633","POINT (-86.53486633 39.17506027)"
"167216","2019-01-26T13:18:12.000","2019-02-05T07:52:17.000","2019-02-05T07:52:17.000","closed","Other","Biking & Walking","Bike lane on west side of college blocked by snow at 14th and by cars at the train bridge south of there.","Parking Services",,"Bloomington","IN",,"39.17576981","-86.53485107","POINT (-86.53485107 39.17576981)"
"167222","2019-01-28T09:59:55.000","2019-01-29T09:58:34.000","2019-01-29T09:58:34.000","closed","Other","Biking & Walking","College ave intersection with 11th. West side of street. North/south ped xing...the ped signal never says ""walk"" unless the beg button is pushed. Pushing the button has no effect for one entire cycle. Effective LOS: F. Why????? A lot of ped signals are like this all over town.","Street Department",,"Bloomington","IN",,"39.17324448","-86.53490448","POINT (-86.53490448 39.17324448)"
"167325","2019-02-06T17:15:02.000","2019-02-08T11:04:31.000","2019-02-08T11:04:31.000","closed","Other","Biking & Walking","On west side of N College just south of train bridge (about 12th st), cars parked in bike lane.  For what it's worth, there is also still (still!) snow in the bike lane at 14th st - it has mwlted enough that it's now passable, but not clear.

Sorry there is no location info...this app is buggy!","Parking Services",,"Bloomington","IN",,,,
"167371","2019-02-08T15:15:08.000","2019-02-13T06:38:52.000","2019-02-13T06:38:51.000","closed","Web Form","Biking & Walking","Bike tunnel at 7th & Bypass needs post-flood cleaning. Drains are mostly blocked.","Street Department","IN-46 W, Bloomington, Indiana, 47408","Bloomington","IN",,"39.16752625","-86.50003052","POINT (-86.50003052 39.16752625)"
"167430","2019-02-12T16:58:27.000","2019-02-14T10:30:53.000","2019-02-14T10:30:53.000","closed","Other","Biking & Walking","Cars parked in bike lane on west side of college just south of train bridge (near 12th st). Still. Traditionally these complaints wind up on the desk of RayeAnn Cox and/or Danna Workman, which has not once resulted in a resolution in the five years I have been submitting this kind of complaint.  Presumably not their fault, but I'm looking for results - you gotta do something different!  Please forward this to someone who can do something about it instead. I have directly communicated with Adam Wason about blanket non-enforcement of cars blocking bike&ped infra, and he said he should be notified personally if non-enforcement continues.  If you cannot figure out what to do about this, please forward it to him.","Parking Services",,"Bloomington","IN",,,,
"167465","2019-02-14T08:50:38.000","2020-10-09T12:09:57.000","2019-08-01T12:22:42.000","closed","Web Form","Biking & Walking","The multi-use path on South Rogers street, specifically between The Warehouse and Cherokee drive, is covered in debris from recent road work / Switchyard Park work trucks. The debris is concerning because it could be hiding glass or other things detrimental to bike tires. Commuters in that area will be grateful if this could be cleaned. Thanks.","Parks and Recreation","1606 S Rogers ST","Bloomington","IN","47403","39.14865112","-86.53915405","POINT (-86.53915405 39.14865112)"
"167773","2019-03-13T10:40:00.000","2019-03-14T09:08:11.000","2019-03-14T09:08:11.000","closed","Web Form","Biking & Walking","Scary to cross 3rd at 3rd and Smith.  Can we get crosswalk repainted there at least? Thank you.","Street Department","3900-4398 E 3rd St, Bloomington, Indiana, 47401","Bloomington","IN",,"39.16410828","-86.48084259","POINT (-86.48084259 39.16410828)"
"167931","2019-04-01T11:55:12.000","2019-04-10T06:42:12.000","2019-04-10T06:42:12.000","closed","Web Form","Biking & Walking","I got a flat tire (bicycle) while riding in the bike lane on Rogers around 10th St. There is a lot of construction there so naturally there's a lot of debris on the road. Could you send a street sweeper vehicle there to clear the bike lanes? Thanks. J","Street Department","630-698 N Rogers St, Bloomington, Indiana, 47404","Bloomington","IN",,"39.17149353","-86.53857422","POINT (-86.53857422 39.17149353)"
"168427","2019-05-06T23:00:46.000","2020-10-09T12:05:51.000","2019-05-30T14:57:27.000","closed","Web Form","Biking & Walking","Hi, W 3rd just before Roselawn cemetary, there is an alley that leads to 4th St. It would be great to have a sign that faces W with a bike on it pointing toward 4th St. It would help bicyclists coming from Patterson addition and the soon-to-be affordable project at Walker, cycle on 4th St to town and IU rather than going the wrong way on 3rd Street. Thanks for this ureport.","Planning and Transportation","317 S Maple ST","Bloomington","IN","47403","39.16374969","-86.54199982","POINT (-86.54199982 39.16374969)"
"168474","2019-05-09T22:25:30.000","2020-10-09T12:05:41.000","2019-05-30T14:49:00.000","closed","Web Form","Biking & Walking","I live on the corner of S Clifton and Hillside Drive, each day I feel I take my life in my own hands as I walk east on Hillside Drive. There is no shoulder between the sidewalk and the street. Cars are speeding by well over the speed limit, liter a few feet from me and potential disaster. I would ask that you look at 1. Lowering the speed limit 2. Mandate a soft shoulder between the sidewalk and street. 3. Place a speed indicator. Anything you can do I feel could reduce the potential for the next accident.","Planning and Transportation","1906 E Hillside DR","Bloomington","IN","47401","39.15046310","-86.50965118","POINT (-86.50965118 39.1504631)"
"168593","2019-05-19T09:58:15.000","2020-07-23T10:46:53.000","2020-07-23T10:46:53.000","closed","Web Form","Biking & Walking","This sewer grate at 6th and College has a hole in it wide enough to swallow a 2 inch wide bike tire.  I believe Bloomington has a standard for storm grates that are bike friendly to avoid this hazard.","Planning and Transportation","122 W 6th St, Bloomington, Indiana, 47404","Bloomington","IN",,"39.16760635","-86.53481293","POINT (-86.53481293 39.16760635)"
"168645","2019-05-23T22:46:54.000","2019-07-11T14:03:16.000","2019-07-11T14:03:16.000","closed","Other","Biking & Walking","B-line lights are out between 6th st and 8th.  About pole #105-111.  Two blocks are uniformly dark.","Parks and Recreation",,"Bloomington","IN",,,,
"168664","2019-05-25T10:04:31.000","2020-10-09T12:04:56.000","2019-05-29T08:44:30.000","closed","Web Form","Biking & Walking","No visible license plate. Permantely parked with cover on it.on city street.","Parking Services","3401 S Cedarwood CIR","Bloomington","IN","47401","39.13016510","-86.50416565","POINT (-86.50416565 39.1301651)"
"168708","2019-05-28T14:12:05.000","2019-05-30T09:22:23.000","2019-05-30T09:22:23.000","closed","Web Form","Biking & Walking","There is a significant amount of gravel in the multi-use path by Performance Refinish Supplies. 

It's a notable hazard because: 

 1. It's at the bottom of the hill where people will already be going fast on a bike. 
 2. There's a fast S-curve at the bottom of the hill, potentially requiring turning in the gravel section
 3. The gravel has almost the same color and texture as the path, making it difficult to see with time to react. 
 4. There's not usually this much gravel here, making the condition unexpected.

It's been a rainy spring and I already know two experienced cyclists who have crashed due to unexpected gravel or mud in turns. I spotted this hazard too late slow fully myself and just tried to keep a straight line riding through it. I nearly rode off the side of the trail, but thankfully avoided losing control.","Street Department","Performance Refinish Supply","Bloomington","IN",,"39.15944672","-86.55529785","POINT (-86.55529785 39.15944672)"
"168721","2019-05-29T19:17:55.000","2019-05-31T11:08:53.000","2019-05-31T11:08:53.000","closed","Web Form","Biking & Walking","The yellow flashing lights for pedestrians and bicyclists to use at Allen St. crossing Walnut are not working on the west side.","Street Department","101-299 W Allen St, Bloomington, Indiana, 47403","Bloomington","IN",,"39.15559006","-86.53381348","POINT (-86.53381348 39.15559006)"
"168724","2019-05-30T13:42:23.000","2019-07-25T07:09:56.000","2019-07-25T07:09:56.000","closed","Web Form","Biking & Walking","On Southdowns just west of the intersection with Jordan Ave, the biking and walking path is being overrun with dirt and brush. The pavement and part of the bicycle painted decal is being covered in dirt now. This needs to be cleaned up.","Street Department","1321-1399 E Southdowns Dr, Bloomington, Indiana, 47401","Bloomington","IN",,"39.15523529","-86.51531982","POINT (-86.51531982 39.15523529)"
"168732","2019-05-30T17:37:00.000","2019-08-05T07:13:06.000","2019-08-05T07:13:06.000","closed","Web Form","Biking & Walking","There is an overgrown bush obstructing the side path along Tapp Road west of Rogers.","Parks and Recreation","601-999 W Country Club Dr, Bloomington, Indiana, 47403","Bloomington","IN",,"39.13610458","-86.53998566","POINT (-86.53998566 39.13610458)"
"168733","2019-05-30T17:39:11.000","2020-10-09T12:04:40.000","2019-07-15T15:36:01.000","closed","Web Form","Biking & Walking","The bushes are overgrown into the trail in the parking lot at the Rail Trail / B-Line on Country Club. The branches are hanging over the sidewalk/path along the front of the parking lot making it tough to get through.","Parks and Recreation","301 W Country Club DR","Bloomington","IN","47403","39.13589096","-86.53507996","POINT (-86.53507996 39.13589096)"
"168738","2019-05-30T20:34:32.000","2020-10-09T12:04:39.000","2019-05-31T10:15:08.000","closed","Web Form","Biking & Walking","Difficult to cross with bike from bike path that goes through underpass through green acres to campus at Union Street at times.  Please have a safe bike signal or something to cross Union to campus and back.","Planning and Transportation","501 N Morton ST","Bloomington","IN","47404","39.17030334","-86.53694916","POINT (-86.53694916 39.17030334)"
"168749","2019-05-31T17:57:27.000","2020-10-09T12:04:37.000","2019-07-25T14:56:47.000","closed","Web Form","Biking & Walking","Debris in West side bike lane of n Smith","Street Department","501 N Morton ST","Bloomington","IN","47404","39.17030334","-86.53694916","POINT (-86.53694916 39.17030334)"
"168958","2019-06-14T14:05:36.000","2019-06-14T15:16:52.000","2019-06-14T15:16:52.000","closed","Web Form","Biking & Walking","Potholes and general surface area of brick crosswalk is in disrepair, with uneven surface area.  The concrete surrounding the brick is falling apart, creating hazards for walkers, bicyclists, runners, etc. Restructuring & re-surfacing needed.","Street Department","Earth","Bloomington","IN",,"0.00209212","-0.00171661","POINT (-0.00171661 0.00209212)"
"169049","2019-06-20T08:57:41.000","2019-08-12T14:46:54.000","2019-08-12T14:46:54.000","closed","Web Form","Biking & Walking","Bushes are overtaking the sidewalk on the NE corner of High street, just above the Rogers/Winslow roundabout. This makes walking or biking along the sidewalk to get to the Jackson Creek Trail somewhat dangerous, as the overgrowth pushes you out towards High Street. Cars are coming out the round about and accelerating, in this area, and sure seems real dangerous for smaller kids trying to navigate the narrow strip of sidewalk with speeding cars so close.","Street Department","E Rogers Rd, Bloomington, Indiana, 47401","Bloomington","IN",,"39.13653183","-86.50792694","POINT (-86.50792694 39.13653183)"
