"dataset_link","u_id","public","derived_view","parent_uid","domain","type","name","description","visits","creation_date","last_update_date_data","category","keywords","downloads","owner","contactemail","license","publication_stage","published_version_name","published_version_uid","data_provided_by","capabilities","definitionexpression","maxscale","htmlpopuptype","copyrighttext","geometrytype","hasattachments","publishing_department","routing_approval","api_endpoint","defaultvisibility","id","spatial_reference_wkid","source","displayfield","minscale","currentversion","source_link","owner_uid","moderation_status","provenance","color"
"https://data.cityofgainesville.org/d/3q6u-qdrm","3q6u-qdrm","false","false",,"data.cityofgainesville.org","dataset","Citizen Engagement","Event schedule & results of citizen engagement and outreach efforts from City of Gainesville staff.","80","2016-05-19T13:29:00.000Z","2017-03-07T19:46:00.000Z","Community Model","citizen,engagement,outreach,input","84","City of Gainesville","dg_strategic_planning@cityofgainesville.org","Public Domain","published",,,"Office of Strategic Planning",,,,,,,,,,"https://data.cityofgainesville.org/resource/3q6u-qdrm.json",,,,,,,,,"vsei-5zu2",,"official",
"https://data.cityofgainesville.org/d/sadt-pjvr","sadt-pjvr","false","false",,"data.cityofgainesville.org","gis map","Zoning Districts","Zoning districts for the city of Gainesville","128","2016-05-10T13:45:00.000Z","2016-05-10T13:45:00.000Z","Community Model","zoning,land use,districts,building","108","City of Gainesville","dg_strategic_planning@cityofgainesville.org","Public Domain","published",,,"Planning and Development Services",,,,,,,,,,"https://data.cityofgainesville.org/resource/sadt-pjvr.json",,,,,,,,"http://www.cityofgainesville.org/GOVERNMENT/CityDepartmentsNZ/PlanningDepartment/DataDownloads/tabid/257/Default.aspx","vsei-5zu2",,"official",
"https://data.cityofgainesville.org/d/srdr-4gis","srdr-4gis","false","true","vs8t-njwg","data.cityofgainesville.org","chart","Tax Revenue to Zip Code View","Selected 2012 attributes from the Alachua County Property Appraisers CAMA (Computer Aided Mass Appraisal) tables. The CAMA tables compiled for the final tax roll include real property, history, entity, entity property, building use and code01.","4","2016-05-26T21:27:00.000Z","2015-10-12T18:29:00.000Z","Charts & Graphs","tax,tax roll,property,values,property values","0","Bradyjf","","Public Domain","published",,,"Alachua County Property Appraiser",,,,,,,,,,"https://data.cityofgainesville.org/resource/srdr-4gis.json",,,,,,,,"http://www.acpafl.org","6mhm-y9r2",,"official",
"https://data.cityofgainesville.org/d/78uv-94ar","78uv-94ar","true","false",,"data.cityofgainesville.org","dataset","311 Service Requests (myGNV)","Non-emergency requests like pothole repairs or damaged street signs can be reported through the myGNV app or online (www.mygnv.org)","2864","2016-04-26T16:29:00.000Z","2020-10-20T21:24:00.000Z","Public Administration & Finance","311,request,citizen,repair,non-emergency,reports","459","City of Gainesville","dg_strategic_planning@cityofgainesville.org","Public Domain","published",,,"City of Gainesville - Administrative Services",,,,,,,,,,"https://data.cityofgainesville.org/resource/78uv-94ar.json",,,,,,,,"http://www.cityofgainesville.org/openGNV/311GNV.aspx","vwbq-myrr",,"official",
"https://data.cityofgainesville.org/d/ae3p-7c3v","ae3p-7c3v","true","false",,"data.cityofgainesville.org","dataset","Asset Inventory","This dataset is an inventory of the assets on the site. Here you can track the performance of data publishing, metadata maintenance, as well as present an overview of what data exists on the site.

Note: This is only updated once per day.","113","2016-03-25T23:35:00.000Z","2020-11-12T06:03:00.000Z",,,"101","Socrata","",,"published",,,,,,,,,,,"Other",,"https://data.cityofgainesville.org/resource/ae3p-7c3v.json",,,,,,,,,"yr49-udwp",,"official",
"https://data.cityofgainesville.org/d/jekm-cpx5","jekm-cpx5","true","true","qexd-f9us","data.cityofgainesville.org","filter","ASD Budget to Actual FY2016","General Government budget to actual expenses for all funds for FY2011 to FY2016 (10/1/2010 through 11/30/2015). *Note: FY2015 & FY2016 is pre-audited data.","192","2016-02-19T15:57:00.000Z","2020-10-05T20:58:00.000Z","Public Administration & Finance",,"122","City of Gainesville","dg_strategic_planning@cityofgainesville.org","Public Domain","published",,,"Budget & Finance",,,,,,,,,,"https://data.cityofgainesville.org/resource/jekm-cpx5.json",,,,,,,,,"8nv7-fk55",,"official",
"https://data.cityofgainesville.org/d/h4zs-rw6n","h4zs-rw6n","true","false",,"data.cityofgainesville.org","gis map","LED Street Lights","LED street lights that are installed and maintained by Public Works. This is not a comprehensive list of all Public Works street lights and is currently missing the lights in Innovation Square and on Depot Avenue.","135","2016-02-15T13:05:00.000Z","2016-02-15T13:05:00.000Z","Geospatial (Maps)","street,lights,led,public works","68","City of Gainesville","dg_strategic_planning@cityofgainesville.org","Public Domain","published",,,"City of Gainesville - Public Works Department",,,,,,,,,,"https://data.cityofgainesville.org/resource/h4zs-rw6n.json",,,,,,,,,"vsei-5zu2",,"official",
"https://data.cityofgainesville.org/view/5yty-85vf","5yty-85vf","true","true","78uv-94ar","data.cityofgainesville.org","datalens","311 Service Requests","Non-emergency requests like pothole repairs or code enforcement questions can be reported through the 311GNV app (https://play.google.com/store/apps/details?id=com.seeclickfix.gnv311.app&hl=en) or online (http://www.cityofgainesville.org/openGNV/311GNV.aspx).","932","2016-05-03T20:10:00.000Z","2020-10-20T21:24:00.000Z","Public Administration & Finance",,"6","City of Gainesville","","Public Domain","published",,,"City of Gainesville - Administrative Services",,,,,,,,,,"https://data.cityofgainesville.org/resource/5yty-85vf.json",,,,,,,,"http://www.cityofgainesville.org/openGNV/311GNV.aspx","vsei-5zu2",,"official",
"https://data.cityofgainesville.org/d/3tbq-fp85","3tbq-fp85","true","false",,"data.cityofgainesville.org","file","GREC Billing: 2016","A rolling summary of bills, adjustments, and payments related to GREC for 2016.","276","2016-01-08T13:58:00.000Z","2016-01-08T13:58:00.000Z","Public Administration & Finance","grec,gru","290","City of Gainesville",,"Public Domain","published",,,"GRU",,,,,,,,,,"https://data.cityofgainesville.org/resource/3tbq-fp85.json",,,,,,,,,"8nv7-fk55",,"official",
"https://data.cityofgainesville.org/d/rbhn-wszk","rbhn-wszk","false","true","gk3k-9435","data.cityofgainesville.org","filter","7I","Customer electric consumption, by address, by month, January 2012 to present","10","2016-06-03T01:20:00.000Z","2020-10-19T18:02:00.000Z","Better Future","kwh,kilowatt,gru,electric,consumption","0","UFL",,"Public Domain","published",,,"GRU",,,,,,,,,,"https://data.cityofgainesville.org/resource/rbhn-wszk.json",,,,,,,,,"iaki-sdnb",,"community",
"https://data.cityofgainesville.org/view/dgaw-m4gh","dgaw-m4gh","false","true","hk2b-em59","data.cityofgainesville.org","datalens","Enterprise Zone Test 1","","8","2016-01-22T00:14:00.000Z","2020-10-21T17:32:00.000Z","Economic Development & Redevelopment",,"0","Charlotte West",,"Public Domain","published",,,,,,,,,,,,,"https://data.cityofgainesville.org/resource/dgaw-m4gh.json",,,,,,,,,"hcmc-89ic",,"official",
"https://data.cityofgainesville.org/view/prjq-jwkk","prjq-jwkk","true","true","qexd-f9us","data.cityofgainesville.org","datalens","Budget - Expenses","<div>General Government expense budget for all funds for FY2011 to FY2016 YTD (10/1/2010 through 5/30/2016). *Note: FY2016 is pre-audited data.<br></div>","622","2015-12-22T21:50:00.000Z","2020-10-05T20:58:00.000Z","Public Administration & Finance",,"10","City of Gainesville","","Public Domain","published",,,"Budget & Finance",,,,,,,,,,"https://data.cityofgainesville.org/resource/prjq-jwkk.json",,,,,,,,,"8nv7-fk55",,"official",
"https://data.cityofgainesville.org/d/nqj4-sidx","nqj4-sidx","false","false",,"data.cityofgainesville.org","gis map","Enterprise Zone Parcels","This dataset shows the parcels that lie within Enterprise Zone boundaries. Enterprise Zones are geographic areas that have been identified for economic revitalization and allow for tax incentives. This can be used in conjunction with the dataset called Enterprise Zones.","82","2015-11-16T20:29:00.000Z","2015-11-16T20:29:00.000Z","Geospatial (Maps)","enterprise,zones,parcels,revitalization,tax,incentives,area,program,economic","72","Jeremy Griffith","dg_strategic_planning@cityofgainesville.org","Public Domain","published",,,"City of Gainesville Planning and Development Services",,,,,,,,,,"https://data.cityofgainesville.org/resource/nqj4-sidx.json",,,,,,,,,"u832-bgea",,"official",
"https://data.cityofgainesville.org/d/an5f-xg99","an5f-xg99","false","false",,"data.cityofgainesville.org","gis map","Enterprise Zones","This dataset represents the Gainesville Enterprise Zone boundaries. An Enterprise Zone is a specific geographic area that has been targeted for economic revitalization. The Florida Enterprise Zone Program provides tax incentives to businesses that choose to start businesses within an enterprise zone. Tax incentives can include but are not limited to a sales and use tax credit, tax refund for business machinery and equipment used in an enterprise zone, sales tax refund for building materials used in an Enterprise Zone, and a sales tax exemption for electrical energy used in an enterprise zone.","124","2015-11-16T20:18:00.000Z","2015-11-16T20:18:00.000Z","Strong Economy","enterprise,zone,revitalization,tax,boundary,business,program,economic,incentive","61","City of Gainesville","dg_strategic_planning@cityofgainesville.org","Public Domain","published",,,"City of Gainesville Planning and Development Services",,,,,,,,,,"https://data.cityofgainesville.org/resource/an5f-xg99.json",,,,,,,,"http://www.enterpriseflorida.com/why-florida/business-climate/incentives/enterprise-zone-incentives/","vsei-5zu2",,"official",
"https://data.cityofgainesville.org/view/yhrq-n393","yhrq-n393","true","true","bn44-jxhy","data.cityofgainesville.org","datalens","GRU Customer Potable Water Consumption","Explore the potable water consumption of Gainesville Regional Utilities customers.","574","2015-11-05T16:54:00.000Z","2020-10-19T19:05:00.000Z","Utilities",,"4","City of Gainesville","","Public Domain","published",,,,,,,,,,,,,"https://data.cityofgainesville.org/resource/yhrq-n393.json",,,,,,,,,"vsei-5zu2",,"official",
"https://data.cityofgainesville.org/d/45fu-kbfb","45fu-kbfb","false","true","gk3k-9435","data.cityofgainesville.org","filter","GRU Customer Consumption and Count by Month","Customer electric consumption, by address, by month, January 2012 to present","1","2015-10-19T18:22:00.000Z","2020-10-19T18:02:00.000Z","Better Future","kwh,kilowatt,gru,electric,consumption","0","Dhenry",,"Public Domain","published",,,"GRU",,,,,,,,,,"https://data.cityofgainesville.org/resource/45fu-kbfb.json",,,,,,,,,"ufgr-r96r",,"community",
"https://data.cityofgainesville.org/view/xutq-4hbr","xutq-4hbr","true","true","kucw-mdg4","data.cityofgainesville.org","datalens","Housing Assistance and Counseling Programs","Assistance and counseling programs provided to local citizens by the Housing and Community Development department.","649","2015-10-01T18:25:00.000Z","2015-10-14T11:34:00.000Z","Public Administration & Finance",,"11","City of Gainesville","","Public Domain","published",,,,,,,,,,,,,"https://data.cityofgainesville.org/resource/xutq-4hbr.json",,,,,,,,,"vsei-5zu2",,"official",
"https://data.cityofgainesville.org/view/35t6-pydw","35t6-pydw","false","true","ckui-5s9f","data.cityofgainesville.org","datalens","Tax Roll - 2014","The tax roll for 2014 comprises several CAMA tables (Computer Aided Mass Appraisal) including those for tax history of the property, details of the real property, several codes tables to describe the codes, tables describing the owner of the property as well as the physical address of the property.","397","2015-10-13T20:53:00.000Z","2015-10-13T22:05:00.000Z","Community Model",,"4","City of Gainesville","","Public Domain","published",,,"Alachua County Property Appraiser",,,,,,,,,,"https://data.cityofgainesville.org/resource/35t6-pydw.json",,,,,,,,"http://acpafl.org","vsei-5zu2",,"official",
"https://data.cityofgainesville.org/view/8ccn-fa9d","8ccn-fa9d","true","true","8w96-fars","data.cityofgainesville.org","datalens","Annexation Activity","<div>Annexation is when unincorporated property becomes incorporated into the city. This is a data lens that explores the Annexation Activity data set by providing several visualizations. The data set contains annexation activity beginning in 1985 to present.&nbsp;<br></div>","576","2015-09-30T21:34:00.000Z","2015-10-14T11:44:00.000Z","Public Administration & Finance",,"13","City of Gainesville","","Public Domain","published",,,,,,,,,,,,,"https://data.cityofgainesville.org/resource/8ccn-fa9d.json",,,,,,,,,"vsei-5zu2",,"official",
"https://data.cityofgainesville.org/view/wq5m-pqvz","wq5m-pqvz","true","true","q5em-yenm","data.cityofgainesville.org","datalens","Community Grant Program","<div>Local organizations receiving assistance from the Community Grant Program for FYs 2011-2013 (October 2010 through September 2013).<br></div>","647","2015-09-30T21:06:00.000Z","2014-05-15T14:30:00.000Z","Public Administration & Finance",,"14","City of Gainesville","","Public Domain","published",,,"Housing & Community Development",,,,,,,,,,"https://data.cityofgainesville.org/resource/wq5m-pqvz.json",,,,,,,,,"vsei-5zu2",,"official",
"https://data.cityofgainesville.org/view/5hfd-umxz","5hfd-umxz","true","true","3wub-njz5","data.cityofgainesville.org","datalens","Adult Recreational Sports","Athletic fields, softball, and tennis data since October 2012.","629","2015-09-30T20:59:00.000Z","2014-12-08T21:02:00.000Z","Public Administration & Finance",,"15","City of Gainesville","","Public Domain","published",,,"Parks, Recreation & Cultural Affairs",,,,,,,,,,"https://data.cityofgainesville.org/resource/5hfd-umxz.json",,,,,,,,,"vsei-5zu2",,"official",
"https://data.cityofgainesville.org/d/ckui-5s9f","ckui-5s9f","false","false",,"data.cityofgainesville.org","dataset","Tax Roll - 2014","The tax roll for 2014 comprises several CAMA tables (Computer Aided Mass Appraisal) including those for tax history of the property, details of the real property, several codes tables to describe the codes, tables describing the owner of the property as well as the physical address of the property.","1016","2015-10-13T13:22:00.000Z","2015-10-13T22:05:00.000Z","Community Model","tax,appraisal,property,buildings","112","City of Gainesville","dg_strategic_planning@cityofgainesville.org","Public Domain","published",,,"Alachua County Property Appraiser",,,,,,,,,,"https://data.cityofgainesville.org/resource/ckui-5s9f.json",,,,,,,,"http://acpafl.org","vsei-5zu2",,"official",
"https://data.cityofgainesville.org/view/gg4w-heg7","gg4w-heg7","false","true","9n26-8sbn","data.cityofgainesville.org","datalens","City Facilities","This is a list of the facilities owned by the City of Gainesville. It includes the location, year built, square footage and type along with other useful information for each building. Some records have been omitted as a security precaution.","388","2015-09-30T20:52:00.000Z","2019-08-15T15:18:00.000Z","Community Model",,"6","City of Gainesville","","Public Domain","published",,,"Facilities Management",,,,,,,,,,"https://data.cityofgainesville.org/resource/gg4w-heg7.json",,,,,,,,,"vsei-5zu2",,"official",
"https://data.cityofgainesville.org/view/nqh6-2268","nqh6-2268","false","true","49eb-8bq9","data.cityofgainesville.org","datalens","Senior Recreation Center","Senior Recreation Center facility usage for programs and events, including counts of participation and attendance since FY2013 (October 2012).","564","2015-09-30T20:46:00.000Z","2019-11-26T15:52:00.000Z","Public Administration & Finance",,"16","City of Gainesville","","Public Domain","published",,,"Parks, Recreation & Cultural Affairs",,,,,,,,,,"https://data.cityofgainesville.org/resource/nqh6-2268.json",,,,,,,,,"vsei-5zu2",,"official",
"https://data.cityofgainesville.org/view/nwgn-vc6i","nwgn-vc6i","false","true","mzff-betx","data.cityofgainesville.org","datalens","Recreation Centers, Pools & Parks","Attendance numbers and revenue generated for the MLK Center, Senior Recreation Center, other public recreation centers, pools, and parks since FY2013.","420","2015-09-30T19:37:00.000Z","2019-09-19T17:38:00.000Z","Public Administration & Finance",,"16","City of Gainesville","","Public Domain","published",,,"Parks, Recreation & Cultural Affairs",,,,,,,,,,"https://data.cityofgainesville.org/resource/nwgn-vc6i.json",,,,,,,,,"vsei-5zu2",,"official",
"https://data.cityofgainesville.org/view/6xk4-bexd","6xk4-bexd","false","true","69nq-c5ma","data.cityofgainesville.org","datalens","Cultural Affairs","Thomas Center usage, Free Friday Concerts and Downtown Plaza events attendance, and other Cultural Affairs special events data since FY2013.","569","2015-09-30T20:39:00.000Z","2014-08-13T16:47:00.000Z","Public Administration & Finance",,"15","City of Gainesville","","Public Domain","published",,,"Parks, Recreation & Cultural Affairs",,,,,,,,,,"https://data.cityofgainesville.org/resource/6xk4-bexd.json",,,,,,,,,"vsei-5zu2",,"official",
"https://data.cityofgainesville.org/view/d6iz-5ubc","d6iz-5ubc","false","true","7qfa-ytkc","data.cityofgainesville.org","datalens","Youth Recreational Programs & Sports","Youth programming and sports participation and event attendance data since FY2013.","518","2015-09-30T19:08:00.000Z","2019-09-18T15:59:00.000Z","Public Administration & Finance",,"12","City of Gainesville","","Public Domain","published",,,"Parks, Recreation & Cultural Affairs",,,,,,,,,,"https://data.cityofgainesville.org/resource/d6iz-5ubc.json",,,,,,,,,"vsei-5zu2",,"official",
"https://data.cityofgainesville.org/view/933d-t4d9","933d-t4d9","true","true","59qg-knpf","data.cityofgainesville.org","datalens","WSPP Projects & Expenditures","Revenues and Expenditures for Wild Spaces, Public Places, projects funded by a 2-year voter approved 1/2 cent sales tax county wide, with all municipalities receiving a share.","494","2015-09-30T19:05:00.000Z","2013-11-12T18:59:00.000Z","Public Administration & Finance",,"18","City of Gainesville","","Public Domain","published",,,"Alachua County",,,,,,,,,,"https://data.cityofgainesville.org/resource/933d-t4d9.json",,,,,,,,,"vsei-5zu2",,"official",
"https://data.cityofgainesville.org/view/4iqt-nabu","4iqt-nabu","false","true","x3sz-gqmp","data.cityofgainesville.org","datalens","Landlord Permits","Landlord permits for 2013 - 2014.","595","2015-09-29T20:35:00.000Z","2020-10-19T19:10:00.000Z","Strong Economy",,"8","City of Gainesville","","Public Domain","published",,,,,,,,,,,,,"https://data.cityofgainesville.org/resource/4iqt-nabu.json",,,,,,,,,"vsei-5zu2",,"official",
"https://data.cityofgainesville.org/d/h6ys-nmix","h6ys-nmix","false","true","cj3f-mn5t","data.cityofgainesville.org","filter","FY 2015-Expenditures","General Government expenditures to vendors by ETF, check, and/or credit card, excluding payroll, for all funds for FY2011 to FY2015 (10/1/2010 through 6/30/2015). *Note: FY2014 & FY2015 is pre-audited data.","6","2015-10-22T17:33:00.000Z","2020-10-05T21:00:00.000Z","Community Model","checkbook,finance,financial,expenditures","0","Sylvia Warren",,"Public Domain","published",,,"Budget & Finance",,,,,,,,,,"https://data.cityofgainesville.org/resource/h6ys-nmix.json",,,,,,,,,"yg9m-d5hb",,"community",
"https://data.cityofgainesville.org/view/amv7-bkwz","amv7-bkwz","false","true","vs8t-njwg","data.cityofgainesville.org","datalens","Tax Roll - 2012","<div>Selected attributes from 2012 CAMA (Computer Aided Mass Appraisal) tables provided by the Alachua County Property Appraiser.&nbsp;<br></div>","414","2015-09-29T19:25:00.000Z","2015-10-12T18:29:00.000Z","Community Model",,"8","City of Gainesville","","Public Domain","published",,,"Alachua County Property Appraiser",,,,,,,,,,"https://data.cityofgainesville.org/resource/amv7-bkwz.json",,,,,,,,"http://www.acpafl.org","vsei-5zu2",,"official",
"https://data.cityofgainesville.org/view/exp2-h8n7","exp2-h8n7","true","true","khkv-62wd","data.cityofgainesville.org","datalens","GRU Customer Reclaimed Water Consumption","<div>Monthly reclaimed water consumption in kilogallons (kgals) by service address, all cusomters in the GRU service area - this is reclaimed water use (potable water can be find in another dataset), also knwon as sewer or wastewater<br></div>","568","2015-09-29T18:38:00.000Z","2020-10-19T18:58:00.000Z","Public Administration & Finance",,"14","City of Gainesville","","Public Domain","published",,,"GRU",,,,,,,,,,"https://data.cityofgainesville.org/resource/exp2-h8n7.json",,,,,,,,,"vsei-5zu2",,"official",
"https://data.cityofgainesville.org/view/3yya-5x38","3yya-5x38","true","true","p798-x3nx","data.cityofgainesville.org","datalens","Building Permits","Building permits issued and closed for all permit types.","659","2015-09-29T15:29:00.000Z","2020-09-23T20:30:00.000Z","Building & Development",,"14","City of Gainesville","","Public Domain","published",,,"City of Gainesville Building Inspections Department",,,,,,,,,,"https://data.cityofgainesville.org/resource/3yya-5x38.json",,,,,,,,,"vsei-5zu2",,"official",
"https://data.cityofgainesville.org/d/kucw-mdg4","kucw-mdg4","true","false",,"data.cityofgainesville.org","dataset","Housing Assistance and Counseling Programs","Assistance and counseling programs provided to local citizens by the Housing and Community Development department.","464","2015-09-30T18:28:00.000Z","2015-10-14T11:34:00.000Z","Building & Development","housing,assistance,counseling,development,programs,business,economic","191","City of Gainesville","dg_strategic_planning@cityofgainesville.org","Public Domain","published",,,,,,,,,,,,,"https://data.cityofgainesville.org/resource/kucw-mdg4.json",,,,,,,,,"vsei-5zu2",,"official",
"https://data.cityofgainesville.org/d/8ycn-vzvn","8ycn-vzvn","false","false",,"data.cityofgainesville.org","dataset","Gainesville Fire Preliminary TRIM 07-21-15","fire assessment trim roll, amount to be charged to each building/property","12","2015-08-24T16:55:00.000Z","2015-08-24T16:56:00.000Z","Governance","fire assessment","0","Becky Rountree","rountreebl@cityofgainesville.org","Public Domain","published",,,"GSG",,,,,,,,,,"https://data.cityofgainesville.org/resource/8ycn-vzvn.json",,,,,,,,,"rrw7-nu8y",,"official",
"https://data.cityofgainesville.org/d/mp5x-f7kw","mp5x-f7kw","false","true","8ycn-vzvn","data.cityofgainesville.org","filter","fire assessment by parcel and hazard class","fire assessment trim roll, amount to be charged to each building/property","3","2015-08-24T17:09:00.000Z","2015-08-24T16:56:00.000Z","Governance","fire assessment","1","Becky Rountree","rountreebl@cityofgainesville.org","Public Domain","published",,,"GSG",,,,,,,,,,"https://data.cityofgainesville.org/resource/mp5x-f7kw.json",,,,,,,,,"rrw7-nu8y",,"official",
"https://data.cityofgainesville.org/d/22hr-mhzr","22hr-mhzr","false","false",,"data.cityofgainesville.org","dataset","Gainesville Fire Preliminary TRIM 07-21-15",,"1","2015-08-24T17:07:00.000Z","2015-08-24T17:08:00.000Z",,,"0","Becky Rountree",,,"unpublished",,,,,,,,,,,,,"https://data.cityofgainesville.org/resource/22hr-mhzr.json",,,,,,,,,"rrw7-nu8y",,"official",
"https://data.cityofgainesville.org/view/nwnj-pxzf","nwnj-pxzf","false","true","gk3k-9435","data.cityofgainesville.org","datalens","GRU Customer Electric Consumption","<div>Customer electric consumption, by address, by month, January 2012 to present.<br></div>","1542","2015-04-06T21:23:00.000Z","2020-10-19T18:02:00.000Z","Better Future",,"4","Clare Zimmerman","","Public Domain","published",,,"GRU",,,,,,,,,,"https://data.cityofgainesville.org/resource/nwnj-pxzf.json",,,,,,,,,"rqdg-xj2v",,"official",
"https://data.cityofgainesville.org/d/99rv-xbsy","99rv-xbsy","true","true","cj3f-mn5t","data.cityofgainesville.org","filter","SBD Expenditure Roll-up 2014","General Government expenditures to vendors by ETF, check, and/or credit card, excluding payroll, for all funds for FY2011 to FY2015 (10/1/2010 through 6/30/2015). *Note: FY2014 & FY2015 is pre-audited data.","148","2015-08-24T13:00:00.000Z","2020-10-05T21:00:00.000Z","Public Administration & Finance","checkbook,finance,financial,expenditures","80","Becky Rountree","","Public Domain","published",,,"Budget & Finance",,,,,,,,,,"https://data.cityofgainesville.org/resource/99rv-xbsy.json",,,,,,,,,"rrw7-nu8y",,"official",
"https://data.cityofgainesville.org/d/bm6h-xwyq","bm6h-xwyq","true","true","cj3f-mn5t","data.cityofgainesville.org","filter","SBD Expenditures","General Government expenditures to vendors by ETF, check, and/or credit card, excluding payroll, for all funds for FY2011 to FY2015 (10/1/2010 through 6/30/2015). *Note: FY2014 & FY2015 is pre-audited data.","1122","2015-08-24T12:58:00.000Z","2020-10-05T21:00:00.000Z","Public Administration & Finance","checkbook,finance,financial,expenditures","100","Becky Rountree","","Public Domain","published",,,"Budget & Finance",,,,,,,,,,"https://data.cityofgainesville.org/resource/bm6h-xwyq.json",,,,,,,,,"rrw7-nu8y",,"official",
"https://data.cityofgainesville.org/view/bidm-spyh","bidm-spyh","false","true","6k9q-8e9a","data.cityofgainesville.org","datalens","TEST SBD Data","","3","2015-08-20T15:33:00.000Z","2015-08-20T15:29:00.000Z",,,"0","City of Gainesville",,"Public Domain","published",,,,,,,,,,,,,"https://data.cityofgainesville.org/resource/bidm-spyh.json",,,,,,,,,"8nv7-fk55",,"official",
