"dataset_link","u_id","public","derived_view","parent_uid","domain","type","name","description","visits","creation_date","last_update_date_data","category","keywords","downloads","owner","contactemail","license","publication_stage","published_version_name","published_version_uid","data_provided_by","capabilities","definitionexpression","maxscale","htmlpopuptype","copyrighttext","geometrytype","hasattachments","publishing_department","routing_approval","api_endpoint","defaultvisibility","id","spatial_reference_wkid","source","displayfield","minscale","currentversion","source_link","owner_uid","moderation_status","provenance","color"
"https://data.cityofgainesville.org/d/agkx-2fc8","agkx-2fc8","true","true","hk2b-em59","data.cityofgainesville.org","filter","Only Active Apartments","Businesses licensed to operate in the City of Gainesville.","148","2014-02-22T20:42:00.000Z","2020-10-21T17:32:00.000Z","Strong Economy","business tax,business license","18","Sylvrfish",,"Public Domain","published",,,,,,,,,,,,,"https://data.cityofgainesville.org/resource/agkx-2fc8.json",,,,,,,,,"vcz2-tzm9",,"community",
"https://data.cityofgainesville.org/d/hxgb-9ta8","hxgb-9ta8","true","true","hk2b-em59","data.cityofgainesville.org","filter","apartment listing","Businesses licensed to operate in the City of Gainesville.","1339","2014-02-22T20:36:00.000Z","2020-10-21T17:32:00.000Z","Strong Economy","business tax,business license","624","Sylvrfish","","Public Domain","published",,,,,,,,,,,,,"https://data.cityofgainesville.org/resource/hxgb-9ta8.json",,,,,,,,,"vcz2-tzm9",,"community",
"https://data.cityofgainesville.org/d/hw2t-nd9r","hw2t-nd9r","false","true","gk3k-9435","data.cityofgainesville.org","filter","2013_May_June","Customer electric consumption, by address, by month, January 2012 to present","25","2014-08-12T16:26:00.000Z","2020-10-19T18:02:00.000Z","Better Future","kwh,kilowatt,gru,electric,consumption","4","Nick Taylor - UF PREC",,"Public Domain","published",,,"GRU",,,,,,,,,,"https://data.cityofgainesville.org/resource/hw2t-nd9r.json",,,,,,,,,"3fga-9d68",,"community",
"https://data.cityofgainesville.org/d/acva-nc85","acva-nc85","true","true","q5em-yenm","data.cityofgainesville.org","chart","Community Grant Program Recipients & Type of Assistance [FYs2011-2013]","Local organizations receiving assistance from the Community Grant Program and the type of assistance received for FYs2011-2013 (October 2010 through September 2013).","162","2014-04-04T21:37:00.000Z","2014-05-15T14:30:00.000Z","Charts & Graphs",,"120","City of Gainesville","DG_Strategic_Planning@cityofgainesville.org","Public Domain","published",,,"Housing & Community Development",,,,,,,,,,"https://data.cityofgainesville.org/resource/acva-nc85.json",,,,,,,,,"8nv7-fk55",,"official",
"https://data.cityofgainesville.org/d/s7de-wj39","s7de-wj39","true","false",,"data.cityofgainesville.org","dataset","Fire/Rescue Responses","Fire / EMS response data for FY2012 up to the most current month available.","6295","2014-02-05T14:12:00.000Z","2020-10-22T17:41:00.000Z","Public Safety","fire,ems,rescue,responses","441","City of Gainesville","dg_strategic_planning@cityofgainesville.org","Public Domain","published",,,"Gainesville Fire Rescue (GFR)",,,,,,,,,,"https://data.cityofgainesville.org/resource/s7de-wj39.json",,,,,,,,,"8nv7-fk55",,"official","asa"
"https://data.cityofgainesville.org/d/395d-sdfp","395d-sdfp","false","true","37sh-6gz5","data.cityofgainesville.org","gis map","Citymap1 HCKTHN","Selected attributes from the Alachua County Property Appraiser that include the most recent boundaries for the City of Gainesville.","10","2014-02-22T19:51:00.000Z","2014-05-15T12:51:00.000Z","Governance",,"0","Sylvrfish",,"Public Domain","published",,,,,,,,,,,,,"https://data.cityofgainesville.org/resource/395d-sdfp.json",,,,,,,,,"vcz2-tzm9",,"community",
"https://data.cityofgainesville.org/d/vt4i-fx67","vt4i-fx67","true","true","vu9p-a5f7","data.cityofgainesville.org","filter","Top Three Violations","Complaints of potential code violations from October 2011 to date.  Not all complaints resulted in a violation","1848","2014-01-28T18:19:00.000Z","2020-10-21T17:15:00.000Z","Building & Development",,"229","Becky Rountree","dg_strategic_planning@cityofgainesville.org","Public Domain","published",,,"Code Enforcement",,,,,,,,,,"https://data.cityofgainesville.org/resource/vt4i-fx67.json",,,,,,,,,"rrw7-nu8y",,"official",
"https://data.cityofgainesville.org/d/y6su-758z","y6su-758z","true","true","vu9p-a5f7","data.cityofgainesville.org","map view","Where Top 3 Code Violations Occur","Complaints of potential code violations from October 2011 to date.  Not all complaints resulted in a violation","1780","2014-01-29T14:27:00.000Z","2020-10-21T17:15:00.000Z","Geospatial (Maps)",,"200","Becky Rountree","dg_strategic_planning@cityofgainesville.org","Public Domain","published",,,"Code Enforcement",,,,,,,,,,"https://data.cityofgainesville.org/resource/y6su-758z.json",,,,,,,,,"rrw7-nu8y",,"official",
"https://data.cityofgainesville.org/d/ymt5-xmfx","ymt5-xmfx","false","true","uk4p-nv6z","data.cityofgainesville.org","gis map","3 map overlay","RTS bus routes in city limits.","35","2014-02-22T20:14:00.000Z","2020-01-02T17:28:00.000Z","Infrastructure & Transportation",,"0","Sylvrfish",,"Public Domain","published",,,"RTS, Matthew Muller",,,,,,,,,,"https://data.cityofgainesville.org/resource/ymt5-xmfx.json",,,,,,,,,"vcz2-tzm9",,"community",
"https://data.cityofgainesville.org/d/85jt-vihs","85jt-vihs","true","true","bn44-jxhy","data.cityofgainesville.org","chart","Chart of Potable Water Consumption, by month and year","Potable water consumption, in kgals, for all GRU customers, by service address, by month, January 2012 to present","265","2014-01-06T14:02:00.000Z","2020-10-19T19:05:00.000Z","Charts & Graphs","potable water,water,gru,consumption gallons,kgals","203","Becky Rountree","DG_Strategic_Planning@cityofgainesville.org","Public Domain","published",,,,,,,,,,,,,"https://data.cityofgainesville.org/resource/85jt-vihs.json",,,,,,,,,"rrw7-nu8y",,"official",
"https://data.cityofgainesville.org/d/bn44-jxhy","bn44-jxhy","true","false",,"data.cityofgainesville.org","dataset","GRU Customer Potable Water Consumption","Potable water consumption, in kgals, for all GRU customers, by service address, by month, January 2012 to present","2119","2013-12-31T15:19:00.000Z","2020-10-19T19:05:00.000Z","Utilities","potable water,water,gru,consumption gallons,kgals","694","City of Gainesville","DG_Strategic_Planning@cityofgainesville.org","Public Domain","published",,,,,,,,,,,,,"https://data.cityofgainesville.org/resource/bn44-jxhy.json",,,,,,,,,"8nv7-fk55",,"official",
"https://data.cityofgainesville.org/d/g7uv-qkae","g7uv-qkae","true","true","bn44-jxhy","data.cityofgainesville.org","filter","Comparison of  of Potable Water Consumption - by month, by year","Potable water consumption, in kgals, for all GRU customers, by service address, by month, January 2012 to present","290","2014-01-06T14:00:00.000Z","2020-10-19T19:05:00.000Z","Utilities","potable water,water,gru,consumption gallons,kgals","163","Becky Rountree","DG_Strategic_Planning@cityofgainesville.org","Public Domain","published",,,,,,,,,,,,,"https://data.cityofgainesville.org/resource/g7uv-qkae.json",,,,,,,,,"rrw7-nu8y",,"official",
"https://data.cityofgainesville.org/d/dbcj-nniz","dbcj-nniz","true","false",,"data.cityofgainesville.org","dataset","GRU Customer Natural Gas Consumption","Natural gas consumption for all GRU customers in therms, by month, by service address from January 2012 to present","3467","2013-12-30T17:25:00.000Z","2020-10-19T18:48:00.000Z","Utilities","natural gas,therms,consumption gru,gas","222","City of Gainesville","DG_Strategic_Planning@cityofgainesville.org","Public Domain","published",,,"GRU",,,,,,,,,,"https://data.cityofgainesville.org/resource/dbcj-nniz.json",,,,,,,,,"8nv7-fk55",,"official",
"https://data.cityofgainesville.org/d/spe2-t65p","spe2-t65p","true","true","s7de-wj39","data.cityofgainesville.org","map view","Fire / EMS Heat Map FY12 to Present","Fire / EMS response data for FY2012 up to the most current month available.","5618","2014-02-05T21:32:00.000Z","2020-10-22T17:41:00.000Z","Geospatial (Maps)","fire,ems,rescue,responses","435","City of Gainesville","dg_strategic_planning@cityofgainesville.org","Public Domain","published",,,"Gainesville Fire Rescue (GFR)",,,,,,,,,,"https://data.cityofgainesville.org/resource/spe2-t65p.json",,,,,,,,,"vsei-5zu2",,"official",
"https://data.cityofgainesville.org/d/s63h-6anu","s63h-6anu","true","false",,"data.cityofgainesville.org","dataset","GRU Customer LP Gas Consumption","LP gas (propane) consumption in gallons for all GRU customers, by service address, by month - January 2012 to present","2026","2013-12-31T12:51:00.000Z","2020-10-19T18:24:00.000Z","Utilities","lp,gas,consumption,gru,gallons,propane","255","City of Gainesville","DG_Strategic_Planning@cityofgainesville.org","Public Domain","published",,,"GRU",,,,,,,,,,"https://data.cityofgainesville.org/resource/s63h-6anu.json",,,,,,,,,"8nv7-fk55",,"official",
"https://data.cityofgainesville.org/d/gk3k-9435","gk3k-9435","true","false",,"data.cityofgainesville.org","dataset","GRU Customer Electric Consumption","Customer electric consumption, by address, by month, January 2012 to present","6924","2013-12-24T18:59:00.000Z","2020-10-19T18:02:00.000Z","Utilities","kwh,kilowatt,gru,electric,consumption","2388","City of Gainesville","DG_Strategic_Planning@cityofgainesville.org","Public Domain","published",,,"GRU",,,,,,,,,,"https://data.cityofgainesville.org/resource/gk3k-9435.json",,,,,,,,,"8nv7-fk55",,"official",
"https://data.cityofgainesville.org/d/637g-47kk","637g-47kk","true","true","dbcj-nniz","data.cityofgainesville.org","map view","Map of Top 10 Users of Natural Gas","natural gas consumption for all GRU customers in therms, by month, by service address from January 2012 to present","332","2013-12-31T15:15:00.000Z","2020-10-19T18:48:00.000Z","Geospatial (Maps)","natural gas,therms,consumption gru,gas","186","Becky Rountree","DG_Strategic_Planning@cityofgainesville.org","Public Domain","published",,,"GRU",,,,,,,,,,"https://data.cityofgainesville.org/resource/637g-47kk.json",,,,,,,,,"rrw7-nu8y",,"official",
"https://data.cityofgainesville.org/d/vs8t-njwg","vs8t-njwg","false","false",,"data.cityofgainesville.org","dataset","Tax Roll - 2012","Selected 2012 attributes from the Alachua County Property Appraisers CAMA (Computer Aided Mass Appraisal) tables. The CAMA tables compiled for the final tax roll include real property, history, entity, entity property, building use and code01.","1894","2013-12-19T21:03:00.000Z","2015-10-12T18:29:00.000Z","Community Model","tax,tax roll,property,values,property values","158","City of Gainesville","DG_Strategic_Planning@cityofgainesville.org","Public Domain","published",,,"Alachua County Property Appraiser",,,,,,,,,,"https://data.cityofgainesville.org/resource/vs8t-njwg.json",,,,,,,,"http://www.acpafl.org","vsei-5zu2",,"official",
"https://data.cityofgainesville.org/d/qu9e-3iz4","qu9e-3iz4","true","true","hk2b-em59","data.cityofgainesville.org","map view","Gainesville Businesses Heat Map","Businesses licensed to operate in the City of Gainesville.","6254","2013-12-04T22:55:00.000Z","2020-10-21T17:32:00.000Z","Geospatial (Maps)","business tax,business license","12474","Lila","dg_strategic_planning@cityofgainesville.org","Public Domain","published",,,,,,,,,,,,,"https://data.cityofgainesville.org/resource/qu9e-3iz4.json",,,,,,,,,"mpbg-6sdb",,"official",
"https://data.cityofgainesville.org/d/khkv-62wd","khkv-62wd","true","false",,"data.cityofgainesville.org","dataset","GRU Customer Reclaimed Water Consumption","Monthly reclaimed water consumption in Kilo-gallons (kgals) by service address for all customers in the GRU Service Area. Reclaimed water is also known as sewer or wastewater. (Potable water use can be found in another dataset)","3168","2013-12-11T22:20:00.000Z","2020-10-19T18:58:00.000Z","Utilities","water,consumption,gallons,kgals,gru,reclaimed,sewer,wastewater","261","City of Gainesville","DG_Strategic_Planning@cityofgainesville.org","Public Domain","published",,,"GRU",,,,,,,,,,"https://data.cityofgainesville.org/resource/khkv-62wd.json",,,,,,,,,"8nv7-fk55",,"official",
"https://data.cityofgainesville.org/d/gtee-xftk","gtee-xftk","true","true","khkv-62wd","data.cityofgainesville.org","chart","Chart Comparing  Water Consumption by Month (and year)","monthly water consumption in kilogallons (kgals) by service address, all cusomters in the GRU service area - this is regular water use (potable water can be find in another dataset)","351","2013-12-30T16:39:00.000Z","2020-10-19T18:58:00.000Z","Charts & Graphs","water,consumption,gallons,kgals,gru","197","Becky Rountree","DG_Strategic_Planning@cityofgainesville.org","Public Domain","published",,,"GRU",,,,,,,,,,"https://data.cityofgainesville.org/resource/gtee-xftk.json",,,,,,,,,"rrw7-nu8y",,"official",
"https://data.cityofgainesville.org/d/n9k9-wg3u","n9k9-wg3u","true","true","khkv-62wd","data.cityofgainesville.org","filter","Total Water Consumption by month (and year)","monthly water consumption in kilogallons (kgals) by service address, all cusomters in the GRU service area - this is regular water use (potable water can be find in another dataset)","533","2013-12-30T16:37:00.000Z","2020-10-19T18:58:00.000Z","Utilities","water,consumption,gallons,kgals,gru","178","Becky Rountree","DG_Strategic_Planning@cityofgainesville.org","Public Domain","published",,,"GRU",,,,,,,,,,"https://data.cityofgainesville.org/resource/n9k9-wg3u.json",,,,,,,,,"rrw7-nu8y",,"official",
"https://data.cityofgainesville.org/d/pibj-zrfe","pibj-zrfe","true","true","rkug-zh32","data.cityofgainesville.org","chart","Top 10 Routes with Most Passengers","Ten routes with most passengers for 2011 through 2013.","501","2013-12-04T21:55:00.000Z","2020-10-20T19:09:00.000Z","Charts & Graphs","transit","259","City of Gainesville","dg_strategic_planning@cityofgainesville.org","Public Domain","published",,,"Regional Transit System (RTS)",,,,,,,,,,"https://data.cityofgainesville.org/resource/pibj-zrfe.json",,,,,,,,,"8nv7-fk55",,"official",
"https://data.cityofgainesville.org/d/hum5-xch8","hum5-xch8","false","true","mzff-betx","data.cityofgainesville.org","chart","MLK Center Participation & Attendance","Participation and attendance numbers for the MLK Center for FY2013 (October 2012 through September 2013).","271","2013-12-04T13:28:00.000Z","2019-09-19T17:38:00.000Z","Charts & Graphs",,"107","City of Gainesville","dg_strategic_planning@cityofgainesville.org","Public Domain","published",,,"Parks, Recreation & Cultural Affairs",,,,,,,,,,"https://data.cityofgainesville.org/resource/hum5-xch8.json",,,,,,,,,"8nv7-fk55",,"official",
"https://data.cityofgainesville.org/d/bmqs-29e3","bmqs-29e3","false","true","mzff-betx","data.cityofgainesville.org","chart","Attendance at Pools & Parks","Attendance numbers for the pools and parks for FY2013 (October 2012 through September 2013).","213","2013-12-04T13:34:00.000Z","2019-09-19T17:38:00.000Z","Charts & Graphs",,"103","City of Gainesville","dg_strategic_planning@cityofgainesville.org","Public Domain","published",,,"Parks, Recreation & Cultural Affairs",,,,,,,,,,"https://data.cityofgainesville.org/resource/bmqs-29e3.json",,,,,,,,,"8nv7-fk55",,"official",
"https://data.cityofgainesville.org/d/5tre-ptg2","5tre-ptg2","true","true","2mwg-nkuf","data.cityofgainesville.org","filter","Fire Dept Vehicle Fuel Consumption 2012 - by station & division","Fuel consumption by month - by department-by fuel type, including gallons and total cost","787","2013-12-03T22:48:00.000Z","2020-09-17T17:57:00.000Z","Public Administration & Finance","fuel,gasoline,diesel,unleaded,consumption,vehicle","101","Becky Rountree","dg_strategic_planning@cityofgainesville.org","Public Domain","published",,,"General Services",,,,,,,,,,"https://data.cityofgainesville.org/resource/5tre-ptg2.json",,,,,,,,,"rrw7-nu8y",,"official",
"https://data.cityofgainesville.org/d/r3bt-bhsi","r3bt-bhsi","false","true","69nq-c5ma","data.cityofgainesville.org","chart","Cultural Affairs Revenue Generated","Revenue generated at Cultural Affairs' events like the Free Friday Concerts, Downtown Plaza events, and other special events for FY2013 (October 2012 through September 2013).","154","2013-12-03T21:52:00.000Z","2014-08-13T16:47:00.000Z","Charts & Graphs",,"127","City of Gainesville","dg_strategic_planning@cityofgainesville.org","Public Domain","published",,,"Parks, Recreation & Cultural Affairs",,,,,,,,,,"https://data.cityofgainesville.org/resource/r3bt-bhsi.json",,,,,,,,,"8nv7-fk55",,"official",
"https://data.cityofgainesville.org/d/7qfa-ytkc","7qfa-ytkc","false","false",,"data.cityofgainesville.org","dataset","Youth Recreational Programs & Sports Attendance and Revenue","Youth programming and sports participation and event attendance data since FY2013.","335","2013-12-03T18:42:00.000Z","2019-09-18T15:59:00.000Z","Public Administration & Finance",,"217","Jeremy Griffith","dg_strategic_planning@cityofgainesville.org","Public Domain","published",,,"Parks, Recreation & Cultural Affairs",,,,,,,,,,"https://data.cityofgainesville.org/resource/7qfa-ytkc.json",,,,,,,,,"u832-bgea",,"official",
"https://data.cityofgainesville.org/d/6xri-t3cp","6xri-t3cp","false","false",,"data.cityofgainesville.org","gis map","City Boundary","Selected attributes from the Alachua County Property Appraiser that include the most recent boundaries for the City of Gainesville.","44","2013-12-03T19:30:00.000Z","2016-08-27T16:22:00.000Z","Governance","city limits,city boundary,gainesville","1","City of Gainesville","dg_strategic_planning@cityofgainesville.org","Public Domain","published",,,"ACPA",,,,,,,,,,"https://data.cityofgainesville.org/resource/6xri-t3cp.json",,,,,,,,,"vsei-5zu2",,"official",
"https://data.cityofgainesville.org/d/69nq-c5ma","69nq-c5ma","false","false",,"data.cityofgainesville.org","dataset","Cultural Affairs","Thomas Center usage, Free Friday Concerts and Downtown Plaza events attendance, and other Cultural Affairs special events data since FY2013.","283","2013-12-03T17:50:00.000Z","2014-08-13T16:47:00.000Z","Public Administration & Finance",,"150","Jeremy Griffith","dg_strategic_planning@cityofgainesville.org","Public Domain","published",,,"Parks, Recreation & Cultural Affairs",,,,,,,,,,"https://data.cityofgainesville.org/resource/69nq-c5ma.json",,,,,,,,,"u832-bgea",,"official",
"https://data.cityofgainesville.org/d/25yi-nhu4","25yi-nhu4","true","true","3wub-njz5","data.cityofgainesville.org","chart","Adult Sports Participation & Attendance","Athletic fields, softball, and tennis data for FY2013 (October 2012 through September 2013).","260","2013-12-03T21:19:00.000Z","2014-12-08T21:02:00.000Z","Charts & Graphs",,"194","City of Gainesville","dg_strategic_planning@cityofgainesville.org","Public Domain","published",,,"Parks, Recreation & Cultural Affairs",,,,,,,,,,"https://data.cityofgainesville.org/resource/25yi-nhu4.json",,,,,,,,,"8nv7-fk55",,"official",
"https://data.cityofgainesville.org/d/ya5z-hspf","ya5z-hspf","false","true","69nq-c5ma","data.cityofgainesville.org","chart","Thomas Center Attendance","Thomas Center rental participants and gallery and traveling exhibits attendance information for FY2013 (October 2012 through September 2013).","191","2013-12-03T21:06:00.000Z","2014-08-13T16:47:00.000Z","Charts & Graphs",,"114","City of Gainesville","dg_strategic_planning@cityofgainesville.org","Public Domain","published",,,"Parks, Recreation & Cultural Affairs",,,,,,,,,,"https://data.cityofgainesville.org/resource/ya5z-hspf.json",,,,,,,,,"8nv7-fk55",,"official",
"https://data.cityofgainesville.org/d/tfff-asdt","tfff-asdt","true","true","49eb-8bq9","data.cityofgainesville.org","chart","Senior Recreation Center Programs & Attendance","Senior Recreation Center number of programs held and quantity of attendance since FY2013 (October 2012).","348","2013-12-03T13:24:00.000Z","2019-11-26T15:52:00.000Z","Charts & Graphs",,"248","City of Gainesville","dg_strategic_planning@cityofgainesville.org","Public Domain","published",,,"Parks, Recreation & Cultural Affairs",,,,,,,,,,"https://data.cityofgainesville.org/resource/tfff-asdt.json",,,,,,,,,"8nv7-fk55",,"official",
"https://data.cityofgainesville.org/d/2mwg-nkuf","2mwg-nkuf","true","false",,"data.cityofgainesville.org","dataset","City Vehicles Fuel Consumption - October 2011 to Present","Fuel consumption of city vehicles by month - by department - by fuel type (Including General Government and Gainesville Regional Utilities).","2318","2013-12-02T22:12:00.000Z","2020-09-17T17:57:00.000Z","Public Administration & Finance","fuel,gasoline,diesel,unleaded,consumption,vehicle","308","Becky Rountree","dg_strategic_planning@cityofgainesville.org","Public Domain","published",,,"General Services",,,,,,,,,,"https://data.cityofgainesville.org/resource/2mwg-nkuf.json",,,,,,,,,"rrw7-nu8y",,"official",
"https://data.cityofgainesville.org/d/mzff-betx","mzff-betx","false","false",,"data.cityofgainesville.org","dataset","Recreation Centers, Pools & Parks Attendance and Revenue","Attendance numbers and revenue generated for the MLK Center, Senior Recreation Center, other public recreation centers, pools, and parks since FY2013.","300","2013-12-02T21:49:00.000Z","2019-09-19T17:38:00.000Z","Public Administration & Finance",,"140","Jeremy Griffith","dg_strategic_planning@cityofgainesville.org","Public Domain","published",,,"Parks, Recreation & Cultural Affairs",,,,,,,,,,"https://data.cityofgainesville.org/resource/mzff-betx.json",,,,,,,,,"u832-bgea",,"official",
"https://data.cityofgainesville.org/d/qcty-nik4","qcty-nik4","true","true","49eb-8bq9","data.cityofgainesville.org","chart","Senior Recreation Center Rentals & Participants","Senior Recreation Center number of facility rentals for events and quantity of participants since FY2013 (October 2012).","197","2013-12-03T13:29:00.000Z","2019-11-26T15:52:00.000Z","Charts & Graphs",,"171","City of Gainesville","dg_strategic_planning@cityofgainesville.org","Public Domain","published",,,"Parks, Recreation & Cultural Affairs",,,,,,,,,,"https://data.cityofgainesville.org/resource/qcty-nik4.json",,,,,,,,,"8nv7-fk55",,"official",
"https://data.cityofgainesville.org/d/49eb-8bq9","49eb-8bq9","true","false",,"data.cityofgainesville.org","dataset","Senior Recreation Center Facility Usage","Senior Recreation Center facility usage for programs and events, including counts of participation and attendance since FY2013 (October 2012).","305","2013-12-02T14:51:00.000Z","2019-11-26T15:52:00.000Z","Public Administration & Finance",,"179","Jeremy Griffith","dg_strategic_planning@cityofgainesville.org","Public Domain","published",,,"Parks, Recreation & Cultural Affairs",,,,,,,,,,"https://data.cityofgainesville.org/resource/49eb-8bq9.json",,,,,,,,,"u832-bgea",,"official",
"https://data.cityofgainesville.org/d/5ras-6zd3","5ras-6zd3","true","true","cj3f-mn5t","data.cityofgainesville.org","filter","Checkbook - expenditure Count","Expenditure data since FY2011","680","2013-11-22T23:00:00.000Z","2020-10-05T21:00:00.000Z","Public Administration & Finance","checkbook,finance,financial,expenditures","256","Dylan Bussone","","Public Domain","published",,,"Budget & Finance",,,,,,,,,,"https://data.cityofgainesville.org/resource/5ras-6zd3.json",,,,,,,,,"vcvp-yass",,"official",
"https://data.cityofgainesville.org/d/wkh5-eidw","wkh5-eidw","true","true","cj3f-mn5t","data.cityofgainesville.org","filter","Checkbook - departments","Expenditure data since FY2011","279","2013-11-22T23:10:00.000Z","2020-10-05T21:00:00.000Z","Public Administration & Finance","checkbook,finance,financial,expenditures","189","Dylan Bussone","","Public Domain","published",,,"Budget & Finance",,,,,,,,,,"https://data.cityofgainesville.org/resource/wkh5-eidw.json",,,,,,,,,"vcvp-yass",,"official",
"https://data.cityofgainesville.org/d/cj3f-mn5t","cj3f-mn5t","true","false",,"data.cityofgainesville.org","dataset","Gainesville Checkbook - Expenditures FY2011 to FY2020","General Government expenditures to vendors by ETF, check, and/or credit card, excluding payroll, for all funds for Fiscal Year 2011 to present (10/1/2010 to present). *Note: FY2014 & FY2015 is pre-audited data.","5777","2013-11-22T00:44:00.000Z","2020-10-05T21:00:00.000Z","Public Administration & Finance","checkbook,finance,financial,expenditures","388","City of Gainesville","dg_strategic_planning@cityofgainesville.org","Public Domain","published",,,"Budget & Finance",,,,,,,,,,"https://data.cityofgainesville.org/resource/cj3f-mn5t.json",,,,,,,,,"8nv7-fk55",,"official",
"https://data.cityofgainesville.org/d/c5d8-83ch","c5d8-83ch","true","true","cj3f-mn5t","data.cityofgainesville.org","filter","Checkbook - vendor count","Expenditure data since FY2011","2362","2013-11-22T22:59:00.000Z","2020-10-05T21:00:00.000Z","Public Administration & Finance","checkbook,finance,financial,expenditures","4379","Dylan Bussone","","Public Domain","published",,,"Budget & Finance",,,,,,,,,,"https://data.cityofgainesville.org/resource/c5d8-83ch.json",,,,,,,,,"vcvp-yass",,"official",
"https://data.cityofgainesville.org/d/inpb-txp2","inpb-txp2","true","true","cj3f-mn5t","data.cityofgainesville.org","filter","Checkbook - department count","Expenditure data since FY2011","341","2013-11-22T22:58:00.000Z","2020-10-05T21:00:00.000Z","Public Administration & Finance","checkbook,finance,financial,expenditures","212","Dylan Bussone","","Public Domain","published",,,"Budget & Finance",,,,,,,,,,"https://data.cityofgainesville.org/resource/inpb-txp2.json",,,,,,,,,"vcvp-yass",,"official",
