"company_name","business_description","street_address","city","state","county","phone","fax","email","commodity_codes"
"Consulting Resources NY LLC","Interior decorating consulting service, office set-up: non-technology items and Project Management Consulting.","340 East 57th Street, #4A","New York","NY","New York","917-657-0943","212-826-5690","marylynn@crny.net","541611 - Administrative Management and General Management Consulting Services; 541613 - Marketing consulting services; 541618 - Other Management Consulting Services"
"Contine Corporation","Machine Shop, Industrial and Commercial Machinery & Equipment;","1820 Nagle Road","Erie","PA",,"814-899-0006","814-899-2796","cellrich@continedbe.com","332321 - Metal Window and Door Manufacturing; 332322 - Sheet Metal Work Manufacturing; 332710 - Machine shops; 335313 - Switchgear and Switchboard Apparatus Manufacturing"
"Contractor Problem Resolution Consultants, LLC","Contractor Problem Resolution Consultants, LLC provides GC/Prime Contractors and their subs in the building construction industry with satisfying the required contract administration & documents controls required that will aid them with being able to mobilize, manage, and complete their projects. Also provide individual and group training to accomplish this goal.","911 West Front Street","Plainfield","NJ","Union","908-754-1731","908-754-5224","cprconsultants@verizon.net","541618 - Other Management Consulting Services; C - Consultants"
"Contractor's Layout","Heavy Contruction, Survey, Stakeout.","829 Lincoln Ave, Suite 4","Bohemia","NY","Suffolk","631-218-0334","631-218-0335","darcy@contractorslayout.com","541370 - Surveying and Mapping (except Geophysical) Services; 625 - SURVEY OPERATIONS, ROW MARKERS & PERMANENT SURVEY MARKERS"
"Convergent Technologies Design Group - NY, Inc.","Telecommunications Management Consulting and Design Services;","4849 MIDDLETOWN DRIVE","LOCKPORT","NY","Niagara","716-438-7516","716-438-7516","wmnicosia@yahoo.com","541330 - Engineering services; 541618 - Other Management Consulting Services"
"Cooper Neon Sign Co. Inc.","Full Service Sign Manufacturing Company ;","7350 PORTER ROAD","NIAGARA FALLS","NY","Niagara","716-297-2340","716-297-5159","jennifer@coopersign.com","339950 - Sign Manufacturing; 453998 - All Other Miscellaneous Store Retailers (except Tobacco Stores); 645 - SIGNS; 920 - Manufacturer"
"Cooper Trading, Inc.","SUPPLIER OF COMMERCIAL, INDUSTRIAL, RESIDENTIAL, HEAVY HIGHWAY CONSTRUCTION SAFETY AND SITE DEVELOPMENT PRODUCTS","P.O. Box 339","Irwin","PA",,"724-861-8830","724-861-8832","pete@ctipa.com","327320 - Ready-Mix Concrete Manufacturing; 423310 - Lumber, Plywood, Millwork, and Wood Panel Merchant Wholesalers; 423320 - Brick, Stone, and Related Construction Material Merchant Wholesalers; 423330 - Roofing, Siding, and Insulation Material Merchant Wholesalers; 423510 - Metal Service Centers and Other Metal Merchant Wholesalers; 423710 - Hardware Merchant Wholesalers; 423720 - Plumbing and Heating Equipment and Supplies (Hydronics) Merchant Wholesalers"
"Copertino Earth Materials, LLC","Supplier of Engineered soils, aggregates and construction materials.","1841 County House Road","Deptford","NJ",,"609-548-0445","201-406-6382","donna@earthmaterialsllc.com","325314 - Fertilizer (Mixing Only) Manufacturing; 327992 - Ground or Treated Mineral and Earth Manufacturing; 423320 - Brick, Stone, and Related Construction Material Merchant Wholesalers; 423390 - Other Construction Material Merchant Wholesalers; 423990 - Other Miscellaneous Durable Goods Merchant Wholesalers; 424910 - Farm supplies merchant wholesalers; 562219 - Other Nonhazardous Waste Treatment and Disposal"
"Copwood","We provide state-of-the-art training for employees and managers in creativity, critical thinking, communication, stress and time management, motivation, team building, and many other topics","6 Chester Place","Woodstock","NY","Dutchess","845-247-7021","845-471-5261","copwood@gmail.com","611430 - Professional and Management Development Training; 090H - PROFESSIONAL & MANAGEMENT TRAINING"
"Cordoba Construction, Inc.","We are general contractors and do all phases of work with our own people and subcontractors. We also do specialty work, i.e. window replacement and concrete a well as finishes.","101 WEST STREET","HILLSDALE","NJ","Bergen","201-664-6929","201-664-4279","cordoba6929@gmail.com","236115 - New Single-Family Housing Construction (except Operative Builders) (deactivated in 2012 codeset); 236118 - Residential Remodelers; K-CARPNTRY - Carpentry; K-GCBUILDG - G.C.-Bldg.; K-WINDOWS* - Windows"
"CORE ENVIRONMENTAL CONSULTANTS INC","Engineering Consulting Services Environmental Services Remediation Services Testing Laboratories;","2312 WEHRLE DRIVE","Buffalo","NY","Erie","716-204-8054","718-762-0543","tst@coreenv.com","541330 - Engineering services; 541380 - Testing Laboratories; 541620 - Environmental consulting services; 562910 - Remediation Services; 010A - HIGHWAY DESIGN PHASES I-IV; 010D - DRAINAGE; 010G - ESTIMATING; 010H - SPECIFICATIONS; 010Q - HYDROLOGY; 010R - MECHANICAL DESIGN; 080A - GEOLOGY; 080B - AIR QUALITY; 080C - WATER QUALITY; 090E - REAL ESTATE APPRAISALS"
"Core Industrial, LLC","Paint and varnish supply. merchant wholesalers.","3944 Cooper Road","Lowellville","OH","Mahoning","330-719-6063",,"lmcore9@gmail.com","424950 - Paint, Varnish, and Supplies Merchant Wholesalers; 14545 - Paint and Varnish; V-99999999 - Unknown-Pending-Others"
"Corliss Stone-Littles, LLC","Corliss Stone-Littles, LLC is a growing owner/operator and operating partner in internationally branded specialty retail stores primarily positioned in some of America's largest airports.","8180 PRECINCT LINE, SUITE 150","Southlake","TX","Tarrant","817-421-6399","801-650-1339","mthornell@cslllc.biz","446120 - Cosmetics, Beauty Supplies, and Perfume Stores; 446130 - Optical goods stores (except offices of optometrists); 453220 - Gift, Novelty, and Souvenir Stores; 453998 - All Other Miscellaneous Store Retailers (except Tobacco Stores); 722310 - Airline food services contractors; 722515 - Snack bars (e.g., cookies, popcorn, pretzels), fixed location; 997000 - Retail (General)"
"Cosmic Designs & Crafts, Inc.","The firm is a retailer of jewelry accessories, souvenirs and gifts.","Newark Liberty Intl Airport, Terminal C-1","Newark","NJ","Essex","844-777-2559","732-749-1500","cosmicdesigns@gmail.com","448150 - Clothing accessories stores; 451211 - Religious book stores; 452990 - Variety stores; U-GENMERCH - Gen Merchandise"
"Cost Control Contractors, LLC","CONSTRUCTION MANAGEMENT ADMINISTRATION AND INSPECTION;","159 East 116th Street, Second Floor","New York","NY","New York","347-267-4581","212-348-4469","alfonso.valdes@costcontrolpr.com","531312 - Nonresidential Property Managers; 541611 - Administrative Management and General Management Consulting Services"
"Costing Services Group, Inc.","Construction Costs Consultants Building Inspection and Industrial Design Consulting Services;","1270 W. Peachtree St., NW Ste. 3","Atlanta","GA",,"404-815-9555","404-815-9666","anita@costingservicesgroup.com","541350 - Building inspection services; 541420 - Industrial design services; 541690 - Other Scientific and Technical Consulting Services; 010G - ESTIMATING; 050A - CONSTRUCTION INSPECTION; 090J - BUSINESS & FINANCIAL ADVISING"
"Counter Technology, Inc.","Technical Security Systems Design & Engineering/Contractor Administration, Security Program Design & Assessment's Computer Based Systems Design & Management.","9711 Washington Blvd., Suite 550","Gaithersburg","MD","Montgomery","301-528-8591","301-528-2037","san.garza@countertech.com","541512 - Computer Systems Design Services; 91893 - Security/Safety Consulting"
"County Metal & Glass Inc","Glass and Glazing Contractors.Curtain wall, metal installation, Glass, plate, merchant wholesalers.;","79 Gage Road","East Brunswick","NJ",,"732-738-6655","732-738-6658","ednaq@allactionglass.com","23815 - Glass and Glazing Contractors; 238190 - Shutter installation; 42339 - Other Construction Material Merchant Wholesalers"
"CQ Fluency, Inc.","Translation and interpretation services.","2 University Plaza, suite 406","HACKENSACK","NJ","Bergen","201-487-8007","201-487-8052","info@cqfluency.com","96175 - Translation Services"
"Cragnolin Engineering and Design Associates, D.P.C","Cragnolin Engineering & Design Assoc., DPC (CDA) is a design consulting firm providing clients with a variety of engineering services to include: conceptual, preliminary and final design, and related construction documents, arborist inspection, cpm scheduling.","223 Wall St. #293","Huntington","NY","Suffolk","516-721-4515","267-653-4260","msm@cragnolindesign.com","236220 - Construction management, commercial and institutional building; 237310 - Construction management, highway, road, street and bridge; 541320 - Landscape architectural services; 541330 - Engineering consulting services; 541340 - Drafting services; 54135 - Building Inspection Services; C-CONSMGMT - Construction Mgmt; C-ENGEERNG - Engineering; K-CAD/CAM* - Cad/Cam; K-ENGEERNG - Engineering; K-ESTMATNG - Estimating; K-LANDSCPG - Landscaping; R-CAD/CAM* - Cad/Cam; R-CIVIL*** - Civil; R-CONSINSP - Construction Inspection; R-CONSMGMT - Construction Mgmt; R-DRFTSMEN - Draftsmen; R-ENGEERNG - Engineering; R-ESTIMTNG - Estimating; R-LNDSCPNG - Landscaping; R-PROJMGMT - Project Management; R-SCHEDLNG - Scheduling; R-STRUCTRL - Structural"
"Craven's Painting, Restoration","Painting.","219 Sherman Street","Rochester","NY","Monroe","585-485-9514","585-442-5743","cravenspaintingrestoration@gmail.com","238320 - Painting and Wall Covering Contractors"
"CRC Associates, Inc.","General construction,Electrical work, Security System, Communication System Design and Installation.","267 JEWETT AVENUE","STATEN ISLAND","NY",,"908-561-8246","908-756-3433","cpatel@crcassociates.net","236220 - Commercial and Institutional Building Construction; 238210 - Electrical Contractors and Other Wiring Installation Contractors; 238220 - Plumbing, Heating, and Air-Conditioning Contractors; 517110 - Wired Telecommunications Carriers"
"Creative Concourse Concessions, LLC","airport, airport concessions, retail, food and beverage, duty free, concessionaire","10700 Richmond Avenue #265","Houston","TX","Houston","832-236-9548","832-519-9203","hej@flash.net","445310 - Package stores (i.e., liquor); 446120 - Cosmetics, Beauty Supplies, and Perfume Stores; 451212 - Newsstands (i.e., permanent); 453220 - Gift, Novelty, and Souvenir Stores; 453991 - Tobacco stores; V - Vendors"
"Creative Construction Services Corp.","Creative Construction Services Corp, is a minority owned business firm that provides union labor specializing in general carpentry, drywall and framing, acoustical ceilings, safety protection, waterproofing and hardware instillation.","118-58 229TH STREET","CAMBRIA HEIGHTS","NY","Queens","718-525-2300","718-528-2410","sjames@hjccs.com","236220 - Commercial and Institutional Building Construction; K-INTRENOV - Interior Renovations"
"Creative Direction Construction and Design , LLC","Masonry and Carpentry contractors;","29 Linden Ave","Mount Vernon","NY","Westchester","646-215-3245","914-699-1652","emg4000@aol.com","238140 - Masonry Contractors; 238350 - Finish Carpentry Contractors"
"Creative Insurance Concepts, Inc.","Risk management, bonding and document management services.;","8012 Midlothian Turnpike, Ste# 202","North Chesterfield","VA",,"804-674-8330","804-674-8332","cjreynolds@creativeic.com","518210 - Data Processing, Hosting, and Related Services; 524126 - Direct Property and Casualty Insurance Carriers; 524210 - Insurance Agencies and Brokerages; 524291 - Claims Adjusting; 524292 - Third Party Administration of Insurance and Pension Funds; 524298 - All Other Insurance Related Activities; 541611 - Administrative Management and General Management Consulting Services; 561990 - All Other Support Services"
"Creekside Boundary Land Surveying, PLLC","Land Surveying Services","1746 HIGGINS ROAD","WARSAW","NY","Wyoming","585-786-5640",,"mclark@creeksideboundary.com","541370 - Surveying and Mapping (except Geophysical) Services; 040A - LAND SURVEYING/TOPO MAPPING & 3D MODELING; 040B - RIGHT OF WAY DETERMINATION AND MAPPING; 040C - PHOTOGRAMMETRY"
"Creelman & Associates, Inc.","Technical consulting in the areas of information technology, security, and the environment. Engineering services and environmental consulting services.","9040 Rangely Ave","West Hollywood","CA","San Luis Obispo","805-237-9500","805-237-2384","swdbe@lynncreelman.com","541330 - Civil engineering services; 541330 - Consulting engineers' offices; 541330 - Electrical engineering services; 541330 - Engineering consulting services; 541330 - Environmental engineering services; 541330 - Mechanical engineering services; 541330 - Traffic engineering consulting services; 541620 - Environmental consulting services"
"CRESCENT CONSULTING","DIVERSITY, AFFIRMATIVE ACTION, INTEGRITY MONITORING AND EEO CONSULTING SERVICES;","2 STOWE ROAD SUITE 3A","PEEKSKILL","NY","Westchester","914-788-9244","914-788-9214","lsegarra@crescentconsult.com","541611 - Administrative Management and General Management Consulting Services; 070A - COMMUNITY PARTICIPATION/PUBLIC RELATIONS/OUTREACH"
"CRESCENT ENERGY INC","LEED, Energy Savings Program and Sustainability Consulting and Training Services Broker of Green Lighting and Electrical and HVAC Products.;","2 STOWE ROAD SUITE 3A","PEEKSKILL","NY","Westchester","914-788-9244","914-788-9214","lsegarra@crescentconsult.com","423610 - Electrical Apparatus and Equipment, Wiring Supplies, and Related Equipment Merchant Wholesalers; 423720 - Plumbing and Heating Equipment and Supplies (Hydronics) Merchant Wholesalers; 541614 - Process, Physical Distribution, and Logistics Consulting Services; 541690 - Other Scientific and Technical Consulting Services"
"C & R HOUSING INC","Light Commercial Construction Company performing demolition asbestos and lead abatement;","230 PRATT STREET","BUFFALO","NY","Erie","716-827-3556","716-856-8386","jabril777@hotmail.com","238310 - Drywall and Insulation Contractors; 322299 - All Other Converted Paper Product Manufacturing; 333112 - Lawn and Garden Tractor and Home Lawn and Garden Equipment Manufacturing; 424910 - Farm supplies merchant wholesalers; 484220 - Specialized Freight (except Used Goods) Trucking, Local; 561730 - Landscaping Services; 562910 - Remediation Services; 201 - CLEARING GRUBBING; 202 - REMOVAL OF STRUCTURES & OBSTRUCTIONS; 205 - CONTAMINATED SOIL; 210 - REMOVE AND DISPOSAL OF ASBESTOS CONTAINING MATERIAL; 080H - HAZARDOUS WASTE/ASBESTOS/LEAD"
"Cris Supplies, Inc.","DISTRIBUTOR OF CONTRACTORS SUPPLIES AND SAFETY EQUIPMENT;","P.O. Box 224, 533 Province Line Road","Allentown","NJ",,"908-804-5885","609-758-1147","crissupplies@hotmail.com","423710 - Hardware Merchant Wholesalers"
"Critical Path, Inc.","CPI provides experience, skill & expertise to deliver a full range of airport consultant services, SMS Plans, operational studies, snow plans, airfield development, and planning & management solutions for airports worldwide.","4977 39 Avenue S.","Fargo","ND","Cass","701-212-0695","571-297-4129","jessica@criticalpathinc.com","488119 - Other Airport Operations; 541614 - Transportation management consulting services; 541618 - Telecommunications management consulting services; 56121 - Facilities Support Services; C-MNGEMENT - Management; C-RSCHADEV - Research And Development; K-MNGEMENT - Management; R-MNGEMENT - Management"
"Cromedy Construction Corporation",,"5702 Newtown Avenue","Philadelphia","PA",,"215-437-7606","215-437-7655","bcromedy@cromedyconstruction.com","236118 - Residential Remodelers; 237110 - Water and Sewer Line and Related Structures Construction; 237310 - Concrete paving (i.e., highway, road, street, public sidewalk); 238140 - Cement block laying; 238220 - Heating, ventilation and air-conditioning (HVAC) contractors; 238290 - Boiler and pipe insulation installation; 238320 - Painting and Wall Covering Contractors; 238910 - Site Preparation Contractors; 238990 - Brick paver (e.g., driveways, patios, sidewalks) installation; 332322 - Sheet Metal Work Manufacturing; 561730 - Landscaping Services"
"Cross Cultural Communication Systems, Inc.","Face to Face Interpreting services written translations culture competrncy trainings.;","P. O. Box 2308","Woburn","MA",,"781-729-3736","781-729-1217","zarujo_lane@embracingculture.com","541930 - Translation and Interpretation Services"
"Crossroads JV, LLC","Painting and Wall Covering Contractors, flooring contractors and remediation services","1025 Old Country Road, Suite 300 AW","Westbury","NY",,"516-605-1122",,"sheetal@crossroadsjv.com","238320 - Bridge painting; 238320 - Painting (except roof) contractors; 238320 - Rustproofing (except automotive); 238330 - Floor laying, scraping, finishing and refinishing; 562910 - Lead paint abatement services; 562910 - Lead paint removal contractors"
"Cross-Spectrum Acoustics Inc","Acoustical consulting services.","P.O. Box 90842","Springfield","MA",,"413-315-5770","413-315-5770","dbe@csacoustics.com","541330 - Acoustical engineering consulting services; 541380 - Testing Laboratories; 080E - NOISE"
"Cruz Concrete & Guniting Repair Inc","Cruz Concrete & Guniting Repair, Inc. is a speciality concrete repair company. We pride ourselves in the restoration, rehabilitation and reconstruction of all types of concrete structures.","1405 WINESAP DRIVE","MANASQUAN","NJ","Monmouth","732-223-2206","732-223-2373","cruzconcrete@gmail.com","238110 - Foundation, building, poured concrete, contractors; 238190 - Other Foundation, Structure, and Building Exterior Contractors; K-CONCRETE - Concrete; K-FIREPROO - Fireproofing"
"CRYSTAL MCKENZIE INC","Advertising & Marketing; Graphic Designers and services; Marketing Research and Analysis, experimental graphic design services, wayfinding, interpretation and place making, planning, design development, documentation, construction supervision, infrastructure, architecture, transportation, parks, puclic places, marketing communication services, creative services, brand integration, web development","220 EAST 23rd STREET, Suite 305","NEW YORK","NY","New York","212-598-4567","212-598-4566","cmckenzie@cminyc.com","541613 - Marketing management consulting services; 91522 - Communications Marketing Services; 91876 - Marketing Consulting; 92078 - Web Site Development; 96153 - Marketing Service, Including Distribution, Public Opinion Surveys, Research, Sales Promotions, etc.; 96546 - Graphic Design Services for Printing; C-GRAPHICS - Graphics; R-CAD/CAM* - Cad/Cam; R-INTRDSGN - Interior Designers; R-PROJMGMT - Project Management; U-GRAPHICS - Graphics"
"CS Bell Inc.","Masonry; Brick Veneer; Bricklaying; Cement Block; Cinder Block; Chimney; Field Stone; Fireplace; Foundation; Glass; Granite; Marble; Pointing; Caulking; Refractory Brick; Retaining Wall; Slate; Stonework","2157 N. Dover Street","Phila","PA",,"215-827-6200","215-763-1345","ccsbell@aol.com","238140 - Masonry Contractors; 238990 - All Other Specialty Trade Contractors"
"CSM ENGINEERING P C","ENGINEERING SERVICES;","626 RXR PLAZA","UNIONDALE","NY","Nassau","516-378-4887","516-378-1938","hgd@csmengineering.com","237310 - Highway, Street, and Bridge Construction; 541330 - Engineering services; 541820 - Public relations agencies; 010A - HIGHWAY DESIGN PHASES I-IV; 010B - HIGHWAY DESIGN PHASES V-VI; 010C - ROADWAY LIGHTING; 010D - DRAINAGE; 010E - UTILITIES; 010F - CONSTRUCTIBILITY; 010G - ESTIMATING; 010I - BRIDGE INSPECTION; 010J - BRIDGE DESIGN PHASES I-IV; 010K - BRIDGE DESIGN PHASES V-VI"
"CTR Cleaning Inc.","LABOR LEASING FOR CONSTRUCTION PROJECTS;","814 HEWITT PLACE","BRONX","NY","Bronx","718-378-2081","917-560-6137","ctr719@aol.com","561330 - Professional Employer Organizations"
"CUENCA CORONEL TRUCKING, INC.","Transportation of solid Construction Waste.;","74 Academy Street","Belleville","NJ",,"973-583-3523","973-542-8388","cuenca_coronel@cctruckinginc.com","484220 - Specialized Freight (except Used Goods) Trucking, Local; 810 - Trucking - Freight - Container"
"CULINARY CONCEPTIONS, LLC","We offer full architectural and interior design services.","8 STABLE CT","OWING MILLS","MD",,"410-998-3887","410-908-9344","bonnie@culinary-conceptions.com","236220 - Commercial and Institutional Building Construction; 238290 - Other Building Equipment Contractors; 425120 - Wholesale Trade Agents and Brokers; 541340 - Drafting services; 541410 - Interior design services; 541420 - Industrial design services; 541430 - Graphic design services; 541490 - Other Specialized Design Services"
"Cuozzo Construction Corp","Trucking;","27 Lincoln Avenue","Crompond","NY","Westchester","914-906-3817",,"acooz54@aol.com","484110 - Trucking, general freight, local; 830 - Trucking - Loose material"
"Curdco, LLC","Railroad construction & maintenance.;","2746 A Maidens Loop","Maidens","VA",,"804-556-9157","513-226-2512","danny@curdco.com","237990 - Other Heavy and Civil Engineering Construction; 675 - RAILROAD TRACK AND APPURTENANCES"
"Current Design & Drafting Solutions, LLC","Computer aded design and drafting services for civil infrastructure, systems, and architectural projects and file management.","P.O. Box 821","DeSoto","TX",,"214-208-4957","972-223-6116","raymond.current@cddsllc.com","541340 - Drafting services; 541512 - Computer Systems Design Services"
"Currito NJ Inc.","Quick serving restaurant.","355 Lynn Street","Harrington Park","NJ","Bergen","201-722-9376","201-722-9376",,"72231 - Food Service Contractors; U-FOODSRVC - Food Service"
"CUSTOM INTEGRATED SYSTEMS","INSTALLATION OF AUDIO VISUAL SYSTEMS; MOTORIZED SHADING AND LIGHTING; TELECOMMUNICATION AND DATA NETWORKING; CCTV/SECURITY, CONTROL SYSTEMS ; AND LOW VOLTAGE WIRING; ;","92-18 ROCKAWAY BEACH BLVD","ROCKAWAY BEACH","NY","Queens","212-255-7991",,"victorrivera@c-i-s-tech.com","238210 - Alarm system (e.g., fire, burglar), electric, installation only; 238210 - Audio equipment installation (except automotive) contractors; 238210 - Computer and network cable installation; 238210 - Electrical, electrical wiring, and low voltage electrical work; 238210 - Low voltage electrical work; 238210 - Security and fire system, installation only; 238210 - Telecommunications equipment and wiring (except transmission line) installation contractors"
"CUTTING EDGE GROUP LLC","Excavation, Grading, Horizontal Drilling, Construction, Sewer, Utilities, Rip Rap, Gabions, Design, Build, Slope Stabilization, Culvert Installation, Pipe Bursting, Slip Lining, Bypass Pumping, Underdrain, Geotextile, Catch Basin, Man Hole, Storm Water","14 WALKUP CUTOFF ROAD","LAKE GEORGE","NY","Warren","518-798-4151","518-798-4152","tea@cuttingedge-group.com","237110 - Water and Sewer Line and Related Structures Construction; 237990 - Other Heavy and Civil Engineering Construction; 238110 - Poured Concrete Foundation and Structure Contractors; 238120 - Structural Steel and Precast Concrete Contractors; 238910 - Site Preparation Contractors; 541330 - Engineering services; 541620 - Environmental consulting services; 203 - EXCAVATION AND EMBANKMENT; 206 - TRENCH, CULVERT AND STRUCTURE EXCAVATION; 207 - GEOTEXTILE AND PREFABRICATED COMPOSITE DRAINS FOR STRUCTURES; 555 - STRUCTURAL CONCRETE; 586 - MISCELLANEOUS STRUCTURAL RECONSTRUCTION; 603 - CULVERT AND STORM DRAINS; 604 - DRAINAGE STRUCTURES; 010X - UNDERWATER INSPECTION"
"C.V. ASSOCIATES NY; PE, LS, PC","Construction Inspection, Overhead Sign Structure and Bridge Inspection, Land Surveying, Construction Support Services;","148 ROUTE 17M SUITE 2","HARRIMAN","NY","Orange","845-774-1075","845-774-8139","cvany@cvassociatesny.com","237310 - Highway, Street, and Bridge Construction; 541330 - Engineering services; 541370 - Surveying and Mapping (except Geophysical) Services; 541690 - Other Scientific and Technical Consulting Services; 625 - SURVEY OPERATIONS, ROW MARKERS & PERMANENT SURVEY MARKERS; 010I - BRIDGE INSPECTION; 010J - BRIDGE DESIGN PHASES I-IV; 010K - BRIDGE DESIGN PHASES V-VI; 010T - RAILROAD PLANNING AND DESIGN; 010V - WATERFRONT/PORT DESIGN; 040A - LAND SURVEYING/TOPO MAPPING & 3D MODELING; 050A - CONSTRUCTION INSPECTION; 080A - GEOLOGY"
"CVF INC","Concrete Services concrete slip form work curbs gutters sidewalks decorative stamp work;","100 Burkhardt Ave","Depew","NY","Erie","716-836-1673","716-836-6820","rofarru@roadrunner.com","237310 - Highway, Street, and Bridge Construction; 238110 - Poured Concrete Foundation and Structure Contractors; 238190 - Other Foundation, Structure, and Building Exterior Contractors; 238990 - All Other Specialty Trade Contractors; 501 - PORTLAND CEMENT CONCRETE - GENERAL; 502 - PORTLAND CEMENT CONCRETE PAVEMENT; 503 - PORTLAND CEMENT CONCRETE FOUNDATION FOR PAVEMENT; 608 - SIDEWALKS, DRIVEWAYS, AND BICYCLE PATHS; 609 - CURB AND CURB & GUTTERS; 624 - PAVED GUTTERS; 714 - CURBING AND GUTTER"
"C Williams Electrical Construction Inc.","ELECTRICAL CONTRACTOR;","464 SOUTH 10TH AVENUE","MOUNT VERNON","NY","Westchester","914-667-5754","914-667-2893","chris@cwilliamselectric.com","238210 - Electrical Contractors and Other Wiring Installation Contractors"
"CxA Services, LLC","CxA provides consulting services and project management for new & existing buildings. This includes sustainability services and the integration of building information.","1340 Baldwin Road","Yorktown Heights","NY","Westchester","914-299-5488","914-243-0464","awoodlief@aol.com","54131 - Architectural Services; 541618 - Other Management Consulting Services; 541690 - Other Scientific and Technical Consulting Services; 812921 - Photofinishing labs (except one-hour)"
"C. Y. Brother, Inc.","C.Y. Brother, Inc. operates a quick serve Asian Cuisine in Terminal AA 9 at JFK International Airport.","JFK Airport, AA Terminal 9","Jamaica","NY","Queens","718-491-5304","718-632-7837","wcen1@yahoo.com","722310 - Airline food services contractors"
