"company_name","business_description","street_address","city","state","county","phone","fax","email","commodity_codes"
"EPC Consultants, Inc.","EPC Consultants, Inc. provides program, project and construction management for heavy civil construction projects.","655 Davis Street","San Francisco","CA",,"415-675-7580",,"swang@epcconsultants.com","541618 - Other Management Consulting Services"
"EP Venture Group, LLC","ITS Project Management.;","617 S MESA HILLS DR STE A","EL PASO","TX",,"915-545-5025","915-760-6336","ray.gonzalez@epvgroup.com","541512 - Computer Systems Design Services"
"Erudite Consulting Inc.","IT Management Consulting services including IT Optimization, IT Process Consulting, Green IT, Training, Staffing, IT Audit, Governance and Compliance Services.","116 Village Blvd., Suite 200","Princeton","NJ","Mercer","609-454-5977","609-454-5981","shyam.av@eruditeconsulting.com",
"eSense Incorporated","Information Technology consulting and staffing Software development Management and business consulting;","11256 Hearthstone Drive","Fishers","IN",,"317-537-7050","888-505-2236","sanjay.vaze@esnse-inc.com","541511 - Custom Computer Programming Services; 541512 - Computer Systems Design Services; 541513 - Computer Facilities Management Services; 541519 - Other Computer Related Services; 541611 - Administrative Management and General Management Consulting Services; 541612 - Human Resources Consulting Services; 090B - IT TECHNICAL SUPPORT SERVICES, COMPUTER AIDED DESIGN (INFORMATION SYSTEMS); 090C - IT MGMT SERVICES (PROJECT MGMT, ANALYSIS & PLANNING)"
"ESP Enterprises, Inc.","Installation of Fare Boxes;","12423 Cutten Road, Suite B","Houston","TX",,"281-444-2377","888-686-7694","accounting@espenterprisesinc.com","238210 - Electrical Contractors and Other Wiring Installation Contractors; 334514 - Totalizing Fluid Meter and Counting Device Manufacturing"
"E-SQUARED CONSULTING CORPORATION","Transportation consulting in Intelligent Transportation Systems (ITS), commercial vehicle operations (CVO) and intermodal freight, evaluations, assessments, program management, concept design, research, education and outreach transit systems and electronic payment systems (EPS).","43969 Tavern Dr. #200","Ashburn","VA","Loudoun","703-858-5588","703-724-0983","reasley@e-squared.org","54161 - Management Consulting Services; 541614 - Transportation management consulting services; 541618 - Other Management Consulting Services; 611430 - Professional and Management Development Training; C-TRANSPLG - Transportation Planning; R-TRANSPLG - Transportation Planning"
"E-Squared Engineering","Transportation consulting in Intelligent Transportation Systems, commercial vehicle operations and intermodal freight, evaluations, assessments, program management, concept design, research, education and outreach, transit systems, and electronic payment ;","43969 Tavern Drive Suite 200","Ashburn","VA",,"703-858-5588","703-724-0983","reasley@e-squared.org","485111 - Mixed Mode Transit Systems; 541611 - Administrative Management and General Management Consulting Services; 541614 - Process, Physical Distribution, and Logistics Consulting Services; 541618 - Other Management Consulting Services; 611430 - Professional and Management Development Training; 925120 - Administration of Urban Planning and Community and Rural Development; 090J - BUSINESS & FINANCIAL ADVISING"
"Essential Administrative Services","Virtual or Consultive Administrative Services.;","12 Peach Street","Jamestown","NY","Chautauqua","716-640-0253",,"talitha.mascelli@gmail.com","561110 - Office Administrative Services; 561410 - Document preparation services"
"Essential Data Corp.","EDC provides all types of business and technical writing. Services include: user guides, operations & procedures documentation, training manuals, disaster recovery & business continuity plans etc.","585 Villa Avenue, 2nd Floor","Fairfield","CT","Fairfield","203-359-1400","203-547-6345","lbenne@edc.us","611420 - Computer Training"
"Estime Enterprises, Inc.","ENVIRONMENTAL CONSULTING SERVICES","4640 Forbes Blvd, Suite 100","Lanham","MD",,"240-605-7622","301-731-9779","lestime@eei-consulting.com","236118 - Residential Remodelers; 236220 - Commercial and Institutional Building Construction; 237310 - Highway, Street, and Bridge Construction; 237990 - Other Heavy and Civil Engineering Construction; 561210 - Facilities Support Services"
"ETS, Inc","Employment Agency, Staffing, Recruiting;","186 US Oval","Plattsburgh","NY","Clinton","518-562-4673","518-536-9056","dcleary@etsjobs.com","561320 - Temporary help services"
"EurekaFacts, LLC","Marketing Research","51 Monroe Street PE-10","ROCKVILLE","MD",,"240-403-4800","301-610-0640","info@eurekafacts.com","541613 - Marketing consulting services; 541720 - Research and Development in the Social Sciences and Humanities; 541910 - Marketing Research and Public Opinion Polling"
"Evangeline Barbour Designs","Graphic & web design, provides domain registration & hosting & education on website maintenance;","19 Northampton St Apt 202","Buffalo","NY","Erie","716-316-8958",,"eve@evangelinebarbour.com","518210 - Data Processing, Hosting, and Related Services; 541430 - Graphic design services; 541511 - Custom Computer Programming Services"
"Everclear Distribution LLC","Resale of fitness equipment and gym design consulting.","110-45 Queens Blvd, 607","Forest Hills","NY","Queens","917-295-6372",,"fan@fittechgroup.com","425120 - Agents and brokers, durable goods, wholesale trade; B-BROKDEAL - Broker/Dealer; C-DESIGN** - Design; C-HLTHFTNS - Health/Fitness (Exercise, Etc)"
"Eveready Development, LLC","Our primary specialty is interior renovations but as a licensed contractor, this company is also capable of performing demolition, concrete, reinforcing steel and drywall.","220-27 Hempstead Ave","Queens Village","NY","Queens","646-385-9789",,"evereadyhomes@optonline.net","23621 - Industrial Building Construction; 236220 - Commercial and Institutional Building Construction; 236220 - Construction management, commercial and institutional building; 23835 - Finish Carpentry Contractors; 238390 - Other Building Finishing Contractors; 71394 - Fitness and Recreational Sports Centers; K-INTRENOV - Interior Renovations"
"Ewell W. Finley, P.C.","Civil, structural and transportaion engineering and land surveying for clients in government and private industry. Assignments have included: bridges, highways, street reconstruction, hospitals, schools, courthouses, correctional facilities, airports, recreational and raiload facilities.","231 West 29 Street, Suite 500","New York","NY","New York","212-695-7047","212-695-7049","info@ewfpc.com","236220 - Commercial and Institutional Building Construction; 236220 - Construction management, commercial and institutional building; 237310 - Construction management, highway, road, street and bridge; 54131 - Architectural Services; 541330 - Engineering consulting services; 54135 - Building Inspection Services; 541370 - Surveying and mapping services (except geophysical); 541611 - Administrative Management and General Management Consulting Services; 541618 - Telecommunications management consulting services; 541620 - Environmental consulting services; C-CONSMGMT - Construction Mgmt; C-ENGEERNG - Engineering; K-CAD/CAM* - Cad/Cam; K-ENGEERNG - Engineering; K-SURVEYNG - Surveying; R-CAD/CAM* - Cad/Cam; R-CIVIL*** - Civil; R-CONSINSP - Construction Inspection; R-CONSMGMT - Construction Mgmt; R-ENGEERNG - Engineering; R-STRUCTRL - Structural; R-SURVEYNG - Surveying; 010A - HIGHWAY DESIGN PHASES I-IV; 010B - HIGHWAY DESIGN PHASES V-VI; 010C - ROADWAY LIGHTING; 010D - DRAINAGE; 010E - UTILITIES; 010F - CONSTRUCTIBILITY; 010G - ESTIMATING; 010H - SPECIFICATIONS; 010I - BRIDGE INSPECTION; 010J - BRIDGE DESIGN PHASES I-IV"
"EXCEL ENVIRONMENTAL RESOURCES INC",,"111 NORTH CENTER DRIVE","NORTH BRUNSWICK","NJ",,"732-545-9525","732-545-9425","info@excelenv.com","541620 - Environmental consulting services"
"Excelsior Engineering Services PC","PROVIDE ENGINEERING CONSULTING CONSTRUCTION MANAGEMENT;","54-14 74th Street Suite 2214","Elmhurst","NY","Queens","347-339-6688","718-874-0145","excelsioreng@gmail.com","541330 - Engineering services"
"Executive Personnel Servic","Employment agency, administrative clerical, procurement specialist, project management, quality control specialist, legal, IT, hospitality, skilled trades labor and light industrial staffing support.","1200 G Street N.W.Suite 812","Washington","DC",,"202-470-3208","866-433-4454","gms@epsistaffing.com","56121 - Facilities Support Services; 561320 - Temporary help services; 561330 - Employee leasing services; 561330 - Professional Employer Organizations; 91865 - Human Resources, Relations Consulting; U-PRSNLAGY - Personnel Agencies"
"Executive Pest Management, Inc","PEST CONTROL AND EXTERMINATION SERVICES","1213 ELDER AVENUE #3","Bronx","NY","Bronx","917-815-6813","917-815-6813","executivepestmanagement@gmail.com","561710 - Exterminating and Pest control services"
"Ex-Imp Global Inc.","Quality Assurance Fabrication Inspection, Product Verification Inspection, Product Failure Analysis, Cost Reduction Training Waste Elimination, Six Sigma;","41672 Sudbury Court","Novi","MI",,"248-347-1821","248-232-3036","rrungta@eximpglobal.com","541990 - All Other Professional, Scientific, and Technical Services"
"Expedite Construction Management Services Inc.","Roofing, Siding Sheet Metal, Masonry Services, Concrete Foundation and Structure Services","345 WEST 86TH STREET, SUITE 303","NEW YORK","NY","New York","212-787-5989","212-787-5399","info@expediteconstruction.com","238110 - Poured Concrete Foundation and Structure Contractors; 238140 - Masonry Contractors; 238160 - Roofing contractors"
"Expedited Transportation Services, Inc.","A Third party logistics firm providing all aspects of domestic and international transportation.;","1939 Parker Court Suite E","Stone Mountain","GA",,"770-413-1700","770-554-2095","traci@ets-atlanta.com","423990 - Other Miscellaneous Durable Goods Merchant Wholesalers; 960 - Manufacturer Representative/Broker"
"Exquisite Construction Corp.","Residental Construction and Remodeling.","112-52 178th Street","Jamaica","NY","Queens","917-409-8685","718-715-1435","exquisiteconstructioncorp@gmail.com","236118 - Residential Remodelers; 238350 - Finish Carpentry Contractors"
"Eyeris Industries Ltd.","Zeyeris provides marketing products and services to create a solid brand by optimizing business growth services include: consulting marketing campaigns, promotional items and web design, fund raiser, golf tournaments and corporate sponsored events.","39 E. Bartlett Rd.","Middle Island","NY","Suffolk","646-216-8800","631-775-6488","zw@eyerisindustries.com",
"Eyewitness Security System Services, Inc.","INSTALLATION AND MAINTENANCE OF SECURITY SYSTEMS;","48 46 47th STREET","Woodside","NY","Queens","718-431-4259",,"eyewitnessinc@gmail.com","238210 - Electrical Contractors and Other Wiring Installation Contractors"
"EZ CHOW INC","EZ Chow, Inc. is a quick serve asian food airport concession restaurant.","4339 FOX RIDGE COURT","EAGAN","MN","Dakota","612-726-1999","612-726-1999","enbo.zhou@gmail.com","722511 - Full service restaurants"
"Facility Management Advisors LLC","Facility Management Advisors provides strategy expertise in the field of project management, contracts,vendor evaluation .;","7 WAVERLY PLACE","ROCKVILLE CENTRE","NY","Nassau","347-565-8879","866-475-8561","info@facilitymanagementadvisors.com","541611 - Administrative Management and General Management Consulting Services"
"Facility Matters, LLC","Consulting","19 Bayside Avenue","Port Washington","NY","Nassau","631-834-3159","516-944-4023","njohnsonpwny@gmail.com","541611 - Administrative Management and General Management Consulting Services; 541618 - Other Management Consulting Services; 541620 - Environmental consulting services; 541690 - Other Scientific and Technical Consulting Services"
"FAD MARKETING AND CONCESSIONS LLC","Airport operations and marketing consulting.","2622 RAVELLA LANE","PALM BEACH GARDENS","FL","Palm Beach","561-290-9002",,"elmojeda@gmail.com","541613 - Marketing management consulting services"
"FAD MARKETING AND CONCESSIONS LLC","Airport operations and marketing consulting.","2622 RAVELLA LANE","PALM BEACH GARDENS","FL","Palm Beach","561-290-9002",,"elmojeda@gmail.com","541613 - Marketing management consulting services"
"Fagan Consulting, LLC","Provides consulting services in the areas of operations for electronic toll systems","16001 SPILLMAN RANCH LOOP","AUSTIN","TX",,"512-517-8053","512-605-3782","ron@faganconsulting.com","541611 - Administrative Management and General Management Consulting Services; 541614 - Process, Physical Distribution, and Logistics Consulting Services; 541618 - Other Management Consulting Services; 541690 - Other Scientific and Technical Consulting Services"
"Fairbrooks Delivery & Services","Delivery Courier Service","1305 COUNTY LINE ROAD","MORTON","NY","Orleans","585-659-8697",,"dejableu36@aol.com","492110 - Couriers and Express Delivery Services"
"Fai Tat, Inc.","expert operations management","1865 Nw 111th Avenue","Plantation","FL","Broward","321-436-4933","954-472-6355","faitat2007@yahoo.com","541611 - Administrative Management and General Management Consulting Services; 722511 - Family restaurants, full service; 722513 - Limited-Service Restaurants; U-RESTAURN - Restaurants"
"Faith Security Services, Inc.","SECURITY GUARD, TRAINING AND PATROL SERVICES;","3016 GLENWOOD ROAD 2ND FLOOR","BROOKLYN","NY","Kings","718-859-2952","718-859-8952","faithsec002@aol.com","561612 - Security guards and patrol services; 901 - Guard & Patrol Services"
"Falco Mobile Food LLC","Nathan's food, Nathan's products, food, food truck, mobile food products.","157-33 84 streetet","Howard Beach","NY",,"917-750-1642","718-848-3770","falcon31780@msn.com","722330 - Mobile Food Services"
"Falcon Construction Company of Newark, Inc.","Build concrete footings, install brick, curb, sidewalk pavers.","888 Madison Avenue","Union","NJ","Union","908-688-5808","908-688-5808",,"238140 - Masonry Contractors; K-MASONRY* - Masonry"
"Falcon Investigations Corp.","Investigation, Detective, Surveillance and Related Services","471 N Broadway #282","Jericho","NY","Nassau","800-681-4581","800-681-4591","erod@falconinvestigators.com","561611 - Investigation Services; 561612 - Security guards and patrol services"
"Fantasia Accessory","Women's accessories, scarves, shawl, handbags, shoes, sunglasses, vintage jewelry, jackets.","12 Hageman Road","Somerset","NJ","Somerset","732-448-9308","732-448-9308","algadsen@aol.com","42433 - Women's, Children's, and Infants' Clothing and Accessories Merchant Wholesalers"
"Fastech Consulting, LLC","Fastech Consulting is a fast growing engineering firm providing services in the field of Civil, Structural, Transportation and Municipal Engineering, Construction Management and Inspection, Bridge Inspection, Project Management and Information Technology.","288 Fabry Terrace","Teaneck","NJ","Bergen","201-345-4647","201-591-7974","farah.gilani@fastechnj.com","541330 - Engineering consulting services; 541340 - Drafting services; 54135 - Building Inspection Services; C-CONSMGMT - Construction Mgmt; C-ENGEERNG - Engineering; C-TELECOMM - Telecommunications; C-TRANSPLG - Transportation Planning; K-ENGEERNG - Engineering; K-ESTMATNG - Estimating; K-TELECOMM - Telecommunications; R-CIVIL*** - Civil; R-CONSINSP - Construction Inspection; R-CONSMGMT - Construction Mgmt; R-DRFTSMEN - Draftsmen; R-ENGEERNG - Engineering; R-ESTIMTNG - Estimating; R-PLANNERS - Planners; R-PROJMGMT - Project Management; R-SCHEDLNG - Scheduling; R-STRUCTRL - Structural; R-TELECOMM - Telecommunications; R-TRAFCONT - Traffic Control; R-TRANSPLG - Transportation Planning; R-VALUE*** - Value"
"FAZE ELECTRICAL CONTRACTING INC","ELECTRICAL CONTRACTING;","2384 Adam Clayton Powell Jr. Blvd.","New York","NY","New York","212-222-0833","212-222-0449","faze.electric@gmail.com","238210 - Electrical Contractors and Other Wiring Installation Contractors"
"February Enterprises, Inc.","February Enterprises, Inc. provides the following: mechanical installation of airport baggage systems, conveying systems for industry, machinery installation and installation of building equipment, maintenance of baggage systems.","6740 Lowell Blvd.","Denver","CO","Adams","303-429-5457","303-429-5065","fbenavidez@febent.com","23812 - Structural Steel and Precast Concrete Contractors; 238220 - Ventilating contractors; K-MECHNCAL - Mechanical; K-MISCMETL - Misc Metals; K-STEELERE - Steel Erection; R-MECHANCL - Mechanical"
"Femmy by Design Corp","Interior & Exterior Painting and Carpentry","23 Van Cortlandt Place","Cortlandt Manor","NY","Westchester","203-788-3188","914-743-1315","femmybydesign@hotmail.com","238320 - Painting and Wall Covering Contractors"
"Fennick McCredie Architecture, Ltd.","Architectural Services","70 Franklin Street, 2nd Floor","Boston","MA","Suffolk","617-350-7900","617-350-0051","info@fmarchitecture.com","541310 - Architectural (except landscape) services"
"Ferry Iron Works and Erector LLC",,"90-92 Frelinghuysen Ave.","Newark","NJ","Essex","973-242-0868","973-242-0837","ferryerectors@optimum.net","23812 - Structural Steel and Precast Concrete Contractors; 238190 - Ornamental metal work installation; K-MISCMETL - Misc Metals; K-STEELERE - Steel Erection; K-STEELFAB - Steel Fabrication"
"Field Associates, P.C.","Environmental, Structural, Civil, Electrical, Mechanical, Architectural and Construction Management;","379 NASSAU ROAD","ROOSEVELT","NY","Nassau","516-378-2794","516-378-4995","lfield2272@aol.com","237310 - Highway, Street, and Bridge Construction; 238910 - Site Preparation Contractors; 541330 - Engineering services; 541620 - Environmental consulting services; 010A - HIGHWAY DESIGN PHASES I-IV; 010B - HIGHWAY DESIGN PHASES V-VI; 010C - ROADWAY LIGHTING; 010D - DRAINAGE; 010E - UTILITIES; 010H - SPECIFICATIONS; 010I - BRIDGE INSPECTION; 010J - BRIDGE DESIGN PHASES I-IV; 010K - BRIDGE DESIGN PHASES V-VI; 010M - TRAFFIC ENGINEERING, MODELING & FORECASTING"
"Filly Fabricating, Inc.","Assembly and Kitting Service for Transportation Industry and other Electro Mechanical General;","3916 Crooked Run Road, Suite A","North Versailles","PA",,"412-896-6452","412-512-8341","korykiczan@fillyfab.net","423830 - Industrial Machinery and Equipment Merchant Wholesalers; 423860 - Transportation Equipment and Supplies (except Motor Vehicle) Merchant Wholesalers; 488991 - Packing and Crating; 488999 - All Other Support Activities for Transportation"
"FIRST ALERT SECURITY SERVICES INC","SECURITY GUARD SERVICES & TRAINING ;","2174 Fulton Street","Brooklyn","NY","Kings","718-922-0214","718-506-6066","firstalert2009@yahoo.com","561612 - Security guards and patrol services; 611519 - Other Technical and Trade Schools"
"First Choice Mechanical Inc.","HEATING VENTILATION AND AIR CONDITIONING SERVICES HVAC;","92-13 183RD STREET","Hollis","NY","Queens","718-454-4101","718-454-4105","andrea.moyen@firstchoicemech.com","333415 - Air-Conditioning and Warm Air Heating Equipment and Commercial and Industrial Refrigeration Equipment Manufacturing; 917 - Building Construction - HVAC"
"First Choice Supply Inc.","Motor vehicle supplies supplier","2909 Waycross Drive","MONROE","NC","Union","704-275-1566","704-275-1496","staro@fcs-i.com","423120 - Motor Vehicle Supplies and New Parts Merchant Wholesalers; 423130 - Tire and Tube Merchant Wholesalers; 424720 - Petroleum and Petroleum Products Merchant Wholesalers (except Bulk Stations and Terminals); 561622 - Locksmiths"
"First Choice Supply Inc.",,"2909 Waycross Drive","MONROE","NC",,"704-275-1566","704-275-1496","staro@fcs-i.com","423120 - Motor Vehicle Supplies and New Parts Merchant Wholesalers; 423130 - Tire and Tube Merchant Wholesalers; 424690 - Other Chemical and Allied Products Merchant Wholesalers; 424720 - Petroleum and Petroleum Products Merchant Wholesalers (except Bulk Stations and Terminals); 425120 - Wholesale Trade Agents and Brokers; 561622 - Locksmiths"
"First Class Concessions, Inc.","First Class Concessions, Inc. is a food & beverage airport concessions company.","12118 Ferncrest Place","San Diego","CA","San Diego","858-487-8984","858-487-8987","vakharia@firstclassconcessions.com","72231 - Food Service Contractors; U-FOODSRVC - Food Service"
"First Person Video LLC","First Person Video is a production company that specializes in video reports for online, for presentations and fund-raisers, and for instructional purposes.","25 East End Avenue","New York","NY","New York","646-772-7917",,"celestefordnyc@gmail.com",
"First Star Auto Repair Inc","FLEET AUTO MAINTENANCE AND REPAIR SERVICES;","813 MORRIS PARK AVE","BRONX","NY","Bronx","917-418-4087",,"aissa@daimner.com","811111 - General Automotive Repair"
"FirstWorld USA, Inc.","Computer & Peripheral Reseller.;","163 Amory Street","Brookline","MA",,"617-731-6319","617-277-1984","kathy@terminal.com","532420 - Office Machinery and Equipment Rental and Leasing"
"FITZGERALD & HALLIDAY, INC.","Transportation and Environmental Planning Consulting Services;","416 ASYLUM ST","HARTFORD","CT",,"860-247-7200","860-247-7206","rfitzgerald@fhiplan.com","541620 - Environmental consulting services; 070A - COMMUNITY PARTICIPATION/PUBLIC RELATIONS/OUTREACH; 070B - URBAN PLANNING & FORECASTING; 080B - AIR QUALITY; 080C - WATER QUALITY; 080D - WETLANDS; 080E - NOISE; 080F - ECOLOGY; 080G - ARCHEOLOGY; 080J - VISUAL RESOURCE; 080K - CULTURAL RESOURCE ASSESSMENT"
"Five23 dba Lumenor Consulting Group","Custom Computer Programming Services, Computer Systems Design Services, Administrative Management and General Management Consulting Services;","115 S SMEAD CT","ROSWELL","GA",,"404-918-9078","404-348-4829","bkarra@lumenorconsulting.com","541511 - Custom Computer Programming Services; 541512 - Computer Systems Design Services; 541611 - Administrative Management and General Management Consulting Services"
"Flash Exterminating, Inc.","EXTERMINATING SERVICES","164 MAUJER STREET","BROOKLYN","NY","Kings","888-752-0584","347-689-3154","flashexterminating@gmail.com","561710 - Exterminating and Pest control services"
"Flavio Aguirre Corp.","The services that our firm provides is trucking -- transportation of materials such as stone, concrete, soil, asphalt, snow, etc.","699 BROADWAY","NEWARK","NJ","Essex","973-390-5863","862-763-4622","elidaaguirre@aol.com","484220 - Specialized Freight (except Used Goods) Trucking, Local"
"Florence Construction Corporation","Excavation, Trucking, equipment rental and site preperation, clearing to landscape.;","P.O. Box 195","Saint James","NY","Suffolk","631-584-4460","631-584-5720","fchilton@floconstcorp.com","237310 - Highway, Street, and Bridge Construction; 238910 - Site Preparation Contractors; 238990 - All Other Specialty Trade Contractors; 423390 - Other Construction Material Merchant Wholesalers; 484110 - General freight trucking, local; 484220 - Specialized Freight (except Used Goods) Trucking, Local; 532412 - Construction, Mining, and Forestry Machinery and Equipment Rental and Leasing; 561730 - Landscaping Services; 201 - CLEARING GRUBBING; 203 - EXCAVATION AND EMBANKMENT; 206 - TRENCH, CULVERT AND STRUCTURE EXCAVATION; 609 - CURB AND CURB & GUTTERS; 610 - GROUND VEGETATION - PREPARATION, ESTABLISHMENT AND MANAGEMENT; 619 - WORK ZONE TRAFFIC CONTROL; 729 - TEMPORARY TRAFFIC CONTROL DEVICES; 810 - Trucking - Freight - Container; 820 - Trucking - Freight - Flatbed; 830 - Trucking - Loose material; 910 - Equipment Rental & Leasing w/o Operator"
"Florence Construction Corporation",,"80 LAKE AVENUE SOUTH UNIT 10","NESCONSET","NY",,"631-584-4460","631-584-5720","fchilton@floconstcorp.com",
"Floura Teeter Landscape Architects, Inc.","Landscape Architect Services;","800 N CHARLES ST., SUITE 300","BALTIMORE","MD",,"410-528-8395","410-528-8425","jfloura@ftla.com","541320 - Landscape architectural services; 030A - LANDSCAPE ARCHITECTURE; 070A - COMMUNITY PARTICIPATION/PUBLIC RELATIONS/OUTREACH; 070B - URBAN PLANNING & FORECASTING"
"Flushing Blueprint, Inc.","Reprographics.","134-24 Northern Blvd.","Flushing","NY","Queens","718-463-1900","718-358-7054","nyrepro@verizon.net","541340 - Drafting services"
"Flying Leap, Inc.","ACDBE Airport Concessions operator and owner in retail, business and food and beverage. Airport Concessions consultant.","2854 North Hills Dr NE","Atlanta","GA","Fulton","404-234-5474","404-393-3569","anita_l@bellsouth.net","448150 - Clothing accessories stores; 541611 - Administrative Management and General Management Consulting Services; 541820 - Public relations agencies; 812331 - Uniform (except industrial) supply services; C-ADMINMGT - Administrative Management Services; U-ADMNMGMT - Administrative Management Consulting Services"
"Flying Retail LLC","food service, duty-free retail and management consulting firm.","105 W. Adams Street Suite 2313","Chicago","IL","Cook","773-844-8714","312-264-0783","eflores@flyingretail.com",
