"company_name","business_description","street_address","city","state","county","phone","fax","email","commodity_codes"
"Aussie Painting Corp.","Bridge Painting;","288 PARK AVENUE","MANHASSET","NY","Nassau","516-524-9967","516-365-6699","velliosirene@yahoo.com","237310 - Highway, Street, and Bridge Construction; 570 - PAINT REMOVAL OPERATIONS; 571 - TREATMENT AND DISPOSAL OF PAINT REMOVAL WASTE; 619 - WORK ZONE TRAFFIC CONTROL; 633 - CONDITIONING EXISTING PAVEMENT PRIOR TO HOTMIX ASPHALT (HMA) OVERLAY; 915 - Building Construction - General"
"A Vaillancourt LLC","Landscaping site work dump truck and snowplowing services;","10364 COUNTY ROAD","CLARENCE","NY","Erie","716-741-3555","716-741-5551","vaill03@verizon.net","238910 - Site Preparation Contractors; 484220 - Specialized Freight (except Used Goods) Trucking, Local; 561730 - Landscaping Services; 201 - CLEARING GRUBBING; 202 - REMOVAL OF STRUCTURES & OBSTRUCTIONS; 610 - GROUND VEGETATION - PREPARATION, ESTABLISHMENT AND MANAGEMENT; 611 - PLANTING, TRANSPLANTING AND POST PLANTING CARE; 810 - Trucking - Freight - Container; 830 - Trucking - Loose material"
"Avani Technology Solutions Inc","Information Techonology Consulting, Software Applicatons Support & Development, Network & Applications Security Testing, Mobile Applications Development and Software Project Management;","687 Lee Road, Suite 208","Rochester","NY","Monroe","585-584-1316","585-285-4133","sameer.k@avanitechsolutions.com","518210 - Data Processing, Hosting, and Related Services; 541511 - Custom Computer Programming Services; 541512 - Computer Systems Design Services; 541513 - Computer Facilities Management Services"
"Avenue Contracting Inc.","WATERPROOFING MASONRY CONCRETE WORK INTERIOR AND EXTERIOR BUILDING RENOVATION CERTIFIED ROOFER LICENSE RIGGER","6723 Fresh Meadow Ln.","Fresh Meadows","NY","Queens","347-419-7878","718-795-1957","avenuecon@gmail.com","238110 - Poured Concrete Foundation and Structure Contractors; 238140 - Masonry Contractors; 238160 - Roofing contractors; 238390 - Other Building Finishing Contractors"
"Aviation Alliance, Inc.","Aviation Alliance, Inc. is a consulting engineering firm specializing primarily in airport/airspace consultancy, airfield civil and electrical design, NAVAIDS and power system studies.","101 Timberline Dr. North","Colleyville","TX","Tarrant","817-498-0388","817-281-1867","shirley@aviationallianceinc.com","236220 - Addition, alteration and renovation, commercial and institutional building; 488119 - Other Airport Operations; 541330 - Electrical engineering services; 541614 - Logistics management consulting services; 541614 - Physical distribution consulting services"
"Aviation Security Consulting, Inc","Aviation security and operations consulting.","7032 Turweston Lane","Castle Rock","CO","Douglas","303-663-3618","303-663-3618","lbeckman@avsec.biz","541614 - Freight rate consulting services; 541614 - Freight traffic consulting services; 541614 - Process, Physical Distribution, and Logistics Consulting Services; 541614 - Transportation management consulting services"
"Aviation Security Consulting, Inc","Aviation security and operations consulting.","7032 Turweston Lane","Castle Pines","CO","Douglas","303-663-3618","303-663-3618","lbeckman@avsec.biz","541614 - Freight rate consulting services; 541614 - Freight traffic consulting services; 541614 - Process, Physical Distribution, and Logistics Consulting Services; 541614 - Transportation management consulting services"
"Avila Consultants, LLC","CPM scheduling services.","116 FAIRFIELD ROAD","FAIRFIELD","NJ","Essex","973-575-6327","973-575-6293","info@avilacpm.com","541611 - Administrative Management and General Management Consulting Services"
"Aviman Management, LLC","Construction management, manage commercial and residential construction.","170 Sugarberry Drive","New Castle","DE",,"302-377-5788","302-543-7403","levi@avimanagement.com","236210 - Industrial Building Construction; 236220 - Commercial and Institutional Building Construction; 237310 - Highway, Street, and Bridge Construction"
"A & V Steel LLC","A & V Steel, LLC specializes in structural and miscellaneous fabrication and installation of steel.","144-21 106TH AVENUE","JAMAICA","NY","Queens","718-674-6677","718-674-6671","avsteelcon@aol.com","238120 - Structural Steel and Precast Concrete Contractors; K-MISCSTEE - Misc Steel; K-STRSTEEL - Structural Steel"
"AWA Lighting Designers Inc","ARCHITECTURAL LIGHTING DESIGN AND CONSULTING SERVICES","61 Greenpoint Avenue Suite 306","Brooklyn","NY","Kings","212-473-9797",,,"541490 - Other Specialized Design Services"
"Axela Services LLC","Material Supplier to Bridge Highway;","P.O. Box 652","MOUNT KISCO","NY","Westchester","914-244-0046","914-244-0068","maria@axelaservices.com","423390 - Other Construction Material Merchant Wholesalers; 701 - HYDRAULIC CEMENTS; 702 - BITUMINOUS MATERIAL; 705 - JOINT MATERIALS; 709 - REINFORCING STEEL; 711 - CONCRETE CURING MATERIALS AND ADMIXTURES; 712 - MISCELLANEOUS; 713 - LANDSCAPE DEVELOPMENT MATERIALS; 717 - CONCRETE PROTECTIVE COATINGS; 721 - CONCRETE ADHESIVES AND REPAIR MATERIALS; 726 - DETECTABLE WARNING UNITS; 728 - COMPRESSIVE LOAD TRANSMITTING DEVICES; 729 - TEMPORARY TRAFFIC CONTROL DEVICES; 735 - CONCRETE CYLINDER CURING BOX; 737 - GEOSYNTHETICS"
"AYALA'S CONCESSION GROUP, INC.","Ayala's Concession Group, Inc. is a airport concession firm that provides the sale of women's fashion, jewelry and accessories.","2190 E. PEBBLE RD., SUITE 260","LAS VEGAS","NV","Clark","702-369-6500","702-369-6502","brian@tagsevolution.com","448150 - Clothing accessories stores; 451212 - News Dealers and Newsstands; 453220 - Gift, Novelty, and Souvenir Stores; 453998 - All Other Miscellaneous Store Retailers (except Tobacco Stores)"
"AZH Construction & Consulting Corp","Project Controls Cost Estimating Scheduling Project Management Shop Drawings drafting BIM Drawings conversion","118-18 Union Turnpike, Suite #4H","Kew Gardens","NY","Queens","718-902-8619","866-439-0395","contact@azhconstruction.com","541340 - Drafting services; 541990 - All Other Professional, Scientific, and Technical Services"
"B2Gnow Test Vendor 10","Concrete floor surfacing","253 W Washington","Phoenix","AZ","Navajo","888-694-7458","888-694-7458","test@b2gnowuser.com","238110 - Concrete floor surfacing"
"Backstrom McCarley Berry & Co., LLC","INVESTMENT BANKING , Portfolio Management, Commodities Services, Financial Investment Advice Services, Financial Planning Services;","115 Sansome Street, Mez A","San Francisco","CA",,"415-392-5505","415-392-5276","vmccarley@bmcbco.com","523110 - Investment Banking and Securities Dealing; 523920 - Portfolio Management; 523930 - Investment Advice; 523999 - Miscellaneous Financial Investment Activities"
"Badger Machinery, Inc.","Equipment rental, small highway projects, paving and demolition work.","3170 BORDENTOWN AVENUE","OLD BRIDGE","NJ","Middlesex","732-525-9600","732-721-0588","angela@badgermachinery.com","237310 - Highway, Street, and Bridge Construction; 237990 - Other Heavy and Civil Engineering Construction; 238910 - Site Preparation Contractors; 484220 - Specialized Freight (except Used Goods) Trucking, Local; 532412 - Construction, Mining, and Forestry Machinery and Equipment Rental and Leasing"
"B-A ENGINEERING, P.C.","ENGINEERING SERVICES;","139 FULTON STREET SUITE 310","NEW YORK","NY","New York","212-285-0701","212-285-0642","umesh.avadhani@baepc.com","541330 - Engineering services; 010A - HIGHWAY DESIGN PHASES I-IV; 010B - HIGHWAY DESIGN PHASES V-VI; 010D - DRAINAGE; 010G - ESTIMATING; 010H - SPECIFICATIONS; 010L - TRANSPORTATION PLANNING; 010M - TRAFFIC ENGINEERING, MODELING & FORECASTING; 010N - SIGNALS; 010O - SIGNING; 010U - AVIATION PLANNING AND DESIGN"
"BAE Urban Economics, Inc.","We provide urban development advisory and real estate economics consulting services.","1285 66th Street","Emeryville","CA","Alameda","510-547-9380","510-547-9388","jsmithheimer@bae1.com","541618 - Other Management Consulting Services; 541690 - Other Scientific and Technical Consulting Services; 541810 - Advertising agencies"
"BAG-IT INC","SUPPLIER OF CONSTRUCTION BAGS;","42-04 243RD STREET","DOUGLASTON","NY","Queens","718-224-6137","718-423-5634","mcgillicks@aol.com","444190 - Other Building Material Dealers; 201 - CLEARING GRUBBING"
"Bailey Engineers & Constructors, Inc.","Providing Professional Engineering, Construction Management and Inspection Services for major Infrastructure Projects.;","1219 Monterey Street","Pittsburgh","PA",,"412-323-9237","412-405-3028","aibailey@baileyec.com","236220 - Commercial and Institutional Building Construction; 237110 - Water and Sewer Line and Related Structures Construction; 237310 - Highway, Street, and Bridge Construction; 541330 - Engineering services; 010D - DRAINAGE; 010E - UTILITIES; 010F - CONSTRUCTIBILITY; 010R - MECHANICAL DESIGN; 010S - ELECTRICAL DESIGN; 050A - CONSTRUCTION INSPECTION; 050C - CONSTRUCTION MANAGEMENT"
"Baker Ready Mix, LLC","Baker Ready Mix manufactures and delivers Ready-Mix concrete products, construction materials and aggregates for use in Louisiana, Georgia, Texas and New York through fixed permanent and mobile plant facilities and operations.","2800 Frenchmen Street","New Orleans","LA","Orleans","504-947-8081","504-947-8085","abaker@bakerreadymix.com","327320 - Ready-mix concrete manufacturing and distributing"
"Ballard Associates, LLC","NAICS 54161, Administrative and General Management Consulting Services, NAICS 561110, Office Administration Services ;","6816 Retreat","West Bloomfield","MI","Oakland","313-399-5627","248-862-6464","ballard.associatesllc@gmail.com","541611 - Administrative Management and General Management Consulting Services; 561110 - Office administration services"
"Ballard Associates, LLC","NAICS 54161, Administrative and General Management Consulting Services, NAICS 561110, Office Administration Services ;","6816 Retreat","West Bloomfield","MI","Oakland","313-399-5627","248-862-6464","ballard.associatesllc@gmail.com",
"BANC 3, Inc., PC","ENGINEERING SERVICES;","379 PRINCETON HIGHSTOWN ROAD","CRANBURY","NJ",,"609-448-6776","609-448-5590","babucherukuri@banc3.com","237310 - Highway, Street, and Bridge Construction; 541330 - Engineering services; 541620 - Environmental consulting services; 010A - HIGHWAY DESIGN PHASES I-IV; 010B - HIGHWAY DESIGN PHASES V-VI; 010D - DRAINAGE; 010E - UTILITIES; 010F - CONSTRUCTIBILITY; 010G - ESTIMATING; 010H - SPECIFICATIONS; 010I - BRIDGE INSPECTION; 010J - BRIDGE DESIGN PHASES I-IV; 010K - BRIDGE DESIGN PHASES V-VI"
"B and S Construction, Inc.","General Construction; Flooring; Painting; Carpentry; Construction Management; Remodeling and Alterations; ;","442 MADISON ST SUITE 2B","BROOKLYN","NY","Kings","347-893-1897","347-787-6901","bryantshannon84@gmail.com","236116 - Construction management, multifamily building; 236116 - Multifamily building construction general contractors; 238320 - Painting and Wall Covering Contractors; 238330 - Flooring Contractors"
"Barbara J. Sales Associates, Inc.","Focused on the education and promotion of building materials in the commercial construction market, serving architects,general contractors, and installers.","220 Edgewood Dr","Sarver","PA",,"412-523-3398","800-813-7122","barbarajsales@verizon.net","425120 - Wholesale Trade Agents and Brokers"
"Barbara Thayer PE Arch Landscape Architecture LS DPC","ENGINEERING, ARCHITECTURAL AND SURVEYING ERVICES, LANDSCAPE ARCHITECTURE;","100 Crossways Park Drive W, Suite 104","Woodbury","NY","Nassau","516-364-0660","516-364-0668","bthayer@bthayerassociates.com","541310 - Architectural Services; 541320 - Landscape architectural services; 541330 - Engineering services; 541370 - Surveying and Mapping (except Geophysical) Services; 541620 - Environmental consulting services; 541820 - Public relations agencies; 625 - SURVEY OPERATIONS, ROW MARKERS & PERMANENT SURVEY MARKERS; 010A - HIGHWAY DESIGN PHASES I-IV; 010B - HIGHWAY DESIGN PHASES V-VI; 010D - DRAINAGE; 010E - UTILITIES; 010H - SPECIFICATIONS; 010I - BRIDGE INSPECTION; 010J - BRIDGE DESIGN PHASES I-IV; 010K - BRIDGE DESIGN PHASES V-VI; 010M - TRAFFIC ENGINEERING, MODELING & FORECASTING; 020A - ARCHITECTURE; 030A - LANDSCAPE ARCHITECTURE; 040A - LAND SURVEYING/TOPO MAPPING & 3D MODELING; 040B - RIGHT OF WAY DETERMINATION AND MAPPING; 070A - COMMUNITY PARTICIPATION/PUBLIC RELATIONS/OUTREACH; 070B - URBAN PLANNING & FORECASTING; 080F - ECOLOGY; 080G - ARCHEOLOGY; 080J - VISUAL RESOURCE; 080K - CULTURAL RESOURCE ASSESSMENT"
"Barden Contracting Serv, LLC","We provide services in construction management, estimating, project management, and interior finishes. We also provide and install exterior composite panels, curtain wall, windows and doors. Terrazzo floors (speciality) and Ceilings.","160-23 Rockaway Blvd, Suite 4","Queens","NY","Queens","718-341-1065","888-679-8270","dee@bardencontracting.com","237210 - Land (except cemeteries) subdividers; 238130 - Framing contractors; 238190 - Other Foundation, Structure, and Building Exterior Contractors; 23831 - Drywall and Insulation Contractors; 238330 - Flooring Contractors; 23834 - Tile and Terrazzo Contractors; 23835 - Finish Carpentry Contractors"
"BARFIELD PUBLIC RELATIONS INC","Public Relations Agencies ;","638 Macon Street, 3rd Floor","Brooklyn","NY","New York","212-736-0404","718-452-1806","barfieldmedia@gmail.com","541820 - Public relations agencies; 070A - COMMUNITY PARTICIPATION/PUBLIC RELATIONS/OUTREACH; 070B - URBAN PLANNING & FORECASTING; 080K - CULTURAL RESOURCE ASSESSMENT"
"Barrier Cable, Inc.","Provide and install barrier cable for fall protection in parking decks;","665 Lee Road 212","Phenix City","AL",,"334-448-4889","334-448-4889","merri@barriercableinc.com","236220 - Commercial and Institutional Building Construction; 238990 - All Other Specialty Trade Contractors; 607 - FENCES; 915 - Building Construction - General"
"Basano Contracting Inc","Landscape Construction, Tree Consulting, Tree, shrub, perennial and annual plantings, new lawns seed and sod. Tree Consulting, Tree Surveying and Reporting, Tree Prune Inspection and Surveys.","1431 Carlls Straight Path","DIX HILLS","NY","Suffolk","631-864-4296","631-864-5703","basano11746@yahoo.com","237110 - Water and Sewer Line and Related Structures Construction; 238120 - Structural Steel and Precast Concrete Contractors; 238910 - Site Preparation Contractors; 541611 - Administrative Management and General Management Consulting Services; 561730 - Landscaping Services; 209 - SOIL EROSION AND SEDIMENT CONTROL; 610 - GROUND VEGETATION - PREPARATION, ESTABLISHMENT AND MANAGEMENT; 611 - PLANTING, TRANSPLANTING AND POST PLANTING CARE; 620 - BANK AND CHANNEL PROTECTION; 632 - PRECAST MODULAR WALLS; 639 - CONSTRUCTION CONTRACT MANAGEMENT SYSTEMS"
"BASE Architecture, Planning & Engineering, Inc","Architecture and Engineering Design Services, Interior Design, construction and contract management","1500 Market Street, 12th Floor, East Tower","Philadelphia","PA","Los Angeles","215-665-5624","310-988-1085","twebster@base-ae.com",
"BASE Architecture, Planning & Engineering, Inc","Architecture and Engineering Design Services, Interior Design, construction and contract management","1500 Market Street, 12th Floor, East Tower","Philadelphia","PA","Los Angeles","215-665-5624","310-988-1085","twebster@base-ae.com","236220 - Addition, alteration and renovation for-sale builders, commercial and institutional building; 237110 - Aqueduct construction; 237990 - Anchored earth retention contractors; 541310 - Architects' (except landscape) offices; 541330 - Acoustical engineering consulting services; 541410 - Decorating consulting services, interior; 541611 - Administrative Management and General Management Consulting Services; 541620 - Environmental consulting services"
"Baseline Supply LLC","Supplier of Construction Materials and Building Supplies;","65 Turnberry Dr","Monroe Township","NJ",,"732-835-2080","888-398-2080","baselinesupply@gmail.com","423310 - Lumber, Plywood, Millwork, and Wood Panel Merchant Wholesalers; 423330 - Roofing, Siding, and Insulation Material Merchant Wholesalers; 423390 - Other Construction Material Merchant Wholesalers; 423510 - Metal Service Centers and Other Metal Merchant Wholesalers; 423610 - Electrical Apparatus and Equipment, Wiring Supplies, and Related Equipment Merchant Wholesalers; 423710 - Hardware Merchant Wholesalers; 423720 - Plumbing and Heating Equipment and Supplies (Hydronics) Merchant Wholesalers; 423840 - Industrial Supplies Merchant Wholesalers; 424930 - Flower, Nursery Stock, and Florists' Supplies Merchant Wholesalers; 424950 - Paint, Varnish, and Supplies Merchant Wholesalers; 704 - MASONRY UNITS; 705 - JOINT MATERIALS; 706 - CONCRETE, CLAY AND PLASTIC PIPE; 707 - METAL PIPE; 708 - PAINTS; 709 - REINFORCING STEEL; 712 - MISCELLANEOUS; 713 - LANDSCAPE DEVELOPMENT MATERIALS; 715 - CASTINGS, FORGINGS AND METALS; 716 - BEARINGS AND EXPANSION PLATES; 720 - PILES; 723 - LIGHTING; 724 - TRAFFIC SIGNALS; 725 - MISCELLANEOUS METALS AND PLASTICS; 737 - GEOSYNTHETICS"
"Base One Technologies Inc.","Cyber security, network engineering, software/application development, cloud based services and architecture, enterprise database services, system integration, data center migration & consolidation, IT transformations, project & process management.","30 Church Street, Suite 28","NEW ROCHELLE","NY","Westchester","914-633-0200","914-633-5287","liza@base-one.com","541511 - Applications software programming services, custom computer; 541511 - Computer program or software development, custom; 541511 - Computer programming services, custom; 541511 - Custom Computer Programming Services; 541511 - Software analysis and design services, custom computer; 541512 - Computer software consulting services or consultants; 541512 - Computer Systems Design Services; 541512 - Computer systems integration analysis and design services; 541513 - Computer Facilities Management Services; 541513 - Computer systems facilities (i.e., clients' facilities) management and operation services; 541513 - Data processing facilities (i.e., clients' facilities) management and operation services; 541513 - Facilities (i.e., clients' facilities) management and operation services, computer systems or data processing; 541513 - Facilities (i.e., clients' facilities) support services, computer systems or data processing; 541519 - Computer disaster recovery services; 541519 - Other Computer Related Services; 541519 - Software installation services, computer; 541618 - Other Management Consulting Services; 541618 - Telecommunications management consulting services; 541690 - Other Scientific and Technical Consulting Services"
"BBA Project, Inc.","Delivery Service, General Warehousing and Storage, Sub-Assembly of Railroad Equipment, Supplier of Railroad Equipment and Supplies, Supplier of Electrical Apparatus and Equipment","8 Westchester Plaza","Elmsford","NY","Westchester","914-345-3888","914-345-8667","bba.ny@bbaproject.com","336510 - Railroad rolling stock manufacturing; 423610 - Electrical Apparatus and Equipment, Wiring Supplies, and Related Equipment Merchant Wholesalers; 423860 - Transportation equipment and supplies (except marine pleasure craft, motor vehicles) merchant wholesalers; 492210 - Local Messengers and Local Delivery; 493110 - General warehousing and storage"
"BBG Consulting LLC","Security Consulting Services, Security Systems Design Services, Financial Risk Investigation Services;","8 Rosa Drive","White Plains","NY","Westchester","917-727-1173","918-547-3713","cbell@thebellbuskeygroup.com","524298 - All Other Insurance Related Activities; 524298 - Insurance investigation services (except claims investigation); 541690 - Other Scientific and Technical Consulting Services; 561621 - Security system monitoring services; 561621 - Security Systems Services (except Locksmiths)"
"B & B Iron Works of Dutchess LLC","Fabrication of miscellaneous & Ornamental steel structural steel.","72 Airport Drive Suite 104","Wappingers Falls","NY","Dutchess","845-849-3837","845-849-3839","bbironwork@gmail.com","332312 - Fabricated structural metal manufacturing; 940 - Fabricator"
"B & B Lighting Supply, Inc.","B & B Lighting Supply Inc, d/b/a B&B Lighting Supply and Recycling Center provides bulbs, ballast, fixtures, batteries, and also a recycling center.","P. O. BOX 68084","BALTIMORE","MD","Baltimore","410-523-7300","410-523-1900","sbradford@bnblightingsupply.com",
"Beach Erectors, Inc.","Beach Erectors furnishes and installs miscellaneous metals. This includes but is not limited to stairs, railings, partions, window guards, detention and security products.","54 ALABAMA AVENUE","ISLAND PARK","NY","Nassau","516-432-5757","516-432-6417","main@beacherectors.com","238190 - Ornamental metal work installation; 332323 - Ornamental metalwork manufacturing; K-MISCMETL - Misc Metals"
"Beacon Restoration Inc.","We install roofs and do masonry restoration which includes all facade repair, caulking, lintels, brick repalcement lintels, stone etc.","222 East 8th Street, Suite #5L","Brooklyn","NY","Kings","718-274-2453","718-437-4654","smuhammadr@aol.com","238140 - Masonry Contractors; K-MASONRY* - Masonry"
"Beam Enterprises, Inc","Management Consulting Services, Mold Remediation Services, Interior Demolition Services","111 John Street, Suite 538","New York","NY","New York","917-775-9333","732-355-6001","brian@beamenterprisesinc.com","238390 - Other Building Finishing Contractors; 238910 - Site Preparation Contractors; 238990 - All Other Specialty Trade Contractors; 541611 - Administrative Management and General Management Consulting Services"
"Bear Business Ventures, LLC","Construction Project Management; Risk Management; Infrastructure Alignment Improvement Services (IAIS); Government RFP Preparation Services; Vendor Management","333 N. Broad Street, STE 208","Elizabeth","NJ","Union","908-662-7166","908-660-0503","support@grrconstruction.com","236220 - Construction management, commercial and institutional building; 541618 - Other Management Consulting Services; 95826 - Construction Management Services; 95877 - Project Management Services; R-PROJMGMT - Project Management"
"Bearings & Industrial Supply Company, Inc.","DISTRIBUTOR OF BEARINGS POWER TRANSMISSIONS COMPONENTS AND INDUSTRIAL AND ELECTRICAL SUPPLIES;","431 Irmen Drive","Addison","IL",,"630-628-1966","630-628-0116","sales@bearingsnow.com","423840 - Industrial Supplies Merchant Wholesalers; 565 - BRIDGE BEARINGS"
"BEATTYS SERVICES INC","Employment Services and Training.","127 WEST 127TH STREET SUITE 301","NEW YORK","NY","New York","212-932-6063","212-932-0655","myneikab@beattys2.com","561311 - Employment Placement Agencies; 561320 - Temporary help services; 561720 - Janitorial services"
"BECKER TRUCKING","Dump Truck ,Arrangement Of Transportation TruckingTransportation Service;","2676 COUNTY ROUTE 12","CENTRAL SQUARE","NY","Oswego","315-668-9649","315-668-9649","revtrucks@aol.com","484110 - General freight trucking, local; 830 - Trucking - Loose material"
"Behan Associates Landscape Architecture DPC","Landscape Architecture","112 Spring Street Suite 305","Saratoga Springs","NY","Saratoga","518-583-4335","518-583-6970","info@behanplanning.com","541320 - Landscape architectural services; 030A - LANDSCAPE ARCHITECTURE; 070A - COMMUNITY PARTICIPATION/PUBLIC RELATIONS/OUTREACH; 070B - URBAN PLANNING & FORECASTING"
"Bella Management Group, Inc.","General construction, masonry, brickwork, flooring, tile, concrete.","5 TOMS WAY","LA GRANGE","NY","Dutchess","845-592-0165","845-592-0165","bellamgmtgrp@optonline.net","236115 - New Single-Family Housing Construction (except Operative Builders) (deactivated in 2012 codeset); 236220 - Construction management, commercial and institutional building"
"BELLOWS CONSTRUCTION SPECIALTIES LLC","General Contracting","213 WEST ADAMS STREET","SYRACUSE","NY","Onondaga","315-476-4718","315-476-6552","karen@bellowsconst.com","236220 - Commercial and Institutional Building Construction; 238110 - Poured Concrete Foundation and Structure Contractors; 238310 - Drywall and Insulation Contractors; 238350 - Finish Carpentry Contractors; 238910 - Site Preparation Contractors"
"Bennett Bolt Works Inc.","Distribution of fasteners for highway bridge and building construction.;","P.O. Box 922","JORDAN","NY","Onondaga","315-689-3981","315-689-3999","ebennett@bennettbolt.com","332510 - Hardware Manufacturing; 332710 - Machine shops; 332722 - Bolt, Nut, Screw, Rivet, and Washer Manufacturing; 423710 - Hardware Merchant Wholesalers"
"Ben Thompson Associates","Ben Thompson Associates Architects and Planners provide full architectural services. We have conducted extensive serveys and prepared detailed reports for varied purposes: Land use and Economic Development Feasibility Studies. Code Compliance Building Rehabikitation and Restoration Studies and Energy Analysis. Our work includes a broad range of transportation maintenance, storage, rail administrative and specialized facilities for various government agencies. We deal with and execute our pro","1140 Broadway - Suite 501","NEW YORK","NY","New York","212-505-9670","212-505-9842","ben@bta-arch.com","54131 - Architectural Services; C-ARCHTCRL - Architectural; R-ARCHTCRL - Architectural"
"Best Asian Trading Inc.","Supplier; Restaurant-use products","67-19 211th Street","Oakland Gardens","NY","Queens","718-878-4203","718-228-6261","bestasiantrading@gmail.com","424410 - General Line Grocery Merchant Wholesalers"
