"_","n_mero_de_proceso","tipo_de_proceso","estado","entidad","objeto","departamento_y_municipio","cuant_a","fecha","link"
"157","U.M. 005-2020","Contratación Directa (Ley 1150 de 2007)","Liquidado","ANTIOQUIA - ALCALDÍA MUNICIPIO DE SAN ROQUE","“SUMINISTRO DE ELEMENTOS DE PROTECCIÓN Y PAQUETES ALIMENTARIOS PARA ADULTO MAYOR EN EL MARCO DE LA EMERGENCIA DEL COVID-19 EN EL MUNICIPIO DE SAN ROQUE”","Antioquia : San Roque","$ 30,014,600.00","2020-05-28T00:00:00.000","https://www.contratos.gov.co/consultas/detalleProceso.do?numConstancia=20-12-10781327"
"158","ARR 003-2020","Contratación Directa (Ley 1150 de 2007)","Celebrado","ANTIOQUIA - ALCALDÍA MUNICIPIO DE SAN ROQUE","ARRENDAMIENTO DE BODEGA PARA LOS DIFERENTES INSUMOS DE LOS DIFERENTES PROYECTOS MANEJADOS POR LA SECRETARIA DE AGRICULTURA Y RECURSOS NATURALES.","Antioquia : San Roque","$ 6,594,000.00","2020-05-23T00:00:00.000","https://www.contratos.gov.co/consultas/detalleProceso.do?numConstancia=20-12-10796993"
"159","PSP 017-2020","Contratación Directa (Ley 1150 de 2007)","Celebrado","ANTIOQUIA - ALCALDÍA MUNICIPIO DE SAN ROQUE","“PRESTACION DE SERVICIOS PROFESIONALES, DE PUBLICIDAD Y PROGRAMAS INFORMATIVOS, SOBRE LAS MEDIDAS EN EL MARCO DE LA EMERGECIA SANITARIA GENERADA POR EL CIVID-19 EN EL MUNICIPIO DE SAN ROQUE”","Antioquia : San Roque","$ 5,100,000.00","2020-05-15T00:00:00.000","https://www.contratos.gov.co/consultas/detalleProceso.do?numConstancia=20-12-10774857"
"160","CMC 019-2020","Contratación Mínima Cuantía","Liquidado","ANTIOQUIA - ALCALDÍA MUNICIPIO DE SAN ROQUE","REALIZAR LA MITIGACIÓN Y RECUPERACIÓN DE PROCESOS EROSIVOS EN EL MUNICIPIO DE SAN ROQUE ANTIOQUIA”.","Antioquia : San Roque","$ 22,322,866.00","2020-05-15T00:00:00.000","https://www.contratos.gov.co/consultas/detalleProceso.do?numConstancia=20-13-10707785"
"161","SAG 044-2020","Contratación Directa (Ley 1150 de 2007)","Celebrado","ANTIOQUIA - ALCALDÍA MUNICIPIO DE SAN ROQUE","“PRESTACION DE SERVICIOS DE APOYO A LA GESTION ASISTENCIAL EN LA SECRETARIA DE GOBIERNO A TRAVES DEL APOYO A LAS LABORES REALIZADAS PARA LA CONTRATACION MUNICIPAL”","Antioquia : San Roque","$ 11,400,000.00","2020-05-12T00:00:00.000","https://www.contratos.gov.co/consultas/detalleProceso.do?numConstancia=20-12-10766068"
"162","PSP 012-202","Contratación Directa (Ley 1150 de 2007)","Liquidado","ANTIOQUIA - ALCALDÍA MUNICIPIO DE SAN ROQUE","“PRESTACIÓN DE SERVICIOS PROFESIONALES COMO INGENIERO CIVIL PARA EL APOYO A LA SECRETARIA DE PLANEACIÓN DEL MUNICIPIO DE SAN ROQUE, EN EL INVENTARIO DE VÍAS TERCIARIAS DEL MUNICIPIO”","Antioquia : San Roque","$ 10,176,000.00","2020-05-09T00:00:00.000","https://www.contratos.gov.co/consultas/detalleProceso.do?numConstancia=20-12-10431103"
"163","C.I. 006-2020","Contratación Directa (Ley 1150 de 2007)","Celebrado","ANTIOQUIA - ALCALDÍA MUNICIPIO DE SAN ROQUE","“FORTALECIMIENTO DE LOS PROCESOS DE VIGILANCIA EN SALUD PUBLICA EN EL MARCO DE LA EMERGENCIA POR EL COVID 19, EN EL MUNICIPIO DE SAN ROQUE, CON RECURSOS ASIGNADOS POR LA GOBERNACION DE ANTIOQUIA MEDIANTE RESOLUCION S2020060022019 DEL 27 DE ABRIL DE 2020”","Antioquia : San Roque","$ 45,000,000.00","2020-05-06T00:00:00.000","https://www.contratos.gov.co/consultas/detalleProceso.do?numConstancia=20-12-10746941"
"164","SAG 043-2020","Contratación Directa (Ley 1150 de 2007)","Celebrado","ANTIOQUIA - ALCALDÍA MUNICIPIO DE SAN ROQUE","“PRESTACION DE SERVICIOS DE APOYO A LA GESTIÓN MUNICIPAL EN EL AREA DE SANEAMIENTO, FORMALIZACIÓN Y LEGALIZACIÓN DE LA PROPIEDAD”","Antioquia : San Roque","$ 15,000,000.00","2020-05-05T00:00:00.000","https://www.contratos.gov.co/consultas/detalleProceso.do?numConstancia=20-12-10745485"
"165","S.A.S.I.P 003-2020","Subasta","Celebrado","ANTIOQUIA - ALCALDÍA MUNICIPIO DE SAN ROQUE","“SUMINISTRO DE COMBUSTIBLES (GASOLINA CORRIENTE Y A.C.P.M); NECESARIOS PARA LA OPERACIÓN Y MOVILIZACION DEL PARQUE AUTOMOTOR (VEHICULOS, MOTOS Y MAQUINARIA) DE PROPIEDAD DEL MUNICIPIO DE SAN ROQUE”.","Antioquia : San Roque","$ 40,316,000.00","2020-05-04T00:00:00.000","https://www.contratos.gov.co/consultas/detalleProceso.do?numConstancia=20-9-464874"
"166","CMC 020-2020","Contratación Mínima Cuantía","Celebrado","ANTIOQUIA - ALCALDÍA MUNICIPIO DE SAN ROQUE","“SUMINISTRO DE ENSERES Y EQUIPOS DE OFICINA PARA EL FORTALECIMIENTO TECNICO DE LA SECRETARIA DE PLANEACION DEL MUNICIPIO DE SAN ROQUE”.","Antioquia : San Roque","$ 8,999,997.00","2020-05-02T00:00:00.000","https://www.contratos.gov.co/consultas/detalleProceso.do?numConstancia=20-13-10714292"
"167","C.I 005-2019","Contratación Directa (Ley 1150 de 2007)","Liquidado","ANTIOQUIA - ALCALDÍA MUNICIPIO DE SAN ROQUE","EJECUTAR EL MEJORAMIENTO DEL SANEAMIENTO URBANO, MEDIANTE LA CONTINUACIÓN EN LA CONSTRUCCIÓN DEL PLAN MAESTRO DE ALCANTARILLADO DEL MUNICIPIO DE SAN ROQUE Y LA PAVIMENTACIÓN DE VÍAS URBANAS","Antioquia : San Roque","$ 1,846,777,528.00","2020-04-29T00:00:00.000","https://www.contratos.gov.co/consultas/detalleProceso.do?numConstancia=19-12-9027747"
"168","CMC 012-2020","Contratación Mínima Cuantía","Liquidado","ANTIOQUIA - ALCALDÍA MUNICIPIO DE SAN ROQUE","SUMINISTRO DE PAPELERIA Y ELEMENTOS DE OFICINA PARA LAS DEPENDENCIAS DE LA ADMINISTRACION MUNICIPAL DE SAN ROQUE– ANTIOQUIA.","Antioquia : San Roque","$ 20,642,088.00","2020-04-24T00:00:00.000","https://www.contratos.gov.co/consultas/detalleProceso.do?numConstancia=20-13-10488459"
"169","C.M.A 001-2018","Concurso de Méritos Abierto","Liquidado","ANTIOQUIA - ALCALDÍA MUNICIPIO DE SAN ROQUE","INTERVENTORIA TECNICA, ADMINISTRATIVA Y FINANCIERA A LA OBRA DENOMINADA AMPLIACION Y ADECUACION DE LA INSTITUCION EDUCATIVA PRESBITERO ABRAHAM JARAMILLO, DEL MUNICIPIO DE SAN ROQUE","Antioquia : San Roque","$ 117,356,145.00","2020-04-22T00:00:00.000","https://www.contratos.gov.co/consultas/detalleProceso.do?numConstancia=18-15-7851964"
"170","UM 003-2020","Contratación Directa (Ley 1150 de 2007)","Liquidado","ANTIOQUIA - ALCALDÍA MUNICIPIO DE SAN ROQUE","“KIT DE MERCADO PARA ATENDER A LA POBLACION VULNERABLE, EMERGENCIA NACIONAL COVID-19 DEL AREA URBANA Y RURAL DEL MUNICIPIO DE SAN ROQUE”","Antioquia : San Roque","$ 24,438,750.00","2020-04-20T00:00:00.000","https://www.contratos.gov.co/consultas/detalleProceso.do?numConstancia=20-12-10630387"
"171","CMC 016-2020","Contratación Mínima Cuantía","Liquidado","ANTIOQUIA - ALCALDÍA MUNICIPIO DE SAN ROQUE","“SUMINISTRO DE REPUESTOS PARA EL MANTENIMIENTO CORRECTIVO Y PREVENTIVO DEL PARQUE AUTOMOTOR CONFORMADO POR: MOTONIVELADORA, RETROEXVADORAS, VOLQUETAS Y LOS VEHÍCULOS DE PROPIEDAD DEL MUNICIPIO DE SAN ROQUE”","Antioquia : San Roque","$ 20,000,000.00","2020-04-18T00:00:00.000","https://www.contratos.gov.co/consultas/detalleProceso.do?numConstancia=20-13-10560135"
"172","CMC 018-2020","Contratación Mínima Cuantía","Celebrado","ANTIOQUIA - ALCALDÍA MUNICIPIO DE SAN ROQUE","“ADQUISICIÓN O SUMINISTRO DE LA PÓLIZA DE SEGURO DE VIDA PARA LOS CONCEJALES, PERSONERO Y ALCALDE DEL MUNICIPIO DE SAN ROQUE, ANTIOQUIA”","Antioquia : San Roque","$ 5,857,215.00","2020-04-16T00:00:00.000","https://www.contratos.gov.co/consultas/detalleProceso.do?numConstancia=20-13-10672117"
"173","CMC 057-2019","Contratación Mínima Cuantía","Liquidado","ANTIOQUIA - ALCALDÍA MUNICIPIO DE SAN ROQUE","INTERVENTORÍA TECNICA, ADMINISTRATIVA Y FINANCIERA A LA OBRA DENOMINADA MEJORAMIENTO DE LOS ESCENARIOS DEPORTIVOS LOCALIZADOS EN EL AREA URNANA Y UNIDAD DEPORTIVA DEL CORREGIMIENTO DE SAN JOSE DEL NUS DEL MUNICIPIO DE SAN ROQUE","Antioquia : San Roque","$ 32,658,000.00","2020-04-13T00:00:00.000","https://www.contratos.gov.co/consultas/detalleProceso.do?numConstancia=19-13-9757452"
"174","L.P 006-2018","Licitación obra pública","Liquidado","ANTIOQUIA - ALCALDÍA MUNICIPIO DE SAN ROQUE","CONSTRUCCION DE SEDE PARA LOS ADULTOS MAYORES DE LA ZONA URBANA DEL MUNICIPIO DE SAN ROQUE, EN CUMPLIMIENTO DE LA RESOLUCION 2018060363044 EMITIDA POR LA GOBERNACIÓN DE ANTIOQUIA","Antioquia : San Roque","$ 1,391,445,147.00","2020-04-12T00:00:00.000","https://www.contratos.gov.co/consultas/detalleProceso.do?numConstancia=18-21-7449"
"175","CMC 013-2020","Contratación Mínima Cuantía","Liquidado","ANTIOQUIA - ALCALDÍA MUNICIPIO DE SAN ROQUE","“SUMINISTRO DE INSUMOS AGROPECUARIOS, MEDICAMENTOS Y MATERIALES DE USO VETERINARIO PARA EL DESARROLLO DE BRIGADAS ENFOCADAS A LA ASISTENCIA TÉCNICA; TALES COMO: ESTERILIZACIÓN, VITAMINIZACIÓN Y DESPARASITACIÓN DE CANINOS, EQUINOS Y BOVINOS EN LA ZONA RURAL Y URBANA DEL MUNICIPIO DE SAN ROQUE – ANTIOQUIA”.","Antioquia : San Roque","$ 24,247,850.00","2020-04-03T00:00:00.000","https://www.contratos.gov.co/consultas/detalleProceso.do?numConstancia=20-13-10510798"
"176","SAG 037-2020","Contratación Directa (Ley 1150 de 2007)","Celebrado","ANTIOQUIA - ALCALDÍA MUNICIPIO DE SAN ROQUE","“PRESTACION DE SERVICIOS EN LA MONITORIA DE DEPORTES EN EL CORREGIMIENTO DE PROVIDENCIA Y APOYO A LAS ACTIVIDADES DEL DEPORTE SOCIAL COMUNITARIO","Antioquia : San Roque","$ 14,840,000.00","2020-03-28T00:00:00.000","https://www.contratos.gov.co/consultas/detalleProceso.do?numConstancia=20-12-10528586"
"177","SAG 038-2020","Contratación Directa (Ley 1150 de 2007)","Celebrado","ANTIOQUIA - ALCALDÍA MUNICIPIO DE SAN ROQUE","“PRESTACION DE SERVICIOS DE APOYO A LA GESTIONN EN LA CASA DE LA CULTURA EN EL FORTALECIMIENTO DEL GRUPO DE TEATRO DEL MUNICIPIO DE SAN ROQUE, VIGENCIA 2020”","Antioquia : San Roque","$ 6,750,000.00","2020-03-28T00:00:00.000","https://www.contratos.gov.co/consultas/detalleProceso.do?numConstancia=20-12-10530088"
"178","U.M 001-2020","Contratación Directa (Ley 1150 de 2007)","Liquidado","ANTIOQUIA - ALCALDÍA MUNICIPIO DE SAN ROQUE","“SUMINISTRO DE COBIJAS, COLCHONES, LAMINAS ZINC Y CABELLETES PARA LAS PERSONAS DAMNIFICADAS POR LA FUERTE TEMPORA INVERNAL QUE SE PRESENTÓ EL DIA 09 DE MARZO DE 2020, SEGÚN DECRETO MUNICIPAL DE URGENCIA MANIFIESTA N. 040 DEL 10 DE MARZO DE 2020”","Antioquia : San Roque","$ 10,930,470.00","2020-03-27T00:00:00.000","https://www.contratos.gov.co/consultas/detalleProceso.do?numConstancia=20-12-10589364"
"179","UM 002-2020","Contratación Directa (Ley 1150 de 2007)","Celebrado","ANTIOQUIA - ALCALDÍA MUNICIPIO DE SAN ROQUE","“SUMINISTRO DE 4.000 TAPABOCAS CON DESTINO A POBLACION VULNERABLE AL CONTAGIO DEL COVID-19 EN EL MARCO DE LA URGENCIA MANIFIESTA DECLARADA MEDIANTE DECRETO 046 DEL 26 DE MARZO DEL AÑO 2020”","Antioquia : San Roque","$ 9,520,000.00","2020-03-27T00:00:00.000","https://www.contratos.gov.co/consultas/detalleProceso.do?numConstancia=20-12-10630354"
"180","CVS 002-2020","Régimen Especial","Liquidado","ANTIOQUIA - ALCALDÍA MUNICIPIO DE SAN ROQUE","AUNAR ESFUERZOS TECNICOS ADMINSTRATIVOS Y FINANCIEROS PARA EL MANTENIMIENTO DE ZONAS VERDES, MANTENIMIENTO PREVENTIVO Y CORRECTIVO DE PARQUES, ESPACIO PÚBLICO CON ROCERIA, LIMPIEZA DE CAÑOS, CUNETAS Y ALCANTARILLADO.","Antioquia : San Roque","$ 2,600,000.00","2020-03-22T00:00:00.000","https://www.contratos.gov.co/consultas/detalleProceso.do?numConstancia=20-4-10501552"
"181","SAG 042-2020","Contratación Directa (Ley 1150 de 2007)","Celebrado","ANTIOQUIA - ALCALDÍA MUNICIPIO DE SAN ROQUE","PRESTACIÓN DE SERVICIOS DE APOYO A LA GESTIÓN DE LA SECRETARÍA DE PLANEACIÓN, OBRAS PÚBLICAS E INFRAESTRUCTURA- CATASTRO MUNICIPAL, EN LA IMPLEMENTACIÓN DE ACCIONES PARA LA DEBIDA CONSERVACIÓN CATASTRAL DE LOS PREDIOS URBANOS Y RURALES EN LA PARTE FISICA, JURIDICA, ECONOMICA Y FISCAL EN EL MUNICIPIO DE SAN ROQUE","Antioquia : San Roque","$ 10,000,000.00","2020-03-21T00:00:00.000","https://www.contratos.gov.co/consultas/detalleProceso.do?numConstancia=20-12-10623354"
"182","CMC 017-2020","Contratación Mínima Cuantía","Celebrado","ANTIOQUIA - ALCALDÍA MUNICIPIO DE SAN ROQUE","ADQUISICION DE POLIZA TODO RIESGO PARA MAQUINARIA Y EQUIPO CONTRATISTA PARA EL VIBROCOMPACTADOR DE PLACAS MC087255 Y SOAT PARA LAS SIGUIENTES PLACAS MML150,RHT95D,RHT96D,STY032 Y STY033 DEL MUNICIPIO DE SAN ROQUE","Antioquia : San Roque","$ 6,168,494.00","2020-03-18T00:00:00.000","https://www.contratos.gov.co/consultas/detalleProceso.do?numConstancia=20-13-10569887"
"183","CVI 003-2020","Contratación Directa (Ley 1150 de 2007)","Celebrado","ANTIOQUIA - ALCALDÍA MUNICIPIO DE SAN ROQUE","ANUAR ESFUERZOS TÉCNICOS, ADMINISTRATIVOS Y FINANCIEROS, EN LA GESTIÓN INTEGRAL, CONTRA INCENDIOS Y AMENAZAS (DESLIZAMIENTOS, INUNDACIONES, INCENDIOS) LOS PREPARATIVOS Y ATENCIÓN DE RESCATE EN TODAS SUS MODALIDADES, CAPACITACIÓN INTEGRAL EN GESTIÓN DEL RIESGO DE DESASTRES Y LA DEBIDA ATENCIÓN DE INCENDIOS DE INCIDENTES CON MATERIALES PELIGROSOS Y TODO LO ANTERIOR SE PODRÁ EJECUTAR EN LA ZONA URBANA Y RURAL DEL MUNICIPIO DE SAN ROQUE.","Antioquia : San Roque","$ 24,000,000.00","2020-03-16T00:00:00.000","https://www.contratos.gov.co/consultas/detalleProceso.do?numConstancia=20-12-10604526"
"184","SAG 031-2020","Contratación Directa (Ley 1150 de 2007)","Liquidado","ANTIOQUIA - ALCALDÍA MUNICIPIO DE SAN ROQUE","“PRESTACIÓN DE SERVICIOS PARA REALIZAR TALLERES DE CAPACITACIÓN PARA LA EDUCACIÓN AMBIENTAL PARA LOS DOCENTES DE LA INSTITUCIONES EDUCATIVAS DE LAS VEREDAS LA CEIBA, PALMAS, EL BRASIL, CABILDO, EFE GÓMEZ, LA FLORESTA; EN PROCURA DE MEJORAR LOS HÁBITOS DE CONSERVACIÓN Y CUIDADO DE LOS RECURSOS NATURALES EN EL MARCO DEL CONVENIO PRAE”","Antioquia : San Roque","$ 5,400,000.00","2020-03-13T00:00:00.000","https://www.contratos.gov.co/consultas/detalleProceso.do?numConstancia=20-12-10454241"
"185","CVI 002-2020","Régimen Especial","Celebrado","ANTIOQUIA - ALCALDÍA MUNICIPIO DE SAN ROQUE","CONVENIO INTERINSTITUCIONAL DE TRANSFERENCIA DE RECURSOS PARA LA PRESTACIÓN DEL SERVICIO PÚBLICO DE PREVENCIÓN Y CONTROL DE INCENDIOS Y CALAMIDADES CONEXAS, y EJECUCIÓN DE ACCIONES ENCAMINADAS A LA PREVENCIÓN Y ATENCIÓN DE DESASTRES NATURALES O ANTROPICOS A TRAVÉS DE LA PLANEACIÓN, DIVULGACIÓN, Y EDUCACIÓN DE LA COMUNIDAD SANROCANA, EN ATENCIÓN AL ACUERDO MUNICIPAL NUMERO 012 de 2018 Y A LA LEY 1575 DE 2012","Antioquia : San Roque","$ 23,000,000.00","2020-03-10T00:00:00.000","https://www.contratos.gov.co/consultas/detalleProceso.do?numConstancia=20-4-10581660"
"186","PSP 016-2020","Contratación Directa (Ley 1150 de 2007)","Celebrado","ANTIOQUIA - ALCALDÍA MUNICIPIO DE SAN ROQUE","APOYO A LA GESTIÓN MEDIANTE LA PRESTACION DE SERVICIOS PROFESIONALES EN EL ACOMPAÑAMIENTO PARA LA FORMULACION, APROBACION Y CUMPLIMIENTO DE LAS OBLIGACIONES ANTE EL SGR DE LOS PROYECTOS FINANCIADOS CON REGALIAS.; ASÍ MISMO DAR CUMPLIMIENTO A LOS REPORTES DE INFORMACIÓN DE ACUERDO A LO ESTABLECIDO EN LA NORMATIVA DEL SISTEMA DE MONITOREO, SEGUIMIENTO, CONTROL Y EVALUACIÓN – SMSCE – DEL SISTEMA GENERAL DE REGALÍAS – SGR.","Antioquia : San Roque","$ 21,000,000.00","2020-03-09T00:00:00.000","https://www.contratos.gov.co/consultas/detalleProceso.do?numConstancia=20-12-10577598"
"187","CMC 001-2020","Contratación Mínima Cuantía","Liquidado","ANTIOQUIA - ALCALDÍA MUNICIPIO DE SAN ROQUE","""SUMINISTRO DE ELEMENTOS Y COMPONENTES PARA PROVEER DE KITS ESCOLARES A ESTUDIANTES DE BAJOS RECURSOS DE LAS INSTITUCIONES EDUCATIVAS DEL MUNICIPIO DE SAN ROQUE ANTIOQUIA, VIGENCIA 2020”","Antioquia : San Roque","$ 16,113,750.00","2020-03-09T00:00:00.000","https://www.contratos.gov.co/consultas/detalleProceso.do?numConstancia=20-13-10290817"
"188","CVI 008-2019","Contratación Directa (Ley 1150 de 2007)","Liquidado","ANTIOQUIA - ALCALDÍA MUNICIPIO DE SAN ROQUE","AUNAR ESFUERZOS TECNICOS, ADMINISTRATIVOS Y FINANCIEROS PARA LA EJECUCION DEL PROYECTO, PROMOCION DEL ENVEJECIMIENTO Y PROTECCION AL ADULTO MAYOR DEL MUNICIPIO DE SAN ROQUE, FIRMADO ENTRE LA GOBERNACION DE ANTIOQUIA Y REALIZACION DE ACTIVIDADES CULTURALES Y RECREATIVAS PARA LA CELEBRACION DE LA NAVIDAD CON LOS 20 GRUPOS GERONTOLOGICOS DEL MUNICIPIO DE SAN ROQUE EN EL AÑO 2019","Antioquia : San Roque","$ 236,161,760.00","2020-03-05T00:00:00.000","https://www.contratos.gov.co/consultas/detalleProceso.do?numConstancia=19-12-10194690"
"189","CMC 015-2020","Contratación Mínima Cuantía","Celebrado","ANTIOQUIA - ALCALDÍA MUNICIPIO DE SAN ROQUE","SUMINISTRO DE EQUIPOS DE COMPUTO, ELEMENTOS DE PAPELERIA, UTILES DE ESCRITORIO Y OFICINA PARA EL CORRECTO FUNCIONAMIENTO DE LA SECRETARIA DE SALUD MUNICIPAL, VIGENCIA 2020.","Antioquia : San Roque","$ 9,999,722.00","2020-03-05T00:00:00.000","https://www.contratos.gov.co/consultas/detalleProceso.do?numConstancia=20-13-10524468"
"190","SAG 041-2020","Contratación Directa (Ley 1150 de 2007)","Celebrado","ANTIOQUIA - ALCALDÍA MUNICIPIO DE SAN ROQUE","“PRESTACION DE SERVICIOS EN LOS PROCESOS DE VOLEIBOL Y DEPORTE SOCIAL COMUNITARIO EN EL MUNICIPIO DE SAN ROQUE”","Antioquia : San Roque","$ 14,840,000.00","2020-03-04T00:00:00.000","https://www.contratos.gov.co/consultas/detalleProceso.do?numConstancia=20-12-10552322"
"191","SAG 040-2020","Contratación Directa (Ley 1150 de 2007)","Celebrado","ANTIOQUIA - ALCALDÍA MUNICIPIO DE SAN ROQUE","“PRESTACION DE SERVICOS EN LOS PROCESOS DEL GIMNASIO MUNICIPAL, PATINAJE Y EL DEPORTE SOCIAL COMUNITARIO EN EL MUNICIPIO DE SAN ROQUE”","Antioquia : San Roque","$ 16,000,000.00","2020-02-29T00:00:00.000","https://www.contratos.gov.co/consultas/detalleProceso.do?numConstancia=20-12-10537686"
"192","CMC 014-2020","Contratación Mínima Cuantía","Terminado Anormalmente después de Convocado","ANTIOQUIA - ALCALDÍA MUNICIPIO DE SAN ROQUE","“SUMINISTRO DE COMBUSTIBLE (GAS) PARA LA PREPARACIÓN DE LOS ALIMENTOS DEL PROGRAMA DE ALIMENTACION ESCOLAR PAE, EL CUAL BENEFICIARA A 2.436 NIÑOS Y NIÑAS FORMALMENTE MATRICULADOS EN LAS INSTITUCIONES EDUCATIVAS DEL MUNICIPIO DE SAN ROQUE PARA EL CALENDARIO ESCOLAR DEL PRIMER SEMESTRE AÑO 2020”","Antioquia : San Roque","$ 5,168,000.00","2020-02-28T00:00:00.000","https://www.contratos.gov.co/consultas/detalleProceso.do?numConstancia=20-13-10511540"
"193","SAG 039-2019","Contratación Directa (Ley 1150 de 2007)","Celebrado","ANTIOQUIA - ALCALDÍA MUNICIPIO DE SAN ROQUE","“PRESTACION DE SERVICIOS EN LA MONITORIA PARA LA ACTIVIDAD FISICA RURAL, Y APOYO A LAS ACTIVIDADES DE RECREACION EN ESTA DEPENDENCIA”","Antioquia : San Roque","$ 10,200,000.00","2020-02-28T00:00:00.000","https://www.contratos.gov.co/consultas/detalleProceso.do?numConstancia=20-12-10530207"
"194","CVS 001-2020","Régimen Especial","Liquidado","ANTIOQUIA - ALCALDÍA MUNICIPIO DE SAN ROQUE","AUNAR ESFUERZOS TECNICOS ADMINSTRATIVOS Y FINANCIEROS PARA LA INSTALACIÓN DE SISTEMAS DE RECOLECCIÓN DE AGUAS LLUVIAS Y LA INSTALACIÓN DE ABASTOS DE AGUAS CON SUS RESPECTIVOS ACCESORIOS PARA SU CORRECTO FUNCIONAMIENTO EN EL MARCO DEL CONVENIO PRAES EN LAS INSTITUCIONES EDUCATIVAS DE LAS VEREDAS LA CEIBA, PALMAS, EL BRASIL, CABILDO, EFE GÓMEZ, LA FLORESTA; EN PROCURA DE MEJORAR LOS HÁBITOS DE CONSERVACIÓN Y CUIDADO DE LOS RECURSOS NATURALES.","Antioquia : San Roque","$ 10,956,000.00","2020-02-28T00:00:00.000","https://www.contratos.gov.co/consultas/detalleProceso.do?numConstancia=20-4-10449050"
"195","CMC 002-2020","Contratación Mínima Cuantía","Liquidado","ANTIOQUIA - ALCALDÍA MUNICIPIO DE SAN ROQUE","¨CONTROL INTEGRADO DE VECTORES Y ROEDORES PLAGAS Y FACTORES DE RIESGO EN LAS INSTALACIONES DE LAS INSTITUCIONES EDUCATIVAS Y SEDES EDUCATIVAS E INSTALACIONES DEPORTIVAS QUE AFECTAN LA SALUD DEL ESTUDIANTADO DE QUIENES TRABAJAN Y UTILIZAN LOS RESTAURANTES ESCOLARES Y APLICACIÓN DE TERMONEBULIZACIÓN EN ALGUNOS SITIOS VULNERABLES DE LA COMUNIDAD EDUCATIVA DEL MUNICIPIO DE SAN ROQUE, DEPARTAMENTO DE ANTIOQUIA 2020¨.","Antioquia : San Roque","$ 10,791,898.00","2020-02-27T00:00:00.000","https://www.contratos.gov.co/consultas/detalleProceso.do?numConstancia=20-13-10312460"
"196","CMC 005-2020","Contratación Mínima Cuantía","Liquidado","ANTIOQUIA - ALCALDÍA MUNICIPIO DE SAN ROQUE","SUMINISTRO DE REPUESTOS PARA EL MANTENIMIENTO CORRECTIVO Y PREVENTIVO DE LA MOTONIVELADORA, RETROEXVADORAS, VOLQUETAS Y LOS VEHÍCULOS DE PROPIEDAD DEL MUNICIPIO DE SAN ROQUE”","Antioquia : San Roque","$ 20,422,000.00","2020-02-27T00:00:00.000","https://www.contratos.gov.co/consultas/detalleProceso.do?numConstancia=20-13-10365436"
"197","CMC 011-2020","Contratación Mínima Cuantía","Celebrado","ANTIOQUIA - ALCALDÍA MUNICIPIO DE SAN ROQUE","SERVICIO DE ALIMENTACIÓN PARA MESA MUNICIPAL DE PARTICIPACION EFECTIVA DE LAS VICTIMAS DEL CONFLICTO ARMADO Y COMITÉ DE JUSTICIA TRANSICIONAL DEL MUNICIPIO DE SAN ROQUE -ANTIOQUIA.","Antioquia : San Roque","$ 5,040,000.00","2020-02-25T00:00:00.000","https://www.contratos.gov.co/consultas/detalleProceso.do?numConstancia=20-13-10479720"
"198","CMC 058-2019","Contratación Directa (Ley 1150 de 2007)","Liquidado","ANTIOQUIA - ALCALDÍA MUNICIPIO DE SAN ROQUE","PRESTACIÓN DE SERVICIOS DE APOYO A LA GESTIÓN ASISTENCIAL, A RIESGO PROPIO, EN LA PROMOCION DE LA ACTIVIDAD FISICA, LA RECREACION, Y LOS ESTILOS DE VIDA SALUDABLE EN LOS GRUPOS GERONTOLOGICOS DEL ADULTO MAYOR DE LA ZONA RURAL DEL MUNICIPIO, 2019","Antioquia : San Roque","$ 6,500,000.00","2020-02-24T00:00:00.000","https://www.contratos.gov.co/consultas/detalleProceso.do?numConstancia=19-12-9817230"
"199","SAG 034-2020","Contratación Directa (Ley 1150 de 2007)","Celebrado","ANTIOQUIA - ALCALDÍA MUNICIPIO DE SAN ROQUE","“PRESTACION DE SERVICIOS DE APOYO A LA GESTION ADMINISTRATIVA DE LA SECRETARIA DE HACIENDA DEL MUNICIPIO DE SAN ROQUE”","Antioquia : San Roque","$ 8,700,000.00","2020-02-24T00:00:00.000","https://www.contratos.gov.co/consultas/detalleProceso.do?numConstancia=20-12-10505875"
"200","PSP 015-2020","Contratación Directa (Ley 1150 de 2007)","Celebrado","ANTIOQUIA - ALCALDÍA MUNICIPIO DE SAN ROQUE","PRESTACIÓN DE SERVICIOS PROFESIONALES PARA LA FORMULACION, IMPLEMENTACION Y MONITOREO DEL PLAN TERRITORIAL EN SALUD Y EJECUCION DE ACCIONES DE LA POLITICA DE PARTICIPACION EN SALUD DEL MUNICIPIO DE SAN ROQUE, PARA LA VIGENCIA 2020","Antioquia : San Roque","$ 33,000,000.00","2020-02-24T00:00:00.000","https://www.contratos.gov.co/consultas/detalleProceso.do?numConstancia=20-12-10508222"
"201","SAG 035-2020","Contratación Directa (Ley 1150 de 2007)","Celebrado","ANTIOQUIA - ALCALDÍA MUNICIPIO DE SAN ROQUE","“PRESTACION DE SERVICIOS EN LA MONITORIA DE DEPORTES DEL CORREGIMIENTO DE SAN JOSE DEL NUS, Y APOYO A LAS ACTIVIDADES DE DEPORTE SOCIAL EN LA SECRETARIA DE EDUCACION, DEPORTE, CULTURA Y TURISMO”","Antioquia : San Roque","$ 18,000,000.00","2020-02-24T00:00:00.000","https://www.contratos.gov.co/consultas/detalleProceso.do?numConstancia=20-12-10508572"
"202","SAG 036-2020","Contratación Directa (Ley 1150 de 2007)","Celebrado","ANTIOQUIA - ALCALDÍA MUNICIPIO DE SAN ROQUE","PRESTACIÓN DE SERVICIOS EN LA PROMOCION DE LA ACTIVIDAD FISICA, LA RECREACION, Y LOS ESTILOS DE VIDA SALUDABLE EN LOS GRUPOS GERONTOLOGICOS DEL ADULTO MAYOR, CORREGIMIENTOS DE SAN JOSE, PROVIDENCIA Y CRISTALES DEL MUNICIPIO DE SAN ROQUE 2020","Antioquia : San Roque","$ 8,904,000.00","2020-02-24T00:00:00.000","https://www.contratos.gov.co/consultas/detalleProceso.do?numConstancia=20-12-10509607"
"203","C.I. 004-2020","Contratación Directa (Ley 1150 de 2007)","Celebrado","ANTIOQUIA - ALCALDÍA MUNICIPIO DE SAN ROQUE","“EJECUTAR EL PLAN DE SALUD PÚBLICA DE INTERVENCIONES COLECTIVAS - PIC 2020 PARA CONTRIBUIR AL IMPACTO POSITIVO DE LOS DETERMINANTES SOCIALES DE LA SALUD, A TRAVÉS DE INTERVENCIONES COLECTIVAS; BASADOS EN LOS LINEAMIENTOS TÉCNICOS DE LA RESOLUCIÓN 518 DE 2015 Y 3280 DE 2018 Y ENMARCADOS EN EL PLAN DECENAL DE SALUD PÚBLICA PARA GARANTIZAR A LA COMUNIDAD SANROCANA EL DERECHO A LA SALUD”","Antioquia : San Roque","$ 55,790,497.00","2020-02-22T00:00:00.000","https://www.contratos.gov.co/consultas/detalleProceso.do?numConstancia=20-12-10501788"
"204","SAG 016-2020","Contratación Directa (Ley 1150 de 2007)","Liquidado","ANTIOQUIA - ALCALDÍA MUNICIPIO DE SAN ROQUE","“PRESTACION DE SERVICIOS EN LA MONITORIA DE DEPORTES EN EL CORREGIMIENTO DE PROVIDENCIA Y APOYO A LAS ACTIVIDADES DEL DEPORTE SOCIAL COMUNITARIO”","Antioquia : San Roque","$ 8,904,000.00","2020-02-20T00:00:00.000","https://www.contratos.gov.co/consultas/detalleProceso.do?numConstancia=20-12-10388879"
"205","SAG 018-2020","Contratación Directa (Ley 1150 de 2007)","Liquidado","ANTIOQUIA - ALCALDÍA MUNICIPIO DE SAN ROQUE","“PRESTACION DE SERVICIOS EN LOS PROCESOS DE VOLEIBOL Y DEPORTE SOCIAL COMUNITARIO EN EL MUNICIPIO DE SAN ROQUE”","Antioquia : San Roque","$ 8,904,000.00","2020-02-20T00:00:00.000","https://www.contratos.gov.co/consultas/detalleProceso.do?numConstancia=20-12-10389456"
"206","SAG 019-2020","Contratación Directa (Ley 1150 de 2007)","Liquidado","ANTIOQUIA - ALCALDÍA MUNICIPIO DE SAN ROQUE","“PRESTACION DE SERVICOS EN LOS PROCESOS DEL GIMNASIO MUNICIPAL, PATINAJE Y EL DEPORTE SOCIAL COMUNITARIO EN EL MUNICIPIO DE SAN ROQUE”","Antioquia : San Roque","$ 11,700,000.00","2020-02-20T00:00:00.000","https://www.contratos.gov.co/consultas/detalleProceso.do?numConstancia=20-12-10389579"
"207","SAG 020-2020","Contratación Directa (Ley 1150 de 2007)","Liquidado","ANTIOQUIA - ALCALDÍA MUNICIPIO DE SAN ROQUE","“PRESTACION DE SERVICIOS EN LA MONITORIA PARA LA ACTIVIDAD FISICA RURAL, Y APOYO A LAS ACTIVIDADES DE RECREACION EN ESTA DEPENDENCIA”","Antioquia : San Roque","$ 10,200,000.00","2020-02-20T00:00:00.000","https://www.contratos.gov.co/consultas/detalleProceso.do?numConstancia=20-12-10390087"
"208","SAG 021-2020","Contratación Directa (Ley 1150 de 2007)","Liquidado","ANTIOQUIA - ALCALDÍA MUNICIPIO DE SAN ROQUE","“PRESTACION DE SERVICIOS EN LA MONITORIA DE DEPORTES DEL CORREGIMIENTO DE SAN JOSE DEL NUS, Y APOYO A LAS ACTIVIDADES DE DEPORTE SOCIAL EN ESTA DEPENDENCIA”","Antioquia : San Roque","$ 10,812,000.00","2020-02-20T00:00:00.000","https://www.contratos.gov.co/consultas/detalleProceso.do?numConstancia=20-12-10390289"
