"id","n_mero_de_proceso","tipo_de_proceso","estado","entidad","objeto","departamento_y_municipio","cuant_a","fecha_dd_mm_aaaa","link"
"100","PS-042-2020","Contratación Directa (Ley 1150 de 2007)","Celebrado","ANTIOQUIA - ALCALDÍA MUNICIPIO DE CARACOLÍ","Prestación de servicios como apoyo logístico en la coordinación de actividad física/lúdica y recreativa con el adulto mayor y población vulnerable del municipio de Caracolí Antioquia","Antioquia : Caracolí","$ 17,640,000.00","2020-06-30T00:00:00.000","https://www.contratos.gov.co/consultas/detalleProceso.do?numConstancia=20-12-10886999"
"101","PS-043-2020","Contratación Directa (Ley 1150 de 2007)","Celebrado","ANTIOQUIA - ALCALDÍA MUNICIPIO DE CARACOLÍ","Prestación de servicios como apoyo logístico en la ocupación del tiempo libre y de ocio en la formación artística, cultural y en el área de artes plásticas y técnicas mixtas a los adultos mayores del municipio de Caracolí Antioquia.","Antioquia : Caracolí","$ 8,040,000.00","2020-06-30T00:00:00.000","https://www.contratos.gov.co/consultas/detalleProceso.do?numConstancia=20-12-10887221"
"102","PSP-016-2020","Contratación Directa (Ley 1150 de 2007)","Celebrado","ANTIOQUIA - ALCALDÍA MUNICIPIO DE CARACOLÍ","Prestación de servicios profesionales para garantizar la atención médica veterinaria y brindar asistencia técnica agropecuaria en el municipio de Caracolí.","Antioquia : Caracolí","$ 12,667,000.00","2020-06-27T00:00:00.000","https://www.contratos.gov.co/consultas/detalleProceso.do?numConstancia=20-12-10884980"
"103","INV-021-2020","Contratación Mínima Cuantía","Celebrado","ANTIOQUIA - ALCALDÍA MUNICIPIO DE CARACOLÍ","Prestación de servicios de alojamiento y/o hospedaje para las unidades de la fuerza pública, que se encuentren apoyando los procesos de control, vigilancia y seguridad ciudadana en todo el territorio del Municipio de Caracolí.","Antioquia : Caracolí","$ 2,974,950.00","2020-06-26T00:00:00.000","https://www.contratos.gov.co/consultas/detalleProceso.do?numConstancia=20-13-10864541"
"104","PS-013-2020","Contratación Directa (Ley 1150 de 2007)","Liquidado","ANTIOQUIA - ALCALDÍA MUNICIPIO DE CARACOLÍ","Prestación de servicios como apoyo logístico para la coordinación del programa de actividad física con el adulto mayor y población vulnerable del municipio de Caracolí Antioquia.","Antioquia : Caracolí","$ 6,615,000.00","2020-06-20T00:00:00.000","https://www.contratos.gov.co/consultas/detalleProceso.do?numConstancia=20-12-10414909"
"105","PS-016-2020","Contratación Directa (Ley 1150 de 2007)","Liquidado","ANTIOQUIA - ALCALDÍA MUNICIPIO DE CARACOLÍ","Prestación de servicios como instructor en la modalidad de futbol, microfútbol y básquetbol masculino urbano y rural, como apoyo al fortalecimiento de los centros de iniciación y formación deportiva en el municipio de Caracolí","Antioquia : Caracolí","$ 6,030,000.00","2020-06-20T00:00:00.000","https://www.contratos.gov.co/consultas/detalleProceso.do?numConstancia=20-12-10432655"
"106","PS-017-2020","Contratación Directa (Ley 1150 de 2007)","Liquidado","ANTIOQUIA - ALCALDÍA MUNICIPIO DE CARACOLÍ","Prestación de servicios de apoyo como instructor en la modalidad de Fútbol y Microfútbol femenino en la zona urbana y rural del municipio de Caracolí.","Antioquia : Caracolí","$ 6,030,000.00","2020-06-20T00:00:00.000","https://www.contratos.gov.co/consultas/detalleProceso.do?numConstancia=20-12-10436509"
"107","PS-018-2020","Contratación Directa (Ley 1150 de 2007)","Liquidado","ANTIOQUIA - ALCALDÍA MUNICIPIO DE CARACOLÍ","Prestación de servicios de apoyo para el fomento y difusión de expresiones artísticas culturales para el sano esparcimiento de los niños, niñas y adolescentes en el área de lectura, literatura y medio ambiente en el municipio de Caracolí.","Antioquia : Caracolí","$ 6,030,000.00","2020-06-20T00:00:00.000","https://www.contratos.gov.co/consultas/detalleProceso.do?numConstancia=20-12-10437181"
"108","PS-033-2020","Contratación Directa (Ley 1150 de 2007)","Liquidado","ANTIOQUIA - ALCALDÍA MUNICIPIO DE CARACOLÍ","Prestación de servicios como apoyo técnico y logístico para la atención psicosocial a la comunidad, en la comisaría de familia del municipio de Caracolí.","Antioquia : Caracolí","$ 4,000,000.00","2020-06-20T00:00:00.000","https://www.contratos.gov.co/consultas/detalleProceso.do?numConstancia=20-12-10681142"
"109","PS-034-2020","Contratación Directa (Ley 1150 de 2007)","Liquidado","ANTIOQUIA - ALCALDÍA MUNICIPIO DE CARACOLÍ","Prestación de servicios de apoyo a la gestión para realizar el mantenimiento preventivo y correctivo a todo costo del software y hardware de los equipos de cómputo, mantenimiento de impresoras, video beam, soporte técnico a cada una de las dependencias del municipio de Caracolí Antioquia, para su adecuado funcionamiento durante la vigencia fiscal 2020.","Antioquia : Caracolí","$ 4,752,000.00","2020-06-20T00:00:00.000","https://www.contratos.gov.co/consultas/detalleProceso.do?numConstancia=20-12-10685164"
"110","PSP-008-2020","Contratación Directa (Ley 1150 de 2007)","Liquidado","ANTIOQUIA - ALCALDÍA MUNICIPIO DE CARACOLÍ","Prestación de servicios profesionales en la ejecución del proceso de selección y nombramiento del Gerente de la ESE Hospital San Pio X del Municipio de Caracolí-Antioquia.","Antioquia : Caracolí","$ 1,500,000.00","2020-06-20T00:00:00.000","https://www.contratos.gov.co/consultas/detalleProceso.do?numConstancia=20-12-10697209"
"111","INV-020-2020","Contratación Mínima Cuantía","Celebrado","ANTIOQUIA - ALCALDÍA MUNICIPIO DE CARACOLÍ","Suministro de materiales y equipos de oficina para el fortalecimiento de la secretaría de Planeación y Obras Públicas, para el correcto funcionamiento de la Administración Municipal y el cumplimiento de los deberes misionales del municipio de Caracolí conforme a la ficha técnica.","Antioquia : Caracolí","$ 4,486,000.00","2020-06-19T00:00:00.000","https://www.contratos.gov.co/consultas/detalleProceso.do?numConstancia=20-13-10846737"
"112","INV-019-2020","Contratación Mínima Cuantía","Celebrado","ANTIOQUIA - ALCALDÍA MUNICIPIO DE CARACOLÍ","Prestación de servicios logísticos, para la realización de las jornadas de “La Feria del Campo y la Creatividad” como un espacio de interacción comercial para impulsar y fortalecer los emprendimientos de nuestros productores campesinos apoyando el desarrollo económico de las familias urbanas y rurales teniendo como prioridad la conservación y uso sostenible de los Recursos Naturales en el marco de la emergencia del COVID-19 proceso contemplado dentro del programa de gobierno “Por la Huella del Desarrollo.”","Antioquia : Caracolí","$ 12,800,000.00","2020-06-12T00:00:00.000","https://www.contratos.gov.co/consultas/detalleProceso.do?numConstancia=20-13-10833581"
"113","PS-023-2020","Contratación Directa (Ley 1150 de 2007)","Liquidado","ANTIOQUIA - ALCALDÍA MUNICIPIO DE CARACOLÍ","Prestación de Servicios de Apoyo a la Gestión para la Operación, y mantenimiento preventivo y constante de la retroexcavadora New Holland y demás vehículos de propiedad y Adscritos al Municipio.","Antioquia : Caracolí","$ 5,985,000.00","2020-06-10T00:00:00.000","https://www.contratos.gov.co/consultas/detalleProceso.do?numConstancia=20-12-10438407"
"114","PS-035-2020","Contratación Directa (Ley 1150 de 2007)","Liquidado","ANTIOQUIA - ALCALDÍA MUNICIPIO DE CARACOLÍ","Prestación de servicios para el fortalecimiento de los procesos de formación artística en las modalidades de Música tradicionales, folclórica y urbana en el municipio de Caracolí Antioquia.","Antioquia : Caracolí","$ 2,680,000.00","2020-06-10T00:00:00.000","https://www.contratos.gov.co/consultas/detalleProceso.do?numConstancia=20-12-10696214"
"115","CS-017-2020","Contratación Directa (Ley 1150 de 2007)","Liquidado","ANTIOQUIA - ALCALDÍA MUNICIPIO DE CARACOLÍ","Suministro de paquetes alimentarios para el sustento de familias caracoliseñas durante la cuarentena ocasionada por la emergencia del COVID 19.","Antioquia : Caracolí","$ 25,000,000.00","2020-06-06T00:00:00.000","https://www.contratos.gov.co/consultas/detalleProceso.do?numConstancia=20-12-10658075"
"116","PS-001-2020","Contratación Directa (Ley 1150 de 2007)","Liquidado","ANTIOQUIA - ALCALDÍA MUNICIPIO DE CARACOLÍ","Prestación de servicios para la implementación del vivero municipal orientado a la conservación, protección, restauración y aprovechamiento de los recursos naturales, zonas de riesgo y del medio ambiente en el municipio de Caracolí-Antioquia.","Antioquia : Caracolí","$ 3,425,000.00","2020-06-05T00:00:00.000","https://www.contratos.gov.co/consultas/detalleProceso.do?numConstancia=20-12-10312563"
"117","PS-031-2020","Contratación Directa (Ley 1150 de 2007)","Liquidado","ANTIOQUIA - ALCALDÍA MUNICIPIO DE CARACOLÍ","Prestar los servicios como monitor en el fortalecimiento de procesos de formación artística en danzas con los Niños, Niñas, Jóvenes y Grupo Adulto Mayor del Municipio de Caracolí.","Antioquia : Caracolí","$ 2,400,000.00","2020-06-04T00:00:00.000","https://www.contratos.gov.co/consultas/detalleProceso.do?numConstancia=20-12-10673466"
"118","PS-001-2020","Contratación Directa (Ley 1150 de 2007)","Liquidado","ANTIOQUIA - ALCALDÍA MUNICIPIO DE CARACOLÍ","Contrato de Prestación de servicios para los servicios fortalecimiento de los sistemas de información de salud para la gestión de la información y cruce de base de datos y realización de actividades de fortalecimiento en el marco de los proyectos de salud en el municipio de Caracolí Antioquia, según resolución 518 de 2015 art. 20 numeral 20.2 parágrafo 1.","Antioquia : Caracolí","$ 11,160,000.00","2020-06-03T00:00:00.000","https://www.contratos.gov.co/consultas/detalleProceso.do?numConstancia=20-12-10309413"
"119","INV-018-2020","Contratación Mínima Cuantía","Celebrado","ANTIOQUIA - ALCALDÍA MUNICIPIO DE CARACOLÍ","Suministro de elementos de oficina, seguridad e implementos que garanticen el correcto funcionamiento de las oficinas e instalaciones del comando de policía, para mejorar la atención y bridar sana convivencia y seguridad en el municipio de Caracolí Antioquía.","Antioquia : Caracolí","$ 5,885,400.00","2020-05-26T00:00:00.000","https://www.contratos.gov.co/consultas/detalleProceso.do?numConstancia=20-13-10780824"
"120","INV-016-2020","Contratación Mínima Cuantía","Liquidado","ANTIOQUIA - ALCALDÍA MUNICIPIO DE CARACOLÍ","Prestación de servicios logísticos para jornada lúdica, recreativa y audiovisual en desarrollo de la protección integral de los niños, niñas y adolescentes del municipio de Caracolí.","Antioquia : Caracolí","$ 4,800,000.00","2020-05-25T00:00:00.000","https://www.contratos.gov.co/consultas/detalleProceso.do?numConstancia=20-13-10694675"
"121","CS-018-2020","Contratación Directa (Ley 1150 de 2007)","Liquidado","ANTIOQUIA - ALCALDÍA MUNICIPIO DE CARACOLÍ","Suministro de equipos de comunicación e insumos de impresión para la atención de COVID 19.","Antioquia : Caracolí","$ 1,400,000.00","2020-05-20T00:00:00.000","https://www.contratos.gov.co/consultas/detalleProceso.do?numConstancia=20-12-10662837"
"122","CS-020-2020","Contratación Directa (Ley 1150 de 2007)","Liquidado","ANTIOQUIA - ALCALDÍA MUNICIPIO DE CARACOLÍ","Suministro de insumos y equipos de atención y protección, material médico para la atención de pacientes en el marco de la contingencia por el COVID 19.","Antioquia : Caracolí","$ 7,329,000.00","2020-05-20T00:00:00.000","https://www.contratos.gov.co/consultas/detalleProceso.do?numConstancia=20-12-10663244"
"123","CS-015-2020","Contratación Directa (Ley 1150 de 2007)","Liquidado","ANTIOQUIA - ALCALDÍA MUNICIPIO DE CARACOLÍ","Suministro de Alimentación e hidratación para la atención a los puestos de control en la emergencia por Covid 19","Antioquia : Caracolí","$ 5,000,000.00","2020-05-19T00:00:00.000","https://www.contratos.gov.co/consultas/detalleProceso.do?numConstancia=20-12-10650994"
"124","PSP-012-2020","Contratación Directa (Ley 1150 de 2007)","Celebrado","ANTIOQUIA - ALCALDÍA MUNICIPIO DE CARACOLÍ","Prestación de servicios profesionales como gerontóloga para la atención integral de la población adulta mayor del municipio de Caracolí Antioquia","Antioquia : Caracolí","$ 13,230,000.00","2020-05-18T00:00:00.000","https://www.contratos.gov.co/consultas/detalleProceso.do?numConstancia=20-12-10775681"
"125","INV-015-2020","Contratación Mínima Cuantía","Liquidado","ANTIOQUIA - ALCALDÍA MUNICIPIO DE CARACOLÍ","Prestación de servicios logísticos, para el desarrollo de una jornada educativa, artística y cultural, denominada: campaña de fortalecimiento de la equidad de género, prevención de todos los tipos de violencia contra las mujeres y promoción de sus derechos, especialmente las mujeres pertenecientes al adulto mayor.","Antioquia : Caracolí","$ 4,500,000.00","2020-05-18T00:00:00.000","https://www.contratos.gov.co/consultas/detalleProceso.do?numConstancia=20-13-10567269"
"126","PS-039-2020","Contratación Directa (Ley 1150 de 2007)","Celebrado","ANTIOQUIA - ALCALDÍA MUNICIPIO DE CARACOLÍ","Prestación de servicios como auxiliar de enfermería en el fortalecimiento de las acciones de convivencia social y salud mental-salud para el alma, en el marco de la emergencia por COVID-19, según concurrencia de la Gobernación de Antioquia.","Antioquia : Caracolí","$ 10,000,000.00","2020-05-16T00:00:00.000","https://www.contratos.gov.co/consultas/detalleProceso.do?numConstancia=20-12-10775245"
"127","PS-007-2020","Contratación Directa (Ley 1150 de 2007)","Liquidado","ANTIOQUIA - ALCALDÍA MUNICIPIO DE CARACOLÍ","Prestación de servicios como gerontóloga para la atención integral de la población adulta mayor del municipio de Caracolí Antioquia.","Antioquia : Caracolí","$ 6,615,000.00","2020-05-15T00:00:00.000","https://www.contratos.gov.co/consultas/detalleProceso.do?numConstancia=20-12-10385050"
"128","PS-024-2020","Contratación Directa (Ley 1150 de 2007)","Liquidado","ANTIOQUIA - ALCALDÍA MUNICIPIO DE CARACOLÍ","Prestación de servicios como apoyo logístico para la implementación de ámbitos culturales adecuados y accesibles para la atención integral a la primera infancia.","Antioquia : Caracolí","$ 4,410,000.00","2020-05-15T00:00:00.000","https://www.contratos.gov.co/consultas/detalleProceso.do?numConstancia=20-12-10454931"
"129","INV-001-2020","Contratación Mínima Cuantía","Liquidado","ANTIOQUIA - ALCALDÍA MUNICIPIO DE CARACOLÍ","Suministro de víveres para la ejecución del programa de alimentación escolar-PAE, a través del cual se brinda un complemento alimentario a los niños, niñas y adolescentes de la matricula oficial del Municipio de Caracolí","Antioquia : Caracolí","$ 20,040,000.00","2020-05-15T00:00:00.000","https://www.contratos.gov.co/consultas/detalleProceso.do?numConstancia=20-13-10295826"
"130","CS-013-2020","Contratación Directa (Ley 1150 de 2007)","Liquidado","ANTIOQUIA - ALCALDÍA MUNICIPIO DE CARACOLÍ","Suministro de 3.000 Tapabocas para la emergencia Covid-19","Antioquia : Caracolí","$ 5,247,900.00","2020-05-14T00:00:00.000","https://www.contratos.gov.co/consultas/detalleProceso.do?numConstancia=20-12-10650506"
"131","CS-014-2020","Contratación Directa (Ley 1150 de 2007)","Liquidado","ANTIOQUIA - ALCALDÍA MUNICIPIO DE CARACOLÍ","Suministro de fumigadora Estacionaria para la prevención de la propagación del virus COVID-19","Antioquia : Caracolí","$ 1,232,600.00","2020-05-14T00:00:00.000","https://www.contratos.gov.co/consultas/detalleProceso.do?numConstancia=20-12-10650775"
"132","CS-016-2020","Contratación Directa (Ley 1150 de 2007)","Liquidado","ANTIOQUIA - ALCALDÍA MUNICIPIO DE CARACOLÍ","Suministro de trajes y máscaras de protección para atención de COVID 19.","Antioquia : Caracolí","$ 4,400,000.00","2020-05-14T00:00:00.000","https://www.contratos.gov.co/consultas/detalleProceso.do?numConstancia=20-12-10654965"
"133","PS-038-2020","Contratación Directa (Ley 1150 de 2007)","Celebrado","ANTIOQUIA - ALCALDÍA MUNICIPIO DE CARACOLÍ","Prestación de servicios de apoyo a la gestión a la oficina de Planeación y Obras Públicas del Municipio de Caracolí como Fotolector, Mutador y Operador de la base de datos Catastral, así mismo, la Plataforma OVC para los tramites y enlace ante la oficina de Sistemas de información y catastro del Departamento de Antioquia","Antioquia : Caracolí","$ 4,410,000.00","2020-05-14T00:00:00.000","https://www.contratos.gov.co/consultas/detalleProceso.do?numConstancia=20-12-10766623"
"134","PS-037-2020","Contratación Directa (Ley 1150 de 2007)","Celebrado","ANTIOQUIA - ALCALDÍA MUNICIPIO DE CARACOLÍ","Prestación de servicios para el rediseño y soporte de la página Web del Municipio de Caracolí Antioquia y la actualización de su sistema de administración de contenidos CMS a su última versión para cumplir los requerimientos de Transparencia por Colombia y el Manual de Gobierno en Línea Vigente.","Antioquia : Caracolí","$ 4,884,000.00","2020-05-13T00:00:00.000","https://www.contratos.gov.co/consultas/detalleProceso.do?numConstancia=20-12-10766401"
"135","PS-011-2020","Contratación Directa (Ley 1150 de 2007)","Liquidado","ANTIOQUIA - ALCALDÍA MUNICIPIO DE CARACOLÍ","Prestación de servicios de apoyo a la gestión a la oficina de Planeación y Obras Públicas del Municipio de Caracolí como Fotolector, Mutador y Operador de la base de datos Catastral, así mismo, la Plataforma OVC para los tramites y enlace ante la oficina de Sistemas de información y catastro del Departamento de Antioquia","Antioquia : Caracolí","$ 5,190,000.00","2020-05-11T00:00:00.000","https://www.contratos.gov.co/consultas/detalleProceso.do?numConstancia=20-12-10414840"
"136","INV-017-2020","Contratación Mínima Cuantía","Celebrado","ANTIOQUIA - ALCALDÍA MUNICIPIO DE CARACOLÍ","Suministro de artículos tecnológicos para la construcción de un canal de televisión local, con el fin de promover el proyecto jóvenes Innovadores.","Antioquia : Caracolí","$ 30,897,000.00","2020-05-08T00:00:00.000","https://www.contratos.gov.co/consultas/detalleProceso.do?numConstancia=20-13-10732709"
"137","PSP-009-2020","Contratación Directa (Ley 1150 de 2007)","Celebrado","ANTIOQUIA - ALCALDÍA MUNICIPIO DE CARACOLÍ","Prestación de servicios profesionales para realizar el estudio ambiental para obtener licencia de explotación de materiales en el marco de la ejecución del convenio de Colombia Rural y todos los proyectos de mejoramiento de vías Rurales del municipio de Caracolí –Antioquia.","Antioquia : Caracolí","$ 10,000,000.00","2020-05-04T00:00:00.000","https://www.contratos.gov.co/consultas/detalleProceso.do?numConstancia=20-12-10740416"
"138","CS-022-2020","Contratación Directa (Ley 1150 de 2007)","Celebrado","ANTIOQUIA - ALCALDÍA MUNICIPIO DE CARACOLÍ","Suministro de víveres para la ejecución del programa de alimentación escolar-PAE, a través del cual se brinda un complemento alimentario a los niños, niñas y adolescentes de la matricula oficial del Municipio de Caracolí","Antioquia : Caracolí","$ 52,936,640.00","2020-04-25T00:00:00.000","https://www.contratos.gov.co/consultas/detalleProceso.do?numConstancia=20-12-10710976"
"139","INV-010-2020","Contratación Mínima Cuantía","Liquidado","ANTIOQUIA - ALCALDÍA MUNICIPIO DE CARACOLÍ","Mantenimiento correctivo y reparación a todo costo del Vehículo Grand Vitara del Municipio de Caracolí, incluye Revisión Técnico - mecánica","Antioquia : Caracolí","$ 24,499,827.00","2020-04-17T00:00:00.000","https://www.contratos.gov.co/consultas/detalleProceso.do?numConstancia=20-13-10431483"
"140","CS-019-2020","Contratación Directa (Ley 1150 de 2007)","Celebrado","ANTIOQUIA - ALCALDÍA MUNICIPIO DE CARACOLÍ","Suministro de talonarios de comparendos para aplicar por el incumplimiento de las medidas de cuarentena decretadas por el Gobierno Nacional en el marco de la emergencia por el COVID 19.","Antioquia : Caracolí","$ 271,320.00","2020-04-07T00:00:00.000","https://www.contratos.gov.co/consultas/detalleProceso.do?numConstancia=20-12-10663157"
"141","PSP-010-2019","Contratación Directa (Ley 1150 de 2007)","Liquidado","ANTIOQUIA - ALCALDÍA MUNICIPIO DE CARACOLÍ","PRESTACIÓN DE SERVICIOS PROFESIONALES PARA DISEÑO Y DESARROLLO A TODO COSTO DE ACCIONES, EVENTOS, ACTIVIDADES Y JORNADAS PARA LA PROMOCIÓN DE LOS DERECHOS DE LOS NIÑOS, NIÑAS Y ADOLESCENTES Y FORTALECIMIENTO DE LA UNIDAD Y ARMONÍA FAMILIAR A REALIZARSE EN EL MUNICIPIO DE CARACOLI ANTIOQUIA EN EL AÑO 2019","Antioquia : Caracolí","$ 12,000,000.00","2020-03-31T00:00:00.000","https://www.contratos.gov.co/consultas/detalleProceso.do?numConstancia=19-12-9333668"
"142","CVI-001-2020","Contratación Directa (Ley 1150 de 2007)","Celebrado","ANTIOQUIA - ALCALDÍA MUNICIPIO DE CARACOLÍ","EL MUNICIPIO DE CARACOLI se compromete a transferir a LA EMPRESA DE SERVICIOS PUBLICOS DOMICILIARIOS DE CARACOLI S.A. E.S.P, el valor de los subsidios para los servicios de acueducto, aseo y alcantarillado, conforme se establezca mediante Acuerdo Municipal del Honorable Concejo Municipal de Caracolí, como contraprestación por los servicios públicos que presta en la vigencia 2.020.","Antioquia : Caracolí","$ 110,000,000.00","2020-03-23T00:00:00.000","https://www.contratos.gov.co/consultas/detalleProceso.do?numConstancia=20-12-10625269"
"143","PS-019-2020","Contratación Directa (Ley 1150 de 2007)","Liquidado","ANTIOQUIA - ALCALDÍA MUNICIPIO DE CARACOLÍ","Prestación de servicios para el fortalecimiento de los procesos de formación artística, musical y cultural, enfocado en instrumentos de teclas, vientos y percusión en el municipio de Caracolí","Antioquia : Caracolí","$ 4,410,000.00","2020-03-20T00:00:00.000","https://www.contratos.gov.co/consultas/detalleProceso.do?numConstancia=20-12-10437404"
"144","INV-011-2020","Contratación Mínima Cuantía","Liquidado","ANTIOQUIA - ALCALDÍA MUNICIPIO DE CARACOLÍ","Suministro de dos motobombas con accesorios, para la implementación de pequeños abastos en la vereda Canutillo y La Mesa en la zona rural del Municipio de Caracolí.","Antioquia : Caracolí","$ 6,337,565.00","2020-03-20T00:00:00.000","https://www.contratos.gov.co/consultas/detalleProceso.do?numConstancia=20-13-10464484"
"145","PS-029-2020","Contratación Directa (Ley 1150 de 2007)","Celebrado","ANTIOQUIA - ALCALDÍA MUNICIPIO DE CARACOLÍ","Prestación de servicios de apoyo y fortalecimiento de la secretaría de planeación y obras públicas y la secretaría técnica del OCAD (Órgano colegiado de administración y decisión) en el seguimiento, monitoreo y control administrativo de los proyectos de inversión ejecutados y en etapa de viabilización en el municipio de Caracolí – Antioquia.","Antioquia : Caracolí","$ 13,230,000.00","2020-03-14T00:00:00.000","https://www.contratos.gov.co/consultas/detalleProceso.do?numConstancia=20-12-10592374"
"146","PS-030-2020","Contratación Directa (Ley 1150 de 2007)","Celebrado","ANTIOQUIA - ALCALDÍA MUNICIPIO DE CARACOLÍ","Prestación de servicios de apoyo a la formulación de proyectos y manejo de Sistema General de Regalías del Municipio de Caracolí – Antioquia.","Antioquia : Caracolí","$ 8,435,182.80","2020-03-14T00:00:00.000","https://www.contratos.gov.co/consultas/detalleProceso.do?numConstancia=20-12-10593663"
"147","INV-014-2020","Contratación Mínima Cuantía","Celebrado","ANTIOQUIA - ALCALDÍA MUNICIPIO DE CARACOLÍ","Prestación de servicios logísticos para la alimentación a las personas privadas de la libertad y a todas las unidades de la fuerza pública, que se encuentren apoyando los procesos de control, vigilancia y seguridad ciudadana y de las del Municipio de Caracolí.","Antioquia : Caracolí","$ 18,984,226.00","2020-03-13T00:00:00.000","https://www.contratos.gov.co/consultas/detalleProceso.do?numConstancia=20-13-10563759"
"148","INV-013-2020","Contratación Mínima Cuantía","Celebrado","ANTIOQUIA - ALCALDÍA MUNICIPIO DE CARACOLÍ","Adquisición de póliza todo riesgo daños materiales que ampare los bienes muebles, inmuebles e intereses patrimoniales de propiedad del municipio de Caracolí y aquellos por los que sea o llegare a ser legalmente responsable.","Antioquia : Caracolí","$ 4,799,961.00","2020-03-10T00:00:00.000","https://www.contratos.gov.co/consultas/detalleProceso.do?numConstancia=20-13-10549040"
"149","INV-013-2020","Contratación Mínima Cuantía","Convocado","ANTIOQUIA - ALCALDÍA MUNICIPIO DE CARACOLÍ","Adquisición de póliza todo riesgo daños materiales que ampare los bienes muebles, inmuebles e intereses patrimoniales de propiedad del municipio de Caracolí y aquellos por los que sea o llegare a ser legalmente responsable.","Antioquia : Caracolí","$ 4,800,000.00","2020-03-07T00:00:00.000","https://www.contratos.gov.co/consultas/detalleProceso.do?numConstancia=20-13-10548976"
"150","INV-007-2020","Contratación Mínima Cuantía","Liquidado","ANTIOQUIA - ALCALDÍA MUNICIPIO DE CARACOLÍ","Suministro de papelería para facturar el impuesto predial unificado del primer y segundo trimestre del año 2020, y primer trimestre de industria y comercio de la misma vigencia, en el municipio de Caracolí conforme a la ficha técnica.","Antioquia : Caracolí","$ 2,007,000.00","2020-03-06T00:00:00.000","https://www.contratos.gov.co/consultas/detalleProceso.do?numConstancia=20-13-10390376"
