"id","n_mero_de_proceso","tipo_de_proceso","estado","entidad","objeto","departamento_y_municipio","cuant_a","fecha_dd_mm_aaaa","link"
"151","INV-009-2020","Contratación Mínima Cuantía","Liquidado","ANTIOQUIA - ALCALDÍA MUNICIPIO DE CARACOLÍ","Suministro de un escáner de alto rendimiento para la oficina de contratación, papelería y elementos de oficina, aseo y cafetería para el correcto funcionamiento de la Administración Municipal y el cumplimiento de los deberes misionales del municipio de Caracolí conforme a la ficha técnica.","Antioquia : Caracolí","$ 7,503,000.00","2020-02-29T00:00:00.000","https://www.contratos.gov.co/consultas/detalleProceso.do?numConstancia=20-13-10425860"
"152","INV-012-2020","Contratación Mínima Cuantía","Celebrado","ANTIOQUIA - ALCALDÍA MUNICIPIO DE CARACOLÍ","Suministro de combustibles derivados del petróleo, gasolina, ACPM, lubricantes, filtros, mantenimiento preventivo que incluye cambios de aceite y filtros a los automotores adscritos a la fuerza pública que se encuentre apoyando los procesos de control y vigilancia, seguridad vial, investigación y seguridad ciudadana dentro del municipio de Caracolí, Antioquia.","Antioquia : Caracolí","$ 4,000,000.00","2020-02-27T00:00:00.000","https://www.contratos.gov.co/consultas/detalleProceso.do?numConstancia=20-13-10485868"
"153","PSP-007-2020","Contratación Directa (Ley 1150 de 2007)","Celebrado","ANTIOQUIA - ALCALDÍA MUNICIPIO DE CARACOLÍ","Prestación de servicios profesionales como CONTADOR para asesorar y servir de apoyo a la gestión de la Secretaría De Hacienda del Municipio de Caracolí en el área contable y financiero.","Antioquia : Caracolí","$ 30,000,000.00","2020-02-25T00:00:00.000","https://www.contratos.gov.co/consultas/detalleProceso.do?numConstancia=20-12-10498708"
"154","CI-002-2020","Contratación Directa (Ley 1150 de 2007)","Celebrado","ANTIOQUIA - ALCALDÍA MUNICIPIO DE CARACOLÍ","Prestación de servicios administrativos, técnicos y financieros, para ejecutar las acciones del Plan de Salud Pública de Intervenciones Colectivas (PIC) y algunas acciones de Vigilancia en Salud Pública enmarcadas en el Plan Decenal de Salud Pública y el Plan Territorial de Salud del municipio de Caracolí Antioquia.","Antioquia : Caracolí","$ 47,514,000.00","2020-02-25T00:00:00.000","https://www.contratos.gov.co/consultas/detalleProceso.do?numConstancia=20-12-10498922"
"155","CI-001-2020","Contratación Directa (Ley 1150 de 2007)","Celebrado","ANTIOQUIA - ALCALDÍA MUNICIPIO DE CARACOLÍ","Prestación de servicios profesionales de Apoyo para la elaboración del plan de desarrollo Municipal de Caracolí - Antioquia de manera concertada entre la comunidad y la administración local tanto en su fase de diagnóstico (parte General), como el plan de inversiones siguiendo los parámetros de la ley 152 de 1994 y la normatividad vigente asociada.","Antioquia : Caracolí","$ 50,604,748.00","2020-02-20T00:00:00.000","https://www.contratos.gov.co/consultas/detalleProceso.do?numConstancia=20-12-10487732"
"156","PS-025-2020","Contratación Directa (Ley 1150 de 2007)","Celebrado","ANTIOQUIA - ALCALDÍA MUNICIPIO DE CARACOLÍ","Contrato de Prestación de servicios de apoyo logístico y operativo para la atención de los adultos mayores del centro de protección social al adulto mayor (CPSAM), Jesús de la Buena Esperanza del municipio de Caracolí-Antioquia.","Antioquia : Caracolí","$ 18,000,000.00","2020-02-20T00:00:00.000","https://www.contratos.gov.co/consultas/detalleProceso.do?numConstancia=20-12-10487820"
"157","PSP-006-2020","Contratación Directa (Ley 1150 de 2007)","Celebrado","ANTIOQUIA - ALCALDÍA MUNICIPIO DE CARACOLÍ","Prestación de servicios profesionales para realizar la asesoría en servicios públicos domiciliarios, implementación y cargue del sistema único de información ""SUI"", reportando los formularios y cargues masivos para dar cumplimientos a la normatividad legal emitidas por la superintendencia de servicios públicos domiciliarios en el municipio de Caracolí· Antioquia","Antioquia : Caracolí","$ 9,500,000.00","2020-02-19T00:00:00.000","https://www.contratos.gov.co/consultas/detalleProceso.do?numConstancia=20-12-10483320"
"158","PSP-006-2020","Contratación Directa (Ley 1150 de 2007)","Celebrado","ANTIOQUIA - ALCALDÍA MUNICIPIO DE CARACOLÍ","Prestación de servicios profesionales para realizar la asesoría en servicios públicos domiciliarios, implementación y cargue del sistema único de información ""SUI"", reportando los formularios y cargues masivos para dar cumplimientos a la normatividad legal emitidas por la superintendencia de servicios públicos domiciliarios en el municipio de Caracolí· Antioquia.","Antioquia : Caracolí","$ 9,500,000.00","2020-02-19T00:00:00.000","https://www.contratos.gov.co/consultas/detalleProceso.do?numConstancia=20-12-10487639"
"159","INV-004-2020","Contratación Mínima Cuantía","Liquidado","ANTIOQUIA - ALCALDÍA MUNICIPIO DE CARACOLÍ","Suministro de elementos que conforman los materiales y medios pedagógicos para aprendizaje, para la población estudiantil de la zona urbana y rural del municipio de Caracolí Antioquia, matriculada en el SIMAT, para el mejoramiento de la calidad de la educación y como estrategia que contribuye a la permanencia estudiantil y la disminución de la deserción escolar","Antioquia : Caracolí","$ 10,000,000.00","2020-02-17T00:00:00.000","https://www.contratos.gov.co/consultas/detalleProceso.do?numConstancia=20-13-10345876"
"160","PE-001-2019","Contratación Directa (Ley 1150 de 2007)","Liquidado","ANTIOQUIA - ALCALDÍA MUNICIPIO DE CARACOLÍ","LA CONTRATISTA SE OBLIGA CON LA PERSONERÍA MUNICIPAL, A PRESTAR LOS SERVICIOS DE APOYO A LA GESTIÓN EN EL DESARROLLO DE LAS FUNCIONES COMPLEMENTARIAS, DELEGADAS Y ASESORÍAS QUE TENGAN RELACIÓN CON LA FUNCIÓN MISIONAL DE LA PERSONERÍA MUNICIPAL, TAREAS QUE SERÁN CUMPLIDAS MEDIANTE UN CONJUNTO DE ACTIVIDADES ADMINISTRATIVAS, COMUNITARIAS Y DE GESTIÓN EN COORDINACIÓN CON EL PERSONERO MUNICIPAL.","Antioquia : Caracolí","$ 15,741,000.00","2020-02-15T00:00:00.000","https://www.contratos.gov.co/consultas/detalleProceso.do?numConstancia=19-12-8887847"
"161","CA-001-2020","Contratación Directa (Ley 1150 de 2007)","Celebrado","ANTIOQUIA - ALCALDÍA MUNICIPIO DE CARACOLÍ","Prestación de servicios de arrendamiento de un vehículo de representación, para el fortalecimiento institucional de la Alcaldía del Municipio De Caracolí.","Antioquia : Caracolí","$ 5,700,000.00","2020-02-14T00:00:00.000","https://www.contratos.gov.co/consultas/detalleProceso.do?numConstancia=20-12-10483286"
"162","INV-008-2020","Contratación Mínima Cuantía","Celebrado","ANTIOQUIA - ALCALDÍA MUNICIPIO DE CARACOLÍ","Suministro de víveres para la ejecución del programa de alimentación escolar-PAE, a través del cual se brinda un complemento alimentario a los niños, niñas y adolescentes de la matricula oficial del Municipio de Caracolí.","Antioquia : Caracolí","$ 30,508,000.00","2020-02-13T00:00:00.000","https://www.contratos.gov.co/consultas/detalleProceso.do?numConstancia=20-13-10419278"
"163","PS-020-2020","Contratación Directa (Ley 1150 de 2007)","Celebrado","ANTIOQUIA - ALCALDÍA MUNICIPIO DE CARACOLÍ","Prestación de servicios como instructor para las modalidades de deportes individuales, natación, atletismo, ciclismo, patinaje, fortaleciendo a los centros de iniciación y formación deportiva.","Antioquia : Caracolí","$ 6,030,000.00","2020-02-08T00:00:00.000","https://www.contratos.gov.co/consultas/detalleProceso.do?numConstancia=20-12-10437760"
"164","PS-014-2020","Contratación Directa (Ley 1150 de 2007)","Celebrado","ANTIOQUIA - ALCALDÍA MUNICIPIO DE CARACOLÍ","Prestación de Servicios de Apoyo a la Gestión para la Operación, y mantenimiento preventivo y constante de la Volqueta International TDY-566 y demás vehículos de propiedad y Adscritos al Municipio, que garanticen la Correcta Operación de los mismos","Antioquia : Caracolí","$ 13,584,000.00","2020-02-06T00:00:00.000","https://www.contratos.gov.co/consultas/detalleProceso.do?numConstancia=20-12-10414964"
"165","PS-008-2020","Contratación Directa (Ley 1150 de 2007)","Celebrado","ANTIOQUIA - ALCALDÍA MUNICIPIO DE CARACOLÍ","Prestación de servicios para la planeación de intervenciones correctivas en las zonas de riesgo y para la sensibilización, conservación, protección, restauración y aprovechamiento de los recursos naturales y del medio ambiente en el Municipio de Caracolí.","Antioquia : Caracolí","$ 8,820,000.00","2020-02-04T00:00:00.000","https://www.contratos.gov.co/consultas/detalleProceso.do?numConstancia=20-12-10412086"
"166","INV-006-2020","Contratación Mínima Cuantía","Terminado Anormalmente después de Convocado","ANTIOQUIA - ALCALDÍA MUNICIPIO DE CARACOLÍ","Suministro de papelería para facturar el impuesto predial unificado del primer y segundo trimestre del año 2020, y primer trimestre de industria y comercio de la misma vigencia, en el municipio de Caracolí conforme a la ficha técnica.","Antioquia : Caracolí","$ 2,007,000.00","2020-02-04T00:00:00.000","https://www.contratos.gov.co/consultas/detalleProceso.do?numConstancia=20-13-10374284"
"167","INV-003-2020","Contratación Mínima Cuantía","Celebrado","ANTIOQUIA - ALCALDÍA MUNICIPIO DE CARACOLÍ","Suministro de combustibles derivados del petróleo, gasolina, ACPM, lubricantes, filtros, para los vehículos automotores adscritos al municipio de Caracolí y los vehículos en calidad de alquiler que se encuentren prestando sus servicios para el desplazamiento de los funcionarios con el objetivo de dar cumplimiento a los deberes misionales del municipio de Caracolí, Antioquia","Antioquia : Caracolí","$ 29,131,173.00","2020-01-29T00:00:00.000","https://www.contratos.gov.co/consultas/detalleProceso.do?numConstancia=20-13-10335672"
"168","INV-002-2020","Contratación Mínima Cuantía","Terminado Anormalmente después de Convocado","ANTIOQUIA - ALCALDÍA MUNICIPIO DE CARACOLÍ","Suministro de combustibles derivados del petróleo, gasolina, ACPM, lubricantes, filtros, para los vehículos automotores adscritos al municipio de Caracolí y los vehículos en calidad de alquiler que se encuentren prestando sus servicios para el desplazamiento de los funcionarios con el objetivo de dar cumplimiento a los deberes misionales del municipio de Caracolí, Antioquia.","Antioquia : Caracolí","$ 20,000,000.00","2020-01-24T00:00:00.000","https://www.contratos.gov.co/consultas/detalleProceso.do?numConstancia=20-13-10317917"
"169","PSP-003-2020","Contratación Directa (Ley 1150 de 2007)","Celebrado","ANTIOQUIA - ALCALDÍA MUNICIPIO DE CARACOLÍ","Prestación de servicios profesionales para la actualización y mantenimiento del software de manejo contable utilizado en la secretaria de hacienda, asistencia técnica, soporte vía remota y asistencia telefónica permitiendo el normal desarrollo de las funciones de propias de dicha dependencia","Antioquia : Caracolí","$ 16,100,000.00","2020-01-20T00:00:00.000","https://www.contratos.gov.co/consultas/detalleProceso.do?numConstancia=20-12-10328789"
