"nombre_del_tramite","descripci_n","url"
"Retiro de personas de la base de datos del sistema de identificación y clasificación de potenciales beneficiarios de programas sociales - SISBEN","Eliminar de la base de datos del SISBEN, las personas que pertenezcan a un hogar y que hayan fallecido o a quienes cambien de domicilio ya sea a otro municipio o dentro del mismo. Si el jefe del hogar es la persona que se va a retirar de la base de datos, se deberá definir quién va a ser el nuevo jefe del hogar.","https://www.nomasfilas.gov.co/buscador/-/tramite/T10627"
"Retiro de un hogar de la base de datos del sistema de identificación y clasificación de potenciales beneficiarios de programas sociales - SISBEN","Obtener el retiro de la totalidad de los miembros de un hogar de la base de datos del SISBEN por traslado a otro municipio.","https://www.nomasfilas.gov.co/buscador/-/tramite/T13862"
"Supervisión delegado de sorteos y concursos","Realizar los sorteos y concursos con la supervisión de un delegado.","https://www.nomasfilas.gov.co/buscador/-/tramite/T53886"
"Traslado de cadáveres","Autorización para movilizar cadáveres y/o restos humanos u óseos de un cementerio a otro dentro del mismo municipio o de un municipio a otro dentro del territorio colombiano.","https://www.nomasfilas.gov.co/buscador/-/tramite/T53965"
"Vacunación antirrábica de caninos y felinos","Vacunar a perros y/o gatos susceptibles de transmitir la enfermedad de la rabia.","https://www.nomasfilas.gov.co/buscador/-/tramite/T51628"
