"city","contact_name","contact_organization","contact_phone","contact_email_address","project_website","project_name","project_address","project_address_2","project_address_city","project_address_state","project_address_zip_code","building_type","number_of_units","number_of_affordable_units","studio","group_home","licensed_care_facility","shared","one_bedroom","two_bedrooms","three_bedrooms","four_bedrooms","five_bedrooms","resident_eligibility","under_construction","near_transit","description","location","location_address","location_city","location_state","location_zip"
"Burlingame",,"Neighborhood Housing Services Silicon Valley","(408) 279-2600",,,,"904 Bayswater Ave",,"Burlingame","CA","94010","Condo rental","6","1",,,,,,"1",,,,"All","0","1","Moderate income","POINT (-122.340177 37.578817)","904 Bayswater Ave",,"CA","94010"
"Foster City",,"Thompson Dorfman","(415) 381-3001",,"http://www.tritonpointe.com","Triton Pointe","1125 E Hillsdale Blvd",,"Foster City","CA","94404","Apartment","166","33",,,,,"1","1","1",,,"All","0","1","Estimated completion: Summer 2015 166 apartments (20% affordable,","POINT (-122.268428 37.56221)","1125 E Hillsdale Blvd",,"CA","94404"
"San Mateo","Mike Tannous",,"(650) 678-3781",,,"Darcy Building","205 S Ellsworth Street",,"San Mateo","CA","94401","Apartment","8","8",,,,,"1","1",,,,"All, Accepts Section 8","0","1","This complex is located at Ellsworth and 2nd Ave. The building has an elevator. There are six 1-BR apartments and two 2-BR apartments. The landlord accepts Section 8 vouchers.","POINT (-122.324109 37.565837)","205 S Ellsworth Street",,"CA","94401"
"Redwood City","Sr. Christina Heltsley","St. Francis Center","(650) 365-7829",,"http://www.stfrancisrwc.org","St. Clare Apartments","2683 Marlborough Ave",,"Redwood City","CA","94063","Apartment","24","24","1",,,,"1",,,,,"Family","0","1","For extremely low income families; part of the St. Francis Center.","POINT (-122.214943 37.473298)","2683 Marlborough Ave",,"CA","94063"
"Menlo Park",,"Abilities United","(650) 494-0550",,,"Oakley St. Group Home","2098 Oakley Ave",,"Menlo Park","CA","94025","Group Home","6","6",,"1",,,,,,,,"People with disabilities","0","0","Permanent housing for developmentally disabled individuals.","POINT (-122.203983 37.433288)","2098 Oakley Ave",,"CA","94025"
"Belmont",,"Paradigm Healthcare, LP","(650) 591-2008",,,"Belmont Vista Senior Community","900 Sixth Avenue",,"Belmont","CA","94002","Apartment","98","10",,,,,"1","1",,,,"Seniors","0","0","Ten units restricted to moderate income seniors.","POINT (-122.278025 37.520071)","900 Sixth Avenue",,"CA","94002"
"South San Francisco",,"Metropolitan Hotel","(650) 588-7802",,,"Metropolitan Hotel","220 Linden Avenue",,"South San Francisco","CA","94080","Apartment","62","62",,,,,,,,,,"Homeless","0","0","Single room occupancy","POINT (-122.410218 37.654862)","220 Linden Avenue",,"CA","94080"
"Pacifica","Jack Melendy",,"(650) 359-2114",,,"Oceanview","555 Crespi Drive",,"Pacifica","CA","94044","Apartment","100","100",,,,,"1",,,,,"Seniors","0","0","Typically accepts Section 8 vouchers, although site is not a project-based section 8 site.","POINT (-122.499022 37.598876)","555 Crespi Drive",,"CA","94044"
"East Palo Alto",,,"(650) 324-2525","Woodlands@midpen-housing.org",,"Woodlands/Newell","1767 Woodland Ave",,"East Palo Alto","CA","94303","Apartment","23","23","1",,,,,"1","1","1",,"All, Resident eligibility criteria must be met","0","0","Family property with community center offering services for all","POINT (-122.136398 37.454482)","1767 Woodland Ave",,"CA","94303"
"Redwood City",,"Kainos","(650) 363-2423",,"http://www.kainosusa.org","Kainos La Vista","3631 Jefferson Avenue",,"Redwood City","CA","94062","Group Home","1",,,,"1",,,,,,,"People with Disabilities","0","0","17 beds; For developmentally disabled individuals. Residents receive training in practical living skills; staff is on-site 24 hours a day.","POINT (-122.252111 37.464438)","3631 Jefferson Avenue",,"CA","94062"
"Burlingame",,"Neighborhood Housing Services Silicon Valley","(408) 279-2600",,,,"1321 El Camino Real",,"Burlingame","CA","94010","Apartment","5","1",,,,,,"1",,,,"All","0","1","Moderate income","POINT (-122.370693 37.586774)","1321 El Camino Real",,"CA","94010"
"South San Francisco",,"MidPen Housing","(650) 827-4000","636elcamino@midpen-housing.org",,,"636 El Camino Real Phase I",,"South San Francisco","CA","94080","Apartment","108","62",,,,,"1","1","1",,,"20 units - People with Disabilities, 88 units – All, Resident eligibility criteria must be met","0","1","Apartment complex features community gardens, outdoor play areas, a fitness center, and a computer lab. Located in close proximity to major bus lines, BART, South San Francisco public schools, restaurants and shopping.",,"636 El Camino Real Phase I",,"CA","94080"
"San Bruno",,"KDF Communities","(650) 588-8036",,"http://www.villageatthecrossing.net","Village at the Crossing","1101 National Ave",,"San Bruno","CA","94066","Apartment","228","228",,,,,"1","1",,,,"Seniors","0","1","Opened in 2007. Across the street from Tanforan Shopping Center, close to BART. All
100% of the units are affordable to seniors at a range of income levels: 29 extremely low income units, 12 very low income units and 187 low income units.","POINT (-122.422829 37.634396)","1101 National Ave",,"CA","94066"
"Burlingame",,"Mental Health Association of San Mateo County","(650) 368-3345",,,"Burlingame Apartments","11 Burlingame Avenue",,"Burlingame","CA","94010","Apartment","5","5",,,,,"1","1","1",,,"People with disabililities who meet HUD guidelines for homelessness","0","0","For individuals with mental illness. Property owned and operated by Mental Health Association.","POINT (-122.335893 37.586441)","11 Burlingame Avenue",,"CA","94010"
"Menlo Park",,"MidPen Housing","(650) 323-5615","WillowTerrace@midpen-housing.org",,"Willow Terrace","1115 - 1143 Willow Road",,"Menlo Park","CA","94025","Apartment","31","30",,,,,"1",,,,,"Seniors, and others who meet resident eligibility criteria","0","1","1-bdrm apartments. Most apartments were upgraded in 1995, and some were upgraded in 2000.","POINT (-122.156149 37.47012)","1115 - 1143 Willow Road",,"CA","94025"
"San Mateo",,"MidPen Housing","(650) 342-7211","StMatthew@midpen-housing.org",,"St. Matthew Apartments","215 East 2nd Avenue",,"San Mateo","CA","94401","Apartment","56","56",,,,,,,,,,"All, Resident eligibility criteria must be met Accepts Section 8","0","1","Single room occupancy. Studio units with private or semi-private baths in downtown San Mateo. Renovated in 1997. Mental Health Association provides on-site services.","POINT (-122.323825 37.556076)","215 East 2nd Avenue","San Mateo","CA","94401"
"San Mateo",,"Lesley Senior Communities","(650) 342-2051",,"http://www.lesleyseniorcommunities.org","Lesley Towers","700 Laurel Avenue",,"San Mateo","CA","94401","Apartment","200","200","1",,,,"1",,,,,"Seniors Accepts Section 8","0","1","Lesley Towers has 158 studio apartments and 40 one-bedroom apartments. Tenants pay 30% of adjusted monthly income; income restrictions apply. Check website for Wait List status.","POINT (-122.320615 37.561996)","700 Laurel Avenue",,"CA","94401"
"Menlo Park",,"MidPen Housing","(650) 323-5615","Gateway@midpen-housing.org",,"Gateway Apartments","1345 Willow Road",,"Menlo Park","CA","94025","Apartment","130","130","1",,,,"1","1","1",,,"All, Resident eligibility criteria must be met","0","1","Must be on San Mateo County's Moderate Rehab Waiting list. Completely renovated in 1987 & features garden-style apartments. Playground, community room, computer center, and services are onsite.","POINT (-122.152025 37.47774)","1345 Willow Road",,"CA","94025"
"South San Francisco",,"MidPen Housing","(650) 616-4570","Greenridge@midpen-housing.org",,"Greenridge","1565 El Camino Real",,"South San Francisco","CA","94080","Apartment","34","33",,,,,,"1","1","1",,"All, Resident eligibility criteria must be met","0","1","Eight residential buildings grouped around 2 landscaped courtyards and play area.Across from BART station and shopping facilities, with nearby schools. Also has laundry facillity and communty room with computer lab and onsite services.","POINT (-122.449011 37.664218)","1565 El Camino Real",,"CA","94080"
"Colma",,"Hildebrand Real Estate Group","(650) 755-0610",,,"Verano","1365 Mission Road",,"Colma","CA","94014","Townhome","63","1",,,,,,"1",,,,"All","0","1","Town-owned unit restricted to low and moderate income households. Unit is occupied, please do not call.",,"1365 Mission Road",,"CA","94014"
"San Mateo",,"City of San Mateo",,,,"Archstone San Mateo","1101 Park Pl",,"San Mateo","CA","94403","Apartment","575","58",,,,,"1","1","1",,,"All","0","1","Mixed income development. Waiting List is Closed","POINT (-122.29042 37.545928)","1101 Park Pl",,"CA","94403"
"San Carlos",,"HIP Housing","(650) 348-6820",,,"Cherry Street Apartments","1244 Cherry Street",,"San Carlos","CA","94070","Apartment","6","6",,,,,"1","1",,,,"All","0","1","There is 1- 1 bedroom apartment and 5 - 2 bedroom apartments. Two of the apartments are accessible.","POINT (-122.260331 37.504749)","1244 Cherry Street",,"CA","94070"
"Foster City","Property Manager",,"(877) 506-2678",,"http://www.plazafostercity.com","The Plaza","1 Plaza View Lane",,"Foster City","CA","94404","Apartment","307","60",,,,,"1","1","1",,,"All","0","1","307 apartments (20% affordable, 60 units). On-site amenities include pool, fitness center, clubhouse, yoga room, business center, washer/dryer in all units.","POINT (-122.270712 37.56436)","1 Plaza View Lane",,"CA","94404"
"Pacifica","Irina Ayrapetyan","Mercy Housing","(650) 359-6161",,,"Oceana Terrace","903 Oceana Blvd",,"Pacifica","CA","94044","Apartment","42","42",,,,,"1",,,,,"Seniors","0","0",,"POINT (-122.49058 37.641267)","903 Oceana Blvd",,"CA","94044"
"Redwood City",,"MidPen Housing","(650) 363-2119","RedwoodCourt@midpen-housing.org",,"Redwood Court","635 Spruce Street",,"Redwood City","CA","94063","Apartment","27","27",,,,,,"1","1",,,"All, Resident eligibility criteria must be met","0","0","Built in 1983 and renovated in 2004. Complex features garden apartments and townhomes. Amenities include private balconies and laundry facilities.","POINT (-122.218312 37.482741)","635 Spruce Street",,"CA","94063"
"Redwood City",,,"(650) 367-8176",,,"Redwood City Commons","875 Walnut Street",,"Redwood City","CA","94063","Apartment","58","58",,,,,"1",,,,,"Seniors, People with Disabilities","0","1",,"POINT (-122.225193 37.485391)","875 Walnut Street",,"CA","94063"
"San Mateo",,"City of San Mateo",,,,"Chamberlain","540 S El Camino Real",,"San Mateo","CA","94402","Apartment","21","2",,,,,,"1",,,,"All","0","1","2 two bedroom units in 21 unit complex. Mixed income development. Waiting List is Closed","POINT (-122.323416 37.560591)","540 S El Camino Real",,"CA","94402"
"San Bruno",,"Avalon Bay","(650) 589-9100",,,"Avalone San Bruno Apartments I","1099 Admiral Court",,"San Bruno","CA","94066","Apartment","300","60",,,,,"1","1","1",,,"Family","0","1","Opened in 2005. Mixed income site. 30 one-bedroom and 30 two-bedroom affordable units. Families up to 50% of median income are eligible.","POINT (-122.421033 37.63458)","1099 Admiral Court",,"CA","94066"
"South San Francisco","Larmil Beasonda",,"(650) 588-8350",,,"Magnolia Plaza","630 Baden Avenue",,"South San Francisco","CA","94080","Apartment","125","125",,,,,"1",,,,,"Seniors","0","0","50% of units for low income; 50% of units for moderate income","POINT (-122.421086 37.65654)","630 Baden Avenue",,"CA","94080"
"San Carlos",,"Midpen Housing","(650) 637-8206","LaureolaOaks@midpen-housing.org",,"Laureola Oaks","907 E San Carlos Ave",,"San Carlos","CA","94070","Apartment","16","16",,,,,"1","1","1",,,"All, Resident eligibility criteria must be met","0","0","Located in a mixed light industrial and residential neighborhood and was completed in 1994. Features 16 garden-style townhomes surrounding a central courtyard.","POINT (-122.256242 37.510301)","907 E San Carlos Ave",,"CA","94070"
"San Mateo",,"City of San Mateo",,,,"Metropolitan Condominiums","337 and 338 S Fremont",,"San Mateo","CA","94401","Apartment","219","22",,,,,"1","1",,,,"All","0","1","4 low income units and 18 very low income units. Mixed income development. Waiting List is Closed",,"337 and 338 S Fremont",,"CA","94401"
"East Palo Alto",,,"(650) 329-7879",,,"Courtyard at Bay Road","1730 Bay Road",,"East Palo Alto","CA","94303","Apartment","77","77",,,,,"1","1","1",,,"Family","0","0","The units are a mix of 1-, 2- and 3-bedroom homes. On-site amenities include a grand plaza on the second floor, secured parking and community rooms.","POINT (-122.13697 37.471657)","1730 Bay Road",,"CA","94303"
"San Mateo",,"HIP Housing","(650) 348-6820",,,"Delaware Building","11 South Delaware",,"San Mateo","CA","94401","Apartment","11","11","1",,,,"1",,,,,"All, Accepts Section 8","0","1","There is 1 studio apartment and 10 -1 bedrooms. 4 units are on the ground floor.","POINT (-122.322708 37.569547)","11 South Delaware",,"CA","94401"
"San Carlos","Barbara","PARCA","(650) 312-0730",,,"Cedar St Group Home","727 Cedar Street",,"San Carlos","CA","94070","Group Home","8","8",,"1",,,,,,,,"People with Disabilities","0","0","Four-bedroom accessible home for 8 individuals with development disabilities. Staff provide training on independent living skills.","POINT (-122.262365 37.501567)","727 Cedar Street",,"CA","94070"
"Half Moon Bay",,"MidPen Housing","(650) 560-4872","Moonridge@midpen-housing.org",,"Moonridge I and II","2001 Miramontes Point Road East",,"Half Moon Bay","CA","94019","Apartment","160","160",,,,,,"1","1","1",,"Farm Worker Households","0","0","Large units for farmworker housing. 51% of household income must be from farm labor. On-site Head Start program and other amenities.","POINT (-122.417238 37.435337)","2001 Miramontes Point Road East",,"CA","94019"
"Half Moon Bay",,"Ocean Colony Partners LP","(650) 560-0055",,,"Wavecrest Plaza","2456 S Cabrillo Hwy",,"Half Moon Bay","CA","94019","Apartment","12","12",,,,,"1","1",,,,"Family","0","1","5 very low and 7 low or moderate income units. Affordability provisions expire 2038.","POINT (-122.426666 37.431714)","2456 S Cabrillo Hwy",,"CA","94019"
"Redwood City",,"Caminar","(650) 367-9610",,"http://www.caminarinc.org","YAIL","37 Clinton Street",,"Redwood City","CA","94062","Group Home","4",,,"1",,,,,,,,"People with Disabilities","0","1","6 beds; Four-plex with shared, two-bedroom units for young adults, 18-23 with mental illness.","POINT (-122.241419 37.487734)","37 Clinton Street",,"CA","94062"
"Redwood City",,,"(650) 261-9900",,"http://www.villamontgomery.org","Villa Montgomery","1500 El Camino Real",,"Redwood City","CA","94063","Apartment","58","57","1",,,,"1","1","1",,,"All","0","1","Accessible rental units affordable at 20-50% of area median income.","POINT (-122.227359 37.480386)","1500 El Camino Real",,"CA","94063"
"Belmont","Phil Surdel","Family Housing and Adult Resources, Inc.","(650) 593-2516",,,"Hiller Street Group Home","803 Hiller Street",,"Belmont","CA","94002","Group Home","6","6",,,,"1",,,,,,"People with Disabilities","0","0","For developmentally disabled, abused children.","POINT (-122.274229 37.525578)","803 Hiller Street",,"CA","94002"
"Redwood City",,"Mental Health Association of SMC","(650) 368-3345",,"http://www.mhasmc.org","Hurlingame Permanent Housing","791 Hurlingame Avenue",,"Redwood City","CA","94063","Group Home","1",,,"1",,,,,,,,"People with Disabilities","0","1","Permanent supportive housing for homeless adults with mental illness.","POINT (-122.207895 37.481953)","791 Hurlingame Avenue",,"CA","94063"
"Foster City","Property Manager",,"(650) 287-4389",,"http://www.prometheusreg.com/residential/mma.html","Miramar Apartments","1288 East Hillsdale Blvd",,"Foster City","CA","94404","Apartment","159","48",,,,,"1","1",,,,"All","0","1","159 apartments (30% affordable, 48 units). On lagoon. On-site amenities include pool, fitness center, clubhouse, washer/dryer in all units.","POINT (-122.265859 37.568791)","1288 East Hillsdale Blvd",,"CA","94404"
"Colma",,"MidPen Housing","(650) 755-3591","SanPedroCommons@midpen-housing.org",,"San Pedro Commons","101 A Street",,"Colma","CA","94014","Apartment","74","74",,,,,"1","1",,,,"Seniors","0","1","Plenty of community spaces, open-air courtyard, and on-site service coordinator. Located one-half block from Colma BART station and served by major bus lines. Residents can walk to community services and a large grocery store is less than one-half block from the building.","POINT (-122.467835 37.686404)","101 A Street",,"CA","94014"
"San Mateo",,,"(650) 593-2516",,,"Hamlet St. Group Home","1773 Hamlet Street",,"San Mateo","CA","94404","Group Home","8","8",,,,"1",,,,,,"People with Disabilities","0","0","Accessible housing for developmentally disabled individuals.","POINT (-122.296317 37.55717)","1773 Hamlet Street",,"CA","94404"
"San Mateo","Kevin Gogue",,"(650) 212-4400","VilMgr@fountainglen.com",,"Fountainglen at San Mateo","4000 S El Camino Real",,"San Mateo","CA","94402","Apartment","135","14",,,,,"1","1",,,,"Seniors","0","1","Conversion of the former Radison Villa Hotel to senior apartments. Mixed income development.",,"4000 S El Camino Real",,"CA","94402"
"Menlo Park",,,"(650) 325-2442",,,"Crane Place","1331 Crane Street",,"Menlo Park","CA","94025","Apartment","93","93","1",,,,"1",,,,,"Seniors (62 yrs and older) or Disabled","0","1",,"POINT (-122.188924 37.453142)","1331 Crane Street",,"CA","94025"
"Daly City",,,"(650) 994-8010",,,"Villa Fontana","50 East Market Street",,"Daly City","CA","94015","Apartment","120","120",,,,,"1",,,,,"Seniors","0","0",,"POINT (-122.46475 37.689745)","50 East Market Street",,"CA","94015"
"Menlo Park",,,"(650) 324-3160",,,"Partridge Kennedy Apartments","817 Partridge Avenue",,"Menlo Park","CA","94025","Apartment","30","30",,"1",,,,,,,,"Seniors","0","0",,"POINT (-122.177064 37.446688)","817 Partridge Avenue",,"CA","94025"
"Foster City",,"Thompson Dorfman","(415) 381-3001",,,"Waverly","88 Triton Park Ln",,"Foster City","CA","94404","Apartment","240","48",,,,,"1","1","1",,,"All","0","1","Estimated completion: Summer 2016 240 apartments (20% affordable, 48 units)",,"88 Triton Park Ln",,"CA","94404"
"Foster City",,"MidPen Housing","(650) 356-2910",,,"Foster Square","710 Foster City Blvd",,"Foster City","CA","94404","Apartment","66","66",,,,,"1",,,,,"Seniors (55+)","1","1","Estimated completion: early 2016. Contact Raquel at rrothenbuescher@midpen-housing.org or 650-356-2910","POINT (-122.267233 37.560229)","710 Foster City Blvd",,"CA","94404"
"Burlingame",,"Neighborhood Housing Services Silicon Valley","(408) 279-2600",,,,"1512-1516 Floribunda Ave",,"Burlingame","CA","94010","Condo rental","9","1",,,,,,"1",,,,"All","0","1","Moderate income","POINT (-122.354519 37.578786)","1512-1516 Floribunda Ave",,"CA","94010"
"Redwood City",,"Service League of San Mateo County","(650) 364-4664",,"http://serviceleague.org","Rolison Road Apartments","3272 Rolison Road",,"Redwood City","CA","94063","Apartment","7","7",,,,,"1","1",,,,"All","0","0",,"POINT (-122.194146 37.48583)","3272 Rolison Road",,"CA","94063"
"Menlo Park",,"HIP Housing","(650) 348-6820",,,"Willow Road","1157-1161 Willow Road",,"Menlo Park","CA","94025","Apartment","12","12",,,,,"1","1",,,,"All","0","1","Must live or work in Menlo Park","POINT (-122.155331 37.47166)","1157-1161 Willow Road",,"CA","94025"
"Millbrae","Edwin Law, owner",,,"edwinlaw@pwdgi.com",,"Pinedera","120 S El Camino Real",,"Millbrae","CA","94030","Condo","54","2",,,,,,,"1",,,"All","0","1","54 units on 3 floors over ground floor commercial near BART, supermarkets, and other retail.","POINT (-122.386095 37.597362)","120 S El Camino Real",,"CA","94030"
"East Palo Alto",,,"(650) 473-9838",,,"Clarke Avenue Apartments","2377, 2387, 2397 Clarke Avenue",,"East Palo Alto","CA","94303","Apartment","15","15",,,,,"1","1",,,,"Family","0","0","A mix of 1 and 2 bedroom apartments. Amenities include On-site Laundry Room, Private Community Backyard and covered parking.","POINT (-122.134927 37.471046)","2377, 2387, 2397 Clarke Avenue",,"CA","94303"
"Redwood City",,"Kainos","(650) 363-2423",,"http://www.kainosusa.org","Kainos Group Home","3631 Jefferson Avenue",,"Redwood City","CA","94062","Group Home","1",,,,"1",,,,,,,"People with Disabilities","0","0","11 beds; For developmentally disabled individuals. Residents receive training in practical living skills; staff is on-site 24 hours a day.","POINT (-122.252111 37.464438)","3631 Jefferson Avenue",,"CA","94062"
"Redwood City",,"Sares-Regis Group","(855) 809-8627",,"http://www.livetownship.com","Township Apartments","333 Main Street",,"Redwood City","CA","94063","Apartment","132","17",,,,,"1","1","1",,,"All","0","1",,"POINT (-122.227445 37.491387)","333 Main Street",,"CA","94063"
"Redwood City",,"Service League of San Mateo County","(650) 364-4664",,"http://serviceleague.org","Hope House IV","926 4th Avenue",,"Redwood City","CA","94063","Group Home","1",,,"1",,,,,,,,"Re-entry individuals from incarceration","0","1","6 beds; Must apply directly with Service League. Transitional Housing","POINT (-122.198986 37.482423)","926 4th Avenue","Redwood City","CA","94063"
"Pacifica",,"Pacific Oaks Associates","(650) 359-7559",,,"Pacific Oaks","750 Oddstad Boulevard",,"Pacifica","CA","94044","Apartment","104","104",,,,,"1",,,,,"Seniors","0","0",,"POINT (-122.474435 37.582919)","750 Oddstad Boulevard",,"CA","94044"
"Burlingame",,,"(650) 697-7237",,,"Palm Ave Group Home","1400 Palm Avenue",,"Burlingame","CA","94010","Group Home","8","8",,,,"1",,,,,,"People with Disabilities","0","0","For developmentally disabled individuals.","POINT (-122.230071 37.465779)","1400 Palm Avenue",,"CA","94010"
"Half Moon Bay",,"Mercy Housing","(650) 276-4819",,,"Coastside Senior Housing","925 Main Street",,"Half Moon Bay","CA","94019","Apartment","40","40",,,,,"1",,,,,"Seniors","0","0",,"POINT (-122.430049 37.45658)","925 Main Street",,"CA","94019"
"East Palo Alto","Harold Rogers",,"(650) 328-4700","hrogers@edenhousing.org",,"Light Tree Apartments","1805 East Bayshore Rd","# 100","East Palo Alto","CA","94303","Apartment","94","94","1",,,,"1","1","1",,,"Mulitfamily","0","1","This is a Project-Based Section 8 property. Pool, two playgrounds & computer room. Located on East Bayshore Rd & Clarke Ave.","POINT (-122.133651 37.456537)","1805 East Bayshore Rd",,"CA","94303"
"Foster City",,"HIP Housing","(650) 348-6820",,,,"Chesapeake Ave",,"Foster City","CA","94404","Single detached house","1","1",,,,,,,"1",,,"All","0","1","This is a 3-bedroom house owned by Foster City and managed by HIP Housing Affordable Ventures.",,"Chesapeake Ave",,"CA","94404"
"San Mateo",,"City of San Mateo",,,,"Bridgepointe Condominiums","1987 Bridgepointe Pkwy",,"San Mateo","CA","94404","Apartment","399","59",,,,,"1","1","1",,,"All","0","0","59 affordable units for very low and moderate income categories. Waiting List is Closed","POINT (-122.282127 37.562283)","1987 Bridgepointe Pkwy",,"CA","94404"
"Daly City",,,"(650) 578-8691",,,"Tehanan II","20 Third Avenue",,"Daly City","CA","94015","Apartment","4","4",,,,,,"1",,,,"Disabeled","0","1","Four two-bedroom units of affordable housing for adults with mental illness. On-site program offered by Caminar. Property owned and operated by Mental Health Association","POINT (-122.462567 37.692655)","20 Third Avenue",,"CA","94015"
"South San Francisco",,"MidPen Housing","(650) 616-4570","Sundial@midpen-housing.org",,"Sundial","215 4th Lane",,"South San Francisco","CA","94080","Apartment","11","11","1",,,,,,,,,"All, Resident eligibility criteria must be met","0","0","Units located above retail space in downtown South San Francisco","POINT (-122.408635 37.655363)","215 4th Lane",,"CA","94080"
"South San Francisco","Sapunar Realty",,"(415) 564-2111",,,,"204-206 Grand Ave",,"South San Francisco","CA","94080","Apartment","8","6","1",,,,,,,,,"All","0","0","For very low to moderate income individuals.","POINT (-122.40883 37.654876)","204-206 Grand Ave",,"CA","94080"
"Redwood City",,"MidPen Housing","(650) 261-1750","CityCenterPlaza@midpen-housing.org",,"City Center Plaza","950 Main Street",,"Redwood City","CA","94063","Apartment","81","80",,,,,"1","1","1","1",,"All, Resident eligibility criteria must be met","0","1","Affordable housing over retail and service, near public library, city hall, shopping and train station.","POINT (-122.226184 37.484937)","950 Main Street",,"CA","94063"
"Belmont",,"Lesley Senior Communities","(650) 593-1818",,"http://www.lesleyseniorcommunities.org","Lesley Terrace","2400 Carlmont Drive",,"Belmont","CA","94002","Apartment","164","164","1",,,,"1",,,,,"Seniors","0","1","Lesley Terrace has a total of 150 studio apartments, 22 of these studios & 2 one-bedrooms are licensed as Assisted Living, and 14 one-bedroom apartments. There is a mandatory meal program. Income restrictions apply; there are 60 Section 8 subsidized units. Check website for Wait List status.","POINT (-122.300003 37.509052)","2400 Carlmont Drive",,"CA","94002"
"Belmont","Michael Maylan","Mental Health Association of San Mateo County","(650) 637-1183",,,"Belmont Apartments","800 F Street",,"Belmont","CA","94002","Apartment","24","24","1",,,,,,,,,"People with Disabilities who meet HUD guidelines for homelessness","0","1","24 accessible apartments, one for on-site manager. Referrals by County Mental Health system only.","POINT (-122.267643 37.513931)","800 F Street",,"CA","94002"
"Colma",,"Bridge Housing Corporation","(415) 989-1111",,,"Trestle Glen","370 F Street",,"Colma","CA","94014","Apartment","119","119",,,,,"1","1","1",,,"Family","0","1","Affordable family community near parks, community center, retail/restaurants. Located next to Colma BART station, a Samtrans bus depot, and El Camino Real.","POINT (-122.465136 37.682503)","370 F Street",,"CA","94014"
