"city","contact_name","contact_organization","contact_phone","contact_email_address","project_website","project_name","project_address","project_address_2","project_address_city","project_address_state","project_address_zip_code","building_type","number_of_units","number_of_affordable_units","studio","group_home","licensed_care_facility","shared","one_bedroom","two_bedrooms","three_bedrooms","four_bedrooms","five_bedrooms","resident_eligibility","under_construction","near_transit","description","location","location_address","location_city","location_state","location_zip"
"San Mateo","Issa Shami",,"(650) 292-0991",,,"Belmont Building","220 East Third Avenue",,"San Mateo","CA","94401","Apartment","6","6",,,,,"1",,,,,"All, Accepts Section 8","0","1","Units in second story over retail in heart of downtown San Mateo.","POINT (-122.322643 37.565346)","220 East Third Avenue",,"CA","94401"
"Daly City","Ramona Garcia","Mercy Housing","(650) 991-1638",,,"School House Station","99 School Street",,"Daly City","CA","94014","Apartment","47","47",,,,,,"1","1","1",,"All","0","1",,"POINT (-122.46555 37.693414)","99 School Street",,"CA","94014"
"San Mateo",,"MidPen Housing","(650) 212-0935",,,"Peninsula Station","2901 S El Camino Real",,"San Mateo","CA","94403","Apartment","68","68",,,,,"1","1","1",,,"All, Resident eligibility criteria must be met","0","1","Transit oriented, located near Hillsdale CalTrain Station and Hilsdale Shopping Center.","POINT (-122.301654 37.540671)","2901 S El Camino Real",,"CA","94403"
"Redwood City",,"Kainos","(650) 363-2423",,"http://www.kainosusa.org","Wy's House","2033 Jefferson Avenue",,"Redwood City","CA","94063","Group Home","1",,,"1",,,,,,,,"People with Disabilities","0","1","5 beds; Accessible housing for developmentally disabled adults.",,"2033 Jefferson Avenue",,"CA","94063"
"Redwood City",,"HIP Housing","(650) 348-6820",,,"Redwood Oaks","330-340 Redwood Ave",,"Redwood City","CA","94061","Apartment","36","35",,,,,"1","1",,,,"All","0","0","Must be on San Mateo County's Project Based Waiting List. There are 34 - 1 bedroom apartments and two 2 bedroom units. 11 units are set aside for persons with special needs. Waiting list is closed.","POINT (-122.22597 37.473875)","330-340 Redwood Ave",,"CA","94061"
"Redwood City",,"Mental Health Association of SMC","(650) 368-3345",,"http://www.mhasmc.org","Cedar Street Apts","104 Cedar Street",,"Redwood City","CA","94063","Apartment","15","14","1",,,,,,,,,"People with Disabilities","0","1","Five units reserved BHRS MHSA eligible individuals. Low and very low income individuals with mental illness who meet HUD homeless requirements","POINT (-122.224765 37.479825)","104 Cedar Street",,"CA","94063"
"South San Francisco",,,"(650) 737-7648",,,"Grand Hotel","731 Airport Blvd",,"South San Francisco","CA","94080","Apartment","16","16",,,,,,,,,,"Homeless","0","0","Single room occupancy","POINT (-122.405428 37.659371)","731 Airport Blvd",,"CA","94080"
"Redwood City",,"Irvine Apartment Communities","(650) 216-6886",,"http://www.irvinecompanyapartments.com","Franklin Street Apartments","1553 El Camino Real",,"Redwood City","CA","94063","Apartment","204","31",,,,,"1","1",,,,"All","0","1","Mixed income development over retail, located on El Camino.","POINT (-122.226941 37.480225)","1553 El Camino Real",,"CA","94063"
"Pacifica","Anita Dos Santos",,"(650) 359-6127",,,"Casa Pacifica","1060 Terra Nova",,"Pacifica","CA","94044","Apartment","101","101",,,,,"1",,,,,"Seniors","0","0",,"POINT (-122.475155 37.584184)","1060 Terra Nova",,"CA","94044"
"Belmont","Lisa McKibbon","Family Housing and Adult Resources, Inc.","(650) 593-2669",,,"North Rd Group Home","901 North Road",,"Belmont","CA","94002","Group Home","8","8",,,,"1",,,,,,"People with Disabilities","0","0","For developmentally disabled adults.","POINT (-122.289402 37.528454)","901 North Road",,"CA","94002"
"Redwood City",,"CURRENTLY OFFLINE DUE TO FIRE",,,,"Hallmark Apartments","531 Woodside Road",,"Redwood City","CA","94062","Apartment","72","72","1",,,,"1",,,,,"All","0","1","Preference on 11 units for seniors.",,"531 Woodside Road",,"CA","94062"
"Belmont",,"MidPen Housing","(650) 802-8153","Horizons@midpen-housing.org",,"Horizons Apartments","825 Old County Road",,"Belmont","CA","94002","Apartment","24","24","1",,,,"1","1",,,,"People with Disabilities","0","1","Affordable independent living for adults who are developmentally disabled. Located near transit and services, with courtyard and community room. Includes one unit for on-site manager.","POINT (-122.277197 37.522473)","825 Old County Road",,"CA","94002"
"Redwood City",,"N.A. Steven Communities","(650) 591-6666",,"http://www.nastevens.com","Pescadero Apartments","950 Redwood Shores Parkway",,"Redwood City","CA","94065","Apartment","170","20",,,,,,"1",,,,"All","0","0",,"POINT (-122.235256 37.542567)","950 Redwood Shores Parkway",,"CA","94065"
"San Mateo",,"HIP Housing","(650) 348-6820",,,,"106 North El Dorado St",,"San Mateo","CA","94401","Apartment","6","6",,,,,"1","1",,,,"All, Accepts Section 8","0","1","The landlord often accepts Section 8 certficates or vouchers. There is one 1 bdrm apartment and five 2 bdrm apartments.","POINT (-122.323679 37.571664)","106 North El Dorado St",,"CA","94401"
"Redwood City","PARCA Community Living Options Manager","PARCA","(650) 312-0730 x108","CLO@parca.org",,"Alameda House","124 Alameda de las Pulgas",,"Redwood City","CA","94062","Group Home","5","8",,"1",,,,,,,,"People with Disabilities","0","0","Group home operated by Parca in unincorporated Redwood City, for developmentally disabled adults; http://www.parca.org/our-programs/alameda-house","POINT (-122.254912 37.482334)","124 Alameda de las Pulgas",,"CA","94062"
"Redwood City",,"Mental Health Association of SMC","(650) 368-3345",,"http://www.mhasmc.org","Waverly Place","105 5th Avenue",,"Redwood City","CA","94063","Apartment",,,"1",,,,,,,,,"People with Disabilities","1","0","Permanent supportive housing for homeless adults with mental illness.","POINT (-122.207367 37.46898)","105 5th Avenue",,"CA","94063"
"San Mateo",,"HIP Housing","(650) 348-6820",,,,"1110 Cypress",,"San Mateo","CA","94401","Apartment","16","16","1",,,,"1",,,,,"All","0","1","11 studio units and 5 1-bedrooms","POINT (-122.318016 37.573299)","1110 Cypress",,"CA","94401"
"San Bruno",,"Avalon Bay","(650) 589-9100",,,"Avalone San Bruno Apartments II","1099 Admiral Court",,"San Bruno","CA","94066","Apartment","185","37",,,,,"1","1","1",,,"Family","0","1","Opened in 2007. Mixed income development. There are 15 one-bedroom, 17 two-bedroom, and 5 three-bedroom affordable apartments. Families up to 50% of median income are eligible.","POINT (-122.421033 37.63458)","1099 Admiral Court",,"CA","94066"
