"uid","title","source","date_published","format","annotation","url","authors","type","access_notes","includes_research_tools","id"
"21523","Screening Clients for COVID-19 at Homeless Shelters or Encampments","Centers for Disease Control and Prevention, Office of Infectious Diseases","2020-08-03T00:00:00.000","Text","This web page, updated on August 3, 2020, provides a simple screening tool that can be used to identify people with symptoms that indicate they might have a respiratory infection. Although not every person who has respiratory infection symptoms will have coronavirus disease 2019 (COVID-19), using this tool during community spread of COVID-19 may help separate those who are more likely to have COVID-19 from the general population at entry to a homeless shelter or other homeless service program.","https://www.cdc.gov/coronavirus/2019-ncov/community/homeless-shelters/screening-clients-respiratory-infection-symptoms.html",,"Guideline/Assessment Tool","Link to page in Chinese: https://chinese.cdc.gov/coronavirus/2019-ncov/community/homeless-shelters/screening-clients-respiratory-infection-symptoms.htmlLink to page in Korean: https://korean.cdc.gov/coronavirus/2019-ncov/community/homeless-shelters/screening-clients-respiratory-infection-symptoms.htmlLink to page in Spanish: https://espanol.cdc.gov/coronavirus/2019-ncov/community/homeless-shelters/screening-clients-respiratory-infection-symptoms.htmlLink to page in Vietnamese: https://vietnamese.cdc.gov/coronavirus/2019-ncov/community/homeless-shelters/screening-clients-respiratory-infection-symptoms.html","false","21523"
"24185","Considerations on the Safe Use of UVC Radiation for Surface and Air Disinfection","American Industrial Hygiene Association","2020-08-01T00:00:00.000","PDF","This one-page fact sheet describes the safe use of UVC radiation for surface and air disinfection, and how studies have indicated that UV radiation also has the capability of killing SARS-CoV-2.","https://aiha-assets.sfo2.digitaloceanspaces.com/AIHA/resources/Public-Resources/UVC-RadiationInfographic_V6.pdf",,"Fact Sheet","Link to document in Spanish: https://aiha-assets.sfo2.digitaloceanspaces.com/AIHA/resources/Public-Resources/UVC-RadiationInfographic_Spanish.pdf","false","24185"
"24126","Preparation of Viral Transport Medium Standard Operating Procedure","Centers for Disease Control and Prevention","2020-08-01T00:00:00.000","PDF","Virus sample on a nasal swab might spoil if it is not kept in a special liquid that keeps it fresh and viable during transport on its way from the nose to a COVID-19 testing lab. The liquid is called viral transport medium (VTM), and in the pandemic, supplies of VTM have run low. These eight-page instructions for professionals to make VTM themselves, and many labs and hospitals have used the document to increase their supplies.","https://www.cdc.gov/coronavirus/2019-ncov/downloads/Viral-Transport-Medium.pdf",,"Guideline/Assessment Tool",,"false","24126"
"23821","COVID-19 Community Response: Emerging Themes Across Sentinel Communities","Robert Wood Johnson Foundation","2020-08-01T00:00:00.000","Text","The Sentinel Communities project described on this web page follows the experiences of nine diverse communities to understand how they are responding to and recovering from the COVID-19 crisis.","https://www.rwjf.org/en/library/interactives/covid-19-community-response--emerging-themes-across-sentinel-communities.html",,"Report",,"false","23821"
"23820","First Aid for Severe Trauma: Empowering High Schoolers to Respond to Traumatic Injuries","National Center for Disaster Medicine and Public Health [Uniformed Services University of the Health Sciences]","2020-08-01T00:00:00.000","Video or Multimedia","In partnership with the American Red Cross, the National Center for Disaster Medicine and Public Health is creating a curriculum geared toward high school students focusing on applying pressure to stop bleeding, communication in emergencies, situational awareness, and body positioning. This 31-minute video discusses the program.","https://www.youtube.com/watch?v=Z0UPDxfUsf8&feature=youtu.be","Levy, Matt; Gausche-Hill, Marianne; Neal, Matthew","Instructional/Training Material",,"false","23820"
"23815","Training, Evaluation, and Monitoring Guidance for Health Departments","Centers for Disease Control and Prevention","2020-08-01T00:00:00.000","PDF","Case investigation, a core activity in COVID-19 control, is crucial to an effective COVID-19 public health control program. As a management tool for quality assurance for case investigation, this 24-page document will help supervisors and training leads to effectively develop and assess Case Investigators’ interviewing skills.","https://www.cdc.gov/coronavirus/2019-ncov/downloads/php/open-america/Training-Evaluation-and-Monitoring-Guidance-for-Health-Departments.pdf",,"Guideline/Assessment Tool",,"false","23815"
"23794","Monitoring and Evaluation Framework for the COVID-19 Response in the WHO African Region","World Health Organization, Regional Office for Africa","2020-08-01T00:00:00.000","PDF","This 27-page monitoring and evaluation framework targets ministries of health, WHO country offices, and the Regional Office, and aims to assess national, country, and regional response performance and progress, measured against country national plans, response efforts, and the broader WHO COVID-19 Strategic Preparedness and Response Plan.","https://apps.who.int/iris/handle/10665/334344",,"Report","Direct link to document: https://apps.who.int/iris/bitstream/handle/10665/334344/9789290234432-eng.pdf?sequence=1&isAllowed=yLink to resource in French: https://apps.who.int/iris/handle/10665/334343","false","23794"
"23722","Rapid Stocktake of Lessons Learnt and Good Practice in the Management of Local COVID-19 Outbreaks","United Kingdom Department of Health","2020-08-01T00:00:00.000","PDF","This 27-page report sets out learning and best practice drawn from Dame Mary Ney’s rapid stocktake of lessons learned from the Leicester City/Leicestershire experience of responding to a local surge in COVID-19 cases. The Leicester City/Leicestershire Intervention was the first of its type and commenced when some of the architecture for managing such an event was underdeveloped and had never been exercised.","https://www.gov.uk/government/publications/local-covid-19-outbreaks-lessons-learnt-and-good-practice","Ney, Mary","Report","Direct link to document: https://assets.publishing.service.gov.uk/government/uploads/system/uploads/attachment_data/file/924639/Local_COVID-19_outbreaks_lessons_learnt_and_good_practice.pdf","false","23722"
"23703","Tackling COVID-19 Pandemic through Integrating Digital Technology and Public Health","Rockefeller Foundation","2020-08-01T00:00:00.000","PDF","Through a combination of desktop research and key informant interviews used in this study, this 142-page report documents and analyses the impact and implications of the actions of the Chinese government and digital technology solutions during the COVID-19 pandemic. It offers an in-depth understanding of the actions and strategies implemented by the government, the roles digital technology played, the technologies used, and the impact made across six outbreak response categories.","https://www.rockefellerfoundation.org/report/tackling-covid-19-pandemic-through-integrating-digital-technology-and-public-health/",,"Report","Direct link to document: https://www.rockefellerfoundation.org/wp-content/uploads/2020/09/v7_RF-Final-Report_AHI_2020903_reduced.pdf","false","23703"
"23679","Remote Work and the Heterogeneous Impact of COVID-19 on Employment and Health","IZA Institute of Labor Economics","2020-08-01T00:00:00.000","PDF","This 35-page paper examines the impact of the COVID-19 pandemic on employment and respiratory health for remote workers (i.e., those who can work from home) and non-remote workers in the United States.","https://covid-19.iza.org/publications/dp13620/","Angelucci, Manuela; Angrisani, Marco; Bennett, Daniel; Kapteyn, Arie; Schaner, Simone","Report","Direct link to document: http://ftp.iza.org/dp13620.pdf","false","23679"
"23644","Methodology: COVID-19 Pandemic: Attacks on Health Care in 2020","Insecurity Insight","2020-08-01T00:00:00.000","PDF","This six-page document provides the definitions for the data used in the report on COVID-19 pandemic: Attacks on health care in 2020, and information on the methodology used  to  generate  the data.","http://insecurityinsight.org/wp-content/uploads/2020/08/Methodology-COVID-19-pandemic-Attacks-on-health-care-in-2020.pdf",,"Guideline/Assessment Tool",,"false","23644"
"23626","Childhood Traumatic Grief: Youth Information Sheet","National Child Traumatic Stress Network","2020-08-01T00:00:00.000","PDF","This two-page fact sheet offers information for youth to help them understand the differences between grief and traumatic grief, the signs and symptoms of traumatic grief in children and youth, and what to do to feel better.","https://www.nctsn.org/resources/childhood-traumatic-grief-youth-information-sheet",,"Fact Sheet","Direct link to document: https://www.nctsn.org/sites/default/files/resources/fact-sheet/childhood_traumatic_grief_youth_information_sheet.pdf","false","23626"
"23625","Childhood Traumatic Separation: Youth Information Sheet","National Child Traumatic Stress Network","2020-08-01T00:00:00.000","PDF","This two-page fact sheet provides information for youth about separation distress, when separation can be traumatic for children and youth, traumatic reactions to separation, and what to do to feel better.","https://www.nctsn.org/resources/childhood-traumatic-separation-youth-information-sheet",,"Fact Sheet","Direct link to document: https://www.nctsn.org/sites/default/files/resources/fact-sheet/childhood_traumatic_separation_youth_information_sheet.pdf","false","23625"
"23618","Supporting a Nation in Crisis: Solutions for Local Leaders to Improve Mental Health and Well-Being During and Post-COVID-19","Well Being Trust","2020-08-01T00:00:00.000","PDF","This 34-page action guide, published with the de Beaumont Foundation, is intended for local policymakers and civic institutions (e.g., universities, hospitals, and other organizations that play a vital role in their local communities and economies; chambers of commerce; philanthropies; and multi-sector collaboratives). It provides recommendations that can be implemented to address mental health in both the immediate response and recovery phases of the COVID-19 pandemic.","https://www.debeaumont.org/wp-content/uploads/2020/08/mental-health-action-guide.pdf","Bork, Rachel; Gendelman, Moriah","Report","Link to one-page summary: https://www.debeaumont.org/wp-content/uploads/2020/08/One-Pager.pdf","false","23618"
"23612","COVID-19: Ambulatory PPE","National Emerging Special Pathogens Training and Education Center","2020-08-01T00:00:00.000","Text","This web page provides links to documents and guidance about ambulatory personal protective equipment (PPE) for COVID-19.","https://repository.netecweb.org/exhibits/show/ppe-cons/ambulatory",,"Guideline/Assessment Tool",,"false","23612"
"23605","Fighting Compassion Fatigue During Public Health Epidemics","Association of State and Territorial Health Officials","2020-08-01T00:00:00.000","PDF","Compassion and empathy have been relentlessly challenged by multiple epidemics in the United States. This two-page brief examines the opioid overdose epidemic as a case study in compassion fatigue during public health epidemics.","https://www.astho.org/ASTHOBriefs/Fighting-Compassion-Fatigue-During-Public-Health-Epidemics/",,"Fact Sheet",,"false","23605"
"23594","Exploring the Impact of COVID-19 on Social Services for Vulnerable Populations in Los Angeles","RAND Corporation","2020-08-01T00:00:00.000","PDF","The authors of this 30-page report conducted semi-structured interviews with representatives from social services organizations in Los Angeles County to assess how these service providers are responding to COVID-19. The interviews also uncovered lessons learned and innovative strategies for dealing with the pandemic that could be more broadly disseminated. The authors recount these interviews and lessons learned, and provide recommendations for social services organizations.","https://www.rand.org/pubs/research_reports/RRA431-1.html","Holliday, Stephanie; Hunter, Sarah; Dopp, Alex; Chamberlin, Margaret; Iguchi, Martin","Report","Direct link to document: https://www.rand.org/content/dam/rand/pubs/research_reports/RRA400/RRA431-1/RAND_RRA431-1.pdf","false","23594"
"23590","America at a Glance: Social Isolation and Loneliness During the First Wave of COVID-19","University of Montana","2020-08-01T00:00:00.000","PDF","To learn more about how COVID-19 and related responses (i.e., stay-at-home orders) may contribute to feelings of social isolation and loneliness among people with disabilities, this study, summarized in this eight-page document, compared data from two cross-sectional samples collected before and after the first wave of “stay-at-home” orders. Post-COVID rural and urban samples reported significantly more interactions with family and close friends.","https://scholarworks.umt.edu/ruralinst_health_wellness/50/","Ipsen, Catherine; Myers, Andrew; Smith, Lauren","Report","Direct link to document: https://scholarworks.umt.edu/cgi/viewcontent.cgi?article=1050&context=ruralinst_health_wellness","false","23590"
"23588","COVID-19 Testing Database","B.Next","2020-08-01T00:00:00.000","Text","This database is a tool for those who need to quickly obtain information about COVID-19 test kits and services for use in the United States. The database includes molecular tests that have received Emergency Use Authorization (EUA) from the Food and Drug Administration (FDA), whether they are kits that can be purchased by lab managers, or tests performed as a service by laboratories, whether sourced from manufacturers, or developed for their own use (so called “laboratory-developed tests”, or LDTs).","https://covidtestdb.com/",,"Database/Dataset","Link to background information: https://www.bnext.org/article/b-next-covid-19-test-database/","false","23588"
"23586","LabTrainingVR: Biosafety Cabinet Edition","Centers for Disease Control and Prevention","2020-08-01T00:00:00.000","Video or Multimedia","This course enables learners to apply knowledge and practice setting up a biosafety cabinet (also known as a biological safety cabinet, or BSC) in a virtual laboratory. Participants can step into a virtual laboratory and learn how to work safely in the first Centers for Disease Control and Prevention (CDC) virtual reality (VR) laboratory training course.","https://www.cdc.gov/labtraining/training-courses/vr/labtrainingVR_BSC.html",,"Instructional/Training Material","Site requires free registration.This training can be found in the Public Health Foundation TRAIN Learning Network at: https://www.train.org/cdctrain/course/1091139/.","false","23586"
"23584","COVID-19","University of California, Davis","2020-08-01T00:00:00.000","PDF","This is a mixed-method, interviewer-administered tool to (1) identify barriers that WIC (Special Supplemental Nutrition Program for Women, Infants, and Children) participants in California are experiencing in using WIC food benefits (e.g., access to WIC-eligible foods); and (2) identify additional short-term unmet basic needs (e.g., food and housing insecurity, as well as access to unemployment benefits, healthcare, childcare, and social support while required to remain at home) of low-income families during the COVID-19 pandemic.Questions Adapted From: U.S. Household Food Security Survey Module, USDA ERS: Q43COVID-19 Community Outcomes (COCO) Needs Assessment, Stanford University: Q1, Q4The Epidemic Pandemic Impacts Inventory (EPII): Q10aPatient Health Questionnaire-2 (PHQ-2): Q48Population: Adults OnlyLength: 55 questionsTime to Complete: 30-35 minutesMode of Administration: TelephoneAdministered by: Professional InterviewerLanguage(s): English; SpanishCOVID-19 Documenting Challenges Faced by California Families with Children 0-5 Years Old on WIC: Full Questionnaire https://www.phenxtoolkit.org/toolkit_content/PDF/UCANR_WIC.pdfCOVID Impacts: Diagnosis; Overall Impact https://www.phenxtoolkit.org/toolkit_content/PDF/UCANR_WIC_Impacts.pdfWIC participation and enrollment: Federal Assistance https://www.phenxtoolkit.org/toolkit_content/PDF/UCANR_WIC_Participation.pdfWIC services: Sources of information about COVID-19  https://www.phenxtoolkit.org/toolkit_content/PDF/UCANR_WIC_Services.pdfShopping for WIC foods: Food Security https://www.phenxtoolkit.org/toolkit_content/PDF/UCANR_WIC_Foods.pdfGeneral food shopping: Food Security; Dietary Intake https://www.phenxtoolkit.org/toolkit_content/PDF/UCANR_WIC_General_Food.pdfImmigration status: Personal Demographics https://www.phenxtoolkit.org/toolkit_content/PDF/UCANR_WIC_Immigration.pdfMental health: General Mental Health https://www.phenxtoolkit.org/toolkit_content/PDF/UCANR_WIC_Mental_Health.pdf COVID-19 Documenting Challenges Faced by California Families with Children 0-5 Years Old on WIC (Spanish): Full Questionniare https://www.phenxtoolkit.org/toolkit_content/PDF/UCANR_WIC_Spanish.pdfCOVID Impacts (Spanish): Diagnosis; Overall Impact https://www.phenxtoolkit.org/toolkit_content/PDF/UCANR_WIC_Impacts_Spanish.pdfWIC participation and enrollment (Spanish): Federal Assistance https://www.phenxtoolkit.org/toolkit_content/PDF/UCANR_WIC_Participation_Spanish.pdfWIC services (Spanish): Sources of information about COVID-19 https://www.phenxtoolkit.org/toolkit_content/PDF/UCANR_WIC_Services_Spanish.pdfShopping for WIC foods (Spanish): Food Security https://www.phenxtoolkit.org/toolkit_content/PDF/UCANR_WIC_Foods_Spanish.pdfGeneral food shopping (Spanish): Food Security; Dietary Intake https://www.phenxtoolkit.org/toolkit_content/PDF/UCANR_WIC_General_Food_Spanish.pdfImmigration status (Spanish): Personal Demographics https://www.phenxtoolkit.org/toolkit_content/PDF/UCANR_WIC_Immigration_Spanish.pdfMental health (Spanish): General Mental Health https://www.phenxtoolkit.org/toolkit_content/PDF/UCANR_WIC_Mental_Health_Spanish.pdf","https://www.nlm.nih.gov/dr2/WIC_COVID_Interview_guide_ENGLISH.pdf",,"Guideline/Assessment Tool","Free/Publicly AvailableLink to Spanish survey: https://www.nlm.nih.gov/dr2/WIC_COVID_Interview_Guide_SPANISH.pdfCitation(s):Ritchie, LD & Whaley, SE (2020). COVID-19: Documenting Challenges Faced by California Families with Children 0-5 Years Old on WIC.Available Formats: PDFContact Information: Lorrene Ritchie, PhD, RDDirector and Cooperative Extension Specialist, Nutrition Policy InstituteUniversity of California Division of Agriculture and Natural ResourcesEmail: lritchie@ucanr.edu","true","23584"
"23562","Views from the Big Cities: Webinar Series","Big Cities Health Coalition","2020-08-01T00:00:00.000","Video or Multimedia","This web page provides links to a series of webinars that share wisdom, experience, and lessons learned related to COVID-19 from communities that experienced the earliest and greatest impact of the pandemic.","https://www.bigcitieshealth.org/pandemic-response-webinars",,"Instructional/Training Material",,"false","23562"
"23561","Leadership Check-Up Series: Developing Your Resiliency as a Public Health Professional","Association of State and Territorial Health Officials","2020-08-01T00:00:00.000","Video or Multimedia","As the nation continues to struggle with COVID-19, public health professionals working on the front lines leading activities may be feeling angry, confused, stressed, and dismayed. Join national behavioral health and resilience experts for these 60-minute sessions of conversation, reflection, and nourishment to help professionals continue the vital work of responding to COVID-19 while better supporting their families, friends, co-workers, and communities.","https://www.astho.org/Events/Leadership-Check-Up-Series/",,"Instructional/Training Material","Link to recordings: https://www.youtube.com/playlist?list=PL-GVXxC1njCD1tXpDB1KNdKjeXU3v0Sne","false","23561"
"23558","School Attendance, Asthma and COVID-19: Considerations for School Nurses","National Association of School Nurses","2020-08-01T00:00:00.000","PDF","The purpose of this two-page document is to summarize current overall recommendations during the COVID-19 pandemic for students with asthma, which may be modified in the future as more is learned about COVID-19.","https://www.aaaai.org/Aaaai/media/MediaLibrary/PDF%20Documents/Libraries/SchoolAsthmaCovid_Final.pdf",,"Guideline/Assessment Tool",,"false","23558"
"23544","Long-Stay Mental Health Care Institutions and the COVID-19 Crisis","World Health Organization, Regional Office for Europe","2020-08-01T00:00:00.000","PDF","This 20-page report presents the results of a survey conducted by the Mental Health Programme, WHO Regional Office for Europe, with 169 long-stay institutions in the WHO European Region to assess the impact of the COVID-19 pandemic on services, staff, service users, and residents with psychosocial and intellectual disabilities.","https://www.euro.who.int/en/health-topics/noncommunicable-diseases/mental-health/publications/2020/long-stay-mental-health-care-institutions-and-the-covid-19-crisis-identifying-and-addressing-the-challenges-for-better-response-and-preparedness-2020",,"Report","Direct link to document: https://apps.who.int/iris/bitstream/handle/10665/333964/WHO-EURO-2020-40745-54930-eng.pdf","false","23544"
"23542","Encouraging Participation and Cooperation in Contact Tracing: Lessons from Survey Research","National Academies Press","2020-08-01T00:00:00.000","Text","This 11-page report is intended to help decision-makers in local public health departments and local governments increase participation and cooperation in contact tracing related to COVID-19. It focuses on contact tracing methods that involve phone, text, or email interviews with people who have tested positive and with others they may have exposed to the virus.","https://www.nap.edu/catalog/25916/encouraging-participation-and-cooperation-in-contact-tracing-lessons-from-survey","Groves, Robert; Bassett, Mary; Hout, Michael","Report",,"false","23542"
"23541","Exchange Newsletter: Volume 1, Issue 11: Special Edition: COVID-19 Healthcare Lessons Learned","Office of the Assistant Secretary for Preparedness and Response [U.S. Department of Health and Human Services]","2020-08-01T00:00:00.000","PDF","This 12-page issue of The Exchange from TRACIE (Technical Resources, Assistance Center, and Information Exchange) provides articles that highlight lessons learned (from the responder, practitioner, and planner perspectives) specific to COVID-19 patient surge; patient, caregiver, and provider behavioral health; operational considerations; and telehealth.","https://files.asprtracie.hhs.gov/documents/aspr-tracie-the-exchange-issue11-final-508.pdf",,"Report",,"false","23541"
"23535","Coronavirus Victimization Distress Scale (CVDS)","Fordham University","2020-08-01T00:00:00.000","PDF","The Coronavirus Victimization Distress Scale (CVDS) is a brief self-report questionnaire developed by Fordham University's Center for Ethics Education and Applied Developmental Psychology Program as part of the Pathways to Health Study. The CVDS assesses bully and cyberbully victimization distress results from being viewed as having coronavirus. Questions include distress about being verbally and physically bullied, treated rudely or unfairly, verbally taunted in public, and cyberbullied because of coronavirus.Population: Adults and TeensEthnic/Religious GroupsSexual or Gender MinoritiesLength: 5 itemsTime to Complete: Less than 5 minutesMode of Administration: Online (e.g., computer-assisted interview)Administered by: Self AdministeredLanguage(s): English","https://www.fordham.edu/download/downloads/id/14918/coronavirus_covid-19_victimization_distress_scale_cvds.pdf",,"Guideline/Assessment Tool","Free/Publicly AvailableAvailable Formats: PDFContact Information:Celia B. Fisher, Ph.D.Center for Ethics EducationFordham UniversityEmail: Fisher@fordham.eduAdministrator: Lori MeroneEmail: lmerone@fordham.edu","true","23535"
"23534","Aid Worker Security Report 2020","Humanitarian Outcomes","2020-08-01T00:00:00.000","PDF","This 22-page annual Aid Worker Security Report focuses on humanitarians working in the health sector. It examines the data from 2019 on attacks against health workers, and discusses how the humanitarian sector is dealing with the new risks and disruptions caused by major epidemics occurring in contexts of broader complex emergency.","https://www.humanitarianoutcomes.org/AWSR2020","Stoddard, Abby; Harvey, Paul; Czwarno, Monica; Breckenridge, Meriah-Jo","Report","Direct link to document: https://www.humanitarianoutcomes.org/sites/default/files/publications/awsr2020_0.pdfLink to Figures at a Glance 2020: https://www.humanitarianoutcomes.org/publications/AWSDfigures2020","false","23534"
"23533","PPE CASE - Filtration Efficiency Performance of Non-NIOSH-Approved International Respiratory Protective Devices","National Institute for Occupational Safety and Health [Centers for Disease Control and Prevention]","2020-08-01T00:00:00.000","PDF","This eight-page report summarizes the filtration performance results from the assessments that took place as a result of the initial Emergency Use Authorization (EUA) issued by the Food and Drug Administration (FDA), and discusses important considerations when purchasing non-NIOSH approved international respiratory devices temporarily authorized for occupational use in the United States.","https://www.cdc.gov/niosh/npptl/ppecase/PPE-CASE-P2020-0112.html","Andrews, A.; Powers, J.; Cichowicz, J.; Coffey, C.; Friese, M.L.","Report","Direct link to document: https://www.cdc.gov/niosh/npptl/ppecase/pdfs/PPE-CASE-P2020-0112-508.pdf","false","23533"
