"uid","title","source","date_published","format","annotation","url","authors","type","access_notes","includes_research_tools","id"
"23687","Framework for Assessing Mortality and Morbidity After Large-Scale Disasters","National Academies Press","2020-09-01T00:00:00.000","Text","This 208-page report reviews and describes the current state of the field of disaster-related mortality and significant morbidity assessment. It examines practices and methods for data collection, recording, sharing, and use across state, local, tribal, and territorial stakeholders; evaluates best practices; and identifies areas for future resource investment.","https://www.nap.edu/catalog/25863/a-framework-for-assessing-mortality-and-morbidity-after-large-scale-disasters",,"Report",,"false","23687"
"23686","Understanding Compliance with OSHA’s Respiratory Protection Standard During the Coronavirus Disease 2019 (COVID-19) Pandemic","Occupational Safety and Health Administration [U.S. Department of Labor]","2020-09-01T00:00:00.000","PDF","The coronavirus disease 2019 (COVID-19) pandemic has had an unprecedented impact on the availability of respirators and fit-testing supplies. This two-page document is intended to help employers understand and comply with OSHA’s temporary enforcement guidance for the Respiratory Protection standard.","https://www.osha.gov/sites/default/files/respiratory-protection-covid19-compliance.pdf",,"Guideline/Assessment Tool",,"false","23686"
"23682","ASHP Principles for COVID-19 Vaccine Distribution, Allocation, and Mass Immunization","American Society of Health-Systems Pharmacists","2020-09-01T00:00:00.000","PDF","This four-page document offers 10 principles for COVID-19 vaccine development, distribution, allocation, mass vaccination, monitoring, and surveillance.","https://www.ashp.org/-/media/assets/pharmacy-practice/resource-centers/Coronavirus/docs/ASHP-Principles-for-COVID-19-Vaccine",,"Guideline/Assessment Tool",,"false","23682"
"23681","Caring for Children and Youth With Special Health Care Needs During the COVID-19 Pandemic","American Academy of Pediatrics","2020-09-01T00:00:00.000","Text","This web page discusses the overall approach to minimizing the risk of infection while meeting the ongoing needs of children and youth with special health care needs during the COVID-19 pandemic.","https://services.aap.org/en/pages/2019-novel-coronavirus-covid-19-infections/clinical-guidance/caring-for-children-and-youth-with-special-health-care-needs-during-the-covid-19-pandemic/",,"Guideline/Assessment Tool",,"false","23681"
"23678","Contagion Externality of a Superspreading Event: The Sturgis Motorcycle Rally and COVID-19","IZA Institute of Labor Economics","2020-09-01T00:00:00.000","PDF","Between August 7 and 16, 2020, nearly 500,000 motorcycle enthusiasts converged on Sturgis, South Dakota, for its annual motorcycle rally. Large crowds, coupled with minimal mask-wearing and social distancing by attendees, raised concerns that this event could serve as a COVID-19 “super-spreader.”  This 63-page study is the first to explore the impact of this event on social distancing and the spread of  COVID-19.","http://ftp.iza.org/dp13670.pdf","Dave, Dhaval; Friedson, Andrew; McNichols, Drew; Sabia, Joseph","Report",,"false","23678"
"23666","COVID-19 Information Metrics for Response Leadership's Decision Making: Guidance in Non-U.S. Settings","Centers for Disease Control and Prevention, Office of Infectious Diseases","2020-09-01T00:00:00.000","Text","This web page aims to provide critical COVID-19 information metrics by technical area that response leaders in non-U.S. settings can request to aid in informing COVID-19 response decisions. It includes a set of core metrics within 10 technical areas for response leaders to help monitor response progress and guide decision making.","https://www.cdc.gov/coronavirus/2019-ncov/global-covid-19/leadership-emergency-response.html",,"Guideline/Assessment Tool",,"false","23666"
"23658","Fact Sheet for Healthcare Providers: MobileDetect Bio BCC19 Test Kit","U.S. Food and Drug Administration","2020-09-01T00:00:00.000","PDF","This three-page fact sheet informs healthcare providers of the significant known and potential risks and benefits of the emergency use of the MobileDetect Bio BCC19 Test Kit. The MobileDetect Bio BCC19 Test Kit is authorized for use with certain respiratory specimens collected from individuals suspected of COVID-19 by their healthcare provider.","https://www.fda.gov/media/141789/download",,"Guideline/Assessment Tool","Link to Fact Sheet for Patients: https://www.fda.gov/media/141790/downloadLink to Letter of Authorization: https://www.fda.gov/media/141788/downloadLink to Instructions for Use: https://www.fda.gov/media/141791/download","false","23658"
"23657","Fact Sheet for Healthcare Providers: Kaira 2019-nCoV Detection Kit","U.S. Food and Drug Administration","2020-09-01T00:00:00.000","PDF","This three-page fact sheet informs healthcare providers of the significant known and potential risks and benefits of the emergency use of the Kaira 2019-nCoV Detection Kit. The Kaira 2019-nCoV Detection Kit is authorized for use with respiratory specimens collected from individuals suspected of COVID-19 by their healthcare provider.","https://www.fda.gov/media/141793/download",,"Guideline/Assessment Tool","Link to Fact Sheet for Patients: https://www.fda.gov/media/141794/downloadLink to Letter of Authorization: https://www.fda.gov/media/141792/downloadLink to Instructions for Use: https://www.fda.gov/media/141795/download","false","23657"
"23647","Conversations on COVID-19: Impacts on Communities of Color","National Academies of Sciences, Engineering, and Medicine","2020-09-01T00:00:00.000","Video or Multimedia","This web page provides videos of conversations with experts on a variety of topics related to minority health and COVID-19, as well as information and resources from the National Academies on topics related to health equity.","https://www.nationalacademies.org/resource/conversations-on-covid-19-impacts-on-communities-of-color",,"Instructional/Training Material",,"false","23647"
"23643","Aid and Health Worker Safety and Security in the Context of the COVID-19 Pandemic","Insecurity Insight","2020-09-01T00:00:00.000","PDF","This six-page document provides an overview of developments that have affected the safety and security of aid and health workers in the first half of 2020 and in the context of the COVID-19 pandemic.","http://insecurityinsight.org/wp-content/uploads/2020/09/Aid-and-health-worker-safety-and-security-in-the-context-of-the-COVID-19-pandemic.pdf",,"Report",,"false","23643"
"23638","Occupational Health and Safety for Health Workers in the Context of COVID-19","World Health Organization","2020-09-01T00:00:00.000","Video or Multimedia","Participants in this course will learn to describe the most common occupational risks to health and safety to which health workers are exposed while responding to the COVID-19 pandemic; describe the rights of health workers to decent working conditions; describe how to apply measures for protecting their health and safety and actively propose improvements; and access and use supportive services for protection of health and safety of health workers.","https://openwho.org/courses/COVID-19-occupational-health-and-safety",,"Instructional/Training Material","Site requires free registration.","false","23638"
"23636","Federal Medical Stations: Training from the Strategic National Stockpile for the COVID-19 Response","Office of the Assistant Secretary for Preparedness and Response [U.S. Department of Health and Human Services]","2020-09-01T00:00:00.000","Video or Multimedia","This web page provides a list of videos from the Strategic National Stockpile that are designed to assist in the assembly and/or operation of key components and equipment in the Federal Medical Station deployment cache.","https://www.phe.gov/emergency/events/COVID19/SNS/Pages/sns-trng-videos.aspx",,"Instructional/Training Material",,"false","23636"
"23629","What to Do if a Student Becomes Sick at School or Reports a New COVID-19 Diagnosis Flowchart","Centers for Disease Control and Prevention","2020-09-01T00:00:00.000","PDF","This one-page flowchart details what to do if a student becomes sick at school, reports a new COVID-19 diagnosis, or tests positive or negative.","https://www.cdc.gov/coronavirus/2019-ncov/images/community/schools-childcare/student-becomes-sick-diagnosis-flowchart.jpg",,"Guideline/Assessment Tool","Link to web page with more information: https://www.cdc.gov/coronavirus/2019-ncov/community/schools-childcare/student-becomes-sick-diagnosis-flowchart.htmlLink to page in Korean: https://korean.cdc.gov/coronavirus/2019-ncov/community/schools-childcare/student-becomes-sick-diagnosis-flowchart.htmlLink to page in Spanish: https://espanol.cdc.gov/coronavirus/2019-ncov/community/schools-childcare/student-becomes-sick-diagnosis-flowchart.htmlLink to page in Vietnamese: https://vietnamese.cdc.gov/coronavirus/2019-ncov/community/schools-childcare/student-becomes-sick-diagnosis-flowchart.html","false","23629"
"23628","Overlooked and Undercounted: The Growing Impact of COVID-19 on Assisted Living Facilities","Henry J. Kaiser Family Foundation","2020-09-01T00:00:00.000","Text","This analysis examines the impact of COVID-19 on assisted living facilities, as well as changes over time, using state-level data on COVID-19 cases and deaths reported in early June 2020, and again in early August.","https://www.kff.org/coronavirus-covid-19/issue-brief/overlooked-and-undercounted-the-growing-impact-of-covid-19-on-assisted-living-facilities/","True, Sarah; Ochieng, Nancy; Cubanski, Juliette; Chidambaram, Priya; Neuman, Tricia","Report",,"false","23628"
"23072","Multisystem Inflammatory Syndrome in Children (MIS-C) Interim Guidance","American Academy of Pediatrics","2020-09-01T00:00:00.000","Text","This web page, updated on September 1, 2020, provides answers to questions, and guidance for clinicians about multisystem inflammatory syndrome in children (MIS-C), including when to perform testing for MIS-C and what sort of testing to start with in the outpatient or emergency room setting.","https://services.aap.org/en/pages/2019-novel-coronavirus-covid-19-infections/clinical-guidance/multisystem-inflammatory-syndrome-in-children-mis-c-interim-guidance/",,"Guideline/Assessment Tool",,"false","23072"
"3156","Surveillance and Studies in a Pandemic in Europe","European Union, European Centre for Disease Prevention and Control","2009-06-12T00:00:00.000","PDF","This 19-page report is a summary of Surveillance and Studies in a Pandemic in Europe, including early detection, investigation, early assessment, monitoring, and investigation of the effectiveness of countermeasures.","https://www.ecdc.europa.eu/en/publications-data/surveillance-and-studies-pandemic-europe?ID=169&List=4f55ad51-4aed-4d32-b960-af70113dbb90",,"Report","Direct link to document: https://www.ecdc.europa.eu/sites/default/files/media/en/publications/Publications/0906_TER_Surveillance_and_Studies_in_a_Pandemic_in_Europe.pdf","false","3156"
"19993","Internal Displacement 2020: Mid-Year Update","Internal Displacement Monitoring Centre","2020-09-01T00:00:00.000","PDF","This 60-page report reveals the most significant new internal displacements associated with conflict, violence, and disasters around the world between January and June 2020. It serves as an important temperature gauge of global displacement halfway through the year, looking ahead to the trends and patterns expected in the months to come.","https://www.internal-displacement.org/mid-year-figures",,"Report","Direct link to document: https://www.internal-displacement.org/sites/default/files/publications/documents/2020%20Mid-year%20update.pdfLink to chapter on Impacts of Covid-19 on iDPs: https://www.internal-displacement.org/sites/default/files/publications/documents/2020%20Mid-year%20update.pdf#page=41 Link to Mid-Year Figures, January to June 2019: https://www.internal-displacement.org/sites/default/files/inline-files/2019-mid-year-figures_for%20website%20upload.pdf","false","19993"
"13848","UK (United Kingdom) Recovery Handbook for Chemical Incidents","United Kingdom Department of Health","2020-09-01T00:00:00.000","PDF","This 600-page book, updated on September 1, 2020, was designed to help manage the recovery phase of a chemical incident where contamination has affected food production systems, inhabited areas, and water environments.","https://www.gov.uk/government/publications/uk-recovery-handbook-for-chemical-incidents-and-associated-publications",,"Book/Book Chapter","Direct link to document: https://assets.publishing.service.gov.uk/government/uploads/system/uploads/attachment_data/file/912808/UKRHCI_2019_Update_v1.1__2_.pdfLink to Disaster Lit record for Chemical Recovery Guidance and Tools: User Guide: https://disasterinfo.nlm.nih.gov/search/id:17955Link to Disaster Lit record for Chemical Recovery Record Form: https://disasterinfo.nlm.nih.gov/search/id:15073Link to Disaster Lit record for Chemical Recovery Navigation Tool: https://disasterinfo.nlm.nih.gov/search/id:9656","false","13848"
"7506","Curriculum Recommendations for Disaster Health Professionals","National Center for Disaster Medicine and Public Health [Uniformed Services University of the Health Sciences]","2020-09-01T00:00:00.000","PDF","This 48-page document, updated in September 2020, was created with the intent to provide a framework upon which to build disaster behavioral health curricula, and compile and give access to up-to-date, credible resources to support such curricula. It is intended for use by those developing and delivering disaster behavioral health training, as well as community leaders, policymakers, and others seeking to better understand the behavioral health impacts of disasters on individuals and communities.  It includes a table for COVID-19 Special Section: Behavioral Health Resources.","https://www.usuhs.edu/sites/default/files/media/ncdmph/pdf/ncdmph_csts_revised.pdf","Flynn, Brian; Vance, Mary; Morganstein, Joshua","Guideline/Assessment Tool",,"false","7506"
"24049","Response to the Ebola Virus Disease in the Eastern of the Democratic Republic of Congo","Enhancing Learning and Research for Humanitarian Assistance","2020-08-31T00:00:00.000","PDF","This 27-page report summarizes a study called “Humanizing the design of the Ebola response in DRC: Anthropological research on humane designs of Ebola treatment and care to build trust for better health,” which examined how humane designs of treatment and care at Ebola Treatment Centers (ETCs) influence the formation of trust into the response to the Ebola virus disease epidemic in Democratic Republic of Congo.","https://www.elrha.org/researchdatabase/ebola-drc-pole-institute-martin-luther-university/","Morisho, Nene; Park, Sung-Joon; Kalubi, Josepha; Lubula, Mumbere","Report","Direct link to document: https://www.elrha.org/wp-content/uploads/2020/09/2020-Elhra-Report_ENGL.pdfLink to report in French: https://www.elrha.org/wp-content/uploads/2020/09/2020-rapport-ELHRA.pdf","false","24049"
"23624","Fact Sheet for Healthcare Providers: TBG SARS-CoV-2 IgG/IgM Rapid Test Kit","U.S. Food and Drug Administration","2020-08-31T00:00:00.000","PDF","This three-page fact sheet informs healthcare providers of the significant known and potential risks and benefits of the emergency use of the TBG SARS-CoV-2 IgG/IgM Rapid Test Kit. The TBG SARS-CoV-2 IgG/IgM Rapid Test Kit is authorized for the detection of antibodies to SARS-CoV-2 in human serum and plasma (Acid Citrate Dextrose -ACD).","https://www.fda.gov/media/141771/download",,"Guideline/Assessment Tool","Link to Fact Sheet for Recipients: https://www.fda.gov/media/141772/downloadLink to Letter of Authorization: https://www.fda.gov/media/141770/downloadLink to Instructions for Use: https://www.fda.gov/media/141773/download","false","23624"
"23623","Fact Sheet for Healthcare Providers: COVID-19 ELISA pan-Ig Antibody Test","U.S. Food and Drug Administration","2020-08-31T00:00:00.000","PDF","This three-page fact sheet informs healthcare providers of the significant known and potential risks and benefits of the emergency use of the COVID-19 ELISA pan-Ig Antibody Test. The COVID-19 ELISA pan-Ig Antibody Test is authorized for the detection of antibodies to SARS-CoV-2 in human serum.","https://www.fda.gov/media/141775/download",,"Guideline/Assessment Tool","Link to Fact Sheet for Recipients: https://www.fda.gov/media/141776/downloadLink to Letter of Authorization: https://www.fda.gov/media/141774/downloadLink to EUA Summary: https://www.fda.gov/media/141777/download","false","23623"
"23622","Fact Sheet for Healthcare Providers: T2SARS-CoV-2 Panel","U.S. Food and Drug Administration","2020-08-31T00:00:00.000","PDF","This three-page fact sheet informs healthcare providers of the significant known and potential risks and benefits of the emergency use of the T2SARS-CoV-2 Panel. The T2SARS-CoV-2 Panel is authorized for use with respiratory specimens collected from individuals suspected of COVID-19 by their healthcare provider.","https://www.fda.gov/media/141753/download",,"Guideline/Assessment Tool","Link to Fact Sheet for Patients: https://www.fda.gov/media/141754/downloadLink to Letter of Authorization: https://www.fda.gov/media/141752/downloadLink to Instructions for Use: https://www.fda.gov/media/141755/download","false","23622"
"23621","Fact Sheet for Healthcare Providers: MiraDx SARS-CoV-2 RT-PCR Assay","U.S. Food and Drug Administration","2020-08-31T00:00:00.000","PDF","This three-page fact sheet informs healthcare providers of the significant known and potential risks and benefits of the emergency use of a Molecular LDT COVID-19 Authorized Test called the MiraDx SARS-CoV-2 RT-PCR assay that has been issued an Emergency Use Authorization (EUA) by the FDA. The Molecular LDT COVID-19 Authorized Test is authorized for use on certain respiratory specimens collected from individuals suspected of COVID-19 by their healthcare provider.","https://www.fda.gov/media/141757/download",,"Guideline/Assessment Tool","Link to Fact Sheet for Patients: https://www.fda.gov/media/141758/downloadLink to Letter of Authorization: https://www.fda.gov/media/141756/downloadLink to EUA Summary: https://www.fda.gov/media/141760/download","false","23621"
"23620","Fact Sheet for Healthcare Providers: SARS-CoV-2 DETECTR Reagent Kit","U.S. Food and Drug Administration","2020-08-31T00:00:00.000","PDF","This three-page fact sheet informs healthcare providers of the significant known and potential risks and benefits of the emergency use of the SARS-CoV-2 DETECTR Reagent Kit. The SARS-CoV-2 DETECTR Reagent Kit is authorized for use with upper respiratory specimens collected from individuals suspected of COVID-19 by their healthcare provider.","https://www.fda.gov/media/141763/download",,"Guideline/Assessment Tool","Link to Fact Sheet for Patients: https://www.fda.gov/media/141764/downloadLink to Letter of Authorization: https://www.fda.gov/media/141762/downloadLink to Instructions for Use: https://www.fda.gov/media/141765/download","false","23620"
"23619","Fact Sheet for Healthcare Providers: BayCare SARS-CoV-2 RT PCR Assay","U.S. Food and Drug Administration","2020-08-31T00:00:00.000","PDF","This three-page fact sheet informs healthcare providers of the significant known and potential risks and benefits of the emergency use of the BayCare SARS-CoV-2 RT PCR Assay that has been issued an Emergency Use Authorization (EUA) by the FDA. The BayCare SARS-CoV-2 RT PCR Assay is authorized for use on nasopharyngeal swab specimens collected from individuals suspected of COVID-19 by their healthcare provider.","https://www.fda.gov/media/141767/download",,"Guideline/Assessment Tool","Link to Fact Sheet for Patients: https://www.fda.gov/media/141768/downloadLink to Letter of Authorization: https://www.fda.gov/media/141766/downloadLink to EUA Summary: https://www.fda.gov/media/141769/download","false","23619"
"23593","COVID-19: Brief Update on Initial Federal Response to the Pandemic","U.S. Government Accountability Office","2020-08-31T00:00:00.000","PDF","This 44-page report examines federal spending on the COVID-19 response; indicators for monitoring public health and the economy; and the status of matters for congressional consideration and recommendations from GAO’s June 2020 report.","https://www.gao.gov/products/GAO-20-708","Clowers, A. Nicole","Report","Direct link to document: https://www.gao.gov/assets/710/709033.pdf","false","23593"
"24143","Reducing the Risk  of COVID-19 Using  Engineering Controls","American Industrial Hygiene Association","2020-08-28T00:00:00.000","PDF","This seven-page document provides details about the recommendations of the American Industrial Hygiene Association (AIHA) and its volunteer committees of industrial hygienists for the use of engineering controls in all indoor workplaces, even those outside of the health care industry, to reduce the spread of COVID-19.","https://aiha-assets.sfo2.digitaloceanspaces.com/AIHA/resources/Guidance-Documents/Reducing-the-Risk-of-COVID-19-using-Engineering-Controls-Guidance-Document.pdf",,"Guideline/Assessment Tool",,"false","24143"
"24013","FAQ: Should Antibiotic Therapy be Continued in Patients Diagnosed with COVID-19?","Duke University","2020-08-28T00:00:00.000","PDF","This three-page fact sheet provides information about the ability to streamline and de-escalate empiric antibiotic therapy and why it remains a challenge for antimicrobial stewardship programs. This challenge is further complicated by the ongoing pandemic and increased concern for COVID-19 infection, especially in light of reported mortality rates associated with severe disease presentation.","https://dason.medicine.duke.edu/sites/dason.medicine.duke.edu/files/antibiotic_use_in_covid-19_faq_updated_8-28-2020.pdf",,"Fact Sheet",,"false","24013"
"23713","Public Health Assessment Training","Agency for Toxic Substances and Disease Registry","2020-08-28T00:00:00.000","Video or Multimedia","This training provides the basics to conduct a public health assessment, consisting of six modules based on a realistic environmental health case study, problem-solving exercises, and comprehensive resources and references to conduct public health assessments. Modules 7 and 8 are under construction.","https://www.atsdr.cdc.gov/training/pha-training-section1.html",,"Instructional/Training Material","Site requires free registration.","false","23713"
"23691","ASPR TRACIE (Assistant Secretary for Preparedness and Response/Technical Resources, Assistance Center, and Information Exchange) Technical Assistance Request: Home Infusion Pharmacy Resources","Office of the Assistant Secretary for Preparedness and Response [U.S. Department of Health and Human Services]","2020-08-28T00:00:00.000","PDF","This three-page document from TRACIE responds to a request for Emergency Operations Plans (EOPs) for home infusion pharmacies, and provides related resources.","https://files.asprtracie.hhs.gov/documents/aspr-tracie-ta---home-infusion-pharmacy-resources---8-28-2020.pdf",,"Bibliography/Resource List",,"false","23691"
"23604","Fact Sheet for Healthcare Providers: PCL SARS-CoV-2 Real-Time RT-PCR Assay","U.S. Food and Drug Administration","2020-08-28T00:00:00.000","PDF","This three-page fact sheet informs healthcare providers of the significant known and potential risks and benefits of the emergency use of a Molecular LDT COVID-19 Authorized Test called the PCL SARS-CoV-2 Real-Time RT-PCR Assay that has been issued an Emergency Use Authorization (EUA) by FDA. The Molecular LDT COVID-19 Authorized Test is authorized for use on certain respiratory specimens collected from individuals suspected of COVID-19 by their healthcare provider.","https://www.fda.gov/media/141663/download",,"Guideline/Assessment Tool","Link to Fact Sheet for Patients: https://www.fda.gov/media/141664/downloadLink to Letter of Authorization: https://www.fda.gov/media/141662/downloadLink to EUA Authorization: https://www.fda.gov/media/141665/download","false","23604"
"23603","Fact Sheet for Healthcare Providers: DxTerity SARS-CoV-2 RT-PCR CE Test","U.S. Food and Drug Administration","2020-08-28T00:00:00.000","PDF","This three-page fact sheet informs healthcare providers of the significant known and potential risks and benefits of the emergency use of the DxTerity SARS-CoV-2 RT-PCR CE Test. The DxTerity SARS-CoV-2 RT-PCR CE Test is authorized for use with saliva specimens collected from individuals consistent with the Emergency Use Authorization (EUA).","https://www.fda.gov/media/141667/download",,"Guideline/Assessment Tool","Link to Fact Sheet for Patients: https://www.fda.gov/media/141668/downloadLink to Letter of Authorization: https://www.fda.gov/media/141666/downloadLink to Instructions for Use (Home Collect): https://www.fda.gov/media/141670/downloadLink to EUA Summary: https://www.fda.gov/media/141669/download","false","23603"
"23602","Opioid Overdose","World Health Organization","2020-08-28T00:00:00.000","Text","This fact sheet provides information about opioid overdose, including risk factors for opioid overdose, emergency responses to opioid overdose, and prevention of opioid overdose.","https://www.who.int/news-room/fact-sheets/detail/opioid-overdose",,"Fact Sheet",,"false","23602"
