"uid","title","source","date_published","format","annotation","url","authors","type","access_notes","includes_research_tools","id"
"23906","Fact Sheet for Healthcare Providers: Aeon Global Health SARS-CoV-2 Assay","U.S. Food and Drug Administration","2020-09-30T00:00:00.000","PDF","This three-page fact sheet informs healthcare providers of the significant known and potential risks and benefits of the emergency use of a Molecular LDT COVID-19 Authorized Test called the Aeon Global Health SARS-CoV-2 Assay that has been issued an Emergency Use Authorization (EUA) by the FDA. The Molecular LDT COVID-19 Authorized Test is authorized for use on certain respiratory specimens collected from individuals suspected of COVID-19 by their healthcare provider.","https://www.fda.gov/media/142533/download",,"Guideline/Assessment Tool","Link to Fact Sheet for Patients: https://www.fda.gov/media/142534/downloadLink to Letter of Authorization: https://www.fda.gov/media/142532/downloadLink to EUA Summary: https://www.fda.gov/media/142535/download","false","23906"
"23410","Guidance on the Use of Personal Protective Equipment (PPE) for Pediatric Care in Ambulatory Care Settings During the SARS-CoV-2 Pandemic","American Academy of Pediatrics","2020-09-30T00:00:00.000","Text","This web page, updated on September 30, 2020, provides guidance for mitigating the risk of infection for all who work or receive care in pediatric ambulatory settings, including the appropriate use of personal protective equipment (PPE) along with consistent and effective infection prevention and control practices.","https://services.aap.org/en/pages/2019-novel-coronavirus-covid-19-infections/clinical-guidance/guidance-on-the-use-of-personal-protective-equipment-ppe-for-pediatric-care-in-ambulatory-care-settings-during-the-sars-cov-2-pandemic/",,"Guideline/Assessment Tool",,"false","23410"
"23409","COVID-19 Testing Guidance","American Academy of Pediatrics","2020-09-30T00:00:00.000","Text","This guidance, updated on September 30, 2020, was developed to help pediatric practices determine when to test for severe acute respiratory syndrome-coronavirus 2 (SARS-CoV-2) infection in their patient population.","https://services.aap.org/en/pages/2019-novel-coronavirus-covid-19-infections/clinical-guidance/covid-19-testing-guidance/",,"Guideline/Assessment Tool",,"false","23409"
"21017","COVID-19 Guidance for Schools Kindergarten to Grade 12","Public Health Agency of Canada","2020-09-30T00:00:00.000","Text","This guidance, updated on September 30, 2020, provides information for both public and private institutions providing K-12 education programs in the classroom setting. It takes into consideration the diverse needs of population groups based on vulnerability, ethnicity/culture, disability, developmental status, and other socioeconomic and demographic factors.","https://www.canada.ca/en/public-health/services/diseases/2019-novel-coronavirus-infection/health-professionals/guidance-schools-childcare-programs.html",,"Guideline/Assessment Tool",,"false","21017"
"24031","Guidance on the Use of Influenza Vaccine in the Presence of COVID-19","Government of Canada","2020-09-29T00:00:00.000","Text","The guidance on this web page is designed to support provincial and territorial vaccine programs and primary care providers in offering influenza vaccine during the COVID-19 pandemic. Topics include delivery and administration of influenza vaccine during COVID-19 pandemic, and who should receive the influenza vaccine during COVID-19 pandemic.","https://www.canada.ca/en/public-health/services/immunization/national-advisory-committee-on-immunization-naci/guidance-use-influenza-vaccine-covid-19.html",,"Guideline/Assessment Tool",,"false","24031"
"23952","EU Laboratory Capability Monitoring System (EULabCap), 2018","European Union, European Centre for Disease Prevention and Control","2020-09-29T00:00:00.000","PDF","This 44-page, fifth consecutive report of the European Union Laboratory Capability (EULabCap) monitoring program presents European Union/European Economic Area (EU/EEA) laboratory capabilities and capacities in 2018, and the trends of previous survey results over the period 2013–2018.","https://www.ecdc.europa.eu/en/publications-data/eu-laboratory-capability-monitoring-system-eulabcap-2018","Leitmeyer, Katrin; Struelens, Marc","Report","Direct link to document: https://www.ecdc.europa.eu/sites/default/files/documents/EULabCap-survey-2018.pdf","false","23952"
"23923","Preventing Global Catastrophic Biological Risks","Nuclear Threat Initiative","2020-09-29T00:00:00.000","PDF","This 32-page report summarizes the exercise scenario and discussion from a scenario-based tabletop exercise designed to identify gaps in global capabilities to prevent and respond to high-consequence biological events, which was held in February 2020. It includes recommendations from the organizers.","https://www.nti.org/analysis/reports/preventing-global-catastrophic-biological-risks/","Cameron, Beth; Eckles, Jacob; Jordan, Jacob; Yassif, Jaime","Instructional/Training Material","Direct link to document: https://media.nti.org/documents/NTI_BIO_TTX_RPT_FINAL.pdfLink to the exercise website, which includes videos: https://www.nti.org/about/projects/global-catastrophic-biological-risks/preventing-global-catastrophic-biological-risks-tabletop-exercise-2020-munich-security-conference/","false","23923"
"23912","Fact Sheet for Healthcare Providers: SARS-CoV-2 Mass Array Test","U.S. Food and Drug Administration","2020-09-29T00:00:00.000","PDF","This three-page fact sheet informs healthcare providers of the significant known and potential risks and benefits of the emergency use of a Molecular LDT COVID-19 Authorized Test called the SARS-CoV-2 Mass Array Test that has been issued an Emergency Use Authorization (EUA) by the FDA. The Molecular LDT COVID-19 Authorized Test is authorized for use on certain respiratory specimens collected from individuals suspected of COVID-19 by their healthcare provider.","https://www.fda.gov/media/142546/download",,"Guideline/Assessment Tool","Link to Fact Sheet for Patients: https://www.fda.gov/media/142547/downloadLink to Letter of Authorization: https://www.fda.gov/media/142545/downloadLink to EUA Summary: https://www.fda.gov/media/142548/download","false","23912"
"23911","Fact Sheet for Healthcare Providers: Akron Children’s Hospital SARS-CoV-2 Assay","U.S. Food and Drug Administration","2020-09-29T00:00:00.000","PDF","This three-page fact sheet informs healthcare providers of the emergency use of a Molecular LDT COVID-19 Authorized Test called the Akron Children’s Hospital SARS-CoV-2 Assay that has been issued an Emergency Use Authorization (EUA) by the FDA. The Molecular LDT COVID-19 Authorized Test is authorized for use on certain respiratory specimens collected from individuals suspected of COVID-19 by their healthcare provider.","https://www.fda.gov/media/142541/download",,"Guideline/Assessment Tool","Link to Fact Sheet for Patients: https://www.fda.gov/media/142542/downloadLink to Letter of Authorization: https://www.fda.gov/media/142540/downloadLink to EUA Summary: https://www.fda.gov/media/142543/download","false","23911"
"23910","Fact Sheet for Healthcare Providers: CentoSure SARS-CoV-2 RT-PCR Assay","U.S. Food and Drug Administration","2020-09-29T00:00:00.000","PDF","This three-page fact sheet informs healthcare providers of the significant known and potential risks and benefits of the emergency use of the CentoSure SARS-CoV-2 RT-PCR Assay. The CentoSure SARS-CoV-2 RT-PCR Assay is authorized for use with dry oropharyngeal swab specimens from individuals without symptoms or other reasons to suspect COVID-19.","https://www.fda.gov/media/142537/download",,"Guideline/Assessment Tool","Link to Fact Sheet for Patients: https://www.fda.gov/media/142538/downloadLink to Letter of Authorization: https://www.fda.gov/media/142536/downloadLink to EUA Summary: https://www.fda.gov/media/142539/download","false","23910"
"23909","Fact Sheet for Healthcare Providers: Nirmidas COVID-19 (SARS-CoV-2) IgM/IgG Antibody Detection Kit","U.S. Food and Drug Administration","2020-09-29T00:00:00.000","PDF","This three-page fact sheet informs healthcare providers of the significant known and potential risks and benefits of the emergency use of the Nirmidas COVID-19 (SARS-CoV-2) IgM/IgG Antibody Detection Kit. The Nirmidas COVID-19 (SARS-CoV-2) IgM/IgG Antibody Detection Kit is authorized for the detection of antibodies to SARS-CoV-2 in human serum and plasma (dipotassium EDTA and lithium heparin) specimens.","https://www.fda.gov/media/142559/download",,"Guideline/Assessment Tool","Link to Fact Sheet for Recipients: https://www.fda.gov/media/142560/downloadLink to Letter of Authorization: https://www.fda.gov/media/142558/downloadLink to Instructions for Use: https://www.fda.gov/media/142561/download","false","23909"
"23908","Fact Sheet for Healthcare Providers: FREND COVID-19 total Ab","U.S. Food and Drug Administration","2020-09-29T00:00:00.000","PDF","This three-page fact sheet informs healthcare providers of the significant known and potential risks and benefits of the emergency use of the FREND COVID-19 total Ab. The FREND COVID-19 total Ab is authorized for the qualitative detection of total antibodies to SARS-CoV-2 in human dipotassium EDTA plasma.","https://www.fda.gov/media/142555/download",,"Guideline/Assessment Tool","Link to Fact Sheet for Recipients: https://www.fda.gov/media/142556/downloadLink to Letter of Authorization: https://www.fda.gov/media/142554/downloadLink to Instructions for Use: https://www.fda.gov/media/142557/download","false","23908"
"23907","Fact Sheet for Healthcare Providers: LIAISON SARS-CoV-2 IgM","U.S. Food and Drug Administration","2020-09-29T00:00:00.000","PDF","This three-page fact sheet informs healthcare providers of the significant known and potential risks and benefits of the emergency use of the LIAISON SARS-CoV-2 IgM. The LIAISON SARS-CoV-2 IgM is authorized for the detection of IgM antibodies to SARS-CoV-2 in human serum and plasma (sodium heparin, lithium heparin, and dipotassium EDTA).","https://www.fda.gov/media/142550/download",,"Guideline/Assessment Tool","Link to Fact Sheet for Recipients: https://www.fda.gov/media/142551/downloadLink to Letter of Authorization: https://www.fda.gov/media/142549/downloadLink to Instructions for Use: https://www.fda.gov/media/142552/download","false","23907"
"23891","Strengthening Health Security Across the Globe: Progress and Impact of U.S. Government Investments in the Global Health Security Agenda","U.S. Department of State","2020-09-29T00:00:00.000","PDF","This 28-page document is the fourth Global Health Security Agenda (GHSA) annual report. It details the progress and impact of investments made by the United States in the GHSA to protect against infectious disease threats and their subsequent adverse effects on global health, security, and the economy.","https://www.state.gov/wp-content/uploads/2020/09/GHSA_ProgressImpactFY19_final.pdf",,"Report",,"false","23891"
"22775","Webinar Series - Respirators and Other Personal Protective Equipment (PPE) for Health Care Personnel Use During the COVID-19 Pandemic","U.S. Food and Drug Administration","2020-09-29T00:00:00.000","Text","This web page provides information about a webinar series, starting on September 29, 2020, discussing the importation of respirators during the COVID-19 pandemic, and the Food and Drug Administration's collaboration with the Centers for Disease Control and Prevention on the sampling and testing of international respirators in support of the FDA's respirator Emergency Use Authorizations.","https://www.fda.gov/medical-devices/workshops-conferences-medical-devices/webinar-series-respirators-and-other-personal-protective-equipment-ppe-health-care-personnel-use",,"Instructional/Training Material",,"false","22775"
"23934","COVID-19: Management of Staff and Exposed Patients and Residents in Health and Social Care Settings","United Kingdom Department of Health","2020-09-28T00:00:00.000","Text","This guidance provides advice on the management of staff and patients or residents in health and social care settings according to COVID-19 exposures, symptoms, and test results. It includes guidance for staff with symptoms of COVID-19, and staff return to work criteria.","https://www.gov.uk/government/publications/covid-19-management-of-exposed-healthcare-workers-and-patients-in-hospital-settings",,"Guideline/Assessment Tool",,"false","23934"
"23933","COVID-19: How to Work Safely in Care Homes","United Kingdom Department of Health","2020-09-28T00:00:00.000","Video or Multimedia","These print and video guidance materials for those working in care homes provide information on how to work safely during this period of sustained transmission of COVID-19, including information about personal protective equipment and case studies.","https://www.gov.uk/government/publications/covid-19-how-to-work-safely-in-care-homes",,"Guideline/Assessment Tool","Link to Case Scenarios for Health Care Workers: https://www.gov.uk/government/publications/covid-19-how-to-work-safely-in-care-homes/case-scenarios-for-health-care-workers","false","23933"
"23899","National Public Health Framework for the Prevention and Control of Vector-Borne Diseases in Humans","Centers for Disease Control and Prevention, Office of Infectious Diseases","2020-09-28T00:00:00.000","PDF","Five federal departments and the Environmental Protection Agency contributed to developing this 16-page national framework for vector-borne disease prevention and control, which includes federal activities necessary to detect, prevent, and control vector-borne diseases in humans in the United States.","https://www.cdc.gov/ncezid/dvbd/framework.html",,"Report","Direct link to document: https://www.cdc.gov/ncezid/dvbd/pdf/Brochure_National_Framework_VBDs-P.pdf","false","23899"
"23696","COVID-19 Target Product Profiles for Priority Diagnostics to Support Response to the COVID-19 Pandemic v.0.1","World Health Organization","2020-09-28T00:00:00.000","PDF","The World Health Organization has published this 38-page final version of Target Product Profiles (TPP), updated on September 28, 2020, for priority COVID-19 diagnostics. These TPPs describe the desirable and minimally acceptable profiles for four tests.","https://www.who.int/publications/m/item/covid-19-target-product-profiles-for-priority-diagnostics-to-support-response-to-the-covid-19-pandemic-v.0.1",,"Guideline/Assessment Tool","Direct link to document: https://www.who.int/docs/default-source/blue-print/who-rd-blueprint-diagnostics-tpp-final-v1-0-28-09-jc-ppc-final-cmp.pdf?sfvrsn=af73a99a_2&download=true","false","23696"
"24047","Housing and Shelter During a Pandemic Webinar Series","Naval Postgraduate School, Center for Homeland Security and Defense","2020-09-25T00:00:00.000","Video or Multimedia","This web page provides information and links for a webinar series discussing the challenges and emerging model practices for housing, sheltering, and congregate population management during the COVID-19 pandemic.","https://www.chds.us/c/item/17353",,"Instructional/Training Material",,"false","24047"
"24038","Risk Mitigation Tool for Child and Youth Settings Operating During the COVID-19 Pandemic","Government of Canada","2020-09-25T00:00:00.000","Text","This tool will assist school boards and operators of child and youth settings in considering risks to children/youth, staff, and volunteers during the coronavirus disease (COVID-19) pandemic, and provide examples of strategies that may be implemented to mitigate potential risks.","https://www.canada.ca/en/public-health/services/diseases/2019-novel-coronavirus-infection/guidance-documents/covid-19-risk-mitigation-tool-child-youth-settings-operating-during-pandemic.html",,"Guideline/Assessment Tool",,"false","24038"
"23953","Pertussis: Annual Epidemiological Report for 2018","European Union, European Centre for Disease Prevention and Control","2020-09-25T00:00:00.000","PDF","This eight-page report provides information about pertussis cases in 2018, when there were 35,627 cases of pertussis reported by 30 European Union/European Economic Area (EU/EEA) countries. Five countries - Germany, the Netherlands, Norway, Spain, and the United Kingdom (UK) - accounted for 72 percent of all notified cases.","https://www.ecdc.europa.eu/en/publications-data/pertussis-annual-epidemiological-report-2018",,"Report","Direct link to document: https://www.ecdc.europa.eu/sites/default/files/documents/AER_for_2018_pertussis.pdf","false","23953"
"23943","COVID-19: Current State of the Pandemic","National Emerging Special Pathogens Training and Education Center","2020-09-25T00:00:00.000","Video or Multimedia","This 53-minute webinar describes the current COVID-19 pandemic hotspots in the U.S. and globally, including the epidemiology of the current wave of infections. It also discusses country-wide testing needs to mitigate and suppress COVID-19 infections, reviews the evidence regarding possible re-infections of COVID-19, and interprets the data behind the newest therapeutic guidelines for COVID-19.","https://repository.netecweb.org/exhibits/show/ppe-cons/item/1318","Tennill, Trish; Klinger, Amanda; Mukherjee, Vikram","Instructional/Training Material","Link to presentation slides: https://repository.netecweb.org/files/original/53cf2eb5e0fc5d60650c7f9024e4e23b.pdf","false","23943"
"23900","COVID-19 Vaccine Planning Information Session for Tribal Communities","National Indian Health Board","2020-09-25T00:00:00.000","Video or Multimedia","The purpose of this one-hour, four-minute webinar is to introduce Tribal leaders to COVID-19 vaccine distribution options and planning considerations. It includes an overview of the federal government’s COVID-19 vaccine planning activities, and highlights considerations for Tribal leaders and health organizations serving Tribal and urban Indian communities making decisions about vaccine distribution.","https://www.youtube.com/watch?v=pCQXZljE4fw&feature=youtu.be","Whicker, Marion; Groom, Amy; Vigario, Jennifer","Instructional/Training Material","Link to Centers for Disease Control and Prevention (CDC) Presentation Vaccine Planning Webinar Slides: https://www.nihb.org/covid-19/wp-content/uploads/2020/09/CDC-Presentation-Vaccine-Planning-Webinar_9_24_Final.pdfLink to Indian Health Service (IHS) Presentation Vaccine Planning Webinar Slides: https://www.nihb.org/covid-19/wp-content/uploads/2020/09/IHS-Presentation-for-NIHB_final_09252020.pdf","false","23900"
"23897","Fact Sheet for Healthcare Providers: MosaiQ COVID-19 Antibody Magazine","U.S. Food and Drug Administration","2020-09-25T00:00:00.000","PDF","This three-page fact sheet informs healthcare providers of the significant known and potential risks and benefits of the emergency use of the MosaiQ COVID-19 Antibody Magazine. The MosaiQ COVID-19 Antibody Magazine is authorized for the detection of total (IgM and IgG) antibodies to SARS-CoV-2 in human serum and dipotassium (K2) and tripotassium (K3)EDTA plasma.","https://www.fda.gov/media/142484/download",,"Guideline/Assessment Tool","Link to Fact Sheet for Recipients: https://www.fda.gov/media/142485/downloadLink to Letter of Authorization: https://www.fda.gov/media/142483/downloadLink to Instructions for Use: https://www.fda.gov/media/142486/download","false","23897"
"23896","Fact Sheet for Healthcare Providers: Genetrack SARS-CoV-2 Molecular Assay","U.S. Food and Drug Administration","2020-09-25T00:00:00.000","PDF","This three-page fact sheet informs healthcare providers of the significant known and potential risks and benefits of the emergency use of the Genetrack SARS-CoV-2 Molecular Assay. The Genetrack SARS-CoV-2 Molecular Assay is authorized for use with anterior nasal swab specimens self-collected at home using the Vo’ COVID-19 Test Home Collection Kit by individuals suspected of COVID-19 when home collection is determined to be appropriate by their healthcare provider.","https://www.fda.gov/media/142480/download",,"Guideline/Assessment Tool","Link to Fact Sheet for Patients: https://www.fda.gov/media/142481/downloadLink to Letter of Authorization: https://www.fda.gov/media/142479/downloadLink to EUA Summary: https://www.fda.gov/media/142482/download","false","23896"
"23841","Topic Collection: COVID-19 and Outreach Efforts: Resources for Communication Tools and Social Media Assets in a COVID-19 Environment","Office of the Assistant Secretary for Preparedness and Response [U.S. Department of Health and Human Services]","2020-09-25T00:00:00.000","Text","This collection from TRACIE (Technical Resources, Assistance Center, and Information Exchange) provides resources to effectively communicate to diverse populations in the COVID-19 environment.","https://asprtracie.hhs.gov/technical-resources/152/covid-19-and-outreach-efforts-resources-for-communication-tools-and-social-media-assets-in-a-covid-19-environment",,"Bibliography/Resource List",,"false","23841"
"23840","Topic Collection: COVID-19 and Minority/Vulnerable Populations: Resources for Outreach and Protection of At-Risk Individuals in a COVID-19 Environment","Office of the Assistant Secretary for Preparedness and Response [U.S. Department of Health and Human Services]","2020-09-25T00:00:00.000","Text","This collection from TRACIE (Technical Resources, Assistance Center, and Information Exchange) provides resources to engage and protect minority and vulnerable populations in the COVID-19 environment.","https://asprtracie.hhs.gov/technical-resources/148/covid-19-and-minority-vulnerable-populations-resources-for-outreach-and-protection-of-at-risk-individuals-in-a-covid-19-environment",,"Bibliography/Resource List",,"false","23840"
"23839","Topic Collection: COVID-19 and K-12 Schools: Resources for Operating K-12 Schools in a COVID-19 Environment","Office of the Assistant Secretary for Preparedness and Response [U.S. Department of Health and Human Services]","2020-09-25T00:00:00.000","Text","This collection from TRACIE (Technical Resources, Assistance Center, and Information Exchange) provides resources related to ways K-12 schools across the country are operating in the COVID-19 environment.","https://asprtracie.hhs.gov/technical-resources/151/covid-19-and-k-12-schools-resources-for-operating-k-12-schools-in-a-covid-19-environment",,"Bibliography/Resource List",,"false","23839"
"23838","Topic Collection: COVID-19 and Institutions of Higher Education (IHE): Resources for Operating IHEs in a COVID-19 Environment","Office of the Assistant Secretary for Preparedness and Response [U.S. Department of Health and Human Services]","2020-09-25T00:00:00.000","Text","This collection from TRACIE (Technical Resources, Assistance Center, and Information Exchange) provides resources related to ways institutions of higher education (IHEs) across the country are operating in the COVID-19 environment.","https://asprtracie.hhs.gov/technical-resources/147/covid-19-and-institutions-of-higher-education-ihe-resources-for-operating-ihes-in-a-covid-19-environment",,"Bibliography/Resource List",,"false","23838"
"23837","Topic Collection: COVID-19 and Critical Infrastructure and Businesses: Resources for Operating Critical Infrastructure in a COVID-19 Environment","Office of the Assistant Secretary for Preparedness and Response [U.S. Department of Health and Human Services]","2020-09-25T00:00:00.000","Text","This collection from TRACIE (Technical Resources, Assistance Center, and Information Exchange) provides resources related to how critical infrastructure and businesses across the country are operating in the COVID-19 environment.","https://asprtracie.hhs.gov/technical-resources/150/covid-19-and-critical-infrastructure-and-businesses-resources-for-operating-critical-infrastructure-in-a-covid-19-environment",,"Bibliography/Resource List",,"false","23837"
"23836","Topic Collection: COVID-19 and Community and Faith-Based Organizations Resources for Operating in a COVID-19 Environment","Office of the Assistant Secretary for Preparedness and Response [U.S. Department of Health and Human Services]","2020-09-25T00:00:00.000","Text","This collection from TRACIE (Technical Resources, Assistance Center, and Information Exchange) provides resources related to ways community and faith-based organizations across the country are operating in the COVID-19 environment.","https://asprtracie.hhs.gov/technical-resources/149/covid-19-and-community-and-faith-based-organizations-resources-for-operating-in-a-covid-19-environment",,"Bibliography/Resource List",,"false","23836"
"23833","Modelling the Allocation and Impact of a COVID-19 Vaccine","Imperial College London","2020-09-25T00:00:00.000","PDF","This 21-page report identifies optimal vaccine allocation strategies within and between countries to maximize health (avert deaths) under constraints on dose supply. It extended an existing mathematical model of SARS-CoV-2 transmission across different country settings to model the public health impact of potential vaccines, using a range of target product profiles developed by the World Health Organization.","https://www.imperial.ac.uk/mrc-global-infectious-disease-analysis/covid-19/report-33-vaccine/","Hogan, Alexandra; Winskill, Peter; Watson, Oliver; Walker, Patrick; Whittaker, Charles","Report","Direct link to document: https://www.imperial.ac.uk/media/imperial-college/medicine/mrc-gida/2020-09-25-COVID19-Report-33.pdf","false","23833"
