"shortcode","indicator","title","headline","summary","bonus"
"LU3A","Housing Permits","Regional Performance","Despite a significant increase since the Great Recession, permitting still remains well below mid-20th century levels.","Bay Area cities and counties issued permits for 27,000 housing units in 2017. While thousands of units below the peaks of the 1970s and 1980s, this represents the largest number of units permitted in the post-Great Recession era. Multi-family housing accounted for more than 75 percent of all permits issued in 2017, one of the highest shares on record. In highly urbanized counties like San Francisco and Santa Clara, the share is even higher, with permits for multi-family units accounting for 98 percent and 88 percent of all permits, respectively. Meanwhile, counties in the North Bay continue to issue more permits for single-family units than multi-family units.",
"LU4B","Housing Production","Local Focus","Since the end of the Great Recession, the majority of the region's housing production has been multi-family properties in San Francisco and San Jose.","San Jose and San Francisco, the two largest cities in the region, have produced around one-third of all new Bay Area housing units since 2010. Fueled by growing demand for rental housing near job centers, San Jose and San Francisco have added nearly 45,000 units to the region’s housing stock – over 90 percent of which are multi-family units. However, housing production in 2018 was down 29% in San Jose and 50% in San Francisco from 2017, which could indicate a slowdown in the demand for housing in these areas. Cities in Alameda County like Oakland, Pleasanton and Union City, and cities in Silicon Valley like Redwood City, Foster City and Sunnyvale also have produced a large share of multi-family units.","Natural disasters have definitively shaped the state of housing production at the local level. The 2017 Northern California wildfires affected communities throughout the North Bay, and the housing production for our region is still recovering from the loss of nearly 5,000 homes. Santa Rosa, as well as unincorporated Sonoma and Napa Counties, were particularly hard hit. However, housing production in these areas was up 8% in 2018, with Sonoma County alone adding 1,400 units."
"LU4C","Housing Production","National Context","The major metros in the South have produced housing at rates two and three times faster than their peers.","Dallas, Houston and Atlanta continue to produce the most housing units per capita among the major metros. The Texas metros have been national leaders in housing production for nearly a decade, with per capita production rates well above that of our region. Dallas is approaching three times the housing units per capita of the Bay Area, while Houston is approaching two times. While housing production in Atlanta fell precipitously during the Great Recession, it has rebounded in recent years to nearly match that of Houston. Housing production in these areas can be attributed to lower construction costs, simpler permitting processes, and skyrocketing job and population growth. In 2017, these three southern metros continued to produce more housing units than the other seven major metros combined.","The Bay Area is ranked 5th among the major metros for per capita housing production, with New York, Chicago and Philadelphia continuing to produce the lowest number of new housing units per capita. However, 2018 was the first year that Chicago outpaced Philadelphia in per capita housing production, suggesting a reversal of the slow growth trend the metro area has experienced for decades."
"LU5A","Greenfield Development","Regional Performance","The pace of Bay Area greenfield development slowed by nearly a third from 2000 to 2016.","Between 2000 and 2010, the Bay Area’s urban footprint expanded by around 4,700 acres per year. In this decade, that figure has been cut in half, down to 2,000 acres per year. The latest data show greenfield development on the rise from 2014 to 2016, which could suggest a resurgence in demand for lower-cost housing in less-centrally located parts of the region.","Development across the Bay Area increased the size of the region’s developed footprint to approximately 790,200 acres in 2016, making it 17 percent larger than the footprint of 1990. Since 1990, greenfield development was most rapid between 1990 and 2000, when approximately 55,000 acres were added to the region’s developed area. Nevertheless, the Bay Area has grown denser over time, with the rate of population growth outpacing the rate of greenfield development since 1990."
"LU5B","Greenfield Development","Regional Distribution","Regional greenfield development since 2010 has been concentrated in Alameda, Contra Costa and Santa Clara counties.","East Bay counties, along with Santa Clara County to the south, have accounted for nearly two-thirds of the Bay Area’s greenfield development since 2010. Development in these three counties largely has consisted of nonagricultural land converting to housing or retail. Meanwhile, Sonoma County has drastically reduced its share of greenfield development in this decade, accounting for just 5 percent of the region’s share since 2010 – down from 19 percent in the 1990s.",
"LU5C","Greenfield Development","Local Focus","The Bay Area’s urban footprint grew in large part due to activity in eastern Contra Costa and southern Santa Clara counties.","Powered in part by significant development activity in Brentwood, Antioch and Oakley, a significant chunk of our region’s greenfield development from 1990 to 2016 occurred in eastern Contra Costa County. The 28,100 acres of greenfield development in the county represented 25 percent of all such development within the region during this period. Combined with similar activity around South San Jose, Gilroy and Morgan Hill, Contra Costa and Santa Clara counties together account for more than 40 percent of our region’s greenfield development in this 26-year timeframe.","Sonoma and Solano counties have accounted for the majority of greenfield development in the North Bay. In Sonoma County – where nearly 16,600 acres have been developed since 1990 – nearly all development can be attributed to the conversion of small parcels in unincorporated areas along the U.S. Route 101 corridor. This contrasts with the development pattern in Solano County, where new, multi-acre residential subdivision developments are much more common."
"LU5D","Greenfield Development","National Context","Since 2000, the Bay Area has consumed the fewest greenfield acres among the 10 largest U.S. metro areas.","While the fast-growing Sunbelt metropolitan regions of Atlanta, Dallas and Houston absorbed land at a prodigious pace from 2000 through 2018 – with each expanding its urban footprint by around 40 percent – the acreage of developed land in the Bay Area expanded by just  10 percent (measured in terms of U.S. Census block groups). Indeed, the Bay Area’s developed footprint grew by the smallest number of acres — and the third-smallest percentage — of any of the nation’s 10 largest metro areas during this period. Only New York City and Los Angeles registered similarly small growth rates for greenfield development.",
"T11T12A","Transit Ridership","Regional Performance","While transit ridership has been on the rise in the last few years, it remains below the modern-era peak achieved in 2001.","On a typical weekday in 2016, Bay Area residents boarded buses, trains and ferries approximately 1.8 million times. While ridership has surpassed pre-recession levels - growing robustly for the fifth consecutive year - the region is still just shy of its modern historic peak of weekday boardings, which was reached in 2001. On a per-capita basis, transit use is well below the levels of the early 1990s. The average resident boarded transit 79 times per year in 1991, while in 2016, this had fallen to 70 trips per year - an 11 percent decline over 25 years.","Short- and long-term ridership trends indicate an ongoing shift in transit demand away from local bus services and toward regional rail systems. While ridership on rail systems has grown steadily over the decades, bus ridership has dropped significantly. On a per-capita basis, ridership on Bay Area buses has fallen by one-third since 1991. Given that the majority of Bay Area transit trips take place on buses - rather than trains - this has played a major role in the overall per-capita decline in regional transit use."
"T11T12B","Transit Ridership","Local Focus","After several years of robust growth, ridership growth on both BART and Caltrain slowed in 2016.","In 2016, BART and Caltrain set records for average daily ridership. Caltrain ridership grew just 1.5 percent year-over-year, however, after climbing by 6 percent to 17 percent annually over the previous five years. Since 1991, Caltrain recorded a daily ridership increase of more than 200 percent, while BART ridership grew by more than 76 percent. For both operators, ridership growth since the end of the Great Recession has occurred despite only limited expansion to service hours over the same time period.","It's a different story for bus operators, however. Though bus ridership has rebounded slightly in the last few years, most agencies have seen significant per-capita declines in ridership over the last few decades. While some of these declines are a result of service cuts, ridership has declined at an even faster rate. AC Transit, VTA and SamTrans all posted per-capita ridership declines of 30 percent to 40 percent since 1991. San Francisco Muni, which provides nearly half of all transit trips in the region, registered an 11 percent decline in per-capita bus ridership in the same period. However, the recent population and jobs boom in San Francisco has had a positive impact on Muni ridership with per-capita boardings increasing markedly in 2016 for not only light rail but also for its bus services."
"T11T12C","Transit Ridership","National Context","After adjusting for population growth, only four of the ten major metros in the United States saw real growth in transit ridership in 2016.","Per-capita transit ridership trended upward in 2016 in Houston, Philadelphia, the Bay Area and New York, but stayed flat or declined in all other large metros. Annual bus boardings in Miami and Los Angeles continued to decline, causing overall per-capita transit ridership in both metros to drop for the second year in a row. Washington - which ranks second among the major U.S. metros for per-capita transit ridership - had 6 percent fewer transit boardings per-capita in 2016 as both bus and rail ridership continued their long-term decline. Ridership loss in 2016 was particularly steep in the nation's capital as major maintenance work disrupted service on the Area's heavy rail system, causing many rail passengers to switch modes.","With the key exception of New York, all of the nation's top metro areas have seen a decline in per-capita ridership since the end of the recession. New York is the only metro area to see significant long-term gains in ridership, with the average resident now boarding transit nearly 42 percent more often than in 1991. Benefiting from reinvestment in aging infrastructure, booming residential and commercial development in the urban core, and improved safety for riders at all times of day, New York has been the core engine of transit ridership growth not only in the Northeast but for the entire United States."
"T13A","Transit Cost-Effectiveness","Regional Performance","The Bay Area has stabilized transit operating costs and is also relying on larger fare contributions from riders.","Although per-rider operating costs ticked slightly upward in 2015, transit cost-effectiveness has been relatively stable over the last decade-plus. Combined with rising revenues from increased fares, the subsidy required to operate service (net cost per boarding) actually declined by 17 percent between 2003 and 2015. Booming ridership on higher-fare systems like Caltrain and BART has contributed to this trend.","Muni remained the regional leader for lowest total operating cost per boarding in 2015, although costs ticked very slightly upwards in the last few years. When it comes to net operating cost per boarding, BART and Caltrain have made the greatest strides in recent years. Both systems saw nearly 70 percent declines in the past dozen years, reflecting surging ridership on both systems. BART riders paid $3.43 out of each $4.29 in total cost per boarding, requiring only 86 cents in operating subsidy, whereas on systems like SamTrans and VTA it was around $1.00 out of $7.00, requiring $6.00 in operating subsidy in 2015."
"T13B","Transit Cost-Effectiveness","National Context","High costs put the Bay Area in the middle of the pack when it comes to transit cost-effectiveness.","The Bay Area ranks fourth among the 10 largest U.S. metro areas for its transit systems' average operating cost per passenger boarding and net cost per boarding, despite relatively high fares across the region which contribute to relatively strong farebox recovery. Due in large part to very high ridership numbers, the New York metro Area's transit network is by far the nation's most cost-effective. The Bay Area's middling transit cost-effectiveness rankings are largely the result of the region's high operating costs.","While the Bay Area's transit system is by no means the most cost-effective in America, transit operators in Dallas and Houston experience even higher operating costs per boarding. Reflecting their relatively transit-incompatible service areas - and a greater share of low-income or transit-dependent riders - these systems have net operating costs per boarding that are 60 to 85 percent higher than the Bay Area."
"T14T15A","Daily Miles Traveled","Regional Performance","Per-capita miles traveled have remained relatively stable for the last decade, even as the region's population grew by more than a half-million people.","Although the number of daily miles logged by vehicles in the Bay Area declined during the Great Recession, daily miles traveled has spiked since 2010. The region has surpassed previous records for this indicator with vehicle miles traveled now totaling 172 million on a typical day. On a per-capita basis, daily travel in the Bay Area has stabilized since 2005 at approximately 23 miles per person. This suggests that recent growth in total mileage is primarily driven by population growth rather than longer travel distances.","At around 30 miles per resident, the North Bay counties of Marin and Solano had the highest average daily vehicle travel of the nine Bay Area counties in 2015. For Marin County, this figure represents a reduction from a daily VMT average that ran in the 30-plus range throughout the preceding decade. Conversely, at just 10 miles, San Francisco has by far the lowest VMT per capita."
"T14T15B","Daily Miles Traveled","National Context","The Bay Area's per-capita miles traveled is in the middle of the pack nationally.","Bookended by the metro areas of New York and Philadelphia on the low end and Atlanta and Dallas on the high end, the San Francisco Bay Area finds itself in the middle of the pack in terms of daily miles traveled. As of 2015, the latest year for which figures are available, the Bay had the fifth-lowest level of average daily driving. Surprisingly, the Bay Area is virtually tied with Los Angeles for per-capita miles traveled, belying the latter metro's auto-oriented reputation.",
"T7A","Time Spent in Congestion","Regional Performance","Traffic congestion is outpacing regional economic growth.","While there are more transportation alternatives than ever before, today's congestion is worse than what was experienced during previous economic booms. Since the peak of the dot-com boom in 2000, per-commuter congested delay increased by about 65 percent while population and jobs grew by 15 percent and 12 percent, respectively. Commuters are likely also experiencing delays on arterials and local roads, although there is insufficient data to quantify these trends.",
"T16A","Street Pavement Condition","Regional Performance","The regional average PCI score held steady at 67 in 2018, with roads in the region rated as fair overall.","Regionwide, street pavement conditions generally have been stable since 2003, the first year data were collected. Since then, the average PCI score in the Bay Area has ranged from 63 to 67, putting our local streets and roads in “fair” condition. While local governments continue to work to improve their pavement condition, aging infrastructure remains a challenge for the region.","While pavement conditions across the region largely have been stable in recent years, performance gains are more evident at the county level. San Francisco and Marin counties had the biggest improvements in PCI from 2010 to 2018, gaining eight and six points, respectively. Notably, after three years in which pavement condition in all counties either improved or held steady, Napa and Sonoma counties experienced one point declines in PCI in 2018. Whether due to direct damage or lack of investment, this decline may be linked to the October 2017 North Bay wildfires."
"T16B","Street Pavement Condition","Regional Distribution","Pavement condition in most cities has changed only marginally over the past decade.","The majority of Bay Area cities and towns have seen minimal shifts in their pavement conditions over the past 10 years. For example, many of the region’s most populous cities – including San Jose, Oakland, Fremont and Hayward – have only shifted by a few PCI points over the past decade. Yet there have also been some success stories, particularly in smaller suburban jurisdictions like El Cerrito, Orinda and Woodside.",
"T16C","Street Pavement Condition","Local Focus","Pavement conditions vary widely from city to city.","Close to three-quarters of Bay Area cities have pavement rated as fair or good (PCI score between 60 and 79), including the region’s two largest cities – San Jose and San Francisco. In total, 74 percent of the region’s population lives in jurisdictions with fair or good pavement, with another 6 percent living in places with pavement in excellent condition (PCI score of 80 or higher). Notable exceptions include the region’s third most populous city, Oakland, along with its neighbors Berkeley and San Leandro – all of which have “at risk” PCIs between 50 and 59.","North Bay communities dominate the list of Bay Area communities with the lowest PCI scores. Among these are Larkspur, Petaluma, Vallejo and Sebastopol. Some of the region’s smoothest roads can be found in East Bay cities such as Brentwood, Dublin and El Cerrito. Not surprisingly, superior pavement conditions are often found in newer communities, where many streets were constructed in the last 20 years or so, as well as in jurisdictions that have passed funding measures aimed at road rehabilitation."
"T17A","Highway Pavement Condition","Regional Performance","While still better than past decades, Bay Area highway pavement conditions have gotten worse since 2013.","The percentage of Bay Area highway lane-miles with pavement in distressed condition increased from 21 percent in 2013 to 25 percent in 2015, but this remains 10 percentage points lower than the level registered nearly two decades ago. The recent dip in the regional highway pavement quality is attributed mainly to deterioration on the heavily-traveled I-580 and I-880 corridors in Alameda County. As state and local agencies rehabilitate and reconstruct roads in the most distressed conditions, highway segments across the region continue to deteriorate due to increasing age, traffic and unfavorable weather conditions.","Over the past decade, our region has benefited from pavement improvement projects such as those along Interstate 80 and U.S. Highway 101 funded by the 2006 Proposition 1B bond measure and the 2009 federal stimulus package. With the passage of Senate Bill 1, which is forecast to generate billions more in funding for highway repairs, the Bay Area is well positioned to make further progress on this metric in the years to come."
"T17B","Highway Pavement Condition","Local Focus","Pavement preservation for the region's busiest freeways has been prioritized over other state highways.","The Bay Area's best highway pavement conditions generally are found on major freeways, with Interstates 80 and 280 as well as U.S. 101 standing out in particular. These highways have among the highest traffic volumes of any Bay Area roadway. Pavement quality is significantly lower on many non-freeway routes, with 57 percent of the 231 lane-miles on State Route 82 (El Camino Real) and 38 percent of State Route 1 in distressed condition.","The Bay Area's smoothest highways generally are found in suburban portions of the region - in Contra Costa, Santa Clara and Solano counties in particular. Heavy use of urban freeways in San Francisco has resulted in pavement conditions far worse than other Bay Area counties. Though San Francisco routes account for just 4 percent of all distressed highway pavement in the region, 39 percent of the highway lane-miles in the city are in poor shape."
"T18A","Bridge Condition","Regional Performance","Bay Area bridge conditions have significantly improved over the past decade.","Bay Area bridges and overpasses are in their best shape since 1992 - the earliest year on record - thanks to substantial efforts to improve the seismic and structural safety of these critical facilities. Poor bridge conditions hit a peak in 2004 when nearly one-third of the Bay Area's bridges were identified as structurally deficient. Over the past 12 years, seismic retrofit programs on highway bridges as well as upgrades to elevated freeway structures helped the region reverse that trajectory. As a result, the share of bridges flagged as deficient fell by a remarkable 25 percentage points - and stood at just 7 percent as of 2016.",
"T18B","Bridge Condition","Local Focus","While most Bay Area counties have seen improved bridge and overpass conditions over the last decade, in recent years San Francisco has experienced the greatest progress.","The share of structurally deficient bridges and overpasses in San Francisco County in 2016 are at an all-time recorded low. Numerous structural repairs were made between 2012 and 2014 and the share of structurally deficient deck area fell by nearly 70 percent in that two-year period. Sonoma, Solano, Contra Costa and Alameda counties have also seen improvements over the past decade, though the rate of repair has slowed considerably in the last four years. In Alameda and Contra Costa counties, the seismic retrofits of those counties' toll bridges have contributed to their strong performance.",
"T18C","Bridge Condition","National Context","As a result of significant investments, the Bay Area no longer has the greatest share of structurally deficient bridges of any major metro area.","Overall, every metro area except for Miami has seen improvements in bridge condition since 2000. Having reduced its share of structurally deficient bridge deck area by 25 percentage points since 2005, the Bay Area finds itself in the middle of the pack of the nation's top 10 metro areas for bridge condition. New York now claims the bottom rung for worst bridge condition, with structurally deficient bridge deck area shares of 11 percent. While the Bay Area had seen by far the largest gains, Los Angeles has also made notable progress over the last four years.","Metro areas in the South generally have the fewest structurally deficient bridges - Houston, Miami, Atlanta and Dallas all have deficient shares below 3 percent. This trend reflects the fact that these regions, due to their recent growth, generally have newer infrastructure and many have fewer geographical features requiring this type of infrastructure."
"T19A","Transit Asset Condition","Regional Performance","While the vast majority of the Bay Area's rail guideway is in good condition, over half of regional rail vehicles have surpassed their useful life.","Transit asset condition performance varies widely in the Bay Area. Rail operators have excelled in maintaining tracks, with less than two percent of all rail mileage impacted by speed restrictions. Condition of revenue vehicles, or the vehicles that provide service to passengers, varies by type of service. For example, none of the Bay Area's light rail vehicles are past their useful life, while 50 to 80 percent of longer-distance service-providing commuter and heavy rail vehicles are. With new BART trains already in service and plans for electric Caltrain locomotives to debut in 2022, regional performance in this area is expected to improve in future years.","The maintenance of transit systems may be less visible to the passenger's eye, but assets that support these activities are critical to maintaining quality service. Based on federal performance measures, nearly a quarter of the Bay Area's maintenance facilities are deemed to be in poor or failed condition. Among major transit providers, BART's maintenance facilities are in the best condition, with just ten percent rated as poor or failed. Meanwhile, Caltrain and Golden Gate Transit report that 75 and 85 percent of their facilities rate as poor or failed, respectively."
