"shortcode","indicator","title","headline","summary","bonus"
"EC13A","Economic Output","Regional Performance","The Bay Area economy has grown by 59 percent since the ""dot-com"" bust in 2001.","The Bay Area economy, $900 billion strong, has fared well in the first two decades of the 21st century. Notwithstanding two significant recessions - in 2001-2002 and in 2007-2009 - the region boosted its inflation-adjusted economic output by 59 percent from 2001 to 2017. While a growing population explains some of this growth, the region's economy has still grown by 40 percent since 2001 when evaluated on a per capita basis. Since 2009, the low point of the recent downturn, the region has added $257 billion to its GRP, an average of nearly 5 percent growth each year.","It's worth noting that the Bay Area's impressive growth in output since 2001 has not been accompanied by a proportional growth in overall employment. The number of jobs in the region grew 11 percent over this period, moving from 3.5 million in 2001 to 3.9 million in 2017. Much of the region's economic growth comes from the job growth in high-productivity sectors such as electronic component manufacturing, computer software design, and scientific research and development services."
"EN2C","Ozone Concentrations","National Context","Despite significant improvements in air quality over the past half-century, Los Angeles still has the highest ozone levels of any major U.S. metro area.","California's stringent motor vehicle emissions standards have played a key role in reducing ozone levels in our state over the past half-century. Although ozone levels vary annually based on weather conditions, Bay Area ozone levels have generally been lower than most major metro areas in recent years. While emissions standards have greatly improved conditions in the City of Angels as well, Los Angeles still has the highest ozone concentrations of any major American metropolis. This is a result of its mountainous terrain, which trap air pollution in the Los Angeles basin. This topography contributes to the creation of smog, but at levels significantly lower than in decades past.",
"EQ2D","Housing Affordability","National Context","Despite having some of the nation's highest housing costs, the Bay Area actually falls in the middle of the pack for affordability, thanks to higher regional incomes.","Despite our very high housing prices, the Bay Area remarkably does not top the list for unaffordability. The region ranks fourth after Los Angeles, Miami and New York. Housing costs are above average in all four of these metro areas, but higher median incomes in the Bay Area mean the average resident here finds it easier to pay the higher housing costs. Meanwhile, Dallas, Atlanta and Washington have the lowest share of excessively-burdened residents among the 10 largest metro areas, led in part by higher incomes in Washington and lower housing costs in the southern metros.",
"EC13B","Economic Output","Local Focus","All Bay Area subregions have seen positive trends for economic output, but Silicon Valley is powering the region's economic surge.","Riding a technology boom, the per capita economic output of Silicon Valley nearly doubled between 2001 and 2017, growing over 40 percent faster than the regional growth rate after adjusting for inflation. While the San Francisco-Oakland subregion still accounts for almost 60 percent of the Bay Area economy, San Jose and other Silicon Valley cities contribute almost 35 percent of our region's economic output.","In the North Bay, Napa, Solano and Sonoma counties account for only 7 percent of the Bay Area's overall economic output. However, on a per capita basis, Napa and Solano counties have experienced economic growth at a rate only slightly lower than that of San Francisco since 2001. Meanwhile, Sonoma County has the smallest long-term growth in per capita GRP since 2001 at 10 percent, due in part to a concentration of jobs in lower-value sectors like agriculture."
"EC13C","Economic Output","National Context","When it comes to economic output, the Bay Area is growing faster than any of its peer metro areas.","The Bay Area's economy has been the nation's best performer since 2001, with its 40 percent per capita GRP growth outpacing other major metro areas by a wide margin. Prior to the Great Recession, our region's economy was also one of the faster-growing in the nation, along with those of Los Angeles, Miami, Washington and New York. Since the Great Recession, however, these other large metro areas have seen little-to-no growth in per capita GRP - while the Bay Area economy has continued its upward trend. Our region's 2017 per capita GRP also topped the list of its big-city peers, outperforming the nation's energy, political and financial hubs (Houston, Washington and New York, respectively) by at least $30,000 per person.",
"EC17A","Airport Activity","Regional Performance","Passenger travel at Bay Area airports has steadily grown over time, primarily at San Francisco International Airport.","Passenger boardings at Bay Area airports have outpaced population growth, increasing nearly 41 percent since 2001 to a total of almost 40 million in 2017. This reflects growing air travel demand from Bay Area residents and increases in passengers arriving in the Bay Area for work, tourism or connecting flights. San Francisco International Airport (SFO) has seen particularly robust growth. With almost 70 percent of our region's total passenger boardings, SFO is clearly the Bay Area's busiest airport, accounting for all net regional passenger growth in the region since 2001. Despite recent investments, passenger levels at both Oakland International Airport (OAK) and San Jose International Airport (SJC) have yet to recover from recession-era airline service cuts to midsize airports.","Sonoma County Airport (STS) in Santa Rosa recorded just 195,000 boardings in 2017, 0.5 percent of the regional total. With terminal expansion underway, the airport has provided a valuable alternative for North Bay residents traveling to select West Coast cities. If regional demand for air travel continues to increase over the coming years, excess capacity in Santa Rosa, Oakland and San Jose may provide relief to SFO, the region's primary passenger hub."
"EC17B","Airport Activity","Local Focus","Bay Area airport freight levels have not fully bounced back from the Great Recession.","Most of the region's domestic air cargo activity occurs at Oakland International Airport (OAK), a regional hub for FedEx. OAK saw a 24 percent drop in air cargo tonnage during the Great Recession, and freight volumes at the airport have remained lower ever since. While tonnage has slowly grown in the last eight years, shifts in the freight industry toward more efficient ground transportation are a challenge for attracting air cargo business, including at OAK.","Other Bay Area airports experienced even steeper reductions than OAK in cargo volumes. San Francisco International Airport (SFO) saw a 40 percent decline and San Jose International Airport (SJC) saw a 50 percent drop in tonnage from 2007 to 2017. SFO and SJC were particularly impacted by shifts in demand that occurred during the Great Recession, and both airports have been slow to fully recover. As an international freight hub, SFO has also endured declining cargo volumes due to shifting trade routes, resulting in goods from Asia bypassing the Bay Area via more direct routing through Alaska."
"EC17C","Airport Activity","National Context","Over the past decade, the strong California economy has spurred substantial growth in boardings at Los Angeles and Bay Area airports.","Most major metro areas across the country have seen growth in passenger boardings in recent years, and the booming California economy has powered substantial growth at airports in Los Angeles and the Bay Area. Since 2009, passenger traffic in these two metro areas has grown by over 40 percent each. Los Angeles is now the nation's second-busiest region with around 50 million boardings per year, while in 2017, the Bay Area surpassed Dallas and Miami to become the fifth-busiest region at 40 million boardings per year.",
"EC18A","Seaport Activity","Regional Performance","Cargo activity at the Port of Oakland is at an all-time high.","The Port of Oakland, the region's primary cargo seaport, has seen a gradual increase in the number of containers processed over the past decade, leading to record-high traffic in 2018. While container volumes dipped during the Great Recession and again in 2015 due to a labor dispute, a strong global economy has resulted in slow but steady growth in traffic in recent years.",
"EC18B","Seaport Activity","National Context","The Port of Oakland is one of the nation's largest ports, although it moves significantly less cargo than either Los Angeles-Long Beach and New York-New Jersey.","The Ports of Los Angeles and Long Beach stand head and shoulders above all competitors when measured by the number of containers moving through the ports. These adjacent ports serve as the nation's primary seaport, benefiting from proximity to major domestic West Coast markets and shorter shipping routes to Asia. On the East Coast, the Port of New York and New Jersey serves as the largest seaport - benefiting from the same advantages as our peers in Southern California. As a result, a large share of goods destined for the Bay Area arrive in Los Angeles and are transported to the Bay Area by truck or by rail.","Since the turn of the 21st century, the Port of Oakland fell from the fifth busiest port in the nation to the eighth. Oakland was surpassed by Savannah, Georgia in 2006, by Hampton Roads, Virginia in 2014, and by Houston in 2017. Lower labor costs combined with proximity to fast-growing markets have resulted in rapid growth at these southern ports."
"EC4C","Unemployment","National Context","Our region's strong economy has resulted in a robust job market with the lowest rate of unemployment among the ten largest U.S. metro areas.","From 2010 to 2018, the Bay Area unemployment rate fell by nearly eight percentage points, the second biggest drop of any major U.S. metro area. The Bay Area currently has the lowest unemployment rate among the ten largest U.S. metro areas. This trend is in line with historical patterns. Over the past 25 years, our region has seen unemployment crest during recessions at levels above the national average, but during periods of economic growth similar to today, the Bay Area's unemployment rate has been among the nation's lowest.","Differences in the unemployment rate across metro regions highlight the key distinctions among local economies. In the Bay Area, low unemployment rates are attributed to the booming tech sector, while in the nation's capital, historically low unemployment rates can be linked with the traditionally stable federal employment sector. Across the country, unemployment rates continue to decline in all major metro areas."
"EC1A","Jobs by Industry","Regional Performance","The Bay Area's job growth over the past quarter-century can be attributed to job creation in the service sector.","Our region has added hundreds of thousands of jobs since 2010, following significant job losses that occurred during the Great Recession. With 3.9 million wage and salary jobs in 2017, the total number of jobs in Bay Area exceeded the previous peak set just a year earlier. Professional and business services, which includes professions like administrative services and management, legal services, scientific research, and computer systems and design, continue to be the largest industry in our region, but other service sector jobs have grown significantly since 1990. This shift towards the service sector reflects an increased demand for education, healthcare, hospitality and information services.","The finance sector has long been one of the pillars of the regional economy, especially in San Francisco. The sector's share of overall regional jobs, however, has declined since 1990. This is perhaps most visible in San Francisco's Financial District, where technology firms are becoming increasingly common in buildings formerly occupied by the financial services companies. Despite San Francisco's history as a global financial center and its prominence as a center of venture capital, the Bay Area does not have a higher share of financial services jobs than the country as a whole. Instead, the professional and business services sector continues to rise in prominence, paralleling growth in high-tech industries."
"EC1B","Jobs by Industry","Regional Distribution","Our region's recent economic expansion has been powered by growth in the technology and service sectors.","Since the end of the Great Recession in 2009, job growth has been strongest in industries related to the development and use of technology, from information to professional and business services. This has been accompanied by similarly strong growth in service sectors like education, healthcare, and leisure and hospitality, industries that directly support the growing information and professional and business services industries and cater to an increasingly affluent population.","After decades of declining employment numbers, the manufacturing sector saw modest job growth between 2010 and 2017, adding just under 50,000 new jobs. Manufacturing employment is now at its highest point since 2002. Meanwhile, the construction sector, which experienced the most severe job loss of all sectors during the Great Recession, is also on the upswing. Employment has grown by over 49 percent since 2010 as new building and infrastructure projects increase the demand for work in this sector."
"EC1C","Jobs by Industry","Local Focus","Job growth in the professional and business services sector, which is a fundamental pillar of our region's economy, is increasingly concentrated in San Francisco, San Mateo and Santa Clara counties.","Santa Clara, San Mateo and San Francisco counties have experienced some of the greatest economic benefits from job growth in the professional and business services sector. While the East Bay has also benefitted from service-sector job growth, its most dominant industries are related to manufacturing, government and logistics - sectors that have experienced relatively stagnant job growth over the same time period.","Agriculture remains an important sector in our region, particularly in Sonoma and Napa counties. These two counties account for over half of all farm jobs in the region. While agriculture has declined overall as the region has become more urbanized, these counties have seen a recent resurgence in agricultural employment."
"EC1D","Jobs by Industry","National Context","The Bay Area has the highest share of information and manufacturing jobs among major metro areas nationwide.","It is no surprise that the Bay Area, with its agglomeration of web-related information technology companies, tops the list of metro areas for the largest share of regional jobs in the information sector. New York, home to major media companies, and Los Angeles, home to the film industry, also have relatively large information sectors. The Bay Area is also tied with Chicago for the largest share of manufacturing jobs nationwide, due in part to local increases in manufacturing of specialty products such as food and beverages.","While the Bay Area has a strong concentration of information jobs, other metro areas have their own industry specialization. For example, Washington, D.C., remains highly dependent on government-related industries as reflected in its job share. The data also reflect Houston's focus on resource extraction and both Miami's and Atlanta's emphasis on logistics, even as their economies have become more diverse over time."
"EC3A","Unemployment","Regional Performance","After eight years of economic recovery following the Great Recession, unemployment in the Bay Area is at a thirty-year low.","The Great Recession led to a dramatic spike in unemployment across the country. In the Bay Area, the regional unemployment rate more than doubled, rising from 4.5 percent in 2007 to 10.5 percent in 2010. At the 2010 peak, over 388,000 workers in the Bay Area were unemployed. During the current economic boom, the unemployment rate has declined each year since 2010. The current rate of 2.6 percent is lower than levels experienced during previous economic booms in the late 1990s and mid-2000s.","Of the nine counties in the Bay Area, Solano County had the highest rate of unemployment in 2018, at 3.6 percent. For most years since 1990, Solano County has topped the list of Bay Area counties in relation to unemployment - dipping below the regional average only in 2002 and 2003. Marin and San Mateo counties, by contrast, have fared significantly better, with unemployment rates remaining consistently below the regional average since 1990."
"EC4B","Unemployment","Local Focus","The majority of Bay Area communities have seen unemployment declines of more than five percentage points since 2010.","Oakland, the third most populous city in the region, exemplifies this regional trend. The unemployment rate in Oakland was 3.3 percent in 2018, a 12 percentage point improvement from its peak of 15.4 percent during the height of the Great Recession. This shows improved conditions for the labor force, but it could also be a reflection of rising housing costs and the subsequent displacement of unemployed Oakland residents to more affordable communities.","Overall, a larger share of Bay Area cities is experiencing low unemployment. In 2018, over 75 percent of Bay Area cities had unemployment rates below 3 percent. Our region's lowest unemployment rates can be found in higher-income suburban cities, such as Mill Valley in Marin County, Millbrae and Half Moon Bay in San Mateo County, and Piedmont in Alameda County. Residents of these cities are relatively highly-educated with skills in high demand and therefore tend to experience below-average unemployment rates."
"EC4EC5A","Income","Regional Performance","Median income growth for a typical Bay Area household has been relatively stagnant over time.","Household incomes have risen and fallen in sync with the expansion and contraction of the region's economy over the past four decades. In the last decade, however, incomes have remained remarkably close to an inflation-adjusted average of $93,000 per household, as measured in 2017 dollars.",
"EC4EC5B","Income","Regional Distribution","The gap between rich and poor continues to widen.","While the trend for regional median income seems to indicate stable household incomes over time, a different story is told when examining income trends by percentile. In fact, the income gap between the rich and poor has widened, especially since 1990. From 1970 to 2017, incomes for the poorest households grew only by 12 percent, a pace similar to the regional median. During the same period, the wealthiest households saw a much larger 40 percent growth in inflation-adjusted income.","This trend is most evident in San Francisco, where households at the 60th and 80th percentile have seen incomes grow two to three times faster since 1970 than households at the 20th percentile. In 2017, household income at the 80th percentile in San Francisco exceeded $200,000, while household income at the 20th percentile remained the lowest in the region. This disparity can be attributed in part to the city's affordable housing policy, which has made it possible for some of the lowest-income residents living in subsidized residences to stay. Meanwhile, other low- and middle-income earners without subsidized housing have moved to less expensive parts of the region or beyond."
"EC4EC5C","Income","Local Focus","The region's highest-income households and workers continue to be concentrated in Silicon Valley.","Along with Marin County, Santa Clara and San Mateo counties have the highest household incomes among Bay Area counties. Median household incomes in these counties are above $100,000 - almost $30,000 greater than the region's two lowest-income counties (Solano and Sonoma counties). This holds true at the city level as well. Of the five wealthiest cities in the region, only Belvedere is located outside of Silicon Valley.","Once one of the more affluent counties in the region, Contra Costa County is one of just two Bay Area counties (along with Solano County) to see inflation-adjusted incomes fall between 1970 and 2017. Contra Costa County has seen its share of low- and moderate-income households increase as housing costs in other parts of the region have grown, leading many low- and middle-income households to relocate to the county in search of lower housing costs. After accounting for inflation, the median household income in Contra Costa County today is $5,000 less than it was almost 50 years ago."
"EC4EC5D","Income","National Context","The Bay Area has the second-highest household income levels of any major metro area in the country.","Washington, D.C. is the only major metro area in the country with a higher median household income than the Bay Area. The typical Bay Area household has an income 80 percent higher than a typical household does in Miami, for example - reflecting a significant income gap between the nation's major metro areas.",
"EC7A","Home Prices","Regional Performance","Inflation-adjusted home sale prices now exceed the previous peak, which was set in 2005 at the height of the housing bubble.","The median home price in the Bay Area has risen to $996,000 - an inflation-adjusted 70 percent increase since 2012 - as the region's robust job market and growing population have increased the demand for housing in an already constrained market. Consistently high home prices reflect the region's failure to produce the housing needed over the past half-century. A limited supply of housing and booming demand due to regional job growth continue to send home prices soaring.",
"EC7B","Home Prices","Local Focus","Communities in Solano County and eastern Contra Costa County remain the least expensive options for homebuyers in the region, while those in Silicon Valley and San Francisco remain the highest.","The most affordable housing options in the Bay Area are located in Solano and Contra Costa counties, where the median home price is 30 to 50 percent lower than the regional median. While homes in these areas are often newer and more affordable than the region as a whole, residents may face higher commute costs and longer travel times due to their distance from major job centers. Lower wages can result in homeowners in these locations spending more of their income on housing than in more expensive and affluent parts of the region.","At the other end of the spectrum, median home sales price in select cities in Silicon Valley can be double or triple the regional median. One such example is Palo Alto, where the median home sale price has tripled since 1997 to more than $3 million. The booming economy has also contributed to rising prices in San Francisco, which now has a median home price of $1.3 million."
"EC7C","Home Prices","National Context","The Bay Area remains the most expensive housing market in the United States.","With their mild climates, dynamic economies and constrained housing markets, California's two largest metro areas lead the nation in home prices. In fact, the Bay Area has led the nation, followed by Los Angeles, every single year for the past two decades. Bay Area home prices are approximately double those of New York and Washington metro areas, and triple those of the Miami, Dallas, Philadelphia, Chicago and Atlanta areas. With home prices 55 percent higher than the next most expensive metro area, the Bay Area is truly in a league of its own when it comes to the cost of buying a home.","Since 1997, home prices have increased in all major metropolitan areas across the United States. The fastest growth has been in the Bay Area, which surpassed Los Angeles in 2017. This stands in stark contrast to Chicago, Atlanta and Dallas. A slower-growing regional economy in Chicago and a relatively unconstrained housing supply in both Atlanta and Dallas may be contributing to the slower growth of housing prices in these areas."
"EC8A","Rent Payments","Regional Performance","Inflation-adjusted median rent payments have risen eighteen percent in the Bay Area since 2012.","While the Bay Area traditionally has been one of the nation's most expensive regions, rents have become increasingly high-cost within the last decade. Starting in 2012, inflation-adjusted rents have risen each year to record highs, with the average Bay Area renter household now paying $1,800 per month. One factor contributing to increasingly expensive rents in the region is the inadequate supply of rental housing compared to the demand. Demand has been particularly high in recent years as Millennials enter the rental housing market in unprecedented numbers.",
"EN2B","Ozone Concentrations","Local Focus","Ozone readings vary widely across the region, with inland areas showing the highest levels of this pollutant.","Due to prevailing winds and weather conditions, ozone from motor vehicle emissions and industrial sources in the center of the region accumulates in inland communities. Eastern Contra Costa, eastern Alameda, and southern Santa Clara counties are particularly affected by ozone. Conditions continue to be especially high in Livermore and San Martin, for example. In contrast, the region's second- and third-largest cities, San Francisco and Oakland, had the lowest concentrations of ozone. Given that the majority of the region's population lives in the urban core of the region, this means that ozone exposure is well within the federal standards for most Bay Area residents.",
