"shortcode","indicator","title","headline","summary","bonus"
"EQ2A","Housing Affordability","Regional Performance","Many Bay Area households struggle with the cost of housing, with renters often bearing the largest burden.","The share of Bay Area households excessively burdened by housing costs has increased since 1980, with home prices and rents alike growing at a faster rate than incomes. In 2017, nearly one in three Bay Area households spent at least 35 percent of its income on housing. Though housing affordability has been improving for both renters and homeowners since the Great Recession, the improvement has been more dramatic for homeowners. Since 2009, the share of excessively burdened renters decreased by just one percent, while the share of excessively burdened homeowners fell by 10 percent.","Bay Area homeowners have benefited from a number of trends in recent years. The housing bust, combined with high foreclosure rates, allowed many of today's owners to buy homes in a period of relatively low prices. Low interest rates also reduced the cost of owning for existing and new homeowners at the same time that income growth accelerated for higher-earning households. Coupled with slow-growing property tax rates, the result has been improved housing affordability for owners. Renters, many of whom have been priced out of the home-buying market by comparatively lower incomes and tighter lending standards, have seen little relief from rising rents and stagnant wages."
"EQ2B","Housing Affordability","Regional Distribution","Low- and moderate-income households are heavily burdened by the region's housing market.","The vast majority of low-income Bay Area households experience an excessive housing cost burden, regardless of where they live. Increasingly, even moderate-income households face excessive cost burdens. For example, nearly 45 percent of Bay Area households earning $50,000 to $75,000 per year spent more than 35 percent of their income on housing in 2017. Only once a household's annual income exceeds $100,000 does the region become marginally more affordable. Just six percent of these high-income households are considered excessively burdened, with more than half of the Bay Area's high-income households spend less than one-fifth of their annual income on housing.",
"EQ2C","Housing Affordability","Local Focus","While affordability has worsened throughout the Bay Area, the greatest changes have occurred in the North Bay.","27 percent of San Francisco households are considered excessively burdened, bringing the share within one percentage point of the lowest on record for the city. Unlike the rest of the region, this trend has been powered by increases in affordability for renters. In fact, San Francisco reported the lowest share of excessively-burdened renter households on record in 2017. This is due largely to higher-income households flocking to San Francisco in recent years, and excessively-burdened lower-income renters filtering out. While rent control has kept housing affordable for existing residents in San Francisco, it has managed only to slow the trend.","Solano, Sonoma and Marin counties all have seen their shares of excessively-burdened households grow faster than the regional average. Despite home prices and rents that generally are much lower than those in San Francisco and Silicon Valley, lower median incomes mean that households in these counties typically experience more acute affordability challenges. This is due in part to the rising share of renter households in these areas, a group more vulnerable to rising housing costs given fluctuating rents. Existing residents also face growing competition from residents of pricier bayside cities seeking more affordable housing options, while slow housing production has failed to meet this increased demand."
"EQ3A","Displacement Risk","Regional Performance","While relatively stable in recent years, regional displacement risk has increased substantially since 1990.","Displacement has become a serious regional concern over the past few decades. As recently as 1990, San Francisco was the only Bay Area county with more than 30 percent of its lower-income residents at risk. By 2017, every county had displacement risk levels in this range. Displacement risk is rising not only in increasingly expensive bayside communities, but also in the counties of the North Bay. Once seemingly immune to displacement risk, these counties are now being affected by spillover demand for housing.","The Great Recession coincided with a bump in displacement risk in most Bay Area counties, as low-income homeowners bore the brunt of the negative effects of the mortgage lending crisis. However, in the region's most jobs-dense counties - San Francisco, San Mateo and Santa Clara - the share of lower-income households at risk of displacement actually fell during the Great Recession, as demand for housing subsided and rising housing costs stabilized."
"EQ3B","Displacement Risk","Local Focus","Neighborhoods at risk of displacement range from urban neighborhoods like San Francisco's Mission District and West Berkeley to suburban communities like East San Mateo and Concord.","Displacement risk has become a regional issue in recent years, through a combination of rising housing prices, scarce affordable housing production, and limited tenant protections in many cities. While urban neighborhoods have long been at risk of displacement via gentrification, the problem can be just as acute in suburban communities such as Concord, El Cerrito, Santa Clara and Santa Rosa. Not surprisingly, cities known for providing affordable options to those displaced - such as Antioch and Vallejo - have relatively few neighborhoods considered at risk, even as they experience rising poverty.",
"EQ3C","Displacement Risk","National Context","Fast-growing Texas metros have the lowest displacement risk.","Houston and Dallas have the lowest and second-lowest levels of displacement risk, respectively, among major U.S. metro areas. This speaks not only to their relative affordability - which reduces pressure on lower-income households - but also to the lack of gentrification in these metro areas' traditional lower-income communities. In contrast to metropolitan areas like Philadelphia, Washington or Los Angeles, Texas metro areas have maintained a 20thÂ century-style pattern of outward development, which has resulted in many higher-income earners continuing to prefer locations at the periphery. In contrast, the metro areas with the highest risk of displacement have seen a much greater shift in homebuyer preferences, resulting in more gentrification and heightened pressure for displacement in renewed walkable urban cores.",
"EQ4A","Migration","Regional Performance","Economic recovery has markedly slowed the rate of out-migration from the Bay Area.","While the high cost of housing remains a major hurdle for the Bay Area, the strong job market has significantly reduced the net flow of residents moving to other states. In 2011, 15,800 more Bay Area residents moved to other states than moved into our region. By 2015, this trend had reversed, with around 3,000 more people moving from other states to the Bay Area than leaving for other states. In this same four-year period, relocation from the Bay Area to more affordable counties to the east remained relatively stable. Net migration between the Bay Area and these communities indicates a net outflow of 14,500 residents in 2015, resulting in lengthy commutes for those that continue to work in the Bay Area.","While data on the number of Bay Area residents that leave the region for other countries is not available, data on immigration show that roughly 86,000 people moved to the Bay Area from abroad in 2015. The majority of these new arrivals hail from Asia, though the fastest growing contingent is residents from other North American countries."
"EQ4B","Migration","Local Focus","The East Bay continues to be a more affordable option for Bay Area households seeking to remain close to major job centers.","While many people have moved outside the Bay Area in pursuit of lower-cost housing, relocation within our region is even more common. In 2015, there was a net flow of 14,800 people from the three counties closest to booming job centers - San Francisco, San Mateo and Santa Clara - to the more affordable counties of the East Bay. Even within the East Bay, residents continue to relocate from Alameda County to lower-cost Contra Costa County, or north to Solano County.","Those moving out of the Bay Area often choose the closest county beyond the borders of the nine-county region. New arrivals to San Joaquin County are disproportionately from Alameda and Contra Costa counties, whereas residents relocating to locations like Los Banos in the Central Valley and Hollister in the Central Coast region often come from Santa Clara County. Intra-state migration into the Bay Area appears to be driven by proximity to high-wage job centers, with the lion's share of former Southern Californians choosing San Francisco, Alameda and Santa Clara counties as their new homes."
"EQ4C","Migration","National Context","Economic opportunity remains a powerful driver for migration within the United States.","Before accounting for immigration, only three of the ten most populous U.S. metro areas - Atlanta, Dallas and Houston - experienced net in-migration in 2015. These low-cost, jobs-rich metro areas are attracting new residents from across the country. At the same time, the Bay Area's slight loss of residents remains a fraction of the out-migration flows from Chicago and New York. While some former New Yorkers and Chicagoans are merely relocating to warmer climates - such as the tens of thousands who annually relocate from New York to Florida - others are looking for better job opportunities and lower-cost housing.","Immigration from other countries remains critical to the ongoing vitality of metropolitan areas across the United States. While New York and Los Angeles unsurprisingly attract the largest number of immigrants each year (given their substantial existing immigrant populations), the Bay Area and Miami rank third and fourth, respectively, for immigration. Economic opportunity, geographic proximity and the existence of established immigrant communities are critical drivers for immigration as well; over half of all Bay Area immigrants come from Asia and over two-thirds of all Miami immigrants relocate from countries in Latin America."
"LU3D","Housing Permits","National Context","Even with a strong economy and steady population growth, the Bay Area continues to issue permits for housing at a slower rate than Sunbelt metros.","While the Bay Area issued more permits per capita than its peers in large metros in the Northeast, the region continued to fall short of permitting rates seen in Sunbelt metros like Dallas and Atlanta. Metro areas across the southern United States issued two to three times as many permits per capita as the Bay Area in 2017, the majority of which are permits for single-family homes. In contrast, the Bay Area ranked second in terms of the share of permits issued for multi-family housing, falling just short of the New York metro area.",
"EQ5A","Poverty","Regional Performance","Our region's poverty rate is at a historic low.","The Great Recession brought poverty levels to new highs, peaking at 27 percent in 2012. Since then, the Bay Area's poverty rate has fallen year after year. In 2017, the poverty rate fell below 20 percent for the first time on record. While this is promising news, 1.5 million Bay Area residents still live in poverty, highlighting the continued importance of affordable housing and job training opportunities for all Bay Area residents.","Poverty rates have fallen in all Bay Area counties except Contra Costa and Marin. The reduction in poverty rates has been especially pronounced in San Francisco and Alameda counties, falling 5 percent since 1980 in Alameda County and 12 percent in San Francisco over the same time period. An influx of high-earning households moving to centrally-located cities like San Francisco and Oakland, coupled with rising housing costs that have prompted many low-income households to relocate to lower-cost communities, have largely powered this trend."
"EQ5B","Poverty","Local Focus","Poverty in the Bay Area increasingly is concentrated in inland cities, though pockets of poverty remain in bayside neighborhoods.","The suburbanization of poverty is readily apparent in communities like Antioch, Oakley, Rohnert Park and San Leandro, each of which has seen more than a 10 percentage point increase in its poverty rate since 2000. In contrast, 2017 poverty rates in San Francisco and San Jose were well below the levels seen in 2000. This trend is driven in part by the relative affordability of housing in these suburban cities, especially as housing costs have risen dramatically in gentrifying urban neighborhoods. Bay Area workers in poverty living in inland suburbs often face restricted economic opportunities due to excessive commute lengths and limited transportation options.","While the Bay Area has experienced increased poverty in inland cities, select neighborhoods close to the Bay also continue to experience high poverty rates. In San Mateo County, some neighborhoods in East Palo Alto and Redwood City have poverty rates over 50 percent, more than triple the county rate. Similarly, the East Bay cities of Oakland, Richmond and San Pablo all have neighborhoods in which the majority of residents are in poverty."
"EQ5C","Poverty","National Context","Southern metros have the greatest challenges with regional poverty.","At just under 20 percent, the Bay Area ranks second-to-last among the top 10 most populous U.S. metro areas for its share of residents in households with incomes below 200 percent of the federal poverty limit. Despite this relatively strong performance, our region's high cost of living presents significant challenges for low-income residents. Yet at the same time, other regions have much greater poverty challenges. Poverty rates are highest in the South, with Miami, Houston, Atlanta and Dallas comprising four of the five metros with the highest poverty rates. While the cost of living is substantially lower in Southern metro areas, evidently incomes have not kept pace for many households.",
"EQ6A","Life Expectancy","Regional Performance","Life expectancy in the region has increased, indicating the Bay Area's population is getting healthier.","Life expectancy in the Bay Area was over 82 years as of 2013, a six year improvement compared to 1990. Regional life expectancy increased almost every year on record since 1990. The most recent year to see a drop was 2005, around the time of a particularly severe flu season. Prior to that, life expectancy dipped in 1993 around the height the AIDS epidemic. Significant healthcare improvements for people living with HIV in the late 1990s had a substantial impact on health outcomes, particularly in San Francisco County where life expectancy jumped nearly six years between 1990 and 2000.","While San Francisco County saw exceptional improvement in life expectancy after 1990, the other eight Bay Area counties also saw life expectancy increases. There are, however, widening disparities between counties as life expectancy is increasing more slowly in Solano compared to the rest of the region in recent years. In 2000, the gap in life expectancy between Solano County and the regional average was 1.5 years. By 2013, that number had grown to 3.8 years."
"EQ6B","Life Expectancy","Local Focus","Life expectancies across different Bay Area ZIP Codes varied by as much as 13 years.","Life expectancy within different Bay Area ZIP Codes ranged from a low of 73 years to a high of 86 years. Life expectancy in ZIP Codes representing neighborhoods in the Berkeley Hills in the East Bay and around Los Altos Hills in the South Bay have some of the best health outcomes in the region. Meanwhile, ZIP Codes in Santa Rosa in Sonoma County, urban neighborhoods areas in Solano County, and Bayside neighborhoods in the East Bay have relatively lower life expectancies.","The lowest life expectancies in the region were in the Downtown and Tenderloin areas of San Francisco. Life expectancies in neighboring Eureka Valley were 10 years higher. Similarly, life expectancy in East Oakland is 75 years compared to 85 years in the Oakland Hills. San Francisco and Oakland exemplify some of the significant health inequities that exist in the Bay Area."
"LU1A","Population","Regional Performance","The South Bay has risen to prominence as the region's largest population center.","The most significant change by far to our region’s population pattern over the past 50 years has been the rise of the South Bay. Santa Clara County is now home to 25 percent of Bay Area residents, compared to 18 percent in 1960. In this same period, the City of San Jose saw its population skyrocket from 200,000 people to more than 1 million, a surge that allowed this unofficial capital of Silicon Valley to claim the title of the region’s most populous city from San Francisco. Meanwhile, in the North Bay, Marin County was eclipsed by both Solano County and Sonoma County in the late 1970s.","The City and County of San Francisco was the second most populous Bay Area county in 1960, home to 20 percent of the region’s residents. In the following decades, San Francisco was surpassed in population by Santa Clara and Contra Costa counties during a period of urban disinvestment and widespread suburban development. Since the turn of the 21st century, the declining share of the population living in San Francisco has stabilized at 11 percent, as population and employment growth have returned to historical urban strongholds."
"LU4A","Housing Production","Regional Performance","While housing construction is up from the depths of the Great Recession, the 2018 production rate is still well below that of past decades.","Demand for housing in the Bay Area has continued to grow due to high rates of job creation and ensuing population growth. Historically, the region has not produced the housing needed over the past half-century to keep up with demand, resulting in higher housing costs due to the constrained supply. In 2018, the Bay Area added just 15,400 housing units, a fraction of the peaks seen in the 1990s.","Multi-family home construction has driven growth since 2010, with 135,000 new multi-family units built between 2010 and 2018 – 73 percent of the total produced. In 2018, there was a roughly 50-50 split between single-family and multi-family production. This is due in large part to substantially lower multi-family housing production rates in San Francisco and Santa Clara counties, which produced 2,000 and 3,700 fewer multi-family units, respectively, in 2018 than in 2017."
"LU1B","Population","Regional Distribution","Over the past decade, the distribution of Bay Area residents between center cities and suburban communities has stabilized.","The Bay Area of 1960 is starkly different than the Bay Area of 2018, especially in terms of where people live. Up until 1960, growth was somewhat concentrated in the ring of cities close to San Francisco Bay. Since 1960, the share of residents living in inland, delta and coastal cities farther from the Bay increased from 12 percent in 1970 to 25 percent in 2018. Much of this growth occurred in Contra Costa, Alameda, Sonoma and Solano counties, where there was ample land to develop new neighborhoods and opportunities to annex adjacent unincorporated areas. Since 2007, the proportion of residents in inland areas has remained constant, reflecting an overall slowdown in the rate of population growth for these areas compared to historical norms, combined with accelerated population growth in select Bayside and all “Big Three” cities.","Vital Signs categorizes these geographical jurisdictions based on their proximity to the Bay, with the three largest cities – San Jose, San Francisco and Oakland – grouped separately as the “Big Three.” Cities that ring the Bay are referred to as “Bayside” cities, while the cities beyond this core are classified descriptively as “Inland, Delta and Coastal.” The remainder of Bay Area lands – by far the largest segment in terms of acreage – is classified as “Unincorporated.”"
"LU1C","Population","Local Focus","Some Priority Development Areas are already rapidly developing, while others have seen limited growth in recent decades.","Examining neighborhoods now identified as Priority Development Areas (PDAs), locally designated areas with frequent transit service, reveals historical population trends and allows us to track where growth is occurring. Transit-Oriented Development, or “TOD”, Corridors, especially those in Santa Clara County and Oakland, have seen the largest growth in overall population in the past decade. Other PDAs have seen robust relative population growth, especially in communities such as San Francisco’s Treasure Island & Yerba Buena Island, Mountain View’s North Bayshore, and Newark’s Dumbarton TOD, which started with smaller populations. Other PDAs have seen more limited growth – including locations like Central Rohnert Park and Berryessa in San Jose – but will likely see future growth in decades to come due to regional transit connections like SMART and BART.",
"LU1D","Population","National Context","While recent population growth may seem rapid to residents, our region’s rate of growth nonetheless remains significantly slower than other booming metro areas.","The Bay Area has been the nation’s fourth-largest metropolitan area by population since the early 1980s, though Sunbelt metros like Houston, Dallas, Atlanta and Miami have added population at faster rates. Since 2010, population growth in Houston and Dallas has occurred at twice the rate of the Bay Area – even as our region’s robust economy has produced jobs at a faster clip. With only 200,000 fewer residents than the Bay Area in 2018, Dallas may surpass the Bay Area in population within the next decade.",
"LU2A","Jobs","Regional Performance","Employment is at an all-time record high.","The Bay Area economy has experienced and survived two bubbles in the 21st century – the “dot-com” technology bubble of the early 2000s and the more recent, real estate-based financial crisis of 2008. Since the end of the Great Recession, the region’s job market has recovered and continued to grow. Jobs have grown by at least 3 percent each year since 2012, reaching a new peak of over 4 million jobs in 2018. Only time will tell whether these trends are fleeting or the new normal.","Between 2000 and 2010, the number of jobs in San Francisco decreased by 65,000. In recent years, the city has more than recovered, adding 184,000 jobs between 2010 and 2018 – nearly three times the number lost in the first decade of the 21st century. Santa Clara County is also experiencing an unprecedented boom, adding over 250,000 jobs in this decade after losing 180,000 jobs between 2000 and 2010. Together, these two counties account for nearly half the region’s employment – and more than 60 percent of regional job growth since 2010. In contrast, recent job growth in the North Bay counties of Solano and Marin – as well as Contra Costa County – has been significantly less robust."
"LU2B","Jobs","Local Focus","Jobs are clustered around San Francisco Bay, particularly in Silicon Valley and San Francisco.","The location of employment clusters can have a strong effect on transportation patterns and housing costs. When divided into 20 sub-counties, the largest job centers continue to be San Francisco, North Santa Clara County and San Jose.  Together, these sub-counties totaled more than 1.6 million jobs in 2018 – nearly half of all regional employment. Along with Central and South San Mateo County, these sub-county areas have seen the most robust job growth rates since 2010. However, booming job markets in these sub-county areas also have contributed to a growing regional housing and jobs imbalance.","While established East Bay communities have seen some job growth in recent years, it has not been to the same level as their San Francisco and Silicon Valley counterparts. East Alameda County, which experienced significant job losses during the Great Recession, has seen the most growth among East Bay sub-county areas, totaling a 26 percent increase since 2010. On the other side of the hills, North Alameda County – the region’s fourth-largest job center that includes downtown Oakland and downtown Berkeley – has seen a 6 percent increase. The diverse geography of job growth across the Bay Area continues to transform the region’s housing and transportation patterns, with East Bay residents increasingly commuting to faster-growing job centers in Silicon Valley and San Francisco."
"LU2C","Jobs","National Context","Since 2010, Bay Area employment has grown faster than any other major metro area.","Over the past 25 years, Dallas and Houston have seen the fastest job growth among the 10 major U.S. metro areas, while the Bay Area has remained in the middle. With expanding manufacturing sectors, rapidly increasing population and housing production rates that can match pace with growing demand, it is no surprise that these Texas metros lead the nation. However, when looking at job growth since 2010, the Bay Area leads the nation, due in large part  to renewed growth in tech sector employment.",
