"shortcode","indicator","title","headline","summary","bonus"
"EC8B","Rent Payments","Local Focus","Counties that once were affordable have become less so over time, including highly-populated Alameda County.","While high-rent cities have remained expensive, some places previously considered affordable have grown significantly more expensive over time. With rents historically below the regional median, cities in Alameda County have had more affordable rental housing options compared to those in Marin, San Mateo and Santa Clara counties, where median rents have been significantly higher since 1970. In the past three years, rent payments in Alameda County have grown by 16 percent, with the fastest growth seen in Union City and Emeryville. This pace is similar to the rapid rent increases seen in Silicon Valley and even faster than rent increases in San Francisco, in part due to that city's rent control policies.","In the North Bay, Sonoma and Solano counties are relatively affordable options for Bay Area renters, at about two-thirds of Silicon Valley median rent payments. Since the Great Recession, median rent payments in Solano County - traditionally the most affordable place for Bay Area renters - have remained stable, as have median rent payments in Sonoma County. Conversely, median rent payments continued to rise in Napa County, including a 45% increase between 2000 and 2017, the highest in the Bay Area over that time period."
"EC8C","Rent Payments","National Context","The Bay Area remains the nation's most expensive major metro area for renters.","The Bay Area has had the highest median rent payments of any major metro area in the United States since data first became available in the 1970s. Moreover, the gap is widening, with median rent payments growing faster in the Bay Area than in any other major metro area over the last half century. High demand for rental housing, limited supply of rental properties and gentrification of historically low-income communities have all contributed to higher rents throughout the region, particularly in the urban core.",
"EC9A","List Rents","Regional Performance","During economic booms, list rents experience rapid growth - only to fall back to median rent payments during subsequent recessions.","For Bay Area renters, increasing housing costs - as evidenced by the continued growth in the region's median rent payment - is a major concern. This rise is even more severe for new renters moving into or within the region. Median list rents, the advertised rental prices for available housing units, have increased four times faster than rent payments since the end of the Great Recession. Compared to rent payments, list rents have been higher and more volatile in the Bay Area because they are more responsive to the region's economic booms and busts and limited supply of new housing. Since the end of the recession, list rents have risen steadily to a median price of over $2,340 and are now on par with inflation-adjusted list rents last seen during the dot-com boom.",
"EC9B","List Rents","Local Focus","During economic booms, list rents increased fastest for housing near the region's major job centers.","The current period of economic growth has resulted in increases in list rents across the Bay Area. Once again, new renters in Silicon Valley and San Francisco have faced rapid price increases. This time, however, Bayside cities in the East Bay such as Oakland, Berkeley and Emeryville have also seen rapid rises in list rents. Oakland has experienced the fastest increase in list rents of all Bay Area cities due to the degree to which job growth shifted towards San Francisco and the preference of the growing workforce for living at the heart of the urban center.","List rents have increased fastest in cities near growing job centers as new workers moving into these cities flood the rental market. During the dot-com boom, list rents in San Francisco, along the Peninsula and in Silicon Valley jumped over 40 percent between 1999 and 2001 in response to rising employment and income before dropping during the subsequent bust. During the same period, list rents in the North Bay and inland portions of the East Bay fluctuated less than 15 percent and have overall been less volatile. List rents in major North Bay cities like Vallejo and Santa Rosa have remained relatively steady during multiple economic cycles."
"EC9C","List Rents","National Context","While list rents were on par with New York and Los Angeles just a few years ago, the Bay Area is now in a league of its own.","Similar to rent payments, median list rents are higher in the Bay Area than any other major metro area in the United States. This makes the Bay Area the most expensive metro for renters to move to. With rapid job growth that has outpaced the number of vacant units on the rental market since 2010, it is not surprising that rents in the Bay Area have increased faster than any other metro area in recent years. The New York metro area, the second most expensive rental market, has also seen significant - albeit smaller - increases in advertised rental prices.",
"EN10A","Bay Restoration","Regional Performance","Rehabilitation of coastal areas has accelerated at unprecedented rates over the past decade.","Since 1969, the surface area of San Francisco Bay has grown by nearly 19,000 acres - a result of policies discouraging bay fill combined with rehabilitation projects that have restored wetlands all across the region. Remarkably, after a century characterized by bay fill, the 21st century has been quite beneficial for the Bay and its surrounding ecosystem with nearly 90 percent of those acres being restored since 2000. In particular, restoration projects in Sonoma County, Marin County and Solano County have played a key role in improving the Bay ecosystem during this time period. In an era of rising tides, these wetland buffers may prove critical in helping the region adapt to global climate change.",
"EN11A","Vulnerability to Sea Level Rise","Regional Performance","Bay Area development patterns are neither increasing nor decreasing the share of regional population at risk from sea level rise.","Depending on the magnitude of sea level rise over the coming decades, between three and six percent of Bay Area residents may be vulnerable to rising tides. While this is just a small share of the region's population, the impacts to these communities may be dramatic, with broader consequences felt beyond these communities' borders from impacts to infrastructure and other regional assets. If sea level rises just 12 inches above today's levels - 194,000 residents will be regularly inundated. Looking at historical growth patterns since 1990, the share of the region's population living in inundated zones has remained relatively steady. This indicates that new housing developments are occurring at the same rate in areas at risk from sea level rise as in the region overall.",
"LU3B","Housing Permits","Regional Distribution","In 2017, fewer than one in five units for which permits were issued could be classified as affordable housing – that is, housing affordable to very low- and low-income households.","14 percent of units for which permits were issued in 2017 will be affordable to very low- or low-income households, well below the 40 percent share of very-low and low-income households currently living in the region. San Francisco and Alameda counties lead the region in affordable housing permits, with each county issuing permits for over 1,000 affordable units in 2017.",
"EN11B","Vulnerability to Sea Level Rise","Local Focus","While no Bay Area county is immune from the threat of rising tides, residential development in Marin, Solano and San Mateo counties are perhaps most vulnerable to inundation.","The unique geographical features of each Bay Area county - combined with the location of existing residential developments - have a strong influence on the number of residents who may be vulnerable to future sea level rise. Residents in Marin County, with much of its population clustered in low-lying areas bordering the Bay shoreline, are the most at risk. Approximately 28 percent of Marin's population is expected to be exposed to inundation by a four-foot rise in tides. Even when sea level rise reaches just 12 inches - a likely forecast for 2050 - almost one in five Marin residents would still be affected. The situation is only slightly better in neighboring Solano County and further south in San Mateo County, with similarly low-lying communities by the Bay such as Vallejo, Redwood City and East Palo Alto.","While existing neighborhoods in San Francisco would not be significantly affected by sea level rise below 2 feet, waterfront communities will be impacted by sea level rise of three feet or more. Approximately 16,500 residents in growing neighborhoods such as Bayview-Hunters Point, Mission Bay and Treasure Island would be affected by a four-foot sea level rise scenario - approximately two percent of the county's current population."
"EN11C","Vulnerability to Sea Level Rise","National Context","Coastal communities across the country that include the Bay Area's San Rafael, New York's Newark and Houston's Galveston are all vulnerable to sea level rise.","With one-foot local sea level rise, the Bay Area has the largest share of population at risk to inundation exposure. However, sea level rise is experienced at different rates across the country. Although the Bay Area is known to experience sea level rise at a higher rate than the global average, local sea levels along the eastern seaboard and the Gulf of Mexico are predicted to rise approximately twice as fast as on the West Coast. At higher sea level rise forecasts, the East Coast metros of Miami, New York and Philadelphia become increasingly vulnerable. Over one million residents in Miami - nearly one-fifth of the population - live in seaside neighborhoods like Fort Lauderdale and Miami Beach will be at risk for inundation if sea level rises by 4 feet.","Sea level rise focuses on regular inundation, but each metro also has unique flooding risks. In addition to vulnerability to high sea level rise, Miami is at a great risk of flooding due to groundwater emergence. For the Bay Area, as the sea level rises, the risk of flooding increases for creeks and rivers that flow into the Bay."
"EN1A","Particulate Concentrations","Regional Performance","Particulate matter concentrations declined in 2016 - benefiting from both long-term reductions in emissions and short-term wet weather conditions.","Over the past 15 years, regional 3-year annual average particulate matter concentrations have fallen from 12.3 micrograms (mg) per cubic meter to just 7.8 micrograms per cubic meter - a remarkable improvement in a relatively short time. Peak particulate matter levels also declined significantly over this time period, as indicated by the peak 24-hour average trend. The most recent downward tick in particulate matter levels has been attributable to emission reduction programs as well as favorable weather conditions. An extended period of light winds and no rain contributed to higher levels of particulate matter accumulating in the Bay Area air basin in 2015; the return of wet and windy winter weather conditions in 2016 provided a natural scrubbing that ""washed"" particulate matter from the air.","The Bay Area has made progress in reducing particulate emissions and has reported concentrations below national air quality standards in recent years. However, there is no known safe threshold for exposure to particulate matter. On days when fine particulate matter concentrations spike due to worst-case conditions, Bay Area residents face significant health risks."
"EN1B","Particulate Concentrations","Local Focus","Local particulate matter concentrations are influenced by variations in emissions and local weather conditions.","Although local concentrations in the Bay Area may be higher in close proximity to major emissions sources, particulate levels are relatively similar for different subregions throughout urbanized portions of the Bay Area. Outliers include the areas around West Oakland, San Pablo and Vallejo, where heavy traffic volumes result in above-average particulate matter levels. Areas around Napa also experiences higher particulate matter levels, a result of its high levels of residential wood-burning activity. In contrast, the northern and southern portions of the region near Gilroy and Sebastopol have consistently seen some of the lowest PM2.5Â levels in the urbanized Bay Area.","Over the long term, the Point Reyes monitoring station in Marin County has consistently seen the lowest concentrations of fine particulate matter of any monitoring site in the region. This result is a reflection of the minimal influence of human activity on local air quality at that location due to the relatively pristine conditions within Golden Gate National Recreation Area - generally upwind of population centers and most emission sources."
"EN1C","Particulate Concentrations","National Context","Among major U.S. metro areas, Miami has the cleanest air as a result of low levels of particulates.","Of the ten largest U.S. metro areas, Miami continues to have the lowest particulate levels. Miami's strong performance in terms of regional air quality is a result of multiple favorable factors. Only lightly industrialized, Miami features a flat topography and favorable wind conditions, which mean that emitted particulates tend to be blown away from populated areas. This stands in stark contrast to Los Angeles. There, unfavorable topographical and meteorological conditions result in the highest particulate matter concentrations among the nation's largest metro areas. Meanwhile, the Bay Area falls in the middle of the pack among major metro areas, though with significantly lower particulate matter levels than Southern California.",
"EN2A","Ozone Concentrations","Regional Performance","Even with significant population and economic growth, Bay Area ozone concentrations have declined over the past half-century.","Peak Bay Area ozone concentration levels are well below those first recorded when air quality monitoring began more than 50 years ago. Thanks in part to cleaner cars and trucks, ozone concentrations today are at least one-third lower than 1970s levels. These improved conditions have come about despite growth in population, vehicles and miles traveled in the Bay Area. Since the early 2000s, Bay Area ozone concentrations have consistently been one-third lower than in the 1970s. At the same time, however, ozone concentrations can vary from year to year depending on weather conditions. In the last two years, the weather was unfavorable and as a result concentrations in the region's worst affected locations ticked upward. Based on these recent data, the Bay Area exceeds the new, more stringent federal standards for ozone.",
"EN3A","Greenhouse Gas Emissions","Regional Performance","On a per-capita basis, greenhouse gas emissions from primary sources have declined by six percentage points since 2010.","While the Bay Area economy has surged in recent years, greenhouse gas emissions have not. Remarkably, since 2010, per-capita greenhouse gas emissions have declined by six percentage points. This trend is primarily attributable to decreased consumption of electricity and natural gas and expanded availability of renewable power sources like solar and wind. At the same time, per-capita consumption of gasoline and diesel fuels by Bay Area drivers has declined in the last few years as well - albeit at a slower rate than the electricity and natural gas sectors. These positive trends have occurred even as economic output has surged by 22 percent and jobs have grown by 18 percent over this five-year period. Still, to achieve our region's increasingly ambitious greenhouse gas reduction targets, more progress will be necessary in the coming years.",
"EN3B","Greenhouse Gas Emissions","Local Focus","Due to a combination of robust public transit services and cleaner industries, San Francisco has the lowest per-capita greenhouse gas emissions of any Bay Area county.","In 2015, combustion of fuels in cars and trucks - combined with consumption of natural gas and electricity - resulted in nearly 50 million metric tons of greenhouse gas emissions - but not every county contributes equally to this regional total. Most notably, per-capita greenhouse gas emissions from primary sources in San Francisco are only 61 percent of regional average. The city's ""green"" status is likely attributable to relatively clean industries, a knowledge-based economy, a robust public transit system, limited parking and a dense land use pattern. Alameda County ranks second-lowest for per-capita emissions, with similarly ""green"" characteristics in more established communities like Berkeley and Oakland.","Contra Costa and Solano counties are notable outliers in terms of their above-average per-capita greenhouse gas emissions. In large part, this is due to the presence of oil refineries and other heavy industries in both counties, which consume large quantities of natural gas for their industrial processes. With regards to the transportation sector by itself, Solano and Napa counties top the list in terms of per-capita greenhouse gas emissions, most likely due to longer trip distances and limited public transit options."
"EN4A","Fatalities from Crashes","Regional Performance","Fatalities from crashes has ticked upwards since 2010, reversing much of the decline seen during the Great Recession.","Annual fatalities from crashes have grown since 2010 - likely a result of increased road activity as our region's economy has boomed. The past six years mark the first period of sustained growth in road fatalities since the late 1970s, when there were similar conditions during a period of economic growth. Despite the recent adverse trend in fatalities, Bay Area roads are still significantly safer than they in the 1970s and 1980s. This reflects the benefits of improved vehicle safety technologies such as airbags. The long-term decline in fatalities has occurred even as the region's population and mileage traveled has grown.","Although roads have become increasingly safe for motorists, over one-third of all 2016 traffic fatalities in the Bay Area were vulnerable road users - bicyclists and pedestrians. While improved vehicle safety technologies have managed to reduce fatalities among vehicle occupants, non-motorized travelers since 2011 have experienced higher fatality levels than in decades past."
"EN4B","Fatalities from Crashes","Local Focus","San Francisco stands out as an outlier - with one of the lowest fatality rates per capita but one of the highest fatality rates per mile driven.","While Solano, Napa and Sonoma counties unfortunately have had the region's highest fatality rates on both a per-capita and per-mile basis, fatality rate statistics in San Francisco County are more complicated. On a per-capita basis, San Francisco had the lowest fatality rate of any county in the region in 2016. This reflects the shorter travel distances and slower speeds in the city compared with much of the region. At the same time, per mile driven, San Francisco ranked near the top of the 2016 list for having the most dangerous roads in the region - reflecting San Francisco's distinctive modal split. Motorists account for the majority of fatalities regionwide, whereas in San Francisco pedestrians and bicyclists account for the majority of fatalities.",
"EN4C","Fatalities from Crashes","National Context","In contrast to the Bay Area's relatively safe roads, Sunbelt metro areas top the list for highest fatality rates.","Atlanta, Miami, Houston and Dallas top the list of major U.S. metro areas with the highest fatality rates per resident. These metro areas have double the fatality rate of the safest major metro area - New York. The stark difference between the Sunbelt metros and the nation's most transit-oriented metro is reflective of the former group's higher travel speeds, greater miles traveled, and higher auto mode share. The Bay Area, Washington, Chicago and Los Angeles rank favorably just behind New York for the safest roads among major metro areas, each with just under six traffic fatalities per 100,000 residents in 2015.",
"EN7A","Injuries from Crashes","Regional Performance","More people were injured on Bay Area roadways in 2016 than in any year since 2001.","In 2016, nearly six people were seriously injured in a crash every single day in the Bay Area - an indication that more work remains to be done to make sure motorists, pedestrians and bicyclists can all get to their destinations safely. Over the past decade, although motorists continue to account for the majority of serious traffic injuries, the annual number of non-motorized injuries increased 28 percent. The top 3 primary collision factors for crashes that resulted in injuries are unsafe speed, improper turning, and driving under the influence.",
"EN7B","Injuries from Crashes","Local Focus","The rate of injuries resulting from collisions varies greatly by county.","Nearly 40 percent of the region's serious injuries occur in Alameda and Santa Clara counties, which is perhaps not surprising given these counties' large populations and high vehicle-mileage traveled. However, in urban San Francisco - where bicyclists and pedestrians accounted for over half of the serious injuries - the per-VMT injury rate was highest in the region. The North Bay counties of Napa and Sonoma also have above-average injuries per-VMT due to more miles of rural roads, which have higher crash rates.",
"LU3C","Housing Permits","Local Focus","Oakland doubled the number of units for which it issued permits from 2016 to 2017, the largest increase of any Bay Area city.","Oakland historically has lagged behind its “Big Three” peers, San Francisco and San Jose, when it comes to permitting rates, issuing 20 to 25 percent as many permits as San Jose or San Francisco between 2010 and 2016. In 2017, Oakland issued permits for over 4,200 units, double the number of units that were permitted in the previous year. Meanwhile, San Francisco continued to lead the region in permitting rates, issuing permits for over 4,500 units in 2017.",
"EQ1A","Jobs by Wage Level","Regional Performance","The Bay Area's workforce has become more skewed towards high- and low-wage jobs over the years.","In 2017, jobs in middle-wage occupations represented one-fifth of our region's employment, having declined in both relative and absolute terms since 2001. Diminishing middle-wage employment has meant increased job polarization, leaving low-wage workers fewer options for upward mobility. Many of the middle-wage jobs lost have been in occupations specific to manufacturing. Meanwhile, the number of middle-wage jobs in the healthcare sector, such as laboratory technicians and dental assistants, has seen sustained growth. Middle-wage employment in the construction sector has also recovered from its Great Recession downturn.","While high-wage jobs represent the majority of all jobs in the Bay Area, both the absolute number and share of workers employed in low-wage jobs has been on the rise in recent years. From 2016 to 2017, the region added roughly 90,000 low-wage jobs and 9,000 middle-wage jobs, while the number of high-wage jobs decreased by around 12,000. The growth in low-wage jobs has been predominantly in the retail and food service sectors."
"EQ1B","Jobs by Wage Level","Local Focus","High-wage jobs are increasingly concentrated in Silicon Valley and San Francisco.","The change in jobs across wage levels has not been evenly spread across the Bay Area. A disproportionate share of high-wage jobs were created in Silicon Valley and San Francisco, the epicenters of recent economic growth. To a lesser extent, this trend also has been seen in the East Bay, where the gap between the share of low-wage and high-wage jobs has narrowed since 2001. While each of these subregions has seen gains in high-wage technology jobs, job growth in the East Bay has been more pronounced in education and health service occupations.","Low-wage occupations, such as janitors or retail salespeople, are not as prone to geographic clustering as middle- and high-wage work. As a result, the distribution of low-wage jobs largely has been proportionate to total employment. Yet contrary to the regional trend, the North Bay has seen its share of low-wage jobs grow, powered by growth in occupations like personal care aides and food service workers."
"EQ1C","Jobs by Wage Level","National Context","Washington, New York and the Bay Area have the most uneven distribution of jobs by wage level.","In 2017, middle-wage jobs represented roughly one-fifth of all jobs in Washington, New York and the Bay Area, making their shares of middle-wage jobs smallest among the large metro areas. An increasingly high median wage for the Bay Area has resulted in traditionally middle-wage occupations like medical assistants and office clerks being classified as low-wage. As a result, the Bay Area's share of low-wage workers is nearly 40 percent, the highest of any of its peer metro areas.","While all peer metro areas have larger shares of low- and high-wage jobs than middle-wage jobs, Miami, Atlanta, Dallas and Houston have more even distributions of jobs by wage level. Miami and Atlanta's large service sector workforce means its median wage is relatively low, and therefore many consumer service occupations are classified as middle-wage. In Texas metros, the oil and gas industry has created jobs in related middle-wage occupations, such as technicians and transportation operators."
