"licenseno","businessname","description","licensedate","issueddate","expireddate","status","priority","stno","predir","stname","suffix","postdir","city","state","zip","latitude","longitude","loc","geolocation"
"269500","SAINTS CONSTANTINE & HELEN","FESTIVAL - September 9th to September 11th","2022-08-16T08:08:01.000","2022-09-09T04:09:04.000","2022-09-11T12:09:00.000","Active",,"721",,"NORWOOD","RD",,"SILVER SPRING","MD","20905","39.120559","-77.022403",,"POINT (-77.022403 39.120559)"
"269509","JSS SPIRITUAL MISSION","EVENT FOR AUGUST 28, 2022 @ 9:30am","2022-08-17T03:08:21.000","2022-09-06T08:09:45.000","2022-08-28T12:08:00.000","Active","ANNUAL","7710",,"HAWKINS CREAMERY","RD",,"GAITHERSBURG","MD","20882","39.244441","-77.1586",,"POINT (-77.1586 39.244441)"
"269203","ST. GEORGE GREEK","BENEFIT PERFORMANCE LICENSE&nbsp; EVENT DATE IS 05/21/22 FRO 4:00PM TO 1:00AM CUSTOMER SAID THATSHE SENT THE APLICATION TO THE ADDRESS IN ROCKVILLE . MIL LOG&nbsp; 453954&nbsp; 05/11/2022","2022-05-17T04:05:56.000","2022-06-13T12:06:35.000","2022-05-22T12:05:00.000","Active",,"7701",,"BRADLEY","BLVD",,"BETHESDA","MD","20817","39.013569","-77.157217",,"POINT (-77.157217 39.013569)"
"269107",,"Special Event permit# 387656&nbsp; ROMANINAN FOOD FESTIVAL:&nbsp;May 20 to May 22&nbsp; ( NOTE: 501 (C) (3) SUBMITTED, &nbsp;FOOD WILL BE SERVED - RECEIPT SUBMITTED ; ALCOHOL WILL BE SERVED) ;&nbsp;&nbsp;&nbsp;&nbsp;TENTS TOTAL : 3- ( 10'.0 X 20'.0 ) ; 1- 40'.0 X 60'.0 (U&amp;O 387459)","2022-05-02T09:05:30.000","2022-05-27T10:05:36.000","2022-05-22T12:05:00.000","Active",,"9111",,"RIVER","RD",,"POTOMAC","MD","20854","39.005155","-77.186128",,"POINT (-77.186128 39.005155)"
"268870","SANDY SPRING MUSUEM","40TH ANNUAL STRAWBERRY FESTIVAL: SATURDAY : JUNE 11 2022 :10:&nbsp; AM - 5:00 PM ; SUNDAY : JUNE 12TH : 11:00 AM - 4:00 PM : NOTE FOOD &amp; ALCOHOL BEVERAGES WILL BE SERVED - EVIDENCE NOT SUBMITTED.","2022-03-22T01:03:17.000","2022-05-05T08:05:06.000","2022-06-12T12:06:00.000","Active",,"17901",,"BENTLEY","RD",,"SANDY SPRING","MD","20860","39.149705","-77.021459",,"POINT (-77.021459 39.149705)"
"268179","ST. FRANCIS OF ASSISI CATHOLIC CHURCH","HOLIDAY BAZAAR : 1- DAY EVENT : NOVEMBER13TH 2021 ( 9:00 AM - 2:00 PM ) - 501 (C)(3) SUBMITTED ; NO FOOD , ALCOHOL, NO TENTS ;11-05-2021 -&nbsp; PROCESSED, MAILED TO: ST FRANCIS OF ASSISI&nbsp; CATHOLIC CHURCH.","2021-10-28T09:10:37.000","2021-11-05T10:11:06.000","2021-11-13T12:11:00.000","Active",,"6701",,"MUNCASTER_MILL","RD",,"DERWOOD","MD",,"0","0",,"POINT (0 0)"
"268071","CALLEVA INC","Markoff's Haunted Forrest open 13 nights in October. : ACTIVITY&nbsp; STARTING OCTOBER 1ST @7:00 PM&nbsp; : DATES OF ACTIVITY : OCTOBER 1; 2;3; 15;16'17;22;23;24;29;30;31 ; ONSITE&nbsp;FOOD PREPARATION ( EVIDENCE OF TEMP. FOOD LICENSE SUBMITTED, NO ALCOHOL ; NO TENTS / STAGES ;&nbsp; SPECIAL EVENT APPLICATON : 383407&nbsp;&nbsp;&nbsp;&nbsp;&nbsp; 501 (C ) (3) CERTIFICATE SUBMITTED.&nbsp;&nbsp;; 10-27-2021 - CUSTOMER REVISED APPLICATION TO&nbsp; INCLUDE ALCOHOL -COPY OF ALCOHOL LICENSE SUBMTTED, SENT TO IMAGING.","2021-09-24T10:09:34.000","2021-09-30T09:09:01.000","2021-01-31T12:01:00.000","Active",,"19120",,"MARTINSBURG","RD",,"DICKERSON","MD","20842","39.179946","-77.47661",,"POINT (-77.47661 39.179946)"
"268068","SAINT ANDREW ROMANIAN CHURCH","ROMANIAN FOOD FESTIVAL : OCTOBER 8TH&nbsp; TO 10TH 2021 ; 501 ( C) (3) SUBMITTED;&nbsp; CATERED FOOD, ALCOHOL WILL BE SERVED; 1- 40'.0 X 60'.0 TEMP TENT( SPECIAL EVENT PERMIT: 383687 ;&nbsp; ( ALCOHOL RECEIPT SUBMITTED )&nbsp; ; 09-29-2021 -&nbsp; PROCESSED, MAILED TO: SAINT ANDREW ORTHODOX CHURCH","2021-09-23T01:09:53.000","2021-09-29T09:09:14.000","2021-10-10T12:10:00.000","Active",,"9111",,"RIVER","RD",,"POTOMAC","MD","20854","39.005155","-77.186128",,"POINT (-77.186128 39.005155)"
"268026","THE KOREAN AMERICAN ASSOC. OF GREATER WAHSINGTON","TENTS FOR FESTIVAL ; 20- 10'.0 X 10'.0 ; 1 - 40'.0 X 40'.0 ; 4 - 20'.0 X 30'.0 ; 1- 10'.0 X 20'.0 ; 1- 10'.0&nbsp; X 30'.0&nbsp; = TOTAL AREA : 6500 SQFT - INCLUDES STAGE LOCATED ON 40'.0 X 40'.0 TEMP TRAILER.; KORUS FESTIVAL WITH&nbsp; MUSIC, FOOD &amp; BEER ; STAGE WILL BE LOCATED WITHIN A TEMP . TRAILER ; 09-15-2021 - PROCESSED, EMAILED / MAILED TO CUSTOMER.","2021-09-14T02:09:43.000","2021-09-15T11:09:53.000","2021-09-26T12:09:00.000","Active",,"7101",,"DEMOCRACY","BLVD",,"BETHESDA","MD","20817","39.024358","-77.145864",,"POINT (-77.145864 39.024358)"
"268012","HELEN GREEK ORTHODOX CHURCH OF DC",,"2021-09-07T10:09:14.000","2021-09-10T02:09:28.000","2021-09-11T12:09:00.000","Active",,"721",,"NORWOOD","RD",,"SILVER SPRING","MD","20905","39.120559","-77.022403",,"POINT (-77.022403 39.120559)"
"267546","SAINT ANDREW ROMANIAN CHURCH","ROMANIAN FOOD FESTIVAL: MAY 14TH - 16TH&nbsp; 2021 -( NOTE: 501 (C) (3) SUBMITTED, &nbsp;FOOD WILL BE SERVED - RECEIPT SUBMITTED ; ALCOHOL WILL BE SERVED) ; ( RELATED BENEFIT PERFORMANCE: 262546)  &nbsp;TENTS TOTAL : 31- 40'.0 X 60'.0&nbsp; ; HEALTH DEPT. COVID APPROVAL SUBMITTED )","2021-05-07T01:05:28.000","2021-05-18T07:05:02.000","2021-05-16T12:05:00.000","Active",,"9111",,"RIVER","RD",,"POTOMAC","MD","20854","39.005155","-77.186128",,"POINT (-77.186128 39.005155)"
"266695","SAINT ANDREW ROMANIAN ORTHODOX","ANNUAL ROMANIAN FOOD FESTIVAL : 10-02-2020 TO 10-04-2020 ( NOTE:501 ( C ) ( 3 ) ;FOOD AND&nbsp;ALCOHOL BEVERAGES WILL BE SERVICED ) &nbsp;COPY OF FOOD LICENSE RECEIPT SUBMITTED. TENTS &lt; 200 SQFT. ) ; 09-23-2020 - PROCESSED, MAILED TO: SAINT ANDREW ROMAIN ORTHODOX CHURCH","2020-09-14T08:09:29.000","2020-09-23T08:09:35.000","2020-10-04T12:10:00.000","Active",,"9111",,"RIVER","RD",,"POTOMAC","MD","20854","39.005155","-77.186128",,"POINT (-77.186128 39.005155)"
"266500","CALLEVA","OUTDOOR CARNIVAL: MARKOFF HAUNTED FOREST: DATES OF ACTIVITY: OCTOBER: 9,10,16,17,23,24,30,31 ; NOVEMBER: 6,7","2020-08-17T10:08:33.000","2020-08-31T12:08:20.000","2020-11-07T12:11:00.000","Active",,"19120",,"MARTINSBURG","RD",,"DICKERSON","MD","20842","39.179946","-77.47661",,"POINT (-77.47661 39.179946)"
"265210","SANDY SPRING MUSEUM","STRAWBERRY FESTIVAL: DATES: SATURDAY : JUNE 6TH : 10:00 AM&nbsp; - 5:00 PM ; SUNDAY: JUNE 7TH : 7:00 AM - 4:00 PM ( NOTE: ALCOHOL &amp; FOOD WILL BE SERVED - APPLICATIONS SUBMITTED ; 501 (C)(3); ; 40 TENTS ; 1 OVER 200 SQFT FT; 2- STAGES &lt; 30 INCHES) RELATED U &amp; O: 373939 ; 03-06-2020 -&nbsp; BENEFIT PERFORMANCE CERTIFCATE MAILED TO: SANDY SPRING MUSEUM","2020-03-05T01:03:22.000","2020-03-06T12:03:37.000","2020-06-07T12:06:00.000","Active",,"17901",,"BENTLEY","RD",,"SANDY SPRING","MD","20860","39.149705","-77.021459",,"POINT (-77.021459 39.149705)"
"265058","HOLY REDEEMER CHURCH","BENEFIF PERFORMANCE&nbsp; ( AUTION )&nbsp;FOR HOLY REDEEMER CHURCH&nbsp; ON 03/07/2020 FROM 7:00AM TO 12:00 PM&nbsp; EVENT WILL BE INSIDE AND FOOD LICENSE AND ALCOHOLIC LICENSE ASUDMITTED WITH THE APLICATION.","2020-02-25T09:02:23.000","2020-03-02T02:03:06.000","2020-03-07T12:03:00.000","Active",,"9705",,"SUMMIT","AVE",,"KENSINGTON","MD","20895","39.01486","-77.084366",,"POINT (-77.084366 39.01486)"
"265015","STOP DROP AND PLAY CHILDREN MUSEUN","&nbsp;BENEFIT PERFORMANCE ; FOR STOP DROP AND PLAY CHILDREN MUSEUN ON 02/29/2020 SHOW DATE 03/07/2020&nbsp;  CUSTOMER CONFIRMED THAT THE ARE SERVING FOOD FROM SAM'S CLUB AND THEY ARE SERVING THE FOOD FOR THEM ; AND THERE IS NOT ALCHOOL AT THE EVENT  ( NOTE: NO TENTS,, ALCHOLIC, NO STAGE - SNOW DATE: 03-02-2019&nbsp;)","2020-02-19T11:02:16.000","2020-02-25T10:02:52.000","2020-02-29T12:02:00.000","Active",,"10211",,"LEWIS","DR",,"DAMASCUS","MD","20872","39.291013","-77.212397",,"POINT (-77.212397 39.291013)"
"264809","THE WOMAN'S CLUB OF CHEVY CHASE","BENEFIT PERFORMANCE FOR COMMUNITY ART SHOW AND SALE ; APRIL 3 2020&nbsp; FROM 2:00 PM TO 5:00 PM AND 7:00PM TO 9:00 PM &nbsp;; APRIL 4&nbsp; FROM 11:00AM TO 5:00 PM ; APRIL 5 FROM 11AM TO 5:00 PM ; FOOD LICENCE&nbsp; ALCOHOLIC LICENSE&nbsp; ATTACHED  MAIL LOG 418183 01/23/2020PROCESSED , MAILED ON THIS DATE 02/06/2020","2020-01-30T12:01:00.000","2020-02-06T12:02:00.000","2020-04-05T12:04:00.000","Active",,"7931",,"CONNECTICUT","AVE",,"CHEVY CHASE","MD","20815","38.990219","-77.076865",,"POINT (-77.076865 38.990219)"
"264026","UPPER MONTGOMERY COUNTY VOLUNTEER FIRE DEPARTMENT","SANTA BREAKFAST: ( NOTE: FOOD WILL BE SERVED - COPY OF FOOD LICENSE; 501 ( C) (3) &nbsp;SUBMITTED ) HOURS OF OPERATION:&nbsp; 8:00 AM TO&nbsp; NOON","2019-11-22T08:11:14.000","2019-11-26T07:11:17.000","2019-12-07T12:12:00.000","Active",,"19801",,"BEALLSVILLE","RD",,"BEALLSVILLE","MD","20839","39.180112","-77.411687",,"POINT (-77.411687 39.180112)"
"263654","ST FRANCIS OF ASSISI CATHOLIC","HOLIDAY CAZAARD FLEA MARKET&nbsp; ON NOVEMBER 9 ,2019 FROM 9:00 AM TO 2:00PM ; mail log 415013&nbsp; from 10/23/19&nbsp;processed , copy sent to via email and regular mail on 11/01/2019","2019-10-29T10:10:31.000","2019-11-01T11:11:19.000","2019-11-09T12:11:00.000","Active",,"6701",,"MUNCASTER_MILL","RD",,"DERWOOD","MD",,"0","0",,"POINT (0 0)"
"263491","DROTT LODGE #168","ANNUAL SWEDISH BAZAAR : NOVEMBER 2ND,&nbsp; ( HOURS OF OPERATION: 11:00 AM - 2:30 PM )( FOOD WILL BE SERVED - COPY OF TEMP. FOOD LICENSE RECEIPT SUBMITTED, NO ALCOHOL,TENTS, STAGES )","2019-10-18T12:10:39.000","2019-10-31T06:10:48.000","2019-11-02T12:11:00.000","Active",,"11815",,"SEVEN LOCKS","RD",,"POTOMAC","MD","20854","39.050411","-77.162854",,"POINT (-77.162854 39.050411)"
"262407","SAINT ANTDREW ORTHODOX CHURCH","ROMANINAN FOOD FESTIVAL: SEPT. - 27TH - 29TH SEPTEMBER&nbsp; ( NOTE: 501 (C) (3) SUBMITTED, &nbsp;FOOD WILL BE SERVED - RECEIPT SUBMITTED ; ALCOHOL WILL BE SERVED)","2019-09-03T02:09:33.000","2019-10-09T01:10:00.000","2019-09-29T12:09:00.000","Active",,"9111",,"RIVER","RD",,"POTOMAC","MD","20854","39.005155","-77.186128",,"POINT (-77.186128 39.005155)"
"261968","CALLEVA INC","HAUNTED ATTRACTIONS: DAYS OF OPERATION: OCT., 4;5;11;12;18;19;25;26;27;31 NOV.; 1;2 - TIME OF OPERATION: 7:00 -10:30 PM&nbsp; ( NOTE: 501 (C)(3), FOOD LICENSE RECEIPT SUBMITTED - RELATED BUILDING PERMITS: 884622; 884627 )","2019-08-22T09:08:43.000","2019-10-08T10:10:46.000","2019-11-02T12:11:00.000","Active",,"19120",,"MARTINSBURG","RD",,"DICKERSON","MD","20842","39.179946","-77.47661",,"POINT (-77.47661 39.179946)"
"263274",,"&nbsp;BENEFIT PERFORMANCE FOR CHURCH&nbsp; "" CHURCH FOOD &amp; CULTURAL FESTIVAL ( OCTUBER 05 FROM 11:00AM TO 10:00 PM&nbsp; AND OCTUBER 6 FROM 12:00 PM TO 9:00 PM","2019-10-01T01:10:48.000","2019-10-04T02:10:05.000","2019-10-06T12:10:00.000","Active",,"10660",,"RIVER","RD",,"POTOMAC","MD","20854","39.025032","-77.219476",,"POINT (-77.219476 39.025032)"
"263237","EMMANUEL LUTHERAN CHURCH","BENEFIT PERFORMANCE FOR THE CHURCH&nbsp; SUNDAY OCTUBER 6TH FROM 1:00PM TO 6:00PM","2019-09-26T02:09:11.000","2019-10-03T09:10:01.000","2019-10-06T12:10:00.000","Active",,"7730",,"BRADLEY","BLVD",,"BETHESDA","MD","20817","39.011703","-77.158866",,"POINT (-77.158866 39.011703)"
"263038","MORALES FRIES","ONE DAY FESTIVAL: SEPT. 22ND 2019 : 11:00 AM - 9:00 PM ( NOTE : FOOD WILL BE PREPARED ON SITE, STAGES LESS THAN 36"" HIGH, 5-10'.0 X10'.0 TENTS SEPERATED, ALCOHOL WILL BE SERVED - ALCOHOL LICENSE APPLICATION SUBMITTED)","2019-09-18T11:09:54.000","2019-09-19T08:09:26.000","2019-09-22T12:09:00.000","Active",,"15901",,"OLD COLUMBIA","PIKE",,"BURTONSVILLE","MD","20866","39.117725","-76.929397",,"POINT (-76.929397 39.117725)"
"262707","ST ROSE OF LIMA PARISH","48 TH ANNUAL FALL FESTIVAL : SEPT. 28TH : 8:00 AM - 4:00PM ; ANTICIPATED ATTENDANCE: 350 PERSONS; 75 VEHICLES: ( NOTE: 501 (C) (3) SUBMITTED, FOOD &amp; ALCOHOL WILL BE SERVED - RECEIPTS SUBMITTED; NO TEMP.TENTS/ GENERATORS;&nbsp; ON SITE COOKING - MCFRS SPECIAL OPERATIONS EVENT REQUEST FORM SUBMITTED )","2019-09-10T03:09:06.000","2019-09-13T07:09:04.000","2019-09-28T12:09:00.000","Active",,"11701",,"CLOPPER","RD",,"GAITHERSBURG","MD","20878","39.149816","-77.241888",,"POINT (-77.241888 39.149816)"
"261587","RAICES INC.","CULTURAL FESTIVAL : 09-08-2019 - FROM: 11:00 AM - 9:00M ( NOTE:&nbsp;&nbsp;FOOD&nbsp; WILL SUPPLIED BY PRIVATE VENDORS ; 501(C)(3) SUBMITTED ;&nbsp; SEPERATE POP TENTS WILL BE ON SITE, STAGE BELOW 36""&nbsp; ; NO GENERATORS) ; 08-20-2019 - PROCESSED, MAILED TO : TED LOZA.","2019-08-08T01:08:24.000","2019-08-20T08:08:59.000","2019-09-08T12:09:00.000","Active",,"1",,"VETERANS","PL",,"SILVER SPRING","MD","20910","38.997495","-77.024552",,"POINT (-77.024552 38.997495)"
"260941","WOMENS' BOARD OF MEDSTAR MONTGOMERY HOSPITAL","ANNUAL PICNIC &amp; BAZAAR: HOURS OF OPERATION: 10:00 AM TO 8:00 PM  ( RELATED U &amp; O:&nbsp;369587 ) ( NOTE: 501 (C) (3) SUBMITTED,FOOD WILL BE SERVED - FOOD LICENSE APPLICATION RECEIPT WILL BE EMAILED) ; 06-17-2019 - PROCESSED, MAILED TO CUSTOMER.","2019-06-13T03:06:40.000","2019-06-17T02:06:35.000","2019-07-23T12:07:00.000","Active",,"2801",,"OLNEY SANDY SPRING","RD",,"OLNEY","MD","20832","39.150907","-77.058205",,"POINT (-77.058205 39.150907)"
"254161","WESTBROOK ELEMENTARY SCHOOL","CARNIVAL : MAY 31ST FROM: 3:00&nbsp; - 7:00 PM ( NOTE: 501 (C) (3) SUBMITTED, &nbsp;FOOD PROVIDED BY FOOD TRUCKS, AND CONCESSION WILL PROVIDE READY TO EAT SNACKS, NO ALCOHOLIC BEVERAGES)","2019-05-22T01:05:55.000","2019-06-03T07:06:56.000","2019-05-31T12:05:00.000","Active",,"5110",,"ALLAN","TER",,"BETHESDA","MD","20816","38.959811","-77.10313",,"POINT (-77.10313 38.959811)"
"237608","GREEK ORTHODOX CHURCH","GREEK FESTIVAL DAY &amp; HOURS OF OPERATION: ( MAY 31ST: 12:00PM - 10:00 PM ; JUNE 1ST: 12;00 PM - 11:00 PM ; JUNE 2ND: 12;00PM - 8:00 PM ) NOTE: FOOD &amp; ALCOHOL WILL BE SERVCED- COPIES OF RECEIPT/APPLICATION &amp; 501 (C)(3)SUBMITTED ; TENTS WILL BE PLACED - RELATED U &amp; O: 368073","2019-03-29T10:03:46.000","2019-06-03T07:06:37.000","2019-06-02T12:06:00.000","Active",,"7701",,"BRADLEY","BLVD",,"BETHESDA","MD","20817","39.013569","-77.157217",,"POINT (-77.157217 39.013569)"
"246798","ST LUKE SERBIAN ORTHODOX CHURCH","BENEFIT PERFORMANCE FOR A LUKE SERBIAN ORTHODOX CHURCH&nbsp;&nbsp; ONE DAY EVENT&nbsp; MAY&nbsp; 18/2018&nbsp; FROM 11:00AM TO 9:00PM&nbsp;&nbsp; U&amp;O APPL WAS SUBMITTED ON THIS DATE # 368791","2019-05-06T11:05:34.000","2019-05-24T11:05:25.000","2019-05-18T12:05:00.000","Active",,"10660",,"RIVER","RD",,"POTOMAC","MD","20854","39.025032","-77.219476",,"POINT (-77.219476 39.025032)"
"236658","SAINT ANDREW ROMANIAN ORTHODOX CHURCH","ROMANIAN FOOD FESTIVAL: MAY 17TH;18TH;19TH FROM : 10:00 AM&nbsp; - 8:00 PM ( NOTE: FOOD &amp; ALCOHOL RECEIPT AND APPLICATION SUBMITTED - TENTS WILL BE ON SITE - U &amp; O APPLICATION SUBMITTED - RELATED U &amp; O :","2019-03-25T01:03:57.000","2019-05-23T02:05:43.000","2019-05-19T12:05:00.000","Active",,"9111",,"RIVER","RD",,"POTOMAC","MD","20854","39.005155","-77.186128",,"POINT (-77.186128 39.005155)"
"242188","SANDY SPRING MUSEUM","STRAWBERRY FESTIVAL: JUNE 1ST : 10:00 AM - 5:00PM ; JUNE 2ND: 11:00 AM - 4:00 PM ( NOTE: VENDORS WILL BE ON SITE - EVIDENCE OF FOOD &amp; ALCOHOL LICENSE APPLICATION SUBMITTED, 501(C)(3) SUBMITTED; 10'.0 X 10'.0 POP TENTS WILL BE ON SITE) - RELATED U &amp; O : 368891","2019-04-24T12:04:50.000","2019-05-23T02:05:17.000","2019-06-02T12:06:00.000","Active",,"17901",,"BENTLEY","RD",,"SANDY SPRING","MD","20860","39.149705","-77.021459",,"POINT (-77.021459 39.149705)"
"242083","POTOMAC SOCCER ASSOCIATION","SOCCER TOURNAMENT - ALL DAY EVENT&nbsp;( NOTE: 501 (C)(3) SUBMITTED - NO FOOD / ALCOHOLIC BEVERAGES, NO TENTS) ; 04-26-2019 - PROCESSED, MAILED TO APPLICANT.","2019-04-24T11:04:38.000","2019-04-26T07:04:58.000","2019-05-27T12:05:00.000","Active",,"14660",,"HUGHES","RD",,"POOLESVILLE","MD","20837","39.095431","-77.411767",,"POINT (-77.411767 39.095431)"
"240778","ATEMIS RACING INC","USAC SANCTIONED CRITERIUM STYLE BICYCLE RACE DURING THE&nbsp;HOURS OF : 7:00 AM TO 6:00 PM;&nbsp;( NOTE: 501 (C)(3), SITE PLAN AND ACTIVITY SCHEDULE SUBMITTED - NO FOOD / ALCOHOLIC ON SITE, POP TENT ON SITE) 04-23-2019 - PROCESSED, AWAITING PICK UP.","2019-04-17T01:04:59.000","2019-04-23T09:04:25.000","2019-05-04T12:05:00.000","Active",,"22300",,"COMSAT","DR",,"CLARKSBURG","MD","20871","39.220729","-77.276294",,"POINT (-77.276294 39.220729)"
"234148","THE WOMEN'S CLUB OF CHEVY CHASE","BENEFIT PERFORMANCE ; FOR COMMUNITY ART SHOW AND SALE ; NO TENTS OR STAGES WILL BE ERECTED OR USED FOR THIS EVENT ; EVENT DAYS APRIL 5, 2019( 2-5PM); APRIL 6( 11-5:00PM) AND APRIL 7 ( 1:00PM TO 5:00PM)&nbsp;&nbsp; FOOD LICENSE# 505&nbsp;, ALCOHOLIC&nbsp; BEVERAGE LIC #42620 ,AND TAX EXEMPT FOR WAS SUBMITTED ON THIS DATE. MAIL LOG 405711 03/04/2019PROCESSED , MAILED ON THIS DATE","2019-03-08T10:03:14.000","2019-03-18T10:03:23.000","2019-04-07T12:04:00.000","Active",,"7931",,"CONNECTICUT","AVE",,"CHEVY CHASE","MD","20815","38.990219","-77.076865",,"POINT (-77.076865 38.990219)"
"232476","MARYLAND SOCCER FOUNDATION","&nbsp;&nbsp; BENEFIT PERFORMANCE&nbsp; LICENSE FOR&nbsp; NON-PROFIT&nbsp; ORGANNIZATION ,&nbsp;( HOME SHOW )&nbsp;ON 03/01/ 2019&nbsp; FROM 10:00PM / 03/02 FROM 10:00AM TO 8:00PM AND 03/03 FROM 10:00AM TO 6:00PM&nbsp;&nbsp;","2019-02-27T02:02:40.000","2019-03-01T11:03:37.000","2019-03-03T12:03:00.000","Active",,"18031",,"CENTRAL PARK","CIR",,"BOYDS","MD","20841","39.152719","-77.311719",,"POINT (-77.311719 39.152719)"
"227191","STOP DROP AND PLAY CHILDREN'S MUSEUM","FUNDRAISER FROM: 6:00 TO 8:00 PM ( NOTE: NO TENTS,FOOD, ALCHOLIC, NO STAGE - SNOW DATE: 03-02-2019&nbsp;) ; 01-11-2019 - PROCESSED, MAILED TO CUSTOMER.","2019-01-07T08:01:12.000","2019-01-11T06:01:20.000","2019-02-23T12:02:00.000","Active",,"10211",,"LEWIS","DR",,"DAMASCUS","MD","20872","39.291013","-77.212397",,"POINT (-77.212397 39.291013)"
"226390","UPPER MONTGOMERY COUNTY FIRE DEPT.","SANTA BREAKFAST:&nbsp; FROM : 8:00 AM TO NOON; FOOD WILL BE SERVED, NO ALCOHOLIC BEVERAGES ( NOTE: COPIES OF FOOD LICENSE CERTIFICATE: 2567: EXPIRES: 01-31-2019; &nbsp;TAX EXEMPT CERT.: 52-0845257 &amp; MAP&nbsp;SUBMITTED)","2018-11-15T07:11:26.000","2018-11-16T07:11:20.000","2018-12-08T12:12:00.000","Active",,"19801",,"BEALLSVILLE","RD",,"BEALLSVILLE","MD","20839","39.180112","-77.411687",,"POINT (-77.411687 39.180112)"
"226376",,"BENEFIT PERFORMANCE FOR ST FRANCIS OF ASSISI CHURCH ;&nbsp; EVENT ON 11/10/2018 FROM 9:00AM TO 2:00PM&nbsp;&nbsp; (APPLICATION WAS RECEIVED ON 11/08/2018 AND ASSIGNED TO MR MORANMAIL LOG 402164 11/07/2018","2018-11-08T02:11:31.000","2018-11-09T12:11:38.000","2018-11-10T12:11:00.000","Active",,"6701",,"MUNCASTER_MILL","RD",,"DERWOOD","MD",,"0","0",,"POINT (0 0)"
"226371","DROTT LODGE #168 VASA","&nbsp;BENEFIT PERFORMENCE FOR THE LODGE ORGANIZATION , 501 (C) ATTACHE TO THE APPLICATION&nbsp;; ANUAL SWEDISH BAZAR;  EVENT DATE&nbsp; NOVEMBER 3 2018 FROM 11:00AM TO 2:30PM COPY SENT TO CUSTOMER EMAIL , AND A COPY BY MAIL .","2018-10-19T02:10:11.000","2018-11-02T12:11:24.000","2018-11-03T12:11:00.000","Active",,"11815",,"SEVEN LOCKS","RD",,"POTOMAC","MD","20854","39.050411","-77.162854",,"POINT (-77.162854 39.050411)"
"226332","ST ANDREW ROMANIAN ORTHODX CHURCH","ROMANIAN FOOD FESTIVAL: 28TH TO 30TH SEPTEMBER: 10:00 AM - 8:00 PM DAILY (NOTE:&nbsp; COPIES OF501 (C) (3); &nbsp;FOOD LICENSE RECEIPT, ALCOHOL LICENSE AND SPECIAL EVENT APPLICATION SUBMITTED ; RELATED U &amp; O FOR TEMP. TENT) ; 10-01-2018 - PROCESSED, MAILED, COPY SENT TO IMAGING ON THIS DATE..","2018-09-06T03:09:00.000","2018-10-01T09:10:48.000","2018-09-30T12:09:00.000","Active",,"9111",,"RIVER","RD",,"POTOMAC","MD","20854","39.005155","-77.186128",,"POINT (-77.186128 39.005155)"
"226333","ST.ROSE OF LIMA PARISH","47TH ANNUAL FALL&nbsp; FIESTAFUNDRAISER&nbsp; SATURDAY SEPTEMBER 29 2018 , CUSTMER HAVE SUBMITTED APROOF OF , HEALTH DEPATRTMENT , ALCHOL DEP , SPECIAL APPLICATION ,&nbsp; TAX FORM. DATE 09/29/2018 FROM 9:00 AM&nbsp; TO 4:00PM , INSITE EVENT.; PROCESSED MAILED &nbsp;UP &nbsp;, COPY SENT TO IMAGING ON THIS DATE.","2018-09-07T12:09:48.000","2018-09-11T02:09:13.000","2018-09-29T12:09:00.000","Active",,"11701",,"CLOPPER","RD",,"GAITHERSBURG","MD","20878","39.149816","-77.241888",,"POINT (-77.241888 39.149816)"
"226310","MARKOFFS HAUNTED  FOREST","&nbsp;HAUNTED FOREST &nbsp;ATTRACTIONS&nbsp;&nbsp; FROM OCTUBER 2018, 5,6,12,13,19,20,21,26,27,28,31&nbsp; DUSK UNTIL 11PM&nbsp;&nbsp; BUSSINESS NAME CAMP CALLEVA INC TAX FORM, HEALTH AND HUMAN&nbsp;SERVICE&nbsp;RECIPT&nbsp;WAS &nbsp;SUBMITTED WITH THE APPLICATIONS .09/05/2018 PROCESSED , MAILED , COPY SENT TO IMAGING ON THIS DATE","2018-08-28T02:08:36.000","2018-09-05T10:09:09.000","2018-08-31T12:08:00.000","Active",,"19120",,"MARTINSBURG","RD",,"DICKERSON","MD","20842","39.179946","-77.47661",,"POINT (-77.47661 39.179946)"
"226269","THE BERNIE HOUSE","MUSIC AND ARTS FUNDRAISING EVENT: FRIDAY HOURS: 3:00 PM TO 1:00 AM ; SATURDAY HOURS: 9:00 AM TO 2:00 AM SUNDAY ( NOTE: COPIES OF FOOD LICENSE RECEIPT, ALCOHOL &amp; SPECIAL EVENTS APPLICATION, STAGES ON SITE - &lt; 3'.0 ; NO TENTS ONLY FOOD CANOPY; 501 (C) ( 3) SUBMITTED) ; 08-17-2018 - PROCESSED, MAILED TO: THE BERNIE HOUSE: 26138 RIDGE ROAD, DAMASCUS, MD 20872 ; COPY SENT TO IMAGING ON THIS DATE.","2018-08-07T11:08:57.000","2018-08-17T07:08:45.000","2018-09-23T12:09:00.000","Active",,"11820",,"HAWKES","RD",,"CLARKSBURG","MD","20871","39.253772","-77.247829",,"POINT (-77.247829 39.253772)"
"226229","BETHESDA SOCCER CLUB","SOCCER TOURNAMENT: DATES OF EVENT: NOVEMEBER 10TH,&nbsp;12TH, 18TH, 19TH : FROM: 8: 00 AM TO 5""00 PM ( NOTE: NO FOOD / ALCOHOLIC BEVERAGE) ; 501 (C)(3) SUBMITTED ; &nbsp;07-27-2018 - PROCESSED, MAILED TO: BETHESDA SOCCER CLUB: 8655 GROVEMONT CIRCLE, GAITHERSBURG, MD 20811; COPY SENT TO IMAGING ON THIS DATE.","2018-07-13T07:07:13.000","2018-07-27T06:07:06.000","2018-11-19T12:11:00.000","Active",,"14660",,"HUGHES","RD",,"POOLESVILLE","MD","20837","39.095431","-77.411767",,"POINT (-77.411767 39.095431)"
"226193","RAICES INC.","CULTURAL COMMUNITY FESTIVAL : FROM 11:00 AM TO 9:00 PM ( NOTE: 501 (C) (3)&nbsp; &amp; MAP SUBMITTED -( FOOD WILL BE SUPPLIED BY VENDORS, NO ALCOHOL; SPECIAL EVENT PERMIT REQUIRED.) ; 06-28-2018 - PROCESSED,PLACED IN TRAY AWAITING PICK UP, COPY SENT TO IMAGING ON THIS DATE.","2018-06-25T03:06:55.000","2018-06-28T10:06:01.000","2018-08-26T12:08:00.000","Active",,"1",,"VETERANS","PL",,"SILVER SPRING","MD","20910","38.997495","-77.024552",,"POINT (-77.024552 38.997495)"
"226154","MANY HATS INSTITUTE","FAMILY FUN GETAWAY: 06-23-2018 - FROM: 8:00 AM TO 5:00 PM ; 06-24-2018 FROM: 8:00 AM TO 1:00 PM ( NOTE: NO FOOD/ ALCOHOLIC , TENTS, STAGES ; 501 (C) (3) SUBMITTED) ; 06-07-2018 - PROCESSED &amp; MAILED.","2018-06-06T07:06:25.000","2018-06-07T08:06:12.000","2018-06-24T12:06:00.000","Active",,"14660",,"HUGHES","RD",,"POOLESVILLE","MD","20837","39.095431","-77.411767",,"POINT (-77.411767 39.095431)"
"226152","WOMEN'S BOARD MED STAR MONTGOMERY HOSPITAL","2018 ANNUAL PICNIC &amp; BAZAAR FUNDRAISER&nbsp; FROM : 10:00 AM TO&nbsp; 8:00 PM ; ( NOTE: 501 (C)&nbsp; (3) ; FOOD LICENSE &amp; RAFFLE RECEIPTS, SPECIAL EVENTS APPLICATION )&nbsp; U &amp; O : 363755 ; 06-06-2018 - PROCESSED, MAILED.","2018-05-24T11:05:06.000","2018-06-06T08:06:39.000","2018-07-24T12:07:00.000","Active",,"2801",,"OLNEY SANDY SPRING","RD",,"OLNEY","MD","20832","39.150907","-77.058205",,"POINT (-77.058205 39.150907)"
"226129","MONTGOMERY COUNTRYSIDE ALLIANCE","FARM FESTIVAL: FROM 4:00 PM - 8:00 PM (&nbsp;NOTE: 501 (C) (3); COMPTROLLER OF&nbsp;MD OFF SITE WINERY/ BREWING PERMIT SUBMITTED FOR THE FOLLOWING:&nbsp;ROCKLANDS FARM LLC; WAREDACA BREWING COMPANY LLC&nbsp;; FOOD FACILITY LICENSE FOR SANDY SPRING V.F.D.; HANARO RESTAURANT / FAMERS MARKET; NO ONSITE COOKING) ; 05-30-2018 - PROCESSED, MAILED TO: MONTGOMERY COUNTRYSIDE ALLIANCE: P.O. BOX 24 ; POOLESVILLE, MD 20837 ; COPY SENT TO&nbsp; IMAGING ON THIS DATE.","2018-05-16T08:05:15.000","2018-05-30T10:05:54.000","2018-06-23T12:06:00.000","Active",,"21355",,"BIG WOODS","RD",,"DICKERSON","MD","20842","39.209819","-77.41555",,"POINT (-77.41555 39.209819)"
"226109","ST ANDREW ROMANIAN CHURCH","BENEFIT PERFORMANACE FOR ST ANDREW ROMANIAN CHURCH&nbsp; FROM MAY 18-2018 TO MAY 20-2018 TIME 08:00AM TO 8:00PM RELATED TO U&amp; O 363378","2018-05-07T12:05:33.000","2018-05-21T11:05:08.000","2018-05-20T12:05:00.000","Active","HIGH","9111",,"RIVER","RD",,"POTOMAC","MD","20854","39.005155","-77.186128",,"POINT (-77.186128 39.005155)"
"226054","EL PODER DE SER MUJER","4TH ANNUAL WOMEN'S FAIR: DATE &amp; TIME &nbsp;OF ACTIVITY: MAY 13TH : 12:00 PM - 6:00 PM; (NOTE:501 (C)(3) SUBMITTED; &nbsp;FOOD VENDORS WILL APPLY FOR THEIR INDIVIDUAL TEMP. FOOD LICENSE PERMIT; SPECIAL EVENT PERMIT IS REQUIRED) ; 05-08-2018 - PROCESSED, MAILED TO: TED LOZA: 5617 ANNAPOLIS ROAD, BLADENSBURG, MD 20710 ; COPY SENT TO IMAGING ON THIS DATE.","2018-04-12T11:04:11.000","2018-05-08T09:05:48.000","2018-05-13T12:05:00.000","Active",,,,,,,,,,"0","0","ELLSWORTH DRIVE BETWEEN FENTON STREET AND ONE VETERAN PLACE, SILVER  SPRING, MD 20910","POINT (0 0)"
"226052","GREEK ORTHODOX CHURCH OF SAINT GEORGE","GREEK FESTIVAL: DAY &amp; HOURS OF OPERATION:  ( MAY 4TH : 12:00PM - 10:00PM; MAY 5TH : 12:00 PM - 11:00 PM; MAY 6TH: 12:00 PM - 8:00 PM) ; ( NOTE:501 (C) (3), &nbsp;FOOD &amp; ALCOHOL WILL BE SERVED;&nbsp;&nbsp; SPECIAL EVENTS APPLICATION EVIDENCE OF ALL REQUIRED DOCUMENTS SUBMITTED) ; 05-08-2018 - PROCESSED, MAILED TO: GREEK ORTHODOX CHURCH OF SAINT GEORGE: 7701 BRADLEY BLVD., BETHESDA, MD 20817; COPY SENT TO IMAGING ON THIS DATE.","2018-04-12T07:04:26.000","2018-05-08T08:05:54.000","2018-05-06T12:05:00.000","Active",,"7701",,"BRADLEY","BLVD",,"BETHESDA","MD","20817","39.013569","-77.157217",,"POINT (-77.157217 39.013569)"
"226069","POTOMAC SOCCER ASSOCIATION","SOCCER TOURNAMENT: ALL DAY EVENT. ( NOTE: FOOD WILL BE SERVED - COPY OF RECEIPT &amp; 501 (C) (3) SUBMITTED; NO TENTS / STAGES) ; 04-24-2018 - PROCESSED, MAILED TO : POTOMAC SOCCER ASSOCIATION: P O BOX 60227. POTOMAC, MD 20859 ; COPY SENT TO IMAGING ON THIS DATE.","2018-04-20T02:04:21.000","2018-04-24T07:04:37.000","2018-05-27T12:05:00.000","Active",,"14660",,"HUGHES","RD",,"POOLESVILLE","MD","20837","39.095431","-77.411767",,"POINT (-77.411767 39.095431)"
"226053","CAMP BENNETT OF CENTRAL UNION MISSION","FESTIVAL ; DAY &amp; HOURS OF OPERATION: MAY 5TH : 12:00PM - 4:00 PM  ( NOTE: EVIDENCE OF 501&nbsp;(C)(3)&nbsp;; SPECIAL EVENTS APPLICATION AND ALCOHOL LICENSE SUBMITTED) ; 04-16-2018 - PROCESSED, MAILED TO: KEVIN HOLLOWELL: 20501 GEORGIA AVENUE, BROOKEVILLE, MD 2033; COPY SENT TO IMAGING ON THIS DATE.","2018-04-12T08:04:50.000","2018-04-16T07:04:27.000","2018-05-05T12:05:00.000","Active",,"20501",,"GEORGIA","AVE",,"BROOKEVILLE","MD","20833","39.198966","-77.055809",,"POINT (-77.055809 39.198966)"
"226045","ARTEMIS RACING INC","BICYCLE RACE: FROM 7:00 AM - 6:00 PM ( NOTE: FOOD TRUCKS WILL BE ON SITE FOR FOOD); 04-05-2018 - PROCESSED, MAILED TO: MR. GLEN P STEVENS: 702 HILLSBORO DRIVE, SILVER SPRING, MD 20902 ; COPY SENT TO IMAGING ON THIS DATE.","2018-03-29T08:03:36.000","2018-04-05T07:04:47.000","2018-05-05T12:05:00.000","Active",,"22300",,"COMSAT","DR",,"CLARKSBURG","MD","20871","39.220729","-77.276294",,"POINT (-77.276294 39.220729)"
"226043","HOLY REDEEMER SCHOOL","DINNER, DANCE, AUCTION FUNDRAISER:FROM 6:30 PM TO 11:30 PM; &nbsp;( NOTE: FOOD LICENSE: 1179 : EXP.: 01-31-2019; REG. NUMBER: 384555492 - ALCOHOL LICENSE APPLICATION; RAFFLE RECEIPT:&nbsp; LR2018-81506 SUBMITTED) ;02-28-2018 - PROCESSED, MAILED TO: HOLY REDEEMER CATHOLIC CHURCH &amp; SCHOOL: 9715 SUMMIT AVENUE, KENSINGTON, MD 20895; COPY SENT TO IMAGING ON THIS DATE.","2018-02-26T02:02:32.000","2018-02-28T12:02:10.000","2018-03-17T12:03:00.000","Active",,"9715",,"SUMMITT","AVE",,"KENSINGTON","MD",,"0","0",,"POINT (0 0)"
"226042","THE WOMAN'S CLUB OF CHEVY CHASE","ART SHOW &amp; SALE:&nbsp; APRIL 13TH : 2:00 &nbsp;-5:00 PM; APRIL 14TH : 11:00 - 5:00 PM; APRIL 15TH: 1:00 - 5:00 PM; &nbsp;NOTE: EVIDENCE OF 501(C)(3), FOOD LICENSE: (01-31-2019) ; ALCOHOLIC BEVERAGE LICENSE( APRIL 2018) SUBMITTED; 02-28-2018 - PROCESSED, MAILED TO: THE WOMAN'S CLUB OF CHEVY CHASE: 7931 CONNECTICUT AVENUE, CHEVY CHASE, MD 20815 ; COPY SENT TO IMAGING ON THIS DATE.","2018-02-23T08:02:46.000","2018-02-28T12:02:06.000","2018-04-15T12:04:00.000","Active",,"7931",,"CONNECTICUT","AVE",,"CHEVY CHASE","MD","20815","38.990219","-77.076865",,"POINT (-77.076865 38.990219)"
"225975","STOP DROP AND PLAY CHILDRENS MUSEUM","FUNDRAISER:FROM: 6:00 - 8:00 PM(NO FOOD / ALCOHOL ; ( NOTE:501(C)(3); COPY OF CONTACT SUBMITTED) ; 01-31-2018 - PERMIT PROCESSED, MAILED TO: MS. KYMBERLI DORIS PETRONIO: P.O. BOX 504, DAMASCUS, MD 20872 ; COPY SENT TO IMAGING ON THIS DATE.","2018-01-29T10:01:37.000","2018-01-31T09:01:42.000","2018-02-24T12:02:00.000","Active",,"10211",,"LEWIS","DR",,"DAMASCUS","MD","20872","39.291013","-77.212397",,"POINT (-77.212397 39.291013)"
"225955","WESTBROOK ELEMENTARY SCHOOL","SCHOOL CARNIVAL: MAY 4TH 2018 FROM 3:30 TO 7:30 PM ( NOTE: FOOD WILLBE SERVED - NO EVIDENCE OF FOOD APPLICATION SUBMITTED,CUSTOMER NOTIFIED - SPECIAL EVENTS PERMIT REQUIRED; LETTER OF GOOD STANDING&nbsp; SUBMITTED INSTEAD OF 501 (C) (3)) ; 01-30-2018 - 501 (C)(3), FOOD LICENSE RECEIPT &amp; CARNIVAL CONTRACT SUBMITTED ON THIS DATE.; 01-31-2018 - PROCESSED,MAILED TO : MS. AMANDA L MILLER: 5110 ALLAN TERRACE , BETHESDA, MD 20816","2018-01-18T08:01:09.000","2018-01-31T09:01:24.000","2018-05-04T12:05:00.000","Active",,"5110",,"ALLAN","TER",,"BETHESDA","MD","20816","38.959811","-77.10313",,"POINT (-77.10313 38.959811)"
"225895","UPPER MONTGOMERY COUNTY FIRE DEPARTMENT","SANTA BREAKFAST:&nbsp; FROM : 8:00 AM TO NOON; FOOD WILL BE SERVED, NO ALCOHOLIC BEVERAGES ( NOTE: COPIES OF FOOD LICENSE CERTIFICATE: 2567: EXPIRES: 01-31-2018; &nbsp;TAX EXEMPT CERT.: 52-0845257 SUBMITTED) .; 11-14-2017 - PROCESSED, MAILED TO: UPPPER MONTGOMERY COUNTY VOLUNTEER FIRE DEPARTMENT: P O BOX 553 , POOLESVILLE, MD 20837 ; COPY SENT TO IMAGING ON THIS DATE.","2017-11-09T09:11:33.000","2017-11-14T08:11:34.000","2017-12-02T12:12:00.000","Active",,"19801",,"BEALLSVILLE","RD",,"BEALLSVILLE","MD","20839","39.180112","-77.411687",,"POINT (-77.411687 39.180112)"
"225855","ST FRANCIS OF ASSISI CHURCH","HOLIDAY BAZAAR: FROM: 9:00 AM - 3:00 PM ( NOTE: FOOD WILL BE SERVED - COPY OF FOOD LICENSE: 2330 &amp; 501(C)(3): 29023109 SUBMITTED ; NO ALCOHOLIC BEVERAGES) ; 11-03-2017 - PROCESSED, MAILED TO : JOHN J DILLON: 6701 MUNCASTER MILL ROAD, ROCKVILLE, MD 20855 ; COPY SENT TO IMAGING ON THIS DATE.","2017-10-31T01:10:40.000","2017-11-03T10:11:18.000","2017-11-11T12:11:00.000","Active",,"6701",,"MUNCASTER MILL","RD",,"ROCKVILLE","MD","20855","39.141555","-77.135588",,"POINT (-77.135588 39.141555)"
"225875","HOLY REDEEMER SCHOOL","TRIVIA NIGHT: FROM&nbsp; 7:00 - 9:00 PM ; COPY OF 501 (C)(3) AND ALCOHOL BEVERAGE APPLICATION SUBMITTED (NOTE: NO FOOD WILL BE SERVED) ; 11-02-2017 - PROCESSED, PLACED IN TRAY AWAITING PICK UP, COPY SENT TO IMAGING ON THIS DATE.","2017-11-01T09:11:26.000","2017-11-02T12:11:59.000","2017-11-11T12:11:00.000","Active",,"9715",,"SUMMIT","AVE",,"KENSINGTON","MD","20895","39.015305","-77.08381",,"POINT (-77.08381 39.015305)"
"225838","DODGE LODGE #68","ANNUAL SWEDISH BAZAAR: FROM: 11:00 AM TO 2:30 PM ( NOTE: COPY OF FOOD LICENSE RECEIPT AND 501 (C)(8) SUBMITTED.) ( NO TENTS OR STAGES); 10-25-2017 - PROCESSED, MAILED TO: DROTT LODGE NO.168 -VASA OF AMERICA - 4600 CONNECTICUT AVENUE, APT. 819, WASHINGTON, DC 20008 ; COPY SENT TO IMAGING ON THIS DATE.","2017-10-20T01:10:39.000","2017-10-25T02:10:18.000","2017-11-04T12:11:00.000","Active",,"11815",,"SEVEN LOCKS","RD",,"POTOMAC","MD","20854","39.050411","-77.162854",,"POINT (-77.162854 39.050411)"
"225836","BETHESDA SOCCER CLUB","YOUTH SOCCER TOURNAMENT ON THE FOLLOWING DATES: NOVEMBER 11TH,18TH,19TH : FROM: 8:00 AM - 5:00 PM - COPY OF 501 (C) (3) SUBMITTED ; NO FOOD OR ALCOHOL BEVERAGES SERVED; 10-18-2017 - PROCESSED, MAILED TO: BETHESDA SOCCER CLUB: 8655 GROVEMONT CIRCLE, GAITHERSBURG, MD 20877; COPY SENT TO IMAGING ON THIS DATE.","2017-10-16T07:10:44.000","2017-10-18T07:10:35.000","2017-11-19T12:11:00.000","Active",,"14660",,"HUGHES","RD",,"POOLESVILLE","MD","20837","39.095431","-77.411767",,"POINT (-77.411767 39.095431)"
"225775","ST ANDREW ROMANIAN ORTHODOX CHURCH","ROMANIAN FOOD FESTIVAL: FRIDAY: 5:00 PM - 8:00 PM, SATURDAY &amp; SUNDAY: 11:00 AM - 8:00 PM ( NOTE: FOOD LICENSE AND ALCHOLIC BEVERAGE RECEIPTS SUBMITTED ( RELATED U &amp; O :359989 ;&nbsp;APPLIED FOR SPECIAL EVENTS PERMIT&nbsp;) ;10-02-2017 -&nbsp;PROCESSED, MAILED TO: 9111 RIVER ROAD, POTOMAC, MD 20854","2017-09-21T12:09:20.000","2017-10-02T11:10:16.000","2017-10-01T12:10:00.000","Active",,"9111",,"RIVER","RD",,"POTOMAC","MD","20854","39.005155","-77.186128",,"POINT (-77.186128 39.005155)"
"225755","DC DESIGGN HOUSE","BENEFIT PERFORMANCE 09/30/2017 UNTIL OCTUBER 29&nbsp; TUESDAY TO FRIDAY 10:00AM TO 3:00 AND SATURDAY AND SUNDAY 12:00 TO 5:00PM&nbsp;.","2017-09-05T03:09:44.000","2017-09-14T10:09:55.000","2017-10-29T12:10:00.000","Active",,"9004",,"CONGRESSIONAL","CT",,"POTOMAC","MD","20854","39.000968","-77.185866",,"POINT (-77.185866 39.000968)"
"225759","ST ROSE OF LIMA PARISH","46TH ANNUAL FALL FESTIVALFUNDRAISER: FROM : 10:00 AM TO 5:00 PM ( COPIES OF 501 (C) (3), TEMP.FOOD LICENSE APPL., ALCOHOLIC BEV. APPL. SUBMITTED; CUSTOMER NOTIFIED - SPECIAL EVENTS APPLICATION REQUIRED) ; 09-13-2017 - PROCESSED, PLACED IN TRAY AWAITING PICK UP, COPY SENT TO IMAGING ON THIS DATE.","2017-09-11T01:09:37.000","2017-09-13T10:09:31.000","2017-09-30T12:09:00.000","Active",,"11701",,"CLOPPER","RD",,"GAITHERSBURG","MD","20878","39.149816","-77.241888",,"POINT (-77.241888 39.149816)"
"225756","CLIFTON PARK BAPTIST CHURCH","COMMUNITY FESTIVAL: FROM 12:&nbsp;00 NOON TO 4: 00 PM (NOTE: FOOD WILLBE PREPARED ON SITE /SERVED- COPY OF FOOD LICENSE RECEIPT SUBMITTED; CUSTOMER APPLIED FOR SPECIAL EVENTS PERMIT) ; 09-08-2017 - PROCESSED, MAILED TO: CLIFTON PARK BAPTIST CHURCH: 8818 PINEY BRANCH ROAD, SILVER SPRING, MD 20903 ; COPY SENT TO IMAGING ON THIS DATE.","2017-09-06T03:09:57.000","2017-09-08T07:09:17.000","2017-09-23T12:09:00.000","Active",,"8818",,"PINEY BRANCH","RD",,"SILVER SPRING","MD","20901","39.000371","-76.993991",,"POINT (-76.993991 39.000371)"
"225736","THE BERNIE  HOUSE","ANUNUAL MUSIC AND ART FUNDRAISER &nbsp;EVENT. &nbsp;FROM FRIDAY&nbsp; SEPTEMBER 22&nbsp;FROM&nbsp;03:00PM TO 1:00AM ; SEPTEMBER 23RD 3:00PM- 1:00AM AND SATURDAY &nbsp;SEPTEMBER 24Th&nbsp;FROM&nbsp;11:00AM-2:00AM ON SEPTEMBER 25TH.&nbsp; FOOD LICENSE RECEIPT WAS SUBMITED&nbsp; BUT THE ALCOHOL LICENSE RECEIPT WAS SUBMITED .

&nbsp;

&nbsp;","2017-08-16T02:08:21.000","2017-09-06T10:09:28.000","2017-09-24T12:09:00.000","Active",,"11820",,"HAWKES","RD",,"CLARKSBURG","MD","20871","39.253772","-77.247829","THE HOMETOWN GET DOWN IS A MISIC AND ARTS FUNDRAISING EVENT","POINT (-77.247829 39.253772)"
"225737","MARKOFF'S HAUNTED FOREST","FUNDRAISER: SEPT. 30TH TO OCTOBER 31ST, 2017 - COPY OF 501 (C) (3) AND RECEIPT OF FOOD LICENSE SUBMITTED ( NOTE: HOURS OF OPERATION: 6:30 PM TO 10:30 PM) ; 08-31-2017 - PROCESSED, MAILED TO: MARKOFF'S HAUNTED FOREST: 13015 RILEY'S LOCK ROAD, POOLESVILLE, MD 20837 ; COPY SENT TO IMAGING ON THIS DATE.","2017-08-23T09:08:54.000","2017-08-31T07:08:54.000","2017-10-31T12:10:00.000","Active",,"19120",,"MARTINSBURG","RD",,"DICKERSON","MD","20842","39.179946","-77.47661",,"POINT (-77.47661 39.179946)"
"225675","AFROPOLITAN YOUTH ASSOCIATION INC","AFRICAN CULTURAL FESTIVAL( NOTE: FOOD WILL BE SERVED&nbsp; BY INDEPENDENT FOOD VENDORS;NO ALCOHOL BEVERAGE; &nbsp;CUSTOMER NOTIFIED OF SPECIAL EVENT PERMIT REQUIREMENT; COPY OF 501 (C) (3) &amp;&nbsp;APPROVED SITE PLANS FROM SILVER SPRING CIVIC ASSOC. SUBMITTED; NO TENTS, STAGE&nbsp;:&nbsp;41"" HIGH&nbsp;); 07-24-2017 - PROCESSED, MAILED TO: AFROPOLITAN YOUTH ASSOCIATION INC:&nbsp; P. O. BOX 4642 , LUTHERVILLE, MD 21094 ; COPY SENT TO IMAGING ON THIS DATE.","2017-07-21T07:07:51.000","2017-07-24T08:07:15.000","2017-08-13T12:08:00.000","Active",,"1",,"VETERANS","PL",,"SILVER SPRING","MD","20910","38.997495","-77.024552",,"POINT (-77.024552 38.997495)"
"225570","WOMEN'S BOARD MED STAR MONTGOMERY HOSPITAL","BENEFIT PERFORMANCE FOR WOMEN'S BOARD MED STAR MONTGOMERY HOSPITAL"" 2017 ANUAL PICNIC BAZAR FUND RAISEL&nbsp; ON&nbsp; JULY 25 FROM 10:00AM TO 8:00PM","2017-05-12T03:05:17.000","2017-07-13T11:07:43.000","2017-07-25T12:07:00.000","Active","LOW","2801",,"OLNEY SANDY SPRING","RD",,"OLNEY","MD","20832","39.150907","-77.058205",,"POINT (-77.058205 39.150907)"
"225654","JSS SPIRITUAL MISSION","YOGA DAY WITH SWAMT BABA RAMDEU: ACTIVITIES WILL BE HELD IN EXISTING BARN ( HOURS: 5:30 PM TO 8:00PM) 06-20-2017 - PLEASE SEE NOTES IN LOG.","2017-06-16T09:06:40.000","2017-06-20T07:06:23.000","2017-06-23T12:06:00.000","Active",,"7710",,"HAWKINS CREAMERY","RD",,"GAITHERSBURG","MD","20882","39.244441","-77.1586",,"POINT (-77.1586 39.244441)"
"225634","MANY HATS INDTITUTE","BENEFIT PERFORMANCE&nbsp; FOR MANY HATS INDTITUTE ; FORM 501(A) 501(C) 3 SUMMITED ON THIS DATE ; DAMILY FUN DAY GETAWAY ON&nbsp; JUNE 24&nbsp; FROM 08:00AM&nbsp; UNTIL 5:00PM AND JUNE 25 ,2017 FROM 08:00AM TO 1:00PM","2017-06-15T02:06:18.000","2017-06-19T11:06:14.000","2017-06-25T12:06:00.000","Active",,"14660",,"HUGHES","RD",,"POOLESVILLE","MD","20837","39.095431","-77.411767",,"POINT (-77.411767 39.095431)"
"225566","SAINT ANDREW ORTHODOX CHURCH","ROMANIAN FOOD FESTIVAL: FRIDAY: 3:00 PM - 8:00 PM, SATURDAY &amp; SUNDAY: 11:00 AM - 8:00 PM ( NOTE: FOOD LICENSE AND ALCHOLIC BEVERAGE RECEIPTS SUBMITTED ( RELATED U &amp; O:357896); 05-19-2017 - PROCESSED, MAILED TO: SAINT ANDREW ORTHODOX CHURCH: 9111 RIVER&nbsp; ROAD, POTOMAC, MD 20854 ; COPY SENT TO IMAGING ON THIS DATE.","2017-05-10T01:05:18.000","2017-05-19T01:05:36.000","2017-05-21T12:05:00.000","Active",,"9111",,"RIVER","RD",,"POTOMAC","MD","20854","39.005155","-77.186128",,"POINT (-77.186128 39.005155)"
"225511","ST GEORGE GREEK ORTHODOX CHURCH","6- TEMPORARY TENTS FOR GREEK FESTIVAL : &nbsp;FROM NOON TO MIDNIGHT ( EVIDENCE OF FOOD LICENSE / ALCOHOLIC BEVERAGES LICENSE&nbsp;&amp; NON-PROFIT DOCUMENTS SUBMITTED&nbsp;) SPECIAL EVENTS PERMIT REQUIRED - NO EVIDENCE OF APPLICATION SUBMITTAL) TENTS WILL BE ON SITE.; RELATED U &amp; O: 357711;&nbsp; 05-04-2017 - PROCESSED, PLACED IN TRAY IN MY CUBICLE FOR PICK UP, COPY SENT TO IMAGING ON THIS DATE.","2017-04-07T01:04:25.000","2017-05-04T02:05:05.000","2017-05-07T12:05:00.000","Active",,"7701",,"BRADLEY","BLVD",,"BETHESDA","MD","20817","39.013569","-77.157217",,"POINT (-77.157217 39.013569)"
"225547","POTOMAC SOCCER ASSOCIATION","SOCCER TOURNAMENT: FROM:8:30AM - 6:30 PM ( NOTE: FOOD LICENSE RECEIPT SUBMITTED) ; 05-02-2017 - PROCESSED, MAILED TO: POTOMAC SOCCER ASSOCIATION:&nbsp; P O BOX 60227, POTOMAC, MD 20859 - COPY SENT TO IMAGING ON THIS DATE.","2017-04-28T11:04:58.000","2017-05-02T08:05:02.000","2017-05-28T12:05:00.000","Active",,"14660",,"HUGHES","RD",,"POOLESVILLE","MD","20837","39.095431","-77.411767",,"POINT (-77.411767 39.095431)"
"225529","AMERICAN LEGION POST #68","KELLY MILLER CIRCUS FROM: 4:30 - 7:30 PM ( NOTE: EVIDENCE OF FOOD LICENSE RECEIPT REQUIRED) ; 04-26-2017 - FOOD LICENSE RECEIPT SUBMITTED ; PROCESSED, MAILED TO: AMERICAN LEGION POST #68, P.O. BOX 426. OLNEY, MD 20830 ; COPY SENT TO IMAGING ON THIS DATE.","2017-04-25T10:04:04.000","2017-04-26T02:04:30.000","2017-06-06T12:06:00.000","Active",,"18101",,"PRINCE PHILIP","DR",,"OLNEY","MD","20832","39.153871","-77.054222",,"POINT (-77.054222 39.153871)"
"225468","SANDY SPRING MUSEUM","36TH ANNUAL STRAWBERRY FESTIVAL: DURING THE HOURS OF 10:00 AM TO 5:00PM ; 501(c) (3) SUBMITTED ; ( NOTE: FOOD AND ALCOHOLIC BEVERAGES WILL BE SERVED - NO EVIDENCE OF LICENSE SUBMITTED) ; 04-18-2017 - COPY OF TEMP.FOOD APPLICATION SUBMITTED -NO EVIDENCE OF RECEIPT RECEIVED.; 04-18-2017 - PROCESSED, MAILED TO: SANDY SPRING MUSEUM : 17901 BENTLEY ROAD, SANDY SPRING, MD 20860 ; COPY SENT TO IMAGING ON THIS DATE.","2017-03-22T07:03:21.000","2017-04-18T02:04:42.000","2017-06-03T12:06:00.000","Active",,"17901",,"BENTLEY","RD",,"SANDY SPRING","MD","20860","39.149705","-77.021459",,"POINT (-77.021459 39.149705)"
"225486","ARTEMIS RACING INC","BENEFIT PERFORMANCE FOR CRITERIUM STYLE BICYCLE RACE&nbsp; ON MAY&nbsp;06/2017 FROM 7:00AM UNTIL 6:00PM;&nbsp; FOOD LICENSE 2584 MAY ;&nbsp; TRADE LICENSE 15025112; 501(C) FORM PROVIDED ON THIS DATE. ASSIGNED TO MR JAKAB","2017-03-31T11:03:52.000","2017-04-05T11:04:20.000","2017-05-06T12:05:00.000","Active",,"22300",,"COMSAT","DR",,"CLARKSBURG","MD","20871","39.220729","-77.276294",,"POINT (-77.276294 39.220729)"
"225469","WESTBROOK ELEMENTARY SCHOOL","SCHOOL CARNIVAL HOURS OF OPERATION: 3:30 PM TO 7:30PM - EVIDENCE OF 501 (c)(3) AND RECEIPT OF FOOD LICENSE SUBMITTED - NO ALCOHOLIC BEVERAGES WILL BE SERVED.;&nbsp; 03-23-2017 - 501 (c)(3) SUBMITTED; PROCESSED, MAILED TO: MS.AMANDA LAUREN MILLER: 5212 FARRINGTON ROAD, BETHESDA, MD 20816 ; COPY SENT TO IMAGING ON THIS DATE.; 05-04-2017 - CUSTOMER REQUESTED CHANGE OF DATE - DUE TO SEVERE WEATHER CONDITIONS -NEW DATE: JUNE 2ND., 2017 ; REVISED COPY EMAILED TO CUSTOMER.","2017-03-22T08:03:18.000","2017-03-23T07:03:34.000","2017-05-05T12:05:00.000","Active",,"5110",,"ALLAN","TER",,"BETHESDA","MD","20816","38.959811","-77.10313",,"POINT (-77.10313 38.959811)"
"225467","HOLY REDEEMER SCHOOL - KNESINGTON","TRIVIA NIGHT -&nbsp;FROM 7:&nbsp;00&nbsp;PM TO 11:00 PM -&nbsp;NO FOOD, ALCOHOLIC BEVERAGE APPLICATION PENDING ; 03-23-2017 - PROCESSED, PLACED IN TRAY IN MY CUBICLE AWAITING PICK UP, COPY SENT TO IMAGING ON THIS DATE.","2017-03-17T10:03:40.000","2017-03-23T07:03:05.000","2017-03-25T12:03:00.000","Active",,"9715",,"SUMMIT","AVE",,"KENSINGTON","MD","20895","39.015305","-77.08381",,"POINT (-77.08381 39.015305)"
"225426","THE WOMAN'S CLUB OF CHEVY CHASE","CHARITY&nbsp;ART SHOW AND SALE &nbsp;:&nbsp;ON 03/31/2017 &nbsp;FROM : 02:00PM - 05:00PM;&nbsp;&nbsp; APRIL 1, 2017 FROM 11:00AM TO 05:00PM&nbsp; APRIL 2, FRORM 1:00 PM TO 5:00 PM ""&nbsp; THEY ARE&nbsp; SERVING ALCOHOL&nbsp; LICENSE # 17-0394 THEY&nbsp; ARE&nbsp; SERVING FOOD ;ICENSE#&nbsp; 505 TYPE D . ASSINED TO MR. HURTADO 

THE WOMAN'S CLUB OF CHEVY CHASE: 7931 CONNECTICUT AVENUE, CHEVY CHASE, MD 20815","2017-03-01T09:03:17.000","2017-03-02T01:03:24.000","2017-04-02T12:04:00.000","Active",,"7931",,"CONNECTICUT","AVE",,"CHEVY CHASE","MD","20815","38.990219","-77.076865",,"POINT (-77.076865 38.990219)"
"225366","THE WOMEN'S CLUB OF CHEVY CHASEE","CHARITY SWING DANCE FUNDRAISER :&nbsp;ON 01/28/2017 &nbsp;FROM : 11:30 PM - 11:30 PM;&nbsp; ALCOHOLIC LICENSE: 170331 SUBMITTED (ASSIGNED TO MR. Hurtado)&nbsp; THEY NOT SERVING FOOD ;THE WOMAN'S CLUB OF CHEVY CHASE: 7931 CONNECTICUT AVENUE, CHEVY CHASE, MD 20815","2017-01-11T10:01:48.000","2017-01-17T12:01:52.000","2017-01-28T12:01:00.000","Active",,"7931",,"CONNECTICUT","AVE",,"CHEVY CHASE","MD","20815","38.990219","-77.076865",,"POINT (-77.076865 38.990219)"
"225306","UPPER MONTGOMERY COUNTY FIRE DEPARTMENT","SANTA BREAKFAST:&nbsp; FROM : 8:00 AM TO NOON; FOOD WILL BE SERVED, NO ALCOHOLIC BEVERAGES ( NOTE: COPIES OF FOOD LICENSE CERTIFICATE: 2567 ; TAX EXEMPT CERT.: 52-0845257 SUBMITTED) ; 11-22-2016 - PROCESSED, MAILED TO: UPPER MONTGOMERY COUNTY FIRE DEPARTMENT: P O BOX 553, POOLESVILLE, MD 20837 ; COPY SENT TO IMAGING ON THIS DATE.","2016-11-18T08:11:29.000","2016-11-22T09:11:22.000","2016-12-03T12:12:00.000","Active",,"19801",,"BEALLSVILLE","RD",,"BEALLSVILLE","MD","20839","39.180112","-77.411687",,"POINT (-77.411687 39.180112)"
"225286","BETHESDA SOCCER CLUB","YOUTH SOCCER TOURNAMENT ON THE FOLLOWING DATES: NOVEMBER 12TH,13TH,19TH, 20TH : FROM: 8:00 AM - 5:00 PM - COPY OF 501 (C) (3) SUBMITTED ; NO FOOD OR ALCOHOL BEVERAGES SERVED.; 11-08-2016 - PROCESSED, PLACED IN TRAY IN MY CUBICLE AWAITING PICK UP, COPY SENT TO IMAGING ON THIS DATE.","2016-11-04T12:11:50.000","2016-11-08T01:11:31.000","2016-11-20T12:11:00.000","Active",,"14660",,"HUGHES","RD",,"POOLESVILLE","MD","20837","39.095431","-77.411767",,"POINT (-77.411767 39.095431)"
"225266","DODGE LODGE No.168 VASA ORDER OF AMERICA","ANNUAL SWEDISH BAZAAR&nbsp; -&nbsp;NOVEMBER 05 -2016 &nbsp;FROM 11:00 AM - 2:30 PM ;&nbsp; FOOD SERVED ,&nbsp; HEALTH DEP&nbsp; RECEIPT PROVIDED ON THIS DATE.","2016-10-21T01:10:58.000","2016-10-25T02:10:52.000","2016-11-05T12:11:00.000","Active",,"11815",,"SEVEN LOCKS","RD",,"POTOMAC","MD","20854","0","0",,"POINT (0 0)"
"225246","T FRANCIS OF ASSISI CHURCH","HOLIDAY BAZAAR: NOV 12/2016 &nbsp;FROM : 9:00 AM - 3:00 PM ( NOTE: FOOD WILL BE SERVED - COPY OF FOOD LICENSE : 2330 SUBMITTED; COPY OF TAX EXEMPTION CERTIFICATE: 29023109 - SUBMITTED; NO ALCOHOLIC BEVERAGES ): MR. MORAN;","2016-10-18T10:10:15.000","2016-10-19T10:10:11.000","2016-10-12T12:10:00.000","Active",,"6701",,"MUNCASTER MILL","RD",,"ROCKVILLE","MD","20855","39.141555","-77.135588",,"POINT (-77.135588 39.141555)"
"225148","ST ANDREW ROMANIAN ORTHDOX CHURCH","ROMANIAN FOOD FESTIVAL:&nbsp;SEPTEMBER 30 -&nbsp;OCTOCBER 2ND &nbsp;DURING THE HOURS OF 10:00AM&nbsp; - 8:00 PM PM&nbsp;. FOOD LICENSE&nbsp; AND ALCHOL LICENSE &nbsp;RECEIPT WAS PROVIDES &nbsp;&nbsp; WITH THIS &nbsp;APPLICATION AND U&amp;O APPLICATION 354320

PENDING INSPECTIONS FOR U&amp;O ,&nbsp; 

&nbsp;","2016-09-08T03:09:12.000","2016-09-29T01:09:06.000","2016-10-02T12:10:00.000","Active",,"9111",,"RIVER","RD",,"POTOMAC","MD","20854","39.005155","-77.186128",,"POINT (-77.186128 39.005155)"
"225199","SANDY SPRING MUSEUM","FALL MUSIC FESTIVAL: FROM : 12:00 - 6: 00 PM ( COPIES OF FOOD AND ALCOHOLIC BEVERAGE APPLICATIONS AND 501 (C) (3) SUBMITTED ;&nbsp;TEMPORARY STAGE AND TENTS UNDER 200 SQFT WILL BE ON SITE - BUILDING /U&nbsp;&amp; O NOT REQUIRED&nbsp;) ; 09-28-2016 - PROCESSED, MAILED TO: SANDY SPRING MUSEUM : 17901 BENTLEY ROAD, SANDY SPRING, MD 20860 ; COPY SENT TO IMAGING ON THIS DATE.","2016-09-22T01:09:17.000","2016-09-28T09:09:55.000","2016-10-08T12:10:00.000","Active",,"17901",,"BENTLEY","RD",,"SANDY SPRING","MD","20860","39.149705","-77.021459",,"POINT (-77.021459 39.149705)"
"225179","SAINT ROSE OF LIMA PARISH","ANNUAL FALL FIESTA FUNDRAISER: FROM : 8:00 AM TO 4:00 PM ( NOTE: TENTS: LESS THAN 200 SQFT, PORTABLE STAGE: LESS THAN 30"" HIGH; COPY OF 501 (C) (3) (1) ;SPECIAL EVENTS&nbsp;; &nbsp;ALCOHOLIC BEV. APPLICATION &amp; FOOD LICENSE APPLICATION RECEIPT SUBMITTED) ; 09-19-2016 - PROCESSED, MAILED TO:&nbsp;MR. AGUSTIN MATEO: ST. ROSE OF LIMA PARISH: 11701 CLOPPER ROAD, GAITHERSBURG, MD 20878 ; COPY SENT TO IMAGING ON THIS DATE.","2016-09-16T07:09:42.000","2016-09-19T08:09:13.000","2016-09-24T12:09:00.000","Active",,"11701",,"CLOPPER","RD",,"GAITHERSBURG","MD","20878","39.149816","-77.241888",,"POINT (-77.241888 39.149816)"
"225141","GLENSTONE FOUNDATION","INDOOR CONCERT - NO FOOD ; ALCOHOL BEVERAGES SERVED / NO SALES - NO ALCOHOL LICENSE SUBMITTED: FROM 6:00 PM TO 8:00 PM: FEES WAIVED PER MR. MUSTAFA.; RELATED U &amp; O: 354224; 09-09-2016 - PROCESSED, DELIVERED TO MR. MUSTAFA, COPY SENT TO IMAGING ON THIS DATE.","2016-09-01T09:09:11.000","2016-09-09T03:09:42.000","2016-09-10T12:09:00.000","Active",,"12002",,"GLEN","RD",,"POTOMAC","MD","20854","39.056478","-77.248945",,"POINT (-77.248945 39.056478)"
"225121","THE BERNIE HOUSE","ANUNUAL MUSIC AND ART FUNDRAISER &nbsp;EVENT. &nbsp;FROM FRIDAY&nbsp; 23RD 3:00PM- 1:00AM AND SATURDAY &nbsp;SEPTEMBER 24Th&nbsp;FROM&nbsp;11:00AM-2:00AM ON SEPTEMBER 25TH.","2016-08-19T12:08:59.000","2016-08-30T04:08:25.000","2016-09-24T12:09:00.000","Active",,"11820",,"HAWKES","RD",,"CLARKSBURG","MD","20871","39.253772","-77.247829","THE HOMETOWN GET DOWN IS A MISIC AND ARTS FUNDRAISING EVENT","POINT (-77.247829 39.253772)"
"225062","AFROPOLITAN YOUTH ASSOCIATION INC","AFRICAN CULTURAL FESTIVAL( NOTE: FOOD WILL BE SERVED ; CUSTOMER NOTIFIED OF SPECIAL EVENT PERMIT REQUIREMENT; COPY OF 501 (C) (3) SUBMITTED) ; 08-01-2016 - PROCESSED, MAILED TO: AFROPOLITAN YOUTH ASSOCIATION: P O BOX 4642 ,LUTHERVILLE, MD 21094 ; COPY SENT TO IMAGING ON THIS DATE.","2016-07-20T02:07:59.000","2016-08-01T02:08:47.000","2016-08-14T12:08:00.000","Active",,"1",,"VETERANS","PL",,"SILVER SPRING","MD","20910","38.997495","-77.024552",,"POINT (-77.024552 38.997495)"
"224983","SCOTT WEDDELL FOUNDATION","BENEFIT PERFORMANCE PERMIT "" YOUTH LACROSSE TOURNAMENT&nbsp; ON SOCCER FIELDS&nbsp; EVENT DATES 06/25/2016 AND 06/26/2016 FROM 08:00AM TO 5:00PM.NO FOOD , NO MUSIC , SPEAKER , NO ALCHOOL .","2016-06-15T03:06:18.000","2016-06-20T09:06:03.000","2016-06-26T12:06:00.000","Active",,"14660",,"HUGHES","RD",,"POOLESVILLE","MD","20837","39.095431","-77.411767",,"POINT (-77.411767 39.095431)"
"224914","WOMEN'S BOARD MED STAR MONTGOMERY HOSPITAL","ANNUAL PICINIC &amp; BAZAAR FUNDRAISER : FROM : 10:00 AM TO 8:00 PM - FOOD LICENSE RECEIPT SUBMITTED; SPECIAL EVENT PERMIT SUBMITTED.&nbsp; WOMEN'S BOARD&nbsp; MED STAR MONTGOMERY MEDICAL CENTER HOSPITAL - 18101 PRINCE PHILIP DRIVE, OLNEY, MD 20832 .","2016-05-24T12:05:04.000","2016-05-25T11:05:02.000","2016-07-26T12:07:00.000","Active",,"2801",,"OLNEY SANDY SPRING","RD",,"OLNEY","MD","20832","39.150907","-77.058205",,"POINT (-77.058205 39.150907)"
"224850","POTOMAC UNITED METHODIST CHURCH","CHARITY FUND RAISING FESTIVAL LOCATED WITHIN THE BUIDLING: FROM: 10:00 PM - 4:00 PM ( NOTE: EVIDENCE OF FOOD LICENSE APPLICATION SUBMITTED; SPECIAL EVENTS PERMIT REQUIRED) ; 05-12-2016 -&nbsp; PROCESSED, MAILED TO: VICKIE COOPER: POTOMAC UNITED METHODIST CHURCH: 9701 CLYDESDALE STREET, POTOMAC, MD 20854 ; COPY SENT TO IMAGING ON THIS DATE: ( NOTE: CUSTOMER NOTIFIED AND IS REQUIRED TO OBTAIN A SPECIAL EVENT PERMIT FROM THE FIRE DEPARTMENT)","2016-05-02T08:05:46.000","2016-05-12T12:05:46.000","2016-05-21T12:05:00.000","Active",,"9908","S","GLEN","RD",,"POTOMAC","MD","20854","39.027197","-77.205928",,"POINT (-77.205928 39.027197)"
"224853","ST ANDREW ROMANIAN ORTHODOX CHURCH","ROMANIAN FOOD FESTIVAL: FROM:2:00 PM TO 8:00 PM ( NOTE: RECEIPT OF TEMP.FOOD LIC. APPL. , SPECIAL EVENT APPLICATION,COPY OF ALCOHOL BEVERAGE LICENSE SUBMITTED; U &amp; O REQUIRED) ; 05-11-2016 - COPIES OF ALCOHOL BEVERAGE APROVAL WITH UPDATED 501 (C) 3 SUBMITTED; NOTE: ONLY ONE 10'.0 X20'.0 TEMP.TENT WILL BE ERECTED - U &amp; O NOT REQUIRED, PROCESSED, PICKED UP, COPY SENT TO IMAGING ON THIS DATE.","2016-05-04T03:05:06.000","2016-05-11T10:05:29.000","2016-05-15T12:05:00.000","Active",,"9111",,"RIVER","RD",,"POTOMAC","MD","20854","39.005155","-77.186128",,"POINT (-77.186128 39.005155)"
"224766","SANDY SPRING MUSEUM","STRAWBERRY FESTIVAL: FROM: 10:00 AM TO 5:00 PM ( NOTE: FOOD &amp; ALCOHOL WILL BE SERVED - NO EVIDENCE OF CERTIFCATE SUBMITTED) ; 05-10-2016 - SPOKE WITH MS. DIANNE BUSH - REF.FOOD, ALCOHOLIC AND SPECIAL EVENTS PERMIT( GAVE HER THE NUMBER: 240-777-2457)&nbsp;THAT ARE REQUIRED PRIOR CERTIFICATE RELEASE(JR) ; 05-11-2016 - COPY OF ALCOHOL APPROVAL SUBMITTED; PROCESSED,MAILED TO: ALLISON WEISS: 17901 BENTLEY ROAD, SANDY SPRING, MD 20860, COPY SENT TO IMAGING ON THIS DATE. (NOTE: THIS PERMIT DOES NOT EXEMPT CUSTOMER FROM OBTAINING A SPECIAL EVENTS PERMIT FROM THE FIRE DEPARTMENT)","2016-03-22T11:03:49.000","2016-05-11T10:05:28.000","2016-06-04T12:06:00.000","Active",,"17901",,"BENTLEY","RD",,"SANDY SPRING","MD","20860","39.149705","-77.021459",,"POINT (-77.021459 39.149705)"
"224852","POTOMAC SOCCER ASSOCIATION C/O KATHERINE HAUSCHILD","SOCCER TOURNAMENT&nbsp; (2 DAYS 05/28/2016 FROM 8:30 TO 6:00PM AND 05/29/2016 08:30AM TO 2:00PM ) THEY WILL HAVE 2 VENDOR . FOOD&nbsp; LIC RECEIPT IS ATTACHED.","2016-05-04T11:05:07.000","2016-05-06T09:05:56.000","2016-05-29T12:05:00.000","Active",,"14660",,"HUGHES","RD",,"POOLESVILLE","MD","20837","39.095431","-77.411767",,"POINT (-77.411767 39.095431)"
"224848","GREEK ORTHODOX CHURCH OF SAINT GEORGE","GREEK FESTIVAL: FROM NOON - MIDNIGHT ( NOTE: FOOD AND ALCOHOLIC BEVERAGES RECEIPT AND &nbsp;CERTIFICATE SUBMITTED: SPECIAL EVENTS PERMIT REQUIRED) ; 05-03-2016 - PROCESSED, MAILED TO: MS. VICTORIA KANTSIOS: 7701 BRADLEY BLVD., BETHESDA, MD 20817 ; COPY SENT TO IMAGING ON THIS DATE (NOTE: THIS PERMIT WAS ISSUED ON DPS REQUIRED SUBMITTAL DOCUMENTS AND APPROVAL , APPLICANT IS RESPONSIBLE FOR SPECIAL EVENTS APPROVAL FROM THE FIRE DEPT.)","2016-04-26T11:04:12.000","2016-05-03T09:05:02.000","2016-05-22T12:05:00.000","Active",,"7701",,"BRADLEY","BLVD",,"BETHESDA","MD","20817","0","0",,"POINT (0 0)"
"224831","THE WOMAN'S CLUB CHEVY CHASE MD","BENEFIT PERFORMANCE ""JAZZ CONCERT""&nbsp;&nbsp; DATE APRIL 30TH FROM 6:00p to 11:00pm. "" WOMAN'CLUB CHEVY CHASE ,MD "". EMPLOYER IDENTIFICATION NUMBER 52-0534893.

&nbsp;

&nbsp;","2016-04-15T10:04:51.000","2016-04-22T10:04:52.000","2016-04-30T12:04:00.000","Active",,"7931",,"CONNECTICUT","AVE",,"CHEVY CHASE","MD","20815","38.990219","-77.076865",,"POINT (-77.076865 38.990219)"
"224732","THE WOMEN'S CLUB OF CHEVY CHASE","ART SHOW: FROM : 11:00 AM - 5:00 PM; COPY OF FOOD LICENSE: 505; ALCOHOLIC LICENSE: 16-0411 SUBMITTED (ASSIGNED TO MR. CALLOWAY ) ; 03-14-2016 - PROCESSED, MAILED TO: MS. MARIE POWELL - THE WOMAN'S CLUB OF CHEVY CHASE: 7931 CONNECTICUT AVENUE, CHEVY CHASE, MD 20815 ; COPY SENT TO IMAGING ON THIS DATE.","2016-03-09T09:03:34.000","2016-03-11T09:03:24.000","2016-04-10T12:04:00.000","Active",,"7931",,"CONNECTICUT","AVE",,"CHEVY CHASE","MD","20815","38.990219","-77.076865",,"POINT (-77.076865 38.990219)"
"224666","HOLY REDEEMER CATHOLIC CHURCH","DINNER, DANCE, AUCTION FUNDRAISER: FROM: 6:30 PM TO 11:00 PM FOOD LICENSE: 1179 SUBMITTED; (NOTE:ALCOHOLIC BEVERAGES WILL BE SERVED - NO EVIDENCE OF&nbsp;LICENSE SUBMITTED) ; ASSIGNED TO MR. CALLOWAY ; 02-25-2016 - PROCESSED, MAILED TO: HOLY REDEEMER SCHOOL: 9715 SUMMIT AVENUE, KENSINGTON, MD. 20895 ; COPY SENT TO IMAGING ON THIS DATE.","2016-02-24T08:02:29.000","2016-02-25T10:02:45.000","2016-03-19T12:03:00.000","Active",,"9715",,"SUMMIT","AVE",,"KENSINGTON","MD","20895","0","0",,"POINT (0 0)"
"224647","WESTBROOK ES PTA","CARNIVAL FROM: 2:00 PM TO 8:00 PM; FOOD WILLBE SERVED ( EVIDENCE OF FOOD LICENSE NOT SUBMITTED); 02-18-2016 - COPY OF FOOD LICENSE APPLICATION AND AREA MAP SUBMITTED, APPLICATION APPROVED, MAILED TO:&nbsp; MS . RACHEL HIRSCHBERG LIGHT : 5110 ALLAN TERRACE, BETHESDA, MD 20816 ; COPY SENT TO IMAGING ON THIS DATE.

05/06/2016&nbsp;&nbsp; THE DATE OF THIS EVENT WAS CHANGED DUE TO RAIN AND WAS AUTHORISED BY MR MOTAZEDI. THE SAME TIME FROM 2:00PM TO 8:00PM ON JUNE-03-2016","2016-02-17T08:02:00.000","2016-02-18T09:02:30.000","2016-05-06T12:05:00.000","Active",,"5110",,"ALLAN","TER",,"BETHESDA","MD","20816","0","0",,"POINT (0 0)"
"224545","SHRINE OF ST JUDE SODALITY","BAZAAR/FLEA MARKET: MARCH 31ST. - APRIL 1ST,2016 (HOURS OF OPERATION: 12:00 NOON TO 7:00 PM) APRIL 2ND( 9:00AM - 12:30PM) ; NO FOOD OR ALCOHOLIC BEVERAGES OR PRIVATE VENDORS (501(C) (3) SUBMITTED.; 12-30-2015 - PROCESSED, MAILED TO: MS. DOROTHY GRANT: 12811 ATHERTON DRIVE, SILVER SPRING, MD 20906-4325; COPY SENT TO IMAGING ON THIS DATE.","2015-12-29T12:12:32.000","2015-12-30T08:12:46.000","2016-04-02T12:04:00.000","Active",,"12701",,"VEIRS MILL","RD",,"ROCKVILLE","MD","20853","39.065471","-77.096935",,"POINT (-77.096935 39.065471)"
"224465","JUNIOR WOMEN'S CLUB OF CHEVY CHASE","DANCE WITH DJ( NO PERFORMANCE)&nbsp;FROM: 7:30&nbsp; PM TO 11:00 PM; &nbsp;NO FOOD ; ALCOHOLIC BEVERAGES WILL BE SOLD: COPIES OF 2015 ALCOHOLIC BEVERAGE LICENSE: 16-0278 AND 501 (C) (3) SUBMITTED.; 12-10-2015 - APPROVED, PROCESSED, MAILED TO: MS. CORA INGRIM: 8900 MONTGOMERY AVENUE, CHEVY CHASE, MD 20815-4704; COPY SENT TO IMAGING ON THIS DATE.","2015-12-07T02:12:43.000","2015-12-10T09:12:36.000","2016-01-30T12:01:00.000","Active",,"7931",,"CONNECTICUT","AVE",,"CHEVY CHASE","MD","20815","38.990219","-77.076865",,"POINT (-77.076865 38.990219)"
"224405","UPPER MONTGOMERY COUNTY VOLUNTEER FIRE DEPARTMENT","SANTA BREAKFAST: FROM 8:00AM TO NOON: FOOD WILL BE SERVED ( NOTE: COPY OF FOOD SERVICE FACILITY LICENSE: 2567 AND TAX EXEMPT CERTIFICATE: 33044315 SUBMITTED) ; 11-18-2015 - PROCESSED, MAILED TO: ANNA BAUER: 19801 BEALLSVILLE ROAD, BEALLSVILLE, MD 20839; COPY SENT TO IMAGING ON THIS DATE(JR)","2015-11-17T07:11:35.000","2015-11-18T09:11:30.000","2015-12-05T12:12:00.000","Active",,"19801",,"BEALLSVILLE","RD",,"BEALLSVILLE","MD","20839","39.180112","-77.411687",,"POINT (-77.411687 39.180112)"
"224345","ST FRANCIS OF ASSISI CHURCH","HOLIDAY BAZAAR: FROM : 9:00 AM - 3:00 PM ( NOTE: FOOD WILL BE SERVED - COPY OF FOOD LICENSE : 2330 SUBMITTED; COPY OF TAX EXEMPTION CERTIFICATE: 29023109 - SUBMITTED; NO ALCOHOLIC BEVERAGES ): MR. MORAN; 11-05-2015 - PROCESSED, MAILED TO: ST FRANCIS OF ASSISI CHURCH : 6701 MUNCASTER MILL ROAD, DERWOOD, MD 20855 ; COPY SENT TO IMAGING ON THIS DATE.","2015-11-05T07:11:34.000","2015-11-05T09:11:04.000","2015-11-14T12:11:00.000","Active",,"6701",,"MUNCASTER MILL","RD",,"ROCKVILLE","MD","20855","0","0",,"POINT (0 0)"
"224165","DROTT LODGE #168","ANNUAL SWEDISH BAZAAR: FROM: 11:00 AM TO 2:30 PM, NO ALCOHOLIC BEVERAGE, COPY OF FOOD LICENSE RECEIPT AND 501 (c) (8) SUBMITTED ( NOTE: BAZAAR WILL BE HELD ON THE ST JAMES EPISCOPIAL CHURCH PARISH HALL) ;&nbsp; 10-21-2015 - PROCESSED, MAILED TO: CAROLL WHITLEY : 4600 CONNECTICUT AVENUE, #819; WASHINGTON, DC 20008; COPY SENT TO IMAGING ON THIS DATE (JR)","2015-10-08T01:10:15.000","2015-10-21T10:10:58.000","2015-11-07T12:11:00.000","Active",,"11815",,"SEVEN LOCKS","RD",,"POTOMAC","MD","20854","39.050411","-77.162854",,"POINT (-77.162854 39.050411)"
"224225","POTOMAC SOCCER ASSOCIATION","SOCCER TOURNAMENT: FROM; 8:00 AM TO 5:00 PM ( NO FOOD OR ALCOHOLIC BEVERAGES SERVED) TAX EXEMPT CERTIFICATE SUBMITTED.; 10-14-2015 . YOUTH SOCCER TOURNAMENT.

DATES ARE NOVEMBER 14,15,21,22.ONLY","2015-10-15T12:10:18.000","2015-10-20T09:10:11.000","2015-11-22T12:11:00.000","Active",,"14660",,"HUGHES","RD",,"POOLESVILLE","MD","20837","39.095431","-77.411767",,"POINT (-77.411767 39.095431)"
"224105","SAINT ANDREW ROMANIAN ORTHODOX CHURCH","ROMANIAN FOOD FESTIVAL: OCTOBER 9TH - 11TH DURING THE HOURS OF 10:00AM&nbsp; - 8:00 PM EXCLUDING FRIDAY WHICH WILL BE: 2: 00 PM TO 6:00 PM .( NOTE: COPY OF FOOD LICENSE RECEIPT, ALCOHOL LICENSE, FESTIVAL LOGISTICS PLAN AND SITE PLAN SUBMITTED - MR. MORAN. ; 09-29-2015 - PROCESSED,PICKED UP, COPY SENT TO IMAGING ON THIS DATE.","2015-09-29T11:09:58.000","2015-09-29T03:09:47.000","2015-10-11T12:10:00.000","Active",,"9111",,"RIVER","RD",,"POTOMAC","MD","20854","39.005155","-77.186128",,"POINT (-77.186128 39.005155)"
"224006","GLOBAL MISSION CHURCH","CHURCH BAZAAR .&nbsp;OCTUBER 3 FROM 08:00AM TO 4:00PM ( NO ALCHOLIC BEVERAGE.","2015-09-04T12:09:43.000","2015-09-10T09:09:18.000","2015-10-03T12:10:00.000","Active",,"13421",,"GEORGIA","AVE",,"SILVER SPRING","MD","20906","39.077773","-77.069533",,"POINT (-77.069533 39.077773)"
"223945","TARGET COMMUNITY & EDUCATIONAL SERVICES INC","BULL ROAST AND RAFFLE FUNDRAISER FROM 2:00 TO 6:00 PM: COPY OF FOOD AND ALCOHOLIC BEVERAGE LICENSES SUBMITTED.; 09-04-2015- PROCESSED, MAILED TO: MS. SANDY SIPES - TARGET COMMUNITY &amp; EDUCATIONAL SERVICES INC - &nbsp;111 STONER AVENUE, WESTMINSTER, MD 21157 ; COPY SENT TO IMAGING ON THIS DATE.","2015-09-02T07:09:20.000","2015-09-04T06:09:41.000","2015-09-27T12:09:00.000","Active",,"23730",,"FREDERICK","RD",,"CLARKSBURG","MD","20871","39.244226","-77.290708",,"POINT (-77.290708 39.244226)"
"223865","ST ROSE OF LIMA PARISH","ANNUAL FALL FIESTA FUNDRAISER SATURDAY SEPT.&nbsp;19 FROM 08:00 AM TO 4:00 PM - FOOD AND ALCOLHOLIC BEVERAGES WILL BE SERVED.","2015-08-28T12:08:33.000","2015-09-01T09:09:21.000","2015-09-19T12:09:00.000","Active",,"11701",,"CLOPPER","RD",,"GAITHERSBURG","MD","20878","39.149816","-77.241888",,"POINT (-77.241888 39.149816)"
"223785","THE BERNIE HOUSE","ANUNUAL MUSIC AND ART FUNDRAISING EVENT. FROM FRIDAY 3:00PM TO SUNDAY SEPTEMBER 27 2:00AM","2015-08-19T02:08:21.000","2015-08-27T01:08:31.000","2015-09-27T12:09:00.000","Active",,"11820",,"HAWKES","RD",,"CLARKSBURG","MD","20871","39.253772","-77.247829","THE HOMETOWN GET DOWN IS A MISIC AND ARTS FUNDRAISING EVENT.","POINT (-77.247829 39.253772)"
"223645","CALLEVA INC","HAUNTED FOREST ATTRACTION: OCTOBER: 2ND - 31ST - FROM 6:00 PM TO 10:30 PM ( NOTE: FOOD WILL BE SERVED- COPY OF FOOD LICENSE SUBMITTED) ; 08-07-2015 - PROCESSED, MAILED TO : CALLEVA INC - 13015 RILEYS LOCK ROAD, POOLESVILLE, MD 20837; COPY SENT TO IMAGING ON THIS DATE.","2015-08-04T10:08:18.000","2015-08-07T07:08:02.000","2015-10-31T12:10:00.000","Active",,"19120",,"MARTINSBURG","RD",,"DICKERSON","MD","20842","39.179946","-77.47661",,"POINT (-77.47661 39.179946)"
"223545","APROPOLITAN YOUTH ASSOCIATION","AFRICAN CULTURAL FESTIVAL:&nbsp; FROM: 1:&nbsp;00 PM TO 8: 00 PM&nbsp; ON AUGUST 8TH &amp; 9TH - FOOD WILL BE SERVED - NO EVIDENCE OF FOOD LICENSE SUBMITTED.; 07-27-2015 -&nbsp; COPY OF LIST OF VENDORS SUBMITTED - PROCESSED, MAILED TO : ENIOLA OLUMIDE - 1237 DALTON ROAD, PARKVILLE, MD 21234 ; COPY SENT TO IMAGING ON THIS DATE.","2015-07-14T09:07:00.000","2015-07-27T07:07:16.000","2015-08-09T12:08:00.000","Active",,"1",,"VETERANS","PL",,"SILVER SPRING","MD","20910","38.997495","-77.024552",,"POINT (-77.024552 38.997495)"
"223305","ALLEN CHAPEL A.M.E.CHURCH","MUSIC &amp; CULTURAL FESTIVAL : 3:00 PM TO 7:00 PM ( FOOD SERVED - FOOD LICENSE RECEIPT SUBMITTED) ; 06-15-2015- PROCESSED, PICKED UP, COPY SENT TO IMAGING ON THIS DATE.","2015-06-12T09:06:48.000","2015-06-15T12:06:16.000","2015-06-20T12:06:00.000","Active",,"2518",,"FAIRLAND","RD",,"SILVER SPRING","MD","20904","39.077399","-76.958301",,"POINT (-76.958301 39.077399)"
"223165","CALLEVA","FUNDRAISER - FOOD AND ALCHOLIC LICENSES SUBMITTED: FROM: 6:00 PM TO 10: 00PM ; 06-04-2015- PROCESSED, MAILED TO: AMANDA RUCHEL -13015 RILEYS LOCK ROAD, ROOLESVILLE, MD 20837; COPY SENT TO IMAGING ON THIS DATE.","2015-05-29T03:05:24.000","2015-06-04T10:06:52.000","2015-06-27T12:06:00.000","Active",,"19120",,"MARTINSBURG","RD",,"DICKERSON","MD","20842","39.179946","-77.47661",,"POINT (-77.47661 39.179946)"
"223167","CALLEVA","FUNDRAISER - FOOD AND ALCHOLIC LICENSES SUBMITTED: FROM: 6:00 PM TO 10: 00PM ; 06-04-2015- PROCESSED, MAILED TO: AMANDA RUCHEL -13015 RILEYS LOCK ROAD, ROOLESVILLE, MD 20837; COPY SENT TO IMAGING ON THIS DATE.","2015-05-29T03:05:24.000","2015-06-04T10:06:33.000","2015-08-22T12:08:00.000","Active",,"19120",,"MARTINSBURG","RD",,"DICKERSON","MD","20842","39.179946","-77.47661",,"POINT (-77.47661 39.179946)"
"223166","CALLEVA","FUNDRAISER - FOOD AND ALCHOLIC LICENSES SUBMITTED: FROM: 6:00 PM TO 10: 00PM ; 06-04-2015- PROCESSED, MAILED TO: AMANDA RUCHEL -13015 RILEYS LOCK ROAD, ROOLESVILLE, MD 20837; COPY SENT TO IMAGING ON THIS DATE.","2015-05-29T03:05:24.000","2015-06-04T10:06:15.000","2015-07-25T12:07:00.000","Active",,"19120",,"MARTINSBURG","RD",,"DICKERSON","MD","20842","39.179946","-77.47661",,"POINT (-77.47661 39.179946)"
"223025","WOMEN'S BOARD MED STAR MOTGOMERY MEDICAL CENTER","ANNUAL PICINIC &amp; BAZAAR FUNDRAISER : FROM : 10:00 AM TO 8:00 PM - FOOD LICENSE RECEIPT SUBMITTED; SPECIAL EVENT PERMIT SUBMITTED. 05-20-2015 - PROCESSED, MAILED TO: WOMEN'S BOARD&nbsp; MED STAR MONTGOMERY MEDICAL CENTER HOSPITAL - 18101 PRINCE PHILIP DRIVE, OLNEY, MD 20832 ; COPY SENT TO IMAGING ON THIS DATE.","2015-05-19T03:05:55.000","2015-05-20T09:05:37.000","2015-07-28T12:07:00.000","Active",,"2801",,"OLNEY SANDY SPRING","RD",,"OLNEY","MD","20832","39.150907","-77.058205",,"POINT (-77.058205 39.150907)"
"222945","AMERICAN LEGION POST 68","CIRCUS - FOOD WILL BE SERVED - NO FOOD PERMIT OR CIRCUS INFORMATION SUBMITTED. ; CIRCUS - NO INFORMATION SUBMITTED: 1- 13,026 SQFT TENT FOR TWO DAYS - STARTING: 7:00 AM TO 4:00 PM ON MAY 28 TH &amp; 29TH. ; U &amp; O : 336669 ; 05-18-2015 - PROCESSED, MAILED TO: AMERICAN LEGION POST 68 - P O BOX 426. OLNEY, MD 20830; COPY SENT TO IMAGING ON THIS DATE.","2015-05-12T10:05:28.000","2015-05-20T09:05:05.000","2015-05-29T12:05:00.000","Active",,"18101",,"PRINCE PHILIP","DR",,"OLNEY","MD","20832","39.153871","-77.054222",,"POINT (-77.054222 39.153871)"
"222905","SANDY SPRING MUSEUM","STRAWBERRY FAIR: FROM: 10:00 AM - 5:00 PM ( FOOD AND ALCHOLIC BEVERAGES SERVED - NO APPROVED LICENSES SUBMITTED) ; 05-06-2015 - PROCESSED, MAILED TO : ALLISON WEISS - SANDY SPRING MUSEUM&nbsp; - 17901 BENTLEY ROAD, SANDY SPRING, MD 20860 ; COPY SENT TO IMAGING ON THIS DATE.","2015-05-05T02:05:48.000","2015-05-06T10:05:45.000","2015-06-06T12:06:00.000","Active",,"17901",,"BENTLEY","RD",,"SANDY SPRING","MD","20860","39.149705","-77.021459",,"POINT (-77.021459 39.149705)"
"222745","POTOMAC UNITED METHODIST CHURCH","CHARITY FUNDRAISER:&nbsp; FROM: 10:00 AM TO 4:00 PM ( FOOD WILL BE SERVED - FOOD LICENSE RECEIPT SUBMITTED) ;&nbsp; 04-22-2015- PROCESSED, MAILED TO: VICKIE COOPER - 9701 CLYDESDALE STREET, POTOMAC, MD 20854 ; COPY SENT TO IMAGING ON THIS DATE.","2015-04-17T10:04:38.000","2015-04-22T08:04:51.000","2015-05-16T12:05:00.000","Active",,"9908","S","GLEN","RD",,"POTOMAC","MD","20854","39.027197","-77.205928",,"POINT (-77.205928 39.027197)"
"222765","ST ANDREW ROMANIAN ORTHDOX CHURCH","FOOD FESTIVAL: FROM : 10:00 AM TO 8:00 PM DAILY - FOOD AND ALCOHOLIC BEVERAGES WILL BE SERVED ( NOTE: APPLICATIONS FOR FOOD AND ALCOHOLIC BEVERAGES SUBMITTED) ; 04-22-2015- PROCESSED, MAILED&nbsp;TO ST ANDREW ROMANIAN ORTHDOX CHURCH - 9111RIVER ROAD,POTOMAC , MD 20854&nbsp;COPY EMAILED TO: sdima@verizon.net ; COPY SENT TO IMAGING ON THIS DATE.","2015-04-17T12:04:11.000","2015-04-22T08:04:09.000","2015-05-17T12:05:00.000","Active",,"9111",,"RIVER","RD",,"POTOMAC","MD","20854","39.005155","-77.186128",,"POINT (-77.186128 39.005155)"
"222625","WESTBROOK ELEMENTARY SCHOOL","CARNIVAL : TIME: 3:00 PM TO 7:00 PM ( NOTE :CONTRACT SUBMITTED, SPECIAL EVENTS PERMIT REQUIRED.) ; 04-13-2015-SPECIAL EVENTS CERTIFICATE RECEIVED ON THIS DATE,&nbsp;PROCESSED, EMAILED, MAILED TO: JULIE CRAIN - 5205 ABINGDON ROAD, BETHESDA, MD 20816 - 

Jackie,

&nbsp;

I have approved the Application for Benefit Performance for the Westbrook PTA License 222625.

&nbsp;

I am unable to access Hansen again so you will have to approve it.

&nbsp;

Please put in your notations and make the applicant aware:

&nbsp;

The Benefit Performance Permit is granted by the Department of Permitting Services, however, this permit does not express or imply to the public that food that is being sold is safe for consumption or play equipment, like the Excalibur Castle","2015-04-01T10:04:49.000","2015-04-13T02:04:49.000","2015-05-01T12:05:00.000","Active",,"5110",,"ALLAN","TER",,"BETHESDA","MD","20816","0","0",,"POINT (0 0)"
"222665","ST GEORGE GREEK CHURCH","GREEK FESTIVAL: FORM 10:00 AM TO 11:00 PM -NOTE: &nbsp;FOOD AND ALCOHOLIC BEVERAGES SOLD, 04-08-2015 PROCESSED,MAILED, SENT TO IMAGING ON THIS DATE.","2015-04-03T03:04:58.000","2015-04-08T11:04:53.000","2015-05-03T12:05:00.000","Active",,"7701",,"BRADLEY","BLVD",,"BETHESDA","MD","20817","39.013569","-77.157217",,"POINT (-77.157217 39.013569)"
"222505","THE WOMAN'S CLUB OF CHEVY CHASE","ART SHOW: &nbsp;FOOD SERVICE CERTIFICATE; 505 ; ALCOHOLIC BEVERAGE LICENSE; 15-0367( VARIOUS TIMES DURING&nbsp; STARTING ON APRIL 10; 2015) ; NOTE: PAYMENT REQUIRED PRIOR TO RELEASE; 04-08-2015- PAYMENT RECEIVED AND PROCESS ON THIS DATE.; 04-08-2018 - PROCESSED, MAILED TO: MARIE POWELL - 14658 KELMSCOT DRIVE, SILVER SPRING, MD 20906-1843; COPY SENT TO IMAGING ON THIS DATE.","2015-03-24T01:03:00.000","2015-04-08T01:04:42.000","2015-04-12T12:04:00.000","Active",,"7931",,"CONNECTICUT","AVE",,"CHEVY CHASE","MD","20815","38.990219","-77.076865",,"POINT (-77.076865 38.990219)"
"222545","POTOMAC SOCCER ASSOCIATION","SOCCER TOURNAMENT: FROM; 8:30 AM TO 7:00 PM ( NO FOOD OR ALCOHOLIC BEVERAGES SERVED) TAX EXEMPT CERTIFICATE SUBMITTED.; 03-31-2015 - PROCESSED, MAILED TO: POTOMAC SOCCER ASSOCIATION - P O BOX 60227, POTOMAC, MD 20859; COPY SENT TO IMAGING ON THIS DATE.","2015-03-27T12:03:25.000","2015-03-31T09:03:30.000","2015-05-24T12:05:00.000","Active",,"14660",,"HUGHES","RD",,"POOLESVILLE","MD","20837","39.095431","-77.411767",,"POINT (-77.411767 39.095431)"
"222185","UPPER MONTGOMERY COUNTY VOLUNTEER FIRE DEPARTMENT","SANTA BREAKFAST: FROM&nbsp;: 8:00 AM TO 11:00 AM - FOOD SERVED - NO ALCOHOLIC BEVERAGES;&nbsp; 11-20-2014- PROCESSED, MAILED TO: ANNA BAUER - UPPER MONTGOMERY COUNTY VOLUNTEER FIRE DEPARTMENT&nbsp;AUXILIARY -&nbsp;P.O. BOX 553, POOLESVILLE, MD 20837; COPY SENT TO IMAGING ON THIS DATE.","2014-11-19T07:11:10.000","2014-11-20T08:11:20.000","2015-01-31T12:01:00.000","Active",,"19801",,"BEALLSVILLE","RD",,"BEALLSVILLE","MD","20839","39.180112","-77.411687",,"POINT (-77.411687 39.180112)"
"222105","ST FRANCIS OF ASSISI CHURCH","HOLIDAY BAZAAR FROM: 9:00 AM TO 3:00 PM - NO ALCOHOLIC BEVERAGES SERVED/ FOOD SERVED.; 10-15-2014- PROCESSED, MAILED TO: ST FRANCIS OF ASSISI CHURCH - 6701 MUNCASTER MILL ROAD, DERWOOD MD. 20855; COPY SENT TO IMAGING ON THIS DATE.","2014-10-14T12:10:14.000","2014-10-15T10:10:14.000","2014-11-08T12:11:00.000","Active",,"6701",,"MUNCASTER MILL","RD",,"ROCKVILLE","MD","20855","0","0",,"POINT (0 0)"
"222045","ST JAMES EPISCOPAL CHURCH","ANNUAL SWEDISH BAZAAR&nbsp; - FROM 11:00 AM - 2:30 PM ; FOOD SERVED.; 10-06-2014 - PROCESSED, MAILED TO: MS CAROL A WHITLEY - 4600 CONNECTICUT AVENUE, NW&nbsp; #819, WASHINGTON, DC 20008; COPY SENT TO IMAGING ON THIS DATE.","2014-09-30T02:09:39.000","2014-10-02T07:10:51.000","2014-11-01T12:11:00.000","Active",,"11815",,"SEVEN LOCKS","RD",,"POTOMAC","MD","20854","39.050411","-77.162854",,"POINT (-77.162854 39.050411)"
"221845","St Andrew Romanian Orthodox Church","Romanian Food Festival","2014-09-15T02:09:59.000","2014-09-19T12:09:11.000","2014-09-21T12:09:00.000","Active",,"9111",,"RIVER","RD",,"POTOMAC","MD","20854","39.005155","-77.186128",,"POINT (-77.186128 39.005155)"
"221865","GLOBAL CHILDREN'S FOUNDATION","BAZAAR -FROM 9:00 AM TO 3:30 PM- FOOD WILL BE SERVED - NO ALCOHOLIC BEVERAGES.;&nbsp; 09-17-2014- PROCESSED,EMAILED TO: JUNGHEELEE3@HOTMAIL.COM, MAILED TO: JUNG HEE - GLOBAL CHILDDREN'S FOUNDATION - 13421 GEORGIA AVENUE, SILVER SPRING, MD 20906; COPY SENT TO IMAGING ON THIS DATE.","2014-09-16T08:09:46.000","2014-09-17T10:09:56.000","2014-09-20T12:09:00.000","Active",,"13421",,"GEORGIA","AVE",,"SILVER SPRING","MD","20906","39.077773","-77.069533",,"POINT (-77.069533 39.077773)"
"221825","ST ROSE OF LIMA PARISH","ANNUAL FALL FIESTA FUNDRAISER&nbsp; SATURDAY SEPT. 24 FROM 10:00 AM TO 4:00 PM - FOOD AND ALCOLHOLIC BEVERAGES WILL BE SERVED.","2014-09-12T12:09:33.000","2014-09-16T09:09:14.000","2014-09-27T12:09:00.000","Active",,"11701",,"CLOPPER","RD",,"GAITHERSBURG","MD","20878","39.149816","-77.241888",,"POINT (-77.241888 39.149816)"
"221785","THE BERNIE HOUSE","GRASSROOTS MUSIC &amp; ARTS - STARTING OCTOBER 3, @ 3:00PM TO OCTOBER 5TH @2:00AM - FOOD &amp; ALCHOLIC BEVERAGES SERVED","2014-09-08T11:09:35.000","2014-09-11T09:09:25.000","2014-10-05T12:10:00.000","Active",,"11820",,"HAWKES","RD",,"CLARKSBURG","MD","20871","39.253772","-77.247829",,"POINT (-77.247829 39.253772)"
"221745","BURTONSVILLE VOLUNTEER FIRE DEPARTMENT INC","ANNUAL FUND RAISING CARNIVAL: FROM: 6:30 PM TO 11:00PM - WEEKDAYS ; SUNDAY: 2:00 - 8:00 PM;08-19-2014 

Sec. 59-A-6.5 (b)(2) A benefit performance must not be lcoated within 600 feet of any dwelling.

Sec. 59-A-6.5 (c) The restrictions of subsection (b) do not apply to a benefit performance conducted on property which is occupied by .... a fire department .... 

Referring to the Montgomery County Zoning Ordinance and the application submitted the site is approved.

Zoning Inspector approves this permit contingent upon event organizer ensuring that the carnival company meets all safety regulations required by Federal, State and Local Laws to include vendors associated with the event prior to the start of the event. 

Enjoined within this requirement is ensuring that food service licenses and point of sale licenses are acquired before the start of the event.","2014-08-15T07:08:04.000","2014-08-19T03:08:53.000","2014-09-20T12:09:00.000","Active",,,,,,,,,,"0","0","Corner of Sandy Spring Road,(rt 198) and Start Pointe Lane, Burtonsville, MD","POINT (0 0)"
"221705","MONTGOMERY SOCCER  INC","YOUTH SOCCER FESTIVAL: 7:30 AM TO 7:30 PM&nbsp;-NOTE:NOT ENGAGED IN PREPARATION/SALE OF FOOD.","2014-08-11T09:08:04.000","2014-08-11T01:08:42.000","2014-09-01T12:09:00.000","Active",,"14660",,"HUGHES","RD",,"POOLESVILLE","MD","20837","39.095431","-77.411767",,"POINT (-77.411767 39.095431)"
"221645","NIGERIAN YOUTH ASSOCIATION OF MARYLAND","AFRICAN FESTIVAL","2014-07-31T11:07:46.000","2014-08-08T08:08:45.000","2014-08-10T12:08:00.000","Active",,,,,,,,,,"0","0","SSCB VETERANS PLAZA ELLSWORTH DRIVE","POINT (0 0)"
"221665","TARGET COMMUNITY & EDUCATIONAL SERVICES INC","BULL ROAST AND RAFFLE FUNDRAISER -FROM: 2:00&nbsp; TO 6:00 PM","2014-08-06T10:08:38.000","2014-08-08T01:08:13.000","2014-09-28T12:09:00.000","Active",,"23730",,"FREDERICK","RD",,"CLARKSBURG","MD","20871","39.244226","-77.290708",,"POINT (-77.290708 39.244226)"
"221625","CHILDREN OF PERSIA","LIVE MUSIC, DJ, DANCE BETWEEN: 11:00 AM - 5:00 PM; FOOD WILL BE SERVED - NO ALCOHOLIC BEVERAGE.","2014-07-30T10:07:24.000","2014-07-31T08:07:04.000","2014-09-21T12:09:00.000","Active",,,,,,,,,,"0","0","NORFOLK AVENUE, BETHESDA","POINT (0 0)"
"221545","CALLEVA INC","HAUNTED FOREST/HAYRIDE - OCTOBER: 3,4,10,11,16,17,18,23,24,25,30,31, NOV.1 -TAX EXEMPT CERTIFICATE AND FOOD LICENSE SUBMITTED - FROM: 7:00 TO 10:00 PM","2014-07-10T01:07:43.000","2014-07-15T08:07:48.000","2014-11-01T12:11:00.000","Active",,"19120",,"MARTINSBURG","RD",,"DICKERSON","MD","20842","39.179946","-77.47661",,"POINT (-77.47661 39.179946)"
"221407","CALLEVA","6:00 PM TO 10:00 PM FUNDRAISER DINNER.","2014-06-10T03:06:40.000","2014-06-12T08:06:47.000","2014-08-23T12:08:00.000","Active",,"19120",,"MARTINSBURG","RD",,"DICKERSON","MD","20842","39.179946","-77.47661",,"POINT (-77.47661 39.179946)"
"221405","CALLEVA","6:00 PM TO 10:00 PM FUNDRAISER DINNER.","2014-06-10T03:06:40.000","2014-06-12T08:06:14.000","2014-06-28T12:06:00.000","Active",,"19120",,"MARTINSBURG","RD",,"DICKERSON","MD","20842","39.179946","-77.47661",,"POINT (-77.47661 39.179946)"
"221406","CALLEVA","6:00 PM TO 10:00 PM FUNDRAISER DINNER.","2014-06-10T03:06:40.000","2014-06-12T08:06:07.000","2014-07-26T12:07:00.000","Active",,"19120",,"MARTINSBURG","RD",,"DICKERSON","MD","20842","39.179946","-77.47661",,"POINT (-77.47661 39.179946)"
"221264","WOMEN'S BOARD MED STAR MONTGOMERY HOSPITAL","2014 ANNUAL PICNIC &amp; BAZAAR FUNDRAISER FROM 10:00 AM TO 8:00 PM","2014-05-20T11:05:20.000","2014-06-03T02:06:42.000","2014-07-22T12:07:00.000","Active",,"2801",,"OLNEY SANDY SPRING","RD",,"OLNEY","MD","20832","39.150907","-77.058205",,"POINT (-77.058205 39.150907)"
"221324","VELOCITY ON BEHALF OF TIGER WOOD FOUNDATION","CONCERT: FROM: 8:30 PM - 10:00 PM","2014-05-23T08:05:20.000","2014-05-28T11:05:18.000","2014-06-25T12:06:00.000","Active",,"10000",,"OAKLYN","DR",,"POTOMAC","MD","20854","38.989068","-77.202757",,"POINT (-77.202757 38.989068)"
"221204","AMERICAN LEGION POST #68","CIRCUS - JUNE 5 - 6TH FROM 4:30 PM - 7:30 PM","2014-05-13T09:05:28.000","2014-05-13T01:05:20.000","2014-06-06T12:06:00.000","Active",,"18101",,"PRINCE PHILIP","DR",,"OLNEY","MD","20832","39.153871","-77.054222",,"POINT (-77.054222 39.153871)"
"221144","POTOMAC SOCCER ASSOCIATION","SOCCER TOURNAMENT: 05-24- TO 05-25-2014","2014-05-01T03:05:45.000","2014-05-05T08:05:46.000","2014-05-25T12:05:00.000","Active",,"14660",,"HUGHES","RD",,"POOLESVILLE","MD","20837","39.095431","-77.411767",,"POINT (-77.411767 39.095431)"
"221064","SAINT GEORGE GREEK CHURCH","SPRING FUNDRAISER: FROM: NOON TO 10:00 PM","2014-04-16T10:04:20.000","2014-04-16T02:04:54.000","2014-05-03T12:05:00.000","Active",,"7701",,"BRADLEY","BLVD",,"BETHESDA","MD","20817","39.013569","-77.157217",,"POINT (-77.157217 39.013569)"
"221044","POTOMAC UNITED METHODIST CHURCH","STRAWBERRY FESTIVAL: FROM 10:00 AM - 4:00PM","2014-04-15T09:04:10.000","2014-04-15T01:04:57.000","2014-05-17T12:05:00.000","Active",,"9908","S","GLEN","RD",,"POTOMAC","MD","20854","39.027197","-77.205928",,"POINT (-77.205928 39.027197)"
"220944","SANDY SPRING MUSEUM","33RD ANNUAL STRAWBERRY FESTIVAL FROM: 10:00 AM - 5:00 PM","2014-04-02T10:04:55.000","2014-04-08T03:04:43.000","2014-06-07T12:06:00.000","Active",,"17901",,"BENTLEY","RD",,"SANDY SPRING","MD","20860","39.149705","-77.021459",,"POINT (-77.021459 39.149705)"
"220964",,"CARNIVAL&nbsp;- 5/2/14&nbsp;- 2pm&nbsp;until 7pm - FOOD SERVICE REQUIRED","2014-04-03T02:04:37.000","2014-04-07T02:04:08.000","2014-05-02T12:05:00.000","Active",,"5110",,"ALLAN","TER",,"BETHESDA","MD","20816","38.959811","-77.10313",,"POINT (-77.10313 38.959811)"
"220785","STONE RIDGE SCHOOL","USED BOOK SALE - FRIDAY - APRIL 11TH TO MONDAY APRIL 14,2014","2014-03-21T10:03:24.000","2014-03-21T02:03:47.000","2014-04-14T12:04:00.000","Active",,"9101",,"ROCKVILLE","PIKE",,"BETHESDA","MD","20814","39.006657","-77.094713",,"POINT (-77.094713 39.006657)"
"220804","THE WOMAN'S CLUB OF CHEVY CHASE","COMMUNITY ART SHOW- FROM 2:&nbsp; PM -9:00PM FRI,SAT.: 11:00-5:00 PM, SUN.: 1:00-5:00PM","2014-03-21T12:03:08.000","2014-03-21T02:03:08.000","2014-03-30T12:03:00.000","Active",,"7931",,"CONNECTICUT","AVE",,"CHEVY CHASE","MD","20815","38.990219","-77.076865",,"POINT (-77.076865 38.990219)"
"220664","GLOBAL MISSION CHURCH","April 26th 2014 Bazaar/GLOBAL MISSION CHURCH","2014-03-12T03:03:35.000","2014-03-14T12:03:48.000","2014-04-26T12:04:00.000","Active","LOW","13421",,"GEORGIA","AVE",,"SILVER SPRING","MD","20906","39.077773","-77.069533",,"POINT (-77.069533 39.077773)"
"220585","SHRINE OF ST JUDE CHURCH","TOT SALE - MARCH 9,2014 FROM 8:00 AM TO 2:00 PM","2014-03-04T11:03:11.000","2014-03-07T08:03:00.000","2014-03-09T12:03:00.000","Active",,"12701",,"VEIRS MILL","RD",,"ROCKVILLE","MD","20853","39.065471","-77.096935",,"POINT (-77.096935 39.065471)"
"220564","WOMAN'S CLUB OF CHEVY CHASE","COMEDY SHOW FUNDRAISER FOR CHARITY - MARCH 8,2014 FORM 8:00 PM TO 11:00 PM","2014-02-28T10:02:49.000","2014-03-06T07:03:12.000","2014-03-08T12:03:00.000","Active",,"7931",,"CONNECTICUT","AVE",,"CHEVY CHASE","MD","20815","38.990219","-77.076865",,"POINT (-77.076865 38.990219)"
"220524","HOLY REDEEMER CATHOLIC CHURC AND SCHOOL","DINNER, DANCE AUCTION FUNDRAISER ON MARCH 15TH, 2014 FORM 6:30 PM TO 11:00 PM","2014-02-21T11:02:22.000","2014-02-24T08:02:35.000","2014-03-15T12:03:00.000","Active",,"9715",,"SUMMIT","AVE",,"KENSINGTON","MD","20895","0","0",,"POINT (0 0)"
"220504","SPECIAL LOVE","ANNUAL GALA DINNER, CASINO NIGHT, DANCING

7:30PM - 11:30PM

&nbsp;","2014-01-30T08:01:53.000","2014-02-04T09:02:58.000","2014-02-08T12:02:00.000","Active",,"7900",,"CONNECTICUT","AVE",,"CHEVY CHASE","MD","20815","38.989115","-77.078752",,"POINT (-77.078752 38.989115)"
"220324","UPPER MONTOGOMERY C. VOL FIRE DEPT.","SANTA BREAKFAST - Dec 7, 2013 8:00am - 12:00noon

Off Rt 28 Darnestown Road","2013-12-05T02:12:03.000","2013-12-06T09:12:31.000","2013-12-07T12:12:00.000","Active",,"19801",,"BEALLSVILLE","RD",,"BEALLSVILLE","MD","20839","39.180112","-77.411687",,"POINT (-77.411687 39.180112)"
"220304",,,"2013-11-25T03:11:20.000","2013-11-29T07:11:55.000","2013-12-15T12:12:00.000","Active",,"3132",,"BEL PRE","RD",,"SILVER SPRING","MD","20906","39.090374","-77.064818",,"POINT (-77.064818 39.090374)"
"220184",,"HOLIDAY BAZAAR - NOVEMBER 9, 2013 - 9AM -3PM","2013-10-10T12:10:01.000","2013-10-31T08:10:56.000","2013-11-09T12:11:00.000","Active",,"6701",,"MUNCASTER MILL","RD",,"ROCKVILLE","MD","20855","0","0",,"POINT (0 0)"
"220244","WOMANS CLUB OF CHEVY CHASE","Art &amp; Crafts Festival&nbsp;&nbsp;&nbsp;&nbsp; Nov. 9th&nbsp; 10am---4PM","2013-10-30T08:10:43.000","2013-10-31T08:10:17.000","2013-11-16T12:11:00.000","Active",,"7931",,"CONNECTICUT","AVE",,"CHEVY CHASE","MD","20815","38.990219","-77.076865",,"POINT (-77.076865 38.990219)"
"219985","CAMP CALLEVA, INC.","FARM TO TABLE DINNER / AUGUST 24, 2013 / 6PM - MIDNIGHT","2013-08-16T09:08:29.000","2013-10-22T04:10:18.000","2013-08-24T12:08:00.000","Active",,"19120",,"MARTINSBURG","RD",,"DICKERSON","MD","20842","39.179946","-77.47661",,"POINT (-77.47661 39.179946)"
"220204","DROTT LODGE # 168","Swedish Bazaar:&nbsp; Nov. 2","2013-10-17T10:10:32.000","2013-10-21T10:10:09.000","2013-11-02T12:11:00.000","Active",,"11815",,"SEVEN LOCKS","RD",,"POTOMAC","MD","20854","39.050411","-77.162854",,"POINT (-77.162854 39.050411)"
"220084",,"SADIE HAWKINS BARN DANCE&nbsp;/ OCTOBER 5, 2013 / 8PM - 11PM","2013-09-26T10:09:53.000","2013-10-01T09:10:35.000","2013-10-05T12:10:00.000","Active",,"13431",,"LEWISDALE","RD",,"CLARKSBURG","MD","20871","39.290397","-77.278554",,"POINT (-77.278554 39.290397)"
"220064","EMPOWERING THROUGH DEVELOPMENT GROWTH AND EDUCATION","CONCERT AND ARTS BENEFIT SHOW 

9/20/13 4PM TO MIDNIGHT&nbsp;&amp; 9/21/13 9AM TO 1AM","2013-09-04T02:09:32.000","2013-09-09T08:09:39.000","2013-09-21T12:09:00.000","Active",,"11820",,"HAWKES","RD",,"CLARKSBURG","MD","20871","39.253772","-77.247829",,"POINT (-77.247829 39.253772)"
"220065","CHILDREN OF PERSIA","DANCE -&nbsp;SEPTEMBER 22, 2013 11AM - 4PM","2013-09-04T02:09:58.000","2013-09-05T08:09:29.000","2013-09-22T12:09:00.000","Active",,,,,,,,,,"0","0","ON NORFOLK AVE BETWEEN WOODMONT AVE AND ST ELMO AVE","POINT (0 0)"
"220044","ST ROSE OF LIMA PARISH","St. Rose of Lima Annual Fall Fiesta","2013-08-30T01:08:19.000","2013-09-04T03:09:37.000","2013-10-28T12:10:00.000","Active","HIGH","11701",,"CLOPPER","RD",,"GAITHERSBURG","MD","20878","39.149816","-77.241888",,"POINT (-77.241888 39.149816)"
"220004","BURTONSVILLE VOLUNTEER FIRE DEPT.","CARNIVAL / SEPTEMBER 12th through SEPTEMBER 21st.

6:30pm to 10pm&nbsp;WEEKDAYS / 6:30pm - 11pm FRIDAY AND SATURDAY","2013-08-26T09:08:03.000","2013-09-04T01:09:41.000","2013-09-21T12:09:00.000","Active",,,,,,,,,,"0","0","corner of Sandy Spring Rd. and Start Pointe Lane Burtonsville MD","POINT (0 0)"
"219984","CAMP CALLEVA, INC.","FARM TO TABLE DINNER / SEPTEMBER 14, 2013 / 6PM - MIDNIGHT","2013-08-16T09:08:29.000","2013-08-22T11:08:44.000","2013-09-14T12:09:00.000","Active",,"19120",,"MARTINSBURG","RD",,"DICKERSON","MD","20842","39.179946","-77.47661",,"POINT (-77.47661 39.179946)"
"219886","NIGERIAN YOUTH","AFRICAN CULTURAL FESTIVAL / AUGUST 10 - 11 2013 /","2013-07-29T09:07:53.000","2013-08-06T11:08:59.000","2013-08-11T12:08:00.000","Active",,,,,,,,,,"0","0","VETERANS PLAZA / ELLSWORTH DR","POINT (0 0)"
"219884","TARGET COMMUNITY","BULL ROAST &amp; RAFFLE FUNDRAISER / SEPTEMBER 29, 2013 / 2PM - 6PM","2013-07-29T09:07:16.000","2013-07-31T04:07:42.000","2013-09-29T12:09:00.000","Active",,"23730",,"FREDERICK","RD",,"CLARKSBURG","MD","20871","39.244226","-77.290708",,"POINT (-77.290708 39.244226)"
"219885","MONGTOMERY SOCCER, INC.","SOCCER YOUTH FESTIVAL, AUGUST 31, 2013 - SEPTEMBER 2, 2013 / 7:30AM -7:30PM","2013-07-29T09:07:49.000","2013-07-31T04:07:02.000","2013-09-02T12:09:00.000","Active",,"14660",,"HUGHES","RD",,"POOLESVILLE","MD","20837","39.095431","-77.411767",,"POINT (-77.411767 39.095431)"
"219724",,"FARM TO TABLE DINNER","2013-07-02T01:07:39.000","2013-07-10T08:07:17.000","2013-07-13T12:07:00.000","Active",,"19120",,"MARTINSBURG","RD",,"DICKERSON","MD","20842","39.179946","-77.47661",,"POINT (-77.47661 39.179946)"
"219725",,"MARKOFF'S HAUNTED FOREST","2013-07-02T01:07:45.000","2013-07-10T08:07:16.000","2013-10-31T12:10:00.000","Active",,"19120",,"MARTINSBURG","RD",,"DICKERSON","MD","20842","39.179946","-77.47661",,"POINT (-77.47661 39.179946)"
"219564","PTA",,"2013-05-24T03:05:23.000","2013-06-06T11:06:33.000","2013-06-01T12:06:00.000","Active","HIGH","4810",,"OXFORD","ST",,"GARRETT PARK","MD","20896","39.032957","-77.096607",,"POINT (-77.096607 39.032957)"
"219584","Women's Board MedStar Montgomery Hospital","Annual Picnic and Bazaar Fundraiser to benefit Med Star Montgomery Hospital-July 23, 2013 - 10:00am to 8:pm","2013-05-30T11:05:35.000","2013-06-05T04:06:12.000","2013-07-23T12:07:00.000","Active",,"18101",,"PRINCE PHILIP","DR",,"OLNEY","MD","20832","39.153871","-77.054222",,"POINT (-77.054222 39.153871)"
"219524","Global Mission Church","Saturday 5/25/13&nbsp;&nbsp;&nbsp; 8:00AM to 8:00PM Basketball Tournament","2013-05-22T10:05:01.000","2013-05-23T02:05:47.000","2013-05-25T12:05:00.000","Active",,"13421",,"GEORGIA","AVE",,"SILVER SPRING","MD","20906","39.077773","-77.069533",,"POINT (-77.069533 39.077773)"
"219404","GLOBAL CHRILDEN CHURCH","BAZAAR &amp; YARD SALE&nbsp; 8:AM--3:PM","2013-05-10T10:05:18.000","2013-05-14T10:05:41.000","2013-06-01T12:06:00.000","Active",,"13421",,"GEORGIA","AVE",,"SILVER SPRING","MD","20906","39.077773","-77.069533",,"POINT (-77.069533 39.077773)"
"219424","Poolesville Polo Grounds","Potomac Soccer Association-May 25, 2013&nbsp; (8:00am to 6:00pm) thru May 26, 2013, (8:00am to 3:00pm)","2013-05-10T04:05:39.000","2013-05-14T08:05:45.000","2013-05-25T12:05:00.000","Active",,,,,,,,,,"0","0",,"POINT (0 0)"
"219364","CALLEVA, INC.","FARM TO TABLE DINNER&nbsp;/ JUNE 1, 2013 / 6PM - 10PM","2013-05-08T09:05:37.000","2013-05-10T08:05:46.000","2013-06-01T12:06:00.000","Active",,"19120",,"MARTINSBURG","RD",,"DICKERSON","MD","20842","39.179946","-77.47661",,"POINT (-77.47661 39.179946)"
"219184","Burtonsville Volunter Fire Department Auxiliary","Spaghetti Dinner-May 4, 2013-5:00pm to 7:00pm","2013-04-19T01:04:56.000","2013-05-03T12:05:59.000","2013-05-04T12:05:00.000","Active",,"13900",,"OLD COLUMBIA","PIKE",,"SILVER SPRING","MD","20904","39.085072","-76.951409",,"POINT (-76.951409 39.085072)"
"219204",,"CARNIVAL","2013-04-22T12:04:47.000","2013-04-25T10:04:57.000","2013-06-17T12:06:00.000","Active",,"6125",,"MONTROSE","RD",,"ROCKVILLE","MD","20852","39.053355","-77.124888",,"POINT (-77.124888 39.053355)"
"218804",,"3 DAY WALK-A-THON, MAY 4, 2013, 7AM - MIDNIGHT","2013-03-21T12:03:34.000","2013-04-23T08:04:24.000","2013-05-05T12:05:00.000","Active",,"7901",,"MEADOWBROOK","LN",,"CHEVY CHASE","MD","20815","0","0",,"POINT (0 0)"
"219064","American Legion Post, #68","Circus (Kelly Miller Circus)&nbsp; June 4th and 5th - 4:30pm&nbsp; - 7:30pm&nbsp;&nbsp; &nbsp;&nbsp;","2013-04-12T11:04:02.000","2013-04-19T01:04:20.000","2013-06-05T12:06:00.000","Active",,"18101",,"PRINCE PHILIP","DR",,"OLNEY","MD","20832","39.153871","-77.054222",,"POINT (-77.054222 39.153871)"
"218964",,"FLEA MARKET TO INCLUDE FOOD SALES FOR FUNDRAISER","2013-04-05T12:04:33.000","2013-04-11T10:04:39.000","2013-05-18T12:05:00.000","Active",,"9908","S","GLEN","RD",,"POTOMAC","MD","20854","39.027197","-77.205928",,"POINT (-77.205928 39.027197)"
"218924","ST GEORGE GREEK CHURCH","GREEK SPRING FESTIVAL","2013-04-04T11:04:59.000","2013-04-09T08:04:48.000","2013-05-12T12:05:00.000","Active",,"7701",,"BRADLEY","BLVD",,"BETHESDA","MD","20817","39.013569","-77.157217",,"POINT (-77.157217 39.013569)"
"218844","SANDY SPRING MUSEUM","STRAWBERRY FESTIVAL / JUNE 1, 2013 10AM - 5PM","2013-03-26T08:03:29.000","2013-04-05T09:04:48.000","2013-06-01T12:06:00.000","Active",,"17901",,"BENTLEY","RD",,"SANDY SPRING","MD","20860","39.149705","-77.021459",,"POINT (-77.021459 39.149705)"
"218885","STONE RIDGE SCHOOL of THE SACRE HEART","Book Sale/ Funraiser

April 19th 8:am to 8:pm

April 20th 9:am to 6:pm

April 21th 12:pm to 6:pm

April 22th 5:pm to 8:pm","2013-04-01T03:04:54.000","2013-04-04T11:04:18.000","2013-04-22T12:04:00.000","Active",,"9101",,"ROCKVILLE","PIKE",,"BETHESDA","MD","20814","39.006657","-77.094713",,"POINT (-77.094713 39.006657)"
"218784",,,"2013-03-21T07:03:20.000","2013-03-27T08:03:13.000","2013-04-13T12:04:00.000","Active",,"9715",,"SUMMIT","AVE",,"KENSINGTON","MD","20895","0","0",,"POINT (0 0)"
"218764","Westbrook Elementary School PTA",,"2013-03-20T10:03:45.000","2013-03-27T05:03:18.000","2013-05-03T12:05:00.000","Active","HIGH","5110",,"ALLAN","TER",,"BETHESDA","MD","20816","0","0",,"POINT (0 0)"
"218845","WOMAN'S CLUB OF CHEVY CHASE","ART SHOW AND SALE / APRIL 5, 2013 2PM - 5PM AND 7PM - 9PM&nbsp;/ APRIL 6, 2013 11AM - 5 PM / 

APRIL 7, 2013 1PM - 5PM","2013-03-26T08:03:39.000","2013-03-26T09:03:28.000","2013-04-07T12:04:00.000","Active",,"7931",,"CONNECTICUT","AVE",,"CHEVY CHASE","MD","20815","38.990219","-77.076865",,"POINT (-77.076865 38.990219)"
"218724","Global Mission Church","Annual Bazaar &amp; Yard Sale&nbsp;&nbsp;&nbsp; 8:am to 3:PM&nbsp; Date: April 27th","2013-03-13T01:03:03.000","2013-03-18T10:03:16.000","2013-04-27T12:04:00.000","Active",,"13421",,"GEORGIA","AVE",,"SILVER SPRING","MD","20906","39.077773","-77.069533",,"POINT (-77.069533 39.077773)"
"218644",,"TOT SALE / MARCH 23, 2013 

8AM TO 2PM","2013-03-08T03:03:28.000","2013-03-13T08:03:59.000","2013-03-23T12:03:00.000","Active",,"12701",,"VEIRS MILL","RD",,"ROCKVILLE","MD","20853","39.065471","-77.096935",,"POINT (-77.096935 39.065471)"
"218604","Shrine of St Jude Sedality","Benefit Performance:&nbsp; Flea Market

April 4th and 5th-12 noon to 7:00pm; April 6th 9:00am to 12:30pm","2013-02-21T12:02:46.000","2013-03-01T11:03:43.000","2013-04-06T12:04:00.000","Active",,"12701",,"VEIRS MILL","RD",,"ROCKVILLE","MD","20853","39.065471","-77.096935",,"POINT (-77.096935 39.065471)"
"218544","Woman's Club of Chevy Chase","Craft's Fair.","2013-02-14T04:02:19.000","2013-02-20T04:02:14.000","2013-03-02T12:03:00.000","Active","HIGH","7931",,"CONNECTICUT","AVE",,"CHEVY CHASE","MD","20815","38.990219","-77.076865",,"POINT (-77.076865 38.990219)"
"218404","Junior Womens club of chevy chase","Benefit : Noon to Midnight 2/2/13","2013-01-18T02:01:49.000","2013-01-28T02:01:28.000","2013-02-02T12:02:00.000","Active","MED","7931",,"CONNECTICUT","AVE",,"CHEVY CHASE","MD","20815","38.990219","-77.076865",,"POINT (-77.076865 38.990219)"
"218303","UPPER MONTGOMERY CO VOL FIRE","SANTA BREAKFAST DECEMBER 8TH, 2012 FROM 8:AM TO 11:00AM","2012-11-29T09:11:57.000","2012-12-03T09:12:42.000","2012-12-08T12:12:00.000","Active",,"19801",,"BEALLSVILLE","RD",,"BEALLSVILLE","MD","20839","39.180112","-77.411687",,"POINT (-77.411687 39.180112)"
"218243","ST. FRANCIS OF ASSISI CATHOLIC CHURCH","HOLIDAY BAZAAR - NOVEMBER 10, 2012 8:30AM - 3:30PM","2012-11-07T03:11:12.000","2012-11-08T12:11:43.000","2012-11-10T12:11:00.000","Active",,"6701",,"MUNCASTER MILL","RD",,"ROCKVILLE","MD","20855","0","0",,"POINT (0 0)"
"218204","St. James Episcopal Church","Annual Swedish Bazaar-November 3, 2012-11:00 am to 3:00 pm","2012-10-17T01:10:41.000","2012-10-23T10:10:21.000","2012-11-03T12:11:00.000","Active",,"11815",,"SEVEN LOCKS","RD",,"POTOMAC","MD","20854","0","0",,"POINT (0 0)"
"218143",,,"2012-10-03T08:10:43.000","2012-10-04T02:10:42.000","2012-10-13T12:10:00.000","Active",,"2111",,"PORTER","RD",,"SILVER SPRING","MD","20910","39.001052","-77.045323",,"POINT (-77.045323 39.001052)"
"218144",,,"2012-10-03T08:10:43.000","2012-10-04T02:10:25.000","2012-10-21T12:10:00.000","Active",,"4015",,"ROSEMARY","ST",,"CHEVY CHASE","MD","20815","38.978574","-77.079898",,"POINT (-77.079898 38.978574)"
"218003","Calleva, Inc",,"2012-09-07T02:09:26.000","2012-09-18T03:09:13.000","2012-09-22T12:09:00.000","Active","MED","19120",,"MARTINSBURG","RD",,"DICKERSON","MD","20842","39.179946","-77.47661",,"POINT (-77.47661 39.179946)"
"218023","ST ROSE OF LIMA PARISH","St. Rose of Lima Annual Fall Fiesta","2012-09-07T03:09:32.000","2012-09-14T03:09:14.000","2009-10-30T12:10:00.000","Active","HIGH","11701",,"CLOPPER","RD",,"GAITHERSBURG","MD","20878","39.149816","-77.241888",,"POINT (-77.241888 39.149816)"
"217983","THE BERNIE HOUSE","CONCERT / 9-21-12 4PM - 1AM&nbsp;AND 9-23-12 / 10AM - 1AM","2012-09-05T12:09:05.000","2012-09-10T02:09:48.000","2012-09-22T12:09:00.000","Active",,"11820",,"HAWKES","RD",,"CLARKSBURG","MD","20871","39.253772","-77.247829",,"POINT (-77.247829 39.253772)"
"217963",,,"2012-09-05T07:09:30.000","2012-09-07T07:09:33.000","2012-09-29T12:09:00.000","Active",,"23730",,"FREDERICK","RD",,"CLARKSBURG","MD","20871","39.244226","-77.290708",,"POINT (-77.290708 39.244226)"
"217883",,"Annual Fundraising&nbsp; Carnival&nbsp;&nbsp; Snyder Amusements, Tami Snyder 717- 597-4871&nbsp;&nbsp; Sept 13th&nbsp; thru Spet 22rd&nbsp; 6:30pm - 10pm Monday Thru Thurdsday (Friday thru Saturday&nbsp; 6:30 - 11pm)&nbsp;&nbsp; Sunday 12 noon to 6pm.","2012-08-24T01:08:14.000","2012-09-07T05:09:14.000","2012-09-22T12:09:00.000","Active",,,,,,,,,,"0","0","Route 198 and Star Pointe Lane  Burtonsville Maryland 20866","POINT (0 0)"
"217884","B-CC RESCUE SQUAD","SHRIMP AND OYSTER FEAST / SEPTEMBER 30, 2012 / 1PM TO 6PM","2012-08-24T02:08:07.000","2012-08-31T08:08:00.000","2012-09-30T12:09:00.000","Active",,"5020",,"BATTERY","LN",,"BETHESDA","MD","20814","38.990516","-77.102856",,"POINT (-77.102856 38.990516)"
"217863","NIH RECREATION & WELFARE FOUNDATION","OUTDOOR FILM FESTIVAL - To RAISE FUNDS and Awareness for Children's Inn, Special Love, Friends of Clinical Centers..Events on AUGUST 23, 24, 25, 2012.. 

Nearest Cross Street: Old Georgetown Road

Distance to the Nearest Dwelling in Feet: 500","2012-08-23T08:08:22.000","2012-08-23T08:08:04.000","2012-08-25T12:08:00.000","Active","HIGH",,,,,,,,,"0","0","Rockville Pike - Georgetown Road - Mid Pike Plaza","POINT (0 0)"
"217824","MONGTOMERY SOCCER INC.","SCOCCER TOURNAMENT (FESTIVAL)","2012-08-07T10:08:23.000","2012-08-15T08:08:36.000","2011-09-03T12:09:00.000","Active",,"14660",,"HUGHES","RD",,"POOLESVILLE","MD","20837","39.095431","-77.411767",,"POINT (-77.411767 39.095431)"
"217643","Damascus Soccer Club","SOCCER TOURNMENT: EVANTS DATES: AUGUST 24, 2012 @12noon thru AUGUST 26, 2012 @12noon","2012-07-16T12:07:38.000","2012-08-08T04:08:25.000","2012-08-26T12:08:00.000","Active","HIGH","14660",,"HUGHES","RD",,"POOLESVILLE","MD","20837","39.095431","-77.411767",,"POINT (-77.411767 39.095431)"
"217583","Calleva",,"2012-07-10T12:07:26.000","2012-07-19T02:07:31.000","2012-10-31T12:10:00.000","Active",,"19120",,"MARTINSBURG","RD",,"DICKERSON","MD","20842","39.179946","-77.47661",,"POINT (-77.47661 39.179946)"
"217401",,,"2012-06-06T12:06:19.000","2012-07-13T09:07:15.000","2012-07-21T12:07:00.000","Active",,,,,,,,,,"0","0","SILVER SPRING CIVIC BUILDING/ONE VETERANS PLAZA","POINT (0 0)"
"217561","CALLEVA, INC.","JULY 21 2012 / 6:30PM - 10:00PM&nbsp; / FARM-TO-TABLE DINNER","2012-07-02T03:07:29.000","2012-07-10T08:07:45.000","2012-07-21T12:07:00.000","Active",,"19120",,"MARTINSBURG","RD",,"DICKERSON","MD","20842","39.179946","-77.47661",,"POINT (-77.47661 39.179946)"
"217541","WORLD ORGANIZATION FOR MEDICAL AID","JULY 1, 2012 11AM TO 9PM.&nbsp; FESTIVAL &amp; SHOWCASE","2012-06-28T10:06:21.000","2012-06-28T01:06:36.000","2012-07-01T12:07:00.000","Active",,"1",,"VETERANS","PL",,"SILVER SPRING","MD","20910","38.997495","-77.024552",,"POINT (-77.024552 38.997495)"
"217359","MONTGOMERY GENERAL HOSPITAL","Women's Board Montgomery General Hospital-Picnic and Bazaar Fundraiser to benefit.  July 24, 2012-10:00am to 8:00pm","2012-05-22T02:05:56.000","2012-06-04T10:06:14.000","2012-07-24T12:07:00.000","Active",,"18101",,"PRINCE PHILIP","DR",,"OLNEY","MD","20832","39.153871","-77.054222",,"POINT (-77.054222 39.153871)"
"217280","EMPOWER WOMEN INTERNATIONAL","Artisan Show & Pot Luck","2012-05-18T02:05:00.000","2012-05-29T10:05:32.000","2012-06-10T12:06:00.000","Active",,,,,,,,,,"0","0","SILVER SPRING CIVIC BUILDING","POINT (0 0)"
"217299","GARRETT PARK ELEMENTARY SCHOOL","SPRING FAIR PTA, JUNE 9,2012 10AM - 2PM","2012-05-18T08:05:50.000","2012-05-22T08:05:48.000","2012-06-21T12:06:00.000","Inactive",,"4810",,"OXFORD","ST",,"GARRETT PARK","MD","20896","39.032957","-77.096607",,"POINT (-77.096607 39.032957)"
"217279","YELLOW RIBBON FUND","POTOMAC HUNT RACES - MAY 20, 2012 - NOON to 5PM","2012-05-17T11:05:00.000","2012-05-17T12:05:00.000","2012-05-20T12:05:00.000","Inactive",,"14401",,"PARTNERSHIP","RD",,"POOLESVILLE","MD","20837","39.091267","-77.36012",,"POINT (-77.36012 39.091267)"
"217179","POTOMAC SOCCER TOURNAMENT","SOCCER TOURNAMENT:FROM 8:00 AM TO 6: PM","2012-04-26T11:04:47.000","2012-04-27T09:04:58.000","2012-05-27T12:05:00.000","Inactive",,"14660",,"HUGHES","RD",,"POOLESVILLE","MD","20837","39.095431","-77.411767",,"POINT (-77.411767 39.095431)"
"217098","AMERICAN LEGION POST 68","Circus-Kelly Miller Circus June 5th 4:30pm to 7:30pm","2012-04-12T10:04:00.000","2012-04-19T10:04:55.000","2012-05-19T12:05:00.000","Inactive",,"18101",,"PRINCE PHILIP","DR",,"OLNEY","MD","20832","39.153871","-77.054222",,"POINT (-77.054222 39.153871)"
"217118","CALLEVA","DINNER:FORM : 6:30PM TO 10:00 PM","2012-04-18T11:04:04.000","2012-04-19T10:04:07.000","2012-05-19T12:05:00.000","Inactive",,"19120",,"MARTINSBURG","RD",,"DICKERSON","MD","20842","39.179946","-77.47661",,"POINT (-77.47661 39.179946)"
"216938","SANDY SPRING MUSEUM","31ST ANNUAL STRAWBERRY FESTIVAL. SATURDAY JUNE 2, 2012 10AM - 5PM","2012-03-27T08:03:00.000","2012-04-05T09:04:25.000","2012-05-05T12:05:00.000","Inactive",,"17901",,"BENTLEY","RD",,"SANDY SPRING","MD","20860","39.149705","-77.021459",,"POINT (-77.021459 39.149705)"
"216998","WOMENS'CLUB OF CHEVY CHASE, MD","YARD SALE: FROM: 9:00AM TO 5:00 PM(MISSING TAX EXEMPT CERTIFICATE.)","2012-04-03T10:04:00.000","2012-04-03T01:04:00.000","2012-04-14T12:04:00.000","Inactive",,"7931",,"CONNECTICUT","AVE",,"CHEVY CHASE","MD","20815","38.990219","-77.076865",,"POINT (-77.076865 38.990219)"
"216978","GLOBAL MISSION CHURCH","ANNUAL BAZAAR/YARD SALE: FROM 8:00 - 3:30 PM","2012-04-02T10:04:00.000","2012-04-03T01:04:00.000","2012-04-28T12:04:00.000","Inactive",,"13421",,"GEORGIA","AVE",,"SILVER SPRING","MD","20906","39.077773","-77.069533",,"POINT (-77.069533 39.077773)"
"216918","SCOOT FOR SCOOTERS","5K / 1 Mile Fundraiser  May 20, 2012  10AM to 2PM","2012-03-21T07:03:00.000","2012-03-26T11:03:31.000","2012-04-25T12:04:00.000","Inactive",,,,,,,,,,"0","0","SHERWOOD HIGH SCHOOL, SANDY SPRING","POINT (0 0)"
"216919","POTOMAC UNITED METHODIST CHURC","STRAWBERRY FESTIVAL: FROM: 10:00 AM TO 4:00PM","2012-03-21T08:03:00.000","2012-03-26T08:03:00.000","2012-05-19T12:05:00.000","Inactive",,"9908","S","GLEN","RD",,"POTOMAC","MD","20854","39.027197","-77.205928",,"POINT (-77.205928 39.027197)"
"216920","WOMAN'S CLUB OF CHEVY CHASE","WCCC 37th Annual Community Art Show.  March 30, 2012 2pm-5pm; March 31, 2012 11am-5pm; April 1, 2012 1pm-5pm","2012-03-21T09:03:00.000","2012-03-22T02:03:00.000","2012-04-01T12:04:00.000","Inactive",,"7931",,"CONNECTICUT","AVE",,"CHEVY CHASE","MD","20815","38.990219","-77.076865",,"POINT (-77.076865 38.990219)"
"216818","ST JUDE CHURCH","TOT CLOTHING SALE OPEN 8AM-3PM","2012-03-08T11:03:00.000","2012-03-16T07:03:00.000","2012-04-15T12:04:00.000","Inactive",,"12701",,"VEIRS MILL","RD",,"ROCKVILLE","MD","20853","39.065471","-77.096935",,"POINT (-77.096935 39.065471)"
"216878","STONE RIDGE SCHOOL","BOOK SALE / April 20, 2012*8am - 8PM / April 21, 2012*9AM - 6PM / April 22, 2012*12PM - 6PM / April 23, 2012*5pm - 8pm","2012-03-13T03:03:00.000","2012-03-16T07:03:00.000","2012-04-23T12:04:00.000","Inactive",,"9101",,"ROCKVILLE","PIKE",,"BETHESDA","MD","20814","39.006657","-77.094713",,"POINT (-77.094713 39.006657)"
"216858","WESTBROOK ELEMENTARY SCHOOL","School Carnival  (3:00PM to 7:30PM)","2012-03-12T08:03:00.000","2012-03-14T09:03:00.000","2012-05-04T12:05:00.000","Inactive",,"5110",,"ALLAN","TER",,"BETHESDA","MD","20816","38.959811","-77.10313",,"POINT (-77.10313 38.959811)"
"216838","SAINT GEORGE GREEK CHURCH","Church Festival.  May 4 & 5, 2012 11:30am to Midnight and May 6, 2012 Noon to 11:30pm","2012-03-09T03:03:00.000","2012-03-14T08:03:00.000","2012-05-06T12:05:00.000","Inactive",,"7701",,"BRADLEY","BLVD",,"BETHESDA","MD","20817","39.013569","-77.157217",,"POINT (-77.157217 39.013569)"
"216778","BURTONSVILLE VOLUNTEER FIRE","CASINO NIGHT: MARCH 10TH,2012 FROM 6:30PM - 10:00 PM","2012-03-06T03:03:00.000","2012-03-07T06:03:00.000","2012-04-10T12:04:00.000","Inactive",,"4343",,"SANDY SPRING","RD",,"BURTONSVILLE","MD","20866","39.106495","-76.92157",,"POINT (-76.92157 39.106495)"
"216738","POOLSVLE ATHLETC ASSOC","PAA (Poolesville Athletic Assoc) Wrestling festival- 5pm-11pm- food being served by Famous Dave (pre-packaged food only)","2012-02-22T12:02:00.000","2012-02-27T12:02:00.000","2012-03-28T12:03:00.000","Inactive",,"19801",,"BEALLSVILLE","RD",,"BEALLSVILLE","MD","20839","39.180112","-77.411687",,"POINT (-77.411687 39.180112)"
