"name","provider","address","city","state","zipcode","phone","website","description","primary_care_location","chemical_dependency_outpatient","chemical_dependency_inpatient","mental_health_outpatient","mental_health_inpatient","self_referral","medicaid","medicare","private_insurance","uninsured","adult","youth","mental_health_wraparound","chemical_dependency_wraparound","community_supports","crisis_services","voluntary","geocoded_column"
"Pierce County Alliance","Pierce County Alliance","510 Tacoma Ave S.","Tacoma","WA","98402","253-572-4750","http://piercecountyalliance.org/","The mission of the Pierce County Alliance is to be a leader in the provision of human services, specializing in substance abuse. The organization strives for client satisfaction through continuous quality improvement of services that are cost efficient and have measurable outcomes. Some programs available include: Medication Assisted Treatment (MAT)
Felony Drug Court
Family Recovery Court
Veterans Treatment Track
Problem Gambling Treatment Track
of Corrections (DOC) Treatment
Outpatient Treatment
DUI Treatment","false","true","false","false","false","true","true","false","false","true","true","false","false","false","false","false","true","POINT (-122.445774 47.258597)"
"MultiCare Sumner Medical Associates","MultiCare","5814 Graham Ave","Sumner","WA","98390","888-445-8120","https://www.multicare.org/behavioral-health-locations/","With therapists available in 11 primary care locations in Pierce and South King counties, we make it easy for you to get the care you need. General Counseling Services only accepts private health insurance at this time —  such as an employer’s health insurance plan, under your company's employee assistance program or through individual insurance coverage. We are unable to accept Medicaid or Medicare for general counseling services.","true","false","false","true","false","true","false","false","true","true","true","false","false","false","false","false","true","POINT (-122.22411 47.203963)"
"Central Pierce Fire Department CARES","Central Pierce Fire District",,"Puyallup","WA",,,"https://www.thenewstribune.com/news/local/community/puyallup-herald/ph-news/article237562199.html","CPFD CARES, or Community Assistance for Referral and Education Services, aims to curb the number of repeat 911 callers by addressing underlying problems and navigating patients to resources. The program will respond to non-urgent calls, like flu-like symptoms, diabetic issues, checking blood pressure, falls and minor cuts.","false","false","false","false","false","false","true","true","true","true","true","true","false","false","true","true","true","POINT (-122.292318 47.177438)"
"Peer Bridger","Recovery Innovations","4210 20th St, Suite B&C","Fife","WA","98424","253-235-5216","https://riinternational.com/our-services/washington/peer-bridger-program/","Short-term community support (18 and up) for recovery during transition from inpatient back into the community. The focus of this program is to reduce re-hospitalization after discharge from inpatient treatment centers and offers peer-to-peer support in navigating post-discharge barriers. 
Access: 360-347-8004. Referral sources include MOCT, E&Ts and RTFs.","false","false","false","false","false","false","true","false","false","true","true","false","true","true","true","false","true","POINT (-122.372325 47.238972)"
"MultiCare Lakewood Clinic","MultiCare","5700 100th St SW, Suite 510","Lakewood","WA","98499","888-445-8120","https://www.multicare.org/behavioral-health-locations/","With therapists available in 11 primary care locations in Pierce and South King counties, we make it easy for you to get the care you need. General Counseling Services only accepts private health insurance at this time —  such as an employer’s health insurance plan, under your company's employee assistance program or through individual insurance coverage. We are unable to accept Medicaid or Medicare for general counseling services.","true","false","false","true","false","true","false","false","true","true","true","false","false","false","false","false","true","POINT (-122.510926 47.166696)"
"Tacoma Behavioral Health Clinic - Parenting in Recovery","SeaMar Community Health Centers","7424 Bridgeport Way W. Suite 305","Lakewood","WA","98499","253-246-6820","https://www.seamar.org/pierce-bh-tacoma-chemical.html","Welcome to Sea Mar’s Tacoma Parenting in Recovery (PIR) program. PIR provides services to parents who are single, parenting and/or pregnant who are suffering from chemical abuse/addiction issues. We partner with the Multicultural Child and Family Hope Center for those in need of child care services. We are eligible to provide court-mandated services to adults. Our treatment includes individual and group therapy and random drug/alcohol testing. We use evidence-based practices with approaches such as motivational interviewing, dialectic behavioral therapy, and family systemic intervention.","false","true","false","false","false","true","true","true","true","true","true","false","false","false","false","false","true","POINT (-122.518477 47.189686)"
"Gig Harbor Counseling","Olalla Recovery Centers","5122 Olympic Dr. NW, Suite A105","Gig Harbor","WA","98335","253-851-2552","http://www.olalla.org","Just minutes from the Tacoma Narrows Bridge, Gig Harbor Counseling offers private intensive outpatient counseling for both adults and youths that includes relapse prevention, substance abuse counseling, education groups, aftercare groups and more all in a family oriented setting.","false","true","false","false","false","true","true","false","false","true","true","true","false","false","false","false","true","POINT (-122.583121 47.304825)"
"Sea Mar Tacoma Behavioral Health Clinic - 11th Street","SeaMar Community Health Centers","1307 S. 11th St.","Tacoma","WA","98405","253-682-2180","https://www.seamar.org/pierce-bh-tacoma-11.html","Our team of mental health therapists, chemical dependency counselors, psychiatric advanced registered nurse practitioners, and psychiatrists specialize in providing culturally competent services. Our staff receive in-depth training on evidence-based practices to ensure we provide the best tools to help our clients lead healthy lives. Sea Mar accepts most insurances including Medicaid and provides services regardless of a patient’s ability to pay. When insurance is not available, Sea Mar offers a sliding fee scale discount, determined by household size and income.","false","false","false","true","false","true","true","false","true","true","true","false","false","false","false","false","true","POINT (-122.454876 47.251658)"
"Consejo Counseling & Referral Services","Consejo Counseling & Referral Services","21120 Meridian Ave E","Graham","WA","98338","253-414-7461","http://consejocounseling.org/","Consejo Counseling and Referral Service provides culturally competent behavioral health services designed to address the diverse needs of adults, children, youth an families in diverse communities to improve the quality of their lives. Adult outpatient services include individual, group and family therapy, in-home behavioral health services, case management, psychiatric evaluations, medication management, and peer support.","false","false","false","true","false","true","true","false","false","true","true","true","false","false","false","false","true","POINT (-122.29473 47.064415)"
"MultiCare Chemical Dependency Services","MultiCare","2201 S. 19ths St., Ste 104","Tacoma","WA","98405","253-456-6868","https://www.muIticare.org/behavioral-health","For over 40 years, MultiCare Behavioral Health has provided in-depth treatment and support services to adults with serious mental illness who are receiving, or would qualify to receive, Medicaid benefits. We work with these clients to coordinate every step of their mental health and medical needs, so that they can: Move forward in their recovery; Achieve a better quality of life; Access local resources to meet their unique needs.","false","true","false","false","false","true","true","false","false","true","true","false","false","false","false","false","true","POINT (-122.466184 47.242683)"
