"incident_date","facility","code_section","long_describe_code_section","codesection_full_url","number_citations","number_field_identifications","month","year","is_park","is_preserve","classification","chapter","park_dept_id","classification_describe","latitude","longitude","location","unique_id"
"2022-08-01T00:00:00.000","Bald Hill Preserve","2.05.010","Dogs and other Animals","Legal Description (https://library.municode.com/ca/marin_county/codes/code_of_ordinances?nodeId=APXAMACOOPSPDICO_CH02.05LAUSREOMANRE_02.05.010DOOTAN)","0","1","August","2022","false","true","IC205_010_Dogs_OtherAnimals","2.05","BAHI","Dogs _Other Animals","37.9593400","-122.5719280","(37.95934, -122.571928)","BAHI_2.05.010_8/1/2022"
"2022-08-01T00:00:00.000","Baltimore Canyon Preserve","2.04.020","Bicycles and Similar Vehicles.","Legal Description (https://library.municode.com/ca/marin_county/codes/code_of_ordinances?nodeId=APXAMACOOPSPDICO_CH02.04LAUSREEHTRRE_02.04.020BISIVE)","1","0","August","2022","false","true","IC204_020_Bicycles","2.04","BACA","Bicycles","37.9311380","-122.5507450","(37.931138, -122.550745)","BACA_2.04.020_8/1/2022"
"2022-08-01T00:00:00.000","Baltimore Canyon Preserve","2.05.010","Dogs and other Animals","Legal Description (https://library.municode.com/ca/marin_county/codes/code_of_ordinances?nodeId=APXAMACOOPSPDICO_CH02.05LAUSREOMANRE_02.05.010DOOTAN)","0","5","August","2022","false","true","IC205_010_Dogs_OtherAnimals","2.05","BACA","Dogs _Other Animals","37.9311380","-122.5507450","(37.931138, -122.550745)","BACA_2.05.010_8/1/2022"
"2022-08-01T00:00:00.000","Blithedale Summit Preserve","2.05.010","Dogs and other Animals","Legal Description (https://library.municode.com/ca/marin_county/codes/code_of_ordinances?nodeId=APXAMACOOPSPDICO_CH02.05LAUSREOMANRE_02.05.010DOOTAN)","0","5","August","2022","false","true","IC205_010_Dogs_OtherAnimals","2.05","BLSU","Dogs _Other Animals","37.9224300","-122.5352360","(37.92243, -122.535236)","BLSU_2.05.010_8/1/2022"
"2022-08-01T00:00:00.000","Camino Alto Preserve","2.02.010","Compliance with all laws, regulations and signs","Legal Description (https://library.municode.com/ca/marin_county/codes/code_of_ordinances?nodeId=APXAMACOOPSPDICO_CH02.02LAUSREISCO_02.02.010COALLARESI)","0","1","August","2022","false","true","IC202_010_Laws_Regs","2.02","CAAL","Laws _Regs","37.9171970","-122.5302000","(37.917197, -122.5302)","CAAL_2.02.010_8/1/2022"
"2022-08-01T00:00:00.000","Camino Alto Preserve","2.05.010","Dogs and other Animals","Legal Description (https://library.municode.com/ca/marin_county/codes/code_of_ordinances?nodeId=APXAMACOOPSPDICO_CH02.05LAUSREOMANRE_02.05.010DOOTAN)","0","6","August","2022","false","true","IC205_010_Dogs_OtherAnimals","2.05","CAAL","Dogs _Other Animals","37.9171970","-122.5302000","(37.917197, -122.5302)","CAAL_2.05.010_8/1/2022"
"2022-08-01T00:00:00.000","Cascade Canyon Preserve","2.04.020","Bicycles and Similar Vehicles.","Legal Description (https://library.municode.com/ca/marin_county/codes/code_of_ordinances?nodeId=APXAMACOOPSPDICO_CH02.04LAUSREEHTRRE_02.04.020BISIVE)","2","2","August","2022","false","true","IC204_020_Bicycles","2.04","CACA","Bicycles","37.9781180","-122.6137890","(37.978118, -122.613789)","CACA_2.04.020_8/1/2022"
"2022-08-01T00:00:00.000","Cascade Canyon Preserve","2.05.010","Dogs and other Animals","Legal Description (https://library.municode.com/ca/marin_county/codes/code_of_ordinances?nodeId=APXAMACOOPSPDICO_CH02.05LAUSREOMANRE_02.05.010DOOTAN)","0","3","August","2022","false","true","IC205_010_Dogs_OtherAnimals","2.05","CACA","Dogs _Other Animals","37.9781180","-122.6137890","(37.978118, -122.613789)","CACA_2.05.010_8/1/2022"
"2022-08-01T00:00:00.000","Deer Island Preserve","2.05.010","Dogs and other Animals","Legal Description (https://library.municode.com/ca/marin_county/codes/code_of_ordinances?nodeId=APXAMACOOPSPDICO_CH02.05LAUSREOMANRE_02.05.010DOOTAN)","1","0","August","2022","false","true","IC205_010_Dogs_OtherAnimals","2.05","DEIS","Dogs _Other Animals","38.1022640","-122.5388210","(38.102264, -122.538821)","DEIS_2.05.010_8/1/2022"
"2022-08-01T00:00:00.000","Loma Verde Preserve","2.06.030","Smoking","Legal Description (https://library.municode.com/ca/marin_county/codes/code_of_ordinances?nodeId=APXAMACOOPSPDICO_CH02.06LAUSREIRRE_02.06.030SM)","0","1","August","2022","false","true","IC206_030_Smoking","2.06","LOVE","Smoking","38.0647760","-122.5509510","(38.064776, -122.550951)","LOVE_2.06.030_8/1/2022"
"2022-08-01T00:00:00.000","Lucas Valley Preserve","2.05.010","Dogs and other Animals","Legal Description (https://library.municode.com/ca/marin_county/codes/code_of_ordinances?nodeId=APXAMACOOPSPDICO_CH02.05LAUSREOMANRE_02.05.010DOOTAN)","0","1","August","2022","false","true","IC205_010_Dogs_OtherAnimals","2.05","LUVA","Dogs _Other Animals","38.0385690","-122.5916700","(38.038569, -122.59167)","LUVA_2.05.010_8/1/2022"
"2022-08-01T00:00:00.000","Lucas Valley Preserve","2.04.010","Motor Vehicles","Legal Description (https://library.municode.com/ca/marin_county/codes/code_of_ordinances?nodeId=APXAMACOOPSPDICO_CH02.03LAUSREESPR_02.03.050ARHIRE)","3","0","August","2022","false","true","IC204_010_MotorVehicles","2.04","LUVA","Motor Vehicles","38.0385690","-122.5916700","(38.038569, -122.59167)","LUVA_2.04.010_8/1/2022"
"2022-08-01T00:00:00.000","Mount Burdell Preserve","2.04.020","Bicycles and Similar Vehicles.","Legal Description (https://library.municode.com/ca/marin_county/codes/code_of_ordinances?nodeId=APXAMACOOPSPDICO_CH02.04LAUSREEHTRRE_02.04.020BISIVE)","1","0","August","2022","false","true","IC204_020_Bicycles","2.04","MOBU","Bicycles","38.1258510","-122.5925690","(38.125851, -122.592569)","MOBU_2.04.020_8/1/2022"
"2022-08-01T00:00:00.000","Mount Burdell Preserve","2.02.010","Compliance with all laws, regulations and signs","Legal Description (https://library.municode.com/ca/marin_county/codes/code_of_ordinances?nodeId=APXAMACOOPSPDICO_CH02.02LAUSREISCO_02.02.010COALLARESI)","1","0","August","2022","false","true","IC202_010_Laws_Regs","2.02","MOBU","Laws _Regs","38.1258510","-122.5925690","(38.125851, -122.592569)","MOBU_2.02.010_8/1/2022"
"2022-08-01T00:00:00.000","Mount Burdell Preserve","2.05.010","Dogs and other Animals","Legal Description (https://library.municode.com/ca/marin_county/codes/code_of_ordinances?nodeId=APXAMACOOPSPDICO_CH02.05LAUSREOMANRE_02.05.010DOOTAN)","0","4","August","2022","false","true","IC205_010_Dogs_OtherAnimals","2.05","MOBU","Dogs _Other Animals","38.1258510","-122.5925690","(38.125851, -122.592569)","MOBU_2.05.010_8/1/2022"
"2022-08-01T00:00:00.000","Old St. Hillary's Preserve","2.05.010","Dogs and other Animals","Legal Description (https://library.municode.com/ca/marin_county/codes/code_of_ordinances?nodeId=APXAMACOOPSPDICO_CH02.05LAUSREOMANRE_02.05.010DOOTAN)","1","0","August","2022","false","true","IC205_010_Dogs_OtherAnimals","2.05","OLST","Dogs _Other Animals","37.8762850","-122.4516850","(37.876285, -122.451685)","OLST_2.05.010_8/1/2022"
"2022-08-01T00:00:00.000","Ring Mountain Preserve","Other","",,"0","0","August","2022","false","true","IC_Other","","RIMO","Other","37.9208950","-122.4943440","(37.920895, -122.494344)","RIMO_Other_8/1/2022"
"2022-08-01T00:00:00.000","Ring Mountain Preserve","2.04.020","Bicycles and Similar Vehicles.","Legal Description (https://library.municode.com/ca/marin_county/codes/code_of_ordinances?nodeId=APXAMACOOPSPDICO_CH02.04LAUSREEHTRRE_02.04.020BISIVE)","2","2","August","2022","false","true","IC204_020_Bicycles","2.04","RIMO","Bicycles","37.9208950","-122.4943440","(37.920895, -122.494344)","RIMO_2.04.020_8/1/2022"
"2022-08-01T00:00:00.000","Ring Mountain Preserve","2.05.010","Dogs and other Animals","Legal Description (https://library.municode.com/ca/marin_county/codes/code_of_ordinances?nodeId=APXAMACOOPSPDICO_CH02.05LAUSREOMANRE_02.05.010DOOTAN)","1","8","August","2022","false","true","IC205_010_Dogs_OtherAnimals","2.05","RIMO","Dogs _Other Animals","37.9208950","-122.4943440","(37.920895, -122.494344)","RIMO_2.05.010_8/1/2022"
"2022-08-01T00:00:00.000","Ring Mountain Preserve","2.04.010","Motor Vehicles","Legal Description (https://library.municode.com/ca/marin_county/codes/code_of_ordinances?nodeId=APXAMACOOPSPDICO_CH02.03LAUSREESPR_02.03.050ARHIRE)","0","1","August","2022","false","true","IC204_010_MotorVehicles","2.04","RIMO","Motor Vehicles","37.9208950","-122.4943440","(37.920895, -122.494344)","RIMO_2.04.010_8/1/2022"
"2022-08-01T00:00:00.000","Ring Mountain Preserve","Fire","Fire Incident on Parks/Open Space Land",,"1","0","August","2022","false","true","Fire","","RIMO","Fire","37.9208950","-122.4943440","(37.920895, -122.494344)","RIMO_Fire_8/1/2022"
"2022-08-01T00:00:00.000","Roys Redwoods Preserve","2.02.040","Group Use","Legal Description (https://library.municode.com/ca/marin_county/codes/code_of_ordinances?nodeId=APXAMACOOPSPDICO_CH02.02LAUSREISCO_02.02.040GRUS)","0","0","August","2022","false","true","IC202_040_GroupUse","2.02","RORE","Group Use","38.0206550","-122.6617720","(38.020655, -122.661772)","RORE_2.02.040_8/1/2022"
"2022-08-01T00:00:00.000","Roys Redwoods Preserve","2.02.100","Noise and audio devices.","Legal Description (https://library.municode.com/ca/marin_county/codes/code_of_ordinances?nodeId=APXAMACOOPSPDICO_CH02.02LAUSREISCO_02.02.100NOAUDE)","0","0","August","2022","false","true","IC202_100_Noise_Audio","2.02","RORE","Noise _Audio","38.0206550","-122.6617720","(38.020655, -122.661772)","RORE_2.02.100_8/1/2022"
"2022-08-01T00:00:00.000","Roys Redwoods Preserve","2.03.030","Wildlife and Animal Resources","Legal Description (https://library.municode.com/ca/marin_county/codes/code_of_ordinances?nodeId=APXAMACOOPSPDICO_CH02.03LAUSREESPR_02.03.030WIANRE)","0","0","August","2022","false","true","IC203_030_Wildlife_Animal","2.03","RORE","Wildlife _Animal","38.0206550","-122.6617720","(38.020655, -122.661772)","RORE_2.03.030_8/1/2022"
"2022-08-01T00:00:00.000","Roys Redwoods Preserve","2.02.050","Responsibility for Conduct of Minors.","Legal Description (https://library.municode.com/ca/marin_county/codes/code_of_ordinances?nodeId=APXAMACOOPSPDICO_CH02.02LAUSREISCO_02.02.050RECOMI)","0","0","August","2022","false","true","IC202_050_MisconductOfMinors","2.02","RORE","Misconduct of Minors","38.0206550","-122.6617720","(38.020655, -122.661772)","RORE_2.02.050_8/1/2022"
"2022-08-01T00:00:00.000","Roys Redwoods Preserve","2.02.010","Compliance with all laws, regulations and signs","Legal Description (https://library.municode.com/ca/marin_county/codes/code_of_ordinances?nodeId=APXAMACOOPSPDICO_CH02.02LAUSREISCO_02.02.010COALLARESI)","0","0","August","2022","false","true","IC202_010_Laws_Regs","2.02","RORE","Laws _Regs","38.0206550","-122.6617720","(38.020655, -122.661772)","RORE_2.02.010_8/1/2022"
"2022-08-01T00:00:00.000","Roys Redwoods Preserve","2.05.010","Dogs and other Animals","Legal Description (https://library.municode.com/ca/marin_county/codes/code_of_ordinances?nodeId=APXAMACOOPSPDICO_CH02.05LAUSREOMANRE_02.05.010DOOTAN)","1","0","August","2022","false","true","IC205_010_Dogs_OtherAnimals","2.05","RORE","Dogs _Other Animals","38.0206550","-122.6617720","(38.020655, -122.661772)","RORE_2.05.010_8/1/2022"
"2022-08-01T00:00:00.000","Rush Creek Preserve","2.04.010","Motor Vehicles","Legal Description (https://library.municode.com/ca/marin_county/codes/code_of_ordinances?nodeId=APXAMACOOPSPDICO_CH02.03LAUSREESPR_02.03.050ARHIRE)","0","1","August","2022","false","true","IC204_010_MotorVehicles","2.04","RUCR","Motor Vehicles","38.1184270","-122.5642700","(38.118427, -122.56427)","RUCR_2.04.010_8/1/2022"
"2022-08-01T00:00:00.000","Rush Creek Preserve","2.05.010","Dogs and other Animals","Legal Description (https://library.municode.com/ca/marin_county/codes/code_of_ordinances?nodeId=APXAMACOOPSPDICO_CH02.05LAUSREOMANRE_02.05.010DOOTAN)","2","0","August","2022","false","true","IC205_010_Dogs_OtherAnimals","2.05","RUCR","Dogs _Other Animals","38.1184270","-122.5642700","(38.118427, -122.56427)","RUCR_2.05.010_8/1/2022"
"2022-08-01T00:00:00.000","Rush Creek Preserve","2.02.060","Camping","Legal Description (https://library.municode.com/ca/marin_county/codes/code_of_ordinances?nodeId=APXAMACOOPSPDICO_CH02.02LAUSREISCO_02.02.060CA)","0","0","August","2022","false","true","IC202_060_Camping","2.02","RUCR","Camping","38.1184270","-122.5642700","(38.118427, -122.56427)","RUCR_2.02.060_8/1/2022"
"2022-08-01T00:00:00.000","Stafford Lake Park","Medical","Medical ",,"0","1","August","2022","true","false","Medical","","STLP","Medical ","38.1163500","-122.6502740","(38.11635, -122.650274)","STLP_Medical_8/1/2022"
"2022-08-01T00:00:00.000","Stafford Lake Park","10.03.010","Compliance with all Laws, Regulations and Signs.","Legal Description (https://library.municode.com/ca/marin_county/codes/code_of_ordinances?nodeId=TIT10PA_CH10.03VICO_10.03.010COALLARESI)","0","0","August","2022","true","false","PIC1003_010_Laws_Regs","10.03","STLP","Laws_Regs","38.1163500","-122.6502740","(38.11635, -122.650274)","STLP_10.03.010_8/1/2022"
"2022-08-01T00:00:00.000","Terra Linda-Sleepy Hollow Divide North Preserve","2.05.010","Dogs and other Animals","Legal Description (https://library.municode.com/ca/marin_county/codes/code_of_ordinances?nodeId=APXAMACOOPSPDICO_CH02.05LAUSREOMANRE_02.05.010DOOTAN)","0","2","August","2022","false","true","IC205_010_Dogs_OtherAnimals","2.05","TELI","Dogs _Other Animals","38.0251610","-122.5689510","(38.025161, -122.568951)","TELI_2.05.010_8/1/2022"
"2022-08-01T00:00:00.000","Terra Linda-Sleepy Hollow Divide South Preserve","2.05.010","Dogs and other Animals","Legal Description (https://library.municode.com/ca/marin_county/codes/code_of_ordinances?nodeId=APXAMACOOPSPDICO_CH02.05LAUSREOMANRE_02.05.010DOOTAN)","1","1","August","2022","false","true","IC205_010_Dogs_OtherAnimals","2.05","TELI2","Dogs _Other Animals","37.9912710","-122.5505420","(37.991271, -122.550542)","TELI2_2.05.010_8/1/2022"
"2022-07-01T00:00:00.000","Alto Bowl Preserve","2.04.020","Bicycles and Similar Vehicles.","Legal Description (https://library.municode.com/ca/marin_county/codes/code_of_ordinances?nodeId=APXAMACOOPSPDICO_CH02.04LAUSREEHTRRE_02.04.020BISIVE)","0","6","July","2022","false","true","IC204_020_Bicycles","2.04","ALBO","Bicycles","37.9177470","-122.5203410","(37.917747, -122.520341)","ALBO_2.04.020_7/1/2022"
"2022-07-01T00:00:00.000","Bald Hill Preserve","2.03.035","Tools and Trail Building Equipment","Legal Description (https://library.municode.com/ca/marin_county/codes/code_of_ordinances?nodeId=APXAMACOOPSPDICO_CH02.03LAUSREESPR_02.03.035TOTRBUEQ)","1","0","July","2022","false","true","IC203_035_Tools_Trail_BldgEquip","2.03","BAHI","ToolsBuildEquip","37.9593400","-122.5719280","(37.95934, -122.571928)","BAHI_2.03.035_7/1/2022"
"2022-07-01T00:00:00.000","Bald Hill Preserve","2.03.040","Geological Resources","Legal Description (https://library.municode.com/ca/marin_county/codes/code_of_ordinances?nodeId=APXAMACOOPSPDICO_CH02.03LAUSREESPR_02.03.040GERE)","1","0","July","2022","false","true","IC203_040_Geological","2.03","BAHI","Geological","37.9593400","-122.5719280","(37.95934, -122.571928)","BAHI_2.03.040_7/1/2022"
"2022-07-01T00:00:00.000","Bald Hill Preserve","2.02.020","Use Restrictions","Legal Description (https://library.municode.com/ca/marin_county/codes/code_of_ordinances?nodeId=APXAMACOOPSPDICO_CH02.02LAUSREISCO_02.02.020USRE)","1","0","July","2022","false","true","IC202_020_UseRestrictions","2.02","BAHI","Use Restrictions","37.9593400","-122.5719280","(37.95934, -122.571928)","BAHI_2.02.020_7/1/2022"
"2022-07-01T00:00:00.000","Baltimore Canyon Preserve","2.05.010","Dogs and other Animals","Legal Description (https://library.municode.com/ca/marin_county/codes/code_of_ordinances?nodeId=APXAMACOOPSPDICO_CH02.05LAUSREOMANRE_02.05.010DOOTAN)","3","4","July","2022","false","true","IC205_010_Dogs_OtherAnimals","2.05","BACA","Dogs _Other Animals","37.9311380","-122.5507450","(37.931138, -122.550745)","BACA_2.05.010_7/1/2022"
"2022-07-01T00:00:00.000","Blithedale Summit Preserve","2.04.020","Bicycles and Similar Vehicles.","Legal Description (https://library.municode.com/ca/marin_county/codes/code_of_ordinances?nodeId=APXAMACOOPSPDICO_CH02.04LAUSREEHTRRE_02.04.020BISIVE)","2","0","July","2022","false","true","IC204_020_Bicycles","2.04","BLSU","Bicycles","37.9224300","-122.5352360","(37.92243, -122.535236)","BLSU_2.04.020_7/1/2022"
"2022-07-01T00:00:00.000","Blithedale Summit Preserve","2.05.010","Dogs and other Animals","Legal Description (https://library.municode.com/ca/marin_county/codes/code_of_ordinances?nodeId=APXAMACOOPSPDICO_CH02.05LAUSREOMANRE_02.05.010DOOTAN)","9","5","July","2022","false","true","IC205_010_Dogs_OtherAnimals","2.05","BLSU","Dogs _Other Animals","37.9224300","-122.5352360","(37.92243, -122.535236)","BLSU_2.05.010_7/1/2022"
"2022-07-01T00:00:00.000","Camino Alto Preserve","2.05.010","Dogs and other Animals","Legal Description (https://library.municode.com/ca/marin_county/codes/code_of_ordinances?nodeId=APXAMACOOPSPDICO_CH02.05LAUSREOMANRE_02.05.010DOOTAN)","0","1","July","2022","false","true","IC205_010_Dogs_OtherAnimals","2.05","CAAL","Dogs _Other Animals","37.9171970","-122.5302000","(37.917197, -122.5302)","CAAL_2.05.010_7/1/2022"
"2022-07-01T00:00:00.000","Cascade Canyon Preserve","2.04.020","Bicycles and Similar Vehicles.","Legal Description (https://library.municode.com/ca/marin_county/codes/code_of_ordinances?nodeId=APXAMACOOPSPDICO_CH02.04LAUSREEHTRRE_02.04.020BISIVE)","2","0","July","2022","false","true","IC204_020_Bicycles","2.04","CACA","Bicycles","37.9781180","-122.6137890","(37.978118, -122.613789)","CACA_2.04.020_7/1/2022"
"2022-07-01T00:00:00.000","Horse Hill Preserve","2.06.030","Smoking","Legal Description (https://library.municode.com/ca/marin_county/codes/code_of_ordinances?nodeId=APXAMACOOPSPDICO_CH02.06LAUSREIRRE_02.06.030SM)","2","0","July","2022","false","true","IC206_030_Smoking","2.06","HOHI","Smoking","37.9084810","-122.5150140","(37.908481, -122.515014)","HOHI_2.06.030_7/1/2022"
"2022-07-01T00:00:00.000","Horse Hill Preserve","2.04.010","Motor Vehicles","Legal Description (https://library.municode.com/ca/marin_county/codes/code_of_ordinances?nodeId=APXAMACOOPSPDICO_CH02.03LAUSREESPR_02.03.050ARHIRE)","1","0","July","2022","false","true","IC204_010_MotorVehicles","2.04","HOHI","Motor Vehicles","37.9084810","-122.5150140","(37.908481, -122.515014)","HOHI_2.04.010_7/1/2022"
"2022-07-01T00:00:00.000","Horse Hill Preserve","Other","",,"0","2","July","2022","false","true","IC_Other","","HOHI","Other","37.9084810","-122.5150140","(37.908481, -122.515014)","HOHI_Other_7/1/2022"
"2022-07-01T00:00:00.000","Horse Hill Preserve","2.02.050","Responsibility for Conduct of Minors.","Legal Description (https://library.municode.com/ca/marin_county/codes/code_of_ordinances?nodeId=APXAMACOOPSPDICO_CH02.02LAUSREISCO_02.02.050RECOMI)","0","2","July","2022","false","true","IC202_050_MisconductOfMinors","2.02","HOHI","Misconduct of Minors","37.9084810","-122.5150140","(37.908481, -122.515014)","HOHI_2.02.050_7/1/2022"
"2022-07-01T00:00:00.000","Horse Hill Preserve","2.05.010","Dogs and other Animals","Legal Description (https://library.municode.com/ca/marin_county/codes/code_of_ordinances?nodeId=APXAMACOOPSPDICO_CH02.05LAUSREOMANRE_02.05.010DOOTAN)","1","0","July","2022","false","true","IC205_010_Dogs_OtherAnimals","2.05","HOHI","Dogs _Other Animals","37.9084810","-122.5150140","(37.908481, -122.515014)","HOHI_2.05.010_7/1/2022"
"2022-07-01T00:00:00.000","Indian Valley Preserve","2.05.010","Dogs and other Animals","Legal Description (https://library.municode.com/ca/marin_county/codes/code_of_ordinances?nodeId=APXAMACOOPSPDICO_CH02.05LAUSREOMANRE_02.05.010DOOTAN)","0","1","July","2022","false","true","IC205_010_Dogs_OtherAnimals","2.05","INVA","Dogs _Other Animals","38.0768480","-122.5824270","(38.076848, -122.582427)","INVA_2.05.010_7/1/2022"
"2022-07-01T00:00:00.000","King Mountain Preserve","2.05.010","Dogs and other Animals","Legal Description (https://library.municode.com/ca/marin_county/codes/code_of_ordinances?nodeId=APXAMACOOPSPDICO_CH02.05LAUSREOMANRE_02.05.010DOOTAN)","0","2","July","2022","false","true","IC205_010_Dogs_OtherAnimals","2.05","KIMO","Dogs _Other Animals","37.9384520","-122.5390310","(37.938452, -122.539031)","KIMO_2.05.010_7/1/2022"
"2022-07-01T00:00:00.000","Loma Verde Preserve","2.06.030","Smoking","Legal Description (https://library.municode.com/ca/marin_county/codes/code_of_ordinances?nodeId=APXAMACOOPSPDICO_CH02.06LAUSREIRRE_02.06.030SM)","0","1","July","2022","false","true","IC206_030_Smoking","2.06","LOVE","Smoking","38.0647760","-122.5509510","(38.064776, -122.550951)","LOVE_2.06.030_7/1/2022"
"2022-07-01T00:00:00.000","Mount Burdell Preserve","2.05.010","Dogs and other Animals","Legal Description (https://library.municode.com/ca/marin_county/codes/code_of_ordinances?nodeId=APXAMACOOPSPDICO_CH02.05LAUSREOMANRE_02.05.010DOOTAN)","0","1","July","2022","false","true","IC205_010_Dogs_OtherAnimals","2.05","MOBU","Dogs _Other Animals","38.1258510","-122.5925690","(38.125851, -122.592569)","MOBU_2.05.010_7/1/2022"
"2022-07-01T00:00:00.000","Old St. Hillary's Preserve","2.05.010","Dogs and other Animals","Legal Description (https://library.municode.com/ca/marin_county/codes/code_of_ordinances?nodeId=APXAMACOOPSPDICO_CH02.05LAUSREOMANRE_02.05.010DOOTAN)","0","1","July","2022","false","true","IC205_010_Dogs_OtherAnimals","2.05","OLST","Dogs _Other Animals","37.8762850","-122.4516850","(37.876285, -122.451685)","OLST_2.05.010_7/1/2022"
"2022-07-01T00:00:00.000","Ring Mountain Preserve","2.05.010","Dogs and other Animals","Legal Description (https://library.municode.com/ca/marin_county/codes/code_of_ordinances?nodeId=APXAMACOOPSPDICO_CH02.05LAUSREOMANRE_02.05.010DOOTAN)","3","4","July","2022","false","true","IC205_010_Dogs_OtherAnimals","2.05","RIMO","Dogs _Other Animals","37.9208950","-122.4943440","(37.920895, -122.494344)","RIMO_2.05.010_7/1/2022"
"2022-07-01T00:00:00.000","Ring Mountain Preserve","2.04.020","Bicycles and Similar Vehicles.","Legal Description (https://library.municode.com/ca/marin_county/codes/code_of_ordinances?nodeId=APXAMACOOPSPDICO_CH02.04LAUSREEHTRRE_02.04.020BISIVE)","1","0","July","2022","false","true","IC204_020_Bicycles","2.04","RIMO","Bicycles","37.9208950","-122.4943440","(37.920895, -122.494344)","RIMO_2.04.020_7/1/2022"
"2022-07-01T00:00:00.000","Roys Redwoods Preserve","2.05.010","Dogs and other Animals","Legal Description (https://library.municode.com/ca/marin_county/codes/code_of_ordinances?nodeId=APXAMACOOPSPDICO_CH02.05LAUSREOMANRE_02.05.010DOOTAN)","0","1","July","2022","false","true","IC205_010_Dogs_OtherAnimals","2.05","RORE","Dogs _Other Animals","38.0206550","-122.6617720","(38.020655, -122.661772)","RORE_2.05.010_7/1/2022"
"2022-07-01T00:00:00.000","Rush Creek Preserve","Other","",,"0","0","July","2022","false","true","IC_Other","","RUCR","Other","38.1184270","-122.5642700","(38.118427, -122.56427)","RUCR_Other_7/1/2022"
"2022-07-01T00:00:00.000","Rush Creek Preserve","2.02.060","Camping","Legal Description (https://library.municode.com/ca/marin_county/codes/code_of_ordinances?nodeId=APXAMACOOPSPDICO_CH02.02LAUSREISCO_02.02.060CA)","0","0","July","2022","false","true","IC202_060_Camping","2.02","RUCR","Camping","38.1184270","-122.5642700","(38.118427, -122.56427)","RUCR_2.02.060_7/1/2022"
"2022-07-01T00:00:00.000","Rush Creek Preserve","2.02.010","Compliance with all laws, regulations and signs","Legal Description (https://library.municode.com/ca/marin_county/codes/code_of_ordinances?nodeId=APXAMACOOPSPDICO_CH02.02LAUSREISCO_02.02.010COALLARESI)","1","0","July","2022","false","true","IC202_010_Laws_Regs","2.02","RUCR","Laws _Regs","38.1184270","-122.5642700","(38.118427, -122.56427)","RUCR_2.02.010_7/1/2022"
"2022-07-01T00:00:00.000","Rush Creek Preserve","2.05.010","Dogs and other Animals","Legal Description (https://library.municode.com/ca/marin_county/codes/code_of_ordinances?nodeId=APXAMACOOPSPDICO_CH02.05LAUSREOMANRE_02.05.010DOOTAN)","1","1","July","2022","false","true","IC205_010_Dogs_OtherAnimals","2.05","RUCR","Dogs _Other Animals","38.1184270","-122.5642700","(38.118427, -122.56427)","RUCR_2.05.010_7/1/2022"
"2022-07-01T00:00:00.000","Terra Linda-Sleepy Hollow Divide North Preserve","2.05.010","Dogs and other Animals","Legal Description (https://library.municode.com/ca/marin_county/codes/code_of_ordinances?nodeId=APXAMACOOPSPDICO_CH02.05LAUSREOMANRE_02.05.010DOOTAN)","1","1","July","2022","false","true","IC205_010_Dogs_OtherAnimals","2.05","TELI","Dogs _Other Animals","38.0251610","-122.5689510","(38.025161, -122.568951)","TELI_2.05.010_7/1/2022"
"2022-07-01T00:00:00.000","Terra Linda-Sleepy Hollow Divide North Preserve","2.04.020","Bicycles and Similar Vehicles.","Legal Description (https://library.municode.com/ca/marin_county/codes/code_of_ordinances?nodeId=APXAMACOOPSPDICO_CH02.04LAUSREEHTRRE_02.04.020BISIVE)","0","1","July","2022","false","true","IC204_020_Bicycles","2.04","TELI","Bicycles","38.0251610","-122.5689510","(38.025161, -122.568951)","TELI_2.04.020_7/1/2022"
"2022-07-01T00:00:00.000","Terra Linda-Sleepy Hollow Divide South Preserve","2.04.020","Bicycles and Similar Vehicles.","Legal Description (https://library.municode.com/ca/marin_county/codes/code_of_ordinances?nodeId=APXAMACOOPSPDICO_CH02.04LAUSREEHTRRE_02.04.020BISIVE)","1","0","July","2022","false","true","IC204_020_Bicycles","2.04","TELI2","Bicycles","37.9912710","-122.5505420","(37.991271, -122.550542)","TELI2_2.04.020_7/1/2022"
"2022-07-01T00:00:00.000","Terra Linda-Sleepy Hollow Divide South Preserve","2.05.010","Dogs and other Animals","Legal Description (https://library.municode.com/ca/marin_county/codes/code_of_ordinances?nodeId=APXAMACOOPSPDICO_CH02.05LAUSREOMANRE_02.05.010DOOTAN)","0","2","July","2022","false","true","IC205_010_Dogs_OtherAnimals","2.05","TELI2","Dogs _Other Animals","37.9912710","-122.5505420","(37.991271, -122.550542)","TELI2_2.05.010_7/1/2022"
"2022-07-01T00:00:00.000","Terra Linda-Sleepy Hollow Divide South Preserve","2.04.010","Motor Vehicles","Legal Description (https://library.municode.com/ca/marin_county/codes/code_of_ordinances?nodeId=APXAMACOOPSPDICO_CH02.03LAUSREESPR_02.03.050ARHIRE)","0","0","July","2022","false","true","IC204_010_MotorVehicles","2.04","TELI2","Motor Vehicles","37.9912710","-122.5505420","(37.991271, -122.550542)","TELI2_2.04.010_7/1/2022"
"2022-06-01T00:00:00.000","Baltimore Canyon Preserve","2.04.020","Bicycles and Similar Vehicles.","Legal Description (https://library.municode.com/ca/marin_county/codes/code_of_ordinances?nodeId=APXAMACOOPSPDICO_CH02.04LAUSREEHTRRE_02.04.020BISIVE)","0","3","June","2022","false","true","IC204_020_Bicycles","2.04","BACA","Bicycles","37.9311380","-122.5507450","(37.931138, -122.550745)","BACA_2.04.020_6/1/2022"
"2022-06-01T00:00:00.000","Blithedale Summit Preserve","2.05.010","Dogs and other Animals","Legal Description (https://library.municode.com/ca/marin_county/codes/code_of_ordinances?nodeId=APXAMACOOPSPDICO_CH02.05LAUSREOMANRE_02.05.010DOOTAN)","0","2","June","2022","false","true","IC205_010_Dogs_OtherAnimals","2.05","BLSU","Dogs _Other Animals","37.9224300","-122.5352360","(37.92243, -122.535236)","BLSU_2.05.010_6/1/2022"
"2022-06-01T00:00:00.000","Camino Alto Preserve","2.04.010","Motor Vehicles","Legal Description (https://library.municode.com/ca/marin_county/codes/code_of_ordinances?nodeId=APXAMACOOPSPDICO_CH02.03LAUSREESPR_02.03.050ARHIRE)","1","0","June","2022","false","true","IC204_010_MotorVehicles","2.04","CAAL","Motor Vehicles","37.9171970","-122.5302000","(37.917197, -122.5302)","CAAL_2.04.010_6/1/2022"
"2022-06-01T00:00:00.000","Cascade Canyon Preserve","2.04.040","Speed Limits","Legal Description (https://library.municode.com/ca/marin_county/codes/code_of_ordinances?nodeId=APXAMACOOPSPDICO_CH02.04LAUSREEHTRRE_02.04.020BISIVE)","0","1","June","2022","false","true","IC204_040_SpeedLimits","2.04","CACA","Speed Limits","37.9781180","-122.6137890","(37.978118, -122.613789)","CACA_2.04.040_6/1/2022"
"2022-06-01T00:00:00.000","Horse Hill Preserve","Fire","Fire Incident on Parks/Open Space Land",,"1","0","June","2022","false","true","Fire","","HOHI","Fire","37.9084810","-122.5150140","(37.908481, -122.515014)","HOHI_Fire_6/1/2022"
"2022-06-01T00:00:00.000","Indian Tree Preserve","2.05.010","Dogs and other Animals","Legal Description (https://library.municode.com/ca/marin_county/codes/code_of_ordinances?nodeId=APXAMACOOPSPDICO_CH02.05LAUSREOMANRE_02.05.010DOOTAN)","1","0","June","2022","false","true","IC205_010_Dogs_OtherAnimals","2.05","INTR","Dogs _Other Animals","38.1027790","-122.6337210","(38.102779, -122.633721)","INTR_2.05.010_6/1/2022"
"2022-06-01T00:00:00.000","Lucas Valley Preserve","2.04.010","Motor Vehicles","Legal Description (https://library.municode.com/ca/marin_county/codes/code_of_ordinances?nodeId=APXAMACOOPSPDICO_CH02.03LAUSREESPR_02.03.050ARHIRE)","0","1","June","2022","false","true","IC204_010_MotorVehicles","2.04","LUVA","Motor Vehicles","38.0385690","-122.5916700","(38.038569, -122.59167)","LUVA_2.04.010_6/1/2022"
"2022-06-01T00:00:00.000","Lucas Valley Preserve","2.04.020","Bicycles and Similar Vehicles.","Legal Description (https://library.municode.com/ca/marin_county/codes/code_of_ordinances?nodeId=APXAMACOOPSPDICO_CH02.04LAUSREEHTRRE_02.04.020BISIVE)","0","1","June","2022","false","true","IC204_020_Bicycles","2.04","LUVA","Bicycles","38.0385690","-122.5916700","(38.038569, -122.59167)","LUVA_2.04.020_6/1/2022"
"2022-06-01T00:00:00.000","Paradise Park","Other","",,"0","0","June","2022","true","false","PIC_Other","","PARP","Other","37.8919480","-122.4574680","(37.891948, -122.457468)","PARP_Other_6/1/2022"
"2022-06-01T00:00:00.000","Ring Mountain Preserve","2.02.160","Commerical Activities","Legal Description (https://library.municode.com/ca/marin_county/codes/code_of_ordinances?nodeId=APXAMACOOPSPDICO_CH02.02LAUSREISCO_02.02.160COAC)","0","0","June","2022","false","true","IC202_160_CommercialActivity","2.02","RIMO","Commercial Activity","37.9208950","-122.4943440","(37.920895, -122.494344)","RIMO_2.02.160_6/1/2022"
"2022-06-01T00:00:00.000","Ring Mountain Preserve","2.05.010","Dogs and other Animals","Legal Description (https://library.municode.com/ca/marin_county/codes/code_of_ordinances?nodeId=APXAMACOOPSPDICO_CH02.05LAUSREOMANRE_02.05.010DOOTAN)","3","4","June","2022","false","true","IC205_010_Dogs_OtherAnimals","2.05","RIMO","Dogs _Other Animals","37.9208950","-122.4943440","(37.920895, -122.494344)","RIMO_2.05.010_6/1/2022"
"2022-06-01T00:00:00.000","Rush Creek Preserve","2.05.010","Dogs and other Animals","Legal Description (https://library.municode.com/ca/marin_county/codes/code_of_ordinances?nodeId=APXAMACOOPSPDICO_CH02.05LAUSREOMANRE_02.05.010DOOTAN)","1","0","June","2022","false","true","IC205_010_Dogs_OtherAnimals","2.05","RUCR","Dogs _Other Animals","38.1184270","-122.5642700","(38.118427, -122.56427)","RUCR_2.05.010_6/1/2022"
"2022-06-01T00:00:00.000","Santa Margarita Island Preserve","2.05.010","Dogs and other Animals","Legal Description (https://library.municode.com/ca/marin_county/codes/code_of_ordinances?nodeId=APXAMACOOPSPDICO_CH02.05LAUSREOMANRE_02.05.010DOOTAN)","0","1","June","2022","false","true","IC205_010_Dogs_OtherAnimals","2.05","SAMA","Dogs _Other Animals","38.0082150","-122.5232910","(38.008215, -122.523291)","SAMA_2.05.010_6/1/2022"
"2022-06-01T00:00:00.000","Stafford Lake Park","Medical","Medical ",,"0","1","June","2022","true","false","Medical","","STLP","Medical ","38.1163500","-122.6502740","(38.11635, -122.650274)","STLP_Medical_6/1/2022"
"2022-06-01T00:00:00.000","Terra Linda-Sleepy Hollow Divide North Preserve","2.05.010","Dogs and other Animals","Legal Description (https://library.municode.com/ca/marin_county/codes/code_of_ordinances?nodeId=APXAMACOOPSPDICO_CH02.05LAUSREOMANRE_02.05.010DOOTAN)","0","2","June","2022","false","true","IC205_010_Dogs_OtherAnimals","2.05","TELI","Dogs _Other Animals","38.0251610","-122.5689510","(38.025161, -122.568951)","TELI_2.05.010_6/1/2022"
"2022-06-01T00:00:00.000","Terra Linda-Sleepy Hollow Divide South Preserve","2.05.010","Dogs and other Animals","Legal Description (https://library.municode.com/ca/marin_county/codes/code_of_ordinances?nodeId=APXAMACOOPSPDICO_CH02.05LAUSREOMANRE_02.05.010DOOTAN)","1","1","June","2022","false","true","IC205_010_Dogs_OtherAnimals","2.05","TELI2","Dogs _Other Animals","37.9912710","-122.5505420","(37.991271, -122.550542)","TELI2_2.05.010_6/1/2022"
"2022-05-01T00:00:00.000","Baltimore Canyon Preserve","2.05.010","Dogs and other Animals","Legal Description (https://library.municode.com/ca/marin_county/codes/code_of_ordinances?nodeId=APXAMACOOPSPDICO_CH02.05LAUSREOMANRE_02.05.010DOOTAN)","7","7","May","2022","false","true","IC205_010_Dogs_OtherAnimals","2.05","BACA","Dogs _Other Animals","37.9311380","-122.5507450","(37.931138, -122.550745)","BACA_2.05.010_5/1/2022"
"2022-05-01T00:00:00.000","Baltimore Canyon Preserve","2.02.160","Commerical Activities","Legal Description (https://library.municode.com/ca/marin_county/codes/code_of_ordinances?nodeId=APXAMACOOPSPDICO_CH02.02LAUSREISCO_02.02.160COAC)","0","1","May","2022","false","true","IC202_160_CommercialActivity","2.02","BACA","Commercial Activity","37.9311380","-122.5507450","(37.931138, -122.550745)","BACA_2.02.160_5/1/2022"
"2022-05-01T00:00:00.000","Blithedale Summit Preserve","2.02.160","Commerical Activities","Legal Description (https://library.municode.com/ca/marin_county/codes/code_of_ordinances?nodeId=APXAMACOOPSPDICO_CH02.02LAUSREISCO_02.02.160COAC)","1","0","May","2022","false","true","IC202_160_CommercialActivity","2.02","BLSU","Commercial Activity","37.9224300","-122.5352360","(37.92243, -122.535236)","BLSU_2.02.160_5/1/2022"
"2022-05-01T00:00:00.000","Blithedale Summit Preserve","2.04.020","Bicycles and Similar Vehicles.","Legal Description (https://library.municode.com/ca/marin_county/codes/code_of_ordinances?nodeId=APXAMACOOPSPDICO_CH02.04LAUSREEHTRRE_02.04.020BISIVE)","0","1","May","2022","false","true","IC204_020_Bicycles","2.04","BLSU","Bicycles","37.9224300","-122.5352360","(37.92243, -122.535236)","BLSU_2.04.020_5/1/2022"
"2022-05-01T00:00:00.000","Camino Alto Preserve","2.05.010","Dogs and other Animals","Legal Description (https://library.municode.com/ca/marin_county/codes/code_of_ordinances?nodeId=APXAMACOOPSPDICO_CH02.05LAUSREOMANRE_02.05.010DOOTAN)","0","1","May","2022","false","true","IC205_010_Dogs_OtherAnimals","2.05","CAAL","Dogs _Other Animals","37.9171970","-122.5302000","(37.917197, -122.5302)","CAAL_2.05.010_5/1/2022"
"2022-05-01T00:00:00.000","Cascade Canyon Preserve","2.05.010","Dogs and other Animals","Legal Description (https://library.municode.com/ca/marin_county/codes/code_of_ordinances?nodeId=APXAMACOOPSPDICO_CH02.05LAUSREOMANRE_02.05.010DOOTAN)","0","2","May","2022","false","true","IC205_010_Dogs_OtherAnimals","2.05","CACA","Dogs _Other Animals","37.9781180","-122.6137890","(37.978118, -122.613789)","CACA_2.05.010_5/1/2022"
"2022-05-01T00:00:00.000","Ignacio Valley Preserve","2.04.020","Bicycles and Similar Vehicles.","Legal Description (https://library.municode.com/ca/marin_county/codes/code_of_ordinances?nodeId=APXAMACOOPSPDICO_CH02.04LAUSREEHTRRE_02.04.020BISIVE)","0","1","May","2022","false","true","IC204_020_Bicycles","2.04","IGVA","Bicycles","38.0642570","-122.5554440","(38.064257, -122.555444)","IGVA_2.04.020_5/1/2022"
"2022-05-01T00:00:00.000","Indian Tree Preserve","2.05.010","Dogs and other Animals","Legal Description (https://library.municode.com/ca/marin_county/codes/code_of_ordinances?nodeId=APXAMACOOPSPDICO_CH02.05LAUSREOMANRE_02.05.010DOOTAN)","0","1","May","2022","false","true","IC205_010_Dogs_OtherAnimals","2.05","INTR","Dogs _Other Animals","38.1027790","-122.6337210","(38.102779, -122.633721)","INTR_2.05.010_5/1/2022"
"2022-05-01T00:00:00.000","Indian Valley Preserve","2.05.010","Dogs and other Animals","Legal Description (https://library.municode.com/ca/marin_county/codes/code_of_ordinances?nodeId=APXAMACOOPSPDICO_CH02.05LAUSREOMANRE_02.05.010DOOTAN)","1","1","May","2022","false","true","IC205_010_Dogs_OtherAnimals","2.05","INVA","Dogs _Other Animals","38.0768480","-122.5824270","(38.076848, -122.582427)","INVA_2.05.010_5/1/2022"
"2022-05-01T00:00:00.000","Loma Alta Preserve","2.05.010","Dogs and other Animals","Legal Description (https://library.municode.com/ca/marin_county/codes/code_of_ordinances?nodeId=APXAMACOOPSPDICO_CH02.05LAUSREOMANRE_02.05.010DOOTAN)","0","1","May","2022","false","true","IC205_010_Dogs_OtherAnimals","2.05","LOAL","Dogs _Other Animals","38.0053190","-122.6046970","(38.005319, -122.604697)","LOAL_2.05.010_5/1/2022"
"2022-05-01T00:00:00.000","Mount Burdell Preserve","2.05.010","Dogs and other Animals","Legal Description (https://library.municode.com/ca/marin_county/codes/code_of_ordinances?nodeId=APXAMACOOPSPDICO_CH02.05LAUSREOMANRE_02.05.010DOOTAN)","1","1","May","2022","false","true","IC205_010_Dogs_OtherAnimals","2.05","MOBU","Dogs _Other Animals","38.1258510","-122.5925690","(38.125851, -122.592569)","MOBU_2.05.010_5/1/2022"
"2022-05-01T00:00:00.000","Other Lands (state, federal, MMWD, city, etc.)","2.05.010","Dogs and other Animals","Legal Description (https://library.municode.com/ca/marin_county/codes/code_of_ordinances?nodeId=APXAMACOOPSPDICO_CH02.05LAUSREOMANRE_02.05.010DOOTAN)","1","0","May","2022","false","true","IC205_010_Dogs_OtherAnimals","2.05","OTLA","Dogs _Other Animals",,,,"OTLA_2.05.010_5/1/2022"
"2022-05-01T00:00:00.000","Pacheco Valle Preserve","2.03.035","Tools and Trail Building Equipment","Legal Description (https://library.municode.com/ca/marin_county/codes/code_of_ordinances?nodeId=APXAMACOOPSPDICO_CH02.03LAUSREESPR_02.03.035TOTRBUEQ)","0","1","May","2022","false","true","IC203_035_Tools_Trail_BldgEquip","2.03","PAVA","ToolsBuildEquip","38.0493370","-122.5343570","(38.049337, -122.534357)","PAVA_2.03.035_5/1/2022"
"2022-05-01T00:00:00.000","Ring Mountain Preserve","2.05.010","Dogs and other Animals","Legal Description (https://library.municode.com/ca/marin_county/codes/code_of_ordinances?nodeId=APXAMACOOPSPDICO_CH02.05LAUSREOMANRE_02.05.010DOOTAN)","1","6","May","2022","false","true","IC205_010_Dogs_OtherAnimals","2.05","RIMO","Dogs _Other Animals","37.9208950","-122.4943440","(37.920895, -122.494344)","RIMO_2.05.010_5/1/2022"
"2022-05-01T00:00:00.000","Rush Creek Preserve","2.02.060","Camping","Legal Description (https://library.municode.com/ca/marin_county/codes/code_of_ordinances?nodeId=APXAMACOOPSPDICO_CH02.02LAUSREISCO_02.02.060CA)","0","0","May","2022","false","true","IC202_060_Camping","2.02","RUCR","Camping","38.1184270","-122.5642700","(38.118427, -122.56427)","RUCR_2.02.060_5/1/2022"
"2022-05-01T00:00:00.000","Rush Creek Preserve","2.05.010","Dogs and other Animals","Legal Description (https://library.municode.com/ca/marin_county/codes/code_of_ordinances?nodeId=APXAMACOOPSPDICO_CH02.05LAUSREOMANRE_02.05.010DOOTAN)","1","1","May","2022","false","true","IC205_010_Dogs_OtherAnimals","2.05","RUCR","Dogs _Other Animals","38.1184270","-122.5642700","(38.118427, -122.56427)","RUCR_2.05.010_5/1/2022"
"2022-05-01T00:00:00.000","Terra Linda-Sleepy Hollow Divide North Preserve","2.05.030","Animals at Large","Legal Description (https://library.municode.com/ca/marin_county/codes/code_of_ordinances?nodeId=APXAMACOOPSPDICO_CH02.05LAUSREOMANRE_02.05.030ANLA)","1","0","May","2022","false","true","IC205_030_AnimalsAtLarge","2.05","TELI","Animals At Large","38.0251610","-122.5689510","(38.025161, -122.568951)","TELI_2.05.030_5/1/2022"
"2022-05-01T00:00:00.000","Terra Linda-Sleepy Hollow Divide North Preserve","2.05.010","Dogs and other Animals","Legal Description (https://library.municode.com/ca/marin_county/codes/code_of_ordinances?nodeId=APXAMACOOPSPDICO_CH02.05LAUSREOMANRE_02.05.010DOOTAN)","1","0","May","2022","false","true","IC205_010_Dogs_OtherAnimals","2.05","TELI","Dogs _Other Animals","38.0251610","-122.5689510","(38.025161, -122.568951)","TELI_2.05.010_5/1/2022"
"2022-05-01T00:00:00.000","Terra Linda-Sleepy Hollow Divide South Preserve","2.05.010","Dogs and other Animals","Legal Description (https://library.municode.com/ca/marin_county/codes/code_of_ordinances?nodeId=APXAMACOOPSPDICO_CH02.05LAUSREOMANRE_02.05.010DOOTAN)","5","7","May","2022","false","true","IC205_010_Dogs_OtherAnimals","2.05","TELI2","Dogs _Other Animals","37.9912710","-122.5505420","(37.991271, -122.550542)","TELI2_2.05.010_5/1/2022"
"2022-05-01T00:00:00.000","Terra Linda-Sleepy Hollow Divide South Preserve","2.02.150","Abandoned and Unattended Property.","Legal Description (https://library.municode.com/ca/marin_county/codes/code_of_ordinances?nodeId=APXAMACOOPSPDICO_CH02.02LAUSREISCO_02.02.150ABUNPR)","0","0","May","2022","false","true","IC202_150_AbandonedProperty","2.02","TELI2","Abandoned Property","37.9912710","-122.5505420","(37.991271, -122.550542)","TELI2_2.02.150_5/1/2022"
"2022-05-01T00:00:00.000","Terra Linda-Sleepy Hollow Divide South Preserve","2.02.140","Unauthorized Structures, Encroachments and Signs.","Legal Description (https://library.municode.com/ca/marin_county/codes/code_of_ordinances?nodeId=APXAMACOOPSPDICO_CH02.02LAUSREISCO_02.02.140UNST)","0","0","May","2022","false","true","IC202_140_UnauthStructEncrh","2.02","TELI2","Unauth. Struct. Encrch.","37.9912710","-122.5505420","(37.991271, -122.550542)","TELI2_2.02.140_5/1/2022"
"2022-04-01T00:00:00.000","Alto Bowl Preserve","2.05.010","Dogs and other Animals","Legal Description (https://library.municode.com/ca/marin_county/codes/code_of_ordinances?nodeId=APXAMACOOPSPDICO_CH02.05LAUSREOMANRE_02.05.010DOOTAN)","1","0","April","2022","false","true","IC205_010_Dogs_OtherAnimals","2.05","ALBO","Dogs _Other Animals","37.9177470","-122.5203410","(37.917747, -122.520341)","ALBO_2.05.010_4/1/2022"
"2022-04-01T00:00:00.000","Baltimore Canyon Preserve","2.05.010","Dogs and other Animals","Legal Description (https://library.municode.com/ca/marin_county/codes/code_of_ordinances?nodeId=APXAMACOOPSPDICO_CH02.05LAUSREOMANRE_02.05.010DOOTAN)","2","6","April","2022","false","true","IC205_010_Dogs_OtherAnimals","2.05","BACA","Dogs _Other Animals","37.9311380","-122.5507450","(37.931138, -122.550745)","BACA_2.05.010_4/1/2022"
"2022-04-01T00:00:00.000","Baltimore Canyon Preserve","2.04.010","Motor Vehicles","Legal Description (https://library.municode.com/ca/marin_county/codes/code_of_ordinances?nodeId=APXAMACOOPSPDICO_CH02.03LAUSREESPR_02.03.050ARHIRE)","0","4","April","2022","false","true","IC204_010_MotorVehicles","2.04","BACA","Motor Vehicles","37.9311380","-122.5507450","(37.931138, -122.550745)","BACA_2.04.010_4/1/2022"
"2022-04-01T00:00:00.000","Baltimore Canyon Preserve","2.04.020","Bicycles and Similar Vehicles.","Legal Description (https://library.municode.com/ca/marin_county/codes/code_of_ordinances?nodeId=APXAMACOOPSPDICO_CH02.04LAUSREEHTRRE_02.04.020BISIVE)","2","0","April","2022","false","true","IC204_020_Bicycles","2.04","BACA","Bicycles","37.9311380","-122.5507450","(37.931138, -122.550745)","BACA_2.04.020_4/1/2022"
"2022-04-01T00:00:00.000","Camino Alto Preserve","2.02.010","Compliance with all laws, regulations and signs","Legal Description (https://library.municode.com/ca/marin_county/codes/code_of_ordinances?nodeId=APXAMACOOPSPDICO_CH02.02LAUSREISCO_02.02.010COALLARESI)","0","0","April","2022","false","true","IC202_010_Laws_Regs","2.02","CAAL","Laws _Regs","37.9171970","-122.5302000","(37.917197, -122.5302)","CAAL_2.02.010_4/1/2022"
"2022-04-01T00:00:00.000","Camino Alto Preserve","SearchRes","Search and Rescue",,"0","1","April","2022","false","true","SearchRes","","CAAL","SearchRes","37.9171970","-122.5302000","(37.917197, -122.5302)","CAAL_SearchRes_4/1/2022"
"2022-04-01T00:00:00.000","Camino Alto Preserve","2.05.010","Dogs and other Animals","Legal Description (https://library.municode.com/ca/marin_county/codes/code_of_ordinances?nodeId=APXAMACOOPSPDICO_CH02.05LAUSREOMANRE_02.05.010DOOTAN)","0","3","April","2022","false","true","IC205_010_Dogs_OtherAnimals","2.05","CAAL","Dogs _Other Animals","37.9171970","-122.5302000","(37.917197, -122.5302)","CAAL_2.05.010_4/1/2022"
"2022-04-01T00:00:00.000","Camino Alto Preserve","2.04.020","Bicycles and Similar Vehicles.","Legal Description (https://library.municode.com/ca/marin_county/codes/code_of_ordinances?nodeId=APXAMACOOPSPDICO_CH02.04LAUSREEHTRRE_02.04.020BISIVE)","0","1","April","2022","false","true","IC204_020_Bicycles","2.04","CAAL","Bicycles","37.9171970","-122.5302000","(37.917197, -122.5302)","CAAL_2.04.020_4/1/2022"
"2022-04-01T00:00:00.000","Cascade Canyon Preserve","2.04.020","Bicycles and Similar Vehicles.","Legal Description (https://library.municode.com/ca/marin_county/codes/code_of_ordinances?nodeId=APXAMACOOPSPDICO_CH02.04LAUSREEHTRRE_02.04.020BISIVE)","1","0","April","2022","false","true","IC204_020_Bicycles","2.04","CACA","Bicycles","37.9781180","-122.6137890","(37.978118, -122.613789)","CACA_2.04.020_4/1/2022"
"2022-04-01T00:00:00.000","Deer Island Preserve","2.05.010","Dogs and other Animals","Legal Description (https://library.municode.com/ca/marin_county/codes/code_of_ordinances?nodeId=APXAMACOOPSPDICO_CH02.05LAUSREOMANRE_02.05.010DOOTAN)","1","1","April","2022","false","true","IC205_010_Dogs_OtherAnimals","2.05","DEIS","Dogs _Other Animals","38.1022640","-122.5388210","(38.102264, -122.538821)","DEIS_2.05.010_4/1/2022"
"2022-04-01T00:00:00.000","Horse Hill Preserve","2.05.010","Dogs and other Animals","Legal Description (https://library.municode.com/ca/marin_county/codes/code_of_ordinances?nodeId=APXAMACOOPSPDICO_CH02.05LAUSREOMANRE_02.05.010DOOTAN)","2","0","April","2022","false","true","IC205_010_Dogs_OtherAnimals","2.05","HOHI","Dogs _Other Animals","37.9084810","-122.5150140","(37.908481, -122.515014)","HOHI_2.05.010_4/1/2022"
"2022-04-01T00:00:00.000","Indian Valley Preserve","2.05.010","Dogs and other Animals","Legal Description (https://library.municode.com/ca/marin_county/codes/code_of_ordinances?nodeId=APXAMACOOPSPDICO_CH02.05LAUSREOMANRE_02.05.010DOOTAN)","0","1","April","2022","false","true","IC205_010_Dogs_OtherAnimals","2.05","INVA","Dogs _Other Animals","38.0768480","-122.5824270","(38.076848, -122.582427)","INVA_2.05.010_4/1/2022"
"2022-04-01T00:00:00.000","Little Mountain Preserve","2.02.120","Littering","Legal Description (https://library.municode.com/ca/marin_county/codes/code_of_ordinances?nodeId=APXAMACOOPSPDICO_CH02.02LAUSREISCO_02.02.120LI)","1","0","April","2022","false","true","IC202_120_Littering","2.02","LIMO","Littering","38.1131610","-122.6162120","(38.113161, -122.616212)","LIMO_2.02.120_4/1/2022"
"2022-04-01T00:00:00.000","Little Mountain Preserve","2.04.010","Motor Vehicles","Legal Description (https://library.municode.com/ca/marin_county/codes/code_of_ordinances?nodeId=APXAMACOOPSPDICO_CH02.03LAUSREESPR_02.03.050ARHIRE)","1","0","April","2022","false","true","IC204_010_MotorVehicles","2.04","LIMO","Motor Vehicles","38.1131610","-122.6162120","(38.113161, -122.616212)","LIMO_2.04.010_4/1/2022"
"2022-04-01T00:00:00.000","Mount Burdell Preserve","2.04.020","Bicycles and Similar Vehicles.","Legal Description (https://library.municode.com/ca/marin_county/codes/code_of_ordinances?nodeId=APXAMACOOPSPDICO_CH02.04LAUSREEHTRRE_02.04.020BISIVE)","0","3","April","2022","false","true","IC204_020_Bicycles","2.04","MOBU","Bicycles","38.1258510","-122.5925690","(38.125851, -122.592569)","MOBU_2.04.020_4/1/2022"
"2022-04-01T00:00:00.000","Mount Burdell Preserve","2.05.010","Dogs and other Animals","Legal Description (https://library.municode.com/ca/marin_county/codes/code_of_ordinances?nodeId=APXAMACOOPSPDICO_CH02.05LAUSREOMANRE_02.05.010DOOTAN)","0","3","April","2022","false","true","IC205_010_Dogs_OtherAnimals","2.05","MOBU","Dogs _Other Animals","38.1258510","-122.5925690","(38.125851, -122.592569)","MOBU_2.05.010_4/1/2022"
"2022-04-01T00:00:00.000","Other Lands (state, federal, MMWD, city, etc.)","2.05.010","Dogs and other Animals","Legal Description (https://library.municode.com/ca/marin_county/codes/code_of_ordinances?nodeId=APXAMACOOPSPDICO_CH02.05LAUSREOMANRE_02.05.010DOOTAN)","0","2","April","2022","false","true","IC205_010_Dogs_OtherAnimals","2.05","OTLA","Dogs _Other Animals",,,,"OTLA_2.05.010_4/1/2022"
"2022-04-01T00:00:00.000","Ring Mountain Preserve","2.05.010","Dogs and other Animals","Legal Description (https://library.municode.com/ca/marin_county/codes/code_of_ordinances?nodeId=APXAMACOOPSPDICO_CH02.05LAUSREOMANRE_02.05.010DOOTAN)","4","4","April","2022","false","true","IC205_010_Dogs_OtherAnimals","2.05","RIMO","Dogs _Other Animals","37.9208950","-122.4943440","(37.920895, -122.494344)","RIMO_2.05.010_4/1/2022"
"2022-04-01T00:00:00.000","Ring Mountain Preserve","IntAct","Interpretive Activity",,"0","0","April","2022","false","true","InterpretiveActivity","","RIMO","IntAct","37.9208950","-122.4943440","(37.920895, -122.494344)","RIMO_IntAct_4/1/2022"
"2022-04-01T00:00:00.000","Rush Creek Preserve","2.05.010","Dogs and other Animals","Legal Description (https://library.municode.com/ca/marin_county/codes/code_of_ordinances?nodeId=APXAMACOOPSPDICO_CH02.05LAUSREOMANRE_02.05.010DOOTAN)","2","0","April","2022","false","true","IC205_010_Dogs_OtherAnimals","2.05","RUCR","Dogs _Other Animals","38.1184270","-122.5642700","(38.118427, -122.56427)","RUCR_2.05.010_4/1/2022"
"2022-04-01T00:00:00.000","Santa Venetia Marsh Preserve","Other","",,"0","1","April","2022","false","true","IC_Other","","SAVE","Other","38.0181460","-122.5154480","(38.018146, -122.515448)","SAVE_Other_4/1/2022"
"2022-04-01T00:00:00.000","Terra Linda-Sleepy Hollow Divide South Preserve","2.05.010","Dogs and other Animals","Legal Description (https://library.municode.com/ca/marin_county/codes/code_of_ordinances?nodeId=APXAMACOOPSPDICO_CH02.05LAUSREOMANRE_02.05.010DOOTAN)","0","8","April","2022","false","true","IC205_010_Dogs_OtherAnimals","2.05","TELI2","Dogs _Other Animals","37.9912710","-122.5505420","(37.991271, -122.550542)","TELI2_2.05.010_4/1/2022"
"2022-03-01T00:00:00.000","Camino Alto Preserve","2.05.010","Dogs and other Animals","Legal Description (https://library.municode.com/ca/marin_county/codes/code_of_ordinances?nodeId=APXAMACOOPSPDICO_CH02.05LAUSREOMANRE_02.05.010DOOTAN)","1","1","March","2022","false","true","IC205_010_Dogs_OtherAnimals","2.05","CAAL","Dogs _Other Animals","37.9171970","-122.5302000","(37.917197, -122.5302)","CAAL_2.05.010_3/1/2022"
"2022-03-01T00:00:00.000","Cascade Canyon Preserve","2.05.010","Dogs and other Animals","Legal Description (https://library.municode.com/ca/marin_county/codes/code_of_ordinances?nodeId=APXAMACOOPSPDICO_CH02.05LAUSREOMANRE_02.05.010DOOTAN)","0","0","March","2022","false","true","IC205_010_Dogs_OtherAnimals","2.05","CACA","Dogs _Other Animals","37.9781180","-122.6137890","(37.978118, -122.613789)","CACA_2.05.010_3/1/2022"
"2022-03-01T00:00:00.000","Indian Tree Preserve","2.05.010","Dogs and other Animals","Legal Description (https://library.municode.com/ca/marin_county/codes/code_of_ordinances?nodeId=APXAMACOOPSPDICO_CH02.05LAUSREOMANRE_02.05.010DOOTAN)","0","2","March","2022","false","true","IC205_010_Dogs_OtherAnimals","2.05","INTR","Dogs _Other Animals","38.1027790","-122.6337210","(38.102779, -122.633721)","INTR_2.05.010_3/1/2022"
"2022-03-01T00:00:00.000","Indian Tree Preserve","2.03.030","Wildlife and Animal Resources","Legal Description (https://library.municode.com/ca/marin_county/codes/code_of_ordinances?nodeId=APXAMACOOPSPDICO_CH02.03LAUSREESPR_02.03.030WIANRE)","0","1","March","2022","false","true","IC203_030_Wildlife_Animal","2.03","INTR","Wildlife _Animal","38.1027790","-122.6337210","(38.102779, -122.633721)","INTR_2.03.030_3/1/2022"
"2022-03-01T00:00:00.000","Indian Valley Preserve","2.05.010","Dogs and other Animals","Legal Description (https://library.municode.com/ca/marin_county/codes/code_of_ordinances?nodeId=APXAMACOOPSPDICO_CH02.05LAUSREOMANRE_02.05.010DOOTAN)","1","0","March","2022","false","true","IC205_010_Dogs_OtherAnimals","2.05","INVA","Dogs _Other Animals","38.0768480","-122.5824270","(38.076848, -122.582427)","INVA_2.05.010_3/1/2022"
"2022-03-01T00:00:00.000","Indian Valley Preserve","2.02.010","Compliance with all laws, regulations and signs","Legal Description (https://library.municode.com/ca/marin_county/codes/code_of_ordinances?nodeId=APXAMACOOPSPDICO_CH02.02LAUSREISCO_02.02.010COALLARESI)","1","0","March","2022","false","true","IC202_010_Laws_Regs","2.02","INVA","Laws _Regs","38.0768480","-122.5824270","(38.076848, -122.582427)","INVA_2.02.010_3/1/2022"
"2022-03-01T00:00:00.000","King Mountain Preserve","2.02.010","Compliance with all laws, regulations and signs","Legal Description (https://library.municode.com/ca/marin_county/codes/code_of_ordinances?nodeId=APXAMACOOPSPDICO_CH02.02LAUSREISCO_02.02.010COALLARESI)","0","0","March","2022","false","true","IC202_010_Laws_Regs","2.02","KIMO","Laws _Regs","37.9384520","-122.5390310","(37.938452, -122.539031)","KIMO_2.02.010_3/1/2022"
"2022-03-01T00:00:00.000","King Mountain Preserve","2.05.010","Dogs and other Animals","Legal Description (https://library.municode.com/ca/marin_county/codes/code_of_ordinances?nodeId=APXAMACOOPSPDICO_CH02.05LAUSREOMANRE_02.05.010DOOTAN)","2","1","March","2022","false","true","IC205_010_Dogs_OtherAnimals","2.05","KIMO","Dogs _Other Animals","37.9384520","-122.5390310","(37.938452, -122.539031)","KIMO_2.05.010_3/1/2022"
"2022-03-01T00:00:00.000","Loma Verde Preserve","2.02.090","Firearms, Traps and Other Weapons.","Legal Description (https://library.municode.com/ca/marin_county/codes/code_of_ordinances?nodeId=APXAMACOOPSPDICO_CH02.02LAUSREISCO_02.02.090FITROTWE)","0","3","March","2022","false","true","IC202_090_Firearms_Weapons","2.02","LOVE","Firearms _Weapons","38.0647760","-122.5509510","(38.064776, -122.550951)","LOVE_2.02.090_3/1/2022"
"2022-03-01T00:00:00.000","Loma Verde Preserve","2.02.080","Games and Miscellaneous Activities","Legal Description (https://library.municode.com/ca/marin_county/codes/code_of_ordinances?nodeId=APXAMACOOPSPDICO_CH02.02LAUSREISCO_02.02.080GAMIAC)","0","3","March","2022","false","true","IC202_080_Games_Activities","2.02","LOVE","Games _Activities","38.0647760","-122.5509510","(38.064776, -122.550951)","LOVE_2.02.080_3/1/2022"
"2022-03-01T00:00:00.000","Loma Verde Preserve","2.02.160","Commerical Activities","Legal Description (https://library.municode.com/ca/marin_county/codes/code_of_ordinances?nodeId=APXAMACOOPSPDICO_CH02.02LAUSREISCO_02.02.160COAC)","0","2","March","2022","false","true","IC202_160_CommercialActivity","2.02","LOVE","Commercial Activity","38.0647760","-122.5509510","(38.064776, -122.550951)","LOVE_2.02.160_3/1/2022"
"2022-03-01T00:00:00.000","Mount Burdell Preserve","2.05.010","Dogs and other Animals","Legal Description (https://library.municode.com/ca/marin_county/codes/code_of_ordinances?nodeId=APXAMACOOPSPDICO_CH02.05LAUSREOMANRE_02.05.010DOOTAN)","0","2","March","2022","false","true","IC205_010_Dogs_OtherAnimals","2.05","MOBU","Dogs _Other Animals","38.1258510","-122.5925690","(38.125851, -122.592569)","MOBU_2.05.010_3/1/2022"
"2022-03-01T00:00:00.000","Pacheco Valle Preserve","2.05.010","Dogs and other Animals","Legal Description (https://library.municode.com/ca/marin_county/codes/code_of_ordinances?nodeId=APXAMACOOPSPDICO_CH02.05LAUSREOMANRE_02.05.010DOOTAN)","0","1","March","2022","false","true","IC205_010_Dogs_OtherAnimals","2.05","PAVA","Dogs _Other Animals","38.0493370","-122.5343570","(38.049337, -122.534357)","PAVA_2.05.010_3/1/2022"
"2022-03-01T00:00:00.000","Ring Mountain Preserve","2.06.030","Smoking","Legal Description (https://library.municode.com/ca/marin_county/codes/code_of_ordinances?nodeId=APXAMACOOPSPDICO_CH02.06LAUSREIRRE_02.06.030SM)","0","1","March","2022","false","true","IC206_030_Smoking","2.06","RIMO","Smoking","37.9208950","-122.4943440","(37.920895, -122.494344)","RIMO_2.06.030_3/1/2022"
"2022-03-01T00:00:00.000","Ring Mountain Preserve","2.04.020","Bicycles and Similar Vehicles.","Legal Description (https://library.municode.com/ca/marin_county/codes/code_of_ordinances?nodeId=APXAMACOOPSPDICO_CH02.04LAUSREEHTRRE_02.04.020BISIVE)","1","0","March","2022","false","true","IC204_020_Bicycles","2.04","RIMO","Bicycles","37.9208950","-122.4943440","(37.920895, -122.494344)","RIMO_2.04.020_3/1/2022"
"2022-03-01T00:00:00.000","Ring Mountain Preserve","2.05.010","Dogs and other Animals","Legal Description (https://library.municode.com/ca/marin_county/codes/code_of_ordinances?nodeId=APXAMACOOPSPDICO_CH02.05LAUSREOMANRE_02.05.010DOOTAN)","3","4","March","2022","false","true","IC205_010_Dogs_OtherAnimals","2.05","RIMO","Dogs _Other Animals","37.9208950","-122.4943440","(37.920895, -122.494344)","RIMO_2.05.010_3/1/2022"
"2022-03-01T00:00:00.000","Rush Creek Preserve","2.05.010","Dogs and other Animals","Legal Description (https://library.municode.com/ca/marin_county/codes/code_of_ordinances?nodeId=APXAMACOOPSPDICO_CH02.05LAUSREOMANRE_02.05.010DOOTAN)","1","3","March","2022","false","true","IC205_010_Dogs_OtherAnimals","2.05","RUCR","Dogs _Other Animals","38.1184270","-122.5642700","(38.118427, -122.56427)","RUCR_2.05.010_3/1/2022"
"2022-03-01T00:00:00.000","Terra Linda-Sleepy Hollow Divide South Preserve","2.05.010","Dogs and other Animals","Legal Description (https://library.municode.com/ca/marin_county/codes/code_of_ordinances?nodeId=APXAMACOOPSPDICO_CH02.05LAUSREOMANRE_02.05.010DOOTAN)","1","9","March","2022","false","true","IC205_010_Dogs_OtherAnimals","2.05","TELI2","Dogs _Other Animals","37.9912710","-122.5505420","(37.991271, -122.550542)","TELI2_2.05.010_3/1/2022"
"2022-03-01T00:00:00.000","Whites Hill Preserve","2.05.010","Dogs and other Animals","Legal Description (https://library.municode.com/ca/marin_county/codes/code_of_ordinances?nodeId=APXAMACOOPSPDICO_CH02.05LAUSREOMANRE_02.05.010DOOTAN)","0","1","March","2022","false","true","IC205_010_Dogs_OtherAnimals","2.05","WHHI","Dogs _Other Animals","38.0097590","-122.6176100","(38.009759, -122.61761)","WHHI_2.05.010_3/1/2022"
"2022-02-01T00:00:00.000","Alto Bowl Preserve","2.05.010","Dogs and other Animals","Legal Description (https://library.municode.com/ca/marin_county/codes/code_of_ordinances?nodeId=APXAMACOOPSPDICO_CH02.05LAUSREOMANRE_02.05.010DOOTAN)","0","1","February","2022","false","true","IC205_010_Dogs_OtherAnimals","2.05","ALBO","Dogs _Other Animals","37.9177470","-122.5203410","(37.917747, -122.520341)","ALBO_2.05.010_2/1/2022"
"2022-02-01T00:00:00.000","Baltimore Canyon Preserve","2.05.010","Dogs and other Animals","Legal Description (https://library.municode.com/ca/marin_county/codes/code_of_ordinances?nodeId=APXAMACOOPSPDICO_CH02.05LAUSREOMANRE_02.05.010DOOTAN)","5","5","February","2022","false","true","IC205_010_Dogs_OtherAnimals","2.05","BACA","Dogs _Other Animals","37.9311380","-122.5507450","(37.931138, -122.550745)","BACA_2.05.010_2/1/2022"
"2022-02-01T00:00:00.000","Baltimore Canyon Preserve","2.04.020","Bicycles and Similar Vehicles.","Legal Description (https://library.municode.com/ca/marin_county/codes/code_of_ordinances?nodeId=APXAMACOOPSPDICO_CH02.04LAUSREEHTRRE_02.04.020BISIVE)","1","0","February","2022","false","true","IC204_020_Bicycles","2.04","BACA","Bicycles","37.9311380","-122.5507450","(37.931138, -122.550745)","BACA_2.04.020_2/1/2022"
"2022-02-01T00:00:00.000","Cascade Canyon Preserve","2.05.010","Dogs and other Animals","Legal Description (https://library.municode.com/ca/marin_county/codes/code_of_ordinances?nodeId=APXAMACOOPSPDICO_CH02.05LAUSREOMANRE_02.05.010DOOTAN)","0","1","February","2022","false","true","IC205_010_Dogs_OtherAnimals","2.05","CACA","Dogs _Other Animals","37.9781180","-122.6137890","(37.978118, -122.613789)","CACA_2.05.010_2/1/2022"
"2022-02-01T00:00:00.000","Cascade Canyon Preserve","2.04.020","Bicycles and Similar Vehicles.","Legal Description (https://library.municode.com/ca/marin_county/codes/code_of_ordinances?nodeId=APXAMACOOPSPDICO_CH02.04LAUSREEHTRRE_02.04.020BISIVE)","0","2","February","2022","false","true","IC204_020_Bicycles","2.04","CACA","Bicycles","37.9781180","-122.6137890","(37.978118, -122.613789)","CACA_2.04.020_2/1/2022"
"2022-02-01T00:00:00.000","Horse Hill Preserve","2.05.010","Dogs and other Animals","Legal Description (https://library.municode.com/ca/marin_county/codes/code_of_ordinances?nodeId=APXAMACOOPSPDICO_CH02.05LAUSREOMANRE_02.05.010DOOTAN)","3","2","February","2022","false","true","IC205_010_Dogs_OtherAnimals","2.05","HOHI","Dogs _Other Animals","37.9084810","-122.5150140","(37.908481, -122.515014)","HOHI_2.05.010_2/1/2022"
"2022-02-01T00:00:00.000","Indian Valley Preserve","2.05.010","Dogs and other Animals","Legal Description (https://library.municode.com/ca/marin_county/codes/code_of_ordinances?nodeId=APXAMACOOPSPDICO_CH02.05LAUSREOMANRE_02.05.010DOOTAN)","0","1","February","2022","false","true","IC205_010_Dogs_OtherAnimals","2.05","INVA","Dogs _Other Animals","38.0768480","-122.5824270","(38.076848, -122.582427)","INVA_2.05.010_2/1/2022"
"2022-02-01T00:00:00.000","Indian Valley Preserve","2.02.160","Commerical Activities","Legal Description (https://library.municode.com/ca/marin_county/codes/code_of_ordinances?nodeId=APXAMACOOPSPDICO_CH02.02LAUSREISCO_02.02.160COAC)","0","2","February","2022","false","true","IC202_160_CommercialActivity","2.02","INVA","Commercial Activity","38.0768480","-122.5824270","(38.076848, -122.582427)","INVA_2.02.160_2/1/2022"
"2022-02-01T00:00:00.000","King Mountain Preserve","2.04.010","Motor Vehicles","Legal Description (https://library.municode.com/ca/marin_county/codes/code_of_ordinances?nodeId=APXAMACOOPSPDICO_CH02.03LAUSREESPR_02.03.050ARHIRE)","0","1","February","2022","false","true","IC204_010_MotorVehicles","2.04","KIMO","Motor Vehicles","37.9384520","-122.5390310","(37.938452, -122.539031)","KIMO_2.04.010_2/1/2022"
"2022-02-01T00:00:00.000","King Mountain Preserve","2.05.010","Dogs and other Animals","Legal Description (https://library.municode.com/ca/marin_county/codes/code_of_ordinances?nodeId=APXAMACOOPSPDICO_CH02.05LAUSREOMANRE_02.05.010DOOTAN)","0","2","February","2022","false","true","IC205_010_Dogs_OtherAnimals","2.05","KIMO","Dogs _Other Animals","37.9384520","-122.5390310","(37.938452, -122.539031)","KIMO_2.05.010_2/1/2022"
"2022-02-01T00:00:00.000","Loma Alta Preserve","2.05.010","Dogs and other Animals","Legal Description (https://library.municode.com/ca/marin_county/codes/code_of_ordinances?nodeId=APXAMACOOPSPDICO_CH02.05LAUSREOMANRE_02.05.010DOOTAN)","0","1","February","2022","false","true","IC205_010_Dogs_OtherAnimals","2.05","LOAL","Dogs _Other Animals","38.0053190","-122.6046970","(38.005319, -122.604697)","LOAL_2.05.010_2/1/2022"
"2022-02-01T00:00:00.000","Mount Burdell Preserve","2.04.020","Bicycles and Similar Vehicles.","Legal Description (https://library.municode.com/ca/marin_county/codes/code_of_ordinances?nodeId=APXAMACOOPSPDICO_CH02.04LAUSREEHTRRE_02.04.020BISIVE)","1","1","February","2022","false","true","IC204_020_Bicycles","2.04","MOBU","Bicycles","38.1258510","-122.5925690","(38.125851, -122.592569)","MOBU_2.04.020_2/1/2022"
"2022-02-01T00:00:00.000","Mount Burdell Preserve","SearchRes","Search and Rescue",,"0","1","February","2022","false","true","SearchRes","","MOBU","SearchRes","38.1258510","-122.5925690","(38.125851, -122.592569)","MOBU_SearchRes_2/1/2022"
"2022-02-01T00:00:00.000","Mount Burdell Preserve","2.05.010","Dogs and other Animals","Legal Description (https://library.municode.com/ca/marin_county/codes/code_of_ordinances?nodeId=APXAMACOOPSPDICO_CH02.05LAUSREOMANRE_02.05.010DOOTAN)","4","6","February","2022","false","true","IC205_010_Dogs_OtherAnimals","2.05","MOBU","Dogs _Other Animals","38.1258510","-122.5925690","(38.125851, -122.592569)","MOBU_2.05.010_2/1/2022"
"2022-02-01T00:00:00.000","Pacheco Valle Preserve","2.02.060","Camping","Legal Description (https://library.municode.com/ca/marin_county/codes/code_of_ordinances?nodeId=APXAMACOOPSPDICO_CH02.02LAUSREISCO_02.02.060CA)","0","0","February","2022","false","true","IC202_060_Camping","2.02","PAVA","Camping","38.0493370","-122.5343570","(38.049337, -122.534357)","PAVA_2.02.060_2/1/2022"
"2022-02-01T00:00:00.000","Ring Mountain Preserve","2.03.050","Archeological and Historical Resources","Legal Description (https://library.municode.com/ca/marin_county/codes/code_of_ordinances?nodeId=APXAMACOOPSPDICO_CH02.03LAUSREESPR_02.03.050ARHIRE)","0","0","February","2022","false","true","IC203_050_Arch_Historical","2.03","RIMO","Arch. _Historical","37.9208950","-122.4943440","(37.920895, -122.494344)","RIMO_2.03.050_2/1/2022"
"2022-02-01T00:00:00.000","Ring Mountain Preserve","2.04.020","Bicycles and Similar Vehicles.","Legal Description (https://library.municode.com/ca/marin_county/codes/code_of_ordinances?nodeId=APXAMACOOPSPDICO_CH02.04LAUSREEHTRRE_02.04.020BISIVE)","1","0","February","2022","false","true","IC204_020_Bicycles","2.04","RIMO","Bicycles","37.9208950","-122.4943440","(37.920895, -122.494344)","RIMO_2.04.020_2/1/2022"
"2022-02-01T00:00:00.000","Ring Mountain Preserve","2.05.010","Dogs and other Animals","Legal Description (https://library.municode.com/ca/marin_county/codes/code_of_ordinances?nodeId=APXAMACOOPSPDICO_CH02.05LAUSREOMANRE_02.05.010DOOTAN)","6","12","February","2022","false","true","IC205_010_Dogs_OtherAnimals","2.05","RIMO","Dogs _Other Animals","37.9208950","-122.4943440","(37.920895, -122.494344)","RIMO_2.05.010_2/1/2022"
"2022-02-01T00:00:00.000","Ring Mountain Preserve","2.03.040","Geological Resources","Legal Description (https://library.municode.com/ca/marin_county/codes/code_of_ordinances?nodeId=APXAMACOOPSPDICO_CH02.03LAUSREESPR_02.03.040GERE)","0","0","February","2022","false","true","IC203_040_Geological","2.03","RIMO","Geological","37.9208950","-122.4943440","(37.920895, -122.494344)","RIMO_2.03.040_2/1/2022"
"2022-01-01T00:00:00.000","Baltimore Canyon Preserve","2.05.010","Dogs and other Animals","Legal Description (https://library.municode.com/ca/marin_county/codes/code_of_ordinances?nodeId=APXAMACOOPSPDICO_CH02.05LAUSREOMANRE_02.05.010DOOTAN)","1","0","January","2022","false","true","IC205_010_Dogs_OtherAnimals","2.05","BACA","Dogs _Other Animals","37.9311380","-122.5507450","(37.931138, -122.550745)","BACA_2.05.010_1/1/2022"
"2022-01-01T00:00:00.000","Baltimore Canyon Preserve","2.02.140","Unauthorized Structures, Encroachments and Signs.","Legal Description (https://library.municode.com/ca/marin_county/codes/code_of_ordinances?nodeId=APXAMACOOPSPDICO_CH02.02LAUSREISCO_02.02.140UNST)","0","0","January","2022","false","true","IC202_140_UnauthStructEncrh","2.02","BACA","Unauth. Struct. Encrch.","37.9311380","-122.5507450","(37.931138, -122.550745)","BACA_2.02.140_1/1/2022"
"2022-01-01T00:00:00.000","Bolinas Lagoon Preserve","2.03.030","Wildlife and Animal Resources","Legal Description (https://library.municode.com/ca/marin_county/codes/code_of_ordinances?nodeId=APXAMACOOPSPDICO_CH02.03LAUSREESPR_02.03.030WIANRE)","0","2","January","2022","false","true","IC203_030_Wildlife_Animal","2.03","BOLA","Wildlife _Animal","37.9150490","-122.6918490","(37.915049, -122.691849)","BOLA_2.03.030_1/1/2022"
"2022-01-01T00:00:00.000","Camino Alto Preserve","2.05.010","Dogs and other Animals","Legal Description (https://library.municode.com/ca/marin_county/codes/code_of_ordinances?nodeId=APXAMACOOPSPDICO_CH02.05LAUSREOMANRE_02.05.010DOOTAN)","1","0","January","2022","false","true","IC205_010_Dogs_OtherAnimals","2.05","CAAL","Dogs _Other Animals","37.9171970","-122.5302000","(37.917197, -122.5302)","CAAL_2.05.010_1/1/2022"
"2022-01-01T00:00:00.000","Cascade Canyon Preserve","2.02.010","Compliance with all laws, regulations and signs","Legal Description (https://library.municode.com/ca/marin_county/codes/code_of_ordinances?nodeId=APXAMACOOPSPDICO_CH02.02LAUSREISCO_02.02.010COALLARESI)","1","0","January","2022","false","true","IC202_010_Laws_Regs","2.02","CACA","Laws _Regs","37.9781180","-122.6137890","(37.978118, -122.613789)","CACA_2.02.010_1/1/2022"
"2022-01-01T00:00:00.000","Cascade Canyon Preserve","2.05.010","Dogs and other Animals","Legal Description (https://library.municode.com/ca/marin_county/codes/code_of_ordinances?nodeId=APXAMACOOPSPDICO_CH02.05LAUSREOMANRE_02.05.010DOOTAN)","0","5","January","2022","false","true","IC205_010_Dogs_OtherAnimals","2.05","CACA","Dogs _Other Animals","37.9781180","-122.6137890","(37.978118, -122.613789)","CACA_2.05.010_1/1/2022"
"2022-01-01T00:00:00.000","Cascade Canyon Preserve","2.04.020","Bicycles and Similar Vehicles.","Legal Description (https://library.municode.com/ca/marin_county/codes/code_of_ordinances?nodeId=APXAMACOOPSPDICO_CH02.04LAUSREEHTRRE_02.04.020BISIVE)","0","2","January","2022","false","true","IC204_020_Bicycles","2.04","CACA","Bicycles","37.9781180","-122.6137890","(37.978118, -122.613789)","CACA_2.04.020_1/1/2022"
"2022-01-01T00:00:00.000","Horse Hill Preserve","2.05.010","Dogs and other Animals","Legal Description (https://library.municode.com/ca/marin_county/codes/code_of_ordinances?nodeId=APXAMACOOPSPDICO_CH02.05LAUSREOMANRE_02.05.010DOOTAN)","1","0","January","2022","false","true","IC205_010_Dogs_OtherAnimals","2.05","HOHI","Dogs _Other Animals","37.9084810","-122.5150140","(37.908481, -122.515014)","HOHI_2.05.010_1/1/2022"
"2022-01-01T00:00:00.000","Ignacio Valley Preserve","2.05.010","Dogs and other Animals","Legal Description (https://library.municode.com/ca/marin_county/codes/code_of_ordinances?nodeId=APXAMACOOPSPDICO_CH02.05LAUSREOMANRE_02.05.010DOOTAN)","0","1","January","2022","false","true","IC205_010_Dogs_OtherAnimals","2.05","IGVA","Dogs _Other Animals","38.0642570","-122.5554440","(38.064257, -122.555444)","IGVA_2.05.010_1/1/2022"
"2022-01-01T00:00:00.000","King Mountain Preserve","2.05.010","Dogs and other Animals","Legal Description (https://library.municode.com/ca/marin_county/codes/code_of_ordinances?nodeId=APXAMACOOPSPDICO_CH02.05LAUSREOMANRE_02.05.010DOOTAN)","0","1","January","2022","false","true","IC205_010_Dogs_OtherAnimals","2.05","KIMO","Dogs _Other Animals","37.9384520","-122.5390310","(37.938452, -122.539031)","KIMO_2.05.010_1/1/2022"
"2022-01-01T00:00:00.000","Lucas Valley Preserve","2.05.010","Dogs and other Animals","Legal Description (https://library.municode.com/ca/marin_county/codes/code_of_ordinances?nodeId=APXAMACOOPSPDICO_CH02.05LAUSREOMANRE_02.05.010DOOTAN)","1","0","January","2022","false","true","IC205_010_Dogs_OtherAnimals","2.05","LUVA","Dogs _Other Animals","38.0385690","-122.5916700","(38.038569, -122.59167)","LUVA_2.05.010_1/1/2022"
"2022-01-01T00:00:00.000","Mount Burdell Preserve","2.02.010","Compliance with all laws, regulations and signs","Legal Description (https://library.municode.com/ca/marin_county/codes/code_of_ordinances?nodeId=APXAMACOOPSPDICO_CH02.02LAUSREISCO_02.02.010COALLARESI)","2","0","January","2022","false","true","IC202_010_Laws_Regs","2.02","MOBU","Laws _Regs","38.1258510","-122.5925690","(38.125851, -122.592569)","MOBU_2.02.010_1/1/2022"
"2022-01-01T00:00:00.000","Mount Burdell Preserve","2.04.020","Bicycles and Similar Vehicles.","Legal Description (https://library.municode.com/ca/marin_county/codes/code_of_ordinances?nodeId=APXAMACOOPSPDICO_CH02.04LAUSREEHTRRE_02.04.020BISIVE)","1","1","January","2022","false","true","IC204_020_Bicycles","2.04","MOBU","Bicycles","38.1258510","-122.5925690","(38.125851, -122.592569)","MOBU_2.04.020_1/1/2022"
"2022-01-01T00:00:00.000","Mount Burdell Preserve","2.05.010","Dogs and other Animals","Legal Description (https://library.municode.com/ca/marin_county/codes/code_of_ordinances?nodeId=APXAMACOOPSPDICO_CH02.05LAUSREOMANRE_02.05.010DOOTAN)","0","1","January","2022","false","true","IC205_010_Dogs_OtherAnimals","2.05","MOBU","Dogs _Other Animals","38.1258510","-122.5925690","(38.125851, -122.592569)","MOBU_2.05.010_1/1/2022"
"2022-01-01T00:00:00.000","Mount Burdell Preserve","2.02.020","Use Restrictions","Legal Description (https://library.municode.com/ca/marin_county/codes/code_of_ordinances?nodeId=APXAMACOOPSPDICO_CH02.02LAUSREISCO_02.02.020USRE)","0","3","January","2022","false","true","IC202_020_UseRestrictions","2.02","MOBU","Use Restrictions","38.1258510","-122.5925690","(38.125851, -122.592569)","MOBU_2.02.020_1/1/2022"
"2022-01-01T00:00:00.000","Old St. Hillary's Preserve","2.05.010","Dogs and other Animals","Legal Description (https://library.municode.com/ca/marin_county/codes/code_of_ordinances?nodeId=APXAMACOOPSPDICO_CH02.05LAUSREOMANRE_02.05.010DOOTAN)","0","1","January","2022","false","true","IC205_010_Dogs_OtherAnimals","2.05","OLST","Dogs _Other Animals","37.8762850","-122.4516850","(37.876285, -122.451685)","OLST_2.05.010_1/1/2022"
"2022-01-01T00:00:00.000","Ring Mountain Preserve","2.05.010","Dogs and other Animals","Legal Description (https://library.municode.com/ca/marin_county/codes/code_of_ordinances?nodeId=APXAMACOOPSPDICO_CH02.05LAUSREOMANRE_02.05.010DOOTAN)","2","1","January","2022","false","true","IC205_010_Dogs_OtherAnimals","2.05","RIMO","Dogs _Other Animals","37.9208950","-122.4943440","(37.920895, -122.494344)","RIMO_2.05.010_1/1/2022"
"2022-01-01T00:00:00.000","Ring Mountain Preserve","2.03.050","Archeological and Historical Resources","Legal Description (https://library.municode.com/ca/marin_county/codes/code_of_ordinances?nodeId=APXAMACOOPSPDICO_CH02.03LAUSREESPR_02.03.050ARHIRE)","0","1","January","2022","false","true","IC203_050_Arch_Historical","2.03","RIMO","Arch. _Historical","37.9208950","-122.4943440","(37.920895, -122.494344)","RIMO_2.03.050_1/1/2022"
"2022-01-01T00:00:00.000","Ring Mountain Preserve","2.03.040","Geological Resources","Legal Description (https://library.municode.com/ca/marin_county/codes/code_of_ordinances?nodeId=APXAMACOOPSPDICO_CH02.03LAUSREESPR_02.03.040GERE)","0","1","January","2022","false","true","IC203_040_Geological","2.03","RIMO","Geological","37.9208950","-122.4943440","(37.920895, -122.494344)","RIMO_2.03.040_1/1/2022"
"2022-01-01T00:00:00.000","Rush Creek Preserve","2.05.010","Dogs and other Animals","Legal Description (https://library.municode.com/ca/marin_county/codes/code_of_ordinances?nodeId=APXAMACOOPSPDICO_CH02.05LAUSREOMANRE_02.05.010DOOTAN)","0","2","January","2022","false","true","IC205_010_Dogs_OtherAnimals","2.05","RUCR","Dogs _Other Animals","38.1184270","-122.5642700","(38.118427, -122.56427)","RUCR_2.05.010_1/1/2022"
"2022-01-01T00:00:00.000","Terra Linda-Sleepy Hollow Divide North Preserve","2.05.010","Dogs and other Animals","Legal Description (https://library.municode.com/ca/marin_county/codes/code_of_ordinances?nodeId=APXAMACOOPSPDICO_CH02.05LAUSREOMANRE_02.05.010DOOTAN)","1","0","January","2022","false","true","IC205_010_Dogs_OtherAnimals","2.05","TELI","Dogs _Other Animals","38.0251610","-122.5689510","(38.025161, -122.568951)","TELI_2.05.010_1/1/2022"
"2022-01-01T00:00:00.000","Terra Linda-Sleepy Hollow Divide North Preserve","2.04.020","Bicycles and Similar Vehicles.","Legal Description (https://library.municode.com/ca/marin_county/codes/code_of_ordinances?nodeId=APXAMACOOPSPDICO_CH02.04LAUSREEHTRRE_02.04.020BISIVE)","4","0","January","2022","false","true","IC204_020_Bicycles","2.04","TELI","Bicycles","38.0251610","-122.5689510","(38.025161, -122.568951)","TELI_2.04.020_1/1/2022"
"2022-01-01T00:00:00.000","Terra Linda-Sleepy Hollow Divide South Preserve","PropDmg","Property Damage",,"0","0","January","2022","false","true","PropDmg","","TELI2","PropDmg","37.9912710","-122.5505420","(37.991271, -122.550542)","TELI2_PropDmg_1/1/2022"
"2022-01-01T00:00:00.000","Terra Linda-Sleepy Hollow Divide South Preserve","2.05.010","Dogs and other Animals","Legal Description (https://library.municode.com/ca/marin_county/codes/code_of_ordinances?nodeId=APXAMACOOPSPDICO_CH02.05LAUSREOMANRE_02.05.010DOOTAN)","1","1","January","2022","false","true","IC205_010_Dogs_OtherAnimals","2.05","TELI2","Dogs _Other Animals","37.9912710","-122.5505420","(37.991271, -122.550542)","TELI2_2.05.010_1/1/2022"
"2022-01-01T00:00:00.000","Terra Linda-Sleepy Hollow Divide South Preserve","2.04.020","Bicycles and Similar Vehicles.","Legal Description (https://library.municode.com/ca/marin_county/codes/code_of_ordinances?nodeId=APXAMACOOPSPDICO_CH02.04LAUSREEHTRRE_02.04.020BISIVE)","2","0","January","2022","false","true","IC204_020_Bicycles","2.04","TELI2","Bicycles","37.9912710","-122.5505420","(37.991271, -122.550542)","TELI2_2.04.020_1/1/2022"
"2021-12-01T00:00:00.000","Alto Bowl Preserve","2.05.010","Dogs and other Animals","Legal Description (https://library.municode.com/ca/marin_county/codes/code_of_ordinances?nodeId=APXAMACOOPSPDICO_CH02.05LAUSREOMANRE_02.05.010DOOTAN)","0","0","December","2021","false","true","IC205_010_Dogs_OtherAnimals","2.05","ALBO","Dogs _Other Animals","37.9177470","-122.5203410","(37.917747, -122.520341)","ALBO_2.05.010_12/1/2021"
"2021-12-01T00:00:00.000","Big Rock Ridge, South","2.05.010","Dogs and other Animals","Legal Description (https://library.municode.com/ca/marin_county/codes/code_of_ordinances?nodeId=APXAMACOOPSPDICO_CH02.05LAUSREOMANRE_02.05.010DOOTAN)","0","1","December","2021","false","true","IC205_010_Dogs_OtherAnimals","2.05","BRRS","Dogs _Other Animals","38.0373870","-122.5921600","(38.037387, -122.59216)","BRRS_2.05.010_12/1/2021"
"2021-12-01T00:00:00.000","Camino Alto Preserve","2.05.010","Dogs and other Animals","Legal Description (https://library.municode.com/ca/marin_county/codes/code_of_ordinances?nodeId=APXAMACOOPSPDICO_CH02.05LAUSREOMANRE_02.05.010DOOTAN)","0","1","December","2021","false","true","IC205_010_Dogs_OtherAnimals","2.05","CAAL","Dogs _Other Animals","37.9171970","-122.5302000","(37.917197, -122.5302)","CAAL_2.05.010_12/1/2021"
"2021-12-01T00:00:00.000","Cascade Canyon Preserve","2.05.010","Dogs and other Animals","Legal Description (https://library.municode.com/ca/marin_county/codes/code_of_ordinances?nodeId=APXAMACOOPSPDICO_CH02.05LAUSREOMANRE_02.05.010DOOTAN)","0","2","December","2021","false","true","IC205_010_Dogs_OtherAnimals","2.05","CACA","Dogs _Other Animals","37.9781180","-122.6137890","(37.978118, -122.613789)","CACA_2.05.010_12/1/2021"
"2021-12-01T00:00:00.000","Cascade Canyon Preserve","2.03.020","Botanical Resources","Legal Description (https://library.municode.com/ca/marin_county/codes/code_of_ordinances?nodeId=APXAMACOOPSPDICO_CH02.03LAUSREESPR_02.03.020BORE)","0","0","December","2021","false","true","IC203_020_Botanical","2.03","CACA","Botanical","37.9781180","-122.6137890","(37.978118, -122.613789)","CACA_2.03.020_12/1/2021"
"2021-12-01T00:00:00.000","Cascade Canyon Preserve","2.04.020","Bicycles and Similar Vehicles.","Legal Description (https://library.municode.com/ca/marin_county/codes/code_of_ordinances?nodeId=APXAMACOOPSPDICO_CH02.04LAUSREEHTRRE_02.04.020BISIVE)","4","0","December","2021","false","true","IC204_020_Bicycles","2.04","CACA","Bicycles","37.9781180","-122.6137890","(37.978118, -122.613789)","CACA_2.04.020_12/1/2021"
"2021-12-01T00:00:00.000","Deer Island Preserve","2.05.010","Dogs and other Animals","Legal Description (https://library.municode.com/ca/marin_county/codes/code_of_ordinances?nodeId=APXAMACOOPSPDICO_CH02.05LAUSREOMANRE_02.05.010DOOTAN)","0","1","December","2021","false","true","IC205_010_Dogs_OtherAnimals","2.05","DEIS","Dogs _Other Animals","38.1022640","-122.5388210","(38.102264, -122.538821)","DEIS_2.05.010_12/1/2021"
"2021-12-01T00:00:00.000","Gary Giacomini Preserve","2.05.010","Dogs and other Animals","Legal Description (https://library.municode.com/ca/marin_county/codes/code_of_ordinances?nodeId=APXAMACOOPSPDICO_CH02.05LAUSREOMANRE_02.05.010DOOTAN)","0","0","December","2021","false","true","IC205_010_Dogs_OtherAnimals","2.05","GAGI","Dogs _Other Animals","38.0108460","-122.6533150","(38.010846, -122.653315)","GAGI_2.05.010_12/1/2021"
"2021-12-01T00:00:00.000","Ignacio Valley Preserve","2.05.010","Dogs and other Animals","Legal Description (https://library.municode.com/ca/marin_county/codes/code_of_ordinances?nodeId=APXAMACOOPSPDICO_CH02.05LAUSREOMANRE_02.05.010DOOTAN)","0","1","December","2021","false","true","IC205_010_Dogs_OtherAnimals","2.05","IGVA","Dogs _Other Animals","38.0642570","-122.5554440","(38.064257, -122.555444)","IGVA_2.05.010_12/1/2021"
"2021-12-01T00:00:00.000","King Mountain Preserve","2.05.010","Dogs and other Animals","Legal Description (https://library.municode.com/ca/marin_county/codes/code_of_ordinances?nodeId=APXAMACOOPSPDICO_CH02.05LAUSREOMANRE_02.05.010DOOTAN)","1","0","December","2021","false","true","IC205_010_Dogs_OtherAnimals","2.05","KIMO","Dogs _Other Animals","37.9384520","-122.5390310","(37.938452, -122.539031)","KIMO_2.05.010_12/1/2021"
"2021-12-01T00:00:00.000","Loma Alta Preserve","2.05.010","Dogs and other Animals","Legal Description (https://library.municode.com/ca/marin_county/codes/code_of_ordinances?nodeId=APXAMACOOPSPDICO_CH02.05LAUSREOMANRE_02.05.010DOOTAN)","1","0","December","2021","false","true","IC205_010_Dogs_OtherAnimals","2.05","LOAL","Dogs _Other Animals","38.0053190","-122.6046970","(38.005319, -122.604697)","LOAL_2.05.010_12/1/2021"
"2021-12-01T00:00:00.000","Maurice Thorner Memorial Preserve","2.05.010","Dogs and other Animals","Legal Description (https://library.municode.com/ca/marin_county/codes/code_of_ordinances?nodeId=APXAMACOOPSPDICO_CH02.05LAUSREOMANRE_02.05.010DOOTAN)","0","1","December","2021","false","true","IC205_010_Dogs_OtherAnimals","2.05","MATH","Dogs _Other Animals","38.0185410","-122.6731730","(38.018541, -122.673173)","MATH_2.05.010_12/1/2021"
"2021-12-01T00:00:00.000","Mount Burdell Preserve","2.05.010","Dogs and other Animals","Legal Description (https://library.municode.com/ca/marin_county/codes/code_of_ordinances?nodeId=APXAMACOOPSPDICO_CH02.05LAUSREOMANRE_02.05.010DOOTAN)","2","1","December","2021","false","true","IC205_010_Dogs_OtherAnimals","2.05","MOBU","Dogs _Other Animals","38.1258510","-122.5925690","(38.125851, -122.592569)","MOBU_2.05.010_12/1/2021"
"2021-12-01T00:00:00.000","Mount Burdell Preserve","2.02.030","Care of Property and Facilities.","Legal Description (https://library.municode.com/ca/marin_county/codes/code_of_ordinances?nodeId=APXAMACOOPSPDICO_CH02.02LAUSREISCO_02.02.030CAPRFA)","0","2","December","2021","false","true","IC202_030_CareOfProperty","2.02","MOBU","Care of Property","38.1258510","-122.5925690","(38.125851, -122.592569)","MOBU_2.02.030_12/1/2021"
"2021-12-01T00:00:00.000","Mount Burdell Preserve","2.04.020","Bicycles and Similar Vehicles.","Legal Description (https://library.municode.com/ca/marin_county/codes/code_of_ordinances?nodeId=APXAMACOOPSPDICO_CH02.04LAUSREEHTRRE_02.04.020BISIVE)","2","1","December","2021","false","true","IC204_020_Bicycles","2.04","MOBU","Bicycles","38.1258510","-122.5925690","(38.125851, -122.592569)","MOBU_2.04.020_12/1/2021"
"2021-12-01T00:00:00.000","Mount Burdell Preserve","2.03.020","Botanical Resources","Legal Description (https://library.municode.com/ca/marin_county/codes/code_of_ordinances?nodeId=APXAMACOOPSPDICO_CH02.03LAUSREESPR_02.03.020BORE)","0","3","December","2021","false","true","IC203_020_Botanical","2.03","MOBU","Botanical","38.1258510","-122.5925690","(38.125851, -122.592569)","MOBU_2.03.020_12/1/2021"
"2021-12-01T00:00:00.000","Mount Burdell Preserve","2.03.035","Tools and Trail Building Equipment","Legal Description (https://library.municode.com/ca/marin_county/codes/code_of_ordinances?nodeId=APXAMACOOPSPDICO_CH02.03LAUSREESPR_02.03.035TOTRBUEQ)","0","2","December","2021","false","true","IC203_035_Tools_Trail_BldgEquip","2.03","MOBU","ToolsBuildEquip","38.1258510","-122.5925690","(38.125851, -122.592569)","MOBU_2.03.035_12/1/2021"
"2021-12-01T00:00:00.000","Mount Burdell Preserve","2.02.010","Compliance with all laws, regulations and signs","Legal Description (https://library.municode.com/ca/marin_county/codes/code_of_ordinances?nodeId=APXAMACOOPSPDICO_CH02.02LAUSREISCO_02.02.010COALLARESI)","0","1","December","2021","false","true","IC202_010_Laws_Regs","2.02","MOBU","Laws _Regs","38.1258510","-122.5925690","(38.125851, -122.592569)","MOBU_2.02.010_12/1/2021"
"2021-12-01T00:00:00.000","Mount Burdell Preserve","2.03.040","Geological Resources","Legal Description (https://library.municode.com/ca/marin_county/codes/code_of_ordinances?nodeId=APXAMACOOPSPDICO_CH02.03LAUSREESPR_02.03.040GERE)","0","2","December","2021","false","true","IC203_040_Geological","2.03","MOBU","Geological","38.1258510","-122.5925690","(38.125851, -122.592569)","MOBU_2.03.040_12/1/2021"
"2021-12-01T00:00:00.000","Mount Burdell Preserve","2.03.050","Archeological and Historical Resources","Legal Description (https://library.municode.com/ca/marin_county/codes/code_of_ordinances?nodeId=APXAMACOOPSPDICO_CH02.03LAUSREESPR_02.03.050ARHIRE)","0","1","December","2021","false","true","IC203_050_Arch_Historical","2.03","MOBU","Arch. _Historical","38.1258510","-122.5925690","(38.125851, -122.592569)","MOBU_2.03.050_12/1/2021"
"2021-12-01T00:00:00.000","Old St. Hillary's Preserve","2.05.010","Dogs and other Animals","Legal Description (https://library.municode.com/ca/marin_county/codes/code_of_ordinances?nodeId=APXAMACOOPSPDICO_CH02.05LAUSREOMANRE_02.05.010DOOTAN)","1","0","December","2021","false","true","IC205_010_Dogs_OtherAnimals","2.05","OLST","Dogs _Other Animals","37.8762850","-122.4516850","(37.876285, -122.451685)","OLST_2.05.010_12/1/2021"
"2021-12-01T00:00:00.000","Ring Mountain Preserve","2.05.010","Dogs and other Animals","Legal Description (https://library.municode.com/ca/marin_county/codes/code_of_ordinances?nodeId=APXAMACOOPSPDICO_CH02.05LAUSREOMANRE_02.05.010DOOTAN)","2","0","December","2021","false","true","IC205_010_Dogs_OtherAnimals","2.05","RIMO","Dogs _Other Animals","37.9208950","-122.4943440","(37.920895, -122.494344)","RIMO_2.05.010_12/1/2021"
"2021-12-01T00:00:00.000","Roys Redwoods Preserve","2.05.010","Dogs and other Animals","Legal Description (https://library.municode.com/ca/marin_county/codes/code_of_ordinances?nodeId=APXAMACOOPSPDICO_CH02.05LAUSREOMANRE_02.05.010DOOTAN)","0","1","December","2021","false","true","IC205_010_Dogs_OtherAnimals","2.05","RORE","Dogs _Other Animals","38.0206550","-122.6617720","(38.020655, -122.661772)","RORE_2.05.010_12/1/2021"
"2021-12-01T00:00:00.000","Rush Creek Preserve","2.05.010","Dogs and other Animals","Legal Description (https://library.municode.com/ca/marin_county/codes/code_of_ordinances?nodeId=APXAMACOOPSPDICO_CH02.05LAUSREOMANRE_02.05.010DOOTAN)","0","1","December","2021","false","true","IC205_010_Dogs_OtherAnimals","2.05","RUCR","Dogs _Other Animals","38.1184270","-122.5642700","(38.118427, -122.56427)","RUCR_2.05.010_12/1/2021"
"2021-12-01T00:00:00.000","San Pedro Ridge Preserve","2.05.010","Dogs and other Animals","Legal Description (https://library.municode.com/ca/marin_county/codes/code_of_ordinances?nodeId=APXAMACOOPSPDICO_CH02.05LAUSREOMANRE_02.05.010DOOTAN)","0","1","December","2021","false","true","IC205_010_Dogs_OtherAnimals","2.05","SAPE","Dogs _Other Animals","38.0017790","-122.5207930","(38.001779, -122.520793)","SAPE_2.05.010_12/1/2021"
"2021-12-01T00:00:00.000","Santa Venetia Marsh Preserve","2.05.010","Dogs and other Animals","Legal Description (https://library.municode.com/ca/marin_county/codes/code_of_ordinances?nodeId=APXAMACOOPSPDICO_CH02.05LAUSREOMANRE_02.05.010DOOTAN)","0","1","December","2021","false","true","IC205_010_Dogs_OtherAnimals","2.05","SAVE","Dogs _Other Animals","38.0181460","-122.5154480","(38.018146, -122.515448)","SAVE_2.05.010_12/1/2021"
"2021-12-01T00:00:00.000","Stafford Lake Trail Easements -  Verissimo Hills","2.05.010","Dogs and other Animals","Legal Description (https://library.municode.com/ca/marin_county/codes/code_of_ordinances?nodeId=APXAMACOOPSPDICO_CH02.05LAUSREOMANRE_02.05.010DOOTAN)","0","1","December","2021","false","true","IC205_010_Dogs_OtherAnimals","2.05","STLA2","Dogs _Other Animals","38.1121750","-122.6297580","(38.112175, -122.629758)","STLA2_2.05.010_12/1/2021"
"2021-12-01T00:00:00.000","Terra Linda-Sleepy Hollow Divide North Preserve","2.04.050","Right-of-Way","Legal Description (https://library.municode.com/ca/marin_county/codes/code_of_ordinances?nodeId=APXAMACOOPSPDICO_CH02.04LAUSREEHTRRE_02.04.050RI-W)","0","0","December","2021","false","true","IC204_050_RightOfWay","2.04","TELI","Right-of-Way","38.0251610","-122.5689510","(38.025161, -122.568951)","TELI_2.04.050_12/1/2021"
"2021-12-01T00:00:00.000","Terra Linda-Sleepy Hollow Divide North Preserve","2.05.010","Dogs and other Animals","Legal Description (https://library.municode.com/ca/marin_county/codes/code_of_ordinances?nodeId=APXAMACOOPSPDICO_CH02.05LAUSREOMANRE_02.05.010DOOTAN)","0","0","December","2021","false","true","IC205_010_Dogs_OtherAnimals","2.05","TELI","Dogs _Other Animals","38.0251610","-122.5689510","(38.025161, -122.568951)","TELI_2.05.010_12/1/2021"
"2021-12-01T00:00:00.000","Terra Linda-Sleepy Hollow Divide South Preserve","2.02.010","Compliance with all laws, regulations and signs","Legal Description (https://library.municode.com/ca/marin_county/codes/code_of_ordinances?nodeId=APXAMACOOPSPDICO_CH02.02LAUSREISCO_02.02.010COALLARESI)","0","1","December","2021","false","true","IC202_010_Laws_Regs","2.02","TELI2","Laws _Regs","37.9912710","-122.5505420","(37.991271, -122.550542)","TELI2_2.02.010_12/1/2021"
"2021-12-01T00:00:00.000","Terra Linda-Sleepy Hollow Divide South Preserve","2.05.010","Dogs and other Animals","Legal Description (https://library.municode.com/ca/marin_county/codes/code_of_ordinances?nodeId=APXAMACOOPSPDICO_CH02.05LAUSREOMANRE_02.05.010DOOTAN)","3","1","December","2021","false","true","IC205_010_Dogs_OtherAnimals","2.05","TELI2","Dogs _Other Animals","37.9912710","-122.5505420","(37.991271, -122.550542)","TELI2_2.05.010_12/1/2021"
"2021-11-01T00:00:00.000","Alto Bowl Preserve","2.05.010","Dogs and other Animals","Legal Description (https://library.municode.com/ca/marin_county/codes/code_of_ordinances?nodeId=APXAMACOOPSPDICO_CH02.05LAUSREOMANRE_02.05.010DOOTAN)","0","1","November","2021","false","true","IC205_010_Dogs_OtherAnimals","2.05","ALBO","Dogs _Other Animals","37.9177470","-122.5203410","(37.917747, -122.520341)","ALBO_2.05.010_11/1/2021"
"2021-11-01T00:00:00.000","Blithedale Summit Preserve","2.05.010","Dogs and other Animals","Legal Description (https://library.municode.com/ca/marin_county/codes/code_of_ordinances?nodeId=APXAMACOOPSPDICO_CH02.05LAUSREOMANRE_02.05.010DOOTAN)","0","1","November","2021","false","true","IC205_010_Dogs_OtherAnimals","2.05","BLSU","Dogs _Other Animals","37.9224300","-122.5352360","(37.92243, -122.535236)","BLSU_2.05.010_11/1/2021"
"2021-11-01T00:00:00.000","Cascade Canyon Preserve","2.05.010","Dogs and other Animals","Legal Description (https://library.municode.com/ca/marin_county/codes/code_of_ordinances?nodeId=APXAMACOOPSPDICO_CH02.05LAUSREOMANRE_02.05.010DOOTAN)","2","2","November","2021","false","true","IC205_010_Dogs_OtherAnimals","2.05","CACA","Dogs _Other Animals","37.9781180","-122.6137890","(37.978118, -122.613789)","CACA_2.05.010_11/1/2021"
"2021-11-01T00:00:00.000","Ignacio Valley Preserve","2.05.010","Dogs and other Animals","Legal Description (https://library.municode.com/ca/marin_county/codes/code_of_ordinances?nodeId=APXAMACOOPSPDICO_CH02.05LAUSREOMANRE_02.05.010DOOTAN)","1","2","November","2021","false","true","IC205_010_Dogs_OtherAnimals","2.05","IGVA","Dogs _Other Animals","38.0642570","-122.5554440","(38.064257, -122.555444)","IGVA_2.05.010_11/1/2021"
"2021-11-01T00:00:00.000","Ignacio Valley Preserve","2.04.020","Bicycles and Similar Vehicles.","Legal Description (https://library.municode.com/ca/marin_county/codes/code_of_ordinances?nodeId=APXAMACOOPSPDICO_CH02.04LAUSREEHTRRE_02.04.020BISIVE)","3","0","November","2021","false","true","IC204_020_Bicycles","2.04","IGVA","Bicycles","38.0642570","-122.5554440","(38.064257, -122.555444)","IGVA_2.04.020_11/1/2021"
"2021-11-01T00:00:00.000","Indian Valley Preserve","2.05.010","Dogs and other Animals","Legal Description (https://library.municode.com/ca/marin_county/codes/code_of_ordinances?nodeId=APXAMACOOPSPDICO_CH02.05LAUSREOMANRE_02.05.010DOOTAN)","0","1","November","2021","false","true","IC205_010_Dogs_OtherAnimals","2.05","INVA","Dogs _Other Animals","38.0768480","-122.5824270","(38.076848, -122.582427)","INVA_2.05.010_11/1/2021"
"2021-11-01T00:00:00.000","Indian Valley Preserve","2.06.030","Smoking","Legal Description (https://library.municode.com/ca/marin_county/codes/code_of_ordinances?nodeId=APXAMACOOPSPDICO_CH02.06LAUSREIRRE_02.06.030SM)","1","0","November","2021","false","true","IC206_030_Smoking","2.06","INVA","Smoking","38.0768480","-122.5824270","(38.076848, -122.582427)","INVA_2.06.030_11/1/2021"
"2021-11-01T00:00:00.000","King Mountain Preserve","2.05.010","Dogs and other Animals","Legal Description (https://library.municode.com/ca/marin_county/codes/code_of_ordinances?nodeId=APXAMACOOPSPDICO_CH02.05LAUSREOMANRE_02.05.010DOOTAN)","0","2","November","2021","false","true","IC205_010_Dogs_OtherAnimals","2.05","KIMO","Dogs _Other Animals","37.9384520","-122.5390310","(37.938452, -122.539031)","KIMO_2.05.010_11/1/2021"
"2021-11-01T00:00:00.000","Loma Alta Preserve","2.05.010","Dogs and other Animals","Legal Description (https://library.municode.com/ca/marin_county/codes/code_of_ordinances?nodeId=APXAMACOOPSPDICO_CH02.05LAUSREOMANRE_02.05.010DOOTAN)","0","2","November","2021","false","true","IC205_010_Dogs_OtherAnimals","2.05","LOAL","Dogs _Other Animals","38.0053190","-122.6046970","(38.005319, -122.604697)","LOAL_2.05.010_11/1/2021"
"2021-11-01T00:00:00.000","Lucas Valley Preserve","2.02.010","Compliance with all laws, regulations and signs","Legal Description (https://library.municode.com/ca/marin_county/codes/code_of_ordinances?nodeId=APXAMACOOPSPDICO_CH02.02LAUSREISCO_02.02.010COALLARESI)","1","0","November","2021","false","true","IC202_010_Laws_Regs","2.02","LUVA","Laws _Regs","38.0385690","-122.5916700","(38.038569, -122.59167)","LUVA_2.02.010_11/1/2021"
"2021-11-01T00:00:00.000","Lucas Valley Preserve","2.04.010","Motor Vehicles","Legal Description (https://library.municode.com/ca/marin_county/codes/code_of_ordinances?nodeId=APXAMACOOPSPDICO_CH02.03LAUSREESPR_02.03.050ARHIRE)","0","2","November","2021","false","true","IC204_010_MotorVehicles","2.04","LUVA","Motor Vehicles","38.0385690","-122.5916700","(38.038569, -122.59167)","LUVA_2.04.010_11/1/2021"
"2021-11-01T00:00:00.000","Mount Burdell Preserve","2.04.020","Bicycles and Similar Vehicles.","Legal Description (https://library.municode.com/ca/marin_county/codes/code_of_ordinances?nodeId=APXAMACOOPSPDICO_CH02.04LAUSREEHTRRE_02.04.020BISIVE)","3","2","November","2021","false","true","IC204_020_Bicycles","2.04","MOBU","Bicycles","38.1258510","-122.5925690","(38.125851, -122.592569)","MOBU_2.04.020_11/1/2021"
"2021-11-01T00:00:00.000","Mount Burdell Preserve","2.05.010","Dogs and other Animals","Legal Description (https://library.municode.com/ca/marin_county/codes/code_of_ordinances?nodeId=APXAMACOOPSPDICO_CH02.05LAUSREOMANRE_02.05.010DOOTAN)","2","1","November","2021","false","true","IC205_010_Dogs_OtherAnimals","2.05","MOBU","Dogs _Other Animals","38.1258510","-122.5925690","(38.125851, -122.592569)","MOBU_2.05.010_11/1/2021"
"2021-11-01T00:00:00.000","Mount Burdell Preserve","2.02.160","Commerical Activities","Legal Description (https://library.municode.com/ca/marin_county/codes/code_of_ordinances?nodeId=APXAMACOOPSPDICO_CH02.02LAUSREISCO_02.02.160COAC)","0","1","November","2021","false","true","IC202_160_CommercialActivity","2.02","MOBU","Commercial Activity","38.1258510","-122.5925690","(38.125851, -122.592569)","MOBU_2.02.160_11/1/2021"
"2021-11-01T00:00:00.000","Ring Mountain Preserve","2.04.020","Bicycles and Similar Vehicles.","Legal Description (https://library.municode.com/ca/marin_county/codes/code_of_ordinances?nodeId=APXAMACOOPSPDICO_CH02.04LAUSREEHTRRE_02.04.020BISIVE)","0","1","November","2021","false","true","IC204_020_Bicycles","2.04","RIMO","Bicycles","37.9208950","-122.4943440","(37.920895, -122.494344)","RIMO_2.04.020_11/1/2021"
"2021-11-01T00:00:00.000","Ring Mountain Preserve","2.05.010","Dogs and other Animals","Legal Description (https://library.municode.com/ca/marin_county/codes/code_of_ordinances?nodeId=APXAMACOOPSPDICO_CH02.05LAUSREOMANRE_02.05.010DOOTAN)","2","6","November","2021","false","true","IC205_010_Dogs_OtherAnimals","2.05","RIMO","Dogs _Other Animals","37.9208950","-122.4943440","(37.920895, -122.494344)","RIMO_2.05.010_11/1/2021"
"2021-11-01T00:00:00.000","Roys Redwoods Preserve","2.05.010","Dogs and other Animals","Legal Description (https://library.municode.com/ca/marin_county/codes/code_of_ordinances?nodeId=APXAMACOOPSPDICO_CH02.05LAUSREOMANRE_02.05.010DOOTAN)","0","1","November","2021","false","true","IC205_010_Dogs_OtherAnimals","2.05","RORE","Dogs _Other Animals","38.0206550","-122.6617720","(38.020655, -122.661772)","RORE_2.05.010_11/1/2021"
"2021-11-01T00:00:00.000","Rush Creek Preserve","2.05.010","Dogs and other Animals","Legal Description (https://library.municode.com/ca/marin_county/codes/code_of_ordinances?nodeId=APXAMACOOPSPDICO_CH02.05LAUSREOMANRE_02.05.010DOOTAN)","1","1","November","2021","false","true","IC205_010_Dogs_OtherAnimals","2.05","RUCR","Dogs _Other Animals","38.1184270","-122.5642700","(38.118427, -122.56427)","RUCR_2.05.010_11/1/2021"
"2021-11-01T00:00:00.000","Terra Linda-Sleepy Hollow Divide North Preserve","2.05.010","Dogs and other Animals","Legal Description (https://library.municode.com/ca/marin_county/codes/code_of_ordinances?nodeId=APXAMACOOPSPDICO_CH02.05LAUSREOMANRE_02.05.010DOOTAN)","0","1","November","2021","false","true","IC205_010_Dogs_OtherAnimals","2.05","TELI","Dogs _Other Animals","38.0251610","-122.5689510","(38.025161, -122.568951)","TELI_2.05.010_11/1/2021"
"2021-11-01T00:00:00.000","Terra Linda-Sleepy Hollow Divide South Preserve","2.05.010","Dogs and other Animals","Legal Description (https://library.municode.com/ca/marin_county/codes/code_of_ordinances?nodeId=APXAMACOOPSPDICO_CH02.05LAUSREOMANRE_02.05.010DOOTAN)","0","1","November","2021","false","true","IC205_010_Dogs_OtherAnimals","2.05","TELI2","Dogs _Other Animals","37.9912710","-122.5505420","(37.991271, -122.550542)","TELI2_2.05.010_11/1/2021"
"2021-10-01T00:00:00.000","Alto Bowl Preserve","2.05.010","Dogs and other Animals","Legal Description (https://library.municode.com/ca/marin_county/codes/code_of_ordinances?nodeId=APXAMACOOPSPDICO_CH02.05LAUSREOMANRE_02.05.010DOOTAN)","1","1","October","2021","false","true","IC205_010_Dogs_OtherAnimals","2.05","ALBO","Dogs _Other Animals","37.9177470","-122.5203410","(37.917747, -122.520341)","ALBO_2.05.010_10/1/2021"
"2021-10-01T00:00:00.000","Baltimore Canyon Preserve","2.05.010","Dogs and other Animals","Legal Description (https://library.municode.com/ca/marin_county/codes/code_of_ordinances?nodeId=APXAMACOOPSPDICO_CH02.05LAUSREOMANRE_02.05.010DOOTAN)","1","1","October","2021","false","true","IC205_010_Dogs_OtherAnimals","2.05","BACA","Dogs _Other Animals","37.9311380","-122.5507450","(37.931138, -122.550745)","BACA_2.05.010_10/1/2021"
"2021-10-01T00:00:00.000","Camino Alto Preserve","2.05.010","Dogs and other Animals","Legal Description (https://library.municode.com/ca/marin_county/codes/code_of_ordinances?nodeId=APXAMACOOPSPDICO_CH02.05LAUSREOMANRE_02.05.010DOOTAN)","2","0","October","2021","false","true","IC205_010_Dogs_OtherAnimals","2.05","CAAL","Dogs _Other Animals","37.9171970","-122.5302000","(37.917197, -122.5302)","CAAL_2.05.010_10/1/2021"
"2021-10-01T00:00:00.000","Cascade Canyon Preserve","2.05.010","Dogs and other Animals","Legal Description (https://library.municode.com/ca/marin_county/codes/code_of_ordinances?nodeId=APXAMACOOPSPDICO_CH02.05LAUSREOMANRE_02.05.010DOOTAN)","0","3","October","2021","false","true","IC205_010_Dogs_OtherAnimals","2.05","CACA","Dogs _Other Animals","37.9781180","-122.6137890","(37.978118, -122.613789)","CACA_2.05.010_10/1/2021"
