"title","address","location_description","classification","marker_condition","year","marker_size","marker_text","geocoded_column"
"Cockrell, Alexander; Sarah Horton Cockrell","Dealey Plaza","Dealey Plaza, South Houston St. (s. side of Plaza), Dallas","Unclassified","Good","1973.0","27 x 42","Alexander Cockrell (June 8, 1820 - April 3, 1858)Sarah Horton Cockrell (Jan. 13, 1819 - April 26, 1892)Alexander Cockrell came to Dallas area in 1845. After serving in the war with Mexico (1846-47), he filed on 640 acres in the Peters Colony, and married Sarah Horton on Sept. 9, 1847. Cockress operated a freight line to Houston, Jefferson, and Shreveport until 1852, when he purchased remainder of the Dallas townsite from John Neely Bryan (1810 - 1877), the ""Father of Dallas.""Cockrell promoted growth of the village in the mid-1850s by building a brick factory, a sawmill, and a bridge across the Trinity River, replacing a ferry he had bought from Bryan. Cockrell's influence on Dallas' prosperity ended April 3, 1858, when he met an untimely death in an altercation over an unpaid debt.Sarah Horton Cockrell became the first woman in Dallas to exert economic influence outside the home. She completed the unfinished St. Nicholas Hotel, and rebuilt it after the fire of July 8, 1860; operated the ferry after the bridge collapsed in 1858 until a new span was erected in 1872; and, added a flour mill and other businesses to the community. The Cockrells' enterprises played a vital role in the establishment of Dallas as an early regional trade center.1973",
"Belo House","2100 Ross Ave.","corner of Ross and Olive streets","Home","good","1979.0","Medallion and Plate","Belo's wife Nettie (Ennis) (d. 1913) bought a home here in 1888 from A.W. Childeress.  It was replaced in the 1890s by this classical revival residence.  Designed by Herbert M. Greene, it reflects influences of the Belo family home in North Carolina.  After their marriage in 1900, A.H. Belo, Jr. and his bride Helen (Ponder) came to live with his parents.  Members of the Belo family resided here until 1922.  Additions were made to the rear and side of the house during the nearly 50 years it was used as a funeral home.Recorded Texas Historical Landmark -- 1979","POINT (-96.798098 32.787883)"
"Demonstration of the First Working Integrated Circuit","Texas Instruments, Inc., Corporate Headquarters","13500 N. Central Expressway (US 75), E. side of road, Exit 22, Dallas","Unclassified",,"1988.0","27 x 42","The twentieth-century age of electronics can trace its roots to the 1906 invention of the triode vacuum tube, which marked the birth of modern radio. The invention of the transistor after World War II ushered in a new era of solid-state electronics.As engineers designed increasingly complex equipment, the difficulty of interconnecting large numbers of individual transistors and other components to form electronic circuits was a barrier to further progress. The need arose for a reliable, cost-effective way to produce and interconnect the components. Technical research groups in the United States and abroad began work on the problem. In 1958, Jack St. Clair Kilby, an engineer at Texas Instruments (TI) in Dallas, designed and built an integrated circuit with all the components formed in a single piece of semiconductor material. On September 12, 1958, he demonstrated this first working integrated circuit to TI personnel in the semiconductor building on this site.This conceptual breakthrough and work elsewhere led to development of the microchips that are at the core of modern electronic products, including a broad range of consumer electronics, digital computers, defense systems, and global communications networks.",
"Pleasant Mound ""Public"" Cemetery","Buckner Blvd. and Sceyne Rd.",,"Cemetery","Faded; Redo (locally)","1972.0","18 x 28","In 1640-acre survey of James Jackson Beeman (1816-88), uncle by marriage of John Neely Bryan, first settler in Dallas. Beeman came here from Illinois in 1840, helped cut first road in Trinity bottoms; name Turtle Creek, 1841; and plat city of Dallas, 1842.On March 8, 1848, he buried his wife Sarah Crawford Beeman on northeast corner of his land, and later allowed neighbors to bury their dead here. Cemetery's first (1887) trustees were J. W. Miller, James Pruitt, and J. H. Shannon.Pioneers buried here set the course for greatness of Dallas.Marker Donated By: Mildred Boone (Mrs. Joel) Haden, great-granddaughter of Sarah Crawford Beeman, first person buried in this cemetery, and by the Ada Bruton Garden Club of Dallas.",
"Alexander Harwood",,"Pioneer Cemetery, Marilla at Young St.","Grave",,"1996.0","Grave Marker","(1820-1885)   Came to Dallas in 1844 from Tennessee. After the death of his first wife Isabella Daniel Harwood in 1851, he married Sarah Peak in 1855. Harwood was elected county clerk six times between 1850 and 1880. He was senior warden of the Tannehill Masonic Lodge and served the Confederacy as assistant to Postmaster General John H. reagan. Harwood represented Dallas County at the 1866 State Constitutional Convention. (1996)","POINT (-96.796215 32.777977)"
"Hall of State","Grand Ave. at Nimitz Dr., Fair Park",,"Government Building",,"1980.0","Plate and Medallion","Construction of this building, which served as the focal point of the 1936 Texas Centennial Central Exposition, was approved by the State Legislature to be ""Texanic in proportion and centennial in character."" Designed by a team of Dallas architects, it is built of native Texas materials with ornamental representations of commerce and history. Completed during the 1930s Depression, it is one of the best examples of Art Deco architecture in Texas.RTHL - 1980",
"Dallas County","Historical Plaza","Dallas Co. Historical Plaza at Elm, Market and Main, Dallas","County","Good","1936.0","pink Hwy. marker","Dallas CountyThe unincorporated town of Dallas was designated as a post office by the Republic of Texas in 1843. The County of Dallas was created by the first Legislature of Texas on March 30, 1846 from portions of Robertson and Nacogdoches counties. Both city and county were named in honor of George Mifflin Dallas (1792 - 1864) Pennsylvania Democratic statesman who was elected the eleventh vice-president of the United States on a platform favoring Texas annexation.(West limits Dallas, US Hy 80, State Hy 18)",
"Reinhardt Elementary School","10122 Losa Dr.","10122 Losa Dr. in Dallas","School",,"1994.0","27 x 42","Reinhardt Elementary School traces its history to the 1880s, when a small frame schoolhouse was built on the farm of John Chenault to serve children of early settlers in this vicinity. After the Santa Fe Railroad built a line through the area and erected a depot about 1885, a town evolved and was named Reinhardt for Dallas merchant Isadore Reinhardt. Soon the town boasted two stores, a cotton gin, and a bank, and by 1900 a new frame school building was constructed near the rail line. Two teachers taught students in all grades. About 1910 a second frame building was erected on the opposite side of the railroad tracks, and in 1921 it was replaced by a two-story red brick school building.After the Casa Linda neighborhood was developed in the 1930s a larger Reinhardt Elementary School was built at this site in 1941. Reinhardt became a part of the Dallas School System in 1945 when the town of Reinhardt was annexed to the city of Dallas.Enlarged over the years to serve an ever-increasing enrollment, Reinhardt Elementary School continues to play an important role in Dallas education. It is considered the ""Mother School"" of Casa View Elementary and several other schools in the area.","POINT (-96.692045 32.83784)"
"Majestic Theatre","1925 Elm St.",,"Arts Building",,"1983.0","Medallion and Plate","In his determination to provide entertainment for the entire family, theatre pioneer and innovator Karl St. John Hoblitzelle (1879 - 1967) built this structure in 1921 to house Dallas' Majestic Theatre. The five-story, five-bay, Beaux Arts structure was designed by Chicago architect John Eberson. Featuring a 1570-seat auditorium, the Majestic's fine classical exterior detailing is complemented by its opulent Baroque interior.RTHL - 1983","POINT (-96.794958 32.782345)"
"Crockett, John McClannahan","Pioneer Cemetery","Pioneer Cemetery between Marilla St. and Griffin Dr., on the grounds of the Dallas Convention Center, Dallas","Unclassified",,"1995.0","grave marker","John McClannahan Crockett(December 26, 1816 - August 4, 1887)South Carolina native John M. Crockett married Katherine (Kate) Polk in 1837. In 1848 they moved to Dallas where Crockett opened one of the pioneer settlement's first law offices. Crockett served as a State Legislator, Mayor of Dallas, and meteorological observer for the Smithsonian Institution in the 1850s, and as Lt. Governor of Texas during its first two years in the Confederacy. A prominent Mason, Crockett also helped establish The Grange in North Texas.Recorded - 1995",
"Garvin Memorial Cemetery","3800 blk. W. NW Hwy.","south side of road, just past apartments","Cemetery","Faded; refinish (local effort)","1980.0","18 x 28","This burial ground served the pioneer families who settled in the area. Graves here date from the 1870s. The land for the cemetery was donated to the community by James G. Garvin (1830 - 1897), a former Dallas merchant, his wife Eliza, and brothers Col. William L. Crawford (1839 - 1920) and Judge M. L. Crawford (1841 - 1910), prominent attorneys of the county. Several veterans of the Civil War are interred here, including Col. Pleasant G. Swor (1834 - 1878), who led an assault against Union forces at the Battle of Corinth.","POINT (-96.852526 32.861672)"
"Bryan, John Neely (1810-1877) and","Dealey Plaza","Bryan Colonnade, dealey Plaza, Elm & Houston, Dallas","Unclassified",,"1978.0","27 x 42","JOHN NEELY BRYAN, 1810-1877 AND MARGAET BEEMAN BRYAN, 1825-1919In 1839 Tennessee lawyer John Neely Bryan chose this high bluff and shallow ford on the Trinity River as site for a trading post. Finding Indians scarce when he returned in 1844, he platted a town, installed a ferry, and called the place Dallas. In the 1840s, the Republic of Texas opened its Central National Road from here to the U.S. border, and drew settlers to this area with liberal land grants.Margaret Beeman was a daughter of John Beeman, a prosperous man from Illinois, of North Carolina heritage. At 15, she met Bryan at the Cross Roads Camp Ground, Bowie County. Her father staked his claim about eight miles from Bryan's town. She and Bryan married in 1843, and became parents of six children. Margaret, her father, and other relatives strongly supported Bryan's work as ""Father of Dallas.""Bryan went to the California gold rush in 1849, but gained no fortune. After his return, he donated 98 city lots for a courthouse and county seat, then sold his ferry and remaining interest in the townsite. In poor health for many years, he died in Austin at 67. Margaret Beeman Bryan lived to age 94, and saw Dallas attain a population of over 150,000.1978Incise on base: A BICENTENNIAL PROJECT OF THE JUNIOR LEAGUE OF DALLAS, INC., 1976",
"Tyler Street United Methodist Church","927 W. 10th St.","between Tyler and Polk Streets","Church","Faded; Refinish","1987.0","27 x 42","On November 27, 1911, the North Texas Conference of the Methodist Episcopal Church, South, appointed the Rev. J. Leonard Rea (1884 - 1965) to establish a parish in Dallas to be known as Tyler Street Methodist Church. The congregation was organized on January 29, 1912, with 166 charter members. A sanctuary for the new church was built on the corner of Tyler and Sunset streets in July 1912. The Rev. Mr. Rea continued as minister, and the first report of the congregation to the denomination Annual Conference revealed a membership of 304.By 1921 the need for a new building had arisen. A site was acquired at Tenth and Polk streets, and the congregation moved into a partially completed building that year. Construction resumed in 1923 and a large sanctuary was completed in 1925.During the difficult period of the Great Depression the church building was closed by creditors. The congregation met in Sunset High School from March 1932 until they could return to their facilities in the fall of 1933. Since that time, the congregation has continued to grow, and additional buildings have been added to the property. Tyler Street United Methodist Church remains a vital part of the community.","POINT (-96.838654 32.745134)"
"Site of First Ferry and Bridge","Dealey Plaza","Cockrell Colonnade","Roadway","Vandalized; redo","1968.0","20 x 20","Site of First Ferry and Bridge (about 300 feet West)First ferry on the Trinity River at Dallas was started here, 1842, by John Neely Bryan (1810 - 1877), the founder of Dallas. Alexander Cockrell (1820 - 1858), early builder and developer, replaced ferry with wooden toll bridge, 1854.This crossing played an important part in the development of the city.",
"Hord Log Cabin",,"501 shelter Place (Opera & Lancaster Sts.","Unclassified","missing","1962.0","Medallion and Plate","First permanent structure built on the west side of the Trinity River in Dallas, this cabin of hand-hewn logs was erected in 1845 by Judge William H. Hord (d. 1901), Dallas County Judge, 1848-50, who brought his family here by covered wagon from Tennessee. In 1887 Oak Cliff developer T. L. Marsalis bought the Hord property. Mr. and Mrs. Martin Weiss rescued the cabin and gave it in 1942 to American Legion Post No. 275 and Auxiliary. The restored building became a museum in 1976.RTHL - 1962","POINT (-96.796215 32.777977)"
"William B. Lipscomb Elementary School","5801 Worth",,"School","Faded; Redo (locally)","1986.0","27 x 42","This school, built in 1920 to relieve the crowded conditions of area schools, was named for early educator William B. Lipscomb. A Tennessee native (b. 1860), Lipscomb served as principal of Dallas High School from 1894 until his death five years later.The three-story structure, designed by architect Herbert M. Green and originally surrounded by over three acres of recreation grounds, boasts a facade trimmed with stone quoins and a basement wing with castellated stones revealing the date of construction. Two Gothic-style stone tablets adorn the two front entrances to display the school name.Since its official opening in 1921, the school has served as an educatinal and social center for the Swiss Avenue, Munger Place, and Junius Heights neighborhoods. Over the years the school's enrollment reflected its changing environment. Rapid urbanization in the 1920s gave way to economic woes in the Great Depression of the 1930s, followed by a surge of patriotic activity and wartime relief efforts during World War II. The post-war years brought decreased enrollment when many families began moving to suburbs, but subsequent decades have seen a renewed vitalization to the old school and neighborhoods.Texas Sesquicentennial 1836 - 1986","POINT (-96.756615 32.806786)"
"Woodrow Wilson High School","100 S. Glasgow Dr.",,"School",,"1989.0","Medallion & Plate","Built in 1927-28 to serve the growing student population in east Dallas, this was the seventh high school in the city. An important example of the period revivals which characterized architecture of the 1920s, this structure reflects the Jacobethan Revival style. Outstanding features include prominent entry bays and stone detailing. Many of the school's graduates have enjoyed successful careers in business, politics, science, sports, and the arts.RTHL - 1989","POINT (-96.75074 32.80495)"
"Log Cabin Pioneers of Dallas County","Elm and Market Sts.","Dallas County Historical Plaza","Cabin",,"1986.0","27 x 42","Most colonists first settled in this ""Three Forks"" area of the Trinity River as mmebers of the Peters Colony after 1841. Immigrants from such states as Arkansas, Illinois, Kentucky, Missouri, and Tennessee brought with them a tradition of building log shelters.Land title was granted to settlers who worked at least 15 acres and built ""a good and comfortable cabin upon it."" This region was abundant in oak, juniper (popularly called cedar), walnut, ash, bois d'arc, and elm trees, which furnished sturdy building timbers.John Neely Bryan, a colonist from Tennessee, arrived near this site in late 1841 and built a log cabin in 1842. The area's first school and church was built of logs at Farmer's Branch (12 mi. NW) in 1845. J. W. Smith and J. M. Patterson brought goods from Shreveport (184 mi. E) in 1846 for resale at their log store in dallas.Milled lumber appeared in Dallas buildings by 1849, and bricks were available by 1860. That year a fire destroyed most of the town's original log cabins.The nearby cabin was built of cedar logs before 1850, possibly by Kentuckian Gideon Pemberton. It was moved from its original site (7.5 mi. E) in 1926 and rebuilt at several locations, including Bryan's designated courthouse site (1 blk. SW) in 1936, and this block in 1971.Texas Sesquicentennial 1836 - 1986",
"Busch-Kirby Building","1509 Main St.",,"Commmercial Building",,"1988.0","Plate & Medallion","Adolphus Busch had this building constructed in 1913 as a complementary retail and office facility for his nearby Adolphus Hotel. It was acquired by the Kirby Investment Company in 1919. Designed by the St. Louis architectural firm of Barnett, Hayes & Barnett, in association with the Dallas firm of Lang and Witchell, it features a strong vertical emphasis with Gothic pinnacles and spires highlighting the top, and fine terra cotta details.RTHL - 1988","POINT (-96.79924200000002 32.780632)"
"Ursuline Academy","4900 Walnut Hill Lane",,"School",,"1989.0","27 x 42","Bishop Claude Marie Dubuis, wishing to establish a Catholic school in the rapidly-growing area of North Texas, assigned six Galveston-based Ursuline nuns to the task in 1874. In January of that year Bishop Dubuis traveled with the sisters to Dallas and assisted them in opening the school.The first facility available to the new academy was a small four-room frame cottage located near Sacred Heart Church in downtown Dallas. The church's pastor, Father Joseph Martiniere, worked closely with the nuns in establishing the school, which officially opened on February 2, 1874, with seven students.As enrollment grew, plans were made to build a larger facility. In 1884 the school moved out of the downtown area to a new brick building located at Bryan, Haskell, and Live Oak streets. That building served the academy until 1949, when the school relocated to this site.Generations of Dallas girls have attended Ursuline Academy. One of the city's first kindergartens opened as part of the academy's program in 1918. Its grammar school section was discontinued in 1976, and the emphasis after that time was placed on high school education.","POINT (-96.823829 32.880116)"
"Albert Carver Cemetery","Bruton Rd. & Masters St.","SE corner of Bruton Rd. and Masters St.","Cemetery","Good","1985.0","18 x 28","Illinois native Albert Carver (1827-1911) purchased land in this area in 1856 and settled here with his family. A farmer and noted breeder of Durham cattle, Carver set aside this plot of land for a family graveyard. Both he and his wife, Mary (Markham), are buried here, as are four sons, J. B., J. A., George, and F. E., and their families. The oldest marked grave in the cemetery, dated 1885, is that of an infant son of J. B. and Ophelia Carver. The cemetery is a visible reminder of this pioneer family and of the area's heritage.",
"Steel Dust","ML King Dr. & Coliseum Dr.",,"Animals","Faded; Redo - locally","1971.0","27 x 42","19th century Texas frontier champion who became foundation sire for the most popular quarter horse strain of the 20th century. A Virginia type horse foaled by a Kentucky thoroughbred mare, Steel Dust was brought in 1844 as a colt to the Texas Republic by settlers Middleton Perry and Jones Greene. On Ten Mile Creek (near Lancaster, SE of Dallas) at the farm track of Thomas McKee Ellis, father-in-law of his owners, Steel Dust outran all challengers. He was about 16 hands high and so quick that his jockey coated his back with molasses in order to stay on. Steel Dust won a spectacular race in McKinney against local favorite Monmouth in 1855; soon afterward defeated Brown Dick, from Hopkins County. Later in 1855, going against Shiloh, a horse from Tennessee, Steel Dust was hurt at the starting gate. He soon went blind, never raced again, but survived at stud for years.The famed King Ranch in south Texas began to use breeding lines from Steel Dust and Shiloh in 1916, winning many honors at the State Fair of Texas. From this ranch has come stock for circuses, rodeos, and polo teams. The American Quarter Horse Association was formed in 1940. Quarter horses are now as much in demand for racing as for farm and ranch work.",
"Swiss Avenue","5500 block Swiss Ave.",,"Neighborhood",,"1975.0","27 x 42","This wide boulevard was a muddy country lane in 1857, when Swiss immigrant Henri Boll named it in honor of his native land. Swiss Avenue was lengthened and paved as part of Munger Place, an exclusive 140-acre residential area developed in 1905 by cotton gin manufacturer R. S. Munger (1854 - 1923). To assure the unified appearance of the neighborhood, Munger imposed such building requirements as $10,000 minimum cost and two-story height. At the same time, the houses are unique because residents were free to choose from the variety of architectural styles popular during the early 20th century, including Tudor Revival, Georgian Revival, and Frank Lloyd Wright's prairie style.Dr. R. W. Baird's Classical Revival residence at 5303 Swiss Avenue was the first one erected here in 1905. By 1920, about 200 elegant homes had been built in the Munger Place addition. Residents included prominent lawyers, bankers, merchants, industrialists, and doctors.In recent years, the Swiss Avenue area declined, and some of the old homes were demolished or divided into apartments. Efforts of the Historic Preservation League and interested citizens to save the neighborhood resulted in the city of Dallas designating it as the city's first historic district in 1973.","POINT (-96.764258 32.806612)"
"East Dallas Christian Church","629 N. Peak St.",,"Church",,"1982.0","18 x 28","Members of Central Christian Church organized this fellowship in 1903. The earliest services were held in a wooden chapel at the northeast corner of Peak and Victor Streets. The Rev. John Stevens served as the first pastor. In 1907 the tabernacle was moved to this site, donated by J. J. Hart. A new brick building replaced the structure in 1912. A leader in the growth of East Dallas, the church has actively supported neighborhood programs, missions, and the Juliette Fowler Home, started by member Sara Harwood. Many prominent Dallas leaders have been members here.","POINT (-96.773649 32.793943)"
"Rylie Cemetery","on Rylie between Tufts and Mulberry",,"Cemetery",,"1994.0","18 x 28","In 1878, John Armstrong Rylie donated land at this site for use as a school by settlers of this part of southeast Dallas County. The property came into service as a cemetery with the burial of Redden Allumbaugh in 1889. Since that time, more than 400 persons, including a number of Rylie Prairie community's earliest settlers and their descendants, have been interred here. The cemetery contains the burial of at least one Civil War veteran, Hartwell Bolin Cox. The Rylie Cemetery Association was founded in 1962 to maintain the graveyard.",
"Trinity Farms / Rancho Grande Cemetery","Lee Hall and Prairie View","at the end of Lee Hall up alleyway, behind houses, facing Arlington Park Rd.","Cemetery",,"1995.0","27 x 42","This cemetery represents the last remaining physical reminder of the community of people who worked and lived on a vast commercial farm here known as the Dallas County Trinity Farms from about 1915 to 1946. The farm covered about 3,000 acres of land which had been farmed for many years. Dallas County Trinity Farms was one of several large farms owned by E. P. Harwell of Tulsa, Oklahoma, C. H. Clark of Wichita Falls, Texas, and T. H. Harbin of Waxahachie, Texas.The Trinity Farms Company provided housing, schools, and a general store/commissary for use by the farm laborers and their families. Farm laborers consisted mostly of Mexican citizens, many of whom arrived during the Mexican Revolution, and a sizable number of African Americans. Harbin lived in a large white ranch house and operated the farm which was also known as Rancho grande. The earliest recorded burials occurred in the early 1920s.The children of Hispanics and African Americans who worked on the farm attended separate schools. Similarly, the cemetery contains separate sections for Hispanics and African Americans. The last burial occurred in the early 1940s. The cemetery is maintained by descendants of the families interred here.Sesquicentennial of Texas Statehood 1845 - 1995","POINT (-96.84776 32.815682)"
