"title","address","location_description","classification","marker_condition","year","marker_size","marker_text","geocoded_column"
"John H. Brown, Maj.","Greenwood Cemetery","gravesite is in Greenwood Cemetery (3020 Oak Grove) at the corner of Love and Gracy Ave., Dallas","Unclassified","letter in file indicates marker was never placed","1963.0","pink Centennial grave marker","Maj. John H. BrownStar and WreathFamed Indian fighter, Confederate officer, commanded Texas' 3rd Frontier District, member 1875 Constitutional Convention.Erected by the State of Texas 1963",
"Oak Cliff Cemetery","1300 Blk. of e. 8th",,"Cemetery","Faded; Redo (locally)","1985.0","27 x 42","Kentucky native William S. Beaty came to Texas during its early days as a Republic and received a grant of 640 acres of land. He and his brother, Josiah, who arrived in 1836, settled along the Trinity River in what is now Dallas County. The settlement that developed around their property first was called Hord's Ridge and became known as Oak Cliff in 1887.In 1846, William Beaty deeded 10 acres of his land for a public burial ground and indicated in the deed that his brother, Josiah, already had been interred on the site. The deed also specified that the cemetery should be subject to no one sect but should forever remain open to all. The oldest marked grave in the cemetery, that of Martha A. Wright, is dated 1844.Many prominent Dallas County pioneers and citizens have been buried here, including Judge William Hord, for whom Hord's Ridge was named. Two former Dallas mayors, George Sergeant and George Sprague, and a son of Gen. Sam Houston, Col. William Rogers Houston, are buried here.Oak Cliff Cemetery remains a valuable and historic lind to the early settlement of Dallas.",
"John Neely Bryan Cabin","Dallas Historical Plaza","Dallas Historical Plaza at Elm, Market & Main, Dallas","Cabin","missing","1962.0","Medallion","no text - log cabin - first house in Dallas",
"Oak Cliff Presbyterian Church","6000 S. Hampton Rd.",,"Church",,"1990.0","18 x 28","Founded in 1890 with seventeen charter members, this church has served the community with a variety of worship, educational outreach, and missionary programs. Meeting in facilities first at Ninth and Patton streets and later at Tenth and Madison streets, the church experienced steady growth. Land at this site was acquired and construction of new facilities began on July 19, 1970. Oak cliff Presbyterian Church has played an active role in creating new congregations in the Dallas area and maintains a commitment to both foreign and domestic missionary endeavors.","POINT (-96.857004 32.674626)"
"Neiman - Marcus","Main and Ervay Sts.",,"Unclassified",,"1982.0","18 x 28","In 1907 Herbert Marcus, Sr., his sister Carrie Marcus Neiman and her husband A. L. Neiman founded the prestigious Neiman - Marcus retail establishment. After the firm's first store at Elm and Murphy streets burned in 1913, a new store was constructed at this site. Many of the retail innovations instituted here have had a dramatic effect on stores and manufacturers throughout the country. Under the direction of Herbert Marcus, Sr., the store also became a leader in the support of philanthropic projects, civic activities and Dallas' early commercial development.","POINT (-96.797111 32.781078)"
"Cochran Chapel Cemetery","9027 Midway","same","Cemetery","Good","1995.0","24 x 18","This cemetery began in 1853 with the burials of Sarah Jane and William M. Cochran, the infant daughter and husband of Nancy Jane Hughes Cochran. Among the many Dallas County pioneers buried here are four of Nancy Jane's sisters and their husbands who came from Tennessee in the 1840s and 1850s: Thomas C. and Sarah Williams, Obadiah and Serena Knight, George and Amanda Record, and John B. and Margaret Bachman.","POINT (-96.836045 32.862035)"
"James Martin Patterson",,"Pioneer Cemetery, Marilla at Young St.","Unclassified",,"1996.0","Grave Marker","(1812-1906) Kentucky native James Martin Patterson arrived in Dallas in 1846. Patterson and John W. Smith opened one of the first stores in Dallas using their pooled resources of $700. They built a flatboat and attempted to ship cotton down the Trinity River to the Gulf Coast in 1851. Patterson served as chief justice (county judge) from 1854-66. He  retired in 1875 and managed his extensive property holdings until his death. (1996)","POINT (-96.796215 32.777977)"
"Texas School Book Depository Building, Formerly The","411 Elm St.",,"Commmercial Building","Faded; Redo (local effort)","1980.0","27 x 42","This site was originally owned by John Neely Bryan, the founder of Dallas. During the 1880s French native Maxime Guillot operated a wagon shop here. In 1894 the land was purchased by Phil L. Mitchell, president and director of the Rock Island Plow Company of Illinois. An office building for the firm's Texas division, known as the Southern Rock Island Plow Company, was completed here four years later. In 1901 the five-story structure was destroyed by fire. That same year, under supervision of the company vice president and general manager F. B. Jones, work was completed on this structure. Built to resemble the earlier edifice, it features characteristics of the commercial Romanesque Revival style.In 1937 the Carraway Byrd Corporation purchased the property. Later, under the direction of D. H. Byrd, the building was leased to a variety of businesses, including the Texas School Book Depository.On November 22, 1963, the building gained national notoriety when Lee Harvey Oswald allegedly shot and killed President John F. Kennedy from a sixth floor window as the presidential motorcade passed the site.RTHL - 1980","POINT (-96.808122 32.779503)"
"Trezevant Calhoun Hawpe",,"Pioneer Cemetery, Marilla & Young","Grave",,"1999.0","Grave Marker","(September 16, 1820 - August 12, 1863)   Georgia native, a widower, moved from Tennessee to Dallas County with his son. He married Electa Underwood Bethurum in 1848. Elected Dallas County sheriff in 1850, he served two terms. He later was justice of the peace and county coroner, and an officer of Tannehill Masonic Lodge. A leader in the secession movement in Dallas County, he organized and was first colonel of the 31st Texas Cavalry in 1862, and was instrumental in the Confederate victory at Newtonia, Missouri. Hawpe was stabbed to death by a friend after a quarrel on the steps of the county courthouse. (1999)","POINT (-96.796215 32.777977)"
"La Prada Drive Church of Christ","2724 La Prada Drive",,"Church",,"1998.0","27 x 42","This congregation first met in members' homes at the end of the 19th century. In 1907 three trustees of the church -- Chester Williams, G. M. Purcell, and Claude Hocker -- purchased property near what would become Fair Park. An existing white frame building was used for 47 years, with the name of the church changing in accordance with street name changes. Members helped form the Ewing Avenue Church of Christ in Oak Cliff in 1949. Moving to a new site on Bruton Road in 1954, the congregation contributed their money, time, and talents to construct a red brick sanctuary, which served for many years.   By the 1970s many members had moved to the northeast Dallas suburbs. In 1976 elders purchased more than four acres of land on La Prada Drive. Due to the rapid sale of the Bruton Road facility, services were held in a Mesquite school until a new church building was completed in December 1979.   In keeping with the traditions of its founders, the church is guided by elders and deacons; male members do all speaking and teaching. There is no Sunday School. Singing without instruments is practiced. The congregation is active in foreign and domestic missionary service and community outreach.  (1998)","POINT (-96.640507 32.839099)"
"Interstate Forwarding Company Warehouse","3200 Main St.",,"Unclassified","Stolen","1991.0","Plate and Medallion","Designed and built as a fireproof warehouse in 1913, this building was erected by businessmen B. D. Milam and E. C. Connor. Dallas was an official U.S. Port of Entry in 1913. This structure initially served as the first bonded customs warehouse in Dallas. Exhibiting Chicago School-style influences, the reinforced concrete structure features metal casement window walls with brick infill. A rear bay served as an entry for rail cars.RTHL - 1991","POINT (-96.77758 32.785092)"
"Pleasant Grove Christian Church","1324 Pleasant Dr.",,"Church","Faded; Redo (locally)","1986.0","18 x 28","This congregation evolved from a rural Union Church which met as early as 1875 in a nearby cabin. The Ladies Aid Society was formed in 1906 and began raising funds for a separate church facility. Built in 1908 on this site, the one-room structure was struck by lightning and burned in 1913. At the completion of a second building, an annual Thanksgiving dinner tradition was begun. A third sanctuary, built in 1950, was damaged by fire the same year. It was rebuilt and, despite another fire in 1965, continued to serve its congregation, including descendants of pioneer families.Texas Sesquicentennial 1836 - 1986","POINT (-96.67859 32.735361)"
"Darnell, Nicholas Henry","Pioneer Cemetery","Pioneer Cemetery, N side of Dallas Convention Center on Ceremonial Dr., Dallas","Grave",,"1986.0","grave marker","Nicholas Henry Darnell(April 20, 1807 - June 7, 1885)Soon after arriving in Texas in 1838, Nicholas Darnell was elected to the Republic of Texas Congress, where he served as Speaker of the House. A delegate to the 1845 Statehood Convention, he later represented Dallas and Tarrant counties in the State Legislature, again serving as speaker. He resigned in 1863 to lead the 18th Texas Cavalry. After the Civil War, Darnell was again elected to the Texas Legislature and was a delegate to the 1875 Constitutional Convention.1986",
"Marcus House","10 Nonesuch Rd.",,"Home",,"2001.0","Medallion & Plate","After dismissing Frank Lloyd Wright for his failure to produce a suitable design, Stanley Marcus commissioned Dallas architect Roscoe Dewitt to design this International style residence.  Recognized worldwide for his innovations in fashion retailing and a significant patron of modern architecture, Marcus hosted hundreds of dignitaries here, including President Lyndon B. Johnson, Princess Grace of Monaco and global leaders in politics, fashion and the arts.  Completed in 1938 and home to the Marcus family until 1994, the house is a notable example of its style in Texas.Recorded Texas Historic Landmark - 2001","POINT (-96.74708600000001 32.82347)"
"City of Dallas","City Hall Plaza","City Hall Plaza, Young and ErvaySts. (on wall facing Young St.in front of City Hall), Dallas","City","None","1986.0","27 x 42","City of DallasPioneer John Neely Bryan (1810 - 1877) settled on the banks of the Trinity River just west of this site in 1841. A town he called Dallas grew up around his cabin. Chosen as county seat four years after the creation of Dallas County in 1846, the City of Dallas was incorporated in 1856, with Dr. Sam B. Pryor serving as first Mayor.Although John Neely Bryan had anticipated that river navigation would lead to growth for the city, it was the arrival of the Houston and Texas Central Railroad in 1872 and the Texas and Pacific Rail Line the following year that helped to establish Dallas as a major commercial center.By 1890, Dallas was the state's most populous city. Wheat and cotton production provided impetus for continued growth. Insurance and banking also contributed to the city's prosperity, and its selection as the site for a regional Federal Reserve Bank in 1914 was an economic milestone. Following the discovery of oil in East Texas in 1930, Dallas banks concentrated on providing financial services for that industry.Noted throughout its history for aggressive civic leaders, Dallas won the right to host the Texas Centennial Exposition in 1936.Texas Sesquicentennial 1836 - 1986",
"McNab Grocery","2701 McKinney Ave.",,"Commmercial Building",,"1979.0","18 x 28","After the Civil War Ahab Bowen acquired this land, then an area of grape vineyards and small farms. In 1891 he sold the lot to J. B. Franklin, who erected this brick structure. James McNab (d. 1924) operated a neighborhood grocery here in partnership with William A. Boren and Thomas M. Cullum, who later founded the Cullum and Boren Sporting Goods business. A livery stable in the rear housed a horse and delivery wagon. Civic leader Frederick Appell retained part ownership in the building until his death in 1943. Other grocers occupied the structure until the 1950s.","POINT (-96.801366 32.797726)"
"First Baptist Church of Renner","17463 Davenport",,"Church",,"1982.0","18 x 28","Renner Baptists organized in 1890 and met in the school building for eight years. Charter members were: B. F. and Kate E. Binkley; Elizabeth H., J. J., Mary A., and R. F. Butler; Mary E. and P. W. Collier; Mary L. Dickerson; George B., J. P. and Nancy E. Jennings; Mary A. McLary; Mary E. Meason; Rob C. and Margaret A. Reynolds. In 1897, the congregation bought this lot and erected a church. The present structure was built in 1925. The only surviving church in Renner, this pioneer fellowship remains a focal point in the community.Marker Sponsor: Ada Dickerson Craig","POINT (-96.793795 32.985941)"
"White Rock Pump Station","2900 White Rock Rd.",,"Pump Station",,"1989.0","Medallion & Plate","In response to increased population and extended droughts in the early 1900s, this facility was built to provide an additional water supply for the city of Dallas. Designed and built in 1911 by the city engineering department, the Renaissance Revival structure features corbelled brick and terra cotta details. Although its use has varied and much of its original mechanical equipment is no longer intact, it remains an important water utility structure.RTHL - 1989","POINT (-96.73174600000002 32.819896)"
"John Shelby Wisdom",,"6400 W. Red Bird Lane, at entrance to Camp Wisdom","Unclassified",,"2000.0","27 x 42","(October 1855 - March 7, 1931)   Born into a large family in Tennessee, John Shelby Wisdom moved with his family to a farm near Mulberry, Arkansas, when he was very young. He moved to Texas as a teenager and found work in ranching and cattle driving. Years later, he met a 12-year-old fiddler named Madison Pinkney ""Pink"" Wright and his widowed mother, Hattie Wright. Wisdom married Mrs. Wright in 1880, and the three of them lived in various parts of Texas before coming to reside in this area in 1897. In 1901 they purchased 148 acres for $100. Hattie Wisdom died in 1918. Wisdom and Pink Wright began to observe the Boy Scouts who camped on the property just west of their own. In 1920, John Shelby Wisdom was so moved by a troop of Scouts holding an Easter Sunday service in the woods that the older man was inspired to invite the Boy Scouts to camp on his land whenever they liked. In 1922, Wisdom and Pink Wright deeded 185 acres of land to the Dallas Council of the Boy Scouts (now Circle Ten Council), retaining a life estate in 130 acres. Known by this time as ""Daddy"" Wisdom, John Shelby Wisdom spent much of his time with the Scouts. In December 1924, the house shared by ""Daddy"" Wisdom and Pink Wright burned. The Boy Scouts immediately set to work building them a new home. Pink Wright died in 1925 of a cerebral hemorrhage. One month later his neighbors arranged for a grieving John Shelby Wisdom to reunite with his oldest brother, who had come to Dallas for a Confederate reunion. Wisdom, accompanied by several Eagle Scouts, later traveled to Arkansas to visit long-lost relatives. When Wisdom died in 1931, he was mourned by his family and thousands of Boy Scouts. (2000)","POINT (-96.796215 32.777977)"
"Millermore","1717 Gano St.","in Old City Park","Unclassified",,"1962.0","Medallion & Plate","William Brown Miller (1807 - 1899) moved from Missouri to Texas in 1847 with his family. In 1855-62 he built this house on his farm east of Dallas. His twelfth child, Minera (1865 - 1960), inherited the house and named it Millermore. Her husband, Barry Miller (1864 - 1933), was a Lieutenant Governor of Texas. Herein lived also their daughter, Evelyn Miller crowell, author of ""A Texas Childhood."" The house was dismantled in 1966 and reconstructed here in the 1970s.RTHL 1962","POINT (-96.788645 32.77186)"
"First Baptist Church","Ervay and Patterson Sts.",,"Church",,"1968.0","Plate and Medallion","(The First Baptist Church in Dallas)Organized 1868; first building (1871) on this site was one-room frame structure, which members fiananced by weaving rugs, making hominy, preserves, and cheese to sell at fairs near Dallas, then a frontier town of 2,500.Section of Victorian-style, red brick building was erected 1890; is only downtown Dallas Church still on original site. George W. Truett, noted minister, was pastor here 47 years and was succeeded by W. A. Criswell, 1944.RTHL - 1968",
"Near Homesite of Belle Boyd","City Park","History Center, in City Park at S. Ervay and Pocahontas, dallas","Unclassified","letter in file indicates marker was never placed","1969.0","27 x 42","(1844 - 1900)Famous as a Confederate spy during the Civil War, Marie Isabella Boyd resided at a stately colonial mansion near this site in the 1880s.One of the most effective of spies, the slender, blonde girl was only 17 when the Civil War began in 1861. Her passionate devotion to the South and to chivalry indirectly started her career when, in a fit of rage, she shot and killed a Union soldier who threatened her mother. While briefly confined at her Georgia estate, Belle was kept under watch by Federal officers, but so charming and friendly was she that they unwittingly divulged many secrets-- which soon found their way into Confederate hands.Her activities led to several prison sentences and finally exile from the United States. In England Belle married S. W. Hardinge, a Union naval officer of southern sympathies. They had one daughter.After Hardinge's untimely death, she returned to this country to become famous again, as a lecturer and a dramatic reader. In New Orleans in 1869, she married noted businessman J. S. Hammond. With their three children they later moved to Dallas, where they lived for some time. In 1884 they were divorced and in 1887, Belle sold this house. She died in 1900.",
"Governor W. Lee O'Daniel","Oaklawn","at Cedar Springs Triangle","Unclassified","Stolen","1978.0","27 x 42","A native of Ohio, Wilbert Lee ""Pappy"" O'Daniel grew up in Kansas. He moved to Ft. Worth in 1925 as sales manager of a flour-milling company. There he became a radio personality and promoter of a western band, the Light Crust Doughboys. In 1938, after a show of support from his radio listeners, O'Daniel entered the Democratic race for governor, despite his lack of political experience. Campaigning with another band, The Hillbilly Boys, he advocated industrial growth, old-age assistance, and abolition of the Poll Tax. He amazed political experts by defeating 12 Democratic opponents without a runoff. His vast inaugural picnic on Jan. 17, 1939, was the first of many colorful public events which marked his administration.Although he failed to achieve many of his campaign goals, O'Daniel was re-elected in 1940 but served only part of his second term. In the summer of 1941, he won a special election to the U.S. Senate over future U.S. President Lyndon B. Johnson and other candidates. The next year, O'Daniel defeated two former Texas governors to win a full six-year Senate term. After leaving the Senate in 1949, he moved to Dallas and opened an insurance company near this site.Married to Merle Estella Butcher, he had 3 children.",
"A. H. Belo Corporation","400 S. Record St.","400 S. Record St. in Dallas","Publication","good","1982.0","18 x 28","A.H. Belo Corporation traces its roots to a small company that founded the  Galveston ""Daily News"" on April 11, 1842.  The company began publishing the ""Texas Almanac"" in 1857.  Alfred Horatio Belo (1839-1901) bought the company in 1876 and founded the ""Dallas Morning News"" in 1885, entrusting it to G.B. Dealey (1859-1946).  In 1923, the company sold the Galveston paper and mover its headquarters to Dallas.  The company later diversified into radio and television, including WFAA-TV.  Since its founding, the A.H. Belo Corporation has played a major role in Texas communications.","POINT (-96.806183 32.776367)"
"Preston Road","6000 Preston Rd.","(in front of YMCA)","Roadway","Faded; Redo","1968.0","20 x 20","Named for Ft. Preston, built 1841at best ford on upper Red River (N. of here). Followed pre-Columbian Indian trail.Republic of Texas staked out road to fort from Austin. ""Preston Road"" later served as cattle trail from ford of Trinity River at Dallas to Oklahoma Border.","POINT (-96.804312 32.839998)"
"Frank Reagh","122 E. 5th Street","122 E. 5th Street","Unclassified",,"1976.0","18 x 28","Artist Frank Reagh (1860-1945), who immortalized the Texas longhorn, began sketching and studying his favorite subject in 1876 when he and his parents, George W. and Clarinda Reaugh, moved from Illinois to Kaufman County.  He studied art in St. Louis and Europe but returned to the Texas prairie for inspiration.  The Family came (1890) to Dallas where Reaugh became influential through his teaching and interest in the arts.  He built ""El Sibil"" as studio and home in 1928.  His pastels of frontier Texas cattle, lauded by historians, can be seen in many Texas cities.","POINT (-96.822061 32.75481)"
"Flippen Homestead and the Founding of Highland Park","4800 Preston Rd.",,"Home",,"1990.0","27 x 42","To fulfill his dream for an exclusive residential neighborhood north of Dallas, Col. John S. Armstrong in 1906 purchased 1,350 acres of land in this area, including the ""Lomo Alto"" Horse Farm, and secured the services of Beverly Hills landscape architect Wilbur David Cook to lay out the suburb. Upon Armstron's death in 1908, the Flippen-Prather Realty Co. continued plans for development of the neighborhood, which was named Highland Park (an erroneous English translation of ""Lomo Alto"").In 1909, this horse farm was deeded to Armstrong's daughters, Minnie May Flippen and Johnetta Prather, each of whom was the spouse of a principal in the Flippen-Prather Realty Co. A coin was flipped to determine first choice for a homesite, and the Flippens won the toss. Dallas architect C. D. Hill designed a house for them based on George Washington's Mount Vernon.Completed in 1910, the house served as an example for attracting Dallas' elite to Highland Park. Although radically altered externally over the years, the basic Flippen homestead retains significance for its association with the founders of Highland Park and as a reflection of Dallas' early 20th-century growth.1990","POINT (-96.804401 32.829285)"
"Dallas Baptist University (Decatur Baptist College)","3000 Mountain Creek Pkwy.",,"School",,"1998.0","27 x 42","Closely linked to Northwest Baptist College, which operated from 1891 to 1897, Decatur Baptist College opened its doors in 1898. The college was the result of an effort by Texas Baptist leaders to consolidate all Texas Baptist Schools under the direction of Baylor University and the Baptist General Convention of Texas. The college, which initially served primary and secondary school students in addition to the junior college program, had an enrollment of 105 in the fall of 1898. J. L. Ward, president of the college from 1900 to 1907 and 1914 to 1950, was most influential in the development and expansion of the college. By 1959 the school offered courses in religion, fine arts, business, languages, and vocational training.   Increasing financial challenges and decreasing enrollment led the college to accept an invitation to move to Dallas. The school's name was changed to Dallas Baptist College in February 1965; its first classes were held that fall, with an enrollment of 941.   The college became a four-year institution in 1968. Renamed Dallas Baptist University in 1985, the school began awarding graduate degrees in religion, education, and business administration. The school grew steadily under the leadership of a new president beginning in 1988 and paid its outstanding financial debts. By the 1990s, the population of the college community exceeded 3,500 as the school affirmed in its mission statement its commitment ""to provide Christ-centered quality higher education."" (1998)","POINT (-96.951511 32.711523)"
"Mount Calvary Cemetery","7200 blk. of Valley View Rd.","1/4 mile west of Coit Road","Cemetery","slightly faded; repair (local effort)","1978.0","18 x 28","Pioneer settlers used this site for burials as early as the 1840s. The oldest known grave is that of Amanda L. Houx (1829 - 1847). In 1868 William Huffhines donated a two-acre tract, which included the early graves, to Mount Calvary Baptist Church. A frame church building stood here until 1885, when the congregation moved to Richardson and later became the First Baptist Church. More land was added to the burial ground by C. C. Huffhines in 1896 and C. B. Chick in 1925 and 1935. A cemetery association, formed in 1924, cares for the almost 800 graves here.",
"Higginbotham - Pearlstone Building","1701 Market St.",,"Commmercial Building",,"1986.0","Medallion and Plate","Constructed in 1909, this building was first occupied in 1910 by the Hobson Electric company. The warehouse was next leased to the Maroney Hardware Company, which was bought in 1926 by Rufus W. Higginbotham and Hyman Pearlstone, owners of the Higginbotham - Pearlstone Wholesale Hardware Company, which was located here until 1977. The four-story brick industrial building, featuring corbelled cornices, remains as a focal point of the city's historic west end.RTHL 1986",
