"title","address","location_description","classification","marker_condition","year","marker_size","marker_text","geocoded_column"
"Caruth House","8000 Cornerstone Parkway",,"Home","did not see","1962.0","Medallion",,"POINT (-96.773995 32.860709)"
"La Reunion","Stevens Park Golf Course, Tee #6","on Hampton Road at intersection w/Old Orchard","Unclassified",,"1924.0","other","Site of the French Colony La Reunion, settled 1854. Placed by Jane Douglas Chapter, Daughters of the American Revolution.April 10, 1924",
"John C. McCoy","Oakland Cemetery","at very front of Oakland Cemetery, near entrance","Unclassified",,"1968.0","grave marker","John C. McCoy(1819 - 1887)Practiced law in Kentucky before coming to Texas in 1845. Was agent for Peters' Colony located in Dallas and adjacent counties. First attorney to practice law here. He founded bar association; fought in the Mexican War; was outstanding civic leader.",
"Beeman Memorial Cemetery","4600 Dolphin Rd.","4600 Dolphin Rd., Dallas","Cemetery","Good","1984.0","18 x 28","John (1799 - 1856) and Emily Hunnicutt (1806 - 1892) Beeman brought their family to Texas during its days as a Republic. About 1842 they gained clear title to 640 acres of land on which they established this family cemetery. One of the first known burials, that of Holland coffee Bryan, eleven-month-old son of their daughter Margaret and her husband, John Neely Bryan, took place in 1845. John and Emily are buried here, as are other family members and early neighbors. An important link in Dallas' history, the Beeman Memorial Cemetery contains more than 100 graves.1984","POINT (-96.737727 32.778144)"
"Buckner Log Cabin","Samuel Blvd. & Buckner","6 mi. east of downtown Dallas, at Samuel and Buckner (Loop 12) Blvds., Dallas","Cabin",,"1965.0","16 x 12 Medallion and Plate","Dr. R. C. Buckner was born in this Madisonville, Tenn., cabin, Jan. 3, 1833. He moved to Texas, 1859.In 1879, founded Buckner Home. Original quarters cared for 8 children. After his death, April 9, 1919, work continued under sons, Joe D. and Hal F., and grandson, Robert Cooke Buckner II.This rough-hewn, 2-story cabin was moved here from original site, 1912, by staff and friends. Children playing around it gave the name ""Tennessee House.""RTHL, 1965",
"Baptist Standard","2343 Lone Star Drive","2343 Lone Star Drive","Publication","good","1989.0","18 x 28","The history of this denominational publication dates to 1888, when Lewis Holland and John H. Boyet founded ""The Baptist News"" om Fannin County.  It moved to Dallas in 1889, and its name cnaged to ""The Baptist Standard"" in 1892 under the guidance of J.B. Cranfill.  The paper moved to Waco that year but returned to Dallas in 1898.  It came under the ownership of the Baptist General Convention of Texas in 1914.  Under the leadership of such editors as J.B. Gambrell, the publication has grown into the largest state paper in the Southern Baptist Convention.","POINT (-96.860558 32.768669)"
"James W. Latimer (Weck)","Pioneer Cemetery","north side of Dallas Convention Center on Ceremonial Drive","Unclassified",,"1968.0","grave marker","(1783 - 1860)Latimer was born in New London, Conn. Moved to Texas, with family, in 1833.Founder and editor first newspaper in Dallas, 1849. Known originally as ""The Cedar Snag"" then as ""Dallas Herald."" Incorporated into ""Dallas Morning News"" in 1885.Recorded, 1968",
"First Baptist Church of Renner","17463 davenport",,"Church",,"1982.0","16 x 12","To better serve a changing community, the congregation of the First Baptist Church of Renner purchased this property in December 1979 and moved its place of worship to this location. The church became Preston Highlands Baptist Church in April 1980, with the first building dedicated on October 12, 1980.","POINT (-96.793795 32.985941)"
"Dallas Depot of the H. & T. C.","Fair Park, Washington Dr.",,"Railroad",,"1979.0","Plate and Medallion","Dallas Depot of the H. & T. C.In July 1872 the Houston & Texas Central became the first railroad to reach Dallas. This frame depot was constructed for the H. & T. C. and the Texas & New Orleans in 1903, when both lines were part of the Southern Pacific System. Originally located on Eakin Street (1.25 mi. W), this structure served as a passenger station until 1918 and as yardmasters office until 1963. Threatened with demolition, it was then moved to this site.RTHL - 1979",
"John Jay Good",,"Pioneer Cemetery - Marilla at Young St.","Grave",,"1996.0","Grave Marker","(1827-1882)   Mississippi native John Jay Good practiced law in Alabama before moving to Dallas in 1851. He married Susan Anna Floyd in 1854. Good was involved in early local and state government and was a charter member of the local Odd Fellows' Lodge in 1855. He served the Confederacy in the Civil War as a colonel of an artillery regiment. Good later became a district judge and was elected as mayor of Dallas in 1880. (1996)","POINT (-96.796215 32.777977)"
"John Goodwin Tower",,"Sparkman Hillcrest Memorial Park, 7405 S. Northwest Highway","Unclassified",,"1999.0","18 x 28","(1925-1991)   The son of a Methodist minister, John Goodwin Tower was a veteran of World War II and a political science professor before entering politics. He joined the national political scene in 1960-1961 when he won the special election to fill Lyndon B. Johnson's U. S. Senate seat, becoming the first Republican senator from Texas since Reconstruction. Tower served in the Senate for 24 years, holding a number of influential committee assignments and chairmanships. He became the chief United States negotiator at the strategic arms reduction talks in Geneva after his retirement from the Senate in 1985. He later chaired the Tower Commission, which issued its report on the Iran-Contra Affair in 1987. Tower was serving as an advisor to President George Bush at the time of his death in an airplane crash. (1999)","POINT (-96.796215 32.777977)"
"St. Paul's Evangelical and Reformed Church","6464 E. Lover's Lane",,"Church",,"1989.0","27 x 42","Established on December 1, 1889, this congregation began with five charter members. Led by the Rev. H. Siegfried, the church was organized with the help of Fort Worth pastors Thomas L. Mueller and c.F. Bauman. The congregation was originally named St. Paul's German Evangelical Church and served a predominantly German-speaking membership.A German Presbyterian congregation already in existence in Dallas merged with St. Paul's, and the Presbyterian church building was moved to a site at the corner of Texas and Florence streets to serve the new congregation. The Rev. Mr. Siegfried was succeeded by the Rev. J. Jans in 1893. The Rev. Theophile Tanner led the congregation from 1895 to 1909, and he was succeeded by the Rev. Albert Romanowski, who served until 1935.A new sanctuary was built in 1912 to serve the growing congregation. Worship services were conducted solely in the German language until world War I. The name was changed to St. Paul's Evangelical and Reformed Church in 1934. This site was acquired in 1953, and a new sanctuary was completed in 1957.Instrumental in establishing new congregations in the area, St. Paul's continues to serve the community.","POINT (-96.749356 32.85202)"
"Site of Scyene Meeting Place","9500 blk. of Scyene Rd.","at Belle Starr Dr.","Government Building","Faded; Refinish","1976.0","18 x 28","In the 1840s, settlers held public meetings under a tree at this site. Beginning in the 1850s, several successive 2-story frame buildings stood here and housed Masonic Lodge, church, elections, and social activities. Scyene Meeting Place housed one of the first public school sessions in Dallas County. In her girlhood, outlaw Belle Starr was a pupil in that school. In 1872, Texas & Pacific Railroad bypassed Scyene and the town dwindled. Yet the Woodmen of the World and other groups continued to meet in the community building, and school was held here until 1927.Bicentennial project donated by Mesquite Historical and Genealogical Society","POINT (-96.659665 32.76327)"
"Higginbotham - Bailey Building","900 Jackson St.",,"Commmercial Building",,"1984.0","Medallion and Plate","Designed by noted Dallas architectural firm of Lang and Witchell, this building was constructed to house the dry goods manufacturing and distributing business of the Higginbothham - Bailey - Logan Co. (known as Higginbotham - Bailey after 1945). The western section was completed in 1914, and additional sections were constructed in 1917 and 1923. The building features a simplified Renaissance Revival architectural style with geometrically-detailed corner towers.RTHL 1984","POINT (-96.803426 32.778211)"
"Juliette Abbey Peak Fowler","Pioneer Cemetery","north side of dallas Convention Center, Ceremonial Dr.","Unclassified",,"1986.0","gravemarker","Juliette Abbey Peak Fowler(May 8, 1837 - June 4, 1889)After the deaths of her husband and children in the early 1860s, Juliette Peak Fowler lived in Dallas and was active in local charitable causes. Committed to orphans and elderly women during her life, she provided for their benevolent care in her will. Under the direction of her sister, Sarah Peak Harwood, the Juliette Fowler Homes began in 1892. Transferred to the Disciples of Christ Church in 1903, the homes continue to reflect the goals and ideas of their founder.",
"Merrell Cemetery","4000 blk. of Merrell Rd.",,"Cemetery",,"1985.0","27 x 42","Elder Eli Merrell (1787 - 1849), minister of the Disciples of Christ Church, came with his wife, Mary, in 1844, to settle 640 acres near Bachman's Branch in what was then Nacogdoches County. This cemetery is on a part of his acreage, and his was the first marked grave at this site.The Merrell Cemetery originally served pioneers from the surrounding area. Numerous prominent citizens and members of the historic Peters Colony are among those buried here.William Strait (1806-86) and his wife, Mourning (1806-77), came to Dallas County in 1853. Many of their family members remained in the area, serving the community in various positions. Strait's sons, William, Enoch, and Bennett, served with Merrell's sons, George and John, in the 19th Cavalry during the Civil War. Enoch Strait (1834 - 1917) served as Dallas County Commissioner and William Strait's grandson, Elmo (1876 - 1922), became the Chief of Police for the city of Dallas.Members of the cemetery association, which was organized in 1965, include many descendants of pioneer settlers.","POINT (-96.844971 32.887679)"
"Union Station","400 S. Houston St.",,"Railroad","Faded; redo (locally)","1979.0","Medallion & Plate","By the early 1900s, Dallas needed a single rail terminal for the numerous railroads serving the city. In 1912 seven rail lines formed the Union Terminal Co. They hired Chicago architect Jarvis Hunt, who designed this neo-classical building with an elegant grand hall on the second floor. The facility officially opened Oct. 14, 1916, at the start of the state Fair. A Dallas landmark, Union Station was a center of community life during the peak years of train travel.RTHL - 1979","POINT (-96.807075 32.776323)"
"Ambassador (Park) Hotel","1312 S. Ervay","1312 S. Ervay, corner of St. Paul","Hotel","good","1965.0","Medallion and Plate","Built in 1905 as city's first suburban luxury hotel. By first public park.  In 1955 became first retirement hotel.Recorded Texas Historical Landmark -- 1965","POINT (-96.791076 32.77273)"
"Texas Women in the Civil War, A Tribute to","Grand Place, Fair Park",,"Grave",,"1964.0","27 x 42","Civilian duties of 90,000 Texas men fighting for the Confederacy fell to wives back home in land of few factories and an enemy blockade that cut down on imports. Women had to run businesses and farms for their absent men who committed to the uncertain mails their letters of instruction. Yet with help of children, old men and loyal slaves, furnished Army and the Confederacy with grain, meat and cotton for home consumption and foreign exchange for guns, gunpowder, factory goods, drugs and other supplies.Ran newspapers. Loaded shells. Made gun caps. Did ""man's work"" of many kinds, in addition to homemaking, sewing, nursing, teaching and child care.Made medicines from herbs and plants. Grew poppies and squeezed the seed pods to supply opiates to the hospitals. Carded cotton and wool, spun and wove, then dyed the homemade cloth with bark or roots. Plaited palmetto or corn shucks to make hats. Made coffee of acorns or vegetables, tea of sage or orange leaves.On 2,000 miles of coastline and frontier, faced personal hazards from invasion or Indian raids. Elsewhere were in peril from marauders. Through the four years won admiration for their pluck, and maintained faith enough to help rebuild the defeated South.",
"Scyene Road, Old","9500 Blk. Scyene Rd.","at Belle Starr Dr.","Roadway",,"1977.0","18 x 28","Once a buffalo trail, Scyene Road was one of the earliest roads in Dallas County. It linked the community of Scyene with Dallas, one day's journey by wagon to the west, and with Jefferson and Shreveport to the east. Named for a town in ancient Egypt, Scyene was settled in the 1840s and 1850s. During the 1870s, Belle Starr and other outlaws, including Jesse James, lived here and traveled this road. A thriving town with a post office, stores, school, and churches, Scyene declined after it was bypassed by the Texas & Pacific Railroad in 1872.","POINT (-96.659665 32.76327)"
"La Reunion Cemetery","3300 block of Fish Trap Rd.","in West Dallas, Housing Park","Cemetery",,"1974.0","18 x 28","Burial place of French, Belgian, and Swiss settlers brought here 1855-58 by company for European American colonization in Texas. This site was on road from La Reunion to Willow Fish Traps set by the colonists in the Trinity. Early burials in this cemetery included aged French Grenadier Pere Lagogue; also a young child of colony director F. Cantagrel. The company failed, but certain families remained, including the Loupots, Remonds, Reverchons, and Santerres. They became business land cultural leaders in Dallas area, and used this cemetery as late as 1939 for family burials.Marker Sponsors:John R. SanterreRoy C. SanterreMrs. George H. Santerre""Germain Santerre Family""Graneta Bilbo GoodwinLe Bonnet Bleu Garden Club",
"Cedar Springs","4810 Cedar springs Rd.","corner of Cedar Springs and Kings (near Gazebo), Dallas","City","None","1984.0","27 x 42","Although settlement of the town of Cedar Springs did not begin until after 1843, the area had been surveyed during the late 1830s by Colonel G. W. Cooke in preparation for construction of a military road from Austin to the Red River. In 1843, Dr. John Cole and his wife, Mary, along with their eight children, arrived in this area. Cole received a Peters colony land grant about two miles east of the Cedar Springs branch of the Trinity River. Preferring to settle closer to the springs, he purchased additional acreage in this area, built a home, and opened a general store.The name of the community possibly was taken from the abundance of cedar trees near the springs. Cedar Springs gradually attracted additional settlers, and several other businesses, including a distillery, steam-powered flour mill, and grist mill, were begun.Development of the Cedar Springs community declined following Dallas' selection as the Dallas County Seat in 1850. Toward the end of the nineteenth century, the area began to experience suburban growth and was renamed Oak Lawn. The site of the early town of Cedar Springs was annexed by the City of Dallas in a series of municipal actions between 1920 and 1940.","POINT (-96.821083 32.819291)"
"Greenwood Cemetery","2030 Oak Grove","corner of Peace and Liberty Ave. within Greenwood Cemetery","Cemetery","Faded slightly","1976.0","18 x 28","Greenwood Cemetery was part of a Republic of Texas grant, called the John Grigsby League, given for service in the Battle of San Jacinto. W. H. Gaston, pioneer Dallas banker, acquired title to the site in 1874, after the noted local legal battle, ""The Grigsby Cases,"" and founded Trinity Cemetery. Greenwood Cemetery Association assumed operation in 1896. Many people prominent in the histories of the city, state and nation rest here, in addition to casualties and verterans of every American military involvement since the War between the States.",
"Cooke, Colonel William G.","Ewing and Clarendon Avenues","intersection of Ewing Ave. and Clarendon Ave. (in traffic triangle)","Roadway","Good","1936.0","grey Centennial","To the memory of Colonel William G. Cooke and forty other members of the Regular Army, Republic of Texas, who camped in this vicinity in October, 1840 while locating the Central National Highway. The importance of this military road in the history of Dallas will not be forgotten.(Corinth Street Viaduct, Dallas)",
"Giving Community Thanks","1625 Elm","on Pacific St. side of Palace Theatre wall facing Thanksgiving Square","Unclassified",,"1971.0",,"Thanksgiving is man's response to his Creator. In an unusual early expression of interfaith good will, a rabbi, a priest, and Protestant ministers started in 1907 at Bush Temple in Dallas a community worship service of thanksgiving which continued until 1918.The 100th anniversary of Dallas in 1941 was a service of thanksgiving and dedication in the Hall of State at Fair Park. In the war year of 1942, a Thanksgiving Day service was held at the Palace Theatre; this was repeated annually for 16 years.To celebrate thanksgiving at all times--not just annually--a foundation purchased land in 1968 for Thanks-Giving Square, here in downtown Dallas.People on this continent have given God thanks in their own way, beginning with the Indians centuries ago. The Spanish in 1541 recorded a Thanksgiving by Fray Juan Padilla of Coronado's Expedition in Palo Duro Canyon near present Amarillo. In 1842, President Sam Houston asked the Republic of Texas to give thanks for its place among the independent nations of the earth. After statehood, governors started in 1849 to issue annual proclamations fulfilling this universal tradition so long honored in Texas.",
"McCree Cemetery","9900 blk. of Audelia","accessed via alleyway (cemetery is behind SW Bell Building)","Cemetery",,"1985.0","18 x 28","The first land for this cemetery was granted by Mahulda Bonner McCree in 1866. At least two burials, for John Henry Jones (d. 1862) and Elizabeth McCullough (d. 1864), occurred before the graveyard was formally deeded. Over the years, the cemetery has been enlarged to cover over 3 acres. It contains the graves of Peters colonists, war veterans, and many persons associated with early area Methodist and Baptist churches. McCree Cemetery remains an important part of the recorded history of Dallas County.",
"Kleberg","1500 block of Edd Rd.","Kleberg/Rylie Recreation Center","City",,"1988.0","18 x 28","The town of Kleberg began in 1850 on the land grant of Robert Justus Kleberg (1803 - 1888), veteran of the Republic of Texas Army and a participant in the Battle of San Jacinto. Originally a stage stop where two wagon trails crossed, Kleberg grew into a farming community. After the railroad came in 1881, the town boasted a post office, bank, and a number of retail businesses. The construction of a series of dams and locks on the Trinity River provided jobs in the early 1900s but a 1908 flood destroyed the work. Incorporated in 1956, Kleberg was annexed by Dallas in 1978.","POINT (-96.601582 32.68511)"
"Ross Avenue Baptist Church","5201 Ross Avenue",,"Church",,"1999.0","Medallion & Plate","This congregation began as a mission of the First Baptist Church in 1894, and was formally organized as the Haskell Avenue Baptist Church in 1908. Designed by prominent Fort Worth architects E. W. Van Slyke and Charles Woodruff after this site was acquired in 1915, this building was completed in 1917. A sophisticated example of early 20th century classicism, it exhibits hallmarks of the style including a pedimented entry portico with colossal Order Ionic columns and classical architrave. Its lantern dome is a visual landmark for much of east Dallas.   Recorded Texas Historic Landmark - 1999","POINT (-96.772951 32.808894)"
"Wheatland Methodist Church","8000 S. Hampton",,"Church",,"1965.0","Medallion & Plate","Founded in 1847, year after Texas joined the United States. Known as the oldest Methodist church west of Trinity River. Built on present site, 1859. Enlarged building, 1912, adding steeple, stained glass windows.RTHL - 1965","POINT (-96.857049 32.649035)"
"Highland Park Methodist Church","3300 Mockingbird",,"Church",,"1995.0","27 x 42","This congregation traces its origin to the founding of a church at Southern Methodist University in early February 1916. Known as the University Church, its first members came from the campus community of faculty and students.Methodist Bishop Edwin D. Mouzon appointed the Rev. A. Frank Smith as first pastor. The church gained added support and leadership when Methodist families living in the new suburb of Highland Park transferred their memberships. It was renamed Highland Park Methodist Episcopal Church, South, and at the end of 1916 the charter roll listed 225 members.Southern Methodist University donated land at this site to the church in 1916, and in 1917 the congregation erected a temporary structure known as the ""Little Brown Church."" The town of Highland Park annexed the church property in 1923, a legal formality that cleared the way for construction of a new Gothic Revival sanctuary in 1926.Due to rapid growth in membership, the church added three new buildings to its main campus between 1950 and 1961. By 1995 membership exceeded 10,500. The congregation continues its historic commitment to community service and international missions.","POINT (-96.786098 32.836544)"
"South Boulevard-Park Row Historic District","Atlanta & South Blvd.",,"Neighborhood",,"1981.0","27 x 42","This neighborhood is one of the few remaining intact residential districts which reflect the early twentieth century surburban development of Dallas. Construction of homes in this vicinity began soon after the Jewish Temple Emanuel El was moved here in 1913 from its downtown location. Many early residents of the neighborhood were prominent leaders of the Dallas Jewish community.Included in the district are homes designed by the leading area architects of the time. The structures feature a variety of popular architectural influences, representing details of the midwestern prairie, Mission Revival, Classical Revival, and Georgian styles.A gradual migration of area residents to newer suburban developments began following the end of World War II. During the 1950s, the South Boulevard-Park Row neighborhood became the home of many prominent Black leaders of the Dallas area. Residents here have included educators, lawyers, merchants, clergymen, doctors, and business executives. Since the early twentieth century the neighborhood has been a symbol of the growth, prosperity, and vitality of Dallas.","POINT (-96.771763 32.767951)"
"Sanger Brothers Department Store","303 N. Akard St.",,"Unclassified","missing","1984.0","18 x 28","This retail establishment traces its history to 1857, when German native Isaac Sanger opened a small dry goods store in McKinney. Sanger later was joined by his brothers Lehman, Philip, Alex, and Sam. The first store to bear the name Sanger Bros. opened in 1867 in Bryan. New stores were established as the railroad line moved north to Dallas, where the Sangers opened a store in 1872. Sanger Bros. became nationally known for its innovative marketing and merchandising techniques and played a major role in the city's commercial development.","POINT (-96.800089 32.782519)"
"Dr. Frank E. Rutherford Veterinary Hospital","924 S. Haskell",,"Unclassified",,"1999.0","Medallion & Plate","This building was erected about 1924 to house the veterinary practice of Dr. Frank E. Rutherford (1876-1932), who began practicing in east and south Dallas in about 1906. When Dr. Rutherford died in 1932, his son-in-law graduated from veterinary school and assumed ownership of the practice; Rutherford's widow Nell retained title to the building until her death in 1975. The practice continues in operation under new ownership. The fine structure's outstanding features include a line of transom windows, simple parapet and tile roof canopy.   Recorded Texas Historic Landmark - 1999","POINT (-96.764177 32.783768)"
"Cedar Springs","Lemmon Ave.","on Lemmon Avenue between Hawthorne and Loma Alto Dr. in Craddock Park; Dallas","Waterway","Good","1936.0","grey Centennial","CEDAR SPRINGSEarliest known historic site in Dallas CountyVisited in 1840 by Colonel Wm. G. Cooke's preliminary exploration for a route between Austin and Red River. A community also called Cedar Springs, established in this vicinity in 1843 by Dr. John Cole, rivalled Dallas in an election in 1848 for county seat. In 1929, the land was annexed to Dallas.",
