"vendor_formal_name","vendor_dba","contact_name","telephone","fax","certification","cert_renewal_date","ethnicity","address1","address2","city","state","zip","mailingaddress1","mailingaddress2","mailingcity","mailingstate","mailingzip","website","date_of_establishment","aggregate_bonding_limit","signatory_to_union_contracts","business_description","goods_materials_suplier","types_of_construction_projects","job_exp1_name_of_client","job_exp1_value_of_contract","job_exp1_percent_self_performed","dateofjob1","experience1","job_exp2_name_of_client","job_exp2_value_of_contract","job_exp2_percent_self_performed","dateofjob2","experience2","job_exp3_name_of_client","job_exp3_value_of_contract","job_exp3_percent_self_performed","dateofjob3","experience3","job_exp4_name_of_client","job_exp4_value_of_contract","job_exp4_percent_self_performed","dateofjob4","experience4"
"Architectural Flooring Resource Inc.",,"Catherine Leidersdorff","2122900200","2122902855","MBE,WBE","11/30/2026;11/30/2026","HISPANIC","135 West 27th Street","6th Floor","New York","NY","10001",,,,,,"http://www.afrny.com","1993-04-25T00:00:00.000","10000000",,"We furnish and install flooring including specialty flooring: wood, cork, ceramic tile, carpet tiles, rubber, sports, flooring, boardroom, vct, mats and floor grates. We provide cleaning of carpet, fabric and hard surface flooring. We offer maintenance programs, as well as SaniGlaze a safe and environmentally friendly tile and grout restoration.",,,"Jones Lang Lasalle","2107731","100","2016-09-01T00:00:00.000","Furnish and install carpet and resilient","NYS Office of Mental Health","460788","100","2017-11-01T00:00:00.000","Labor to install.","Bank of NY Mellon","1522406","100","2016-03-01T00:00:00.000","Furnish and install carpet and resilient","JP Morgan Chase NOC V","1801014","100","2016-01-01T00:00:00.000","Purchase and install Miliken and Mannington carpet"
"Lemor Development Group LLC",,"Harrison Rayford II","2122812714",,"MBE","11/30/2026","BLACK","167 W. 145th St",,"New York","NY","10039",,,,,,"http://www.lemordev.com",,,,"Provide real estate development, consultant, and property management services for affordable, workforce, and mixed-income housing.",,,"Harlem Congregations for Community","350000","100","2018-06-01T00:00:00.000","Management of master lease for commercial units","407 Lenox Avenue LLC","15000","100","2021-08-01T00:00:00.000","Project Management Fee","7th Avenue Mennonite HDFC","30000","100","2015-12-01T00:00:00.000","Management of two apartment buildings.  Marketing and rent up of 20 vacant apartments.","Harlem Restoration Corp","50000","100","2014-08-01T00:00:00.000","Management of three apartment buildings.  Certification of low income tax credit apartments and mark"
"Cloe Luv LLC",,"Lisa Merraro","9176055037",,"MBE,WBE","05/31/2027;05/31/2027","BLACK","535 Atlantic Ave","Storefront","Brooklyn","NY","11217",,,,,,"http://www.cloeluv.com","2017-01-02T00:00:00.000",,,"Cloe Luv LLC is a Multi-Service company that provides the following areas: Artist/Talent and Business Consulting and Management Music Production Cloes Corner which is a multipurpose venue/event space Public and Motivational Speaking",,,"Mayor Bloomberg","126000","100","2020-02-04T00:00:00.000","Supplied Brooklyn campaign headquarters, performed press interviews and coordinated events with camp","Niro Enterprise","16800","100","2019-12-30T00:00:00.000","Business Formation Business Consulting and Development Personal and Business credit consulting","City Block","2663","100","2019-12-02T00:00:00.000","Space rental",,,,,
"RV Global Solutions, Inc.",,"Rahul Gangu","7328020009",,"MBE","06/30/2025","ASIAN","247 East Front Street","Suite # 1","Trenton","NJ","08611",,,,,,"http://www.rvglobalsolutions.com","2005-06-21T00:00:00.000",,,"RV Global Solutions does IT consulting, management consulting, facilities engineering, facilities management and telecommunications support.",,,"U.S Army","1089542.25","100","2021-09-14T00:00:00.000","Provided logistics support, service, repair, equipment/parts replacement, hardware upgrades and asso","U.S Small Business Administration","174790","100","2021-02-28T00:00:00.000","Renewed client's maintenance agreement with Oracle. Renewed a license and offered Tier 3 technical s","U.S Army","90826.89","100","2021-08-13T00:00:00.000","Provided training and technical support.",,,,,
"Sarathi LLC",,"Jenish Tamakuwala","2125685159",,"MBE,WBE","03/31/2024;03/31/2024","ASIAN","4227 Broadway",,"New York","NY","10033",,,,,,"http://subway.com","2012-03-01T00:00:00.000",,,"Owned Restaurant Business in state of New York.",,,"New York City Department of Education","1012.5","100","2020-03-11T00:00:00.000","150 6-inch lunch boxes.","NYC Community Learning Schools","704","100","2019-06-01T00:00:00.000","16 sandwich platters","Law and Public Service","200","50","2017-02-01T00:00:00.000","We Deliver the catering order. Dba: Subway","New York City Department of Education","1012.5","100","2019-11-20T00:00:00.000","150 sandwich boxes with cookies and potato chips."
"IM Practices, Inc.",,"Saurabh Agarwal","7326931644",,"MBE","09/30/2022","ASIAN","4250 US Highway One","Suite 7","Monmouth Junction","NJ","08852",,,,,,,,,,"IM Practice is a staffing company that provides staffs to all kinds of business sectors and industries throughout all 50 states in United States of America.",,,"Jannon Inc","8790","100","2021-05-13T00:00:00.000","Provided staffs to the business",,,,,,,,,,,,,,,
"Leiva Mena Cleaning Services",,"Maxi-Millie Leiva Mena","9174959455",,"MBE,WBE","11/30/2026;11/30/2026","BLACK","865 Amsterdam Avenue",,"New York","NY","10025",,,,,,,"2020-01-03T00:00:00.000",,,"Leiva Mena Cleaning service provides service dedicated to maintaining your property's care and appearance. Our trained professional are ready to review your house or commercial facility's cleaning needs.",,,"Petrona","13000","100","2020-01-03T00:00:00.000","House cleaning.",,,,,,,,,,,,,,,
"AB HILL ENTERPRISES LLC",,"Dionne Ford","3476785758",,"MBE,WBE","08/30/2023;08/30/2023","BLACK","61-43 186TH ST",,"FRESH MEADOWS","NY","11365",,,,,,,"2016-10-12T00:00:00.000",,,"AB Hill Enterprises LLC specializes in commercial carpentry ranging from exterior framing and sheet rock, to interior framing and sheet rock, all rough carpentry, finished carpentry, millwork, taping to level 5 finish, painting and wall covering.",,,"Danya Cebus Construction LLC","1785000","90","2018-06-20T00:00:00.000","Exterior/Interior framing, sheetrock, taping level 5 finish, painting, kadex","Dani's Builders",,"100","2017-03-20T00:00:00.000","Interior framing, sheetrock, level 5 taping, painting,  kitchen cabinet install, bathroom vanity ins",,,,,,,,,,
"Hi & Low Computers, Inc.",,"Ku-Long Lin","7188868088","7183590460","MBE","03/30/2023","ASIAN","135-23 Northern Blvd.",,"Flushing","NY","11354",,,,,,"http://www.hilow.com","1990-04-04T00:00:00.000",,,"Computer and appliance wholesale and retailm, surveillance systems, installation and repair.",,,"Museum of jewish Heritage","72035.62",,"2010-05-01T00:00:00.000","Intallation of Cisco HP switches",,,,,,,,,,,,,,,
"NYCMC Corp.",,"Fahad Fateh","7185939460",,"MBE","11/30/2026","ASIAN","98-18 ASTORIA BLVD","SUITE 1","EAST ELMHURST","NY","11369",,,,,,,"2013-07-29T00:00:00.000",,,"Construction in Private and Public Sector",,,"NYCSCA","644900","50","2021-03-22T00:00:00.000","GYMNASIUM UPGRADE: Floor tiles removal; padding replacement; new storage rooms; drills; painting; pa","NYC SCA","449500","40","2021-08-03T00:00:00.000","ADULT HEIGHT HANDRAILS STAIRWAYS","NYC SCA","574490","60","2019-02-04T00:00:00.000","Room Conversions/Partitioning","NYCSCA","277000","75","2018-10-08T00:00:00.000","Demo Gym floor, Shot blast, Self leveling, replace gym floor, replace water fountain, replace door,"
"Alayjiah Inc.","Alayjiah Cleaning Services","James Alcide","7184963435",,"MBE","11/30/2026","BLACK","899 Euclid Avenue",,"Brooklyn","NY","11208",,,,,,"http://www.alayjiahinc.com","2015-03-03T00:00:00.000",,,"Alayjiah Inc provides janitorial and residential cleaning services. The company offers carpet cleaning, strip and wax, move-in/move-out clean up services and COVID-19 electrostatic disinfecting.",,,"The Ali Forney Center","13000","5","2020-11-03T00:00:00.000","Provided janitorial services.",,,,,,,,,,,,,,,
"Kenny & Khan Architects, P.C.",,"Rolando Kenny","2122060722","2122060919","MBE","11/30/2026","HISPANIC","1123 Broadway, Suite 513",,"New York","NY","10010",,,,,,"http://www.kennykhan.com","2008-11-20T00:00:00.000",,,"Complete Architecture professional services",,,"NYC SCA","3300000",,"2015-09-01T00:00:00.000","The project involved a 46,000 SF building addition to the existing primary school and the alteration","NYC School Construction Authority","1016000",,"2019-01-31T00:00:00.000","Currently in design of a 28,000SF building addition to an existing school","NYC School Construction Authority","2700000",,"2017-09-15T00:00:00.000","Design of a 50,000 SF Bldg Addition to an existing school","NYC SCA","513805","100","2016-03-01T00:00:00.000","Conversion of an existing 15,000 SF retail/commercial building into a pre-school with a capacity for"
"U-Kay Darzi, Inc.","American Safe & Vault","Kelly Darzi","2018956153","2018805675","WBE",,"NON-MINORITY","90 Prospect Avenue","Suite 10A","Hackensack","NJ","07601",,,,,,"http://www.american-safe.com","2009-11-02T00:00:00.000",,,"We are a full 24 hour locksmith & security service. We focus on safe & vault work CCTV, and commercial security.",,,"MTA","23000","100","2015-08-17T00:00:00.000","Replace lock on safe.","NYC Court House","850","100","2015-09-01T00:00:00.000","7 combo changes.",,,,,,,,,,
"TDP Associates, Inc.",,"Tejendrakumar Patel","5164069917",,"MBE","11/30/2026","ASIAN","153 Shepherd Ln",,"Roslyn Heights","NY","11577",,,,,,"https://www.tdpassociates.net","2016-01-01T00:00:00.000","3000000",,"Construction management, consulting, project management, estimating, scheduling & drafting services, security/comm/FA-Alarm installer (Low voltage work), electrical work.",,,"Externetwork Inc/ MTA-NYCT","2100000","100","2021-02-24T00:00:00.000","Installation of Communication Equipment (FWCDS, Ciena, IMACS 3000), Installation of conduit, fiber c","Fujitsu Network Communication/MAT-NYCT","1900000","100","2020-06-01T00:00:00.000","Installation of Communication Equipment (FWCDS, 9500 Ciena), Installation of conduit, fiber cables,","MTA-Metro North/ ATC","2000000","100","2019-12-20T00:00:00.000","Installation of CCTV system, Help Points, conduits, cables, electrical work - 14 Metro north Station","Zafra Minhas Construction LLC","143625","100","2018-08-01T00:00:00.000","Perform electrical conduit mitigation work in manholes, demo and reinstatement of electrical devices"
"Fiedler Marciano, LLP",,"Mark Fieldler","2128685242","2128685244","MBE","11/30/2026","HISPANIC","315 West 39th Street","Studio 1002","New York","NY","10018",,,,,,"http://www.fiedlermarciano.com","2006-02-22T00:00:00.000",,,"Architectural design services.",,,"Gluckman Mayner",,,"2014-06-01T00:00:00.000","Architectural Designs","I Park Foundation",,,"2016-04-01T00:00:00.000","Architectural Design","Peter Malik",,,"2015-01-01T00:00:00.000","Architectural Designs",,,,,
"Shakespeare Gordon Vlado Architects PLLC","SGVA","Amy Shakespeare","2128223200",,"WBE",,"NON-MINORITY","168th 7th Street","Suite 316","Brooklyn","NY","11215",,,,,,"http://www.sgvarch.com","2004-05-08T00:00:00.000",,,"Shakespeare Gordon Vlado Architects is a full service architecture firm that pursues innovative, insightful solutions to challenges of all scales and types. Our primary areas of practice are affordable multi-family housing, institutional projects such as spaces for non-profits and universities, and single family homes.",,,"WSFSSH PA LLC","1293270","0","2020-02-01T00:00:00.000","Architectural design and construction administration services for 105-unit senior affordable housing","MHANY","284000","0","2021-09-09T00:00:00.000","Architectural design and construction administration services for the renovation of five affordable","Columbia University","146624","0","2020-07-22T00:00:00.000","Architectural design and construction administration services for renovations necessary for research","DASNY","339097","0","2017-09-21T00:00:00.000","Architectural and construction administration services related to renovation of 3rd floor of Pearl B"
"Learner Centered Initiatives, Ltd.",,"Marianne Mueller","5165024231","5165024233","MBE,WBE","06/30/2024;06/30/2024","HISPANIC","825 East Gate Blvd, Suite 204","Suite 204","Garden City","NY","11530",,,,,,"http://www.lciltd.org","1995-06-26T00:00:00.000",,,"LCI is a small consulting firm founded in 1995 that fosters the development of deep, self-sustaining, learner-centered educational environments through our professional development programs, products and services for schools, districts and educational organizationss. LCI's ultimate goal is to engage its clients in learning to develop and sustain their organizational capacity.",,,"NYC DOE","617614","100","2017-11-01T00:00:00.000","Facilitation of focus group, MPPRE-focused school visits, city-wide introduction to the MPPR and sup","Southampton Public Schools","50000","100","2019-04-01T00:00:00.000","Participants will develop a deeper understanding of quality curriculum.","NYC DOE - JHS 88","23750","100","2019-02-01T00:00:00.000","Teachers will deepen their understanding and use of instructional practices that promote civic engag","Putnam Northern Westchester BOCES","70600","100","2019-01-01T00:00:00.000","LCI Consultant will co-facilitate blended professional learning for 11 consortium districts. In phas"
"Zire Photography & Graphics","Tyrone Z. McCants","Tyrone McCants","3473427265",,"MBE","11/30/2026","BLACK","744 Walton Avenue","Apt B","St. Louis","MO","63108",,,,,,"http://www.zirephotography.com","2009-02-11T00:00:00.000",,,"Zire Photography & Graphics (ZirePhotos) is a photography and video company which provides portrait and headshot photography services for individuals and groups. The company offers traditional portrait photography and cultural themed portrait photography sessions for families, couples, children, newborns and groups. Zire has a variety of framing options including canvas, metal, wood, acrylic, gallery standouts and digital frames for homes, living spaces and offices. ZirePhotos also offers creative digital multimedia solutions for businesses and professionals and is available for studio and location photography projects, campaigns, headshots and portraits.",,,"Gateway Arch Park Foundation","871","100","2021-07-29T00:00:00.000","Photographically documented the Blues At The Arch concert series. Provided a customized viewing gall",,,,,,,,,,,,,,,
"ZKW Management & Construction Inc.",,"Zeel Whint","6469059697",,"MBE","04/30/2027","BLACK","332 Hendrix  St",,"Brooklyn","NY","11207",,,,,,,,,,"ZKW Management & Construction Inc. is a company that is created and operating to conduct a wide variety of residential and commercial buildings, developments, housing and other types of construction projects.",,,"AVIS WHINT","45500","100","2021-09-18T00:00:00.000","renovated the first-floor apartment, framing, sheetrock, taping, finishing details, installed cabine","cassandra darlington","1200","100","2021-04-27T00:00:00.000","celling demolition, replaced sheetrock in celling, replaced tiles in flooring, painted and taped.","AVIS WHINT","32500","100","2021-09-29T00:00:00.000","installed kitchen cabinets, countertops, kitchen sink and faucets.",,,,,
"HNS Enterprise, Inc.",,"SHARON SOLTAU","7187120382","7187238766","MBE,WBE","02/27/2023;02/27/2023","BLACK","139-39 228 Street",,"Laurelton","NY","11413",,,,,,,"2000-01-15T00:00:00.000",,"Teamsters 282","Trucking & disposal.",,,"Primer Construction Corp.","1000000","100","2017-12-18T00:00:00.000","Trucking and Disposal.","EIC Associates","911000","100","2015-12-01T00:00:00.000","Trucking and Disposal.","EIC Associates","510000","100","2012-12-01T00:00:00.000","NYCTA Arthur Kill Road Staten Island, NY",,,,,
"Marovato Industries, Inc.",,"RoseMarie Rotondi","7183890800","7183890258","WBE",,"NON-MINORITY","108 Dobbin Street",,"Brooklyn","NY","11222",,,,,,"http://www.marovato.com","1994-05-04T00:00:00.000",,"Steamfitters 638","Marovato Industries, Inc. provides pipe support and steel fabrication for mechanical and plumbing contractors of New York and surrounding areas.",,,"Durr Mechanical","5000000","100","2016-02-01T00:00:00.000","Pipe Support and Misc. steel.","CRYSTAL COMFORT","14680","100","2021-07-27T00:00:00.000","SUPPLEMENTAL STEEL","FRESH MEADOW","44055","100","2021-04-30T00:00:00.000","PIPE SUPPORT","BINSKY & SNYDER","165700","100","2021-04-26T00:00:00.000","PIPE SUPPORT & SUPPLEMENTAL STEEL FABRICATION"
"Goldenberg Technologies Inc.","Drensys","Maria Peysakh","7189757590",,"WBE",,"NON-MINORITY","4050 Nostrand Ave","Unit M3","Brooklyn","NY","11235",,,,,,"http://www.drensys.com","2011-06-15T00:00:00.000",,,"Goldenberg Technologies Inc (DBA Drensys) is an enterprise-grade MSP for IT services, as well as Technology Integrators, and Low Voltage Installers. We provide custom CCTV solutions, Office Buildouts, Comprehensive Site Surveys, and more.",,,"Big Apple Institute","28635","50","2018-01-01T00:00:00.000","Installation of speakers within the premises at location. Installation is performed in 5 stages Stag",,,,,,,,,,,,,,,
"Nancy Schick","The Law Studio of Nance L. Schick","Nancy Schick","2128047041","2128047108","WBE",,"NON-MINORITY","301 East 46th Street","Suite 20G","New York","NY","10017",,,,,,"http://www.nschicklaw.com","2003-06-23T00:00:00.000",,,"Integrative law firm focused on keeping parties out of court and building their conflict resolution skills. Services include conflict resolution (e.g., negotiation, mediation, arbitration, litigation), consultation, and education in business and employment. Disputes commonly resolved include worker misclassification, sexual harassment, and discrimination. Also frequently teach continuing education courses on these topics to funeral, human resources, and legal professionals.",,,"Confidential Building Materials Manufacturer","23898","95","2004-06-01T00:00:00.000","Litigation project management. Fraud investigations. Depositions. Trials. Hearings. Subpoenas and su","Confidential Retail Business","3000","100","2018-11-15T00:00:00.000","Revise employee handbook, job descriptions, and operations manual. Advise on employee termination, t","Confidential Entertainment Company","1040","100","2018-07-27T00:00:00.000","Review payments to independent contractors. Organize documents for auditor. Attend audit. Educate cl","Confidential Funeral Services Corporation","15210","95","2004-06-01T00:00:00.000","Litigation project management. Fraud investigations. Depositions. Trials. Hearings. Subpoenas and su"
"Scape Landscape Architecture, D.P.C.",,"Katherine Orff","2124622628","2124624164","WBE",,"NON-MINORITY","277 Broadway","9th Floor","New York","NY","10007",,,,,,"http://www.scapestudio.com","2007-01-01T00:00:00.000",,,"Scape Landscape Architecture does landscape architecture and urban design. The company specializes in regenerative living infrastructure and public landscapes, including research and built works at all scales from urban pocket parks to regional ecological plans.",,,"Hudson Highlands Fjord Trail, Inc","797292","80","2019-12-15T00:00:00.000","Provided conceptual design, design development and construction administration services.","NYC Department of Design and Construction","89018.4","85","2019-11-19T00:00:00.000","Provided design services.","Marble Fairbanks Architecture","110000","100","2019-09-30T00:00:00.000","Provided design and construction administration services.",,,,,
"Piramide Guia Para Padres",,"Juana Diaz","9174979497","7184294245","MBE,WBE","04/30/2027;04/30/2027","HISPANIC","21-05 30 Drive","Apt 4A","Astoria","NY","11102",,,,,,"http://www.guiaparapadres.com","2012-02-02T00:00:00.000",,,"The program comes as a necessity on facing the factors of violence in the education of children and focuses on Spanish speaking parents. We promote respect, value, a warm approach and a non - violent & communication between parents & children.",,,"High schools For Media and Communication","10000","100","2021-02-27T00:00:00.000","Teach Hispanic Parents to resolved situations in wich parents and children behave inappropiately cau","Higth Schools Gregorio Luperon","1000","1","2019-04-10T00:00:00.000","Speech and dinamic over the Communication.","Rodolfo Flores","150","100","2016-11-01T00:00:00.000","Family Seminar","Bodolfo Flores","150","100","2016-10-01T00:00:00.000","Family Seminar"
"Green Guru Network",,"Lea Boyer","8453378070","8664001250","WBE",,"NON-MINORITY","97 Katterskill Avenue",,"Palenville","NY","12463",,,,,,"http://www.greengurunetwork.com","2009-06-19T00:00:00.000",,,"Advertising and Related Services  Event Planning  Event planning for people with disabilities  Artist Management  Hospitality Marketing and Planning",,,"Jeffrey P Boyer","2000","100","2021-10-01T00:00:00.000","Created Marketing materials, reached out to clients, virtual conferencing services","Jeff Boyer","1500","100","2020-02-01T00:00:00.000","Traveled to meet clients for customer.","Jeff Boyer","1500","100","2020-01-01T00:00:00.000","Phone, email, meet in person with clients for the customer. Create Marketing material, build social",,,,,
"Soho 54 LLC","Hampton Inn Manhattan Soho","Raymond Lam","2122266288",,"MBE","04/30/2027","ASIAN","54 Watts Street",,"New York","NY","10013",,,,,,"https://www.soho54hotel.com/","2005-04-29T00:00:00.000",,"New York Hotel and Motel Trades Council, AFL-CIO 6","Soho 54 is a 160 room hotel located in Soho New York City.  It has a boardroom and fitness center and is convenient to Chinatown, Tribeca, Little Italy and NYU.",,,"Hotel Engine","507514","100","2020-05-19T00:00:00.000","Provide Hotel Rooms During Covid",,,,,,,,,,,,,,,
"Rizwan Abdus Salam PE Consulting Engineer PC",,"Rizwan Salam","2123772456",,"MBE","12/31/2023","ASIAN","20 East 49th Street","Suite 3E","New York","NY","10017",,,,,,"http://www.salamcons.com",,,,"RAS P.E. Consulting Engineers, is one of the leading Structural Designing firms in New York City, located in mid town Manhattan near Rockefeller Center. We offer complete structural analysis and design, drafting, shop drawing review and field inspection of buildings. Design services include design of concrete, steel and wood framed buildings, development of construction details, which are practical and cost effective, layout of plans and typical details.",,,"3502 PARTNERS LLC.","36000","50","2020-05-08T00:00:00.000","PE present at site services & prepare partial structural shoring plans.","Denton Stoneworks, Inc.","12000","60","2020-03-11T00:00:00.000","Structural design services of the 6 story building and design foundation and super structure for con","New York Builders","27000","100","2019-05-15T00:00:00.000","Structural design services (new architect) and prepare temporary shoring and demolition plans for th",,,,,
"JFK Office Supermarket Inc.",,"Tami Rosenstein","7189785400",,"WBE",,"NON-MINORITY","15808 Rockaway Blvd",,"Jamaica","NY","11434",,,,,,"http://www.jfkforms.com",,,,"Office Furniture, Lockers, Drafting Tables and Plan Holders and Files, Office Supplies, Printing, Forms, Labels, Breakroom Supplies, PPE, I.D. Tags, School Furniture, School Supplies, Janitorial Supplies, Advertising Specialties, Specializing in Transportation and Airline Industry, Cargo Compliance Document, Uniforms (imprinted), Signage, Display Booths, Auidio/Visual, Crowd Control Equipment, Social Distancing Signs.",,,"Skanska","29963","100","2019-12-17T00:00:00.000","Office Furniture",,,,,,,,,,,,,,,
"Baly Cleaning Services, Inc.",,"Nade Coulibaly-Doucoure","3479723109",,"MBE,WBE","11/29/2022;11/29/2022","BLACK","2080 Lafontaine Ave","Apt 2C","Bronx","NY","10457",,,,,,"http://www.balycleaningservices.com","2014-07-11T00:00:00.000",,,"Baly Cleaning Services, Inc. (BCS) is a NYC, NYS and NJ certified Minority and Woman-Owned business specializing in commercial cleaning services. We provide professional cleaning services to offices, governmental agencies, healthcare facilities, day care centers and financial institutions in an environmentally sound and professional manner.  Our team provides the following services: - General Office Cleaning and Janitorial Maintenance - Post-Construction / Post-Remodel Cleaning -  Floor Services (buffing, stripping, waxing) - Disinfecting Cleaning - Carpet Cleaning - Move-In/Move-Out",,,"YWCA BROOKLYN","150000","100","2018-06-01T00:00:00.000","PROVIDE CLEANING SERVICE EVERY DAY INCLUDING 24 HOUR CLEANING SERVICES DURING WEEKENDS","That's Nice, LLC","10000","100","2021-01-01T00:00:00.000","Provide daily cleaning to the 7,000 sq. ft. office, dust, clean bathrooms, kitchen, desks, remove ga","IncludeNYC","9825","100","2020-02-28T00:00:00.000","Provide daily cleaning to the office, clean bathrooms, kitchen, sweep, mop floor.",,,,,
"Ann Street Hotel LLC","Aloft Manhattan Downtown - Financial District","Teresa Lam","2125130003",,"MBE","11/30/2026","ASIAN","49 Ann Street",,"New York","NY","10038",,,,,,"https://www.marriott.com/hotels/travel/nycal-aloft-manhattan-downtown-financial-district/","2008-05-30T00:00:00.000",,,"Ann Street Hotel is a 128 room hotel located in the Financial District NYC.  The hotel is the 2 blocks to Pace University and also New York Presbyterian Hospital- Downtown.",,,"Hotel Engine","785400","100","2020-04-24T00:00:00.000","Provide hotel rooms during Covid",,,,,,,,,,,,,,,
