"vendor_formal_name","vendor_dba","contact_name","telephone","fax","certification","cert_renewal_date","ethnicity","address1","address2","city","state","zip","mailingaddress1","mailingaddress2","mailingcity","mailingstate","mailingzip","website","date_of_establishment","aggregate_bonding_limit","signatory_to_union_contracts","business_description","goods_materials_suplier","types_of_construction_projects","job_exp1_name_of_client","job_exp1_value_of_contract","job_exp1_percent_self_performed","dateofjob1","experience1","job_exp2_name_of_client","job_exp2_value_of_contract","job_exp2_percent_self_performed","dateofjob2","experience2","job_exp3_name_of_client","job_exp3_value_of_contract","job_exp3_percent_self_performed","dateofjob3","experience3","job_exp4_name_of_client","job_exp4_value_of_contract","job_exp4_percent_self_performed","dateofjob4","experience4"
"A C Security Management","A C Security Management","Alex Casilla","9173250165","3479343495","MBE","12/31/2024","HISPANIC","396-B  Lake Avenue",,"Staten Island","NY","10303",,,,,,,"2003-05-16T00:00:00.000",,,"Installation of security systems. CCTV systems, intrusion systems and card access systems.",,,"NYC DHS","50000","100","2012-10-01T00:00:00.000","Replace security DVR's, repair bad wire connections, replace monitors, program system and instructio","NYC DOHMH","6975","100","2019-11-19T00:00:00.000","Add/upgrade panic-intrusion security system. Provided and installed additional panic buttons Wired a","Tech Services","40000","100","2013-09-01T00:00:00.000","Install 16 camera CCTV systems in Elizabeth NJ, rewire 12 camera CCTV systems at Benjamin Moore Plan","Interface Security LLC","35000","100","2013-08-01T00:00:00.000","Perform repair service on security systems and provide installation of security devices."
"Q-Tech Innovative Solutions Inc.",,"Emmanuel Haynes","7182190717",,"MBE","12/31/2026","BLACK","153-11 123rd ave.",,"Jamaica","NY","11434",,,,,,"http://www.qtisnyc.com","2018-01-16T00:00:00.000",,,"QTIS provides technology repair, maintenance, installation and upgrade services to residential and commercial customers. We service computers, networks, televisions, home automation, security cameras, pos systems, audio video, and many more.",,,"David Greenberg","13000","100","2021-01-04T00:00:00.000","Installed cat 6 cables throughout home Installed and patched patch panels test and certify cables in","WS CONSTRUCTION INC","9000","100","2021-02-11T00:00:00.000","Upgraded operating systems of workstations Custom built computers Custom built servers Install and c","Monoprice","7499","100","2020-12-28T00:00:00.000","Removed existing cat 6 cabling and install new cables.  Patch holes and paint walls Clean up and dis",,,,,
"TNT Consulting Associates LLC",,"Asha Vardarajan","6465259671",,"MBE,WBE","12/31/2025;12/31/2025","ASIAN","14 Wall St","Suite 2006","New York","NY","10005",,,,,,,,,,"Hi, I am Asha Vardarajan! TNT Consulting Associates is my private practice where I head to twice a week on Tuesdays and Thursdays. I treat patients with mental health.",,,"SEIU","2300","100","2013-11-22T00:00:00.000","Psychotherapy counseling sessions","Cigna","700","100","2019-05-13T00:00:00.000","Psychotherapy counseling sessions",,,,,,,,,,
"Hudson Machinery, LLC",,"Donna LaPoma","8459201776",,"WBE",,"NON-MINORITY","2 Brook Street",,"Wanaque","NJ","07420",,,,,,"http://hudsonmachineryllc.net","2011-08-11T00:00:00.000",,"IUOE 15, IUOE 825","Sales, Parts, service and Rentals of municipal and construction equipment.",,,"JCMUA","140000","100","2018-08-01T00:00:00.000","Repair and Parts of Fleet owned vacuum trucks.",,,,,,,,,,,,,,,
"Labor Management Concepts, Inc.","LMC Security","Denise Munro","2019552804","2019977871","WBE",,"NON-MINORITY","7 West 36th Street","6th Floor","New York","NY","10018",,,,,,"http://www.lmcsecurity.com","1989-10-23T00:00:00.000",,,"LMC Security provides professional, cost-effective security services that combine efficient, responsive security and access control with a level customer service that enhances our client's facility. Services include: guard services, access control, investigations, special operations/events.",,,"DVL Kearny Holdings","100",,"2014-08-01T00:00:00.000","Supply Security","Tishman JTS","100",,"2016-09-01T00:00:00.000","Supply Security","Vaughn College","100",,"2015-08-01T00:00:00.000","Supply Security","Tutor Perini","100",,"2013-12-01T00:00:00.000","Supply Security"
"Deborah Bradley Construction & Management Svc. Inc","DBC Electrical Contracting","Deborah Bradley","2122222494","2122225887","WBE",,"NON-MINORITY","481 Manhattan Avenue",,"New York","NY","10027",,,,,,"http://www.dbcnewyork.com","1994-03-01T00:00:00.000","50000000","Laborers, pavers, carpenters, tapers, tile setters, bricklayers, electricians 1010,731, 2287, 1974,","DBC is a full-service General Contractor, Electrical Contractor, and Construction Management Consultant to city and state agencies, utilities, and trusts throughout New York and the Tri-State area. We specialize in site/civil construction and electrical power and communications work on small and medium-sized infrastructure projects, new construction, and modifications of existing facilities and structures. DBC is a 100% certified WBE contractor with NYC SBS, NYS ESD, and WBENC and DBE certified with the PANYNJ. DBC is a DOB Licensed Electrical contractor with the city of NY.",,,"Hudson River Park Trust","6000000",,"2017-06-01T00:00:00.000","New Esplanade construction","NYC Transit Authority","5300000","100","2020-12-31T00:00:00.000","Complete Electrical Package: all electrical conduit and wiring, lighting, and communications work in","PANYNJ","2542675","90","2020-12-31T00:00:00.000","New switchgear & Temp Generator, new steel platform, 5Kv cable installation","NYC DDC/Aecom","3121595","90","2020-08-23T00:00:00.000","FEMA COVID Testing Facilities: Highbridge Recreation Center, 2801 Amsterdam Ave, NYC Electrical inst"
"Cahill Consultants, Inc.",,"Katherine A. Cahill","6317274963",,"WBE",,"NON-MINORITY","500 Portion Road","Suite 14","Lake Ronkonkoma","NY","11779",,,,,,"https://cahillconsultants.com","2011-10-04T00:00:00.000",,,"Cahill Consultants is a regulatory compliance and product safety firm which specializes in assisting organizations to put safe products into the stream of commerce. Specifically, the firm helps companies to conform to CPSC, FDA, USDA and FCC regulations so that their products do not have to be taken out of the stream of commerce because of a product recall.",,,"Chubb Agribusiness","24000","100","2021-06-01T00:00:00.000","Provided services for 1-800 hotline and product recall deployment.",,,,,,,,,,,,,,,
"Mind Body Hair, LLC",,"Ebony Hayes","7183241037",,"MBE,WBE","08/31/2022;08/31/2022","BLACK","3246 White Plains Road",,"Bronx","NY","10467",,,,,,"http://www.mindbodyhair.com","1999-09-09T00:00:00.000",,,"Mind body hair.",,,"Client","120","100","2018-01-25T00:00:00.000","Regular client who comes every 2-4 weeks","Client","120","100","2018-01-25T00:00:00.000","Regular client who comes every 4 weeks","Client","80","100","2018-01-25T00:00:00.000","Regular client who comes every 4 weeks",,,,,
"MAHI PAINTING INC",,"JOHNNY LEE","9172250888",,"MBE","08/31/2025","ASIAN","121-02-95 Avenue",,"Richmond Hill","NY","11419",,,,,,,"2001-08-08T00:00:00.000",,,"THE BUSINESS IS FOCUS ON RESIDENTIAL AND HOUSING PAINTING WORK.",,,"NYCHA","3464893","100","2018-08-16T00:00:00.000","PLASTER RESTORATION","NYCHA","912800","100","2017-10-31T00:00:00.000","GENERAL CARPENTRY WORK",,,,,,,,,,
"Studio H Architecture Planning Environments D.P.C.",,"Mark Hill","2123139551",,"MBE","12/31/2026","BLACK","531 Montgomery St",,"Brooklyn","NY","11225",,,,,,"http://www.studioHshape.com",,,,"SHAPE – an acronym for Studio H Architecture Planning Environments, is a Design firm offering architectural, interior design, master planning and urban design services.",,,"CMC Development Group","24818","75","2020-07-15T00:00:00.000","Conceptual Architectural Design","571 Quincy Realty LLC","15000","75","2021-10-01T00:00:00.000","Architectural Design, Construction document and Construction Administration Services",,,,,,,,,,
"Select Solutions LLC",,"Joan Hughes","6315533382","5165865434","WBE",,"NON-MINORITY","14 Commerce Dr.",,"Farmingdale","NY","11735",,,,,,,"2008-12-30T00:00:00.000",,,"Manufacturer and distributor of industrial soaps/cleaning agents",,,"ConEdison","1000000","100","2019-06-01T00:00:00.000","Manufacture and supply SELECT LEAD ABATE, which is a lead stabilization product directly to Con Ed.","MTA- NYC Bus","110000","100","2017-11-01T00:00:00.000","Fill orders through 3rd party vendor for aerosol cleaner for NYC buses","LIRR","150000","100","2015-09-20T00:00:00.000","manufacture and deliver exterior cleaner for LIRR trains",,,,,
"Lee & Low Books Inc.","Bebop Books","Thomas Low","2127994400","2126831894","MBE","12/31/2022","ASIAN","95 Madison Avenue","Suite 1205","New York","NY","10016",,,,,,"http://www.leeandlow.com","1991-01-04T00:00:00.000","4000000",,"Lee & Low Books, Inc publishes high quality, multicultural children's books. Our books are distributed in schools and libraries.",,,,,,,,,,,,,,,,,,,,,,
"Clarion Research Inc.",,"Larry Traiger","2126641100",,"WBE",,"NON-MINORITY","1776 Broadway","Suite 1410","New York","NY","10019",,,,,,"http://www.clarionresearch.com","1995-12-01T00:00:00.000",,,"Clarion Research is a full-service custom marketing research firm offering a wide range of qualitative and quantitative consumer insights solutions. We help our clients design, build and deliver high quality, high value, and actionable marketing insights, using proven methodologies and innovative techniques. Clarion provides a consultant-like approach to market research, ensuring clients receive actionable insights. We pride ourselves on our ability to integrate qualitative and quantitative studies to translate learnings into a seamless story.  Clarion specializes in focus groups and online surveys, and offers our clients a full suite of custom research solutions.",,,"NJTransit","498478.89","44","2014-10-28T00:00:00.000","O&D census-based study on the following lines inbound to NYC: Northeast Corridor (NEC) and North Je","Avaya","79200","95","2015-03-17T00:00:00.000","Quantitative pre-post Telephone & Online survey among business communication solution decision maker","Wolf Doyal Advertising","47685","87","2014-10-10T00:00:00.000","Qualitative Focus Group & Street Session Research for YMCA Of Greater New York; Video Reel Compilati","NBC Universal","456400","95","2014-10-08T00:00:00.000","70 lengthy in-depth interviews with B2B target respondents plus an online survey of 200 additional B"
"PSA Constructors, Inc.","PSA Management Inc","Vanessa Martinez","4078989119",,"MBE","04/30/2027","BLACK","1516 E. Hillcrest St.","Ste. 310","Orlando","FL","32803",,,,,,"http://www.psaonline.com","1994-04-18T00:00:00.000",,,"Construction Management, Project Management, Program Management, Owners Authorized Rep., Building Inspections, Document Control, Estimating, QA/QC, Water Management",,,"Salt Lake City International Airport","3600000000","100","2013-07-24T00:00:00.000","Program management staff augmentation support services.","Greater Orlando Aviation Authority","1000000000","100","2017-04-25T00:00:00.000","Professional services for continuing program and project management services.","Dallas/Fort Worth Intl Airport","300000000","100","2013-04-01T00:00:00.000","Program Management",,,,,
"SCE Consulting Inc.","Elite Steel","Lucky Damiao","7185029461",,"MBE","04/30/2027","ASIAN","2165 Fifth Avenue",,"Ronkonkoma","NY","11779",,,,,,"http://www.elitesteel.com","2010-12-27T00:00:00.000",,,"SCE Consulting manufactures and installs structural and miscellaneous steel.",,,"Skyline Steel Corp","360500","100","2019-06-03T00:00:00.000","Manufactured and installed structural steel.","Feinstein Iron Works, INC","220766","100","2020-09-16T00:00:00.000","Structural Steel Fabrication",,,,,,,,,,
"Charter School Business Management Inc.","Foresight Financial Services for Good","Snehal Thakkar","6465843364","6465710628","MBE","11/30/2026","ASIAN","237 West 35th Street","Suite 301","New York","NY","10001",,,,,,"http://www.csbm.com","2006-03-28T00:00:00.000","250000",,"Charter School Business Management/FOREsight provides schools and nonprofits with bookkeeping, payroll, budgeting, financial reporting, forecasting and audit preparation services. Options range from us serving fully or partially as the outsourced accounting/finance team for schools/nonprofits to fulfill the responsibilities of a CFO, Controller and/or Accountant to professionally developing financial staff, boards and leaders to ensure responsible financial management.",,,"Democracy Prep Public Schools Inc.","1179588.05","100","2019-04-19T00:00:00.000","Financial services","Zeta Charter Schools Inc.","804814.62","100","2019-06-30T00:00:00.000","Financial Services","Peninsula Prepartory, Charter School","108500","100","2017-07-01T00:00:00.000","Serve as the school's Chief Financial Officer, Controller and Accountant by handling the responsibil","MESA Charter School","135000","100","2017-07-01T00:00:00.000","Serve as the school's Chief Financial Officer, Controller and Accountant by handling the responsibil"
"Twist Visuals Inc.","Bjorg Magnea Photography","Bjorg Magnea","2122555258","3473507197","WBE",,"NON-MINORITY","838 Park Place","#3E","Brooklyn","NY","11216",,,,,,"https://www.bjorgmagnea.com","1993-04-05T00:00:00.000",,,"Architectural and interior photography. Location photography. Construction photography. Landscape photography. Venue photography.",,,"JFK Airport","0","100","2018-01-01T00:00:00.000","Interior and Exterior photography","RFR Management","0","100","2018-01-01T00:00:00.000","Interior and Exterior photography","Westfield Shopping Centers","0","100","2018-01-01T00:00:00.000","Interior and Exterior photography",,,,,
"Diki's Daycare Center Inc",,"Lila Wong","7182781570",,"MBE,WBE","11/30/2025;11/30/2025","ASIAN","3081 Steinway street",,"Astoria","NY","11103",,,,,,"http://www.dikidaycaregroup.com",,,,"Diki Daycare Center is a DOHMH licensed childcare center,approved for 66 preschool children aged 2y to 5y. The center is also contracted by DOE to provide 3k & Pre-k program since 2020.",,,"DOE","456000","50","2009-07-01T00:00:00.000","UPK SERVICE TO 4 YEARS OLD FROM 2009-2012","Naom Llakmani","793.93","100","2020-09-14T00:00:00.000","Child care",,,,,,,,,,
"Mothers Purest Inc.","Comfort Circle MFT","Rosemary Powell","3478709039",,"MBE,WBE","04/30/2027;04/30/2027","BLACK","179-35 Eveleth road Jamaica",,"Jamaica","NY","11434",,,,,,,,,,"Mother’s Purest Inc. Has a DBA named Comfort Circle MFT (Marriage & Family Therapy) .  CCMFT is an ancillary service provided under the umbrella of the corporation. CCMFT provides  mental and behavioral health services to Individuals, couples and families.  CCMFT is a therapeutic space for people to work through their challenges in life. I am bound  by HIPAA and American Association of Marriage and Family Board confidentiality standards  and code of ethics. Which prohibits me from providing any information about my clients, their  diagnosis or any identifying information that may compromise the integrity of my work with  them.",,,"The summer Enrichment Camp","375","75","2020-06-13T00:00:00.000","Provided a camp course teaching organic gardening and aquaponics","Bethel Gospel Tabernacle","75","100","2019-07-25T00:00:00.000","Surveyed the space designated for the garden Took measurements of space Sourced Materials and tools","Fitness Chef Cherylles Mission","50","100","2019-07-04T00:00:00.000","Grow Microgreens  Harvested Microgreens Packaged Microgreens  Labled Microgreens Created Microgreens",,,,,
"Simplicity Consulting LLC",,"Leeza Singh","6467650288",,"MBE,WBE","12/31/2026;12/31/2026","BLACK","30206 Town Green Drive",,"Elmsford","NY","10523",,,,,,"https://www.therenaissancegroup.org/","2012-11-01T00:00:00.000",,,"The Renaissance group is a boutique consulting firm specializing in Business Intelligence & Operations, Information Technology solutions, Business Analysis, Project Management, Event Production, Branding and Marketing needs. Our services cater to your IT and Marketing needs and we are equipped to handle your most complex projects. Founded by business maverick Leeza Singh, the firm partners with soul-centered and progressive brands to help them meet their project goals with meticulous attention to detail, enterprising and cost-effective solutions on time and within budget.   The Renaissance group is made up of a small group of intelligent individuals and we continue to grow. Our group consists of developers, graphic designers, project managers, digital marketing manager, sales & business analysts, event producers, brand managers, and advertising specialists.",,,"Morgan Stanley","215000","100","2016-11-14T00:00:00.000","• Project manager for the data analytics initiatives for various business units • Developed reports","Charter Communications","150000","100","2020-02-24T00:00:00.000","• Lead and manage status meetings with cross functional teams and provide update to senior managemen","Construction 6","2500","100","2015-12-01T00:00:00.000","Website Development","Citi Abstract","8000","100","2015-02-01T00:00:00.000","Website Development and IT Management"
"Principle Project Management LLC",,"William Wong","3475288675",,"MBE","11/30/2022","ASIAN","144 President Street",,"Brooklyn","NY","11231",,,,,,"http://www.principleprojects.com","2015-06-01T00:00:00.000",,,"Principle Project Management LLC is an Owner's Representative, Project Management, and Cost Management firm. We manage the entire life cycle of commercial projects from real estate lease review, management of architectural and engineering consultants during design, to management of construction contractors for the build-out, to furniture selection, oversight of final move-in, and final close-out. We manage projects for corporate, media, technology, law firms, biotech, hospitality, educational, and retail clients. We represent tenants and landlords on projects.",,,"International Flavors & Fragrances Inc","900000","100","2016-08-01T00:00:00.000","Project Management","IDB Bank","500000","100","2019-06-03T00:00:00.000","Project Management & Cost Management","Verizon Media","450000","100","2017-05-22T00:00:00.000","Project Management",,,,,
"FNBC Corporation",,"Lethicia Matos","2127990628",,"MBE","10/31/2024","HISPANIC","215 west 90th street","APT 6F","New York","NY","10024",,,,,,"https://www.fnbccorp.com.br","1993-07-19T00:00:00.000",,,"With several important clients in New York City area, FNBC Corporation  Property Cleaning and Maintenance), is among the successful privately owned commercial cleaning company in New York. Since inception in 1993  we have grown a considerably large work force servicing many of New York as well known companies and Organizations. In every aspect of our business, we strive to earn and keep the trust our clients give us when they choose FNBC as their cleaning provider.",,,"Belmont Arthur","1200000","100","2016-01-01T00:00:00.000","1. Provide all janitorial and cleaning supplies for cleaning the property. (Major equipment Floor ma","DEP","95317","100","2020-07-26T00:00:00.000","cleaning / disinfection services for areas where people with COVID 19 have been in.","Social Service Local 371 Union Fund.","160000","100","2017-01-01T00:00:00.000","Office Cleaning services/Maintenance Repairs. Remove all dust from furniture,pictures frames,office","Walgreens","180000","100","2017-01-01T00:00:00.000","Building Maintenance and repairs as needed."
"4D Construction Inc.",,"Devanand Deonarine","5163030776",,"MBE","01/31/2027","BLACK","90-10 195th Street",,"Hollis","NY","11423",,,,,,,"2019-01-02T00:00:00.000",,"Pavers & Road Builders 1010, Construction & General Building Laborers 79, General Building Laborers","4D Construction is a construction subcontractor providing services in site-work, carpentry, concrete, masonry, fencing, and sidewalk removal and installation.",,,"Ininity Contracting Services Corp.","525000","100","2021-09-07T00:00:00.000","Site Work, Concrete, Masonry, Excavation","Motivate LLC","65000","100","2021-10-14T00:00:00.000","Site Work, Concrete, Fence Installation","Cepheus","75000","100","2020-11-01T00:00:00.000","Site Work, Concrete",,,,,
"Queen Geniuses, Inc.",,"Regine Roy","3475851580",,"MBE,WBE","05/31/2027;05/31/2027","BLACK","133 Cornelia Street","#3","Brooklyn","NY","11221",,,,,,"http://www.regineroy.com","2014-10-10T00:00:00.000",,,"Queen Geniuses, Inc. is committed to enriching strengthening, and supplementing the growth and development of young people, families and the professionals who serve them.",,,,,,,,,,,,,,,,,,,,,,
"Clifford Dias, P.E., P.C.",,"Cynthia Kim","2126084811","2122670622","MBE","09/30/2026","ASIAN","TWO WALL STREET","SUITE 520","New York","NY","10005",,,,,,"http://www.diaseng.com","1983-04-15T00:00:00.000",,,"Clifford Dias, PE, PC is a nationally recognized consulting engineering firm providing services consisting of design, evaluation, and analysis of new and existing buildings and interiors. Our core capabilities span the areas of mechanical, electrical, plumbing, fire protection, life safety, telecommunications and structured cabling, security, and audio/visual design.",,,"UBS Financial Services","300000",,"2015-06-01T00:00:00.000","MEP & FP Design & Consulting","American Express","150000","100","2016-05-01T00:00:00.000","MEP & FP Design & Consulting","American Express","150000",,"2016-05-01T00:00:00.000","MEP & FP Design & Consulting","Willis Towers Watson","100000","100","2016-04-01T00:00:00.000","MEP & FP Design & Consulting"
"RHYMAN CONSULTING, LLC",,"Rachel Hyman","6463543153",,"WBE",,"NON-MINORITY","34 Plaza Street E","#606","Brooklyn","NY","11238",,,,,,"http://www.rhymanconsulting.com","2014-06-01T00:00:00.000",,,"RHYMAN CONSULTING, LLC is a real estate advisory practice specializing in the financial structuring and execution of real estate projects, with a focus on the financing and development of affordable and supportive housing.  The firm assists clients in navigating the complex public and private approval processes needed to bring real estate development projects to fruition.",,,"Low Income Investment Fund","69500","100","2019-06-19T00:00:00.000","Assist LIIF with the tasks associated with originating permanent loans for sale to New York City Ret","Enterprise Community Loan Fund, Inc","27000","100","2019-11-07T00:00:00.000","RC will assist Enterprise with the tasks associated with the origination of CB Emmanuel’s CSH Cluste","RiseBoro Community Partnership","25000","100","2012-06-14T00:00:00.000","Assisting RiseBoro Community Partnership with the refinancing of a construction loan for an affordab",,,,,
"Pretty Brown Girl, LLC",,"Sheri Crawley","8005148559",,"MBE,WBE","02/28/2027;02/28/2027","BLACK","1350 Ave of the Americas, Fl 2 -1045",,"New York","NY","10019",,,,,,"http://www.prettybrowngirl.com","2010-09-28T00:00:00.000",,,"Pretty Brown Girl (PBG) is dedicated to educating and empowering Black and Brown girls by encouraging self-acceptance while cultivating social, emotional & intellectual well-being. Pretty Brown Girl partners with schools and educational institutions, organizations, and strategic allies to support the well-being of Black and Brown girls through our programs, events, and experiences. Listed by New York Magazine as a Community Organization to support Black Lives Matter initiatives and ranked by NBC News as one of the top seven organizations dedicated to empowering girls of color.   Our flagship program, The PBG Academy, is a revolutionary 15-week club model available for Elementary, Middle, and High School students.  PBG Academy is proven to increase a positive attitude toward self and others by cultivating mental well-being, academic achievement, character building, community advocacy, and leadership.",,,"Icahn Charter School 5","35994","100","2021-07-19T00:00:00.000","Build character and increase self-esteem while building sisterhood Improves mental health support am","Alexander Macomb Middle School 232","5999","100","2020-11-06T00:00:00.000","Build character and increase self-esteem while building sisterhood Improves mental health support am","NYC Community Schools District 10","24999","100","2020-01-08T00:00:00.000","Build character and increase self-esteem while building sisterhood Improves mental health support am",,,,,
"M & J Mechanical Corp.",,"Jill Strauss","2129899293","2126751782","WBE",,"NON-MINORITY","1123 Broadway","Suite 416","New York","NY","10010",,,,,,,"1988-08-01T00:00:00.000","3000000",,"Mechanical",,,"Caldwell & Walsh","2510000","90","2020-12-31T00:00:00.000","IVF CLinic Suite","RP Brennan","1791309","90","2020-12-31T00:00:00.000","Aquatics Lab","Oestricher","1357236","100","2020-08-01T00:00:00.000","Delor Milan Lab","Rockefeller University","2434660","100","2018-10-31T00:00:00.000","LARC 5 BSL3"
