"vendor_formal_name","vendor_dba","contact_name","telephone","fax","certification","cert_renewal_date","ethnicity","address1","address2","city","state","zip","mailingaddress1","mailingaddress2","mailingcity","mailingstate","mailingzip","website","date_of_establishment","aggregate_bonding_limit","signatory_to_union_contracts","business_description","goods_materials_suplier","types_of_construction_projects","job_exp1_name_of_client","job_exp1_value_of_contract","job_exp1_percent_self_performed","dateofjob1","experience1","job_exp2_name_of_client","job_exp2_value_of_contract","job_exp2_percent_self_performed","dateofjob2","experience2","job_exp3_name_of_client","job_exp3_value_of_contract","job_exp3_percent_self_performed","dateofjob3","experience3","job_exp4_name_of_client","job_exp4_value_of_contract","job_exp4_percent_self_performed","dateofjob4","experience4"
"HLewis Network Consulting Corporation","HLNCC","Heather Lewis","2125861598","8888656679","MBE,WBE","09/29/2023;09/29/2023","BLACK","169 Haviland Lane",,"White Plains","NY","10605",,,,,,"http://www.hlncc.com","2003-07-28T00:00:00.000",,,"Services-only practice of network and security consultants, providing expert-level niche professional services in routing, switching and network security, specializing in Cisco Systems, Juniper Networks, and Check Point Technologies.  Planning, design, implementation, optimization and support of enterprise network and security solutions.",,,"Corporate Computer Solutions","175000","100","2018-09-27T00:00:00.000","Network and security implementation and support services for various clients","Macmillian Publishers","175000","100","2018-09-28T00:00:00.000","Renewable, non-expiring block of hours to provide support and troubleshooting as needed","SUNY -  College of Optometry","6400","100","2018-09-27T00:00:00.000","Incident and maintenance support services to be performed by Specialist II",,,,,
"JCC Maintenance Supply LLC",,"Jennifer Chin","7187628288","7187623727","MBE,WBE","03/31/2025;03/31/2025","ASIAN","20-28 119th Street",,"College Point","NY","11356",,,,,,"http://www.jccsupplies.com","2008-07-31T00:00:00.000",,,"Full-line distributor of janitorial supplies and authorized lighting distributor.",,,"Collins BLDG Services Inc.","1699042","80","2021-01-01T00:00:00.000","Building maintenance supplies.","Silverstein Properties","404923","80","2021-12-31T00:00:00.000","Building maintenance supplies.","Alliance Building Services","51486","80","2021-12-31T00:00:00.000","Building maintenance supplies.",,,,,
"Prince Contracting & Development",,"Ahsan Iqbal","2127862922","2127863406","MBE","11/30/2026","ASIAN","3039 Wilson Avenue","Apt B1","Bronx","NY","10469",,,,,,,"2013-07-31T00:00:00.000",,,"Prince Contracting & Development does renovation, construction, roofing, waterproofing, restoration, masonry, building renovation and masonry restoration, stucco, pointing, concrete, cornices, garage deck, epoxy injection, power washing, brownstone work, balcony restoration, extension, demolition, joint replacement, carpentry, insulation, sheetrock, plastering, painting, windows, doors, hardwood flooring, tiles, skylights, residential construction, multifamily, general contractors home improvement (e.g., adding on, remodeling, renovating), remodeling and renovating general contractors, residential building construction, carpentry, flooring and painting.",,,"Tafara Sutherton","750000","100","2020-09-12T00:00:00.000","Restored the facade and provided roofing services.",,,,,,,,,,,,,,,
"Novaux, Inc",,"Luis Perez","9739433317",,"MBE","07/31/2024","HISPANIC","23 E 109 ST",,"New York","NY","10029",,,,,,"http://saborpos.com","2015-05-06T00:00:00.000",,,"Novaux, Inc is a NYC Headquartered Software development house with Hero products such as Sabor POS - a Point of Sale with Integrated Payment Processing for small businesses. Novaux, Inc also deals in Software development from Marketing Websites, E-Commerce and High Scale mobile applications with millions of users",,,"AWE INC","80000","70","2015-12-01T00:00:00.000","Built an E-Commerce platform for a affordable luxury jewelry brand. The software was built from the","Priori Legal","9000","100","2019-02-22T00:00:00.000","We work with Priori Legal on assisting with their development needs on their online web portal. We a","Croissant","21000","100","2018-11-22T00:00:00.000","We work with Croissant on building their mobile app on the Android and Apple Store. We built their s",,,,,
"Landmark Consulting LLC","Landmark Consulting of Louisiana LLC","Keely Thibodeaux","5045248880","5045248884","MBE,WBE","10/31/2022;10/31/2022","BLACK","525 St. Charles Ave. - Suite 330",,"New Orleans","LA","70130",,,,,,"https://www.landmarkconsultingllc.om",,,,"Landmark Consulting is an LLC offering comprehensive program and project management for disaster recovery, federal funding compliance and architectural services.",,,"City of Columbia","13000000","100","2016-01-02T00:00:00.000","Grant and program management","City of Atlanta","3000000","100","2021-11-01T00:00:00.000","Grants management, financial recovery, monitoring and compliance for COVID-19","Seaside Heights, New Jersey","738000","100","2012-10-01T00:00:00.000","Grant Management, Project Closeout","Xavier University","3054674","100","2012-08-01T00:00:00.000","Grants management, project management, project closeout"
"SDSH Group LLC",,"Stavan Shah","7324293357",,"MBE","11/30/2026","ASIAN","177 EDISON AVENUE",,"EDISON","NJ","08820",,,,,,,"2020-01-07T00:00:00.000",,,"General Construction Contracting Services within Tri-State Areas.",,,"Luis Contracting Corp.","31000","100","2021-07-07T00:00:00.000","Site cleanup","Tameer Inc.","28850","100","2021-08-06T00:00:00.000","Interior carpentry work  Site work and cleanup",,,,,,,,,,
"Signs and Safety Devices, LLC",,"Heather Altobelli","7323023001",,"WBE",,"NON-MINORITY","201 Wilton Ave",,"Middlesex","NJ","08845",,,,,,,"2007-05-18T00:00:00.000",,,"Manufacture of signs sold to the construction industry with a concentration in road construction.",,,"American Bridge","419048","100","2018-01-01T00:00:00.000","Lane Closure","J. Fletcher Creamer","253874","100","2018-01-01T00:00:00.000","Lane Closure","Ritacco Construction","231228","100","2018-01-01T00:00:00.000","Lane Closure",,,,,
"Project Job Inc.",,"Mariko Sakita","6462413116",,"MBE,WBE","04/30/2027;04/30/2027","ASIAN","285 Central Park West","#5S","New York","NY","10024",,,,,,"http://www.projectjob.org","2015-04-17T00:00:00.000",,,"Project Job promotes workforce diversity and inclusive employment, by providing consultancy services to employers looking to hire professionals and interns with disabilities, and connecting qualified candidates with disabilities to job and internship opportunities..",,,"ACCES-VR","94761","100","2019-01-01T00:00:00.000","Adult Career & Continuing Education Services - Vocational Rehabilitation (ACCES-VR) awarded Project","Aaron School High School","1100","100","2018-10-11T00:00:00.000","Series of three workshops for parents of children with disabilites. Topics include: educational opti",,,,,,,,,,
"T. Eason Land Surveyor",,"Treimane Eason","6314742200","6318999085","MBE","03/31/2026","BLACK","27 Poplar Street",,"Port Jefferson Station","NY","11776",,,,,,"http://www.teasonlandsurveyor.com","2001-07-01T00:00:00.000",,,"SURVEYOR 541370 - Surveying and Mapping (except Geophysical) Services, Cadastral surveying services, Mapping (except geophysical) services, Cartographic surveying services Topographic surveying services, Geodetic surveying services.",,,"Racanelli Construction","50000","100","2018-12-01T00:00:00.000","Construction layout","Minhas Construction","2100","100","2019-12-17T00:00:00.000","100","Commodore Construction","20000","100","2019-08-01T00:00:00.000","McCarron Pool - Brooklyn, NY","Bancker Construction","25000","100","2019-06-01T00:00:00.000","Construction layout for directional drill of sewer force main"
"Our Rental Pumps LLC",,"Samantha Ruttura","6314540022",,"WBE",,"NON-MINORITY","68 Allen Blvd.",,"Farmingdale","NY","11735",,,,,,"http://ourrentalpumps.com","2011-02-09T00:00:00.000",,,"Our Rental Pumps is a company which rents concrete pumps, telebelts, magni telescopic handlers and excavators; we are dealers for various concrete pump supplies and parts.",,,"Halmar","24925728","100","2019-04-17T00:00:00.000","Rented concrete pumps, telebelts and magni telescopic handlers.","EE Cruz","670000","100","2018-03-16T00:00:00.000","Rented concrete pumps, telebelts and magni telescopic handlers.","Railworks","411295","100","2017-07-20T00:00:00.000","Rented concrete pumps.",,,,,
"Chinatown Plumbing & Heating, Inc.",,"Jimmy Yu","2129669735","2122269571","MBE","02/29/2024","ASIAN","153 Centre Street","Suite 108","New York","NY","10013",,,,,,,"1989-09-29T00:00:00.000",,,"Installation, repair and maintenance of plumbing, heating and sprinkler systems.",,,"Great NY Noodletown Inc",,,"2011-06-01T00:00:00.000","Plumbing work in restaurant","New York City Housing Authority",,,"2012-10-01T00:00:00.000","Installation of a new domestic hot water heater at 572 Warren St Houses","New York City Division of School Facilities",,,"2011-12-01T00:00:00.000","Plumbing repair work in various NYC public schools",,,,,
"Careone Home Care Services, Inc.","CareOne Builders","Carol Dyer","3479012637","2126711890","MBE,WBE","11/30/2026;11/30/2026","BLACK","80 Broad Street","5th Floor","New York","NY","10004",,,,,,,"2006-10-06T00:00:00.000",,,"Careone Builders is a re-supplier company that sells commercial office equipment, security equipment, facilities and institutional equipment and supplies.",,,"ACS","100000","100","2021-08-23T00:00:00.000","Sold equipment to the New York City Administration for Children Services.",,,,,,,,,,,,,,,
"Pottsgrove Glass Co., Inc.",,"Dorenna McGonigal","6109061145","6107065418","WBE",,"NON-MINORITY","144 Shoemaker Rd",,"Pottstown","PA","19464",,,,,,,"2000-03-01T00:00:00.000","30000000","District Council 21 Glaziers 252, District Council 711 Glaziers 1009","Sales & Installation of commercial windows, curtain wall, storefront & doors.",,,"Terminal Construction","3295227.78","100","2017-08-01T00:00:00.000","Aluminum windows, curtain wall, storefront & doors","Brockwell & Carrington Contractors Inc","1475000","100","2017-11-01T00:00:00.000","Aluminum & Glazing - Curtain wall, storefront, doors & sunshades","Dobco, Inc.","2282773.63","100","2017-01-13T00:00:00.000","Glass & Glazing - Aluminum windows, doors, curtain wall","Dobco, Inc.","1329000","100","2016-09-01T00:00:00.000","Glass & Glazing - Aluinum windows, doors, curtain wall & sunshades"
"Reyno Car Service, Inc.",,"Fenix Martinez","2129236800","2129270252","MBE","05/31/2025","HISPANIC","199 Audubon Avenue",,"New York","NY","10033",,,,,,"http://www.reynocarservice.com","1987-03-19T00:00:00.000","5000",,"Livery car service specializing in non-emergency medical transportation for ambulatory individuals.",,,"1. NYS Department of Health, Office of Health Insurance Programs","10859296.6","100","2019-12-31T00:00:00.000","Livery Medical Transportation of members","3. Metroplus Health Plan","466145.69","100","2019-01-25T00:00:00.000","Medical Transportation of members","2. Medical Transportation Network","957096.68","100","2017-02-09T00:00:00.000","Medical Transportation of members",,,,,
"DigiDoc, Incorporated","Public Sector Solutions Group","Darryl Wiggins","2022991011","2022991014","MBE","10/31/2026","BLACK","510 Florida Ave NW",,"Washington","DC","20001",,,,,,"http://www.ps2g.us","2000-03-20T00:00:00.000",,,"Office equipment merchant wholesalers  ; Computer peripheral equipment merchant wholesalers ; Computer software, packaged, merchant wholesalers ; Surveying and mapping services (except geophysical); Custom Computer Programming Services",,,"Sagitec Solutions/DC Department of Employment Services","1795432","85","2018-01-01T00:00:00.000","Paid family leave system modification Business Analyst and build architecture","Department of Employment Services","365000","100","2021-06-20T00:00:00.000","Medical claim processing and overview","OSSE","900050","100","2020-01-28T00:00:00.000","Provide nurses to student for bus transfer",,,,,
"Solutionze, LLC",,"Mohit Dhir","9179431834",,"MBE","02/28/2025","ASIAN","41-17 Crescent St","#3F","New York","NY","11101",,,,,,"http://www.solutionze.com","2019-01-07T00:00:00.000",,,"Solutionze work in different areas such as:  Staffing and Recruitment: We provide resources on temporary and permanent basis to our clients for their short and long term needs.  Digital Marketing: We provide services in digital marketing like Search Engine Optimization, Analytics and PPC(Pay per click).   Software and Web Development: We do software and web development for our clients based on Agile, Scrum, Waterfall, etc methodologies and using JIRA and TFS as the management tools.  Mobile Development: We have a dedicated team that does mobile application development on Android, IOS and Hybrid platforms.",,,"UNFPA","14500","70","2020-03-15T00:00:00.000","Flashdrive  and uploading UNFPA material for 9 different countries","Rob Greener","5500","100","2019-08-15T00:00:00.000","Initial Design and architecture for the Mobile app","UNFPA","9800","70","2020-09-15T00:00:00.000","Flashdrive logistics and uploading of the UNFPA material",,,,,
"Charles-Williams Construction Corp.",,"Gizelle Williams","3479394294","3474022111","MBE,WBE","03/31/2025;03/31/2025","BLACK","450 East 28th Street",,"Brooklyn","NY","11226",,,,,,"http://www.charles-williams.com","2013-03-18T00:00:00.000",,,"Charles-Williams Construction is a family owned and operated MWBE business. We provide general construction services, for commercial and residential clients. At Charles-Williams you get a specialized team of experts that deliver on quality, safety, cost control and monitoring procedures with exceptional customer service. When working with Charles-Williams Construction, you can expect us to care about your project from start to finish. We understand every client and project is unique, so choose us to bring your vision to life.",,,"One Brooklyn Health System (OBHS)","180000","80","2018-11-28T00:00:00.000","Demo, carpentry, HVAC, Electrical, Masonry, Acoustical ceiling, Drywall, Painting, Flooring, Door an","One Brooklyn Health System(OBHS)","85200","80","2020-07-13T00:00:00.000","Demo, acoustical ceiling, painting, millwork, Flooring, electrical, HVAC","T. White","14723","100","2019-10-15T00:00:00.000","Carpentry, roofing, finishes, painting","Rebuilding NY","19637","100","2019-02-12T00:00:00.000","Interior renovating, paint, window replacement"
"Bobtek Electrical Corporation",,"Joanne Bobb","7187632563","7182410729","MBE","04/30/2027","BLACK","934 East 51 Street",,"Brooklyn","NY","11203",,,,,,"http://www.bobtekelectrical.com","2000-01-27T00:00:00.000","500000","Electric IBEW 3","Electrical contracting firm, installation and maintenance of all phases of electrical. Control wiring, installation, firealarm, CCTV and data cabling wiring.",,,"CJ Plumbing & Heating","75600","100","2019-11-19T00:00:00.000","Removal and Restoration of Natural Gas Piping","Klairgar, Inc","6250","100","2022-02-23T00:00:00.000","Run circuitry in various locations at 21 St. Paul's Place, Mount Vernon NY 10550. The technicians in","Salvation Army Bronx Tremont Corps","18445","90","2021-07-02T00:00:00.000","We preform maintenance, repair, and monitoring for the Alarm System.","The Ryan Health Center 97th Street","10500","100","2021-01-22T00:00:00.000","Remove and Replace Electrical Lighting Fixtures throughout the facility."
"Talson Solutions, LLC",,"Jeff Simpson","2155929634","2155929636","MBE","12/31/2025","BLACK","41 North 3rd Street",,"Philadelphia","PA","19106",,,,,,,"2001-05-18T00:00:00.000",,,"Talson Solutions does professional services consulting, project management, project management oversite, QA/QC audits, construction contract audit and diversity monitoring.",,,"Boston Properties","1447825","100","2020-12-31T00:00:00.000","Provided capital project consulting and construction audit services.",,,,,,,,,,,,,,,
"Classic Man LLC",,"Isiah Michael","6464845416","6462193001","MBE,WBE","10/30/2023;10/30/2023","BLACK","443 E 9th St",,"New York","NY","10009",,,,,,"http://classicmanbarbers.nyc/","2017-06-30T00:00:00.000",,,"Classic Man Barber Lounge is a premium barber shop that offers New York¿s professional and progressive gentlemen a haven to feel simultaneously confident in the grooming services and comfortable from the therapeutic atmosphere.  Along the same point, Classic Man Barber Lounge will operate as an environment that is designed to make the barber¿s responsibilities focus on providing the best services to each client.",,,"Lululemon","300","100","2018-06-10T00:00:00.000","Provide a series on hair and body grooming; offered various hair grooming services and upkeeps","Work House","300","100","2018-06-17T00:00:00.000","Provide a series on hair and body grooming; offered various hair grooming services and upkeeps and s","TechSpace","300","100","2018-02-15T00:00:00.000","Provide a series on hair and body grooming; offered various hair grooming services and upkeeps",,,,,
"Top Link Contracting, LLC",,"Kathleen Lynch","9146640303",,"WBE",,"NON-MINORITY","36 Seabury Street",,"Newark","NJ","07104",,,,,,,"2014-07-22T00:00:00.000",,,"Detail drawings, fabricate and installation of millwork and steel",,,"Folor","1350000","100","2014-08-01T00:00:00.000","Furnish and Installation of Misc. Metal.","Glenwood","312000","100","2015-09-01T00:00:00.000","Furnish and Delivery of 360 Vanities and 52 Kitchens.","Empire","750000","100","2015-04-01T00:00:00.000","Furnish and Installation of Misc. & Structural Steel","Steiner","370000","100","2014-08-01T00:00:00.000","Furnish and Installation of Millwork"
"Uma Group LLC",,"Rita Kakati-Shah","2122033379",,"MBE,WBE","06/30/2024;06/30/2024","ASIAN","300 Park Ave","12th Floor","New York","NY","10022",,,,,,"https://www.beboldbeuma.com","2016-09-20T00:00:00.000",,,"Uma is a platform that works with companies to attract, retain and develop talent in the workplace via diversity, inclusion and retention strategies. We have successfully worked with many returning candidates and companies, structured return to work and buddy programs, curated numerous workshops as well as mentored and coached women and minorities looking to enter senior leadership positions.",,,"Turning Rock Partners","7312.5","100","2017-05-12T00:00:00.000","trained candidate returning to work through confidence, resume and interview skills.","Georgia Louise Inc","365.5","100","2019-04-20T00:00:00.000","prepared candidate and management for return to work position","Doran Jones","3250","100","2017-03-19T00:00:00.000","trained candidate returning to work through confidence, resume and interview skills.",,,,,
"Comprehensive Consent, Inc.",,"Sarah Casper","2014076046",,"WBE",,"NON-MINORITY","304 Troutman Street","2R","Brooklyn","NY","11237",,,,,,"http://comprehensiveconsent.com","2020-07-06T00:00:00.000",,,"Comprehensive Consent, Inc. provides social-emotional consent education tools, resources and workshops to kids, teachers and parents.",,,"PTA of P.S. 10 Brooklyn","3600","100","2021-11-01T00:00:00.000","Delivered a 3 session workshop series to each of the five 5th grade classes.","Wardlaw + Hartridge School","1000","100","2021-10-13T00:00:00.000","Delivered a virtual 3-session series workshop to 8th grade students; delivered a workshop to their p","Arkansas Coalition Against Sexual Assault","200","100","2021-08-24T00:00:00.000","Delivered a 90-minute webinar on setting boundaries.",,,,,
"Allied Personnel Services, Inc.","Green Staff NY","Amparo Connors","7182617979",,"MBE,WBE","08/30/2022;08/30/2022","HISPANIC","118-21 Queens Blvd.","Suite 310","Forest Hills","NY","11375",,,,,,"http://alliedpersonnel.com","1998-12-07T00:00:00.000",,,"Allied Personnel Services is a boutique-staffing firm whose clients’ value personalized attention. Clients recognize us as as 'Talent Connectors and the President is a People Person'. Headquartered in Queens, we are a NY City and State certified 100% Minority (Hispanic) and Woman Owned Business Enterprise. The service we provide is people as staff; enthusiastic diverse talent, are available for long or short-term needs. Be they Temporary, Temp to Hire, or Direct Hire (Permanent) Personnel, we fill jobs primarily in Queens and Manhattan.  Some clients are in Brooklyn, the Bronx, Nassau and Westchester.  The President has over 34 years of staffing industry experience, and is a recognized active member of many business and community organizations.   Clients include RE Developers, Construction or Contracting, Financial Institutions, Consumer Products Manufacturers, Distributors and Services, Accounting, Legal, and other Professional services, and Government Agencies. Positions staffed range from Office Manager, Administrative, HR Personnel, Executive Assistants, Office Support, Clerical, Accounting, Bookkeeping, Marketing, WP/Data Entry, Receptionists, to Entry level/Clerical and are often Bilingual. Specialty recruiting for industry specific titles, such as RE Leasing Agent, or Section 8 Recertification Temps are fulfilled through tailored searches. Have had great success with temporary staffing with varied NY City agencies and are a current subcontractor for NY State/MTA bids. Allied Personnel offers customized staffing options including Payrolling services (clients find staff but we assume the employer liability). Placed personnel work on W-2s & are screened as employment eligible according to DHS/I-9 requirements. All candidates are skills tested, interviewed, and reference checked. Candidates receive resume help and career guidance at no cost as all fees are company paid.  Personal attention is the difference that allows Allied Personnel to 'Bridge Staffing Solutions with Unsurpassed Quality and Service'.",,,"DTG Consulting Solutions, Inc.","1338252","20","2019-07-01T00:00:00.000","IT Staff","InfoPeople Corp.","368364","20","2019-07-01T00:00:00.000","IT Staff","Stanton, Guzman & Miller","98257","100","2019-07-01T00:00:00.000","Office Admin tasks including phones, filing, scanning, emails, meet/ greet. Support attorneys.","NYC Dept. of Consumer Affairs","41688","100","2019-07-01T00:00:00.000","Office Clerical"
"Concepcion Consulting Group",,"Daisy Concepcion","7185304235",,"MBE,WBE","11/30/2026;11/30/2026","HISPANIC","3701 Henry Hudson Pkwy","4D","Bronx","NY","10463",,,,,,,"2019-08-16T00:00:00.000",,,"Concepcion Consulting Group is dedicated to the advancement of student learning and social emotional promotion in Pre-K to 12. The company provides schools with the tools to improve student achievement outcomes and to nurture emotionally resilient students who are career and college ready. It partners with schools and districts, to support school improvement through tailored work.",,,"The Balance Between","7000","100","2019-01-07T00:00:00.000","Reviewed data and performed professional development evaluations.","The Balance Between","1000","100","2020-02-10T00:00:00.000","Reviewed data with the teachers and provided professional development evaluations.",,,,,,,,,,
"Radiant Prep, LLC",,"Brice Messavussu","9295035398",,"MBE","11/30/2026","BLACK","42-20 Broadway",,"Long Island City","NY","11103",,,,,,"http://www.radiantprep.com","2019-09-23T00:00:00.000",,,"Radiant Prep is an elite tutoring and test preparation service, and educational publisher. We're staffed with certified Master Teachers, Distinguished Teachers, and tutors from Ivy-league universities.",,,"New York City Department of Education","64514","60","2019-11-13T00:00:00.000","Provided special education tutoring for a 6th grade student with a learning disability.","Taconic Investment Partners","2100","55","2021-03-26T00:00:00.000","Provided on-site tutoring services for residents of a building in Taconic Partners' portfolio.",,,,,,,,,,
"Coda Societies LLC",,"Garance Choko","7542349189",,"MBE,WBE","04/30/2027;04/30/2027","BLACK","10 Liberty ST #37A",,"New York","NY","10005",,,,,,"http://Codasocieties.com",,,,"Coda Societies is a firm that drives the design and development of citizen-centered infrastructures, services and organizations worldwide.  Our international team of urban planners, architects, policy-makers, economists, designers, creatives, entrepreneurs and lawyers, uses participatory design and systems thinking to develop modular systems that lead to sustainable and positive outcomes for all. From building hospitals, to developing public spaces, to producing consumer goods and shaping policies, we engage partners and social groups in the design and implementation of value-based and resilient solutions.",,,"The Africa Center","60000","100","2020-12-24T00:00:00.000","Project Design and Management","Mastercard Foundation","45000","100","2021-12-03T00:00:00.000","Project Design and Management","The Aspen Institute","50000","100","2021-05-31T00:00:00.000","Project design and management",,,,,
"Delaware Business Systems, Inc.",,"Elizabeth Brosi","6077463533","6077467768","WBE",,"NON-MINORITY","89 Main Street",,"Delhi","NY","13753",,,,,,"http://www.dbs-inc.net","1993-10-02T00:00:00.000",,,"Business machines and equipment (except computers) merchant wholesalers",,,"Franklin-Essex-Hamilton-Boces","16240","100","2018-01-01T00:00:00.000","Copier & Service Contracts","SUNY Albany","12390","100","2018-01-01T00:00:00.000","Sharp LCD Monitors","NY County District Attorney's Office","940","100","2018-01-01T00:00:00.000","Shapr 60' Television",,,,,
