"vendor_formal_name","vendor_dba","contact_name","telephone","fax","certification","cert_renewal_date","ethnicity","address1","address2","city","state","zip","mailingaddress1","mailingaddress2","mailingcity","mailingstate","mailingzip","website","date_of_establishment","aggregate_bonding_limit","signatory_to_union_contracts","business_description","goods_materials_suplier","types_of_construction_projects","job_exp1_name_of_client","job_exp1_value_of_contract","job_exp1_percent_self_performed","dateofjob1","experience1","job_exp2_name_of_client","job_exp2_value_of_contract","job_exp2_percent_self_performed","dateofjob2","experience2","job_exp3_name_of_client","job_exp3_value_of_contract","job_exp3_percent_self_performed","dateofjob3","experience3","job_exp4_name_of_client","job_exp4_value_of_contract","job_exp4_percent_self_performed","dateofjob4","experience4"
"Brown Girl Recovery LLC",,"Brienne Colston","9173756383",,"MBE,WBE","12/31/2026;12/31/2026","BLACK","780 Concourse Village West","APT 9J","Bronx","NY","10451",,,,,,"http://www.browngirlrecovery.com",,,,"Brown Girl Recovery (BGR) is a Black and queer-led healing justice practice space founded in 2017 that creates grassroots healing spaces for Black and Brown community members living in the Bronx and northern Manhattan. Through the facilitation of innovative social justice programming and events, we primarily serve community members who are marginalized and ousted from traditional models of care through peer-to-peer counseling support, ancestral healing circles, and comprehensive healing & social justice education.   BGR has two major practice areas including offering free and accessible community healing programs and expert racial, gender and healing justice consultation for community-based organizations.  BGR guides organizations to transform outdated work culture by developing an explicit commitment to anti-oppression and anti-oppressive practices. Our facilitators guide community members to center their mental health and healing by providing free and accessible healing spaces that use storytelling as a tool for communication.   BGR facilitators offer large-scale facilitation + consultation services including political educational offerings that build the tools and competencies for anti-oppression, community accountability, feminisms, race + racism, and healing justice.",,,"Vibrant Emotional Health","161000","100","2021-01-01T00:00:00.000","Curriculum design, powerpoint creation and preparation for 10 two-hour Divisional Action Team- Senio","The Fund for Public Health","55899","100","2019-10-01T00:00:00.000","Curriculum design and prep for 1- day Community of Practice Training for Race to Justice Staff Facil","DOHMH Special Projects Collaboration","23700","100","2018-07-01T00:00:00.000","Curriculum Design & Prep for 2-day Personal Identity Deep Dive session - Curriculum Design & Prep fo",,,,,
"G-Squared Electric, LLC",,"Jody Garofolo","7183491761","8883019640","WBE",,"NON-MINORITY","59 Van Dam Street",,"Brooklyn","NY","11222",,,,,,"http://www.gsqelectric.com","2011-02-25T00:00:00.000","15000000","IBEW 3","Furnish & install low voltage & electrical cabling systems including wireless, av & security as well as lighting & UPS work.",,,"Unispace","3292000","100","2019-11-01T00:00:00.000","build out 2 1/2 floors of office space","Hellman Electric LLC","70499","100","2021-06-30T00:00:00.000","Office relocation - 345 Adams St, Brooklyn, NY. Tele/Data LV wiring & closet fitout. Subcontract ong","DoITT","150000","100","2019-11-29T00:00:00.000","In House Electricians for all Electrical & Low Voltage needs","Sierra Mechanical","240000","100","2019-10-31T00:00:00.000","Furnish & Install Chiller/Boiler upgrade"
"Milton Samuels Advertising Agency, Inc",,"Keith Klein","2125325151",,"EBE",,,"325 West 38th Street","#1507","New York","NY","10018",,,,,,"http://msanewyork.com","1960-01-05T00:00:00.000",,,"MSA Marketing is a full service advertising and public relations agency.",,,"NYC Health + Hospitals","28000000","70","2020-06-17T00:00:00.000","Created a media buying plan.",,,,,,,,,,,,,,,
"Tee Pee Entity, LLC",,"Tracy Pridgen","9177243189",,"MBE,WBE","05/31/2026;05/31/2026","BLACK","317 Troy Avenue",,"Brooklyn","NY","11213",,,,,,,,,,"Tee Pee Entity, LLC is a minority women-owned construction company,  which specializes in residential/ commercial repair, maintenance, renovations, new construction (exterior and interior), demolition, painting, carpentry, plumbing, electrical, flooring, masonry, and HVAC services. Under Tee Pee Entity, LLC  umbrella, 'I Did It My Damn Self' home improvement service specializes in providing tutorials and training to individuals in the area of one-on-one home improvement projects here in New York. Tee Pee Entity, LLC is a full-service company that aims to change the definition of women in construction.",,,"Anthony Franklin","5500","100","2019-12-16T00:00:00.000","Electrical Work-removed 3 meters from building and new meters, installed ground wires and ground rod","Advanced Cladding Construction","4500","100","2019-06-01T00:00:00.000","Performed electrical work for client in regards to adding outlets on 2-4 floors.","Rodney Ocean","2650","100","2019-02-18T00:00:00.000","Carpentry Work-performed services in regards to closet frame outs for 4 floors, installed bifold doo",,,,,
"Platinum Healthcare Solutions, Inc.",,"Sherlon McKenzie","3474304636","6105357007","MBE,WBE","05/30/2023;05/30/2023","BLACK","7 Kalmia Ln",,"Valley Stream","NY","11581",,,,,,"http://www.PHSPro.com","2010-07-12T00:00:00.000",,,"Platinum Healthcare Solutions, Inc. (PHS) is a New York-based healthcare consulting and project management firm. Since 2010, we have customized services to meet our clients’ requirements in the areas of consulting, project management, leadership skills, and clinical training. We also offer interim executive services, and since 2021, have curated a pool of talented healthcare professionals to meet the staffing and recruitment demands of our clientele.  Boutique-style service ensures personalized attention by one of our qualified pros. Our team is responsive and understands the value of building meaningful relationships with consumers; this is one reason we tailor our programs to meet their needs. Passion for excellence, innovation, service, and dependability are the pillars that help us establish and maintain cherished connections with clients.",,,"Press Ganey","44000","100","2020-11-13T00:00:00.000","Consulting services","Samaritan Services","30000","100","2018-03-01T00:00:00.000","Business Consultation and Management Services",,,,,,,,,,
"LSI General Contracting Corp.",,"Maurizio Banchitta","7187598980",,"WBE",,"NON-MINORITY","1650 George Road",,"Wantagh","NY","11793",,,,,,,"2012-07-27T00:00:00.000",,,"General contractor. Installation of sheet rock, ceramic tile, kitchen cabinets, taping, painting, masonry, doors and windows, demolition, roof repair and framing",,,"Rockaway Development Group Inc.","20000","100","2020-09-01T00:00:00.000","Sheetrock, Spackle, Paint Doors and door frames","Rockaway Development Group Inc","13000","100","2020-08-13T00:00:00.000","Level out flooring, break concrete, float floor, install new Install new interior wall - Sheet rock,","Rockaway Development Group Inc.","17000","100","2020-08-24T00:00:00.000","Frame entire 2nd floor and install iron rods and brackets throughout",,,,,
"Clock wise Productions, Inc.",,"Carolina Froriep","2123433099",,"WBE",,"NON-MINORITY","2110 Frederick Douglass Blvd","Suite 8A","New York","NY","10026",,,,,,"https://www.clockwiseproductions.com","1996-11-25T00:00:00.000",,,"Services: Video Marketing Consulting and Coaching Video marketing assessments, video filming, video editing, video & digital marketing strategy, video hosting and distributions, video scripting.  Products: Custom made video content, vlog-packages, promotional videos, educational videos, corporate videos, documentary videos, on-line videos.",,,"Commerz Real","50000","100","2019-09-02T00:00:00.000","Location filming","Rella's Spielhaus","2300","100","2017-08-27T00:00:00.000","Filming & Editing","Consulate General of Switzerland in NY","3800","100","2017-04-07T00:00:00.000","Video Workshop","IVI Creative","9545","100","2016-02-24T00:00:00.000","Producing"
"FORTIS ARCHITECTURAL METAL & GLASS LLC",,"Gianugo Pischiutta","8602451251",,"MBE","04/30/2027","HISPANIC","1245 Farmington Ave # 201",,"West Hartford","CT","06107",,,,,,"http://www.fortis-amg.com","2019-11-15T00:00:00.000",,,"Fortis Architectural Metal & Glass LLC is a specialty trade contractor that design, fabricates and installs ornamental steel and glass structures for both interiors and exteriors, such as storefronts, stairs, balustrades, office partitions.",,,"Fabbrica LLC","1250000","50","2019-11-27T00:00:00.000","Guardrails","G&H Diversified Manufacturing, LP","189770","50","2020-03-04T00:00:00.000","Stainless Steel Totems at 425 Park Ave, NY",,,,,,,,,,
"Maxpar Inc.","La Lumia","Jacqueline Sencion","9172874638","2122749520","MBE,WBE","08/31/2025;08/31/2025","HISPANIC","159-00  Riverside  Drive","#3M","New York","NY","10032",,,,,,"http://maxparinc.com","2006-07-20T00:00:00.000",,,"Maxpar Inc. is an apparel manufacturing company. We specialize in active wear, uniforms, bathing suits and athletic wear for women, men, and children. We also provide PPE.",,,"Linda Hall Vassall","7480","100","2013-12-01T00:00:00.000","Apparel Manufacturing","Jane Neustadter","2386","100","2014-12-01T00:00:00.000","Apparel Manufacturing","Anh-Tuyet Nguyen","3203","100","2014-12-01T00:00:00.000","Apparel Manufacturing",,,,,
"KW Tech Corp.",,"Samuel Watts","5165050336","5165050339","MBE","11/30/2024","BLACK","132 Merrick Rd",,"Lynbrook","NY","11563",,,,,,"http://www.kwtech.net","1994-11-16T00:00:00.000","10000000",,"We provide HVAC services which includes, sheet metal duckwork heating and cooling piping, insulation, air balancing.",,,"RICI CORP","1700000","100","2017-06-17T00:00:00.000","DUCTWORK; MECHANICAL INSULATION OF PIPE AND DUCTS, TEMPERATURE CONTROLS, STEAM PIPING","Adams European Contracting","473750","75","2019-03-29T00:00:00.000","HVAC, Balancing, Steampiping","NEHAL CONTRACTING","997000","75","2018-05-31T00:00:00.000","STEAMFITTING DUCTWORK REFRIGERATION PIPING, PIPE & DUCT INSULATION","DEBORAH BRADLEY CONSTRUCTION","670000","75","2017-06-01T00:00:00.000","HVAC"
"Open Bar Hospitality LLC",,"lisa lindo-duval","2127361119",,"MBE,WBE","05/31/2027;05/31/2027","BLACK","365 West 22nd street",,"New York","NY","10011",,,,,,"http://Www.openbarhospitality.com","2006-11-06T00:00:00.000",,,"Open Bar Hospitality is one of New York’s City top off premise bar catering, event staffing and event planning firm.  We provide cocktail service for private events, such as corporate events, pop up experience, product launch, galleries openings, fashion shows, award shows, holiday parties meeting and conferences  to name a few.  Open Bar Hospitality also provides professional & friend Mixologist, bartenders, servers, chefs and busier with years of experience in the hospitality industry.  We also provide virtual and in-person mixology classes for corporate companies.  Open Bar Hospitality has been in business for more than 10 years.  With excellent reviews. We can cater small and large events.  OB provides everything you need at the, to create a fabulous experience for your guests at the bar.",,,"Warner Music group","20000","100","2020-02-06T00:00:00.000","Provide bartenders and provided the signature cocktail for the event.  400 guests total.","Toorak capital","3300","100","2021-03-22T00:00:00.000","Provided virtual mixology experience for corporate company celebrating women’s History Month 50 gues","Brandon Maxwell fashion designer","15000","100","2020-02-06T00:00:00.000","Provide event staffing and cocktail service for the guests and A list celebrities attending the fash",,,,,
"New Venture","Cheryl Mann dba New Venture","Cheryl Mann","6464818708",,"MBE,WBE","01/30/2023;01/30/2023","BLACK","2351 Adam Clayton Powell Jr Blvd","#506","New York","NY","10030",,,,,,"http://www.new-venture.com","2001-07-15T00:00:00.000",,,"New Venture is a marketing, communications and advertising company. New Venture does marketing, collateral development, website design, social media marketing and fundraising/development campaign management.",,,"Amistad Research Center","12750","100","2015-07-19T00:00:00.000","Redesigned client's website and provided marketing consulting services.","COACHES, A Family First Program","5000","100","2017-10-10T00:00:00.000","Designed brochures, infographics, pitch documents and stationery.","NYC Public Advocate","6000","100","2015-03-01T00:00:00.000","Created marketing collateral.",,,,,
"Soloh Partners Inc.",,"Heather Ohalloran","6468440548",,"WBE",,"NON-MINORITY","500 7th Ave","8th Fl","New York","NY","10018",,,,,,"http://www.solohpartners.com","2018-01-01T00:00:00.000",,,"Soloh Partners provides contingent labor solutions and direct hire talent search for clients in various industries and organizations. We leverage the latest technologies to to swiftly identify, screen and place qualified employees with our clients.   Working with us ensures quality is not sacrificed at the expense of speed. We deliver both, and the impact of a partnership with us is felt immediately.",,,"Services for the Underserved","2600000","0","2017-08-25T00:00:00.000","The supply of on-demand Contingent Labor for roles such as: Direct Care Worker, Case Manager, Wellne","Rightsourcing (for HHC)","2600000","0","2020-08-06T00:00:00.000","On-demand contingent labor for NYC HHC. Staffing roles including: Registered Nurse, LPN, Medical Ass","AHRC","500000","0","2019-09-30T00:00:00.000","On-demand contingent labor and staffing for roles including: Registered Nurse & Direct Care",,,,,
"3G Warehouse Solutions, Inc.",,"Lauren Nichols","6316175951","6316175954","WBE",,"NON-MINORITY","565 Broadhollow Road",,"Farmingdale","NY","11735",,,,,,"http://www.3gwhse.com","2008-09-21T00:00:00.000",,,"3G Solutions provides warehouse and shipping services for customers. We also buy, store, ship and sell products to NYC and NYS.",,,"Astoria Bank","150000","100","2017-02-02T00:00:00.000","Storage & shipping of all bank promotional products","Traffic Systems, Inc.","8000","100","2021-04-28T00:00:00.000","Provided signal optimization equipment, wireless vehicle detection system.","Astoria Bank","2601","100","2016-10-01T00:00:00.000","Pick, pack & shipping services","Astoria Bank","624","100","2016-07-25T00:00:00.000","Pick, pack & shipping services."
"IBX Emergency, LLC",,"Eva Lalaj","9177800024","8665984503","WBE",,"NON-MINORITY","62-30 65th Street",,"Middle Village","NY","11379",,,,,,"http://ibxservices.com/","2016-10-12T00:00:00.000",,,"Disaster restoration - water damage & fire damage clean up.",,,"Lucy Fejzaj","52000","100","2017-01-10T00:00:00.000","Demolition, drywall, flooring, painting, kitchen, and stairs.","William Damms","30000","100","2017-10-04T00:00:00.000","Painting Lobby","Ervin Brahmi","25000","100","2017-03-23T00:00:00.000","Repairs",,,,,
"Terrain-NYC Landscape Architecture PC",,"Steven Tupu","2125376080","2125376079","MBE","08/31/2024","ASIAN","200 Park Avenue South","Suite 1401","New York","NY","10003",,,,,,"http://www.terrain-nyc.net","2008-10-20T00:00:00.000",,,"Terrain-NYC is a landscape architecture company that provides professional design services. Its projects include master plans, parks, plazas, streetscapes and urban landscapes.",,,"Stanley Avenue Preservation, LLC","30157","100","2021-12-15T00:00:00.000","Created schematic designs.","Ascendant Heritage LLC","13000","100","2022-01-01T00:00:00.000","Created a schematic design and provided construction administration services.","Rosenkranz Residence","4185","100","2021-12-01T00:00:00.000","Put together construction documents and provided construction administration services.",,,,,
"KO2 Consulting, LLC",,"Kiymet Ornektekin","6467177584",,"WBE",,"NON-MINORITY","1325 Sixth Avenue","28th Fl (Suite 2710)","New York","NY","10019",,,,,,"http://www.ko2consulting.com","2016-04-05T00:00:00.000",,,"Energy and sustainability consulting services; feasibility studies; program/project development, assessment, management (energy efficiency, solar, renewables, operations, maintenance); microgrid strategy; PEER Certification; carbon assessment; carbon management; greenhouse gas inventory; real estate portfolio operations (energy management, water management, waste reduction, vendor management, budgeting/ billing, cash-flow analysis, utility coordination, design management, construction consulting).",,,"PGAL","375000","100","2020-02-01T00:00:00.000","Sustainability Consulting and Commissioning Oversight","AECOM","86340","100","2020-08-11T00:00:00.000","Strategic advising on indirect and direct ghg emissions reductions and program development.","NYC Department of Transportation","17000","100","2018-07-01T00:00:00.000","LED lighting and controls upgrade",,,,,
"Pearl Lounge Inc.",,"Ioulia Fedorova","6469450202",,"WBE",,"NON-MINORITY","2 Hinckley Place","Apt 6D","Brooklyn","NY","11218",,,,,,,"2009-01-30T00:00:00.000",,,"Pearl Lounge is a bar and restaurant that serves food and beverages.",,,,,,,,,,,,,,,,,,,,,,
"The Center for Emotional Development",,"Rupert Hayles","2015322170",,"MBE","12/31/2026","BLACK","48 Flagstone Hill Road",,"Wantage","NJ","07461",,,,,,"http://www.emotionalcenter.org","2011-08-15T00:00:00.000",,,"The Center for Emotional Development is a boutique development and consulting firm. The company focuses on emotional intelligence, strategic planning, transition management and team development.",,,"Movement.Org","40000","100","2020-01-01T00:00:00.000","Supervised operational and financial functions.","Lead.NYC","32000","100","2020-01-01T00:00:00.000","Provided coaching and strategic advising services to the president and his team.",,,,,,,,,,
"EG&R Engineering PC",,"Vinaya Bhagavathula","6096195256","6096552630","MBE","12/31/2026","ASIAN","1249 South River Road","Suite 111","Cranbury","NJ","08512",,,,,,"http://www.egrengineering.com","2016-10-22T00:00:00.000",,,"EG&R Engineering PC provides electrical engineering and design services (specializing in power systems/power distribution and transmission, emergency power/generators, substations, lighting, grounding, arc flash studies); MEP Services, Environmental Consulting, Hazardous Waste Management, Environmental Engineering (permitting, compliance and site remediation), and Geotechnical Engineering.",,,"AECOM","250000","100","2020-01-01T00:00:00.000","Served as a sub-contractor to AECOM.","MASS Electric/Kewit","200000","80","2020-03-10T00:00:00.000","provided engineering and design support.","IDL Electric","200000","100","2020-03-01T00:00:00.000","Prepared an electrical shop drawing and provided engineering support.",,,,,
"Guzman & Company",,"Leopoldo Guzman","6469791170","6466738401","MBE","04/30/2027","HISPANIC","370 Lexington Avenue","Suite 1812","New York","NY","10017",,,,,,"http://www.guzman.com","1987-01-28T00:00:00.000","1000000",,"Guzman & Company is an institutional broker-dealer that specializes in investment banking and trading equities and fixed income globally.",,,"CitiGroup","5000000","1","2015-06-01T00:00:00.000","Co-Manager for CitiGroup bond writing.","New York State Common Retirement System","625000","100","2016-08-01T00:00:00.000","Equity trading for portfolio of NYSCRS.","MasterCard","1500000","1","2014-03-01T00:00:00.000","Co-Manager MasterCard bond underwriting.",,,,,
"Now Next Media, LLC",,"Joanne Roberts","9178866849",,"WBE",,"NON-MINORITY","230 East 79th Street","Suite 8F","New York","NY","10075",,,,,,"http://www.whatnowwhatnext.com","2014-12-10T00:00:00.000",,,"We are a digital company operating WHATNOWWHATNEXT.com a collaborative network and talent marketplace supporting women entrepreneurs to launch and grow their ventures. We connect women business owners with new customers, clients and opportunities, and help government agencies and organizations source the expertise they need from women-owned businesses.",,,"California Capital","44000","100","2021-01-01T00:00:00.000","100","Opportunity Resources, Inc.","3750",,"2016-05-04T00:00:00.000","Planning, development, creation and execution of digital newsletter",,,,,,,,,,
"Brandy Brown and Associates","United One Cleaning","Brandy Brown","3474697715",,"MBE,WBE","12/31/2026;12/31/2026","BLACK","75 east 21st",,"Brookkyn","NY","11226",,,,,,,,,,"Brandy Brown and Associates is a leader in providing crisis management services, including disaster recovery operations support, long- term recovery organization development, strategic advice, hazard mitigation expertise, grants management, and human resource consulting. Our team has a collective of 10 + years’ experience assisting in some of the nation’s major disasters. With a full suite of emergency management services, we are your partner before disaster strikes and as you become more resilient for future crises. Brown &amp; Associates has also partnered with several Janitorial experts that specializes in full-service commercial and residential cleaning. We can provide janitorial services, carpet cleaning, trash collection, lawn care, and facilities management. We aim to forge a solid and long-lasting relationship with our customers and future customers based on a reliable, timely, and high-quality service.",,,"Kentucky Emergency Management","45000","30","2021-04-12T00:00:00.000","Provided support and technical assistance with FEMA PA grant management for COVID-19 vaccination pro",,,,,,,,,,,,,,,
"Jacobsen/Daniels Associates, LLC",,"Darryl Daniels","7349613200",,"MBE","04/30/2027","BLACK","121 Pearl Street",,"Ypsilanti","MI","48197",,,,,,"https://www.jacobsendaniels.com","2001-12-28T00:00:00.000",,,"Consulting and concessions",,,"ABM","110701","100","2021-11-17T00:00:00.000","Scope of Work for Valet operations services: •Hiring, training, and performance management of the Va","Fishbeck","20000","100","2022-01-13T00:00:00.000","ConRAC O&M Consulting Services","JACOBS","0","100","2021-11-04T00:00:00.000","Subconsultant will provide Service in accordance with the terms, conditions, and provisions of this",,,,,
"B&F Office Equipment, LLC",,"Ashley  Holt","7182221698",,"MBE,WBE","06/30/2026;06/30/2026","BLACK","63 Flushing Avenue","Building 3, Unit 244","Brooklyn","NY","11205",,,,,,"http://www.bandfofficefurniture.com","2017-07-26T00:00:00.000",,,"B & F Office Equipment, LLC. provides office furniture and inside design services at affordable pricing.",,,"HUMAN RESOURCES ADMINISTRATION","70000","100","2018-07-31T00:00:00.000","Provided Nightingale Chairs to various HRA locations in the city",,,,,,,,,,,,,,,
"Chocolate Promises Inc.",,"Cindy Zakalik","5162996400","5166883923","WBE",,"NON-MINORITY","1872 George Court",,"Merrick","NY","11566",,,,,,"http://www.chocolatepromises.com","2012-05-17T00:00:00.000",,,"Chocolate Promises sells personalized chocolate gifts and party/event favors.",,,"NYC Law Department","2856","100","2021-11-19T00:00:00.000","Sold 1600 chocolate coins.",,,,,,,,,,,,,,,
"Sallie Mullins Thompson CPA PLLC",,"Sallie Thompson","2122439126","2128077392","WBE",,"NON-MINORITY","100 Bank Street #5F",,"New York","NY","10014",,,,,,"http://www.smtcpapllc.com","1994-03-31T00:00:00.000",,,"Provide business & financial management consulting & services to small business owners and non-profits in the ares of: accounting, tax preparation, payrol reporting, retirement funding, investment guidance, budgeting & cash flow projections, admin policies & procedures, and project management.",,,"Accounting/Payroll","20000","100","2017-01-01T00:00:00.000","Business transaction postings. Financial reporting. Payroll tax calculations/deposits.","Out East Designs Inc.","1610","100","2020-07-31T00:00:00.000","Corporation setup","Tax Client","2800","100","2020-01-31T00:00:00.000","Personal tax return preparation and payroll processing.","Neon Palm Tree LLC","1900","100","2020-01-31T00:00:00.000","Corporate tax return preparation and payroll processing."
"JD Consulting, LLC","JD Traditional Industries","Christine Boccia","6315491338","6315491309","WBE",,"NON-MINORITY","199 Broadway",,"Huntington Station","NY","11746",,,,,,"http://www.jdtraditional.com","1997-01-01T00:00:00.000","30000000","Laborers 66, Painters 1974,  NYC District Council of Carpenters   608/45/157 , Ironworkers 46, Labor","JD Consulting is an interior contracting company that does drywall, taping, lath, carpentry, metal, acoustical and specialty ceilings.",,,"Prismatic Development Corp","7500890","100","2018-06-29T00:00:00.000","Installed frame, drywall, tape, ballistic panels, specialty and ACT ceilings.","Citnalta Construction","6700000","98","2018-06-30T00:00:00.000","Installed frames, drywalls, tapes, lath, ACT, specialty ceilings and exterior soffits.","Turner Construction","4700000","98","2018-06-29T00:00:00.000","Installed frame, drywall, tape, skim coat, lath, ceilings, interior & exterior soffits.",,,,,
"Alabaster Box Events",,"polyseenia lewis","9142588462",,"MBE,WBE","07/31/2025;07/31/2025","BLACK","12 south 15 ave apt 4",,"Mount Vernon","NY","10550",,,,,,,"2018-07-24T00:00:00.000",,,"Alabaster Box Events was established in July 2018, located in Westchester County, New York. Alabaster box Event is an event planning company, services offered are; wedding planning, corporate events, special events, floral arrangement, interior designs, and table accessories rental.",,,"omobola opawoye","1500","100","2020-02-23T00:00:00.000","coordinating event, decorate guest tables,decorate headtable, decorate gift table, decorate cake tab","glenville bassaragh","200","100","2020-03-21T00:00:00.000","floral arrangment","stepheie grady","100","100","2020-02-08T00:00:00.000","provided chaircovers for rental",,,,,
