"MANHATTAN","SoHo-TriBeCa-Civic Center-Little Italy","Soho Thrift Shop","130 Crosby Street, New York, NY 10012, USA","130","CROSBY STREET","Books/Media, Clothing/Personal Accessories, Household Furniture/Furnishings, Kitchen Items, Footwear, Arts/Crafts, Musical Instruments, Office Furniture/Furnishings","Books/Media, Clothing/Personal Accessories, Household Furniture/Furnishings, Kitchen Items, Footwear, Arts/Crafts, Musical Instruments, Office Furniture/Furnishings","Drop off your clothing, shoes, books, artwork, jewelry, and housewares at any of our Thrift Shops during our open business hours. We offer furniture pick-ups for a fee. Please call 1-888-HW-DONATE (1-888-493-6628).",,"Friday 11:00 AM-07:00 PM, Thursday 11:00 AM-07:00 PM, Wednesday 11:00 AM-07:00 PM, Tuesday 11:00 AM-07:00 PM, Monday 11:00 AM-07:00 PM, Saturday 11:00 AM-07:00 PM, Sunday 11:00 AM-05:00 PM","https://www.housingworks.org/","(646) 786-1200","info@housingworks.org","Partner","102","01","43","1005110012","1007944","40.724709","-73.996391","005","POINT (-73.9963910003454 40.7247089997238)"
"QUEENS","Ridgewood","Agape Christian Center","59-02 Summerfield Street, Ridgewood, NY 11385, USA","59-02","SUMMERFIELD STREET","Food/Beverage","Food/Beverage","Saturday food pantry walk-ins are welcome 11:30am-1:30pm. Donations dropoff convenient Wednesday at 4:30pm-6pm. Saturday 10am-2pm.",,"Friday Closed, Thursday Closed, Wednesday 4:30 PM-6:00 PM, Tuesday Closed, Monday Closed, Sunday Closed, Wednesday Closed, Friday Closed, Thursday Closed, Saturday 10:00 AM-2:00 PM, Tuesday Closed, Monday Closed, Saturday 11:30 AM-01:30 PM, Sunday Closed","http://agapenyc.org/","(917) 604-4812","info@agapenyc.org",,"405","34","557","4035890001","4086718","40.699223","-73.897719","104","POINT (-73.897718999733 40.6992229998447)"
"QUEENS","Fresh Meadows-Utopia","J. Weissman","19662 67th Avenue, NY, New York 11365, USA","196-62","67 AVENUE",,"Musical Instruments",,,"Monday 10:00 AM-04:30 PM, Tuesday 10:00 AM-04:30 PM, Wednesday 10:00 AM-04:30 PM, Thursday 10:00 AM-04:30 PM, Friday 10:00 AM-04:30 PM, Saturday 11:00 AM-04:30 PM, Sunday Closed","http://www.jbwflutes.com","(718) 454-9288","lukesaxandflute@gmail.com",,"408","23","1347","4071170051","4560823","40.738933","-73.778066","107","POINT (-73.7780660001468 40.7389330000611)"
"QUEENS","Astoria","Unique Boutique Steinway","32-36 Steinway Street, Astoria, NY, USA","32-36","STEINWAY STREET",,"Books/Media, Clothing/Personal Accessories, Household Furniture/Furnishings, Kitchen Items, Footwear, Toys/Games",,,"Friday 10:00 AM-8:00 PM, Thursday 10:00 AM-8:00 PM, Wednesday 10:00 AM-8:00 PM, Tuesday 10:00 AM-8:00 PM, Monday 10:00 AM-8:00 PM, Saturday 10:00 AM-8:00 PM, Sunday 10:00 AM-8:00 PM",,"(718) 278-6400","magdyraz@yahoo.com",,"401","22","155","4006560051","4010418","40.758186","-73.920011","114","POINT (-73.9200109998087 40.7581860002869)"
"MANHATTAN","West Village","The Salvation Army New York Temple","132 W 14th St, New York, NY 10011, USA","132","WEST   14 STREET","Food/Beverage","Food/Beverage","This is a catchment area pantry. Only people living south of 14th street. Call for appointment, bring photo ID to get food. Call to schedule donation drop off. Mon - Fri: 9:30 AM - 11:00 AM; 1:30 PM - 3:30 PM. Soup kitchen Monday-Thursday 12pm-1pm.","Pickup","Friday 9:30 AM-3:30 PM, Thursday 9:30 AM-3:30 PM, Wednesday 9:30 AM-3:30 PM, Tuesday 9:30 AM-3:30 PM, Monday 9:30 AM-3:30 PM, Sunday Closed, Wednesday 09:30 AM-03:30 PM, Friday 09:30 AM-03:30 PM, Thursday 09:30 AM-03:30 PM, Saturday Closed, Tuesday 09:30",,"(212) 337-7469","notanemail@callphone.com",,"102","03","71","1006090020","1010638","40.73781","-73.998682","006","POINT (-73.9986819998753 40.7378100004344)"
"MANHATTAN","Upper West Side","Westsider Books","2246, Broadway, New York, NY, 10024, USA","2246","BROADWAY",,"Books/Media",,,"Monday 10:00 AM-9:00 PM, Tuesday 10:00 AM-9:00 PM, Wednesday 10:00 AM-9:00 PM, Thursday 10:00 AM-9:00 PM, Friday 10:00 AM-9:00 PM, Saturday 10:00 AM-9:00 PM, Sunday 10:00 AM-09:00 PM",,"(212) 362-0788","info@westsiderbooks.com",,"107","06","167","1012280013","1032653","40.7847","-73.979048","020","POINT (-73.9790480000661 40.7846999999083)"
"BROOKLYN","Flatlands","helping hands for life","4415 Avenue L, Brooklyn, NY 11234, USA","4415","AVENUE L","Arts/Crafts, Building Products, Clothing/Personal Accessories, Electronics, Appliances, Household Furniture/Furnishings, Kitchen Items, HealthCare, Musical Instruments, Office Furniture/Furnishings, Office Supplies/Stationary, Footwear, Sports Equipment,",,,,"Monday 12:30 PM-06:00 PM, Tuesday 10:00 AM-06:00 PM, Wednesday 10:00 AM-06:00 PM, Thursday 10:00 AM-10:00 AM, Friday 10:00 AM-06:00 PM, Saturday 11:00 AM-03:00 PM, Sunday 01:00 PM-02:00 PM",,"(718) 252-9700","esthrthom@aol.com",,"318","45","730","3078240004","3217405","40.623429","-73.932561","063","POINT (-73.9325610002909 40.6234290002514)"
"BRONX","University Heights-Morris Heights","The Davidson Community Center, Inc.","2038 Davidson Avenue, Bronx, NY 10453, USA","2038","DAVIDSON AVENUE","Arts/Crafts, Books/Media, Clothing/Personal Accessories, Electronics, Food/Beverage, Household Furniture/Furnishings, Kitchen Items, Office Furniture/Furnishings, Office Supplies/Stationary, Footwear, Toys/Games",,"Accepts items listed, but nothing too big. Please inquire by calling for Ms. Medina, Operations Manager.",,"Monday 08:00 AM-06:00 PM, Tuesday 08:00 AM-06:00 PM, Wednesday 08:00 AM-06:00 PM, Thursday 08:00 AM-06:00 PM, Friday 08:00 AM-06:00 PM, Saturday 10:00 AM-04:00 PM, Sunday Closed","http://www.thedccsite.org/","(718) 731-6360","g.medina.bacd@gmail.com",,"205","14","243","2028630028","2008399","40.853564","-73.908472","046","POINT (-73.9084720000837 40.8535640000818)"
"MANHATTAN","Hudson Yards-Chelsea-Flatiron-Union Square","Academy Records & CDs","12 West 18th Street, New York, NY 10011, USA","12","WEST   18 STREET",,"Books/Media","Check out the website or call ahead for more information about selling your items.",,"Monday 11:00 AM-07:00 PM, Tuesday 11:00 AM-07:00 PM, Wednesday 11:00 AM-07:00 PM, Thursday 11:00 AM-8:00 PM, Friday 11:00 AM-8:00 PM, Saturday 11:00 AM-8:00 PM, Sunday 11:00 AM-07:00 PM","http://www.academy-records.com/","(212) 242-3000","academylpcd@gmail.com",,"105","03","54","1008197501","1015429","40.738872","-73.992955","013","POINT (-73.9929550001741 40.738871999946)"
"QUEENS","Murray Hill","Bayside Thrift","14402 Northern Boulevard, NY, New York 11354, USA","144-02","NORTHERN BOULEVARD","Books/Media, Clothing/Personal Accessories, Footwear","Books/Media, Clothing/Personal Accessories, Footwear",,,"Monday 11:00 AM-07:00 PM, Tuesday 11:00 AM-07:00 PM, Wednesday 11:00 AM-07:00 PM, Thursday 11:00 AM-07:00 PM, Friday 11:00 AM-07:00 PM, Saturday 11:00 AM-07:00 PM, Sunday 11:00 AM-6:00 PM",,"(718) 460-4141","notanemail@bayside.com",,"407","20","1163","4050140009","4113419","40.76437","-73.823138","109","POINT (-73.8231380003194 40.7643700003784)"
"QUEENS","Flushing","La Jornada","135-32 38th Avenue, Flushing, NY 11354, USA","135-32","38 AVENUE","Arts/Crafts, Automotive, Clothing/Personal Accessories, Electronics, Food/Beverage, Office Furniture/Furnishings, Office Supplies/Stationary","Arts/Crafts, Automotive, Clothing/Personal Accessories, Electronics, Food/Beverage, Office Furniture/Furnishings, Office Supplies/Stationary","Call before food donation drop-off.",,"Monday Closed, Tuesday Closed, Wednesday 12:00 PM-05:00 PM, Thursday Closed, Friday 12:00 PM-05:00 PM, Saturday 12:00 PM-05:00 PM, Sunday Closed","http://lajornadany.org","(917) 880-5693","pedro@lajornadany.org",,"407","20","871","4049750001","4112307","40.760468","-73.831483","109","POINT (-73.8314830002412 40.7604680003012)"
"STATEN IS","Grymes Hill-Clifton-Fox Hills","Our Lady of Good Counsel","42 Austin Place, Staten Island, NY 10304, USA","42","AUSTIN PLACE","Food/Beverage","Food/Beverage","Food pantry open Saturdays 10-12pm. Must be registered for pantry, registration first Saturday of every month. Call to schedule a drop-off. Canned and packaged foods only.",,"Monday Closed, Tuesday Closed, Wednesday Closed, Thursday Closed, Friday Closed, Saturday 10:00 AM-12:00 PM, Sunday Closed",,"(718) 447-1504","acctg.ologc@verizon.net",,"501","49","33","5005800034","5106889","40.631074","-74.086371","120","POINT (-74.0863710003224 40.6310740002681)"
"MANHATTAN","SoHo-TriBeCa-Civic Center-Little Italy","Men","19 Prince Street, New York, NY 10012, USA","19","PRINCE STREET",,"Clothing/Personal Accessories, Footwear",,,"Monday 12:00 PM-08:00 PM, Tuesday 12:00 PM-08:00 PM, Wednesday 12:00 PM-08:00 PM, Thursday 12:00 PM-08:00 PM, Friday 12:00 PM-08:00 PM, Saturday 12:00 PM-08:00 PM, Sunday 12:00 PM-07:00 PM","http://www.inanyc.com","(212) 334-2210","inamen@inanyc.com",,"102","01","43","1005080047","1007910","40.722874","-73.994309","005","POINT (-73.9943089996616 40.7228739996386)"
"QUEENS","Ridgewood","Topos Bookstore Cafe","788 Woodward Ave, Ridgewood, NY 11385, USA","788","WOODWARD AVENUE",,"Books/Media","Hours vary--call ahead to ensure they are open. Also call ahead to ensure donations can be accepted.",,"Monday 07:00 AM-09:00 PM, Tuesday 07:00 AM-09:00 PM, Wednesday 07:00 AM-09:00 PM, Thursday 07:00 AM-09:00 PM, Friday 07:00 AM-09:00 PM, Saturday 08:00 AM-09:00 PM, Sunday 08:00 AM-09:00 PM",,"(347) 927-5680","hello@toposbookstore.com",,"405","34","551","4034710035","4083037","40.703597","-73.903706","104","POINT (-73.903705999733 40.7035970001047)"
"STATEN IS","Mariner's Harbor-Arlington-Port Ivory-Graniteville","Comic Book Jones","2220 Forest Avenue, Staten Island, NY 10303, USA","2220","FOREST AVENUE",,"Books/Media",,,"Monday 10:00 AM-08:00 PM, Tuesday 10:00 AM-08:00 PM, Wednesday 10:00 AM-09:00 PM, Thursday 10:00 AM-09:00 PM, Friday 10:00 AM-09:00 PM, Saturday 10:00 AM-09:00 PM, Sunday 10:00 AM-07:00 PM",,"(718) 448-1234","Comicbookjones@gmail.com",,"501","49","30302","5016850090","5141910","40.626157","-74.163173","121","POINT (-74.1631729996352 40.6261570001486)"
"QUEENS","South Jamaica","V.E.T.S Inc. Main Headquarters","111-16 173rd St, Jamaica, NY 11433, USA","111-16","173 STREET","Arts/Crafts, Books/Media, Clothing/Personal Accessories, Electronics, Food/Beverage, Appliances, Household Furniture/Furnishings, Kitchen Items, Office Furniture/Furnishings, Office Supplies/Stationary, Footwear, Sports Equipment, Toys/Games","Arts/Crafts, Books/Media, Clothing/Personal Accessories, Electronics, Food/Beverage, Appliances, Household Furniture/Furnishings, Kitchen Items, Office Furniture/Furnishings, Office Supplies/Stationary, Footwear, Sports Equipment, Toys/Games","The 173rd street Jamaica location has a food pantry, soup kitchen and boutique open Fridays from 10 to 12. All other locations have a food pantry. Hours of operation are listed on each locations profile. Call to schedule donation pick up.","Pickup","Monday Closed, Tuesday Closed, Wednesday Closed, Thursday Closed, Friday 10:00 AM-12:00 PM, Saturday Closed, Sunday Closed","https://www.veteranownedbusiness.com/business/6885/vets-inc","(646) 261-1973","vets@rocketmail.com",,"412","27","434","4102820125","4219252","40.694756","-73.779498","113","POINT (-73.7794979996339 40.6947559997928)"
"STATEN IS","Grasmere-Arrochar-Ft. Wadsworth","The Salvation Army","493, Mosel Avenue, New York, NY, 10304, USA","493","MOSEL AVENUE","Household Furniture/Furnishings, Musical Instruments, Footwear, Sports Equipment, Toys/Games, Appliances, Books/Media, Electronics, Kitchen Items, Clothing/Personal Accessories","Household Furniture/Furnishings, Musical Instruments, Footwear, Sports Equipment, Toys/Games, Appliances, Books/Media, Electronics, Kitchen Items, Clothing/Personal Accessories","For pick-up please call 1-800-728-7825","Pickup","Friday 10:00 AM-7:00 PM, Thursday 10:00 AM-7:00 PM, Wednesday 10:00 AM-7:00 PM, Tuesday 10:00 AM-7:00 PM, Monday 10:00 AM-7:00 PM, Saturday 10:00 AM-7:00 PM, Sunday Closed","http://ny.salvationarmy.org/GreaterNewYork","(718) 442-3179","Donations@salvationarmyusa.org","Partner","502","50","50","5029210016","5107464","40.605268","-74.083664","122","POINT (-74.0836639995949 40.6052680000214)"
"MANHATTAN","West Village","Hamlet's Vintage","146 West 4th Street, New York, NY 10012, USA","146","WEST    4 STREET",,"Clothing/Personal Accessories, Footwear",,,"Monday 12:00 PM-08:00 PM, Tuesday 12:00 PM-08:00 PM, Wednesday 12:00 PM-08:00 PM, Thursday 12:00 PM-08:00 PM, Friday 12:00 PM-09:00 PM, Saturday 12:00 PM-09:00 PM, Sunday 12:00 PM-08:00 PM",,"(212) 228-1561","hamlet@hamletsvintage.com",,"102","01","65","1005430044","1008753","40.731277","-74.000598","006","POINT (-74.0005980000986 40.7312770004364)"
"BROOKLYN","East New York","Love Fellowship Tabernacle","464 Liberty Ave, Brooklyn, NY 11207, USA","464","LIBERTY AVENUE","Food/Beverage","Food/Beverage","Food pantry is open to the public on Tuesdays from 2pm-5pm. Call ahead with any food donation drop-offs.",,"Monday 09:00 AM-06:00 PM, Tuesday 02:00 PM-05:00 PM, Wednesday Closed, Thursday Closed, Friday Closed, Saturday Closed, Sunday Closed",,"(718) 235-2266","tinalft@aol.com",,"305","37","1152","3037080011","3083726","40.67483","-73.892487","075","POINT (-73.8924870003757 40.6748300000077)"
"BRONX","Williamsbridge-Olinville","Bronx Bethany Community Corporation","964 , East 227th st, New York, NY, 10466, USA","964","EAST  227 STREET","Food/Beverage","Food/Beverage","Walk-ins welcome. Last name registers person for which days they come in. We accept: food in good condition, not expired or dented cans. Food distribution: Wed: 9:00 AM - 11:00 AM, Thurs: 3-6pm and by appointment",,"Friday 9:00 AM-5:00 PM, Thursday 9:00 AM-5:00 PM, Wednesday 9:00 AM-5:00 PM, Tuesday 9:00 AM-5:00 PM, Monday 9:00 AM-5:00 PM, Sunday Closed, Wednesday 09:00 AM-11:00 AM, Friday 09:00 AM-05:00 PM, Thursday 3:00 PM-6:00 PM, Saturday Closed, Tuesday 09:00 A","https://www.bbccnyc.com/","(718) 231-5276","renae.carter@bbccnyc.com",,"212","12","404","2048620088","2064510","40.886522","-73.851766","047","POINT (-73.8517660003016 40.8865220000934)"
"MANHATTAN","Gramercy","The Materials Center","130 East 16th Street, New York, NY 10003, USA","130","EAST   16 STREET","Arts/Crafts","Arts/Crafts",,"Pickup","Monday Closed, Tuesday Closed, Wednesday Closed, Thursday Closed, Friday Closed, Saturday Closed, Sunday Closed","https://www.teachingbeyondthesquare.org/the-materials-center","(212) 228-5679","wendy@teachingbeyondthesquare.org","Partner","106","02","50","1008710055","1017811","40.734927","-73.987342","013","POINT (-73.987342000334 40.7349269996845)"
"BROOKLYN","North Side-South Side","JUNK","567 Driggs Avenue, Brooklyn, NY 11211, USA","567","DRIGGS AVENUE",,"Books/Media, Clothing/Personal Accessories, Household Furniture/Furnishings, Kitchen Items, Footwear",,,"Monday 09:00 AM-09:00 PM, Tuesday 09:00 AM-09:00 PM, Wednesday 09:00 AM-09:00 PM, Thursday 09:00 AM-09:00 PM, Friday 09:00 AM-09:00 PM, Saturday 09:00 AM-09:00 PM, Sunday 09:00 AM-09:00 PM",,"(718) 640-6299","noemail@email.com",,"301","33","519","3023290003","3062105","40.716643","-73.956681","094","POINT (-73.956681000129 40.7166430000776)"
"MANHATTAN","East Village","Fabulous Fanny's","335 East 9th Street, New York, NY 10003, USA","335","EAST    9 STREET",,"Clothing/Personal Accessories","Eye wear only.",,"Monday 12:00 PM-08:00 PM, Tuesday 12:00 PM-08:00 PM, Wednesday 12:00 PM-08:00 PM, Thursday 12:00 PM-08:00 PM, Friday 12:00 PM-08:00 PM, Saturday 12:00 PM-08:00 PM, Sunday 12:00 PM-08:00 PM",,"(212) 533-0637","fanny@fabulousfannys.com",,"103","02","40","1004510044","1006421","40.72867","-73.9856","009","POINT (-73.9856000000409 40.7286699998239)"
"BROOKLYN","Crown Heights North","St. Gregory the Great (Catholic Charities)","244 Brooklyn Ave, Brooklyn, NY 11213, USA","244","BROOKLYN AVENUE","Food/Beverage","Food/Beverage","Every other Wednesday 1pm-3pm. Call ahead to schedule food donation drop-off.",,"Friday 9:00 AM-5:00 PM, Thursday 9:00 AM-5:00 PM, Wednesday 9:00 AM-5:00 PM, Tuesday 9:00 AM-5:00 PM, Monday 9:00 AM-5:00 PM, Sunday Closed, Wednesday 01:00 PM-03:00 PM, Friday Closed, Thursday Closed, Saturday Closed, Tuesday Closed, Monday Closed, Satu",,"(718) 733-0100","JENNIFER.SMITH@ccbq.org",,"308","35","339","3012490037","3251084","40.671854","-73.944888","077","POINT (-73.9448880003819 40.671854000365)"
"STATEN IS","Stapleton-Rosebank","Good Counsel Homes","38 Wiman Place, Staten Island, NY 10305, USA","38","WIMAN PLACE","Arts/Crafts, Books/Media, Clothing/Personal Accessories, Electronics, Food/Beverage, Appliances, Kitchen Items, HealthCare, Musical Instruments, Footwear, Toys/Games, Baby Care, Cleaning Products, Personal Care/Hygiene",,"Donations can be dropped off during Hours of Operation (8 AM to 4 PM weekdays). Pick-up services are only available for the elderly or disabled. Will accept most donations with the exception of furniture. Donation forms available for those in need.","Pickup","Monday 08:00 AM-04:00 PM, Tuesday 08:00 AM-04:00 PM, Wednesday 08:00 AM-04:00 PM, Thursday 08:00 AM-04:00 PM, Friday 08:00 AM-04:00 PM, Saturday Closed, Sunday Closed","http://www.goodcounselhomes.org/","(718) 650-6994","noemail@email.com",,"501","49","6","5028270176","5042128","40.615694","-74.06634","120","POINT (-74.0663400001918 40.6156939996816)"
"MANHATTAN","Midtown-Midtown South","Muscular Dystrophy Association","11 E 44th St, New York, NY 10017, USA","11","EAST   44 STREET","HealthCare, Office Supplies/Stationary",,"We accept manual wheelchairs up to 5 years old, and electric wheelchairs up to 3 years, and walkers. Call to arrange pickup services.","Pickup","Monday 09:00 AM-05:00 PM, Tuesday 09:00 AM-05:00 PM, Wednesday 09:00 AM-05:00 PM, Thursday 09:00 AM-05:00 PM, Friday 09:00 AM-05:00 PM, Saturday Closed, Sunday Closed","https://www.mda.org/get-involved/product-donations","(212) 682-5272","newyorkcity@mdausa.org",,"105","04","94","1012790009","1035369","40.75454","-73.97894","014","POINT (-73.9789399995823 40.7545400003239)"
"QUEENS","Elmhurst-Maspeth","New Life CDC","82-10 Queens Blvd, Flushing, NY 11373, USA","82-10","QUEENS BOULEVARD","Clothing/Personal Accessories, Food/Beverage, Footwear","Clothing/Personal Accessories, Food/Beverage, Footwear","Donations of food and clothing can be dropped off at the pantry Mon-Sat 9 am ? 5 pm. Pantry open Tuesdays 6pm ? 8pm  &  Saturdays 10am ? 12pm. Pantry guests can receive food and clothing ONCE a week. Contact Jeff Kulsch (718) 424-0122.",,"Monday Closed, Tuesday 6:00 PM-08:00 PM, Wednesday Closed, Thursday Closed, Friday Closed, Saturday 10:00 AM-12:00 PM, Sunday Closed, Monday 9:00 AM-5:00 PM, Tuesday 9:00 AM-5:00 PM, Wednesday 9:00 AM-5:00 PM, Thursday 9:00 AM-5:00 PM, Friday 9:00 AM-5:0","http://newlifecdc.us/about/food-and-clothing-pantry/","(718) 424-0122","jkolsch@newlifefellowship.org",,"404","25","479","4024750012","4437425","40.736946","-73.881164","110","POINT (-73.8811639998197 40.736946000161)"
"MANHATTAN","Chinatown","Commend","172 Forsyth Street, New York, NY 10002, USA","172","FORSYTH STREET",,"Books/Media, Clothing/Personal Accessories",,,"Monday Closed, Tuesday Closed, Wednesday Closed, Thursday 12:00 PM-7:00 PM, Friday 12:00 PM-7:00 PM, Saturday 12:00 PM-7:00 PM, Sunday 12:00 PM-7:00 PM","https://commendnyc.com/","(646) 861-1460","commend@igetrvng.com",,"103","01","3601","1004210043","1005605","40.721308","-73.991026","005","POINT (-73.9910260002507 40.7213080002672)"
,,"Mind-Builders Creative Arts Center","341 Olinville Ave, NY, New York 10467, USA",,,"Arts/Crafts, Musical Instruments, Office Furniture/Furnishings",,"Third-party pickup arrangements made by phone call. We accept gently used, good condition instruments, art supplies and office furniture.","Pickup","Monday 09:00 AM-03:00 PM, Tuesday 09:30 AM-07:00 PM, Wednesday 09:30 AM-07:00 PM, Thursday 09:30 AM-07:00 PM, Friday 09:30 AM-05:30 PM, Saturday 09:00 AM-06:00 PM, Sunday Closed","http://www.mind-builders.org/","(718) 652-6256","nrichards@mind-builders.org",,,,,,,"40.871464","-73.868276",,"POINT (-73.8682759999384 40.8714639999669)"
"BROOKLYN","DUMBO-Vinegar Hill-Downtown Brooklyn-Boerum Hill","fork + pencil","18 Bergen Street, Brooklyn, NY 11201, USA","18","BERGEN STREET",,"Books/Media, Household Furniture/Furnishings, Kitchen Items, Toys/Games",,,"Monday Closed, Tuesday 11:00 AM-06:00 PM, Wednesday 11:00 AM-06:00 PM, Thursday 11:00 AM-06:00 PM, Friday 11:00 AM-06:00 PM, Saturday 11:00 AM-06:00 PM, Sunday 11:00 AM-06:00 PM","http://www.forkandpencil.com/","(718) 488-8855","noemail@email.com",,"302","33","69","3003840016","3005722","40.687405","-73.992748","084","POINT (-73.9927479996215 40.6874049998441)"
"BRONX","Longwood","Thessalonia Baptist Church","941 Rev James A Polite Ave, Bronx, NY 10459, USA","941","REV JAMES A POLITE AVENUE","Food/Beverage","Food/Beverage","Food pantry Tue: 9 AM - 12 PM. Call ahead to schedule donation drop-off.",,"Friday 9:00 AM-5:00 PM, Thursday 9:00 AM-5:00 PM, Wednesday 9:00 AM-5:00 PM, Tuesday 9:00 AM-5:00 PM, Monday 9:00 AM-5:00 PM, Sunday Closed, Wednesday 09:00 AM-05:00 PM, Friday 09:00 AM-05:00 PM, Thursday 09:00 AM-05:00 PM, Saturday Closed, Tuesday 09:00",,"(718) 542-0828","mangelcumi3@aol.com",,"202","17","12901","2026900160","2086531","40.822219","-73.899147","041","POINT (-73.899146999935 40.8222189998102)"
"BROOKLYN","Bay Ridge","The Salvation Army","6822 3rd Avenue, Brooklyn, NY, USA","6822","3 AVENUE","Household Furniture/Furnishings, Musical Instruments, Footwear, Sports Equipment, Toys/Games, Appliances, Books/Media, Electronics, Kitchen Items, Clothing/Personal Accessories","Household Furniture/Furnishings, Musical Instruments, Footwear, Sports Equipment, Toys/Games, Appliances, Books/Media, Electronics, Kitchen Items, Clothing/Personal Accessories","For pick-up please call 1-800-728-7825","Pickup","Monday 10:00 AM-7:00 PM, Tuesday 10:00 AM-7:00 PM, Wednesday 10:00 AM-7:00 PM, Thursday 10:00 AM-7:00 PM, Friday 10:00 AM-7:00 PM, Saturday 10:00 AM-7:00 PM, Sunday 10:00 AM-7:00 PM","http://ny.salvationarmy.org/GreaterNewYork","(718) 833-6894","Donations@salvationarmyusa.org","Partner","310","43","68","3058620050","3145151","40.636194","-74.026067","068","POINT (-74.0260670000929 40.6361939998564)"
"BROOKLYN","North Side-South Side","Spoonbill & Sugartown, Booksellers","218 Bedford Avenue, Brooklyn, NY 11249, USA","218","BEDFORD AVENUE",,"Books/Media",,,"Monday 10:00 AM-10:00 PM, Tuesday 10:00 AM-10:00 PM, Wednesday 10:00 AM-10:00 PM, Thursday 10:00 AM-10:00 PM, Friday 10:00 AM-10:00 PM, Saturday 10:00 AM-10:00 PM, Sunday 10:00 AM-10:00 PM","http://www.spoonbillbooks.com","(718) 387-7322","sugar@spoonbillbooks.com",,"301","33","553","3023430012","3062307","40.716641","-73.959269","094","POINT (-73.9592689998654 40.7166409999853)"
"BROOKLYN","Bedford","Northeast Brooklyn Housing DC","376 Throop Ave, Brooklyn, NY 11221, USA","376","THROOP AVENUE","Food/Beverage","Food/Beverage","Call ahead to schedule a drop-off outside food pantry hours. Last meal ticket issued at 11:30am on Tues and Thurs 10am-12pm.",,"Monday Closed, Tuesday 10:00 AM-12:00 PM, Wednesday Closed, Thursday 10:00 AM-12:00 PM, Friday Closed, Saturday Closed, Sunday Closed",,"(718) 453-2444","aash@nebhdco.org",,"303","36","261","3017860038","3049834","40.691306","-73.942902","079","POINT (-73.9429019996286 40.6913059998752)"
"MANHATTAN","Midtown-Midtown South","Furnish Green","1261 Broadway, New York, NY 10001, USA","1261","BROADWAY",,"Clothing/Personal Accessories, Electronics, Household Furniture/Furnishings, Kitchen Items","We offer local furniture delivery, but we do not pickup or accept donations.",,"Monday 10:00 AM-08:00 PM, Tuesday 10:00 AM-08:00 PM, Wednesday 10:00 AM-08:00 PM, Thursday 10:00 AM-08:00 PM, Friday 10:00 AM-08:00 PM, Saturday 10:00 AM-06:00 PM, Sunday Closed","http://furnishgreen.com","(917) 583-9051","furnishgreen@gmail.com",,"105","03","76","1008330006","1015803","40.747934","-73.988569","014","POINT (-73.9885690002601 40.7479339996576)"
"MANHATTAN","East Village","Metropolis Vintage","43 3rd Avenue, New York, NY 10003, USA","43","3 AVENUE",,"Clothing/Personal Accessories, Footwear","Donations not accepted",,"Monday 12:00 PM-7:00 PM, Tuesday 12:00 PM-7:00 PM, Wednesday 12:00 PM-7:00 PM, Thursday 12:00 PM-7:00 PM, Friday 12:00 PM-7:00 PM, Saturday 12:00 PM-7:00 PM, Sunday 12:00 PM-7:00 PM","http://www.metropolisvintageonline.com","(212) 358-0795","metropolisvintage@gmail.com",,"103","02","40","1004650001","1006764","40.730475","-73.988972","009","POINT (-73.9889719999588 40.7304750003242)"
"MANHATTAN","West Village","Drop-Off Box","208 West 13th Street, New York, NY, USA","208","WEST   13 STREET","HealthCare",,"Sends FedEx prepaid label for old medications donations by mail to 131 Varick St. Drop-off box is the Lesbian and Gay Community Center 208 West 13th st.  Call to arrange donation. All five boroughs does pickup.","Pickup","Monday 09:00 AM-05:00 PM, Tuesday 09:00 AM-05:00 PM, Wednesday 09:00 AM-05:00 PM, Thursday 09:00 AM-05:00 PM, Friday 09:00 AM-05:00 PM, Saturday Closed, Sunday Closed","https://aidforaids.org/hiv-recycling-program/","(212) 337-8043","jaguais@aidforaids.org",,"102","03","77","1006170047","1067571","40.738087","-74.001046","006","POINT (-74.0010460000738 40.7380869997185)"
"BROOKLYN","DUMBO-Vinegar Hill-Downtown Brooklyn-Boerum Hill","MYUNIQUE Brooklyn","408 Fulton Street, Brooklyn, NY 11201, USA","408","FULTON STREET",,"Books/Media, Clothing/Personal Accessories, Electronics, Kitchen Items, Footwear, Toys/Games",,,"Monday 10:00 AM-08:00 PM, Tuesday 10:00 AM-08:00 PM, Wednesday 10:00 AM-08:00 PM, Thursday 10:00 AM-08:00 PM, Friday 10:00 AM-08:00 PM, Saturday 10:00 AM-08:00 PM, Sunday 11:00 AM-05:00 PM","http://myunique.com","(718) 643-1825","noemail@email.com",,"302","33","37","3001560012","3000441","40.689382","-73.981557","084","POINT (-73.9815569997567 40.6893820001824)"
