"MANHATTAN","Upper West Side","Food Pantry","207 W 96th St, New York, NY 10025, USA","207","WEST   96 STREET","Books/Media, Clothing/Personal Accessories, Electronics, Food/Beverage, Appliances, Household Furniture/Furnishings, Kitchen Items, Musical Instruments, Office Furniture/Furnishings, Office Supplies/Stationary, Footwear, Sports Equipment, Toys/Games","Books/Media, Clothing/Personal Accessories, Electronics, Food/Beverage, Household Furniture/Furnishings, Kitchen Items, Sports Equipment, Toys/Games","Hours of operation and donation drop off for the Thrift Store, Food Pantry and Sandwich Line are listed in their respective listing. The food pantry serves residents within the following zip codes: 10023, 10024, 10025, 10026.",,"Monday 11:00 AM-3:00 PM, Tuesday Closed, Wednesday Closed, Thursday Closed, Friday Closed, Saturday Closed, Sunday Closed, Monday 9:00 AM-5:00 PM, Tuesday 9:00 AM-5:00 PM, Wednesday 9:00 AM-5:00 PM, Thursday 9:00 AM-5:00 PM, Friday 9:00 AM-5:00 PM, Satur","http://fccnyc.org/thriftshop/","(212) 932-8040","mortega@fccnyc.org",,"107","07","183","1018680124","1056067","40.794463","-73.970606","024","POINT (-73.9706060001678 40.794462999571)"
"MANHATTAN","East Village","East Village Books","99 Saint Marks Place, New York, NY 10009, USA","99","SAINT MARKS PLACE","Books/Media","Books/Media",,,"Monday 01:00 PM-10:00 PM, Tuesday 01:00 PM-10:00 PM, Wednesday 01:00 PM-10:00 PM, Thursday 01:00 PM-10:00 PM, Friday 01:00 PM-10:00 PM, Saturday 01:00 PM-10:00 PM, Sunday 01:00 PM-10:00 PM","http://www.buyusedbooksnewyork.com","(212) 477-8647","eastvillagebooksny@aol.com",,"103","02","32","1004360052","1077650","40.727451","-73.984449","009","POINT (-73.9844490000223 40.7274510002667)"
"MANHATTAN","Marble Hill-Inwood","Lebron Restaurant","3835 9th Avenue, New York, NY 10034, USA","3835","9 AVENUE",,"Appliances, Kitchen Items","Does not accept donations of used restaurant equipment.",,"Monday 09:00 AM-5:00 PM, Tuesday 09:00 AM-5:00 PM, Wednesday 09:00 AM-5:00 PM, Thursday 09:00 AM-5:00 PM, Friday 09:00 AM-5:00 PM, Saturday 09:00 AM-5:00 PM, Sunday Closed","https://www.lebronrestaurantsupplier.com/","(212) 942-8258","info@lebronrestaurantsupply.com",,"112","10","299","1021860001","1064481","40.862597","-73.91752","034","POINT (-73.917520000049 40.8625970002546)"
"QUEENS","Hunters Point-Sunnyside-West Maspeth","St. Teresa (Catholic Charities)","50-20 45th St, Woodside, NY 11377, USA","50-20","45 STREET","Clothing/Personal Accessories, Food/Beverage, Footwear","Food/Beverage","Food pantry Tuesday 6 p.m. - 7 p.m. Open: Mon-Fri betw 8am-12pm. Call to schedule food donation drop-off. Accept donations of clothing, shoes, bin outside in the parking lot. We send to Society of St Vincent De Paul in Brooklyn for distribution.",,"Monday 08:00 AM-12:00 PM, Tuesday 06:00 PM-07:00 PM, Wednesday 08:00 AM-12:00 PM, Thursday 08:00 AM-12:00 PM, Friday 08:00 AM-12:00 PM, Saturday Closed, Sunday Closed",,"(718) 784-2123","JENNIFER.SMITH@ccbq.org",,"402","26","187","4022940050","4053169","40.737333","-73.921332","108","POINT (-73.9213319995731 40.7373330000212)"
"MANHATTAN","Hamilton Heights","Convent Avenue Baptist Church","420 W 145th St, New York, NY 10031, USA","420","WEST  145 STREET","Clothing/Personal Accessories, Food/Beverage","Clothing/Personal Accessories, Food/Beverage","Pantry is open to the neighborhood Mondays and Thursdays from 9:30a.m.to 12:00 noon. Call before making food or clothing donation drop-off.",,"Friday 9:00 AM-5:00 PM, Thursday 9:00 AM-5:00 PM, Wednesday 9:00 AM-5:00 PM, Tuesday 9:00 AM-5:00 PM, Monday 9:00 AM-5:00 PM, Sunday Closed, Wednesday Closed, Friday Closed, Thursday 9:30 AM-12:00 PM, Saturday 9:00 AM-5:00 PM, Tuesday Closed, Monday 9:30",,"(212) 234-6767","contactcabc@conventchurch.org",,"109","07","227","1020500042","1060948","40.824318","-73.946039","030","POINT (-73.9460390004005 40.8243180003786)"
"BROOKLYN","Georgetown-Marine Park-Bergen Beach-Mill Basin","Mizrahi Bookstore","3114 Quentin Rd, Brooklyn, NY 11234, USA","3114","QUENTIN ROAD",,"Books/Media",,,"Monday 10:00 AM-06:30 PM, Tuesday 10:00 AM-06:30 PM, Wednesday 10:00 AM-06:30 PM, Thursday 10:00 AM-06:30 PM, Friday 10:00 AM-02:00 PM, Saturday Closed, Sunday 10:00 AM-06:30 PM",,"(347) 492-6508","bluebirds15@yahoo.com",,"318","46","640","3077140044","3212718","40.612441","-73.939805","063","POINT (-73.9398049998019 40.6124409998555)"
,,"ACS Asian Initiatives - Flushing, NY (American Cancer Society)","Business has no physical store",,,"Automotive",,"Accepts cars, motorcycles, RVs, boats on trailers, etc. Has offices in Manhattan, Brooklyn, Bronx, Flushing, Staten Island. Fill out our easy-to-use online car donation form or call us 1-888-227-5500.","Pickup","Monday 9:00 AM-5:00 PM, Tuesday 9:00 AM-5:00 PM, Wednesday 9:00 AM-5:00 PM, Thursday 9:00 AM-5:00 PM, Friday 9:00 AM-5:00 PM, Saturday 9:00 AM-5:00 PM, Sunday 9:00 AM-5:00 PM","https://www.cancer.org/involved/donate/more-ways-to-give/cars-for-a-cure.html","(888) 227-5500","none@email.com",,,,,,,"40.769902","-73.827203",,"POINT (-73.8272029998196 40.7699020000805)"
"QUEENS","Jamaica","MYUNIQUE Jamaica","162-10 Jamaica Ave, Jamaica, NY 11432, USA","162-10","JAMAICA AVENUE",,"Books/Media, Clothing/Personal Accessories, Electronics, Kitchen Items, Footwear, Toys/Games",,,"Monday 09:00 AM-08:00 PM, Tuesday 09:00 AM-08:00 PM, Wednesday 09:00 AM-08:00 PM, Thursday 09:00 AM-08:00 PM, Friday 09:00 AM-08:00 PM, Saturday 09:00 AM-08:00 PM, Sunday 10:00 AM-07:00 PM","http://myunique.com","(347) 901-5750","noemail@email.com",,"412","27","44601","4101020004","4215623","40.704084","-73.797149","103","POINT (-73.7971489997275 40.7040840000797)"
"QUEENS","Forest Hills","Bagriculture","71-63 Austin St, Flushing, NY 11375, USA","71-63","AUSTIN STREET",,"Clothing/Personal Accessories, Footwear","Only for Designer goods over $10,000 in value. For arrangement call 917-650-7249","Pickup","Monday 11:30 AM-09:00 PM, Tuesday 11:30 AM-09:00 PM, Wednesday 11:30 AM-09:00 PM, Thursday 11:30 AM-09:00 PM, Friday 11:30 AM-10:00 PM, Saturday 11:30 AM-10:00 PM, Sunday 11:30 AM-09:00 PM","https://thebagriculture.com/","(917) 650-7249","bagriculture2014@gmail.com",,"406","29","737","4032570024","4078009","40.719577","-73.842653","112","POINT (-73.8426530000369 40.719576999582)"
"BROOKLYN","Stuyvesant Heights","Bridge Street AME","277 Stuyvesant Avenue, Brooklyn, NY 11221, USA","277","STUYVESANT AVENUE","Clothing/Personal Accessories, Footwear, Toys/Games, Personal Care/Hygiene","Clothing/Personal Accessories, Food/Beverage, Footwear, Toys/Games, Personal Care/Hygiene","Program pantry is open to the public Wednesdays 7am-2pm. Church office hours are Mon-Thurs 9am-4pm.",,"Friday 9:00 AM-4:00 PM, Thursday 9:00 AM-4:00 PM, Wednesday 9:00 AM-4:00 PM, Tuesday 9:00 AM-4:00 PM, Monday 9:00 AM-4:00 PM, Sunday Closed, Wednesday 07:00 AM-2:00 PM, Friday Closed, Thursday Closed, Saturday Closed, Tuesday Closed, Monday Closed, Satur","http://www.bridgestreetbrooklyn.org/","(718) 452-3936","bridgestreetpantry@gmail.com",,"303","36","295","3016560005","3045802","40.685128","-73.932181","081","POINT (-73.9321809998542 40.6851280000603)"
"BROOKLYN","Flatbush","CAMBA","1720 Church Ave, Brooklyn, NY 11226, USA","1720","CHURCH AVENUE","Books/Media, Clothing/Personal Accessories, Footwear, Toys/Games","Books/Media, Clothing/Personal Accessories, Footwear, Toys/Games","Main office: Open 9am-5 M-F. We have 8 locations of shelters in our network, each has its own hours. Most are 7 days a week. If walk-in not listed, call ahead.",,"Monday 09:00 AM-05:00 PM, Tuesday 09:00 AM-05:00 PM, Wednesday 09:00 AM-05:00 PM, Thursday 09:00 AM-05:00 PM, Friday 09:00 AM-05:00 PM, Saturday Closed, Sunday Closed","https://www.camba.org/","(718) 287-2600","info@camba.org",,"314","40","512","3050970085","3341487","40.649091","-73.96337","070","POINT (-73.9633700001264 40.6490910001528)"
"MANHATTAN","East Harlem South","Manhattan","8 East 109th Street, New York, NY 10029, USA","8","EAST  109 STREET","Food/Beverage","Food/Beverage","Accepts donations of healthy food ONLY, including fruit, vegetables, grains, as well as prepared foods.To register for pantry go to Help 365 window between 9:00am ? 6:00pm Monday through Saturday and 2:00pm ? 6:00pm on Sundays and holidays.",,"Saturday 09:00 AM-3:00 PM, Friday 09:00 AM-4:00 PM, Thursday 09:00 AM-4:00 PM, Wednesday 09:00 AM-4:00 PM, Tuesday 09:00 AM-4:00 PM, Monday 09:00 AM-4:00 PM, Sunday 02:00 PM-4:00 PM","http://nycommonpantry.org","(917) 720-9700","foodrescue@nycommonpantry.org","Partner","111","09","17401","1016140066","1051594","40.795809","-73.949236","023","POINT (-73.9492360003421 40.7958089995888)"
"MANHATTAN","Clinton","Olde Good Things","333 W 52nd St, New York, NY 10019, USA","333","WEST   52 STREET",,"Building Products, Household Furniture/Furnishings, Kitchen Items","https://ogtstore.com/ogt-purchasing/","Pickup","Monday 10:00 AM-5:30 PM, Tuesday 10:00 AM-5:30 PM, Wednesday 10:00 AM-5:30 PM, Thursday 10:00 AM-5:30 PM, Friday 10:00 AM-5:30 PM, Saturday 10:00 AM-5:30 PM, Sunday Closed","http://ogtstore.com","(212) 989-8814","mail@oldegoodthings.com",,"104","03","133","1010430013","1025240","40.764373","-73.98663","018","POINT (-73.9866299998756 40.7643729996174)"
"QUEENS","Queensbridge-Ravenswood-Long Island City","The 4th Bin","9-20 35th Ave, Queens, NY 11106, USA","9-20","35 AVENUE","Electronics",,,,"Monday 09:00 PM-05:00 PM, Tuesday 09:00 PM-05:00 PM, Wednesday 09:00 PM-05:00 PM, Thursday 09:00 PM-05:00 PM, Friday 09:00 PM-05:00 PM, Saturday Closed, Sunday Closed","https://www.4thbin.com/","(646) 747-5985","ecyclenow@4thbin.com",,"401","26","39","4003290018","4003935","40.763142","-73.940292","114","POINT (-73.9402919997769 40.7631420004062)"
"STATEN IS","Port Richmond","COJO","984 Post Avenue, Staten Island, NY 10302, USA","984","POST AVENUE","Food/Beverage","Food/Beverage","Accept donations of nonperishable and canned food, as well as fresh produce. Do not accept donations of prepared food.",,"Monday Closed, Tuesday Closed, Wednesday 10:00 AM-02:00 PM, Thursday Closed, Friday Closed, Saturday Closed, Sunday Closed","http://www.cojosi.com","(718) 720-4047","info@cojosi.org",,"501","49","213","5010330028","5106984","40.632243","-74.133571","121","POINT (-74.1335709997029 40.6322430002175)"
"BRONX","Fordham South","Creston Avenue Baptist Church","114 East 188th Street, Bronx, NY 10468, USA","114","EAST  188 STREET","Food/Beverage","Food/Beverage","Accepts donations of canned and boxed food that is unopened and unexpired.",,"Monday 09:00 AM-05:00 PM, Tuesday 09:00 AM-05:00 PM, Wednesday 09:00 AM-05:00 PM, Thursday 09:00 AM-05:00 PM, Friday 09:00 AM-05:00 PM, Saturday 09:00 AM-05:00 PM, Sunday 09:00 AM-05:00 PM","https://www.facebook.com/Baptist114/","(718) 367-1754","crestonabc@hotmail.com",,"205","14","23703","2031730036","2013909","40.861678","-73.899134","046","POINT (-73.8991340002349 40.8616780001428)"
"MANHATTAN","East Village","WPA East Village","110 2nd Avenue, New York, NY 10003, USA","110","2 AVENUE","Arts/Crafts, Automotive, Building Products, Electronics, Food/Beverage, Appliances, Household Furniture/Furnishings, Kitchen Items, Musical Instruments, Office Furniture/Furnishings, Office Supplies/Stationary, Toys/Games",,,,"Sunday 09:00 AM-05:00 PM, Saturday 09:00 AM-05:00 PM, Friday 09:00 AM-05:00 PM, Thursday 09:00 AM-05:00 PM, Wednesday 09:00 AM-05:00 PM, Tuesday 09:00 AM-05:00 PM, Monday 09:00 AM-05:00 PM",,"(646) 292-7740","jsingleton@wpaonline.org",,"103","02","38","1004480004","1006264","40.72758","-73.988076","009","POINT (-73.9880760000084 40.7275799999203)"
"STATEN IS","Mariner's Harbor-Arlington-Port Ivory-Graniteville","Staten Island Family Empowerment Project","2958 Richmond Terrace, Staten Island, NY, USA","2958","RICHMOND TERRACE","Arts/Crafts, Automotive, Books/Media, Building Products, Clothing/Personal Accessories, Electronics, Food/Beverage, Appliances, Household Furniture/Furnishings, Kitchen Items, HealthCare, Musical Instruments, Office Furniture/Furnishings, Office Supplies","Arts/Crafts, Books/Media, Clothing/Personal Accessories, Electronics, Food/Beverage, Appliances, Household Furniture/Furnishings, Kitchen Items, HealthCare, Musical Instruments, Footwear, Sports Equipment, Toys/Games, Baby Care, Camping/Outdoor Equipment",,"Pickup","Sunday Closed, Saturday Closed, Friday 9:00 AM-5:00 PM, Thursday 9:00 AM-5:00 PM, Wednesday 9:00 AM-5:00 PM, Tuesday 9:00 AM-5:00 PM, Monday 9:00 AM-5:00 PM","http://northshorelc.org","(929) 482-4264","wewal75@yahoo.com",,"501","49","223","5012240013","5027697","40.636649","-74.158654","121","POINT (-74.1586539998832 40.6366490001545)"
"MANHATTAN","Hudson Yards-Chelsea-Flatiron-Union Square","Miju Sewing","306 West 37th Street, New York, NY 10018, USA","306","WEST   37 STREET",,"Electronics",,,"Monday 08:00 AM-06:30 PM, Tuesday 08:00 AM-06:30 PM, Wednesday 08:00 AM-06:30 PM, Thursday 08:00 AM-06:30 PM, Friday 08:00 AM-06:30 PM, Saturday 08:00 AM-05:00 PM, Sunday Closed",,"(212) 695-7122","mijusewing@hotmail.com",,"104","03","111","1007600032","1013596","40.754137","-73.992785","014","POINT (-73.9927850004284 40.754136999726)"
"BROOKLYN","Park Slope-Gowanus","Beacon's Closet","92 5th Ave, Brooklyn, NY 11217, USA","92","5 AVENUE",,"Clothing/Personal Accessories, Footwear","We buy, sell, and trade vintage and modern clothing, shoes and accessories, with the public. We buy 7 days a week with no appointments, walk on in.  Our buying counter closes 1/2 hour before store closing.",,"Friday 12:00 PM-9:00 PM, Monday 12:00 PM-9:00 PM, Tuesday 12:00 PM-9:00 PM, Wednesday 12:00 PM-9:00 PM, Thursday 12:00 PM-9:00 PM, Saturday 11:00 AM-08:00 PM, Sunday 11:00 AM-08:00 PM","http://beaconscloset.com","(718) 230-1630","service@beaconscloset.com",,"306","39","12901","3009370038","3018817","40.680212","-73.978205","078","POINT (-73.9782049998618 40.680211999987)"
"MANHATTAN","Yorkville","Manhattan Stuyvesant Store","1704 2nd Avenue, New York, NY 10128, USA","1704","2 AVENUE","Arts/Crafts, Automotive, Books/Media, Clothing/Personal Accessories, Electronics, Kitchen Items, HealthCare, Musical Instruments, Footwear, Sports Equipment, Toys/Games, Lawn/Garden Supplies, Office Supplies/Stationary, Storage/Haulage Containers, Tools/","Arts/Crafts, Books/Media, Clothing/Personal Accessories, Electronics, Kitchen Items, HealthCare, Musical Instruments, Footwear, Sports Equipment, Toys/Games, Lawn/Garden Supplies, Office Supplies/Stationary, Storage/Haulage Containers, Tools/Equipment","Donations accepted at all stores/donation centers during business hours. Pick up service available depending on volume, schedule and type of donation. Please contact the donations department at (718) 777-6320 or donations.department@goodwillnynj.org.","Pickup","Sunday 11:00 AM-7:00 PM, Saturday 11:00 AM-7:00 PM, Friday 11:00 AM-7:00 PM, Wednesday 11:00 AM-7:00 PM, Tuesday 11:00 AM-7:00 PM, Monday 11:00 AM-7:00 PM, Thursday 11:00 AM-7:00 PM","http://goodwillnynj.org","(212) 831-1830","info@goodwillnynj.org","Partner","108","05","14602","1015510003","1050067","40.77929","-73.950257","019","POINT (-73.9502569997617 40.7792900004364)"
"BROOKLYN","Greenpoint","The Thing","1001 Manhattan Avenue, Brooklyn, NY 11222, USA","1001","MANHATTAN AVENUE",,"Books/Media, Clothing/Personal Accessories, Household Furniture/Furnishings, Kitchen Items, Footwear",,,"Monday 11:00 AM-07:00 PM, Tuesday 11:00 AM-07:00 PM, Wednesday 11:00 AM-07:00 PM, Thursday 11:00 AM-07:00 PM, Friday 11:00 AM-07:00 PM, Saturday 11:00 AM-07:00 PM, Sunday 11:00 AM-07:00 PM",,"(718) 349-8234","noemail@email.com",,"301","33","563","3025220045","3064148","40.733265","-73.954976","094","POINT (-73.9549759997435 40.7332650003827)"
"MANHATTAN","Gramercy","Gramercy Thrift Shop","157 East 23rd Street, New York, NY 10010, USA","157","EAST   23 STREET","Books/Media, Clothing/Personal Accessories, Household Furniture/Furnishings, Kitchen Items, Footwear, Arts/Crafts, Musical Instruments, Office Furniture/Furnishings","Books/Media, Clothing/Personal Accessories, Household Furniture/Furnishings, Kitchen Items, Footwear, Arts/Crafts, Musical Instruments, Office Furniture/Furnishings","Drop off your clothing, shoes, books, artwork, jewelry, and housewares at any of our Thrift Shops during our open business hours. We offer furniture pick-ups for a fee. Please call 1-888-HW-DONATE (1-888-493-6628).",,"Tuesday 11:00 AM-07:00 PM, Sunday 12:00 PM-05:00 PM, Saturday 11:00 AM-07:00 PM, Thursday 11:00 AM-07:00 PM, Wednesday 11:00 AM-07:00 PM, Monday 11:00 AM-07:00 PM, Friday 11:00 AM-07:00 PM","https://www.housingworks.org/","(212) 529-5955","info@housingworks.org","Partner","106","02","68","1008790033","1018046","40.739309","-73.98356","013","POINT (-73.9835600003947 40.7393090003133)"
"BROOKLYN","Prospect Lefferts Gardens-Wingate","Record City","65 Fenimore Street, Brooklyn, NY 11225, USA","65","FENIMORE STREET",,"Books/Media",,,"Monday Closed, Tuesday Closed, Wednesday Closed, Thursday Closed, Friday 12:00 PM-08:00 PM, Saturday 12:00 PM-08:00 PM, Sunday 12:00 PM-08:00 PM",,"(718) 618-7650","recordcitybk@gmail.com",,"309","40","79801","3050370001","3115281","40.658196","-73.960104","071","POINT (-73.9601039997008 40.6581960000486)"
"BROOKLYN","Georgetown-Marine Park-Bergen Beach-Mill Basin","Ruth's Place Antiques","1410 East 64th Street, Brooklyn, NY 11234, USA","1410","EAST   64 STREET",,"Household Furniture/Furnishings, Kitchen Items",,,"Monday Closed, Tuesday Closed, Wednesday Closed, Thursday 10:00 AM-05:00 PM, Friday 10:00 AM-05:00 PM, Saturday 10:00 AM-05:00 PM, Sunday 11:00 AM-04:00 PM",,"(718) 241-8700","ruthtow@icloud.com",,"318","46","698","3083850052","3236378","40.619292","-73.915726","063","POINT (-73.9157260000558 40.6192920001289)"
"QUEENS","Richmond Hill","Crossover Baptist","85-12 101st St, Richmond Hill, NY 11418, USA","85-12","101 STREET","Arts/Crafts, Books/Media, Clothing/Personal Accessories, Electronics, Food/Beverage, Appliances, Household Furniture/Furnishings, Kitchen Items, Musical Instruments, Office Furniture/Furnishings, Office Supplies/Stationary, Footwear, Sports Equipment, To","Arts/Crafts, Books/Media, Clothing/Personal Accessories, Electronics, Food/Beverage, Appliances, Household Furniture/Furnishings, Kitchen Items, Musical Instruments, Office Furniture/Furnishings, Office Supplies/Stationary, Footwear, Sports Equipment, To","Pickups vary upon request. Call (718) 322-1200 Outreach number, leave a voicemail for donation dropoffs.  Pantry: Every Friday 9am-12pm. Every other Sunday betw 1pm-3pm (2nd and 4th Sunday of every month).","Pickup","Friday 10:00 AM-5:00 PM, Thursday 10:00 AM-5:00 PM, Wednesday 10:00 AM-5:00 PM, Tuesday 10:00 AM-5:00 PM, Monday Closed, Sunday 01:00 PM-03:00 PM, Wednesday Closed, Friday 9:00 AM-12:00 PM, Thursday Closed, Saturday Closed, Tuesday Closed, Monday Closed,","https://www.hungervolunteer.org/hv/hunger-organization/3784","(718) 322-1200","crossoverbc358@yahoo.com",,"409","32","24","4091770023","4191297","40.696807","-73.84768","102","POINT (-73.8476799998331 40.6968069999463)"
"MANHATTAN","East Village","AuH2O","84 East 7th Street, New York, NY, USA","84","EAST    7 STREET",,"Clothing/Personal Accessories, Footwear",,,"Monday 12:00 PM-08:00 PM, Tuesday 12:00 PM-08:00 PM, Wednesday 12:00 PM-08:00 PM, Thursday 12:00 PM-08:00 PM, Friday 12:00 PM-08:00 PM, Saturday 12:00 PM-08:00 PM, Sunday 12:00 PM-08:00 PM",,"(212) 466-0844","auh20shop@gmail.com",,"103","02","38","1004480026","1006282","40.727017","-73.986286","009","POINT (-73.9862860001998 40.7270170000377)"
"BRONX","North Riverdale-Fieldston-Riverdale","Riverdale Y Sunday Market","4545 Independence Avenue, The Bronx, NY, USA","4545","INDEPENDENCE AVENUE","Clothing/Personal Accessories, Footwear",,"Pick-up service available on case-by-case basis for a minimum of 100 lbs. Farmer's market locations vary seasonally; check online to confirm dates of operation.","Pickup","Tuesday Closed, Monday Closed, Sunday 9:00 AM-2:00 PM, Saturday Closed, Friday Closed, Thursday Closed, Wednesday Closed","http://www.greentreetextiles.org/","(347) 262-4777","info@greentreetextiles.org","Partner","208","11","309","2059200456","2088698","40.89182","-73.912927","050","POINT (-73.9129269995823 40.8918199997963)"
"BROOKLYN","Cypress Hills-City Line","Dream Finds Thrift","333A Crescent Street, Brooklyn, NY 11208, USA","333A","CRESCENT STREET",,"Clothing/Personal Accessories, Footwear",,,"Monday 10:00 AM-08:00 PM, Tuesday 10:00 AM-08:00 PM, Wednesday 10:00 AM-08:00 PM, Thursday 10:00 AM-08:00 PM, Friday 10:00 AM-08:00 PM, Saturday 10:00 AM-08:00 PM, Sunday Closed",,"(718) 483-8234","noemail@email.com",,"305","37","1186","3041680009","3093470","40.680821","-73.871222","075","POINT (-73.8712219999963 40.6808210001922)"
"BROOKLYN","DUMBO-Vinegar Hill-Downtown Brooklyn-Boerum Hill","The HOPE Program (Professional Clothing Only)","1 Smith St, Brooklyn, NY 11201, USA","1","SMITH STREET","Clothing/Personal Accessories",,"Accepts gently used professional clothing only. Can drop off or call to arrange donation.",,"Monday 08:00 AM-07:00 PM, Tuesday 08:00 AM-06:00 PM, Wednesday 08:00 AM-07:00 PM, Thursday 08:00 AM-06:00 PM, Friday 08:00 AM-05:00 PM, Saturday Closed, Sunday Closed","http://www.thehopeprogram.org/","(347) 773-4623","sgreene@thehopeprogram.org",,"302","33","37","3001550010","3000438","40.691101","-73.987273","084","POINT (-73.98727299985 40.6911010003141)"
"BROOKLYN","East New York","Maribel's Clothing & Accessories","2301 Pitkin Avenue, Brooklyn, NY 11207, USA","2301","PITKIN AVENUE",,"Clothing/Personal Accessories, Footwear",,,"Monday 10:30 AM-06:00 PM, Tuesday 10:30 AM-06:00 PM, Wednesday 10:30 AM-06:00 PM, Thursday 10:30 AM-06:00 PM, Friday 10:30 AM-06:00 PM, Saturday 10:30 AM-06:00 PM, Sunday Closed",,"(347) 335-8616","noemail@email.com",,"305","37","1150","3039970035","3088842","40.673399","-73.887363","075","POINT (-73.8873629997036 40.6733989996673)"
"MANHATTAN","Central Harlem South","Outreach Ministry","41 W 124th St, New York, NY, USA","41","WEST  124 STREET","Clothing/Personal Accessories, Food/Beverage, Footwear, Personal Care/Hygiene","Clothing/Personal Accessories, Food/Beverage, Footwear, Personal Care/Hygiene","Call ahead and schedule appointment for donation drop-off. Preferably Fridays. Food pantry every Saturday and clothing distribution every 1st and 3rd Friday. Walk-ins welcome but bring your own bags/cart. Temporarily Closed Due to Pandemic",,"Monday Closed, Tuesday Closed, Wednesday Closed, Thursday Closed, Friday 09:00 AM-12:00 PM, Saturday 07:30 AM-11:00 AM, Sunday Closed, Monday 9:00 AM-5:00 PM, Tuesday 9:00 AM-5:00 PM, Wednesday 9:00 AM-5:00 PM, Thursday 9:00 AM-5:00 PM, Friday 9:00 AM-5:",,"(917) 974-8261","antiochangel@verizon.net",,"110","09","200","1017220019","1053455","40.80661","-73.944179","028","POINT (-73.9441790000618 40.8066100003544)"
"MANHATTAN","West Village","Reminiscence","74 5th Avenue, NY, New York 10011, USA","74","5 AVENUE",,"Clothing/Personal Accessories, Footwear, Toys/Games",,,"Monday 11:00 AM-08:00 PM, Tuesday 11:00 AM-08:00 PM, Wednesday 11:00 AM-08:00 PM, Thursday 11:00 AM-08:00 PM, Friday 11:00 AM-08:00 PM, Saturday 11:00 AM-08:00 PM, Sunday 12:00 PM-07:00 PM","http://reminiscence.com","(212) 243-2292","info@reminiscence.com",,"102","03","63","1005770042","1009719","40.735734","-73.994251","006","POINT (-73.9942509996849 40.7357340000273)"
"BRONX","Bronxdale","The Salvation Army","2441 Boston Road, Bronx, NY 10467, USA","2441","BOSTON ROAD","Household Furniture/Furnishings, Musical Instruments, Footwear, Sports Equipment, Toys/Games, Appliances, Books/Media, Electronics, Kitchen Items, Clothing/Personal Accessories","Household Furniture/Furnishings, Musical Instruments, Footwear, Sports Equipment, Toys/Games, Appliances, Books/Media, Electronics, Kitchen Items, Clothing/Personal Accessories","For pick-up please call 1-800-728-7825","Pickup","Saturday 10:00 AM-7:00 PM, Friday 10:00 AM-7:00 PM, Thursday 10:00 AM-7:00 PM, Wednesday 10:00 AM-7:00 PM, Tuesday 10:00 AM-7:00 PM, Monday 10:00 AM-7:00 PM, Sunday Closed","http://ny.salvationarmy.org/GreaterNewYork","(718) 325-5810","Donations@salvationarmyusa.org","Partner","211","15","330","2044300042","2051309","40.862181","-73.867175","049","POINT (-73.8671750004269 40.8621809999564)"
"BROOKLYN","East New York","Brooklyn Animal Care Center","2336, Linden Boulevard, New York, NY, 11208, USA","2336","LINDEN BOULEVARD","Automotive, Pet Care/Food, Appliances, Cleaning Products, Storage/Haulage Containers, Tools/Equipment",,"Accepts donations of bedding & linens, pet supplies, and unopened bags of pet food at Care/Admissions Centers. Email donate@nycacc.org about vehicle donation or go to http://www.v-dac.com/org?id=133788986.","Pickup","Friday 08:00 AM-08:00 PM, Monday 08:00 AM-08:00 PM, Tuesday 08:00 AM-08:00 PM, Wednesday 08:00 AM-08:00 PM, Thursday 08:00 AM-08:00 PM, Saturday 08:00 AM-08:00 PM, Sunday 08:00 AM-08:00 PM","http://www.nycacc.org/","(212) 788-4000","donate@nycacc.org","Partner","305","42","1116","3043630001","3097756","40.663706","-73.876505","075","POINT (-73.8765049999068 40.6637059996354)"
"QUEENS","South Jamaica","Allen Outreach Ministry","111-54 Merrick Boulevard, NY, New York 11433, USA","111-54","MERRICK BOULEVARD","Clothing/Personal Accessories, Food/Beverage, Personal Care/Hygiene","Clothing/Personal Accessories, Food/Beverage, Personal Care/Hygiene","Accepts donations of unexpired food.",,"Monday 09:00 AM-01:00 PM, Tuesday Closed, Wednesday Closed, Thursday 09:00 AM-01:00 PM, Friday Closed, Saturday Closed, Sunday Closed","http://allencathedral.org/allen-ame-outreach/","(718) 526-3510","noemail@email.com",,"412","27","266","4102080001","4217363","40.693478","-73.780558","113","POINT (-73.7805579999527 40.6934780002128)"
