"borough","ntaname","site","address","number","street","categoriesaccepted","categoriesavailable","additionalmaterialinformation","pickupstatus","hours","website","phone","email","partnerstatus","borocd","councildist","ct2010","bbl","bin","latitude","longitude","police_precinct","point_1"
"MANHATTAN","Murray Hill-Kips Bay","Tropicalfete","295 Madison Avenue, New York, NY 10017, USA","295","MADISON AVENUE","Arts/Crafts, Automotive, Electronics, Food/Beverage, Musical Instruments, Sports Equipment, Tools/Equipment","Arts/Crafts, Automotive, Electronics, Food/Beverage, Musical Instruments",,"Pickup","Monday Closed, Tuesday Closed, Wednesday Closed, Thursday Closed, Friday Closed, Saturday 11:00 AM-05:00 PM, Sunday Closed","http://tropicalfete.com","(646) 504-3383","alton@tropicalfete.com",,"105","04","82","1012750050","1035321","40.751861","-73.979473","014","POINT (-73.97947299988 40.7518609999884)"
"QUEENS","Flushing","Flushing Food Pantry","14032 Cherry Ave, NY, New York 11355, USA","140-32","CHERRY AVENUE","Food/Beverage","Food/Beverage","Food Pantry available for walk-ins, every Wednesday 12pm-2pm.",,"Monday Closed, Tuesday Closed, Wednesday 12:00 PM-02:00 PM, Thursday Closed, Friday Closed, Saturday Closed, Sunday Closed","https://www.icnarelief.org/wp/index.php/new-york/","(929) 329-7986","manwar@icnarelief.org",,"407","20","859","4051927504","4540148","40.754394","-73.821624","109","POINT (-73.8216239997488 40.7543939998864)"
"BROOKLYN","Erasmus","Beyond Hunger","21 Snyder Avenue, Brooklyn, NY, USA","21","SNYDER AVENUE","Food/Beverage","Food/Beverage","Items Accepted: Non-perishable Food. Please call first to arrange your donation.",,"Monday Closed, Tuesday 10:00 AM-01:00 PM, Wednesday Closed, Thursday 10:00 AM-01:00 PM, Friday Closed, Saturday Closed, Sunday Closed","https://www.camba.org/Pages/support/In-Kind-Donations.aspx","(718) 282-3082","janetm@camba.org",,"314","40","794","3051030008","3117220","40.648752","-73.957267","070","POINT (-73.9572670001729 40.6487519998081)"
"BROOKLYN","Bedford","St. Stephen Outreach Community","874 Myrtle Ave, Brooklyn, NY 11206, USA","874","MYRTLE AVENUE","Clothing/Personal Accessories, Food/Beverage, Footwear","Clothing/Personal Accessories, Food/Beverage, Footwear","Call to schedule drop-off donation.",,"Friday 9:00 AM-5:00 PM, Thursday 9:00 AM-5:00 PM, Wednesday 9:00 AM-5:00 PM, Tuesday 9:00 AM-5:00 PM, Monday 9:00 AM-5:00 PM, Sunday Closed, Wednesday 09:00 AM-10:30 AM, Friday 09:00 AM-10:30 AM, Thursday Closed, Saturday Closed, Tuesday Closed, Monday C",,"(718) 938-4532","sheilawilliams874@yahoo.com",,"303","36","25901","3017550032","3048641","40.695405","-73.947091","079","POINT (-73.9470910003504 40.6954050000439)"
"STATEN IS","West New Brighton-New Brighton-St. George","Clothing","17 Brook Street, Staten Island, NY 10301, USA","17","BROOK STREET",,"Clothing/Personal Accessories, Footwear",,,"Monday Closed, Tuesday 11:00 AM-06:30 PM, Wednesday 11:00 AM-06:30 PM, Thursday 11:00 AM-06:30 PM, Friday 11:00 AM-06:30 PM, Saturday 11:00 AM-06:30 PM, Sunday Closed","http://etgstores.com/clothing/index.html","(718) 273-7139","clothing@etgstores.com",,"501","49","11","5000230038","5000385","40.637406","-74.081209","120","POINT (-74.0812089996966 40.6374059999901)"
"BRONX","Bedford Park-Fordham North","Our Lady of Refuge Thrift","2845 Briggs Avenue, Bronx, NY 10458, USA","2845","BRIGGS AVENUE","Clothing/Personal Accessories, Kitchen Items, Footwear, Household Furniture/Furnishings","Clothing/Personal Accessories, Kitchen Items, Footwear, Household Furniture/Furnishings",,,"Monday Closed, Tuesday Closed, Wednesday Closed, Thursday Closed, Friday 11:00 AM-03:00 PM, Saturday 11:00 AM-03:00 PM, Sunday Closed",,"(718) 733-9026","noemail@email.com",,"207","15","40702","2033020072","2017109","40.869353","-73.888989","052","POINT (-73.8889890000433 40.8693529997443)"
"STATEN IS","Charleston-Richmond Valley-Tottenville","Totenville Thrift Shop","223 Main Street, Staten Island, NY, USA","223","MAIN STREET","Clothing/Personal Accessories, Kitchen Items, Footwear","Clothing/Personal Accessories, Kitchen Items, Footwear",,,"Monday 10:00 AM-04:00 PM, Tuesday 10:00 AM-04:00 PM, Wednesday 10:00 AM-04:00 PM, Thursday 10:00 AM-04:00 PM, Friday 10:00 AM-04:00 PM, Saturday 10:00 AM-04:00 PM, Sunday Closed","http://simhs.org/thrift-shops","(718) 984-7439","info@simhs.org",,"503","51","248",,,"40.509662","-74.247445","123","POINT (-74.2474449998878 40.5096619996048)"
"BROOKLYN","Park Slope-Gowanus","Record & Tape Center","439 5th Avenue, Brooklyn, NY 11215, USA","439","5 AVENUE",,"Books/Media, Electronics",,,"Monday 11:00 AM-05:30 PM, Tuesday 11:00 AM-10:00 PM, Wednesday 11:00 AM-05:30 PM, Thursday 11:00 AM-10:00 PM, Friday 11:00 AM-09:00 PM, Saturday 10:30 AM-10:00 PM, Sunday 11:00 AM-10:00 PM",,"(718) 499-8483","noemail@email.com",,"306","39","137","3010050001","3022111","40.669287","-73.986024","078","POINT (-73.9860239998087 40.6692869997984)"
"MANHATTAN","Midtown-Midtown South","Bottomless Closet","16, E. 52nd Street, New York, NY, 10022, USA","16","EAST   52 STREET","Clothing/Personal Accessories, Footwear","Clothing/Personal Accessories, Footwear","Please call ahead to ensure that your donation can be accepted. Professional clothing only.",,"Monday 09:00 AM-05:30 PM, Tuesday 09:00 AM-05:30 PM, Wednesday 09:00 AM-05:30 PM, Thursday 09:00 AM-05:30 PM, Friday Closed, Saturday Closed, Sunday Closed","http://www.bottomlesscloset.org/","(212) 563-2499","info@bottomlesscloset.org","Partner","105","04","102","1012870058","1035475","40.75915","-73.97534","018","POINT (-73.975339999942 40.7591499997759)"
"MANHATTAN","Battery Park City-Lower Manhattan","Center for Hearing and Communicaiton","50 Broadway, New York, NY, USA","50","BROADWAY","HealthCare",,"Walk-in donations of used Hearing Aids welcome, can also mail. Need Name and Address for tax receipt. Mail address: Center for Hearing and Communication, Donation 50 Broadway floor 6 10004",,"Monday 09:00 AM-05:00 PM, Tuesday 09:00 AM-05:00 PM, Wednesday 09:00 AM-05:00 PM, Thursday 09:00 AM-05:00 PM, Friday 09:00 AM-05:00 PM, Saturday Closed, Sunday Closed","http://chchearing.org/","(917) 305-7921","twilliams@chchearing.org",,"101","01","9","1000220024","1000813","40.706349","-74.012522","001","POINT (-74.0125219995916 40.7063490002095)"
"MANHATTAN","Lincoln Square","Westside Records","233 West 72nd Street, New York, NY 10023, USA","233","WEST   72 STREET",,"Books/Media",,,"Monday 11:00 AM-6:00 PM, Tuesday 11:00 AM-6:00 PM, Wednesday 11:00 AM-6:00 PM, Thursday 11:00 AM-6:00 PM, Friday 11:00 AM-6:00 PM, Saturday 11:00 AM-6:00 PM, Sunday 12:00 PM-06:00 PM","http://www.westsiderbooks.com/recordstore.html","(212) 874-1588","records@westsiderbooks.com",,"107","06","159","1011640019","1030516","40.779333","-73.982693","020","POINT (-73.9826929999829 40.7793329997214)"
"MANHATTAN","Midtown-Midtown South","The Alliance for Positive Change","64 West 35th Street, New York, NY 10001, USA","64","WEST   35 STREET","Clothing/Personal Accessories, Footwear, Personal Care/Hygiene",,"We accept new or gently worn clothing, shoes, and unopened toiletries that will stock ""hygiene kits"".",,"Monday 09:00 AM-05:00 PM, Tuesday 09:00 AM-05:00 PM, Wednesday 09:00 AM-05:00 PM, Thursday 09:00 AM-05:00 PM, Friday 09:00 AM-05:00 PM, Saturday Closed, Sunday Closed","http://alliance.nyc/","(212) 645-0875","ebony@alliance.nyc",,"105","04","76","1008360007","1015868","40.749979","-73.986751","014","POINT (-73.9867510000596 40.7499790004337)"
"MANHATTAN","Manhattanville","African Services Committee","429 W 127th St, New York, NY 10027, USA","429","WEST  127 STREET","Clothing/Personal Accessories, Food/Beverage, Footwear, Baby Care, Personal Care/Hygiene","Clothing/Personal Accessories, Food/Beverage, Footwear, Baby Care, Personal Care/Hygiene","Also accepts toiletries, personal hygiene, diapers, tampons, toothbrushes and NEW clothing.  Call anytime to arrange for donation drop-off. Pantry is open M-F 9am-5pm, initial referral required.",,"Monday 09:00 PM-05:00 PM, Tuesday 09:00 AM-05:00 PM, Wednesday 09:00 AM-05:00 PM, Thursday 09:00 AM-05:00 PM, Friday 09:00 AM-05:00 PM, Saturday Closed, Sunday Closed","http://www.africanservices.org/","(212) 222-3882","info@africanservices.org",,"109","07","21303","1019670060","1084104","40.813453","-73.954456","026","POINT (-73.9544560000453 40.813453000259)"
"BROOKLYN","North Side-South Side","Main Drag Music","330 Wythe Avenue, Brooklyn, NY 11249, USA","330","WYTHE AVENUE",,"Musical Instruments",,,"Monday 12:00 PM-08:00 PM, Tuesday 12:00 PM-08:00 PM, Wednesday 12:00 PM-08:00 PM, Thursday 12:00 PM-08:00 PM, Friday 12:00 PM-08:00 PM, Saturday 12:00 PM-08:00 PM, Sunday 12:00 PM-07:00 PM","http://maindragmusic.com","(718) 388-6365","info@maindragmusic.com",,"301","33","551","3024037501","3062888","40.714899","-73.965062","090","POINT (-73.9650619999123 40.7148989996923)"
"BROOKLYN","Canarsie","RCCG International Center Brooklyn","781 E 93rd St, Brooklyn, NY 11236, USA","781","EAST   93 STREET","Food/Beverage","Food/Beverage","Food pantry Tues-Friday 9am-4pm. Sat by appointment only. SAT food pantry 1-3pm. Call ahead for drop-off.",,"Monday Closed, Tuesday 09:00 AM-04:00 PM, Wednesday 09:00 AM-04:00 PM, Thursday 09:00 AM-04:00 PM, Friday 09:00 AM-04:00 PM, Saturday 01:00 PM-03:00 PM, Sunday Closed",,"(347) 955-4403","info@rccgbrooklyn.org",,"317","42","960","3081190047","3325406","40.649243","-73.911824","067","POINT (-73.9118239999786 40.6492429999677)"
"BROOKLYN","DUMBO-Vinegar Hill-Downtown Brooklyn-Boerum Hill","The Bike Truck","216 Hoyt Street, Brooklyn, NY 11217, USA","216","HOYT STREET","Sports Equipment","Sports Equipment","Will pick up on an case by case basis--call to discuss.",,"Monday 12:00 PM-08:00 PM, Tuesday 12:00 PM-08:00 PM, Wednesday 12:00 PM-08:00 PM, Thursday 12:00 PM-08:00 PM, Friday 12:00 PM-08:00 PM, Saturday 12:00 PM-08:00 PM, Sunday 12:00 PM-06:00 PM","http://www.thebiketruck.com/","(718) 596-3999","info@thebiketruck.com",,"306","33","69","3004030033","3341589","40.68374","-73.98995","076","POINT (-73.9899500000934 40.6837399999043)"
"BROOKLYN","Bushwick South","Beacon's Closet","23, Bogart St, New York, NY, 11206, USA","23","BOGART STREET",,"Clothing/Personal Accessories, Footwear","We buy, sell, and trade vintage and modern clothing, shoes and accessories, with the public. We buy 7 days a week with no appointments, walk on in.  Our buying counter closes 1/2 hour before store closing.",,"Friday 11:00 AM-08:00 PM, Thursday 11:00 AM-08:00 PM, Monday 11:00 AM-08:00 PM, Tuesday 11:00 AM-08:00 PM, Wednesday 11:00 AM-08:00 PM, Saturday 11:00 AM-08:00 PM, Sunday 11:00 AM-08:00 PM","http://beaconscloset.com","(718) 417-5683","service@beaconscloset.com",,"301","34","485","3031180017","3071586","40.704046","-73.933297","090","POINT (-73.9332970000575 40.704046000126)"
"BROOKLYN","North Side-South Side","Arbor Vitae Vintage Clothing","309 Bedford Ave, Brooklyn, NY 11211, USA","309","BEDFORD AVENUE",,"Clothing/Personal Accessories, Footwear",,,"Monday 12:00 PM-08:00 PM, Tuesday 12:00 PM-08:00 PM, Wednesday 12:00 PM-08:00 PM, Thursday 12:00 PM-08:00 PM, Friday 10:00 AM-09:00 PM, Saturday 10:00 AM-09:00 PM, Sunday 12:00 PM-08:00 PM","http://arborvitaevintage.com/","(864) 663-3463","arborvitaevintage@gmail.com",,"301","34","551","3024060001","3321275","40.71336","-73.961842","090","POINT (-73.9618419998094 40.7133599997674)"
"BROOKLYN","East Flatbush-Farragut","God's Battalion of Prayer","661 Linden Boulevard, Brooklyn, NY 11203, USA","661","LINDEN BOULEVARD","Food/Beverage","Food/Beverage","No expired foods. Drop-off during open hours.",,"Monday Closed, Tuesday 09:00 AM-01:00 PM, Wednesday Closed, Thursday 09:00 AM-01:00 PM, Friday Closed, Saturday Closed, Sunday Closed",,"(718) 774-5447","lcockfield@battalionministries.org",,"317","41","870","3048670025","3108481","40.653916","-73.933916","067","POINT (-73.9339159998245 40.6539159996269)"
"QUEENS","Woodside","Habitat NYC ReStore","62-01 Northern Blvd, Flushing, NY 11377, USA","62-01","NORTHERN BOULEVARD","Automotive, Building Products, Appliances, Household Furniture/Furnishings, Kitchen Items, Office Furniture/Furnishings, Camping/Outdoor Equipment, Lawn/Garden Supplies, Tools/Equipment","Building Products, Appliances, Household Furniture/Furnishings, Kitchen Items, Office Furniture/Furnishings, Camping/Outdoor Equipment, Lawn/Garden Supplies, Tools/Equipment","Pick-up on case-by-case basis. To donate, please submit photos of the donation item/items to restore@habitatnyc.org. See https://habitatnyc.org/restore/restore-donate/ for more information.","Pickup","Monday 10:00 AM-6:00 PM, Tuesday 10:00 AM-6:00 PM, Wednesday 10:00 AM-6:00 PM, Thursday 10:00 AM-6:00 PM, Friday 10:00 AM-6:00 PM, Saturday 10:00 AM-07:00 PM, Sunday 12:00 PM-06:00 PM","https://habitatnyc.org/restore","(646) 779-8852","Restore@habitatnyc.org","Partner","401","26","297","4011630074","4026208","40.754373","-73.900112","114","POINT (-73.9001120003695 40.7543729998173)"
"STATEN IS","Mariner's Harbor-Arlington-Port Ivory-Graniteville","Person Centered Care Services","150 Granite Ave, Staten Island, NY 10303, USA","150","GRANITE AVENUE","Arts/Crafts, Books/Media, Clothing/Personal Accessories, Electronics, Household Furniture/Furnishings, Kitchen Items, HealthCare, Musical Instruments, Office Supplies/Stationary, Footwear, Sports Equipment, Toys/Games, Baby Care, Cleaning Products, Food/",,"Pickup service M-F 10am-2pm, call Gabriella Nuara at 718-354-5858 to schedule pickup.","Pickup","Monday 10:00 AM-02:00 PM, Tuesday 10:00 AM-02:00 PM, Wednesday 10:00 AM-02:00 PM, Thursday 10:00 AM-02:00 PM, Friday 10:00 AM-02:00 PM, Saturday Closed, Sunday Closed","http://www.pccsny.org/","(718) 370-1088","nmolinell@pccsny.org","Partner","501","49","239","5011610150","5090047","40.633567","-74.148677","121","POINT (-74.1486770002443 40.6335670001202)"
"BROOKLYN","Bushwick South","Human Head","168 Johnson Ave, Brooklyn, NY 11206, USA","168","JOHNSON AVENUE",,"Books/Media, Electronics","Call ahead.  We work with you to coordinate.  We also pick up vinyl related equipment.  Turntables, receivers, speakers","Pickup","Monday 12:00 PM-08:00 PM, Tuesday 12:00 PM-08:00 PM, Wednesday 12:00 PM-08:00 PM, Thursday 12:00 PM-08:00 PM, Friday 12:00 PM-08:00 PM, Saturday 12:00 PM-08:00 PM, Sunday 12:00 PM-08:00 PM","http://humanheadnyc.com","(347) 987-3362","humanheadnyc@gmail.com",,"301","34","493","3030710009","3071291","40.706501","-73.942748","090","POINT (-73.9427479997214 40.7065010000243)"
"MANHATTAN","SoHo-TriBeCa-Civic Center-Little Italy","NOLITA","21 Prince Street, New York, NY 10012, USA","21","PRINCE STREET",,"Clothing/Personal Accessories, Footwear",,,"Sunday 12:00 PM-07:00 PM, Monday 12:00 PM-08:00 PM, Tuesday 12:00 PM-08:00 PM, Wednesday 12:00 PM-08:00 PM, Thursday 12:00 PM-08:00 PM, Friday 12:00 PM-08:00 PM, Saturday 12:00 PM-08:00 PM","http://www.inanyc.com","(212) 334-9048","inanolita@inanyc.com",,"102","01","43","1005087503","1082462","40.722944","-73.994347","005","POINT (-73.9943469996153 40.7229440001687)"
"QUEENS","Murray Hill","Mordes Antiques","41-17 162nd Street, Flushing, NY 11358, USA","41-17","162 STREET",,"Household Furniture/Furnishings",,,"Monday 09:30 AM-03:30 PM, Tuesday 09:30 AM-03:30 PM, Wednesday 09:30 AM-03:30 PM, Thursday 09:30 AM-03:30 PM, Friday 09:30 AM-03:30 PM, Saturday Closed, Sunday Closed",,"(718) 539-7019","noemail@email.com",,"407","20","1171","4053360042","4120480","40.760832","-73.803621","109","POINT (-73.8036209996104 40.760832)"
"MANHATTAN","Clinton","Covenant House","460 W 41st St, New York, NY 10036, USA","460","WEST   41 STREET","Arts/Crafts, Clothing/Personal Accessories, Footwear","Clothing/Personal Accessories, Footwear","24/7 Shelter open for walk-in donations. Preferred times are Mon- Fri 10am-6pm, please call ahead for specifics on donations accepted at that time. Please Note: Currently, we only accept unused items. Appointment needed. No furniture accepted.",,"Monday 10:00 AM-06:00 PM, Tuesday 10:00 AM-06:00 PM, Wednesday 10:00 AM-06:00 PM, Thursday 10:00 AM-06:00 PM, Friday 10:00 AM-06:00 PM, Saturday Closed, Sunday Closed","https://ny.covenanthouse.org/crisis-center","(212) 613-0300","inkinddonations@covenanthouse.org",,"104","03","115","1010500001","1080924","40.758453","-73.996004","010","POINT (-73.9960039995859 40.7584530000091)"
"BROOKLYN","Carroll Gardens-Columbia Street-Red Hook","Food First, Inc.","165 Conover Street, Brooklyn, NY 11231, USA","165","CONOVER STREET","Food/Beverage","Food/Beverage","Accepts non-perishable and unexpired food.",,"Monday 09:00 AM-07:00 PM, Tuesday 09:00 AM-07:00 PM, Wednesday Closed, Thursday 09:00 AM-07:00 PM, Friday Closed, Saturday Closed, Sunday Closed","http://www.foodfirstinc.com","(718) 624-1950","hr@foodfirstinc.com",,"306","38","53","3005650001","3008580","40.678272","-74.013704","076","POINT (-74.0137040001405 40.6782719995563)"
"MANHATTAN","Midtown-Midtown South","PAWS NY","134 W 29th St, New York, NY 10001, USA","134","WEST   29 STREET","Pet Care/Food",,"Unopened and unexpired pet food. Please note: Due to the COVID-19 pandemic, PAWS NY is not able to accept in-kind donations at this time. We encourage you to support our other donateNYC partners with your donations for now. Thank you!",,"Monday 09:00 AM-05:00 PM, Tuesday 09:00 AM-05:00 PM, Wednesday 09:00 AM-05:00 PM, Thursday 09:00 AM-05:00 PM, Friday 09:00 AM-05:00 PM, Saturday Closed, Sunday Closed","http://pawsny.org","(212) 203-4760","info@pawsny.org","Partner","105","03","95","1008040059","1015129","40.747123","-73.991777","013","POINT (-73.9917769998097 40.7471230000296)"
"STATEN IS","Stapleton-Rosebank","United Church of Praise International Ministries","32 Sands Street, Staten Island, NY, USA","32","SANDS STREET","Automotive, Building Products, Clothing/Personal Accessories, Electronics, Food/Beverage, Appliances, Household Furniture/Furnishings, Kitchen Items, Footwear, Sports Equipment, Baby Care, Cleaning Products, HealthCare, Lawn/Garden Supplies, Musical Inst","Building Products, Clothing/Personal Accessories, Electronics, Food/Beverage, Appliances, Household Furniture/Furnishings, Kitchen Items, Footwear, Sports Equipment, Baby Care, Cleaning Products, HealthCare, Lawn/Garden Supplies, Musical Instruments, Off","Food pantry M-F 1:00pm-3:00pm Donations 10:00am-3:00pm M-F. We accept small/large appliances, household goods, home building supplies, bedding, electronics, children's products, bicycles, and more. Will travel up to 10 miles to pickup.","Pickup","Monday 1:00 PM-03:00 PM, Tuesday 1:00 PM-03:00 PM, Wednesday 1:00 PM-03:00 PM, Thursday 1:00 PM-03:00 PM, Friday 1:00 PM-03:00 PM, Saturday Closed, Sunday Closed, Monday 10:00 AM-3:00 PM, Tuesday 10:00 AM-3:00 PM, Wednesday 10:00 AM-3:00 PM, Thursday 10:","http://unitedchurchint.com/welcome_23.html","(718) 314-8779","unitedchurchofpraiseintmin@gmail.com","Partner","501","49","21","5004900004","5113073","40.629032","-74.076112","120","POINT (-74.0761120002696 40.6290319996303)"
"BROOKLYN","Seagate-Coney Island","Our Lady of Solace Shrine","2866 W 17th St, Brooklyn, NY 11224, USA","2866","WEST   17 STREET","Food/Beverage","Food/Beverage","Monday 9:30am-1:30pm. Call ahead to schedule food donation drop-off.",,"Monday 09:30 AM-01:30 PM, Tuesday Closed, Wednesday Closed, Thursday Closed, Friday Closed, Saturday Closed, Sunday Closed",,"(718) 726-9790","JENNIFER.SMITH@ccbq.org",,"313","47","326","3070200039","3329329","40.576803","-73.985253","060","POINT (-73.9852530002267 40.5768030003614)"
"BRONX","Kingsbridge Heights","Uprising","2401 Davidson Ave, Bronx, NY 10468, USA","2401","DAVIDSON AVENUE","Arts/Crafts, Books/Media, Electronics, Food/Beverage, Musical Instruments, Office Supplies/Stationary, Sports Equipment, Toys/Games",,"Materials for arts and crafts activities, books for youth, tech equipment for videography, photography, music production, laptops/tablets, park activities, games, snacks and drinks, are accepted. Appointment only.","Pickup","Monday 9:00 AM-5:00 PM, Tuesday 9:00 AM-5:00 PM, Wednesday 9:00 AM-5:00 PM, Thursday 9:00 AM-5:00 PM, Friday 9:00 AM-5:00 PM, Saturday Closed, Sunday Closed","https://uprisingbronx.org/","(408) 966-8725","uprisingbx@gmail.com",,"207","14","253","2031990038","2014312","40.861882","-73.903336","052","POINT (-73.9033359997576 40.8618819996577)"
"BROOKLYN","Bedford","Bedford Galleries","1167 Bedford Avenue, Brooklyn, NY 11216, USA","1167","BEDFORD AVENUE",,"Household Furniture/Furnishings, Kitchen Items",,,"Monday 09:00 AM-06:30 PM, Tuesday 09:00 AM-06:30 PM, Wednesday 09:00 AM-06:30 PM, Thursday 09:00 AM-06:30 PM, Friday 09:00 AM-06:30 PM, Saturday 09:00 AM-06:30 PM, Sunday 12:00 PM-06:00 PM","http://bedfordgalleries.com","(718) 230-1298","bgalleries@optimum.net",,"303","36","245","3018270010","3051837","40.683486","-73.953582","079","POINT (-73.9535820002101 40.6834859998822)"
"MANHATTAN","Clinton","The Salvation Army Times Square Corps","315 W 47th St, New York, NY 10036, USA","315","WEST   47 STREET","Food/Beverage","Food/Beverage","Food pantry is by appointment only. Please call ahead a schedule an appointment to pick up. Recipients of the food pantry must live within the zip code.","Pickup","Friday 9:00 AM-5:00 PM, Thursday 9:00 AM-5:00 PM, Wednesday 9:00 AM-5:00 PM, Tuesday 9:00 AM-5:00 PM, Monday 9:00 AM-5:00 PM, Sunday Closed, Wednesday Closed, Friday Closed, Thursday Closed, Saturday Closed, Tuesday Closed, Monday Closed, Saturday Closed","http://newyork.salvationarmy.org/who-we-are/locations/#","(212) 975-9988","noemail@callphone.com",,"104","03","127","1010380023","1088176","40.76092","-73.988261","018","POINT (-73.9882610004458 40.7609199995615)"
"QUEENS","Hunters Point-Sunnyside-West Maspeth","Saint Teresa Church - Saint Vincent Depaul Society","50-20 45th St, Woodside, NY 11377, USA","50-20","45 STREET","Food/Beverage","Food/Beverage","Office hours M-F 9am-8pm. Call ahead, make drop-off on Tuesday. Pantry open Tuesday 6pm-7pm.",,"Monday 09:00 AM-08:00 PM, Tuesday 09:00 AM-7:00 PM, Wednesday 09:00 AM-08:00 PM, Thursday 09:00 AM-08:00 PM, Friday 09:00 AM-08:00 PM, Saturday Closed, Sunday Closed",,"(718) 784-2123","schichi7@aol.com",,"402","26","187","4022940050","4053169","40.737333","-73.921332","108","POINT (-73.9213319995731 40.7373330000212)"
"MANHATTAN","East Village","East Village Thrift","186 2nd Avenue, New York, NY 10003, USA","186","2 AVENUE","Books/Media, Clothing/Personal Accessories, Household Furniture/Furnishings, Kitchen Items, Footwear, Toys/Games","Books/Media, Clothing/Personal Accessories, Household Furniture/Furnishings, Kitchen Items, Footwear, Toys/Games",,,"Monday 10:00 AM-08:00 PM, Tuesday 10:00 AM-08:00 PM, Wednesday 10:00 AM-08:00 PM, Thursday 10:00 AM-08:00 PM, Friday 10:00 AM-08:00 PM, Saturday 10:00 AM-08:00 PM, Sunday 10:00 AM-08:00 PM",,"(212) 375-8585","magdyraz@yahoo.com",,"103","02","40","1004530007","1006475","40.730741","-73.985834","009","POINT (-73.98583400004 40.7307410000003)"
"MANHATTAN","West Village","Bowery","302 Bowery, New York, NY 10012, USA","302","BOWERY",,"Building Products, Household Furniture/Furnishings, Kitchen Items","https://ogtstore.com/ogt-purchasing/","Pickup","Monday 10:00 AM-07:00 PM, Tuesday 10:00 AM-06:30 PM, Wednesday 10:00 AM-07:00 PM, Thursday 10:00 AM-07:00 PM, Friday 10:00 AM-07:00 PM, Saturday 11:00 AM-07:00 PM, Sunday 11:00 AM-07:00 PM","http://ogtstore.com","(212) 498-9922","mail@oldegoodthings.com",,"102","01","5502","1005210081","1008205","40.72473","-73.992759","009","POINT (-73.9927590001287 40.7247299997928)"
"STATEN IS","Westerleigh","Monkey Girlz Treasures","565 Manor Road, Staten Island, NY 10314, USA","565","MANOR ROAD","Clothing/Personal Accessories, Footwear","Clothing/Personal Accessories, Footwear, Household Furniture/Furnishings","Close at 6 or 6:30. Accept clothing donations for the nonprofit Suit Up. By appointment only.",,"Monday Closed, Tuesday 11:30 AM-06:00 PM, Wednesday 11:30 AM-06:00 PM, Thursday 11:30 AM-06:00 PM, Friday 11:30 AM-06:00 PM, Saturday Closed, Sunday Closed","http://www.monkeygirlz.com/","(718) 981-0706","mkygirlz@gmail.com",,"501","50","147","5003500012","5106749","40.613489","-74.122413","120","POINT (-74.1224129995613 40.6134889996208)"
"QUEENS","Flushing","St. Michael","136-76 41st Ave, NY, New York 11355, USA","136-76","41 AVENUE","Food/Beverage","Food/Beverage","Food pantry open for times listed. Call ahead to schedule food donation drop-off.",,"Monday Closed, Tuesday 10:00 AM-12:00 PM, Wednesday 09:00 AM-12:00 PM, Thursday 09:00 AM-12:00 PM, Friday Closed, Saturday Closed, Sunday Closed, Monday 9:00 AM-5:00 PM, Tuesday 9:00 AM-5:00 PM, Wednesday 9:00 AM-5:00 PM, Thursday 9:00 AM-5:00 PM, Friday",,"(718) 961-0295","JENNIFER.SMITH@ccbq.org",,"407","20","853","4050440047","4114288","40.759363","-73.826347","109","POINT (-73.8263469999151 40.7593629997059)"
"STATEN IS","Mariner's Harbor-Arlington-Port Ivory-Graniteville","Castellanos House of Music","1013 Richmond Ave, Staten Island, NY 10314, USA","1013","RICHMOND AVENUE",,"Musical Instruments",,,"Monday 12:00 PM-07:00 PM, Tuesday 12:00 PM-07:00 PM, Wednesday 12:00 PM-07:00 PM, Thursday 12:00 PM-07:00 PM, Friday 12:00 PM-07:00 PM, Saturday 11:00 AM-06:00 PM, Sunday Closed","http://www.castellanoshouseofmusic.com/#about-marquee","(718) 982-8548","info@castellanoshouseofmusic.com",,"501","49","30301","5014780001","5029215","40.622397","-74.149537","121","POINT (-74.1495370003333 40.6223970003245)"
