"project_type","blklot","nameaddr","entitled","beststat","bestdate","units","unitsnet","affordable","affordablenet","section415","aff_target","tenure_type","caseno","descript","dbidesc","total_gsf","net_gsf","cie_exist","cie","cienet","med_exist","med","mednet","mips_exist","mips","mipsnet","pdr_exist","pdr","pdrnet","ret_exist","ret","retnet","restaurant","restaurantnet","visit_exist","visit","visitnet","hotel_room_exist","hotel_room_prop","hotel_room_net","planner","sponsor","contact","contactph","pd","supedist","pda","neighborhood","nhood_1990","year","qtr","year_qtr","latitude","longitude","geocoded_column",":@computed_region_6qbp_sg9q",":@computed_region_qgnn_b9vv",":@computed_region_26cr_cadq",":@computed_region_ajp5_b2md"
"Resident","5334031","2175 QUESADA AV","false","BP FILED","2016-01-06T00:00:00.000","1","1","0","0",,,,"2016-000600PRJ","TO ERECT 2 STORIES, NO BASEMENT, SINGLE FAMILY HOME","TO ERECT 2 STORIES, NO BASEMENT, SINGLE FAMILY HOME.","0","0","0","0","0","0","0","0","0","0","0","0","0","0","0","0","0","0","0","0","0","0","0","0","0","EJARDINE","WILLIAMS NANCY Y","WILLIAMS NANCY Y",,"10 - South Bayshore","10","Bayview/Hunters Point Shipyard/Candlestick Point","Bayview Hunters Point","Bayview","2019","Q1","2019_Q1","37.73817873","-122.4005117","POINT (-122.4005117 37.73817873)","87","2","9","1"
"Resident","7326001","PARKMERCED, PHASE I","true","BP APPROVED","2017-12-21T00:00:00.000","299","299","0","0",,,,"2014.1370",,"ERECT A 299 RESIDENTIAL 17 STORY TYPE 1-A BUILDING.","0","0","0","0","0","0","0","0","0","0","0","0","0","0","0","0","0","0","0","0","0","0","0","0","0","TRANNANC",,,,"13 - Ingleside","7","19th Avenue","Lakeshore","Lakeshore","2019","Q1","2019_Q1","37.71602946","-122.4731701","POINT (-122.4731701 37.71602946)","42","10","8","16"
"Resident","6442008","722 PRAGUE ST","false","PL FILED","2016-06-09T00:00:00.000","2","1","0","0",,,,"2016-007554PRJ","Change of use of existing garage to a residential dwelling unit (studio).",,"0","0","0","0","0","0","0","0","0","0","0","0","0","0","0","0","0","0","0","0","0","0","0","0","0","DWASHING","Takami Engineering Group",,"4156726066","12 - South Central","11",,"Excelsior","Crocker Amazon","2019","Q1","2019_Q1","37.71154888","-122.4331275","POINT (-122.4331275 37.71154888)","58","9","1","7"
"MED","6941059","1441 - 1443 OCEAN AV","true","CONSTRUCTION","2019-04-01T00:00:00.000","0","0","0","0",,,,"2015-014461PRJ","Proposed change of use from (E) restaurant to (N) medical clinic. To include upgrades and renovations. Vertical addition of (N) 2nd and 3rd levels.","CHG OF USE.RENOVATE(E)1ST STORY.UPGRADE(E)FOUNDATION TO SUPPORT 2 NEW STORY ADDITION ABOVE (E)1ST STORY.INSTALL A NEW ELEVATOR,AN AUTO SPRINKLER SYS,NEW STAIRS,INTERIOR PARTITIONS,ACOUSTICAL CEILINGS,LITING,ACCESS RESTROOMS.UPGRADE(E)POWER DISTRIBUTION,PL","4665","1995","0","0","0","0","4665","4665","0","0","0","0","0","0","0","0","-2670","0","0","0","0","0","0","0","0","VFLORES","ED2 International","Frank Fung","4155752500","13 - Ingleside","7","Balboa Park","Oceanview/Merced/Ingleside","Ocean View","2019","Q1","2019_Q1","37.72399918","-122.4579399","POINT (-122.4579399 37.72399918)","64","10","8","24"
"Visitor","3704025","996 MISSION ST","false","PL FILED","2016-06-09T00:00:00.000","0","0","0","0",,,,"2015-015253PRJ","Demo of 2-story existing residential hotel building. New construction of 8-story hotel (2 floors residential hotel units, 5 floors tourist hotel) with ground floor retail. Includes installation of drilled piers in (e) basement, eleven stop elevator, retail spaces with mezzanine levels and 2 unisex accessible restrooms, 105 guest rooms with 105 guest room bathrooms (including 7 accessible rooms  5 without roll-in showers & 2 with roll-in showers), solar panel system on roof, HVAC system, and type 1-A Construction.",,"50529","38947","0","0","0","0","0","0","0","0","0","0","0","0","6000","5645","-355","0","0","5582","44884","39302","29","105","76","VBYRD","KevinStephens Design",,"4152254255","4 - Downtown","6","Eastern Neighborhoods","South of Market","South of Market","2019","Q1","2019_Q1","37.78128144","-122.4087051","POINT (-122.4087051 37.78128144)","32","5","10","34"
"Resident","0937022","2477 LOMBARD ST","true","CONSTRUCTION","2018-08-13T00:00:00.000","3","1","0","0",,,,"2016-000314PRJ","CHANGE OF OCCUPANCY FROM R-3 TO R-2. (N) GROUND FLOOR 3-BEDROOM ADDITIONAL DWELLING UNIT WITHIN (E) ENVELOPE PART OF SOFT STORY PROGRAM ORD 30-15 SEISMIC PERMIT 201511243532. 1342 SQ FT RENOVATION, 2-BATH, 3-BEDROOM","CHANGE OF OCCUPANCY FROM R-3 TO R-2. (N) GROUND FLOOR 3-BEDROOM ADDITIONAL DWELLING UNIT WITHIN (E) ENVELOPE PART OF SOFT STORY PROGRAM ORD 30-15 SEISMIC PERMIT 201511243532. 1342 SQ FT RENOVATION, 2-BATH, 3-BEDROOM","0","0","0","0","0","0","0","0","0","0","0","0","0","0","0","0","0","0","0","0","0","0","0","0","0","SAMONSKY","MAJID & MARYAM RAHIMIAN FMLY TR","MAJID & MARYAM RAHIMIAN FMLY TR",,"2 - Marina","2",,"Marina","Marina","2019","Q1","2019_Q1","37.7988367","-122.4421114","POINT (-122.4421114 37.7988367)","14","4","6","13"
"Mixres","3518005","244 09TH ST","true","BP APPROVED","2019-02-21T00:00:00.000","19","19","0","0",,,,"2015-010668PRJ","Proposed new construction of 5 story over basement building with 19 SRO units and 2 commercial units.","Vertical & horizontal addition to an (e) bldg to accomodate five story bldg w/ (4) studio dwelling units and (5) 2-bdrm dwelling units & (1) commercial unit. New building is a covered multi-family dwelling building.","2222","-459","0","0","0","0","0","0","0","0","0","0","0","0","0","2222","-459","0","0","0","0","0","0","0","0",,"SIA Consulting","Su Yun Zeng","4159220200","9 - South of Market","6","Eastern Neighborhoods","South of Market","South of Market","2019","Q1","2019_Q1","37.77423375","-122.4126549","POINT (-122.4126549 37.77423375)","32","1","10","34"
"Mixres","3505016","30 OTIS ST","true","BP ISSUED","2019-01-22T00:00:00.000","404","404","0","0","Fee Payment",,,"2015-010013PRJ","The proposed project consist of demolition of the existing buildings and construction of a new approximately 250-foot tall mixed use building (the ""Project"").  The Project will feature 354 dwelling units on the top of 26 floors of the building.  Approxima","TO ERECT 27 STORIES, 2 BASEMENT, 404 RESIDNETIAL UNITS, REATIL, BALLET SCHOOL & COMMERCIAL.","18263","-31737","0","13125","3125","0","0","0","0","0","-15000","0","0","-15000","10000","5138","-4862","0","0","0","0","0","0","0","0","TCHANG","Reuben, Junius and Rose, LLP",,"4155679000","8 - Mission","6","Market & Octavia","Mission","South of Market","2019","Q1","2019_Q1","37.77291691","-122.4193948","POINT (-122.4193948 37.77291691)","32","1","10","20"
"Resident","3598009","3700 20TH ST","true","PL APPROVED","2017-02-07T00:00:00.000","25","1","0","0",,,,"2016-012613PRJ","Conversion of utility/storage space at the basement level to create an additional dwelling unit per Ordinance 30-15.",,"0","0","0","0","0","0","0","0","0","0","0","0","0","0","0","0","0","0","0","0","0","0","0","0","0",,"Harvey Hacker Architects",,"4159570579","8 - Mission","8","Mission-San Jose Corridor","Mission","Mission","2019","Q1","2019_Q1","37.75848266","-122.4238243","POINT (-122.4238243 37.75848266)","37","3","5","20"
"Mixres","0534007","3027 FILLMORE ST","false","BP FILED","2016-04-12T00:00:00.000","1","0","0","0",,,,"2016-004870PRL","change use from office use to retail space for a small clothing boutique.","CHANGE OF USE: OFFICE USE TO RETAIL SPACE FOR A SMALL CLOTHING BOUTIQUE.  MAHER NA","0","0","0","0","0","0","0","0","0","0","0","0","0","0","0","0","0","0","0","0","0","0","0","0","0","ATAEB","BLEU PROPERTIES INC","BLEU PROPERTIES INC",,"2 - Marina","2",,"Marina","Marina","2019","Q1","2019_Q1","37.79741941","-122.4358524","POINT (-122.4358524 37.79741941)","15","4","6","13"
"Mixed","0287014","300 GRANT AV","true","CONSTRUCTION","2019-03-29T00:00:00.000","0","0","0","0",,,,"2015-000878PRJ","Demo existing non-historic buildings at 272 Sutter and 290 Sutter.  Construct new building with basement plus six stories. Offices on floors three (3) - six (6) with retail on the first floor.","ERECT 6 STORIES, ONE BASEMENT, OFFICE AND RETAIL. Life safety, generator, elevator, fire pump, ERRCS on future addenda.","51410","51410","0","0","0","0","0","0","0","25533","25533","0","0","0","0","25877","25877","0","0","0","0","0","0","0","0","LYEGAZU","Arent Fox LLP",,"4158057971","4 - Downtown","3","Downtown-Van Ness-Geary","Financial District/South Beach","Financial District","2019","Q1","2019_Q1","37.78991388","-122.4052329","POINT (-122.4052329 37.78991388)","19","6","3","8"
"Resident","5532007","190 HOLLADAY AV","true","BP ISSUED","2018-04-06T00:00:00.000","1","1","0","0",,,,"2016-002253PRJ","TO ERECT 3 STORIES, NO BASEMENT, SINGLE FAMILY RESIDENCE.","TO ERECT 3 STORIES, NO BASEMENT, SINGLE FAMILY RESIDENCE.","0","0","0","0","0","0","0","0","0","0","0","0","0","0","0","0","0","0","0","0","0","0","0","0","0","DISALVOJ","BRITTON JOHN F & LINDA M BRITTON","BRITTON JOHN F & LINDA M",,"11 - Bernal Heights","9",,"Bernal Heights","Bernal Heights","2019","Q1","2019_Q1","37.74673886","-122.4053852","POINT (-122.4053852 37.74673886)","60","9","2","2"
"Resident","7092014","220 LOBOS ST","false","BP FILED","2016-05-24T00:00:00.000","2","1","0","0",,,,"2016-007448PRJ","LEGALIZE (E) DWELLING UNIT WITH KITCHEN ON 2ND FLOOR. COMPLY WITH ORDINANCE #33-16 AND PER ORDINANCE #43-14.","LEGALIZE (E) DWELLING UNIT WITH KITCHEN ON 2ND FLOOR. COMPLY WITH ORDINANCE #33-16 AND PER ORDINANCE #43-14.","0","0","0","0","0","0","0","0","0","0","0","0","0","0","0","0","0","0","0","0","0","0","0","0","0","CAMPBELL","HUANG JIA JUN HUANG","HUANG JIA JUN",,"13 - Ingleside","11",,"Oceanview/Merced/Ingleside","Ocean View","2019","Q1","2019_Q1","37.71515622","-122.4598615","POINT (-122.4598615 37.71515622)","81","10","1","24"
"Mixres","3708055","OCEANWIDE (FIRST ST TOWER)","true","BP ISSUED","2017-07-05T00:00:00.000","112","112","0","0","Fee Payment",,,"2006.1523","The project site consist of three undeveloped lots and four buildings ranging from five to seven stories, totaling approx. 251,000 sq. ft. of office, retail, and commercial uses. There are no off-street parking or loading on the site. The proposed project","CONSTRUCT (N) RESIDENTIAL, OFFICE, RETAIL BUILDING","1043317","777317","0","0","0","0","0","0","244000","1034236","790236","0","0","0","22000","9081","-12919","0","0","0","0","0","0","0","0","KGUY","Mark Solit","Joel Yodowitz","415 567-9000","4 - Downtown","6","Transit Center District","Financial District/South Beach","Financial District","2019","Q1","2019_Q1","37.79014909","-122.3986582","POINT (-122.3986582 37.79014909)","108","6","10","8"
"Resident","5991001","300 - 308 UNIVERSITY ST","true","BP ISSUED","2017-06-09T00:00:00.000","1","1","0","0",,,,"2014.1345","New construction of four single-family dwellings on four vacant lots.","TO ERECT 3 STORIES, NO BASEMENT, SINGLE FAMILY DWELLING.","0","0","0","0","0","0","0","0","0","0","0","0","0","0","0","0","0","0","0","0","0","0","0","0","0","EJASZEWS",,,,"12 - South Central","9",,"Portola","Excelsior","2019","Q1","2019_Q1","37.72634449","-122.4142602","POINT (-122.4142602 37.72634449)","92","2","2","25"
"Retail/Ent","3780034","979 BRYANT ST","true","BP ISSUED","2016-08-02T00:00:00.000","0","0","0","0",,,,"2015-018154PRJ","CHANGE OF USE ONLY. RETIRE LAST PERMITTED USE (MOTOR VEHICLE REPAIR) AND CHANGE TO ARTS ACTIVITY.","CHANGE OF USE ONLY. RETIRE LAST PERMITTED USE (MOTOR VEHICLE REPAIR) AND CHANGE TO ARTS ACTIVITY. CHANGE OF OCCUPANCY FROM S-1 TO F-1. N/A FOR MAHER ORDINANCE NO-155.13","3150","0","0","0","0","0","0","0","0","0","0","0","0","-3150","0","3150","3150","0","0","0","0","0","0","0","0","DISALVOJ","PAK LING & SAU FUN YIP REVOC TR","PAK LING & SAU FUN YIP REVOC TR",,"9 - South of Market","6","Eastern Neighborhoods","South of Market","South of Market","2019","Q1","2019_Q1","37.77279485","-122.4062725","POINT (-122.4062725 37.77279485)","33","1","10","34"
"Resident","7308001","PARKMERCED, PHASE I","true","BP ISSUED","2018-10-29T00:00:00.000","64","64","0","0",,,,"2014.1370",,"CONSTRUCT (N) 4-STORY MULTI-UNIT RESIDENTIAL","0","0","0","0","0","0","0","0","0","0","0","0","0","0","0","0","0","0","0","0","0","0","0","0","0","FLORESVE",,,,"13 - Ingleside","7","19th Avenue","Lakeshore","Lakeshore","2019","Q1","2019_Q1","37.72050478","-122.483875","POINT (-122.483875 37.72050478)","42","10","8","16"
"Resident","5898035","771 SILVER AV","true","BP ISSUED","2017-12-26T00:00:00.000","1","1","0","0",,,,,,"CONSTRUCT (N) 3-STORY SINGLE FAMILY DWELLING.","0","0","0","0","0","0","0","0","0","0","0","0","0","0","0","0","0","0","0","0","0","0","0","0","0","EJARDINE",,,,"12 - South Central","9",,"Excelsior","Excelsior","2019","Q1","2019_Q1","37.72921516","-122.4199169","POINT (-122.4199169 37.72921516)","92","9","2","7"
"Mixres","0024020","1327 COLUMBUS AV","true","BP APPROVED","2018-11-20T00:00:00.000","1","1","0","0",,,,"2015-006614PRJ","Demolish two-story commercial building and construct four-story building containing one residential dwelling unit at floors 2-4, over ground floor retail.","TO CONSTRUCT 4 STORIES, NO BASEMENT, SINGLE RESIDENTIAL & RETAIL COMMERCIAL BUILDING.
** MAHER: N/A **","1111","-897","0","0","0","0","0","0","0","0","0","0","0","0","2008","1111","-897","0","0","0","0","0","0","0","0","APERRY",,"Jack Tam","409-8808","3 - Northeast","2","Downtown-Van Ness-Geary","Russian Hill","Russian Hill","2019","Q1","2019_Q1","37.80634753","-122.4193257","POINT (-122.4193257 37.80634753)","99","6","6","32"
"Mixres","3750082","667 FOLSOM ST, 120 & 126 HAWTHORNE ST","true","PL APPROVED","2017-01-05T00:00:00.000","229","229","34","34",,,,"2015-002604PRJ","The proposal entails demolition of 126 Hawthorne Street, a 2 story concrete building and 667 Folsom Street, a 2 story concrete building.  The 19,589 square foot project site comprises three adjoining rectangular lots.  Following demolition, the proposal entails construction of a 130-foot-tall, 13-story mixed-use building containing 240 dwelling units; 11,179 square foot of commercial retail space.",,"8873","-17041","0","0","0","0","0","0","21914","0","-21914","4000","0","-4000","0","8873","8873","0","0","0","0","0","0","0","0","CTOWNES","EQR-Soma II LP, a Delaware limited",,"4157677188","9 - South of Market","6","Eastern Neighborhoods","Financial District/South Beach","South of Market","2019","Q1","2019_Q1","37.78422098","-122.3976308","POINT (-122.3976308 37.78422098)","32","1","10","8"
"MIPS","7544045","199 EVERSON ST","false","BP FILED","2016-03-09T00:00:00.000","0","0","0","0",,,,"2016-006865PRJ","CONSTRUCT (N) ACTIVITY ROOM/OFFICE IN A 1-STORY BUILDING","CONSTRUCT (N) ACTIVITY ROOM/OFFICE IN A 1-STORY BUILDING","0","0","0","0","0","0","0","0","0","0","0","0","0","0","0","0","0","0","0","0","0","0","0","0","0","CTOWNES","DIAMOND VIEW RESIDENTS ASSOC ASSOC","DIAMOND VIEW RESIDENTS ASSOC",,"7 - Central","8",,"Glen Park","Glen Park","2019","Q1","2019_Q1","37.73908777","-122.4330789","POINT (-122.4330789 37.73908777)","59","9","5","10"
"Resident","5991001","300 - 308 UNIVERSITY ST","true","BP ISSUED","2017-06-09T00:00:00.000","1","1","0","0",,,,"2014.1345","New construction of four single-family dwellings on four vacant lots.","TO ERECT 3 STORIES, NO BASEMENT, SINGLE FAMILY DWELLING.","0","0","0","0","0","0","0","0","0","0","0","0","0","0","0","0","0","0","0","0","0","0","0","0","0","EJASZEWS",,,,"12 - South Central","9",,"Portola","Excelsior","2019","Q1","2019_Q1","37.72634449","-122.4142602","POINT (-122.4142602 37.72634449)","92","2","2","25"
"Resident","1273017","1010 STANYAN ST","true","CONSTRUCTION","2019-02-20T00:00:00.000","4","4","0","0",,,,"2016-000260PRJ","ERECT 4 STORIES OF 4 DWELLING UNIT MULTI FAMILY RES'D. TYPE 5 CONSTRUCTION.","ERECT 4 STORIES OF 4 DWELLING UNIT MULTI FAMILY RES'D. TYPE 5 CONSTRUCTION.","0","0","0","0","0","0","0","0","0","0","0","0","0","0","0","0","0","0","0","0","0","0","0","0","0","BBENDIX","jonathan pearlman",,"4155371125","6 - Buena Vista","5",,"Haight Ashbury","Haight Ashbury","2019","Q1","2019_Q1","37.76523248","-122.4524202","POINT (-122.4524202 37.76523248)","29","7","11","3"
"Resident","3587011","668 GUERRERO ST","true","BP ISSUED","2017-08-17T00:00:00.000","3","3","0","0",,,,"2016-004057PRJ","TO ERECT 4 STORIES, NO BASEMENT, 3 UNITS RESIDENTIAL BUILDING. ** MAHER: DISTURBANCE OF AT LEAST 50 CU.YD. OF SOIL; ROUTE TO DPH **","TO ERECT 4 STORIES, NO BASEMENT, 3 UNITS RESIDENTIAL BUILDING.
** MAHER: DISTURBANCE OF AT LEAST 50 CU.YD. OF SOIL; ROUTE TO DPH **","0","0","0","0","0","0","0","0","0","0","0","0","0","0","0","0","0","0","0","0","0","0","0","0","0","EJACKSON","REAL EQUITY GROUP ONE LLC LLC","REAL EQUITY GROUP ONE LLC",,"8 - Mission","8","Mission-San Jose Corridor","Mission","Mission","2019","Q1","2019_Q1","37.76044786","-122.4240037","POINT (-122.4240037 37.76044786)","37","3","5","20"
"Resident","5461015","6256 03RD ST","false","BP FILED","2016-09-16T00:00:00.000","1","1","0","0",,,,,,"CHANGE OF USE. CONVERT REAR STORAGE AREA TO RESIDENTIAL UNIT. UPGRADE EXISTING COMMERCIAL BATHROOM TO ACCESSABLE BATHROOM. UPGRADE ELECTRICAL SERVICE TO 200 AMPS. PROVIDE ONE HOUR SEPARATION WALL BETWEEN COMMERCIAL & RESIDENTIAL.","0","0","0","0","0","0","0","0","0","0","0","0","0","0","0","0","0","0","0","0","0","0","0","0","0","ADINASEE",,,,"10 - South Bayshore","10","Bayview/Hunters Point Shipyard/Candlestick Point","Bayview Hunters Point","Bayview","2019","Q1","2019_Q1","37.72145428","-122.3964325","POINT (-122.3964325 37.72145428)","88","2","9","1"
"Resident","3582014","476 NOE ST","true","CONSTRUCTION","2019-03-06T00:00:00.000","2","1","0","0",,,,"2016-005087PRJ","The project includes an expansion of the top floor through the addition of dormers, a stepped three-story horizontal addition at the rear of the existing building with a roof deck, an expansion of the existing garage opening at the front facade, and an addition of a second dwelling unit at the ground floor.","HORIZONTAL & VERTICAL EXPANSION. ADDITION OF ROOF DECKS ON 2ND , 3RD & 4TH LEVELS. RENOVATION IS INTENDED FOR A COUPLE WITH A GROWING FAMILY WHO WILL OCCUPY THE 2ND - 4TH FLOORS. THE PROPOSED 1ST LEVEL WILL BE AN ADDED 2ND DWELLING UNIT ON THE PROPERTY.","0","0","0","0","0","0","0","0","0","0","0","0","0","0","0","0","0","0","0","0","0","0","0","0","0","NKWIATKO","PFLEGER FAMILY TRUST TRUST","PFLEGER FAMILY TRUST",,"7 - Central","8","Mission-San Jose Corridor","Castro/Upper Market","Castro/Upper Market","2019","Q1","2019_Q1","37.76139559","-122.4331865","POINT (-122.4331865 37.76139559)","38","3","5","5"
"CIE","3616084","2558 - 2564 MISSION ST","false","PL FILED","2016-03-17T00:00:00.000","0","0","0","0",,,,"2016-003529PRJ","Proposed change of use of (E) commercial space into (N) hands-on learning environment.",,"5023","0","0","5023","5023","0","0","0","0","0","0","0","0","0","5023","0","-5023","0","0","0","0","0","0","0","0","ERUSSELL","Alta Vista School","Ed Walters","4154673700","8 - Mission","9","Eastern Neighborhoods","Mission","Mission","2019","Q1","2019_Q1","37.75597879","-122.4191494","POINT (-122.4191494 37.75597879)","53","3","2","20"
"Resident","6939001B","483 FAXON AV","false","BP FILED","2016-02-17T00:00:00.000","2","1","0","0",,,,"2016-002751PRJ","Legalize a second (2nd) dwelling unit at the ground floor of an existing single-family two-story residential dwelling, per Section 207.3 (Ord. 43-14). Revision to BPA #2014.1230.4759.","REVISION TO PERMIT 201410300354 PER UNIT LEGALIZED ORDINANCE 43-14, LEGALIZE KITCHEN.","0","0","0","0","0","0","0","0","0","0","0","0","0","0","0","0","0","0","0","0","0","0","0","0","0","CLARKECO","LAU HELENE LAU","LAU HELENE",,"13 - Ingleside","7",,"Oceanview/Merced/Ingleside","Ocean View","2019","Q1","2019_Q1","37.72333543","-122.4604379","POINT (-122.4604379 37.72333543)","64","10","8","24"
"Mixres","4005001B","1601 - 1677 MARIPOSA ST / 485 CAROLINA","true","CONSTRUCTION","2019-02-28T00:00:00.000","154","154","60","60","BMR","50% AMI;",,"2012.1398","The proposed project would involve demolition of an existing 1-story industrial buildings and  bus repair shop and the construction of a new mixed-use project with 316 dwelling-units, 8,823 sf ft. of commercial space, and 261 off-street parking spaces.  T","TO ERECT 4 STORIES, 1 BASEMENT, TYPE VA & IA, 154 UNITS RESIDENTIAL WITH COMMERCIAL & PARKING.","9555","-65141","0","0","0","0","0","0","8000","0","-8000","66696","3962","-62734","0","5593","5593","0","0","0","0","0","0","0","0","CTOWNES",,,,"9 - South of Market","10","Eastern Neighborhoods","Potrero Hill","Potrero Hill","2019","Q1","2019_Q1","37.76293307","-122.3989915","POINT (-122.3989915 37.76293307)","54","2","9","26"
"Mixres","5952002","302 SILVER AV","true","CONSTRUCTION","2019-03-22T00:00:00.000","198","198","0","0","excempt",,,"2011.1323","Project includes the demolition of the Main/ West/ Infirmary Building, approximately 50,600 square feet, and the new construction of two buildings (1A and 1B), totaling approximately 264,984 square feet, which would house up to 210 Residential Care Facili","TO ERECT 5 STORIES, 2 BASEMENT, RESIDENTIAL CARE FOR THE ELDERLY BUILDING.","572000","275875","296125","561109","264984","0","0","0","0","6291","6291","0","0","0","0","4600","4600","0","0","0","0","0","0","0","0","TCHANG",,,,"12 - South Central","11","Mission-San Jose Corridor","Excelsior","Excelsior","2019","Q1","2019_Q1","37.72778011","-122.4305685","POINT (-122.4305685 37.72778011)","90","9","1","7"
"Mixres","1071003","2670 GEARY BL","true","BP APPROVED","2019-02-28T00:00:00.000","95","95","3","3",,,,"2014-002181PRJ","Construction of a seven story mixed-use building composed of three stories with 21, two-four bedroom residential dwelling units, three stories of office space, one story commercial space and 3 levels of subterranean parking. The proposed building conforms",,"46696","43882","0","0","0","0","0","0","0","35372","35372","0","0","0","0","11324","8510","0","0","0","0","0","0","0","0","JHORNER",,"Riyad Ghannam","699-3640","1 - Richmond","2",,"Presidio Heights","Presidio Heights","2019","Q1","2019_Q1","37.78285255","-122.4474425","POINT (-122.4474425 37.78285255)","11","8","6","31"
"Resident","1465015A","464 34TH AV","false","BP FILED","2016-08-19T00:00:00.000","3","1","0","0",,,,"2016-011948PRJ","LEGALIZE (E) UNITS IN GROUND FLOOR PER ORDINANCE# 43-14. 2 BEDROOMS & 2 BATH.","LEGALIZE (E) UNITS IN GROUND FLOOR PER ORDINANCE# 43-14. 2 BEDROOMS & 2 BATH.","0","0","0","0","0","0","0","0","0","0","0","0","0","0","0","0","0","0","0","0","0","0","0","0","0","CAMPBELL","XU YUAN YUAN XU YUAN","XU YUAN YUAN",,"1 - Richmond","1",,"Outer Richmond","Outer Richmond","2019","Q1","2019_Q1","37.78041542","-122.494106","POINT (-122.494106 37.78041542)","8","8","4","29"
"CIE","3970006","1850 BRYANT ST","false","PL FILED","2015-12-14T00:00:00.000","0","0","0","0",,,,"2015-011211PRJ","Demolition of existing two story structure on Project Site and construction of new 68 foot, 202,927 square foot building to be used for service delivery and office space for nonprofit social service agencies.  The project would include 130 parking spaces, a 9,125 sf interior courtyard, and a 13,409 sf roof deck.",,"175333","170733","0","172394","172394","0","0","0","0","0","-4600","0","0","0","0","2939","2939","0","0","0","0","0","0","0","0","VBYRD","Ross Construction",,"4158502515","8 - Mission","9","Eastern Neighborhoods","Mission","Mission","2019","Q1","2019_Q1","37.76373504","-122.4107943","POINT (-122.4107943 37.76373504)","53","3","2","20"
"Resident","1561014","571 18TH AVE","true","CONSTRUCTION","2018-08-10T00:00:00.000","2","-1","0","0",,,,"2016-004768PRJ","Dwelling Unit Merger application to reduce a unit size more than 25%.   Proposal is to have unit 573 18th move the 1st floor and reduce from 1675 sq ft to 820sqft.","INFILL (E) LIGHTWELL @ SOUTH OF PROPERTY ON 2ND & 3RD FLR. REARRANGE INTERIOR LAYOUT FOR 571 18TH AVE ON 1ST & 2ND FLR. REARRANGE INTERIOR LAYOUT FOR 573 18TH AVE ON 3RD FLR.","0","0","0","0","0","0","0","0","0","0","0","0","0","0","0","0","0","0","0","0","0","0","0","0","0","WFARRENS","Ice Design Inc.",,"6507416968","1 - Richmond","1",,"Outer Richmond","Inner Richmond","2019","Q1","2019_Q1","37.77718018","-122.4773297","POINT (-122.4773297 37.77718018)","5","8","4","29"
"Resident","0158010","1032 PACIFIC AV","true","CONSTRUCTION","2017-08-09T00:00:00.000","6","6","0","0",,,,"2015-015804PRJ","ERECT 5 STORY 6 UNITS RESIDENTIAL BUILDING.","ERECT 5-STORY, 1 BASEMENT, 6 UNITS RESIDENTIAL BUILDING.","0","0","0","0","0","0","0","0","0","0","0","0","0","0","0","0","0","0","0","0","0","0","0","0","0","YEUNGMIN","JEFFREY & JEN MEI ENG REVOC TRUST","JEFFREY & JEN MEI ENG REVOC TRUST",,"3 - Northeast","3","Downtown-Van Ness-Geary","Nob Hill","Nob Hill","2019","Q1","2019_Q1","37.79637056","-122.4122634","POINT (-122.4122634 37.79637056)","107","6","3","21"
"Resident","1558042","512 16TH AV","true","BP ISSUED","2018-03-12T00:00:00.000","2","1","0","0",,,,"2016-003671PRJ",,"REVISION TO PA #201508174486. CONVERT FAMILY ROOM TO BEDROOM & REMOVE STORAGE ROOM @ 1ST FL AS PER PLAN. ADD 2ND UNIT TO (E) SINGLE FAMILY BLDG.","0","0","0","0","0","0","0","0","0","0","0","0","0","0","0","0","0","0","0","0","0","0","0","0","0","SYOUNG",,,,"1 - Richmond","1",,"Outer Richmond","Inner Richmond","2019","Q1","2019_Q1","37.77833319","-122.4746594","POINT (-122.4746594 37.77833319)","5","8","4","29"
"Resident","6996010","453 RALSTON ST","true","CONSTRUCTION","2019-02-26T00:00:00.000","2","1","0","0",,,,,,"LEGALIZE AS BUILT UNIT ON 1ST FLOOR PER PLAN. PER ORDINANCE 43-14.","0","0","0","0","0","0","0","0","0","0","0","0","0","0","0","0","0","0","0","0","0","0","0","0","0","YEUNGMIN",,,,"13 - Ingleside","11","19th Avenue","Oceanview/Merced/Ingleside","Ocean View","2019","Q1","2019_Q1","37.72063159","-122.4692403","POINT (-122.4692403 37.72063159)","64","10","1","24"
