"project_type","blklot","nameaddr","entitled","beststat","bestdate","units","unitsnet","affordable","affordablenet","section415","aff_target","tenure_type","caseno","descript","dbidesc","total_gsf","net_gsf","cie_exist","cie","cienet","med_exist","med","mednet","mips_exist","mips","mipsnet","pdr_exist","pdr","pdrnet","ret_exist","ret","retnet","restaurant","restaurantnet","visit_exist","visit","visitnet","hotel_room_exist","hotel_room_prop","hotel_room_net","planner","sponsor","contact","contactph","pd","supedist","pda","neighborhood","nhood_1990","year","qtr","year_qtr","latitude","longitude","geocoded_column",":@computed_region_6qbp_sg9q",":@computed_region_qgnn_b9vv",":@computed_region_26cr_cadq",":@computed_region_ajp5_b2md"
"Mixed","3966001","2525 16TH ST","true","BP ISSUED","2018-09-05T00:00:00.000","0","0","0","0",,,,"2015-011529PRJ","The project site contains a four-story building consisting of approximately 149,051 square feet. The building was constructed in 1924 was a warehouse. The property owner now desires to convert a portion of the building to office use pursuant to the legitimization program of Planning Code Section 179.1.","CHANGE OF USE FROM PDR TO OFFICE ON 1B, 2/F & 3/F. CONSTRUCTION OF BICYCLE STORAGE AREA TO SHOWERS & LOCKERS ON THE 4/F. N/A ORDINANCE #155-13","149051","0","0","0","0","0","0","0","0","49999","49999","0","99052","-49999","0","0","0","0","0","0","0","0","0","0","0","CTEAGUE","Hanson Bridgett, LLP","Brett Gladestone","415-995-5065","8 - Mission","9","Eastern Neighborhoods","Mission","Mission","2019","Q1","2019_Q1","37.76512082","-122.411897","POINT (-122.411897 37.76512082)","53","3","2","20"
"MIPS","8721033","MISSION BAY BLOCK 26","true","CONSTRUCTION","2019-04-01T00:00:00.000","0","0","0","0",,,,"2008.0850","Creation of Alexandria Mission Bay Life Sciences and Technology Development District (""Alexandria District"") to consoldiate office allocation from previously approved and future projects under the ownership of Alexander Real Estate, for MB South Blks 26-27, 29-32, 33-34, and 41-43.  Includes all campuses (North, South, East & West).","ERECT 12 STORIES FOR OFFICE, DAYCARE.","423000","423000","0","0","0","0","0","0","0","423000","423000","0","0","0","0","0","0","0","0","0","0","0","0","0","0","AA CONV",,,,"9 - South of Market","6","Mission Bay","Mission Bay","South of Market","2019","Q1","2019_Q1","37.77005997","-122.3887726","POINT (-122.3887726 37.77005997)","34","1","10","4"
"PDR","4811011","1350 VAN DYKE AV","true","CONSTRUCTION","2019-03-21T00:00:00.000","0","0","0","0",,,,"2015-000959PRJ","REMODEL TENANT SUITE INCLUDING DEMOLISTION & CONSTRUCTION CONVERT (E) GROUND FLOOR FROM STORAGE TO PARKING GARAGE CONSTRUCT 2ND FLOOR FOR STORAGE, AN CONSTRUCT NEW 3RD FLOOR VERTICAL ADDITON FOR STORAGE AND OFFICE. NEW STAIR & ELEVATOR. MEHER-COMPLIANCE WITH ORDINANCE NO.155.13 NOT REQUIRED.","REMODEL TENANT SUITE INCLUDING DEMOLITION & CONSTRUCTION CONVERT (E) GROUND FLOOR FROM STORAGE TO PARKING GARAGE CONSTRUCT 2ND FLOOR FOR STORAGE, AND CONSTRUCT NEW 3RD FLOOR VERTICAL ADDITON FOR STORAGE AND OFFICE. NEW STAIR & ELEVATOR. MAHER-COMPLIANCE W","28142","14649","0","0","0","0","0","0","0","0","0","13493","28142","14649","0","0","0","0","0","0","0","0","0","0","0","JSPEIRS",,"LAU DAVID ZE FAN",,"10 - South Bayshore","10","Bayview/Hunters Point Shipyard/Candlestick Point","Bayview Hunters Point","Bayview","2019","Q1","2019_Q1","37.72663144","-122.3874173","POINT (-122.3874173 37.72663144)","86","2","9","1"
"Resident","1550009","539 07TH AV","true","CONSTRUCTION","2019-03-21T00:00:00.000","2","1","0","0",,,,"2016-005681PRJ","HORIZONTAL ADDITION. PROPOSAL FOR NEW 986 S.F. HABITABLE SPACE AT GROUND LEVEL, INCLUDE FULL BATHROOM, NEW ROOF DECK ABOVE ADDITION.","HORIZONTAL ADDITION. PROPOSAL FOR NEW 840 S.F. DWELLING AT GROUND LEVEL, INCLUDE FULL BATHROOM AND KITCHEN. ADDITION OF 164 S.F. TO (E) DWELLING ON 2/FL (LOUNGE). NEW ROOF DECK ABOVE ADDITION.","0","0","0","0","0","0","0","0","0","0","0","0","0","0","0","0","0","0","0","0","0","0","0","0","0","CAMPBELL","CLARK MALCOLM CLARK","CLARK MALCOLM",,"1 - Richmond","1",,"Inner Richmond","Inner Richmond","2019","Q1","2019_Q1","37.7782746","-122.4654897","POINT (-122.4654897 37.7782746)","5","8","4","11"
"Resident","0028006E","2624 LEAVENWORTH ST","true","BP APPROVED","2017-03-22T00:00:00.000","3","1","0","0",,,,"2015-012195PRJ","ADD GARAGE LEVEL APARTMENT. N/A ORDINANCE #155-13","ADD GARAGE LEVEL APARTMENT. N/A LEGALIZE UNIT PER ORDINANCE #43-14","0","0","0","0","0","0","0","0","0","0","0","0","0","0","0","0","0","0","0","0","0","0","0","0","0","JIMENEZS",,"VIRGINIA M BILLANTE TRUST",,"3 - Northeast","2","Downtown-Van Ness-Geary","Russian Hill","Russian Hill","2019","Q1","2019_Q1","37.80539807","-122.4183417","POINT (-122.4183417 37.80539807)","99","6","6","32"
"Visitor","3736084","48 TEHAMA ST","false","PL FILED","2016-05-10T00:00:00.000","0","0","0","0",,,,"2015-002325PRJ","Project proposes a 29-story, 350-ft vertical addition for lot 84/85 with 120 hotel rooms, Seven (7) residential units, 2,477 sf of restaurant space, and other accessory uses including event space, a spa, meeting rooms.  An additional 4-story, 60-ft tall addition will include 6,000 sf of office space ,4,000 sf of auto ramp and storage space leading to 13 parking spaces in lot 111.",,"0","0","0","0","0","0","0","0","0","0","0","0","0","0","0","0","0","0","0","0","0","0","0","0","0","RSCHUETT","Reuben, Junius & Rose, LLP",,"4155679000","9 - South of Market","6","Transit Center District","Financial District/South Beach","Financial District","2019","Q1","2019_Q1","37.78741687","-122.3966179","POINT (-122.3966179 37.78741687)","32","1","10","8"
"Resident","7335001","PARKMERCED, PHASE I","true","BP APPROVED","2017-12-27T00:00:00.000","248","248","0","0",,,,"2014.1370",,"TO ERECT A 11 STORIES OF 248 FAMILY DWELLINGS","0","0","0","0","0","0","0","0","0","0","0","0","0","0","0","0","0","0","0","0","0","0","0","0","0","FLORESVE",,,,"13 - Ingleside","7","19th Avenue","Lakeshore","Lakeshore","2019","Q1","2019_Q1","37.71826626","-122.4809081","POINT (-122.4809081 37.71826626)","42","10","8","16"
"Resident","4224022","1058 MISSISSIPPI ST","true","BP ISSUED","2019-01-16T00:00:00.000","2","2","0","0",,,,"2016-000814PRJ","TO ERECT 3 STORIES OF 3 FAMILY DWELLING.","TO ERECT 3 STORIES OF 3 FAMILY DWELLING.","0","0","0","0","0","0","0","0","0","0","0","0","0","0","0","0","0","0","0","0","0","0","0","0","0","SAMONSKY","REDLAND GROUP INC","REDLAND GROUP INC",,"9 - South of Market","10","Eastern Neighborhoods","Potrero Hill","Potrero Hill","2019","Q1","2019_Q1","37.75300336","-122.393982","POINT (-122.393982 37.75300336)","54","2","9","26"
"Resident","5414006","2230 LANE ST","true","PL APPROVED","2017-01-19T00:00:00.000","1","1","0","0",,,,"2016-008445PRJ","Legalizing the existing dwelling unit on the second floor and permit an approximately 640 gsf addition to the unit.",,"0","-1000","0","0","0","0","0","0","0","0","-1000","0","0","0","0","0","0","0","0","0","0","0","0","0","0","RSUCRE","Rebecca Joseph","PELASSINI HEMAN","5303003243","10 - South Bayshore","10","Bayview/Hunters Point Shipyard/Candlestick Point","Bayview Hunters Point","Bayview","2019","Q1","2019_Q1","37.72826954","-122.3935678","POINT (-122.3935678 37.72826954)","86","2","9","1"
"Resident","1289058","4971 17TH ST","false","BP FILED","2016-05-27T00:00:00.000","3","1","0","0",,,,"2016-008127PRJ","Legalize a third dwelling unit at the second floor of an existing two-family three-story residential dwelling, per Section 207.3 (Ord #43-14).","LEGALIZATION OF 2ND FLOOR UNIT PER ORDINANCE# 43-14. LEGALIZE KITCHEN, UPGRADE LIGHTING & SWITCHES, PROVIDE HYDRONIC HEATING. CONVERT 1ST FLOOR STORAGE AREA TO FAMILY ROOM & BEDROOM. PROVIDE SEPARATE METERS FOR GAS, ELECTRICAL AND WATER. 
(THIS APPLICATIO","0","0","0","0","0","0","0","0","0","0","0","0","0","0","0","0","0","0","0","0","0","0","0","0","0","CLARKECO","KWAN HENRY S & VICKY L KWAN","KWAN HENRY S & VICKY L",,"7 - Central","5",,"Inner Sunset","Haight Ashbury","2019","Q1","2019_Q1","37.76128994","-122.4515552","POINT (-122.4515552 37.76128994)","114","7","11","14"
"Resident","3619074","57 CHATTANOOGA ST","true","BP ISSUED","2017-05-24T00:00:00.000","2","1","0","0",,,,,,"ADDITION OF A NEW UNIT WITHIN THE EXISTING ENVELOPE OF THE BLDG CONSISTING OF GROUND & FIRST FLOOR.","0","0","0","0","0","0","0","0","0","0","0","0","0","0","0","0","0","0","0","0","0","0","0","0","0","EOROPEZA",,,,"7 - Central","8","Mission-San Jose Corridor","Noe Valley","Noe Valley","2019","Q1","2019_Q1","37.75567381","-122.4263809","POINT (-122.4263809 37.75567381)","52","3","5","22"
"MIPS","8721029","MISSION BAY BLOCK 27","true","CONSTRUCTION","2019-03-28T00:00:00.000","0","0","0","0",,,,"2008.0850","Creation of Alexandria Mission Bay Life Sciences and Technology Development District (""Alexandria District"") to consoldiate office allocation from previously approved and future projects under the ownership of Alexander Real Estate, for MB South Blks 26-27, 29-32, 33-34, and 41-43.  Includes all campuses (North, South, East & West).","ERECT 7-STORY, TYPE 1, NO BASEMENT, OFFICE/RETAIL BLDG.","0","0","0","0","0","0","0","0","0","0","0","0","0","0","0","0","0","0","0","0","0","0","0","0","0","AA CONV",,,,"9 - South of Market","6","Mission Bay","Mission Bay","South of Market","2019","Q1","2019_Q1","37.76932049","-122.3888568","POINT (-122.3888568 37.76932049)","34","1","10","4"
"Retail/Ent","5000001","490 JAMESTOWN AV","true","BP FILED","2015-10-27T00:00:00.000","0","0","0","0",,,,,,"BLDG #7. ERECT 3-STORY, TYPE 5, NO BASEMENT. NEW RETAIL BUILDING.","0","0","0","0","0","0","0","0","0","0","0","0","0","0","0","0","0","0","0","0","0","0","0","0","0",,,,,"10 - South Bayshore","10","Bayview/Hunters Point Shipyard/Candlestick Point","Bayview Hunters Point","Bayview","2019","Q1","2019_Q1","37.71334402","-122.3851069","POINT (-122.3851069 37.71334402)","79","2","9","1"
"Mixres","1107008","2500 - 2698 TURK ST","true","BP ISSUED","2018-10-16T00:00:00.000","84","84","0","0","Exempt Project",,,"2015-000058PRJ","New construction of two buildings connected by an elevated walkway.  A combined total of 205,000 gsf, excluding the underground garage (77,000 gsf).  The buildings will provide approximately 600 beds in approximately 444 bedrooms between the two buildings","(EAST BUILDING) TO ERECT 4 STORIES, 1 BASEMENT, TYPE IA/VA, 84 UNITS STUDENT RESIDNECE HALL WITH AMENITY OFFICE.","2000","-6500","0","2000","-6500","0","0","0","0","0","0","0","0","0","0","0","0","0","0","0","0","0","0","0","0","MWOODS","Coblentz Patch Duffy & Bass, LLP","Harry O'Brien","415-772-5723","5 - Western Addition","1",,"Lone Mountain/USF","Inner Richmond","2019","Q1","2019_Q1","37.77909884","-122.4514481","POINT (-122.4514481 37.77909884)","12","7","4","18"
"Resident","1155005","1500 MCALLISTER ST","true","BP FILED","2016-08-03T00:00:00.000","10","1","0","0",,,,"2016-000189PRJ","REFERENCE STRUCTURAL UNDER SOFT STORY PERMT#201505216944. WORK INCLUDES ADDING A DWELLING UNIT @ GROUND LEVEL (PER ORDIANCE 30-15)INCLUDES SLAB EXCAVATION, LOWERING EXTERIOR ENTARANCE DOOR W/LEVEL LANDING, ADDING 3 NEW WINDOWS IN KIND @ (E) LOCATIONS. NEW EGRESS @ UNIT, DIRECTLY TO PUBLIC RIGHT AWAY","REFERENCE STRUCTURAL UNDER SOFT STORY PERMT#201505216944. WORK INCLUDES ADDING A DWELLING UNIT @ GROUND LEVEL (PER ORDIANCE 30-15)INCLUDES SLAB EXCAVATION, LOWERING EXTERIOR ENTARANCE DOOR W/LEVEL LANDING, ADDING 3 NEW WINDOWS IN KIND @ (E) LOCATIONS. NEW","0","0","0","0","0","0","0","0","0","0","0","0","0","0","0","0","0","0","0","0","0","0","0","0","0","ESAMONSK","ELIZABETH COURT LP","ELIZABETH COURT LP",,"5 - Western Addition","5",,"Western Addition","Western Addition","2019","Q1","2019_Q1","37.77819461","-122.4369212","POINT (-122.4369212 37.77819461)","97","4","11","39"
"Mixres","0346002","135 HYDE ST","true","BP APPROVED","2019-01-04T00:00:00.000","72","72","10","10","BMR","55% AMI;",,"2015-015203PRJ","CONVERSION OF EXISTING AUTO REPAIR SHOP TO RESIDENTIAL AND COMMERCIAL SPACE AT FIRST FLOOR, CREATION OF BASEMENT SPACE, AND VERTICAL ADDITION OF 6 STORIES CONTAINING EFFICIENCY UNITS.

The PPA was submitted on 11/13/15 and the 90 day deadline is 2/11/16.","TO ERECT 8 STORIES OF 72 DWELLING UNITS","1060","1060","0","0","0","0","0","0","0","0","0","0","0","0","0","1060","1060","0","0","0","0","0","0","0","0","VBYRD","Dolmen Property Group",,"4155590057","4 - Downtown","6","Downtown-Van Ness-Geary","Tenderloin","Downtown/Civic Center","2019","Q1","2019_Q1","37.78214757","-122.4159657","POINT (-122.4159657 37.78214757)","20","5","10","36"
"Mixres","5311035","4712 - 4720 03RD ST","true","BP APPROVED","2017-09-11T00:00:00.000","10","10","0","0",,,,"2014.1000","The existing structure is a one-story stucco building consist of 3 vacant retail units.  The existing building will be demolished.  The proposed project is to construct a 4-story mixed-use building with 13 condominiums as well as a retail space at ground level.","ERECT 4-STORY, RESIDENTIAL CARE FACILITY FOR THE ELDERLY OVER COMMERCIAL BUILDING.","1118","-1376","0","0","0","0","0","0","0","0","0","0","0","0","2494","1118","-1376","0","0","0","0","0","0","0","0","AA CONV",,,,"10 - South Bayshore","10","Bayview/Hunters Point Shipyard/Candlestick Point","Bayview Hunters Point","Bayview","2019","Q1","2019_Q1","37.7354428","-122.3908449","POINT (-122.3908449 37.7354428)","86","2","9","1"
"Resident","6170037","239 ORDWAY ST","true","BP ISSUED","2018-05-10T00:00:00.000","2","2","0","0",,,,"2016-007919PRJ","TO ERECT 3 STORIES, NO BASEMENT, SIGNLE FAMILY DWELLING.","TO ERECT 3 STORIES, NO BASEMENT, SINGLE FAMILY DWELLING.","0","0","0","0","0","0","0","0","0","0","0","0","0","0","0","0","0","0","0","0","0","0","0","0","0","SOUTHEAS","CHIN VICTOR S & AMY Z CHIN","CHIN VICTOR S & AMY Z",,"12 - South Central","10",,"Portola","Visitacion Valley","2019","Q1","2019_Q1","37.71955879","-122.4030887","POINT (-122.4030887 37.71955879)","91","9","9","25"
"Resident","5968011","462 CAMBRIDGE ST","true","CONSTRUCTION","2016-09-23T00:00:00.000","2","1","0","0",,,,"2015-010832PRJ",,"COMPLY W/ NOV 201542201,201555582,201517861. LEGALIZE 2ND UNIT ON GROUND FLOOR INCLUDING 2 BEDROOMS, A FULL BATH & KITCHEN, ADD STORAGE ON GROUND FLR, ADD TWO WINDOWS @ REAR, RELOCATE WATER HEATER & FURNACE PER ORDINANCE 43-14 UNIT LEGALIZATION.","0","0","0","0","0","0","0","0","0","0","0","0","0","0","0","0","0","0","0","0","0","0","0","0","0","CLARKECO",,,,"12 - South Central","9",,"Excelsior","Excelsior","2019","Q1","2019_Q1","37.72558112","-122.4183824","POINT (-122.4183824 37.72558112)","92","9","2","7"
"Resident","4260014","1379 KANSAS ST","true","BP ISSUED","2018-02-02T00:00:00.000","2","1","0","0",,,,"2016-008251PRJ","EXCAVATE (E) GROUND FL TO CONVERT GRD FLR STORAGE TO HABITABLE STUDIO VERTICAL & HORIZONTAL ADDITION TO ENLARGE (E) KITCHEN & BEDROOM. REMODEL BATH, RELOCATE (E) ENTRY STAIRS & EXCAVATE FOR OFF STREET BIKE STORAGE.","EXCAVATE (E) GROUND FL TO CONVERT GRD FLR STORAGE TO HABITABLE STUDIO VERTICAL & HORIZONTAL ADDITION TO ENLARGE (E) KITCHEN & BEDROOM. REMODEL BATH, RELOCATE (E) ENTRY STAIRS & EXCAVATE FOR OFF STREET BIKE STORAGE.","0","0","0","0","0","0","0","0","0","0","0","0","0","0","0","0","0","0","0","0","0","0","0","0","0","SIROISDA","OLSON JOHN H OLSON","OLSON JOHN H",,"9 - South of Market","10","Eastern Neighborhoods","Potrero Hill","Potrero Hill","2019","Q1","2019_Q1","37.75223823","-122.4020711","POINT (-122.4020711 37.75223823)","54","2","9","26"
"Mixres","3764063","525 HARRISON ST","true","BP FILED","2015-09-24T00:00:00.000","179","179","25","25","On-site BMR Project","90% AMI;","Rental","2013.0159","The proposed project includes demolition of the existing two-story former industrial building (27,500 gsf), and the new construction of a 23-story residential building (approximately 255,468 gross square feet; up to 250-ft tall) with up to 205 dwelling units, 1,000 square feet of ground floor caf/retail, 103 off-street parking spaces, 127 Class 1 bicycle parking spaces, and 20 Class 2 bicycle parking spaces. The project includes a dwelling unit mix consisting of 94 two-bedroom units, 69 one-bedroom units, and 42 studio units. The project includes approximately 15,683 square feet of open space via ground floor street improvements, private balconies, a podium level roof deck, and a rooftop terrace. The entrance to the below-grade parking levels via a 22-ft wide entrance off of Harrison Street. The project also includes streetscape improvements, including installation of a signalized pedestrian crosswalk with continental striping along Harrison and Essex Streets, as well as sidewalk widening, new street trees, landscaping and corner bulb outs.","TO ERECT 17 STORIES, 3 BASEMENT, 179 DWELLING UNITS & RETAIL BUILDING. ** MAHER: COMPLIANCE WITH ORDINANCE NO. 155-13 REQUIRED; ROUTE TO DPH **","0","-16000","0","0","-16000","0","0","0","0","0","0","0","0","0","0","0","0","0","0","0","0","0","0","0","0","RSUCRE",,,,"9 - South of Market","6","Downtown-Van Ness-Geary","Financial District/South Beach","South of Market","2019","Q1","2019_Q1","37.7853672","-122.3933593","POINT (-122.3933593 37.7853672)","30","1","10","8"
"PDR","4829020A","1413 VAN DYKE AV","true","BP ISSUED","2017-07-06T00:00:00.000","0","0","0","0",,,,"2016-010781PRJ","CONSTRUCT (N) 1-STORY, NO BASEMENT, WAREHOUSE.","CONSTRUCT (N) 1-STORY, NO BASEMENT, WAREHOUSE.","0","0","0","0","0","0","0","0","0","0","0","0","0","0","0","0","0","0","0","0","0","0","0","0","0","CHRISTEN","CHOW YING KIN & SIU MEI MEI","CHOW YING KIN & SIU MEI",,"10 - South Bayshore","10","Bayview/Hunters Point Shipyard/Candlestick Point","Bayview Hunters Point","Bayview","2019","Q1","2019_Q1","37.72704121","-122.3892103","POINT (-122.3892103 37.72704121)","86","2","9","1"
"Retail/Ent","0206013","439 WASHINGTON ST","false","PL FILED","2018-09-19T00:00:00.000","0","0","0","0",,,,"2015-015553PRJ",,,"4500","-5000","0","0","0","0","0","0","7000","0","-7000","0","0","0","2500","4500","2000","0","0","0","0","0","0","0","0",,,,,"3 - Northeast","3","Downtown-Van Ness-Geary","Chinatown","Financial District","2019","Q1","2019_Q1","37.79554762","-122.4011146","POINT (-122.4011146 37.79554762)","108","6","3","6"
"CIE","0138001","SEAWALL LOTS 323 & 324","false","PL FILED","2016-04-14T00:00:00.000","0","0","0","0",,,,"2015-016326PRJ","The proposed project involves the demolition of the existing parking lot and construction of a new, permanent theater for Teatro ZinZanni, a new 180-200 room hotel and a new privately financed, publicly accessible park. See Project Description submitted herewith for more information.  The hotel portion of the Project requires a conditional use authorization pursuant to Planning Code Section 240.3(3).",,"28301","28301","0","28301","28301","0","0","0","0","0","0","0","0","0","0","0","0","0","0","0","0","0","0","192","192","VBYRD","TZK Broadway, LLC",,"9164438891","3 - Northeast","3","Port of San Francisco","Financial District/South Beach","North Beach","2019","Q1","2019_Q1","37.80003549","-122.3987482","POINT (-122.3987482 37.80003549)","77","6","3","8"
"Mixed","3778046B","735 BRYANT ST","true","CONSTRUCTION","2019-03-15T00:00:00.000","0","0","0","0",,,,"2015-009892PRJ","CONSTRUCT A NEW 3RD FLOOR FOR ARTIST WORKSHOP. 2 NEW BATHROOMS. N/A MAHER ORD.","CONSTRUCT NEW 3RD & 4TH FLOORS. RENOVATE (E) 1ST & 2ND FLOOR. (N) BIKE RACKS & STAIR ENCLOSURE ON BASEMENT. SEISMIC UPGRADE THE ENTIRE STRUCTURE. FULLY SPRINKLER NFPA-13 ENTIRE STRUCTURE (UNDER SEPARATE PERMIT).","0","0","0","0","0","0","0","0","0","0","0","0","0","0","0","0","0","0","0","0","0","0","0","0","0","KDURANDE",,"PANOSSIAN ABRAHAM A",,"9 - South of Market","6","Eastern Neighborhoods","South of Market","South of Market","2019","Q1","2019_Q1","37.77694588","-122.4008484","POINT (-122.4008484 37.77694588)","32","1","10","34"
"Mixres","3576062","645 - 647 VALENCIA ST","true","BP REINSTATED","2018-08-21T00:00:00.000","7","7","0","0",,,,"2015-006330PRJ","ERECT 5-STORY, TYPE 5-A OVER 1-A, 9 DWELLING UNITS OVER MERCANTILE & PARKING BUILDING.","ERECT 5-STORY, TYPE 5-A OVER 1-A, 9 DWELLING UNITS OVER MERCANTILE & PARKING BUILDING.","622","-4628","0","0","0","0","0","0","0","0","0","0","0","0","0","622","-4628","0","0","0","0","0","0","0","0","RSUCRE",,"ROKISKY-RING 2005 TRUST","4152985133","8 - Mission","9","Eastern Neighborhoods","Mission","Mission","2019","Q1","2019_Q1","37.76249992","-122.421373","POINT (-122.421373 37.76249992)","53","3","2","20"
"Resident","4591C001","HUNTERS POINT SHIPYARD (BP APPROVED)","true","BP APPROVED","2015-09-21T00:00:00.000","9","9","0","0",,,,"2013.0196","Hunters Point Shipyard Phase 1 D4D amendments and associated review of buildings within Phase I","Multiple Permits","0","0","0","0","0","0","0","0","0","0","0","0","0","0","0","0","0","0","0","0","0","0","0","0","0","AA CONV",,,,"10 - South Bayshore","10","Bayview/Hunters Point Shipyard/Candlestick Point","Bayview Hunters Point","Bayview","2019","Q1","2019_Q1","37.72983494","-122.3708391","POINT (-122.3708391 37.72983494)","78","2","9","1"
"Resident","6250007B","75 LELAND AV","false","BP FILED","2015-06-29T00:00:00.000","2","2","0","0",,,,,,"REAR BLDG - ERECT 2-STORY, TYPE 5, 1 DWELLING UNIT BUILDING.","0","0","0","0","0","0","0","0","0","0","0","0","0","0","0","0","0","0","0","0","0","0","0","0","0","JSPEIRS",,,,"12 - South Central","10","San Francisco/San Mateo Bi-County Area","Visitacion Valley","Visitacion Valley","2019","Q1","2019_Q1","37.71132733","-122.4055384","POINT (-122.4055384 37.71132733)","75","9","9","40"
"Mixres","1414061","1888 CLEMENT ST","true","CONSTRUCTION","2019-03-04T00:00:00.000","3","3","0","0",,,,"2015-001076PRJ","VERTICAL ADDITION. REMODEL (E) 1 STORY COMMERCIAL TO BE A GARAGE WITH COMMERCIAL SPACE AT THE REAR AND ADD 3 STORIES OF RESIDENTIAL FLATS ON TOP.","VERTICAL ADDITION.  REMODEL (E) 1 STORY COMMERCIAL TO BE A GARAGE WITH COMMERCIAL SPACE AT THE REAR AND ADD 3 STORIES OF RESIDENTIAL FLATS ON TOP.","484","-1933","0","0","0","0","0","0","0","0","0","0","0","0","0","484","-1933","0","0","0","0","0","0","0","0","AKIRBY",,"M C M I INVESTMENT LLC",,"1 - Richmond","1",,"Outer Richmond","Outer Richmond","2019","Q1","2019_Q1","37.78252111","-122.4792567","POINT (-122.4792567 37.78252111)","8","8","4","29"
"Mixres","3763009","600 VAN NESS AV","true","BP ISSUED","2018-12-03T00:00:00.000","168","168","24","24","BMR","55% AMI;",,"2015-012729PRJ","Demolition of existing McDonald's building; Construction of new 9 floor (+ mech. penthouse) residential building: Project includes ground level retail on Van Ness & golden Gate Ave.; 2-story townhouses on Elm Street; new street trees on Elm Street and gol","*** CPC/DBI PARALLEL P/C PER MAYOR'S DIRECTIVE 17-02.***
TO ERECT 13 STORIES, 1 BASEMENT, TYPE I-A,","4997","-4603","0","0","0","0","0","0","0","0","0","0","0","0","9600","4997","-4603","0","0","0","0","0","0","0","0","VBYRD","Reuben, Junius & Rose LLP",,"4155679000","9 - South of Market","6","Eastern Neighborhoods","Financial District/South Beach","South of Market","2019","Q1","2019_Q1","37.78280887","-122.3943538","POINT (-122.3943538 37.78280887)","32","1","10","8"
"Resident","1852006","1531 06TH AV","true","BP ISSUED","2017-09-12T00:00:00.000","2","1","0","0",,,,,,"CREATE ACCESSORY DWELLING UNIT. DIVIDE ENTRY W/ FIRE RATED WALL & (2) ENTRY DOORS. ADD KITCHEN @ LOWER LEVEL FAMILY ROOM.","0","0","0","0","0","0","0","0","0","0","0","0","0","0","0","0","0","0","0","0","0","0","0","0","0","ALEXANDE",,,,"14 - Inner Sunset","7",,"Inner Sunset","Inner Sunset","2019","Q1","2019_Q1","37.75995114","-122.4631357","POINT (-122.4631357 37.75995114)","109","7","8","14"
"Resident","4102007","538 MISSISSIPPI ST","true","CONSTRUCTION","2018-11-20T00:00:00.000","2","1","0","0",,,,"2016-005260PRJ","ADD 1-STORY REAR ADDITION UNDER (E) PORCH FOR 2ND UNIT. ADD STAIR AND CONVERT (E) ATTIC TO BEDROOM/BATH WITH BALCONY.","ADD 1-STORY REAR ADDITION UNDER (E) PORCH FOR 2ND UNIT. ADD STAIR AND CONVERT (E) ATTIC TO BEDROOM/BATH WITH BALCONY.","0","0","0","0","0","0","0","0","0","0","0","0","0","0","0","0","0","0","0","0","0","0","0","0","0","DISALVOJ","FOREMAN BRET L FOREMAN","FOREMAN BRET L",,"9 - South of Market","10","Eastern Neighborhoods","Potrero Hill","Potrero Hill","2019","Q1","2019_Q1","37.7595829","-122.3945853","POINT (-122.3945853 37.7595829)","54","2","9","26"
"Resident","3995015","603 TENNESSEE ST","true","CONSTRUCTION","2019-04-01T00:00:00.000","24","24","0","0","Fee Payment",,,"2015-011202PRJ","The project will involve demolishing an existing two story storage building and construct a new six story, 24 dwelling, 58 foot tall, multi-family residential building.  The ground floor will include active space (lobby), residential,  20 parking stalls a","ERECT 6-STORY, NO BASEMENT, 24 DWELLING UNITS BUILDING.
** MAHER: DISTURBANCE OF AT LEAST 50 CU.YD OF SOIL. ROUTE TO DPH **","0","-6000","0","0","0","0","0","0","0","0","0","6000","0","-6000","0","0","0","0","0","0","0","0","0","0","0","VBYRD","Arcon Construction Inc.",,"4157596228","9 - South of Market","10","Eastern Neighborhoods","Potrero Hill","Potrero Hill","2019","Q1","2019_Q1","37.76400518","-122.3895159","POINT (-122.3895159 37.76400518)","55","2","9","26"
"Medical","5654044","1231 CORTLAND AV","true","CONSTRUCTION","2016-05-25T00:00:00.000","0","0","0","0",,,,"2015-012518PRJ","CHANGE OF USE FROM RETAIL TO MEDICAL/CHIROPRACTOR","CHANGE OF USE FROM RETAIL TO MEDICAL/CHIROPRACTIC","0","0","0","0","0","0","0","0","0","0","0","0","0","0","0","0","0","0","0","0","0","0","0","0","0","IOMOKARO",,"NEPLOKH ERIC A",,"11 - Bernal Heights","9",,"Bernal Heights","Bernal Heights","2019","Q1","2019_Q1","37.73997944","-122.4115084","POINT (-122.4115084 37.73997944)","83","9","2","2"
