"project_type","blklot","nameaddr","entitled","beststat","bestdate","units","unitsnet","affordable","affordablenet","section415","aff_target","tenure_type","caseno","descript","dbidesc","total_gsf","net_gsf","cie_exist","cie","cienet","med_exist","med","mednet","mips_exist","mips","mipsnet","pdr_exist","pdr","pdrnet","ret_exist","ret","retnet","restaurant","restaurantnet","visit_exist","visit","visitnet","hotel_room_exist","hotel_room_prop","hotel_room_net","planner","sponsor","contact","contactph","pd","supedist","pda","neighborhood","nhood_1990","year","qtr","year_qtr","latitude","longitude","geocoded_column",":@computed_region_6qbp_sg9q",":@computed_region_qgnn_b9vv",":@computed_region_26cr_cadq",":@computed_region_ajp5_b2md"
"Resident","1018012","3657 SACRAMENTO ST","true","PL APPROVED","2018-11-08T00:00:00.000","18","18","0","0",,,,"2007.1347","Demolish existing garage and medical office buildings and construct a new 4-story building with 18 residential units, offices, retail, and 3 levels of underground parking.",,"0","0","0","0","0","0","0","0","0","0","0","0","0","0","0","0","0","0","0","0","0","0","0","0","0","TBLOMGRE","Jefffrey Litke",,,"1 - Richmond","2",,"Presidio Heights","Presidio Heights","2019","Q1","2019_Q1","37.78716966","-122.4527692","POINT (-122.4527692 37.78716966)","10","8","6","31"
"Resident","0935024","2429 CHESTNUT ST","true","CONSTRUCTION","2018-06-01T00:00:00.000","4","2","0","0",,,,"2016-002617PRL","Addition of third unit","CONVERT UNIT 2429 FROM 1 UNIT INTO 2 UNITS. NO CHANGE TO UNIT 2431.","0","0","0","0","0","0","0","0","0","0","0","0","0","0","0","0","0","0","0","0","0","0","0","0","0","AKIRBY","Danny Mak",,,"2 - Marina","2",,"Marina","Marina","2019","Q1","2019_Q1","37.7996245","-122.4433811","POINT (-122.4433811 37.7996245)","17","4","6","13"
"Mixres","4110008A","PIER 70","true","PL APPROVED","2017-08-24T00:00:00.000","1875","1875","600","600",,,,"2014-001272PRJ","The proposed project would involve development of a 28-acre site into a mixed-use development, including parks, roads, and infrastructure. Below is a breakdown of the use types of the pier 70-waterfront site development. 

Residential ? Development of a r",,"1620250","1274650","0","0","0","0","0","0","0","1102250","1102250","345600","50000","-295600","0","468000","468000","0","0","0","0","0","0","0","0","ACONTRER","Jack Sylvan","Forest City Development California","415)(","9 - South of Market","10","Eastern Neighborhoods","Potrero Hill","Potrero Hill","2019","Q1","2019_Q1","37.75856909","-122.386881","POINT (-122.386881 37.75856909)","56","2","9","26"
"Resident","5470002","6424 3RD STREET / 188 KEY AVENUE","false","PL FILED","2016-10-12T00:00:00.000","17","17","0","0",,,,"2014.1058","Demolish 1.5 story commercial structure, currently used as a funeral home, and construct four-story building with 17 residential units over 2,121 sf retail and 17 parking spaces on ground floor.",,"0","-3600","0","0","0","0","0","0","0","0","0","0","0","0","0","0","-3600","0","0","0","0","0","0","0","0","MHUE","Victor Quan","Victor Quan","531-8311","10 - South Bayshore","10","Bayview/Hunters Point Shipyard/Candlestick Point","Bayview Hunters Point","Bayview","2019","Q1","2019_Q1","37.71984966","-122.3971677","POINT (-122.3971677 37.71984966)","88","2","9","1"
"Mixres","3502108","198 VALENCIA ST","true","BP ISSUED","2018-11-29T00:00:00.000","28","28","3","3","BMR","90% AMI;",,"2013.1458","Demolition of existing 1 story commercial structure, replace with 5-story building with 28 residential units and ground floor commercial space.","TO ERECT 5 STORIES, NO BASEMENT, 28 UNITS RESIDENTIAL CONDO AND COMMERCIAL BUILDING.
** MAHER: COMPLIANCE WITH ORDINANCE NO# 155-13 NOT REQUIRED **","5000","2900","0","0","0","0","0","0","0","0","0","2100","0","-2100","0","5000","5000","0","0","0","0","0","0","0","0","DISALVOJ",,,,"8 - Mission","8","Market & Octavia","Mission","Mission","2019","Q1","2019_Q1","37.77009628","-122.4226863","POINT (-122.4226863 37.77009628)","32","1","5","20"
"Mixres","6987041","845 HOLLOWAY AVE","true","BP ISSUED","2016-10-20T00:00:00.000","5","2","0","0",,,,"2015-003104PRJ","Vertical addition. Construction of 2 additional units on an existing 2-story mixed use building (retail + 3 dwelling units).","ADDITION OF 1 UNIT ON AN (E) 2-STORY MIXED USED PROJECT WHICH ALREADY HAS 3 APARTMENT UNITS OVER RETAIL.","1","0","0","0","0","0","0","0","0","0","0","0","0","0","0","1","0","0","0","0","0","0","0","0","0","NTRAN",,"DHILLON DALWINDER S",,"13 - Ingleside","11",,"Oceanview/Merced/Ingleside","Ocean View","2019","Q1","2019_Q1","37.72167936","-122.4619921","POINT (-122.4619921 37.72167936)","64","10","1","24"
"CIE","1717048","3225 LINCOLN WY","false","PL FILED","2015-05-20T00:00:00.000","0","0","0","0",,,,"2015-006327PRJ","Change of use from residential to religious.",,"2450","2450","0","2450","2450","0","0","0","0","0","0","0","0","0","0","0","0","0","0","0","0","0","0","0","0","TKENNEDY",,"NAGARA DHAMMA TEMPLE INC THE","4156656576","15 - Outer Sunset","4",,"Sunset/Parkside","Outer Sunset","2019","Q1","2019_Q1","37.76449749","-122.4927252","POINT (-122.4927252 37.76449749)","39","10","7","35"
"Resident","0252011","1160 PINE ST","true","BP FILED","2015-02-04T00:00:00.000","18","3","0","0",,,,"2015-001806PRJ","INSTALLATION OF (3) NEW RESIDENTIAL UNITS FOR A TOTAL OF (18) UNITS.","INSTALLATION OF (3) NEW RESIDENTIAL UNITS FOR A TOTAL OF (18) UNITS.","0","0","0","0","0","0","0","0","0","0","0","0","0","0","0","0","0","0","0","0","0","0","0","0","0","CGROB",,"CITY RING 1 LLC",,"3 - Northeast","3","Downtown-Van Ness-Geary","Nob Hill","Nob Hill","2019","Q1","2019_Q1","37.79061673","-122.4149462","POINT (-122.4149462 37.79061673)","16","6","3","21"
"Resident","4004034","1451 MARIPOSA ST","true","CONSTRUCTION","2016-08-02T00:00:00.000","3","1","0","0",,,,,,"LEGALIZE (E) DWELLING UNIT. CHANGE OF USE FROM R-3 TO R-2. PROVIDE (N) SMOKE DETECTORS. REPLACE (E) OUTLETS IN KITCHEN, REPLACE (E) LIGHT FIXTURE IN KITCHEN.  PROVIDE (N) SPRINKLER SYSTEM THROUGHOUT PER NFPA 13.","0","0","0","0","0","0","0","0","0","0","0","0","0","0","0","0","0","0","0","0","0","0","0","0","0","EJACKSON",,,,"9 - South of Market","10","Eastern Neighborhoods","Potrero Hill","Potrero Hill","2019","Q1","2019_Q1","37.76356715","-122.398125","POINT (-122.398125 37.76356715)","54","2","9","26"
"Mixres","0855010","1740 MARKET ST","true","BP ISSUED","2018-12-05T00:00:00.000","100","100","12","12","On-site BMR Project","90% AMI;","Rental","2014.0409","The proposed project is to demolish the existing 25,108 square foot commercial building and construct an 9-story, 85-foot tall mixed use building.  The existing building on the 13, 642 square foot subject lot was constructed in 1940.  The proposed new building would include 100 housing units, 110 bicycle parking spaces, and 7,630 square feet of commercial space along Market Street.","TO ERECT 9 STORIES OF 100 DWELLING UNITS WITH ONE COMMERCIAL","4385","-20723","0","0","0","0","0","0","25108","0","-25108","0","0","0","0","4385","4385","0","0","0","0","0","0","0","0","TCHANG",,,,"6 - Buena Vista","5","Market & Octavia","Hayes Valley","Western Addition","2019","Q1","2019_Q1","37.77254418","-122.423102","POINT (-122.423102 37.77254418)","26","4","11","9"
"Mixres","4060001","888 TENNESSEE ST","true","PL Approved","2017-10-19T00:00:00.000","128","128","16","16",,,,"2013.0975","The proposed project is the demolition of an existing two-story building and construction of two four-story residential-over-retail building containing 110 dwelling units, 2,155 sq.ft. of retail use, and 10,073 sq.ft. of courtyard open space.  The project would construct a 35,752 sf below grade parking garage with 93 off-street parking spaces.",,"3784","-34736","0","0","0","0","0","0","0","0","0","0","0","-38520","0","3784","3784","0","0","0","0","0","0","0","0","RSUCRE","Andrew Junius","Andrew Junius","415 567 9000","9 - South of Market","10","Eastern Neighborhoods","Potrero Hill","Potrero Hill","2019","Q1","2019_Q1","37.76076627","-122.3899847","POINT (-122.3899847 37.76076627)","55","2","9","26"
"Mixres","3949001","901 16TH ST","true","PL APPROVED","2016-05-12T00:00:00.000","395","395","42","42","On-site BMR Project; Fee Payment",,"Rental","2011.1300","The proposed project will demolish metal warehouses and temporary office buildings; preserve and rehabilitate brick office building; lot line adjustment to create two lots, construct approximately 200 residential units in 4-story building on 17th Street; construct 5-story Kaiser Permanente Medical office building with ground floor retail on 16th Street. The proposed project would construct a below-grade parking garage with 170 spaces for the residential building and 563 for the medical office building.",,"24468","-85032","0","0","0","0","0","0","0","0","-4500","0","0","-105000","0","24468","24468","0","0","0","0","0","0","0","0","WWIETGRE","Attn: Indrajit Obeysekere","Jay Murphy","415-833-1231","9 - South of Market","10","Eastern Neighborhoods","Mission Bay","Potrero Hill","2019","Q1","2019_Q1","37.76612471","-122.3954731","POINT (-122.3954731 37.76612471)","54","1","9","4"
"Resident","4624023","HUNTERS VIEW (BP FILED)","true","BP FILED","2018-09-18T00:00:00.000","668","401","373","106",,,,"2007.0168CUA-02",,,"0","0","0","0","0","0","0","0","0","0","0","0","0","0","0","0","0","0","0","0","0","0","0","0","0",,,,,"10 - South Bayshore","10","Bayview/Hunters Point Shipyard/Candlestick Point","Bayview Hunters Point","Bayview","2019","Q1","2019_Q1","37.73697648","-122.3807497","POINT (-122.3807497 37.73697648)","86","2","9","1"
"Mixres","3737012","TRANSBAY BLOCK 8","true","CONSTRUCTION","2019-03-28T00:00:00.000","546","546","150","150",,"50% AMI;","Rental",,,"TO ERECT 56 STORIES TOWER, 2.5 BASEMENT, 9 STORIES ELEMENT HIGH RISE bUILDING, WITH 546 UNITS RESIDENTIAL, RETAIL & PARKING.
** MAHER: COMPLIANCE WITH ORDINANCE NO# 155-13 REQUIED; ROUTE TO DPH **","0","0","0","0","0","0","0","0","0","0","0","0","0","0","0","0","0","0","0","0","0","0","0","0","0","MSMALL",,,,"9 - South of Market","6","Transit Center District","Financial District/South Beach","Financial District","2019","Q1","2019_Q1","37.78790011","-122.394594","POINT (-122.394594 37.78790011)","32","1","10","8"
"Resident","6763001","95 NORDHOFF ST","false","BP FILED","2018-11-14T00:00:00.000","4","3","0","0",,,,"2014.1490","Demolish an existing single-family home, subdivide parcel into four parcels, and construct four three-story single-family homes.",,"0","0","0","0","0","0","0","0","0","0","0","0","0","0","0","0","0","0","0","0","0","0","0","0","0","MBOURDRE","Anthony Pantaleoni","Tony Pantaleoni","415-495-4051","13 - Ingleside","8",,"West of Twin Peaks","Outer Mission","2019","Q1","2019_Q1","37.7342544","-122.4413327","POINT (-122.4413327 37.7342544)","95","9","5","41"
"Mixres","3651018","3822 24TH ST","true","BP ISSUED","2016-09-20T00:00:00.000","5","5","0","0",,,,"2014.1408","DEMOLISH 2 STORIES, SINGLE FAMILY DWELLING AND ERECT 2 STORIES, 1 BASEMENT, 5 UNITS RESIDENTIAL WITH MIXED USE BUILDING.","TO ERECT 5 STORIES, 1 BASEMENT, 5 UNITS RESIDENTIAL WITH MIXED USE BUILDING.","563","563","0","0","0","0","0","0","0","0","0","0","0","0","0","563","563","0","0","0","0","0","0","0","0","MBOURDRE",,,,"7 - Central","8","Mission-San Jose Corridor","Noe Valley","Noe Valley","2019","Q1","2019_Q1","37.75190136","-122.4280742","POINT (-122.4280742 37.75190136)","84","3","5","22"
"Resident","0478003","2815 POLK ST","true","CONSTRUCTION","2018-12-14T00:00:00.000","3","3","0","0",,,,"2014.1552","Demolish one-story single-family residence and construct three-story three-unit residential building.","CONSTRUCT NEW 3-STORY MULTI-FAMILY RESIDENCE","0","0","0","0","0","0","0","0","0","0","0","0","0","0","0","0","0","0","0","0","0","0","0","0","0","CGROB","Taylor Lombardo Architects",,"4154337777","3 - Northeast","2","Downtown-Van Ness-Geary","Russian Hill","Russian Hill","2019","Q1","2019_Q1","37.80275013","-122.4234101","POINT (-122.4234101 37.80275013)","107","4","6","32"
"Resident","4211001","1100 POTRERO AV","false","BP FILED","2015-03-17T00:00:00.000","3","3","0","0",,,,"2015-003800PRJ","Construct rear addition at first floor behind historic fuel station and a four-story vertical addition to include four dwelling units. Fuel station currently used as automotive repair and will be changed to a retail use/eating establishment TBD.","TO ERECT 4 STORIES, NO BASEMENT, 3 UNITS RESIDENTIAL APARTMENT.  PARTIAL OF (E) STRUCTURE WITH HISTORICAL FEATURES WILL BE RE-ASSEMBLED AS A SUNROOM ON ROOFDECK ABOVE THE 3RD FLOOR OF THE NEW BUILDING.","0","0","0","0","0","0","0","0","0","0","0","0","0","0","0","0","0","0","0","0","0","0","0","0","0","CTOWNES","TOPETCHER ARCHITECTURE INC.","TOPETCHER ARCHITECTURE INC.","(415) 359-99","8 - Mission","9","Eastern Neighborhoods","Mission","Mission","2019","Q1","2019_Q1","37.75440795","-122.4068109","POINT (-122.4068109 37.75440795)","53","3","2","20"
"Retail/Ent","2375019","3606 - 3608 TARAVAL ST","true","BP ISSUED","2016-05-02T00:00:00.000","0","0","0","0",,,,"2015-002171PRJ","Change of use from office and gaming uses to two (2) limited restaurants.","CHANGE OF USE FROM PERSONAL SERVICE TO RETAIL AND LIMITED RESTAURANT- ALL WORK UNDER REF PA 2015 0825 5189","0","0","0","0","0","0","0","0","0","0","0","0","0","0","0","0","0","0","0","0","0","0","0","0","0","DWASHING","Patricia Haight",,"4159394140","15 - Outer Sunset","4",,"Sunset/Parkside","Parkside","2019","Q1","2019_Q1","37.7420113","-122.5049019","POINT (-122.5049019 37.7420113)","39","10","7","35"
"Resident","1731015","1271 19TH AV","true","CONSTRUCTION","2018-12-14T00:00:00.000","2","2","0","0",,,,"2014.1256","New construction of a four-story building containing two residential units and two vehicle spaces.","TO ERECT 4 STORIES, 1 BASEMENT, 2 UNITS RESIDENTIAL BUILDING.","0","0","0","0","0","0","0","0","0","0","0","0","0","0","0","0","0","0","0","0","0","0","0","0","0","TCHANG",,,,"15 - Outer Sunset","4",,"Sunset/Parkside","Outer Sunset","2019","Q1","2019_Q1","37.76410775","-122.4775511","POINT (-122.4775511 37.76410775)","39","10","7","35"
"Resident","3780001","502 07TH ST","true","CONSTRUCTION","2019-02-11T00:00:00.000","16","16","0","0","Fee Payment",,,"2014.1575","New construction of 5-story residential building containing 16 residential units.  Combination of private and common open space.","ERECT 5 STORIES OF 16 RES'D DWELLING UNIT.","0","-3870","0","0","0","0","0","0","0","0","0","3870","0","-3870","0","0","0","0","0","0","0","0","0","0","0","JDISALVO",,,,"9 - South of Market","6","Eastern Neighborhoods","South of Market","South of Market","2019","Q1","2019_Q1","37.77399389","-122.4047881","POINT (-122.4047881 37.77399389)","33","1","10","34"
"Resident","1419007","239 14TH AV","true","CONSTRUCTION","2017-10-24T00:00:00.000","2","1","0","0",,,,,,"VERTICAL & HORIZONTAL ADDITION. CONVERT GROUND FLR LIVING SPACE TO A NEW UNIT INCLUDING THREE BEDROOM, TWO BATHROOMS, LIVING ROOM & KITCHEN. CONVERT (E) FAMILY ROOM & (E) BEDROOM AREA TO TWO BEDROOMS, A FULL BATH, & ROOF DECK ON THE SECOND FLR. CONVERT (E","0","0","0","0","0","0","0","0","0","0","0","0","0","0","0","0","0","0","0","0","0","0","0","0","0","MPUTRA",,,,"1 - Richmond","1",,"Outer Richmond","Inner Richmond","2019","Q1","2019_Q1","37.78358023","-122.4734061","POINT (-122.4734061 37.78358023)","5","8","4","29"
"Resident","3753089","265 SHIPLEY ST","true","BP FILED","2018-06-27T00:00:00.000","9","9","0","0",,,,"2013.1549","The proposed project would include a lot merger of Lots 089 & 090 and construction of a new 5 story, 9 unit residential building, with 6 off-street parking spaces located in a below-grade garage.","Erect a 5 story 9 reidential units to lot 089 & 090.","0","0","0","0","0","0","0","0","0","0","0","0","0","0","0","0","0","0","0","0","0","0","0","0","0","DDWYER","Peter  Naughton","Robert  Edmonds","415 285-1300","9 - South of Market","6","Eastern Neighborhoods","South of Market","South of Market","2019","Q1","2019_Q1","37.7786483","-122.404063","POINT (-122.404063 37.7786483)","32","1","10","34"
"Resident","6738020","831 CHENERY ST","true","CONSTRUCTION","2018-06-08T00:00:00.000","1","1","0","0",,,,,,"CONSTRUCT (N) 3-STORY SINGLE FAMILY RESIDENCE.","0","0","0","0","0","0","0","0","0","0","0","0","0","0","0","0","0","0","0","0","0","0","0","0","0","PERRY AN",,,,"7 - Central","8","Mission-San Jose Corridor","Glen Park","Glen Park","2019","Q1","2019_Q1","37.73467029","-122.4361986","POINT (-122.4361986 37.73467029)","96","9","5","10"
"Mixres","0744010","950 GOUGH ST","true","BP ISSUED","2018-05-11T00:00:00.000","95","95","11","11","On-site BMR Project","90% AMI;","Ownership","2012.0506","Mixed-use building comprised of 100 residential dwelling units, church and community space, 73 space parking garage and courtyard.","CONSTRUCT (N) RESIDENTIAL, ASSEMBLY, PARKING","10000","10000","0","10000","10000","0","0","0","0","0","0","0","0","0","0","0","0","0","0","0","0","0","0","0","0","MWOODS",,,,"5 - Western Addition","5","Downtown-Van Ness-Geary","Western Addition","Downtown/Civic Center","2019","Q1","2019_Q1","37.78222257","-122.4237659","POINT (-122.4237659 37.78222257)","100","4","11","39"
"Resident","6665049","53 MIGUEL ST","false","BP FILED","2015-03-06T00:00:00.000","3","1","0","0",,,,"2015-005214PRJ","BUILDING UNIT COUNT VERIFICATION, legalizing unit, change of use, R3 to R2 to comply with Information Sheet FS-05...sprinkler 1st floor, 2 hr separation on ceiling. SPRINKLER ON SEPARATE PERMIT.","BUILDING UNIT COUNT VERIFICATION, legalizing unit, change of use, R3 to R2 to comply with Information Sheet FS-05...sprinkler 1st floor, 2 hr separation on ceiling. SPRINKLER ON SEPARATE PERMIT.","0","0","0","0","0","0","0","0","0","0","0","0","0","0","0","0","0","0","0","0","0","0","0","0","0","NKWIATKO",,"JOHNASEN JORY P",,"7 - Central","8","Mission-San Jose Corridor","Glen Park","Glen Park","2019","Q1","2019_Q1","37.73915761","-122.4293397","POINT (-122.4293397 37.73915761)","59","9","5","10"
"Resident","3521053A","33 NORFOLK ST","false","BP FILED","2019-01-08T00:00:00.000","11","11","0","0",,,,"2014.0008","The project sponsor proposes to merge Lots 053A and 093 and to replace the existing industrial building and parking lot with a 5-story, 55-foot tall, residential building with a total of 11 residential units. The project is proposing to provide 4 off-street parking spaces and 12 bicycle parking spaces.","TO ERECT 5 STORIES, NO BASEMENT, TYPE 1, 11 DWELLING UNITS AND PARKING BUILDING.
** MAHER: COMPLIANCE WITH ORDINANCE NO# 155-13 REQUIRED. ROUTE TO DPH **","0","-2900","0","0","0","0","0","0","0","0","0","2900","0","-2900","0","0","0","0","0","0","0","0","0","0","0","CTOWNES",,,,"8 - Mission","6","Eastern Neighborhoods","Mission","South of Market","2019","Q1","2019_Q1","37.7711554","-122.4138559","POINT (-122.4138559 37.7711554)","32","1","10","20"
"Resident","6092018","575 ATHENS ST","true","CONSTRUCTION","2018-09-12T00:00:00.000","2","1","0","0",,,,,,"LEGALIZE A 2ND UNIT PER ORD 43-14. DEPRESS REAR CONCRETE FLOOR SLAB FOR 7.5' CEILING CLEARANCE. INSTALL EMERGERCY EGRESS WINDOW FOR BEDROOM 2. INSTALL REAR STAIR & SMOKE /CARBON MONOXIDE DETECTORS. TO COMPLY W/NOV 201038658. ELIMINATION OF CURB CUT.","0","0","0","0","0","0","0","0","0","0","0","0","0","0","0","0","0","0","0","0","0","0","0","0","0","NKWIATKO",,,,"12 - South Central","11",,"Excelsior","Excelsior","2019","Q1","2019_Q1","37.71880417","-122.4302283","POINT (-122.4302283 37.71880417)","90","9","1","7"
"Resident","5503018","3123 FOLSOM ST","true","CONSTRUCTION","2018-06-07T00:00:00.000","2","2","0","0",,,,"2014.1109","Demolish existing one-story garage and construct a 3-story building with two residences and four parking spaces . Variance request to the parking requirement of Bernal Heights SUD.","TO ERECT 3 STORIES, NO BASEMENT, 2 FAMILY DWELLING, TYPE V CONSTRUCTION.","0","0","0","0","0","0","0","0","0","0","0","0","0","0","0","0","0","0","0","0","0","0","0","0","0","JSPEIRS","Karl Lee","Jeremy  Schaub","682-8060x103","11 - Bernal Heights","9",,"Bernal Heights","Bernal Heights","2019","Q1","2019_Q1","37.74791144","-122.4133259","POINT (-122.4133259 37.74791144)","83","9","2","2"
"CIE","1939001","401 13TH TI ST","false","BP FILED","2014-07-15T00:00:00.000","0","0","0","0",,,,,,"CHANGE OF USE FROM SCHOOL TO CHURCH.","0","0","0","0","0","0","0","0","0","0","0","0","0","0","0","0","0","0","0","0","0","0","0","0","0",,,,,"-","6","Treasure Island & Yerba Buena Island","Treasure Island","Treasure Island/YBI","2019","Q1","2019_Q1","37.82428377","-122.3709515","POINT (-122.3709515 37.82428377)","36","1","10","37"
"Resident","2764010","268 GRAND VIEW AV","true","CONSTRUCTION","2019-03-26T00:00:00.000","1","1","0","0",,,,,,"CONSTRUCT 2-STORY, 2 BASEMENTS, TYPE VB, SINGLE FAMILY RESIDENCE WITH GARAGE","0","0","0","0","0","0","0","0","0","0","0","0","0","0","0","0","0","0","0","0","0","0","0","0","0","TCHANG",,,,"7 - Central","8",,"Twin Peaks","Noe Valley","2019","Q1","2019_Q1","37.75394217","-122.4415457","POINT (-122.4415457 37.75394217)","51","3","5","38"
"Mixres","1939001","TREASURE ISLAND DEVELOPMENT AREA","true","PL APPROVED","2011-03-15T00:00:00.000","8495","7676","2050","1800",,,,"2007.0903","Development and Redevelopment Plan for Treasure Island and Yerba Buena Island, including land uses up to (approximately): 6,000 units residential, 500 rooms hotel, 250,000-sf retail, 300 acres park and open space, parking, reuse and historic rehabilitatio",,"381000","381000","0","0","0","0","0","0","0","0","0","0","0","0","0","250000","250000","0","0","0","131000","131000","0","500","500","JSWITZKY",,,,"-","6","Treasure Island & Yerba Buena Island","Treasure Island","Treasure Island/YBI","2019","Q1","2019_Q1","37.82428377","-122.3709515","POINT (-122.3709515 37.82428377)","36","1","10","37"
"Resident","5721077","349 RICHLAND AV","true","CONSTRUCTION","2017-05-11T00:00:00.000","2","1","0","0",,,,,,"FRONT BUILDING VERTICAL ADDITION AND REMODEL OF EXISTING GARAGE AND CONVERT STORAGE AREA AT FRONT OF PROPERTY INTO RESIDENTIAL SINGLE FAMILY DWELLING.","0","0","0","0","0","0","0","0","0","0","0","0","0","0","0","0","0","0","0","0","0","0","0","0","0","JSPEIRS",,,,"11 - Bernal Heights","9",,"Bernal Heights","Bernal Heights","2019","Q1","2019_Q1","37.73591026","-122.418448","POINT (-122.418448 37.73591026)","61","9","2","2"
"Resident","3636027","1181 VALENCIA ST","true","CONSTRUCTION","2017-08-15T00:00:00.000","3","1","0","0",,,,"2014-000347PRJ","Remodel and legalize ground floor dwelling unit.","REMODEL & LEGALIZE RESIDENTIAL 3RD UNIT AT THE GROUND FLOOR. COMPLIANCE WITH ORDINANCE NO. 155-13 NOT REQUIRED. Sprinklers (NFPA-13R for unit, NFPA-13 for garage) on deferred submittal.","0","0","0","0","0","0","0","0","0","0","0","0","0","0","0","0","0","0","0","0","0","0","0","0","0","EJACKSON","Ernie Selander",,,"8 - Mission","9","Eastern Neighborhoods","Mission","Mission","2019","Q1","2019_Q1","37.75406554","-122.4204874","POINT (-122.4204874 37.75406554)","53","3","2","20"
"Mixres","3726103","119 07TH ST","true","CONSTRUCTION","2019-02-08T00:00:00.000","39","39","0","0","Fee Payment",,,"2012.0673","A new 8-story residential development consisting of 48 dwelling units, 1 level of below-grade parking with 15 spaces, and 2,795 sf of ground floor retail.","ERECT NEW MIXED-USED 8 STORY 39 RESIDENTIAL UNITS APARTMENT/PARKING LOT. MAHER ORDINANE IS NOT REQUIRED.","1974","-30426","0","0","0","0","0","0","0","0","0","0","0","0","0","1974","1974","0","0","0","0","-32400","0","0","0","RSUCRE","Nicole Belcore","Andrew J. Junius","415 567-9000","4 - Downtown","6","Eastern Neighborhoods","South of Market","South of Market","2019","Q1","2019_Q1","37.77907287","-122.4103124","POINT (-122.4103124 37.77907287)","32","1","10","34"
"Resident","2623074","53 STATES ST","true","CONSTRUCTION","2018-10-26T00:00:00.000","2","1","0","0",,,,"2014.0177","Mandatory Discretionary Review for the Demo/Reconstruction of a Single Family Dwelling to a Two Unit Building with parking.",,"0","0","0","0","0","0","0","0","0","0","0","0","0","0","0","0","0","0","0","0","0","0","0","0","0","DVU","Marvin & Elisabeth Tien","Jill Allen","415-558-9550","6 - Buena Vista","8","Mission-San Jose Corridor","Castro/Upper Market","Castro/Upper Market","2019","Q1","2019_Q1","37.76317626","-122.4364558","POINT (-122.4364558 37.76317626)","113","7","5","5"
"Resident","1202002J","1282 HAYES ST","true","CONSTRUCTION","2018-10-19T00:00:00.000","8","8","0","0",,,,"2008.0432","CONDITIONAL USE APPEAL OF HARDING THEATHER","New 5-story residential building with 7 dwelling units and 2-car stacked parking","0","-13207","0","0","0","0","0","0","0","0","0","0","0","0","0","0","-13207","0","0","0","0","0","0","0","0","MAYCHRIS",,,,"5 - Western Addition","5",,"Hayes Valley","Western Addition","2019","Q1","2019_Q1","37.77534741","-122.4374633","POINT (-122.4374633 37.77534741)","23","4","11","9"
"Resident","0694003","1033 POLK ST","false","PL FILED","2015-06-17T00:00:00.000","9","9","0","0",,,,"2014.0914","Build a new 8 story residential mixed-use building to the rear of an existing historic building.  The proposed program is for ground floor and second floor commercial/office space (3,175 sq.ft.) and 6 levels of residential space totaling 7,260 sq.ft. net.  Total gross square footage is 14,390.  The existing 2 story historical building is to be renovated.  The existing building is currently unoccupied.",,"0","0","0","0","0","0","0","0","0","0","0","0","0","0","0","0","0","0","0","0","0","0","0","0","0","AA CONV",,,,"4 - Downtown","3","Downtown-Van Ness-Geary","Tenderloin","Downtown/Civic Center","2019","Q1","2019_Q1","37.78643416","-122.4200652","POINT (-122.4200652 37.78643416)","50","4","3","36"
