"landuse","blklot","nameaddr","entitled","beststat","bestdate","units","unitsnet","affordable","affordablenet","section415","aff_target","tenure_type","caseno","descript","dbidesc","total_gsf","net_gsf","cie_exist","cie","cienet","med_exist","med","mednet","mips_exist","mips","mipsnet","pdr_exist","pdr","pdrnet","ret_exist","ret","retnet","restaurant","restaurantnet","visit_exist","visit","visitnet","hotel_room_exist","hotel_room_prop","hotel_room_net","planner","sponsor","contact","contactph","pd","sd","nhood_37","nhood_41","plans","zoning","height_bulk","pda","sud","latitude","longitude","year_","qtr","year_qtr","geocoded_column",":@computed_region_jwn9_ihcz",":@computed_region_6qbp_sg9q",":@computed_region_qgnn_b9vv",":@computed_region_26cr_cadq",":@computed_region_ajp5_b2md"
"Mixres","4266035","2799 24TH ST","0","PL FILED","2015-06-18T00:00:00.000","7","7",,,,,,"2014.1258","Existing laundrymat building will be demolished.  New 8-unit 5-story mixed use residential building will be constructed.  First floor level (street level) will contain 2 commercial spaces and the residential lobby with a bicycle storage.  Four stories above will contain residential units only.  The building will be served by a full height elevator and 2 common stairways.  The rooftop will be used as common open space.","TO ERECT 5 STORIES, NO BASEMENT, TYPE I-B ON 1ST STORY WITH TYPE V-B,     7 UNITS RESIDENTIAL & COMMERCIAL BUILDING.","2056","-269","0",,,"0",,,"0",,,"0",,,"0","2056","-269",,"0","0",,,,,,"EJARDINE",,,,"8 - Mission","9","Mission","Mission","Mission (EN); Mission District Streetscape Plan","NCT-24TH-MISSION","55-X","Eastern Neighborhoods PDA","Mission Alcohol Restrict; Calle 24 SUD; Fringe Financial Services RUD","37.75264806","-122.4080221","2019","Q3","2019_Q3","POINT (-122.4080221 37.75264806)","53","53","3","2","20"
"Resident","0095031","2125 HYDE ST","1","PL Approved","2017-05-23T00:00:00.000","11","3",,,,,,"2016-014950PRJ","There are eight existing legal dwelling units located on the property. There are two project scopes for the subject property: 1) proposal seeks to add one (1) Accessory Dwelling Unit (Building Permit Application No. 201703010409); ZA Action Memo for administrative waiver of open space and exposure approved on 6/9/17; 2) through Building Permit Application No. 201610140347 and Variance Case No. 2016-014950VAR (granted May 24, 2017), the property owner seeks to add two additional dwelling units to the property, for a proposed total of eleven dwelling (units including the proposed Accessory Dwelling Unit). Variance from the open space requirement to allow the addition of two dwelling units within the existing building envelope.",,"0","0",,,,,,,,,,,,,,,,,"0",,,,,,,"NFOSTER","Hood Thomas Architects",,"4153852303","3 - Northeast","2","Russian Hill","Russian Hill",,"RM-2","40-X","Downtown/Van Ness/Northeast Neighborhoods PDA",,"37.80062583","-122.419698","2019","Q3","2019_Q3","POINT (-122.419698 37.80062583)","107","107","6","6","32"
"Retail/Ent","3589088","757 VALENCIA ST","0","BP FILED","2016-10-24T00:00:00.000",,,,,,,,"2015-008231PRJ","INSTALL 9' X 20', 1-STORY, TYPE 5, CONTAINER RESTAURANT.","INSTALL 9' X 20', 1-STORY, TYPE 5, CONTAINER RESTAURANT.","530","530","0",,,"0",,,"0",,,"0",,,"0","530","530",,,"0",,,,,,"EJARDINE",,"VALENCIA SF PROPERTIES LLC",,"8 - Mission","9","Mission","Mission","Mission (EN); Mission District Streetscape Plan","NCT-VALENCIA","55-X","Eastern Neighborhoods PDA","Mission Alcohol Restrict; Fringe Financial Services RUD","37.76076998","-122.4212074","2019","Q3","2019_Q3","POINT (-122.4212074 37.76076998)","53","53","3","2","20"
"Resident","5462010","38 CARR ST","0","BP FILED","2015-12-02T00:00:00.000","2","1",,,,,,,,"LEGALIZE EXISTING KITCHEN ON THE GROUND FLOOR. TO LEGALIZE 1 EXISTING RESIDENTIAL UNIT UNDER UNIT LEGALIZATION ORD 43-14.","0","0","0",,,"0",,,"0",,,"0",,,"0",,,,"0","0",,,,,,"SAMONSKY",,,,"10 - South Bayshore","10","Bayview","Bayview Hunters Point","Bayview Hunters Point","RH-1","40-X","Bayview/Southeast Neighborhoods PDA","3rd St Alcohol Restrict","37.72198599","-122.3971584","2019","Q3","2019_Q3","POINT (-122.3971584 37.72198599)","88","88","2","9","1"
"Resident","0184007","1515 LEAVENWORTH ST","1","BP ISSUED","2018-09-10T10:08:14.000","8","1",,"0",,,,"2016-014696PRJ","CONVERT ILLEGAL UNIT TO ONE ADU @ REAR (NORTHWEST CORNER). REF #2015-0821-4994 (SOFT STORY APPL), 2016-1107-2165 (UNIT LEGALIZATION) & 2016-1108-2161 (ADU).","CONVERT ILLEGAL UNIT TO ONE ADU @ REAR (NORTHWEST CORNER). REF #2015-0821-4994 (SOFT STORY APPL), 2016-1107-2165 (UNIT LEGALIZATION) & 2016-1108-2161 (ADU).","0","0",,,"0",,,"0",,,"0",,,"0",,,"0",,"0",,,"0",,,,"ESAMONSK",,"1515 LEAVENWORTH STREET LLC",,"3 - Northeast","3","Nob Hill","Russian Hill",,"RM-3","65-A","Downtown/Van Ness/Northeast Neighborhoods PDA",,"37.79506178","-122.4167784","2019","Q3","2019_Q3","POINT (-122.4167784 37.79506178)","16","16","6","3","32"
"CIE","0138001","SEAWALL LOTS 323 & 324","0","PL FILED","2016-04-14T00:00:00.000",,,,,,,,"2015-016326PRJ","The proposed project involves the demolition of the existing parking lot and construction of a new, permanent theater for Teatro ZinZanni, a new 192 room hotel and a new privately financed, publicly accessible park. See Project Description submitted herewith for more information.  The hotel portion of the Project requires a conditional use authorization pursuant to Planning Code Section 240.3(3).",,"138800","138800","0","26100","26100","0",,,"0",,,"0",,,"0",,,,"0","0","112700","112700","0","192","192","CALEXAND","TZK Broadway, LLC",,"9164438891","3 - Northeast","3","North Beach","Financial District/South Beach","Northeast Embarcadero Study; Northeast Waterfront","C-2","40-X","Downtown/Van Ness/Northeast Neighborhoods PDA","Waterfront 3","37.80003549","-122.3987482","2019","Q3","2019_Q3","POINT (-122.3987482 37.80003549)","77","77","6","3","8"
"Mixres","4045003","2171 03RD ST","1","CONSTRUCTION","2019-11-26T00:00:00.000","109","109","17","17","On-site BMR Project","90% AMI;","Ownership","2013.0784","The proposal is to demolish the two existing 35,274 sq. ft. total industrial/office buildings on the 29,438-square-foot subject lots and construct one seven-story, 68-foot tall 182,724 sq. ft. mixed-use residential building over podium and two basement levels. The project includes 109 dwelling units, 3,143 sq. ft. ground-floor retail/commercial space, 91 basement level parking spaces, and 102 Class 1 bicycle parking spaces. Parking would be provided at two basement levels with access from 19th Street. The project also includes 7,019 square feet of common open space at a ground-floor interior courtyard and a 2,500 square foot common roof deck.","ERECT MIXED-USE (RESIDENTIAL, RETAIL) NEW BUILDING.","4833","-30441",,,,,,,,,,"35274","0","-35274","0","4833","4833",,,,,,,,,"DVU",,,,"9 - South of Market","10","Potrero Hill","Potrero Hill","Central Waterfront (EN); Dogpatch Public Realm Plan","UMU","68-X","Eastern Neighborhoods PDA","Life Science and Medical","37.76234051","-122.3882552","2019","Q3","2019_Q3","POINT (-122.3882552 37.76234051)","55","55","2","9","26"
"Mixed","3748028","443 FOLSOM ST","0","BP FILED","2017-03-13T00:00:00.000",,,,,,,,"2017-003995PRJ","CHANGE OF USE & TENANT IMPROVEMENT FOR NEW MEDICAL CANNABIS DISPENSARY. WORK TO INCLUDE BATHROOM, FINISHES, CABINETRY & STRUCTURAL IMPROVEMENTS (ROOF, WALL FRAMING, FOUNDATION)","CHANGE OF USE & TENANT IMPROVEMENT FOR NEW MEDICAL CANNABIS DISPENSARY. WORK TO INCLUDE BATHROOM, FINISHES, CABINETRY & STRUCTURAL IMPROVEMENTS (ROOF, WALL FRAMING, FOUNDATION)","0","0",,,,,,,,,,,,,,,,,"0",,,,,,,"MCHRISTE",,"KLOCKARS FAMILY TRUST",,"9 - South of Market","6","South of Market","Financial District/South Beach","Rincon Hill Streetscape Plan; Rincon Hill","RH DTR","85/200-R","Transbay/Rincon Hill PDA",,"37.78735936","-122.3939851","2019","Q3","2019_Q3","POINT (-122.3939851 37.78735936)","30","30","1","10","8"
"Vacant","3509008","170 09TH ST","0","PL Filed","2018-05-08T00:00:00.000","0","0",,"0",,,,"2018-006786PRJ","Conditional Use Authorization for change of use from an industrial use to an Institutional Use (social service, d.b.a. Positive Resource Center) at the first through third floors of an existing building in the Regional Commercial District. The proposed use will have a gross floor area of 24,955 square feet. Interior tenant improvements are associated with this proposal. No changes to any building facades, one new business sign proposed.Planning Commission Motion # 20258, and recorded Notice of Special restrictions",,"24995","0",,"24995","0",,,"0",,,"0",,,"0",,,"0",,"0",,,"0",,,,"DGANETSO","Positive Resource Center (PRC)",,"4158644655X2","4 - Downtown","6","South of Market","South of Market","Western SoMa (EN)","RCD","55-X","Eastern Neighborhoods PDA","Western SoMa","37.77524792","-122.4139604","2019","Q3","2019_Q3","POINT (-122.4139604 37.77524792)","32","32","1","10","34"
"Resident","1671013","800 29TH AV","0","BP FILED","2017-01-26T00:00:00.000","2","1",,,,,,"2017-001492PRJ","Legalize a second unit (2-bedroom Unit No.1) at the ground floor of an existing single-family two-story dwelling, per Planning Code Section 207.3 (Ord. 43-14).","LEGALIZE (E) UNIT ON GROUND LEVEL. NO CONSTRUCTION OR ADDITIONS TO BE MADE. PER ORDINANCE 43-14.","0","0",,,,,,,,,,,,,,,,,"0",,,,,,,"KPHUNG",,,"6504000078","1 - Richmond","1","Outer Richmond","Outer Richmond",,"RH-2","40-X","Richmond Corridors PDA",,"37.77411188","-122.4883099","2019","Q3","2019_Q3","POINT (-122.4883099 37.77411188)","8","8","8","4","29"
"MIPS","3726026","1076 HOWARD ST","0","PL FILED","2015-11-17T00:00:00.000",,,,,,,,"2015-015152PRJ","Change of use from PDR to Office and a vertical addition of 1 additional story.",,"13387","1539","0",,,"0",,,"0","13387","13387","0","0","-11848","0",,,,"0","0",,,,,,"RSUCRE","Vantage Property Investors",,"3105456013","4 - Downtown","6","South of Market","South of Market","East SoMa (EN)","MUG","85-X","Eastern Neighborhoods PDA","Youth and Family Zone","37.77868902","-122.4090983","2019","Q3","2019_Q3","POINT (-122.4090983 37.77868902)","32","32","1","10","34"
"Resident","5514002","1510 YORK ST","0","BP FILED","2014-09-19T00:00:00.000","2","1",,,,,,,,"TO COMPLY WITH COMPLAINT# 2013-01-262. REPLACE FRONT STAIRS. ADD (N) STAIRS TO (N) EXTENSION UNDER (E) DECK. ADD 2 BATHS & 1 LAUNDRY ROOM AND 1 BEDROOM. RENOVATE 1 BATHROOM. CHANGE OF USE FROM 1 FAMILY TO 2 FAMILY.","0","0","0",,,"0",,,"0",,,"0",,,"0",,,,,"0",,,,,,"EJARDINE",,,,"11 - Bernal Heights","9","Bernal Heights","Bernal Heights",,"RH-2","40-X","Bayview/Southeast Neighborhoods PDA","Bernal Heights","37.74786107","-122.4078476","2019","Q3","2019_Q3","POINT (-122.4078476 37.74786107)","60","60","9","2","2"
"Resident","1161016","2545 TURK BLVD","1","BP Filed","2018-07-12T00:00:00.000","4","2",,,,,,"2018-007465PRJ","ADD A (N) STUDIO ADU IN 1ST FL PER ORD# 162-17. THE 3RD UNIT IS UNDER PA# 2018-04206938. Addition of two wood double-hung windows at ground floor on west side of building without divided lites.",,"0","0",,,,,,,,,,,,,,,,,,,,,,,,"DWEISSGL",,"DEBBIE LYNNE NGOW REVOCABLE TRUST",,"5 - Western Addition","1","Inner Richmond","Lone Mountain/USF",,"RH-2","40-X","Central City Neighborhoods PDA",,"37.77805862","-122.4495747","2019","Q3","2019_Q3","POINT (-122.4495747 37.77805862)","12","12","7","4","18"
"Mixres","3725093","5M","1","PL APPROVED","2016-01-04T00:00:00.000","386","386","0","0","On-site BMR Project; Land Dedication","90% AMI;","Ownership","2011.0409","Project review for a development .  A mix of residential, office, retail and other uses on the approx. 4 acre site on the SE corner of 5th/ Mission and extending towards sixth street & south to Howard Street,  The site is comprised of 23 parcels.",,"617900","574800","0","17300","-23600","0",,,"0","593500","591300","0",,,"0","7100","7100",,"0","0",,,,,,"CALEXAND",,,,"4 - Downtown","6","South of Market","South of Market","Downtown","C-3-S","85-X","Downtown/Van Ness/Northeast Neighborhoods PDA","Fifth and Mission","37.78215365","-122.4066011","2019","Q3","2019_Q3","POINT (-122.4066011 37.78215365)","32","32","1","10","34"
"Resident","5652028","3625 FOLSOM ST","0","BP Filed","2017-09-26T00:00:00.000","2","1",,"0",,,,,,"LEGALIZATION OF GROUND FLOOR ""IN LAW"" APT AND BASEMENT, CODE UPGRADES TO PRE-EXISTING SPACE-1 BATH A","0","0",,,"0",,,"0",,,"0",,,"0",,,"0",,"0",,,"0",,,,,,,,"11 - Bernal Heights","9","Bernal Heights","Bernal Heights",,"RH-1","40-X",,"Bernal Heights","37.74111716","-122.4130503","2019","Q3","2019_Q3","POINT (-122.4130503 37.74111716)","83","83","9","2","2"
"Resident","6022015","385 ATHENS ST","1","BP ISSUED","2017-02-08T16:16:15.000","2","1",,,,,,"2016-004974PRJ","LEGALIZING PRE-EXISTING LIVABLE SPACE WITH KITCHEN ON 1ST FLOOR PER PLAN PER ORD 43-14.","LEGALIZING UNIT AT PRE-EXISTING LIVABLE SPACE WITH KITCHEN ON 1ST FLOOR PER PLAN. UNIT LEGALIZATION ORD 43-14.","0","0","0",,,"0",,,"0",,,"0",,,"0",,,,"0","0",,,,,,"SJIMENEZ",,"CHEN JENNY",,"12 - South Central","11","Excelsior","Excelsior",,"RH-2","40-X",,,"37.72180093","-122.4279637","2019","Q3","2019_Q3","POINT (-122.4279637 37.72180093)","90","90","9","1","7"
"Mixres","3780004E","828 BRANNAN ST","0","PL FILED","2016-04-14T00:00:00.000","50","50","9","9",,,,"2015-015789PRJ","The proposed project would demolish the existing building on the site, and construct a seven-story, 68-foot tall, approximately 58,553 gross-square-foot (gsf) mixed-use building. The building would consist of 50 dwellings, with a mix of 10 (20%) studio, 10 (20%) one-bedroom, 25 (50%) two-bedroom, and 5 (10%) loft units. The ground floor provides for a residential lobby, a community/fitness room, a bicycle storage room for 30 Class 1 bicycle parking spaces, 2,104 sf of commercial space, and a trash room. Below grade 7,651 gsf provides 22 auto parking spaces including 1 car share, 60 Class 1 bicycle parking spaces, building services and storage. The project would provide approximately 2,687 gsf in the rear yard and 4,819 gsf on a roof deck of common open space and approximately 455 gsf of private open space (a total of 5 private balconies) on floors three to seven.  The project is subject to hearing by the Planning Commission under Section 329 for review of a Large Project Authorization and neighborhood notification under Section 312.  Under the Large Project Authorization, the project is seeking exceptions to Planning Code Sections 134 for a rear yard modification and 140 for dwelling unit exposure.

The proposed project is located on Lot 004E on Assessor?s Block 3780: 828 Brannan Street on north side of Brannan Street, at the corner of Langton Street in the South of Market neighborhood and within the UMU (Urban Mixed Use) Zoning and 68-X Height District. The approximately 13,000 square-foot lot is currently occupied by a 2-story industrial building constructed in 1936 which has been determined to not be a historic resource. (Updated 9-10-18 kjd)",,"2104","-10501",,,,,,,,,,"12605","0","-12605","0","2104","2104",,,,,,,,,"KDURANDE","Reuben, Junius, and Rose, LLP",,"4155679000","9 - South of Market","6","South of Market","South of Market","Showplace Square/Potrero Hill (EN)","UMU","68-X","Eastern Neighborhoods PDA",,"37.77275249","-122.4041578","2019","Q3","2019_Q3","POINT (-122.4041578 37.77275249)","33","33","1","10","34"
"Mixed","3778046B","735 BRYANT ST","1","CONSTRUCTION","2019-07-26T00:00:00.000",,,,,,,,"2015-009892PRJ","CONSTRUCT A NEW 3RD FLOOR FOR ARTIST WORKSHOP. 2 NEW BATHROOMS. N/A MAHER ORD.","CONSTRUCT NEW 3RD & 4TH FLOORS. RENOVATE (E) 1ST & 2ND FLOOR. (N) BIKE RACKS & STAIR ENCLOSURE ON BASEMENT. SEISMIC UPGRADE THE ENTIRE STRUCTURE. FULLY SPRINKLER NFPA-13 ENTIRE STRUCTURE (UNDER SEPARATE PERMIT).","0","0","0",,,"0",,,"0",,,"0",,,"0",,,,"0","0",,,,,,"KDURANDE",,"PANOSSIAN ABRAHAM A",,"9 - South of Market","6","South of Market","South of Market","Western SoMa (EN); Central SoMa","MUG","55-X","Eastern Neighborhoods PDA","Western SoMa; Central SoMa","37.77694588","-122.4008484","2019","Q3","2019_Q3","POINT (-122.4008484 37.77694588)","32","32","1","10","34"
"Resident","7159013","21 REGENT ST","1","CONSTRUCTION","2019-11-07T00:00:00.000","2","1",,"0",,,,,,"NEW ADU PER ORDINANCE# 95-17. REF PA# 2016/03/24/2990.","0","0",,,"0",,,"0",,,"0",,,"0",,,"0",,"0",,,"0",,,,,,,,"12 - South Central","11","Outer Mission","Outer Mission",,"RH-1","40-X","Balboa Park and Southwest Corridors PDA",,"37.70916521","-122.4561626","2019","Q3","2019_Q3","POINT (-122.4561626 37.70916521)","66","66","9","1","28"
"Mixres","0522002A","2601 VAN NESS AV","1","BP ISSUED","2016-04-04T15:38:39.000","26","26","0","0","Fee Payment",,,"2013.1177","New construction of a 7 story, 27 unit building with 3 ground floor commercial and 2 levels subterranean garage with 35 spaces","ERECT 7-STORY, 27 DWELLING UNITS, RESIDENTIAL/R.2, A-2/B/S-2.  Life safety permits  deferred.","7632","7632","0",,,"0",,,"0",,,"0",,,"0","7632","7632",,,"0",,,,,,"GCABRERO","L. F. Geo","L. F. Geo","415.665.5","2 - Marina","2","Marina","Marina","Van Ness Corridor","RC-3","65-A","Downtown/Van Ness/Northeast Neighborhoods PDA",,"37.79966249","-122.4246167","2019","Q3","2019_Q3","POINT (-122.4246167 37.79966249)","15","15","4","6","13"
"Resident","2473018","2689 23RD AV","1","BP ISSUED","2016-01-08T15:22:17.000","2","1",,,,,,,,"LEGALIZE AS-BUILT KITCHEN ON 1ST FLOOR PER PLAN. REF #201501297032. ORDINANCE #43-14.","0","0","0",,,"0",,,"0",,,"0",,,"0",,,,"0","0",,,,,,"CLARKECO",,,,"15 - Outer Sunset","4","Parkside","Sunset/Parkside",,"RH-1","40-X","Sunset Corridors PDA",,"37.73749084","-122.4798833","2019","Q3","2019_Q3","POINT (-122.4798833 37.73749084)","40","40","10","7","35"
"Resident","4094048","923 - 939 KANSAS ST","1","BP REINSTATED","2019-05-09T13:58:24.000","2","2",,,,,,"2013.1856","The project would construct five buildings (totaling 33, 200 sf) containing nine dwelling units (two each at lots 045-048, one at lot 044) and ten parking spaces on a 12,500-square-foot vacant lot. The proposed building would be three to five stories and 40 to 60 feet in height.  The projct site and the roadway it fronts are on a hillside of serpentine rock that would require excavation for the construction of the buildings and street and sidewalk improvements. The project would require excavation to a depth of 24 feet.","ERECT 5-STORY, 2 DWELLING UNITS WITH 1 BASEMENT RESIDENTIAL BUILDING.","0","0","0",,,"0",,,"0",,,"0",,,"0",,,,,"0",,,,,,"DVU",,,,"9 - South of Market","10","Potrero Hill","Potrero Hill","Showplace Square/Potrero Hill (EN)","RH-2","40-X","Eastern Neighborhoods PDA",,"37.75809933","-122.4025896","2019","Q3","2019_Q3","POINT (-122.4025896 37.75809933)","54","54","2","9","26"
"Resident","3615047","657 CAPP ST","1","CONSTRUCTION","2017-05-22T00:00:00.000","9","5",,,,,,"2015-000141PRJ","Vertical and horizontal additions to existing three-story building containing four residences and two vehicle parking spaces. Move existing building approx. 11' to front of lot; add one story; add five residential units; add one vehicle parking space. Add roof decks. Add curb cut and new entrance to off-street parking; remove unauthorized rear yard additions","VERTICAL & HORIZONTAL ADDITIONS. NEW INTERIOR & EXTERIOR WALLS, FLOORS, WINDOWS, DOORS & BUILDING SYSTEMS. REMODEL 3-STORY W/ 4 DWELLING UNITS TO 4-STORY W/ 9 DWELLING UNITS & PARKING FOR 2 CARS & 1 ACCESSIBLE VAN.(E)STRUCTURE IS MOVED HORIZONTALLY TO MAT","0","0","0",,,"0",,,"0",,,"0",,,"0",,,,"0","0",,,,,,"EJACKSON","Zack / de Vito Architecture Constru",,"4154957889","8 - Mission","9","Mission","Mission","Mission (EN); Mission District Streetscape Plan","RTO-M","40-X","Eastern Neighborhoods PDA","Mission Alcohol Restrict; Fringe Financial Services RUD","37.75625022","-122.4174529","2019","Q3","2019_Q3","POINT (-122.4174529 37.75625022)","53","53","3","2","20"
"Retail/Ent","4109001","610 22ND ST","1","BP APPROVED","2016-05-19T10:42:25.000",,,,,,,,"2015-012208PRJ","CHANGE OF OCCUPANCY. TENANT IMPROVEMENT FOR (N) RESTAURANT INCLUDING KITCHEN, DINING AREA, (N) ADA RESTROOM, HVAC, ELECTRICAL, PLUMBING, MECHANICAL, MEZZANINE, (N) DINING MEZZANINE, (N) FIXTRURES & FINISHES. ** MAHER: COMPLIANCE WITH ORDINANCE NO# 155-13 NOT REQUIRED **","CHANGE OF OCCUPANCY. TENANT IMPROVEMENT FOR (N) RESTAURANT INCLUDING KITCHEN, DINING AREA, (N) ADA RESTROOM, HVAC, ELECTRICAL, PLUMBING, MECHANICAL, MEZZANINE, (N) DINING MEZZANINE, (N) FIXTRURES & FINISHES.
** MAHER: COMPLIANCE WITH ORDINANCE NO# 155-13","4000","0",,,,,,,,,,,"0","-4000",,"4000","4000",,"0",,,,,,,"EOROPEZA",,"AMERICAN INDUSTRIAL CENTER NORTH",,"9 - South of Market","10","Potrero Hill","Potrero Hill","Central Waterfront (EN); Dogpatch Public Realm Plan","PDR-1-G","68-X","Eastern Neighborhoods PDA","Innovative Industries","37.75924593","-122.3879174","2019","Q3","2019_Q3","POINT (-122.3879174 37.75924593)","55","55","2","9","26"
"Vacant","3540081","941 14TH ST","0","PL Filed","2018-07-18T00:00:00.000","2","1",,"0",,,,"2018-009878PRJ","Variance request from the open space requirement to permit the addition of a new dwelling unit to an existing single family home.

Under a separate ""over the counter"" permit, the existing family room, bedroom, bathrooms, laundry room and interior staircase have been brought up to current code.",,"0","0",,,"0",,,"0",,,"0",,,"0",,,"0",,"0",,,"0",,,,,,"LEHMAN JANE A & BALLARD PATRICIA A","4153106584","6 - Buena Vista","8","Castro/Upper Market","Castro/Upper Market",,"RH-3","40-X","Central City Neighborhoods PDA",,"37.76715814","-122.4343515","2019","Q3","2019_Q3","POINT (-122.4343515 37.76715814)","28","28","7","5","5"
"Resident","7555009","366 SUSSEX ST","1","BP ISSUED","2018-04-03T09:22:04.000","2","1",,"0",,,,,,"ADD UNIT PER ORDINANCED NO. 162-16. INTERIOR FREMODEL FOR ADU TO INCLUDE LIVING ROOM KITCHEN BEDROOM","0","0",,,"0",,,"0",,,"0",,,"0",,,"0",,"0",,,"0",,,,,,,,"7 - Central","8","Glen Park","Glen Park",,"RH-1","40-X",,,"37.73732551","-122.4389021","2019","Q3","2019_Q3","POINT (-122.4389021 37.73732551)","96","96","9","5","10"
"Resident","3639006","2675 FOLSOM ST","1","BP ISSUED","2018-12-07T09:55:36.000","117","117","19","19","On-site BMR Project","90% AMI;","Rental","2014-000601PRJ","The proposed Project includes demolition of the three existing buildings on the project site, and new construction of a four-story, 40-ft tall, residential building (approximately 109,917 gross square feet) with 117 dwelling units, approximately 5,291 square feet of PDR use, 65 below-grade off-street parking spaces, 1 car-share parking space, 160 Class 1 bicycle parking spaces, and 14 Class 2 bicycle parking spaces. The Project includes a dwelling unit mix consisting of 2 three-bedroom units, 45 two-bedroom units, 46 one-bedroom units, and 24 studio units. The Project includes 4,775 square feet of public open space, 5,209 square feet of common open space via ground floor courtyard and roof deck, and 3,356 square feet of private open space via balconies and terraces. The Project would also include a lot merger of Lots 006, 007 and 024 on Block 3639.","ON LOT NOS. 006,007 AND 024: TO ERECT 4 STORIES 117 RESIDENTIAL WITH PARKING (LOTS WILL BE MERGED IN FUTURE)","4645","-16954","0",,,"0",,,"0",,,"22411","4645","-16954","0",,,,,"0",,,,,,"RSUCRE","Axis Development Group, LLC",,"992-6997","8 - Mission","9","Mission","Mission","Mission (EN); Mission District Streetscape Plan","UMU","48-X","Eastern Neighborhoods PDA","Mission Alcohol Restrict; Calle 24 SUD; Fringe Financial Services RUD","37.75459458","-122.4138116","2019","Q3","2019_Q3","POINT (-122.4138116 37.75459458)","53","53","3","2","20"
"Resident","1158031","1959 GOLDEN GATE AV","0","BP Filed","2019-05-13T00:00:00.000","3","1",,"0",,,,,,"LEGALIZATION OF (E) UNIT PER ORDINANCE# 43-14. PROVIDE NFPA 13-R SPRINKLERS UNDER SEPARATE PERMIT. C","0","0",,,"0",,,"0",,,"0",,,"0",,,"0",,"0",,,"0",,,,,,,,"5 - Western Addition","5","Western Addition","Lone Mountain/USF",,"RH-3","40-X","Central City Neighborhoods PDA",,"37.77793144","-122.442873","2019","Q3","2019_Q3","POINT (-122.442873 37.77793144)","97","97","7","11","18"
"Resident","5826002","104 BACHE ST","1","CONSTRUCTION","2017-06-21T00:00:00.000","2","2",,,,,,"2008.0382","Rear yard and parking variance","TO ERECT TWO DWELLING UNIT WITH 3 STORY NEW BLDG","0","0","0",,,"0",,,"0",,,"0",,,"0",,,,,"0",,,,,,,,,,"11 - Bernal Heights","9","Bernal Heights","Bernal Heights",,"RH-2","40-X",,"Bernal Heights","37.73379094","-122.4177819","2019","Q3","2019_Q3","POINT (-122.4177819 37.73379094)","61","61","9","2","2"
"Resident","6620030A","1557 NOE ST","0","BP Filed","2019-07-17T00:00:00.000","3","1",,"0",,,,,,"PER LEGALIZATION ORDINANCE# 43-14, UNIT LEGALIZE FOR 1 BEDROOM & 1 BATHROOM.","0","0",,,"0",,,"0",,,"0",,,"0",,,"0",,"0",,,"0",,,,,,,,"7 - Central","8","Noe Valley","Noe Valley",,"RH-2","40-X","J Church and Mission Corridor PDA",,"37.74405268","-122.430875","2019","Q3","2019_Q3","POINT (-122.430875 37.74405268)","84","84","9","5","22"
"Mixres","3532019B","235 VALENCIA ST","1","CONSTRUCTION","2019-11-19T00:00:00.000","50","50","6","6","BMR","55% AMI;",,"2016-007877PRJ","Demolition of existing 9,210 sq. ft. retail automotive repair building and construction of a 55-ft. tall, five-story and approx. 34,912 sq. ft. mixed-use building containing 6,367 sq. ft. of ground floor commercial use and 28,545 sq. ft. of residential use for 40 dwelling units at the floors above. No auto parking is proposed, and Clinton Park to be improved as a living alley with bulb-out, landscaping, paving, and site furniture.",,"5659","-3341",,,,,,,,,,"9000","0","-9000",,"5659","5659",,"0",,,,,,,"RSUCRE","DDG 235 Valencia Realty LLC","Craig Hamburg",,"8 - Mission","9","Mission","Mission","Market and Octavia; Market and Octavia Living Alleys","NCT-3","50-X","Market Octavia PDA",,"37.76920136","-122.4218423","2019","Q3","2019_Q3","POINT (-122.4218423 37.76920136)","53","53","3","2","20"
