"landuse","blklot","nameaddr","entitled","beststat","bestdate","units","unitsnet","affordable","affordablenet","section415","aff_target","tenure_type","caseno","descript","dbidesc","total_gsf","net_gsf","cie_exist","cie","cienet","med_exist","med","mednet","mips_exist","mips","mipsnet","pdr_exist","pdr","pdrnet","ret_exist","ret","retnet","restaurant","restaurantnet","visit_exist","visit","visitnet","hotel_room_exist","hotel_room_prop","hotel_room_net","planner","sponsor","contact","contactph","pd","sd","nhood_37","nhood_41","plans","zoning","height_bulk","pda","sud","latitude","longitude","year_","qtr","year_qtr","geocoded_column",":@computed_region_jwn9_ihcz",":@computed_region_6qbp_sg9q",":@computed_region_qgnn_b9vv",":@computed_region_26cr_cadq",":@computed_region_ajp5_b2md"
"Resident","7308001","PARKMERCED, PHASE I","1","BP ISSUED","2018-10-29T14:39:16.000","64","64",,,,,,"2014.1370","Phase 1 is comprised of four development subphases: Subphase A through Subphase D. The parcels subject to Phase 1 are shown by subphase on the attached Existing Phase 1 Site Plan diagram and further described by block number and area on page 4 of this application. Phase 1 consists primarily of residential development on the western and southeastern portions of the Project site. In addition, as described in more detail below, Phase 1 will include a number of Community Improvements and CEQA Mitigation Measures, as required by the approved Parkmerced Phasing Plan.","CONSTRUCT (N) 4-STORY MULTI-UNIT RESIDENTIAL","0","0","0","0","0","0","0","0","0","0","0","0","0","0","0","0","0",,"0","0","0","0",,,,"VFLORES","Gibson Dunn & Crutcher LLP","Jim Abrams","415 393 8370","13 - Ingleside","7","Lakeshore","Lakeshore","Parkmerced","PM-R","45-PM","19th Avenue PDA","Parkmerced","37.72050478","-122.483875","2019","Q3","2019_Q3","POINT (-122.483875 37.72050478)","42","42","10","8","16"
"Resident","0126007","1803 JONES ST","1","BP ISSUED","2019-07-26T08:34:37.000","3","1",,,,,,"2016-008976PRJ","ADDITION OF AN ACCESSORY DWELLING UNIT TO (E) 2 UNITS PER ORDINANCE NO 162-16.","ADDITION OF AN ACCESSORY DWELLING UNIT TO (E) 2 UNITS  PER ORDINANCE NO 162-16.","0","0",,,,,,,,,,,,,,,,,"0",,,,,,,"MBOUDREA",,"Hafsa Burt","415-702-1609","3 - Northeast","3","Russian Hill","Nob Hill",,"RH-2","40-X","Downtown/Van Ness/Northeast Neighborhoods PDA",,"37.79785178","-122.4156494","2019","Q3","2019_Q3","POINT (-122.4156494 37.79785178)","107","107","6","3","21"
"Resident","5514030","620 PRECITA AV","0","BP Filed","2017-07-07T00:00:00.000","1","1",,"0",,,,,,"ERECT A TWO STORY TYPE 5 CONSTRUCTION SINGLE FAMILY DWELLING.","0","0",,,"0",,,"0",,,"0",,,"0",,,"0",,"0",,,"0",,,,,,,,"11 - Bernal Heights","9","Bernal Heights","Bernal Heights",,"RH-2","40-X","Bayview/Southeast Neighborhoods PDA","Bernal Heights","37.74755109","-122.4088306","2019","Q3","2019_Q3","POINT (-122.4088306 37.74755109)","60","60","9","2","2"
"Mixres","3554001","1900 MISSION ST","1","BP ISSUED","2019-09-19T09:04:58.000","9","9",,,,,,"2013.1330","Project includes the demolition of an approximately 1,690 sq. ft. automotive repair shop and construction of a new 68-ft. 8-in tall, 15,518 sq. ft., six-story-over-basement mixed-use building with full lot coverage that includes 817 sq. ft. of ground floor commercial retail space, eleven dwelling units totaling 15,518 sq. ft., approximately 323 sq. ft. of private open space for two units, 873 sq. ft. of common usable open through a rooftop deck, eleven bicycle parking spaces and no off-street parking; [UPDATED 08/29/19]","ERECT 7-STORY, TYPE 1, 11 DWELLING UNITS, AND RETAIL WITH 1 BASEMENT BUILDING.","2542","852","0",,,"0",,,"0","1725","1725","0","0","-1690","0","817","817",,"0","0",,,,,,"RSUCRE","Kevin Stephens","Kevin Stephens","509-5661","8 - Mission","9","Mission","Mission","Mission (EN); Mission District Streetscape Plan; Mission Public Life Plan","NCT-MISSION","80-B","Eastern Neighborhoods PDA","Mission Alcohol Restrict; Mission Street Formula Retail Restaurant Subdistrict; Fringe Financial Services RUD","37.76653564","-122.4201087","2019","Q3","2019_Q3","POINT (-122.4201087 37.76653564)","53","53","3","2","20"
"Resident","5673023","3459 MISSION ST","1","CONSTRUCTION","2019-11-13T00:00:00.000","3","2",,"0",,,,,,"COMPLY W/ N.O.V 201933911. LEGALIZE 2 RESIDENTIAL UNITS AT REAR OF BUILDING.","0","0",,,"0",,,"0",,,"0",,,"0",,,"0",,"0",,,"0",,,,,,,,"11 - Bernal Heights","9","Bernal Heights","Bernal Heights","Mission Public Life Plan","NC-3","40-X","J Church and Mission Corridor PDA","Mission Alcohol Restrict; Mission Street Formula Retail Restaurant Subdistrict; Fringe Financial Services RUD","37.74132149","-122.422065","2019","Q3","2019_Q3","POINT (-122.422065 37.74132149)","83","83","9","2","2"
"Resident","1763027","1366 09TH AV","1","BP ISSUED","2016-01-08T14:06:26.000","2","1",,,,,,,,"LEGALIZE (E) UNIT & KITCHEN PER ORD-43-14. ADD TWO LAYERS OF TYPE ""X"" GYPSUM BOARD TO CEILING BELOW UNIT.","0","0","0",,,"0",,,"0",,,"0",,,"0",,,,"0","0",,,,,,"NKWIATKO",,,,"14 - Inner Sunset","5","Inner Sunset","Inner Sunset",,"NCD-INNER SUNSET","40-X","Central City Neighborhoods PDA",,"37.76281324","-122.465896","2019","Q3","2019_Q3","POINT (-122.465896 37.76281324)","109","109","10","11","14"
"Resident","3731113","31-33 HARRIET ST","1","BP ISSUED","2019-06-03T08:29:12.000","16","0",,"0",,,,"2018-001698PRJ","3 new ADU's at the ground floor of an existing twelve unit building (31-33 Harriet). The proposal includes Infill of one garage opening with two entry doors for access to the gas meter room and electric panel room and brick to match the existing finish, recess of one existing entry door and replacement/installation of new security gates at front doors.","4 NEW ADU UNITS TO BE ADDED TO (E) GROUND FLR PER ORD 162-16, 3 NEW STREET TREES.","0","0",,,"0",,,"0",,,"0",,,"0",,,"0",,"0",,,"0",,,,"MCHANDLE",,"AGI HAI APARTMENT FUND I LLC",,"9 - South of Market","6","South of Market","South of Market","East SoMa (EN)","MUG","45-X","Eastern Neighborhoods PDA","Youth and Family Zone","37.77901027","-122.4070149","2019","Q3","2019_Q3","POINT (-122.4070149 37.77901027)","32","32","1","10","34"
"Mixres","0510001","2101 LOMBARD ST","0","BP FILED","2016-10-05T00:00:00.000","9","9",,,,,,"2015-015252PRJ","The project includes the demolition of an existing approximately 3,000 square foot commercial building (constructed in 2007) and the construction of a new mixed use commercial/residential building. The proposed building would include 9 residential units, approximately 3,200 square feet of ground floor retail space, and a below grade parking level. The proposed building will be approximately 40 feet in height and consist of 4 stories over a below grade parking level, requiring approximately 12 ft of excavation. The project is located on a corner parcel (approximately 6,017 square feet) within the Marina neighborhood with frontages along Fillmore and Lombard Streets. A Notification of Project Receiving Environmental Review was sent on July 19, 2017 to neighboring property owners and tenants within a 300 foot radius of the project site; no comments were received. 

.","ERECT A 4 STORY TYPE 5, 9 UNITS RESIDENTIAL AND COMMERCIAL BUILDING.","3174","1062",,,,,,,,,,,,,"2112","3174","1062",,"0",,,,,,,"CMAY","Ghiai Architects",,"4157752113","2 - Marina","2","Marina","Marina",,"NC-3","40-X","Lombard Street PDA",,"37.79958444","-122.4362777","2019","Q3","2019_Q3","POINT (-122.4362777 37.79958444)","15","15","4","6","13"
"Resident","3116023","300 FOERSTER ST","0","BP FILED","2014-09-26T00:00:00.000","2","1",,,,,,,,"LEGALIZATION OF 2 UNIT . ORDINANCE 43-14.","0","0","0",,,"0",,,"0",,,"0",,,"0",,,,,"0",,,,,,"KCONNER",,,,"13 - Ingleside","7","Outer Mission","West of Twin Peaks",,"RH-1","40-X",,,"37.73082173","-122.4485856","2019","Q3","2019_Q3","POINT (-122.4485856 37.73082173)","95","95","9","8","41"
"Resident","8954001","233 FOREST RD (BP Filed, Treasure Island)","1","BP FIled","2019-05-17T00:00:00.000","4","4",,,,,,,,"YERBA BUENA ISLAND PROJECT. BLDG# 23 (4Y). TO ERECT 3 STORIES, NO BASEMENT, TYPE III-A, 4 UNITS RESI","0","0",,,,,,,,,,,,,,,,,,,,,,,,,,,,"-","6","Treasure Island/YBI","Treasure Island","Treasure Island","YBI-R","35-Low Rise YBI","Treasure Island/Yerba Buena Island PDA",,"37.81073104","-122.3659586","2019","Q3","2019_Q3","POINT (-122.3659586 37.81073104)","35","35","1","10","37"
"Resident","1062017","169 JORDAN AV","0","BP Filed","2019-08-30T00:00:00.000","1","1",,"0",,,,,,"LEGALIZATION OF (E) DWELLING UNIT INSTALLED W/O PERMIT PER ORD# 43-14 IN REAR GARAGE SHED. ONE BEDRO","0","0",,,"0",,,"0",,,"0",,,"0",,,"0",,"0",,,"0",,,,,,,,"1 - Richmond","2","Presidio Heights","Presidio Heights",,"RH-1(D)","40-X","Richmond Corridors PDA",,"37.7821975","-122.4570338","2019","Q3","2019_Q3","POINT (-122.4570338 37.7821975)","11","11","8","6","31"
"Resident","4030014","2018 19TH ST","0","BP FILED","2015-02-04T00:00:00.000","1","1",,,,,,,,"CONSTRUCT (N) 4-STORY SINGLE FAMILY RESIDENTIAL.","0","0","0",,,"0",,,"0",,,"0",,,"0",,,,"0","0",,,,,,"SAMONSKY",,,,"9 - South of Market","10","Potrero Hill","Potrero Hill","Showplace Square/Potrero Hill (EN)","RH-2","40-X","Eastern Neighborhoods PDA",,"37.76115128","-122.4026653","2019","Q3","2019_Q3","POINT (-122.4026653 37.76115128)","54","54","2","9","26"
"Resident","0149019","1616 TAYLOR ST","1","BP APPROVED","2019-11-27T09:29:43.000","14","0",,"0",,,,"2018-003610PRJ","The proposal is to add three new dwelling units on the first floor. Units A&B would be in the rear, with two bedrooms each utilizing a mezzanine level. These units face the rear yard. Unit C has exposure to the interior lightwells, which will require a variance. Change of pedestrian door at front facade of building, no other work visible from public right of way.","(3) (N) DWELLING UNITS IN (E) 11-UNIT BUILDING.  RECONFIGURE INTERIOR STAIRS. SPRINKLERS UNDER SEPARATE PERMIT","0","0",,,"0",,,"0",,,"0",,,"0",,,"0",,"0",,,"0",,,,"DGANETSO","Gabriel Ng Architects Inc.",,"4156828060","3 - Northeast","3","Russian Hill","Nob Hill",,"RM-2","40-X","Downtown/Van Ness/Northeast Neighborhoods PDA",,"37.79738399","-122.4132695","2019","Q3","2019_Q3","POINT (-122.4132695 37.79738399)","107","107","6","3","21"
"Resident","0552031","1776 VALLEJO ST","1","BP ISSUED","2019-08-27T11:24:55.000","1","1",,,,,,"2016-001466PRJ","TO ERECT 2 STORIES OF ONE SINGLE FAMILY","TO ERECT 2 STORIES OF ONE SINGLE FAMILY","0","0","0",,,"0",,,"0",,,"0",,,"0",,,,"0","0",,,,,,"BBENDIX",,"EMERSON RICHARD",,"2 - Marina","2","Pacific Heights","Marina",,"RH-2","40-X","Downtown/Van Ness/Northeast Neighborhoods PDA",,"37.79659884","-122.4266784","2019","Q3","2019_Q3","POINT (-122.4266784 37.79659884)","102","102","4","6","13"
"Resident","6706045","1247 BOSWORTH ST","0","BP FILED","2016-12-02T00:00:00.000","1","1",,,,,,,,"TO ERECT 3 STORIES, NO BASEMENT, TYPE VB, SINGLE FAMILY BUILDING.","0","0",,,,,,,,,,,,,,,,,"0",,,,,,,"CTOWNES",,,,"13 - Ingleside","7","Outer Mission","West of Twin Peaks",,"RH-1","40-X",,,"37.7356346","-122.4414209","2019","Q3","2019_Q3","POINT (-122.4414209 37.7356346)","72","72","9","8","41"
"Resident","2393038","2422 33RD AV","0","BP Filed","2019-01-03T00:00:00.000","2","1",,"0",,,,,,"ADDING A 912 SQ FT (1) BEDROOM ADU ON GROUND FLOOR PER ORDINANCE 95-17. GROUND FLOOR ADDITION IN REA","0","0",,,"0",,,"0",,,"0",,,"0",,,"0",,"0",,,"0",,,,,,,,"15 - Outer Sunset","4","Parkside","Sunset/Parkside",,"RH-1","40-X","Sunset Corridors PDA",,"37.74191426","-122.4903298","2019","Q3","2019_Q3","POINT (-122.4903298 37.74191426)","40","40","10","7","35"
"Resident","0331001","229 ELLIS","1","PL APPROVED","2018-05-22T00:00:00.000","52","52",,"0",,,,"2016-007593PRJ","The proposed project (?Project?) would involve the rehabilitation of a vacant, mixed-use historic
building. The alterations include facade alterations, excavation, interior alterations, and a one-story
vertical addition to the existing 4-story-over-basement building, resulting in a 5-story-over basement
building reaching a finished roof height of 55?-1? (up to 73?-8? for the elevator penthouse). The vacant
building previously contained approximately 17,400 square feet of uses, including Residential Use (five
Dwelling Units) on the upper floors, unauthorized Office Uses within the middle floors, and a former
bathhouse (Personal Service Use) (d.b.a. ?Burns Hammam? and ?San Francisco Turkish Baths?) on the
lower floors. The Project would include a change of use, converting non-residential uses into residential
uses, resulting in approximately 27,500 gross square feet of Group Housing (a Residential Use), for a total
of 55 Group Housing rooms. The Project would provide 850 square feet of common useable open space
via a roof deck, in addition to several common and private open spaces on the lower floors of the
building. The Project would also provide 38 Class 1 and 4 Class 2 bicycle parking spaces, with no offstreet
vehicular parking provided. The proposed Project also requires a Rear Yard Modification,
pursuant to Planning Code Sections 134(g) and 249.5.",,"0","-12400",,,,,,,,,,,,,"12400","0","-12400",,"0",,,"0",,,,"NFOSTER","Frank Chiu","Frank Chiu","2243929286","4 - Downtown","6","Downtown/Civic Center","Tenderloin",,"RC-4","80-T-130-T","Downtown/Van Ness/Northeast Neighborhoods PDA","North of Market Residential 1; Fringe Financial Services RUD","37.78511682","-122.4097269","2019","Q3","2019_Q3","POINT (-122.4097269 37.78511682)","20","20","5","10","36"
"Medical","8724001","MISSION BAY BLOCK 36","1","CONSTRUCTION",,,,,,,,,,,,"170600","170600",,"170600","170600",,,,,,,,,,,,,,,,,,,,,,,,,"9 - South of Market","6","Potrero Hill","Potrero Hill","Mission Bay","MB-RA","MB-RA","Mission Bay PDA",,"37.76590849","-122.3901431","2019","Q3","2019_Q3","POINT (-122.3901431 37.76590849)","34","34","1","10","26"
"Resident","5696036","992 PERALTA AV","0","BP FILED","2016-07-11T00:00:00.000","50","50","8","8",,,,"2012.1139","The proposed project is to demolish and existing 10,675 square foot industrial building and construct a four-story, 50 unit residential building with 50 off-street parking spaces as the replacement structure. The 40,565 square foot subject lot is bound by Tompkins Avenue to the south, Peralta Avenue to the east and Bradford to the west. The lot slopes laterally along Tompkins Avenue, decreasing in elevation toward the east. The lot also slopes laterally along Peralta Avenue, increasing in elevation toward the north.  The lot is up-sloping as the north end of the property is approximately 55 to 70 feet higher in grade than much of the south portion. The proposed buildingwould front Tompkins Avenue. The project is located withing the Bernal Heights neighobrhood near Alemany Boulevard and Highway 101.","CONSTRUCT (N) 5-STORY, 49 DWELLING UNIT RESIDENTIAL CONDOMINIUM","0","0","0",,,"0",,,"0",,,"0",,,"0",,,,,"0",,,,,,"KDURANDE","CENTERSTO","C. STEVEN","415-550-6","11 - Bernal Heights","9","Bernal Heights","Bernal Heights",,"NC-S","40-X","Bayview/Southeast Neighborhoods PDA",,"37.73731595","-122.4094004","2019","Q3","2019_Q3","POINT (-122.4094004 37.73731595)","83","83","9","2","2"
"Resident","4971006","922 JAMESTOWN AV","0","BP Filed","2018-09-14T00:00:00.000","1","1",,"0",,,,,,"TO ERECT A TYPE V-B, 3 STORY SINGLE FAMILY DWELLING WITH ONE BASEMENT.","0","0",,,"0",,,"0",,,"0",,,"0",,,"0",,"0",,,"0",,,,,,,,"10 - South Bayshore","10","Bayview","Bayview Hunters Point","Bayview Hunters Point","RH-1","40-X","Bayview/Southeast Neighborhoods PDA",,"37.7178785","-122.3917707","2019","Q3","2019_Q3","POINT (-122.3917707 37.7178785)","88","88","2","9","1"
"Resident","7029A001","718 GENEVA AV","1","BP APPROVED","2019-10-24T10:31:01.000","2","1",,"0",,,,,,"UNIT LEGALIZATION PER ORDINANCE 43-14 AT 1ST FLR. (TO COMPLY WITH VIOLATION #201796701.)","0","0",,,"0",,,"0",,,"0",,,"0",,,"0",,"0",,,"0",,,,,,,,"12 - South Central","11","Outer Mission","Outer Mission",,"RH-1","40-X","Balboa Park and Southwest Corridors PDA",,"37.71844364","-122.4434834","2019","Q3","2019_Q3","POINT (-122.4434834 37.71844364)","80","80","9","1","28"
"Vacant","0636037","2455 SACRAMENTO ST","0","BP Filed","2017-12-21T00:00:00.000","0","0",,"0",,,,,,"TO ERECT 4 STORIES,1 BASEMENT, TYPE 5-A COMMERCIAL BLDG (B,M)","0","0",,,"0",,,"0",,,"0",,,"0",,,"0",,"0",,,"0",,,,,,,,"2 - Marina","2","Pacific Heights","Pacific Heights",,"NCD-UPPER FILLMORE","40-X",,,"37.78968035","-122.433603","2019","Q3","2019_Q3","POINT (-122.433603 37.78968035)","102","102","4","6","30"
"Resident","6234024","292 ARLETA AV","0","BP FILED","2015-04-20T00:00:00.000","1","1",,,,,,,,"CONSTRUCT (N) 2-STORY SINGLE FAMILY DWELLING UNIT.","0","0","0",,,"0",,,"0",,,"0",,,"0",,,,"0","0",,,,,,"CLARKECO",,,,"12 - South Central","10","Visitacion Valley","Visitacion Valley",,"RH-1","40-X",,,"37.71463116","-122.408601","2019","Q3","2019_Q3","POINT (-122.408601 37.71463116)","75","75","9","9","40"
"Resident","3730096","34 LANGTON ST","1","CONSTRUCTION","2019-10-15T00:00:00.000","5","5",,,,,,"2014.0681","Demolition of a 630 SF industrial building and construction of a 5-unit 4-story 5,795 SF building with 2 parking spaces.","TO ERECT 4 STORIES, NO BASEMENT, 5 UNITS APARTMENT, TYPE V-A BUILDING.","0","0","0",,,"0",,,"0",,,"0",,,"0",,,,,"0",,,,,,"JSPEIRS",,,,"9 - South of Market","6","South of Market","South of Market","Western SoMa (EN)","RED","40-X","Eastern Neighborhoods PDA","Western SoMa","37.7769453","-122.4094445","2019","Q3","2019_Q3","POINT (-122.4094445 37.7769453)","32","32","1","10","34"
"Vacant","3756001","1201 FOLSOM ST","0","BP Filed","2017-06-05T00:00:00.000",,,,"0",,,,,,"CHANGE OF USE OF(E)3RD & 4TH FL FROM LIGHT MANUFACTURING TO OFFICE USE IN HISTORIC BLDG & BASE BLDG","0","0",,,"0",,,"0",,,"0",,,"0",,,"0",,"0",,,"0",,,,,,,,"9 - South of Market","6","South of Market","South of Market","Western SoMa (EN)","NCT-FOLSOM","65-X","Eastern Neighborhoods PDA","Western SoMa","37.77466759","-122.4100499","2019","Q3","2019_Q3","POINT (-122.4100499 37.77466759)","32","32","1","10","34"
"Resident","4006006","1601 - 1677 MARIPOSA ST / 485 CAROLINA","1","CONSTRUCTION","2019-11-21T00:00:00.000","145","145","60","60","On-site BMR Project","50% AMI;","Rental","2012.1398","The proposed project would involve demolition of an existing 1-story industrial buildings and  bus repair shop and the construction of a new mixed-use project with 316 dwelling-units, 8,823 sf ft. of commercial space, and 261 off-street parking spaces.  The project is also proposing a a mid-block pedestrian mews. The project site is located at the base of Potrero Hill.","TO ERECT 4 STORIES, NO BASEMENT, 145 UNITS RESIDENTIAL & COMMERCIAL BUILDING.
** MAHER: EXEMPTED; SEE APPROVAL LETTER FROM DPH ON THE PLANS **","9555","-65141","0",,,"0",,,"0","0","-8000","0","3962","-62734","0","5593","5593",,"0","0",,,,,,"CTOWNES",,,,"9 - South of Market","10","Potrero Hill","Potrero Hill","Showplace Square/Potrero Hill (EN)","UMU","40-X","Eastern Neighborhoods PDA",,"37.76323624","-122.399761","2019","Q3","2019_Q3","POINT (-122.399761 37.76323624)","54","54","2","9","26"
"Resident","7536010","628 29TH ST","1","BP ISSUED","2016-10-03T10:35:04.000","1","1",,,,,,,,"ERECT A ONE STORY GARAGE & ONE PLAYROOM AT FRONT.","0","0","0",,,"0",,,"0",,,"0",,,"0",,,,,"0",,,,,,"APERRY",,,,"7 - Central","8","Noe Valley","Noe Valley",,"RH-1","40-X",,,"37.74348266","-122.4343185","2019","Q3","2019_Q3","POINT (-122.4343185 37.74348266)","84","84","9","5","22"
"Resident","2347004G","2350 19TH AV","1","CONSTRUCTION","2018-07-16T00:00:00.000","10","10","0","0","Fee Payment",,,"2007.0178","The proposed project would demolish a 300 square foot carport/office shack, subdivide one lot into five new (25'x100') lots, and the construct two units on each lot for a total of ten dwelling units.","TO ERECT 4 STORY, 2 DWELLING UNITS BUILDING.","0","0","0",,,"0",,,"0",,,"0",,,"0",,,,,"0",,,,,,,"San Franc","Chris Fol","577-9885","14 - Inner Sunset","7","Parkside","West of Twin Peaks",,"RH-2","40-X","Sunset Corridors PDA",,"37.74403845","-122.4753681","2019","Q3","2019_Q3","POINT (-122.4753681 37.74403845)","44","44","10","8","41"
"Mixres","6631049","497 29TH ST","1","CONSTRUCTION","2019-06-05T00:00:00.000","4","1",,"0",,,,"2016-013458PRJ","ADD 1 UNIT = STUDIO UNIT WITH KITCHEN & 1 BATHROOM. REMODEL AN (E) UNIT.  Addition of (1) ground floor ADU.  Removal/replacement of existing stairs and deck at rear, per plans.  Interior tenant improvements for existing unit at first floor.  Per CHA #2018-K574763 and NSR #2018-K574762 recorded 02/01/2018","ADD 1 UNIT = STUDIO UNIT WITH KITCHEN & 1 BATHROOM. REMODEL AN (E) UNIT. SOFT STORY APPROVED PER #2016-0822-5608.","648","0",,,"0",,,"0",,,"0",,,"0",,"648","0",,"0",,,"0",,,,"SADINA","Hood Thomas",,"4153852303","7 - Central","8","Noe Valley","Noe Valley",,"RH-2","40-X","J Church and Mission Corridor PDA",,"37.74325264","-122.4308869","2019","Q3","2019_Q3","POINT (-122.4308869 37.74325264)","84","84","9","5","22"
"Retail/Ent","3555018","3140-3150 16TH ST","0","PL FILED","2017-01-31T00:00:00.000",,,,,,,,"2017-001270PRJ","Project includes the rehabilitation and adaptive re-use of a former 20,400 sq. ft. two-story Automotive Repair Use to a new Restaurant Use including interior renovations, installation of new storefront systems, and the construction of a 3,735 sq. ft. rooftop deck, exit stairs, two restrooms, storage room, and two elevator penthouses for a new Outdoor Activity Area.",,"20400","0",,,,,,,,,,,"0","-20400","0","20400","20400",,,,,,,,,"RSUCRE","Reuben, Junius & Rose LLP",,"4155679000","8 - Mission","8","Mission","Mission","Mission (EN); Mission District Streetscape Plan","NCT-VALENCIA","55-X","Eastern Neighborhoods PDA","Mission Alcohol Restrict; Fringe Financial Services RUD","37.76510623","-122.4228911","2019","Q3","2019_Q3","POINT (-122.4228911 37.76510623)","37","37","3","5","20"
"Resident","5684016","3817 FOLSOM ST","0","BP Filed","2018-10-05T00:00:00.000","2","1",,"0",,,,,,"LEGALIZATION OF DWELLING UNIT (1 BEDROOM & 1 BATH) PER ORD# 43-14.","0","0",,,"0",,,"0",,,"0",,,"0",,,"0",,"0",,,"0",,,,,,,,"11 - Bernal Heights","9","Bernal Heights","Bernal Heights",,"RH-1","40-X",,"Bernal Heights","37.73867989","-122.413144","2019","Q3","2019_Q3","POINT (-122.413144 37.73867989)","83","83","9","2","2"
"Resident","3085022","715 MANGELS AV","0","BP Filed","2017-12-11T00:00:00.000","2","1",,"0",,,,,,"TO LEGALIZE GROUND FLR UNIT PER ORD 43-14. TO ADD A 2ND UNIT CONSITING OF KITCHEN, (3) BDRMS AND (2)","0","0",,,"0",,,"0",,,"0",,,"0",,,"0",,"0",,,"0",,,,,,,,"13 - Ingleside","7","West of Twin Peaks","West of Twin Peaks",,"RH-1(D)","40-X",,,"37.7328069","-122.4537244","2019","Q3","2019_Q3","POINT (-122.4537244 37.7328069)","70","70","9","8","41"
"Resident","3483016","4000 19TH ST","1","BP ISSUED","2019-07-15T11:51:00.000","11","3",,,,,,"2018-005797PRJ","Conversion of crawl space to three ADUs at the rear of the basement level per ordinance 162-16 and CHA K76514500 and NSR K77045100. Proposed Excavation not to exceed 46 cubic yards as shown on plans.",,"0","0",,,,,,,,,,,,,,,,,,,,,,,,"MCHANDLE","Wayne Meyer Works",,"4158606223","7 - Central","8","Castro/Upper Market","Castro/Upper Market",,"RH-3","40-X","Market Octavia PDA",,"37.75958948","-122.4329409","2019","Q3","2019_Q3","POINT (-122.4329409 37.75958948)","38","38","3","5","5"
"Resident","0935006B","3130 BRODERICK ST","1","BP ISSUED","2019-07-29T15:04:09.000","9","0",,"0",,,,"2017-013205PRJ","Addition of an accessory dwelling unit to an existing 8 unit building 207(c)(4).","ADD UNIT PER ORDINANCE NO. 162-16 ADU AT 1ST FLOOR, CONVERT OF (E) STORAGE & MECH RM TO HABITABLE SPACE, (N) KITCHEN, BATH, LIVING & 2 BEDRM AT REAR FACADE, (N) DOORS, WINDOWS, REMOVE MASONRY CHIMNEY, ELECT & PLUMB AS REQ'D. NO CHANGE TO BLDG FOOTPRINT.","0","0",,,"0",,,"0",,,"0",,,"0",,,"0",,"0",,,"0",,,,"DWEISSGL","Rodgers Arch.",,"4153099612","2 - Marina","2","Marina","Marina",,"RH-3","40-X","Lombard Street PDA",,"37.79928152","-122.4441871","2019","Q3","2019_Q3","POINT (-122.4441871 37.79928152)","17","17","4","6","13"
"Resident","7084001","195 RALSTON ST","1","BP ISSUED","2019-06-25T10:18:10.000","2","1",,"0",,,,,,"CONVERT PORTION OF REMAINING GARAGE SPACE TO 3RD BEDROOM. (GROUND FLOOR UNIT LEGALIZED UNDER SEPARAT","0","0",,,"0",,,"0",,,"0",,,"0",,,"0",,"0",,,"0",,,,,,,,"13 - Ingleside","11","Ocean View","Oceanview/Merced/Ingleside",,"RH-1","40-X","Balboa Park and Southwest Corridors PDA","Oceanview Large Residence","37.71598748","-122.4691513","2019","Q3","2019_Q3","POINT (-122.4691513 37.71598748)","65","65","10","1","24"
"Resident","4913011","1298 FITZGERALD AV","0","BP FILED","2018-12-21T00:00:00.000","9","9",,,,,,"2014.0969","Subdivision of existing parcel into four code-compliant parcels without modification of existing structure at corner of Jennings Street and Fitzgerald Avenue.","CONSTRUCT 4-STORY, 9 DWELLING UNITS BUILDING.","0","0","0",,,"0",,,"0",,,"0",,,"0",,,,,"0",,,,,,"MCHRISTE",,,,"10 - South Bayshore","10","Bayview","Bayview Hunters Point","Bayview Hunters Point","RM-1","40-X","Bayview/Southeast Neighborhoods PDA","3rd St Alcohol Restrict","37.72212534","-122.3927964","2019","Q3","2019_Q3","POINT (-122.3927964 37.72212534)","88","88","2","9","1"
"Resident","5329011","1948 QUESADA AV","1","CONSTRUCTION","2019-08-07T00:00:00.000","1","1",,,,,,"2016-005032PRJ","Proposed demolition of (E) one-story parking structure and new construction of two three-story, single-family dwelling.","ERECT 3 STORIES OF ONE SINGLE FAMILY.","0","0","0","0","0","0","0","0","0","0","0","0","0","0","0","0","0",,"0","0","0","0",,,,"NKWIATKO",,"YOUNG ANER R",,"10 - South Bayshore","10","Bayview","Bayview Hunters Point","Bayview Hunters Point","RH-1","40-X","Bayview/Southeast Neighborhoods PDA",,"37.73625912","-122.3960627","2019","Q3","2019_Q3","POINT (-122.3960627 37.73625912)","87","87","2","9","1"
