First Name,Last Name,Email Address,Organization,State,Comment,Additional Document
Jade,Freund,islandearth20@gmail.com,Island Earth Group llc.,Oregon ,we are a local water company and hauling,
meyer,goldstein,goldstein.meyer@deq.state.or.us,DEQ,OR,This is a test.,https://data.oregon.gov/views/xgey-arpm/files/5a296f7b-42a8-46c6-b603-f2a447cd661b?filename=C%3A%5CUsers%5Cmgoldst%5CDesktop%5CThis+is+a+test.docx
Sam,Goldstein,sam.goldstein@or.usda.gov,USDA Rural Development,OR,"I can't determine if the file attached was uploaded so I""m also emailing the comments to LeAnn Lawrence.",https://data.oregon.gov/views/xgey-arpm/files/ebdce490-1670-4c04-ad7e-6493cd0f11f9?filename=Public+Comments+related+to+2017+CWSRF+Rulemaking.docx
Susie,Smith,smith@oracwa.org,Oregon Assoc. of Clean Water Agencies,Oregon,Please find attached the Oregon Association of Clean Water Agencies’ (ACWA) comments on the draft changes to the Clean Water State Revolving Fund rules.  Thank you for the opportunity to participate in the advisory committee process and for your consideration of ACWA’s comments.,https://data.oregon.gov/views/xgey-arpm/files/9dd44681-2a32-4822-b8ca-2048511e0e21?filename=ACWA+Comment+Letter+CWSRF+Rule+Making-2017.pdf
Lauren,Smith,laurens@owrc.org,Oregon Water Resources Congress,Oregon,"Attached please find Oregon Water Resources Congress' comments on DEQ's proposed changes to the CWSRF rules. If you have any questions, please do not hesitate to contact our office. ",https://data.oregon.gov/views/xgey-arpm/files/91ee9dc5-adee-4232-acd5-db429e4ef627?filename=OWRC+Comments+on+DEQ+Proposed+Rules+CWSRF+August+25+2017.final.pdf
